work_order_id,assigned_vendor,assigned_at,completed_at,description,estimated_start_date,estimated_end_date,current_status,comments,location,estimated_cost,estimated_duration,priority,well_id,created_at,updated_at,created_by,updated_by
8ae87920-86aa-464d-9e2a-1cdb8b1746d5,01788852-2904-489e-8f04-bb0c9a204f53,2025-11-24T16:21:41,,"Wear to week together fill your. Rule also career rich opportunity example service.
Also trial book world. Since bed point without case game reach.",2025-11-27T02:20:48,2025-12-11T02:20:48,unassigned,"Play figure whatever three.
Sometimes indicate anyone whose. Stop challenge American like.",West Ryan,18876.53,"13 days, 0:00:00",urgent,17941284-a857-4947-9263-fe63bfd59d7c,2025-11-14T07:37:22,2026-04-07T18:12:43.688481,e64cb421-ed5d-4c06-8305-2c60709e758a,7482a920-6eb0-493e-9dde-5f957e316591
af692e4f-67d4-432a-883c-ef6777d7d06e,1183ff2b-4d45-4bb5-b674-7441c73903cc,2024-07-14T19:22:56,,"Work news answer style. Culture tree religious country material the various. Picture point take agent your. Factor south foreign few budget.
Special week age institution American realize.",2024-07-22T08:38:46,2024-08-05T08:38:46,unassigned,Close two throughout about stock.,Woodmouth,46092.92,"14 days, 0:00:00",urgent,b71ac294-8468-4261-b7ba-555387b0a3e0,2024-07-05T21:44:31,2026-04-07T18:12:43.688664,ffcfe4a5-2b2d-4a31-9e5c-569277e48232,e3e5572b-87ba-4a8e-9c88-3e46ebdb6dd9
4169db7a-0031-43b9-92fd-692e0fdffa73,393b03aa-8e0e-4af1-a284-946ca7e0b61c,2026-02-03T01:32:22,,"Send very rest yard per myself. Try member very gun. Appear where it citizen data great. Tough debate education because.
Class research during line herself hour vote.",2026-02-09T05:47:40,2026-02-24T05:47:40,in progress,Kid provide sing represent. Role wait behavior likely face health compare chance.,West Daniellestad,20420.24,"4 days, 0:00:00",emergency,f9c6a065-6416-44bb-8d89-191aed28b4b9,2026-02-02T02:33:11,2026-04-07T18:12:43.688867,0a2b38c2-5cc3-4a6c-8e5c-2664eaf62eeb,de43ff56-b7f2-4083-b5b3-d8ef2b6a35fa
fd279fad-2bac-4a5d-b167-1b2a8cf66790,1885aabf-2070-43a3-8f8d-71e67ae9409f,2025-04-28T23:15:36,,"Series hair far year new true. Team even drive suggest future. Ten final site start.
Realize successful hear expert. Television authority natural hope what front how here.",2025-05-12T16:48:42,2025-05-21T16:48:42,unassigned,Arm where family glass state. Especially wonder cover get.,Davidfort,21314.44,"21 days, 0:00:00",urgent,c827aaf3-39b3-4991-b410-f2b4c5c5d05a,2025-04-19T13:26:10,2026-04-07T18:12:43.689050,e9e43849-857f-4a89-b324-3e585e1b5f59,1ae7030c-8199-4969-8970-ae5712c173a6
31c77b3a-527c-42ce-8e4e-5f98d4250d9a,0fd09b32-d37a-4f44-ab04-a4366606e6c9,2025-07-28T17:45:53,,Senior do listen hold member evening return. Evening approach necessary range continue fine travel. Management same view actually effect. Bit bit young end to case.,2025-08-03T05:09:02,2025-08-17T05:09:02,unassigned,Central government wind boy increase wear then. Scientist allow cultural.,Port Kelly,6658.91,"5 days, 0:00:00",emergency,af04bae8-99c0-4bb7-89ef-d29b27e1d65f,2025-07-27T10:17:39,2026-04-07T18:12:43.689200,d7e64bc6-0691-4905-be96-9aabd0fdf27a,4454b5bf-b4dc-4feb-8e02-8e74e28f6914
d73fc0a0-f802-4d43-85e0-eaf589b0eaff,b0f3789f-11b3-4e6d-8205-dcb3381ef2ba,2024-09-30T11:18:43,,"Order bad contain page politics response worry. Stuff she already actually fight. Yourself computer behind discover major.
Yard voice weight put million as should. Before save reveal nearly.",2024-10-03T15:48:50,2024-11-02T15:48:50,in progress,"Here from care worry protect like.
Month inside tough. Also better young onto on.",Mariafurt,20955.43,"15 days, 0:00:00",routine,ae2b4f3a-8d15-43a4-a5a5-0dc6cab6ca7a,2024-09-24T22:15:34,2026-04-07T18:12:43.689414,e4ca89d5-e411-4422-b6d1-d6be515cf9a0,771248a6-11d7-4a81-810d-dc2921699dea
d75577e0-710d-4f0b-83bc-065c10a4b876,01788852-2904-489e-8f04-bb0c9a204f53,2025-01-28T21:19:27,,"Anything east despite street reduce fire wrong. Range various add her fill possible go.
Reduce plant level world important never. Nearly become chair white development.",2025-01-29T09:41:43,2025-02-17T09:41:43,in progress,American class week from student. Start blue concern mention. There impact visit social play go.,Justinstad,19132.32,"17 days, 0:00:00",emergency,77ccf46f-0b0a-4827-9500-b896c2b7f37d,2025-01-23T07:48:06,2026-04-07T18:12:43.689630,f30834ff-ccff-4479-bdb7-3cb27ee20209,906625e6-4e26-4754-aa48-664efa67c115
06117ad9-4784-4d8c-b5ee-831349abee0b,1183ff2b-4d45-4bb5-b674-7441c73903cc,2025-08-21T19:42:07,,"Quality road difficult knowledge often almost. View activity marriage sit old hard moment.
Activity us somebody behind source news. Up impact exactly spend general trial.",2025-08-22T17:10:32,2025-09-12T17:10:32,unassigned,"Into employee service painting.
Education dog ground attorney. Hope show establish simply.",Smithhaven,6842.8,"7 days, 0:00:00",routine,69b70b28-f8e5-4a33-8b15-45fc9ee2cbbf,2025-08-10T08:36:52,2026-04-07T18:12:43.689826,0bfb4697-cddb-4c7c-924e-659d578705b7,7f4f78d1-332f-4147-8e5e-f55dc6eef128
e911a13f-9cef-4cac-8fd1-fe40aa3c50e1,393b03aa-8e0e-4af1-a284-946ca7e0b61c,2024-09-12T13:37:34,,"Painting so media. Modern probably guy. Production serious half cause test.
Mother degree sister hit buy board finish analysis.",2024-09-16T01:10:18,2024-09-25T01:10:18,in progress,Tell page least until. Skill artist drive happen old.,Aaronmouth,27936.37,"27 days, 0:00:00",urgent,96af6f3f-c904-4575-8c78-0644312a5cc7,2024-09-11T09:15:12,2026-04-07T18:12:43.689998,8cff91be-86b8-4f06-98ec-09cae8e0a6ba,28c5c1dc-0225-4d2c-9c2f-b7ad79452b23
b00dbad9-7208-44c2-b8d7-c832077b5e64,0fd09b32-d37a-4f44-ab04-a4366606e6c9,2025-02-21T09:55:05,,"Make ready provide of. Since should person visit or federal theory teacher.
Hundred chair top follow agreement opportunity. Probably close want about here vote property.",2025-03-02T12:27:43,2025-03-27T12:27:43,unassigned,Agency threat half per within. Truth knowledge across indicate great middle follow finally.,Ritaview,44181.11,"28 days, 0:00:00",routine,0d09eac5-3ddc-41fc-bb29-996accb4edce,2025-02-11T09:52:26,2026-04-07T18:12:43.690154,9b1a2433-136e-4f3f-bc30-ecb0bfd6eed7,679c7a68-e4e5-4ae5-a770-68182a921c6b
841427ed-cdf0-4069-beb2-026a0e8b2bbe,1b193ccd-19a1-4d90-802b-c54dafe33648,2025-02-28T03:02:12,,"Fly sort be ball such. Ability central rise may their.
This mean computer hotel man nation may. Kid science seek.",2025-03-13T09:11:16,2025-04-11T09:11:16,assigned,Guess expert author billion more. Newspaper environmental stage decide.,Dominguezland,28926.49,"24 days, 0:00:00",routine,38f94a6c-908f-4bbe-bd80-559fc50b6e37,2025-02-22T00:38:04,2026-04-07T18:12:43.690333,8c69ed68-67ff-428b-b78d-cffbc7c14469,37bab68a-9df9-4445-97f9-ba562db928e7
7f55973d-748d-4927-abd1-e0aef96d59c5,1b193ccd-19a1-4d90-802b-c54dafe33648,2026-01-06T03:35:17,,Key safe last instead difference hot scientist. Small office toward lawyer.,2026-01-16T20:35:57,2026-01-22T20:35:57,in progress,First eight whether before off kitchen note. Nearly strategy final theory.,Lake Peter,10548.38,"14 days, 0:00:00",routine,70db585e-7da4-42d7-8a52-378d70101594,2025-12-31T22:03:31,2026-04-07T18:12:43.690476,c285773a-9de9-4e4f-9bb5-5f0a5f860112,33a4f85d-1a42-4c1f-b802-8aeb661aa6d3
60fa40a0-1202-449f-9db3-763c47d0db0c,1885aabf-2070-43a3-8f8d-71e67ae9409f,2024-05-06T03:23:30,,"Chance there different generation get occur into civil.
Fine senior maybe your meeting. Smile position tonight kid town at.
Good like agency cut couple. Take than contain ok see bed.",2024-05-18T04:23:01,2024-05-31T04:23:01,in progress,"Put chair difference. Reach society born serious anyone.
Student article morning improve over.",Lake Jennifer,22508.39,"2 days, 0:00:00",urgent,c827aaf3-39b3-4991-b410-f2b4c5c5d05a,2024-05-03T04:57:23,2026-04-07T18:12:43.690637,d1f4bba2-7d31-4370-8e0e-4b6a93fec6f0,33bae35d-8786-4add-9af7-a526c36bd499
f603ce4a-06a3-4336-9e2a-8bc4264643d8,0fd09b32-d37a-4f44-ab04-a4366606e6c9,2024-07-03T12:54:15,,Environmental indicate themselves health success service trouble. Staff owner million give dinner.,2024-07-12T03:24:36,2024-07-21T03:24:36,unassigned,Do thousand agree best. Force style offer get. Student kitchen health responsibility.,Washingtonhaven,1792.67,"3 days, 0:00:00",urgent,0d09eac5-3ddc-41fc-bb29-996accb4edce,2024-06-28T01:31:52,2026-04-07T18:12:43.690825,94554c66-e5da-4005-8300-505f66eb0967,7535a591-cb1a-4eb4-89cd-8e6e2df5bdc9
7e951a6a-036b-4712-80e7-16b657b1ad62,0fd09b32-d37a-4f44-ab04-a4366606e6c9,2024-05-19T15:17:40,,"Law social entire start this. Expect including late hotel all reduce.
Reflect again north movie research six add. Serve strategy general figure.",2024-05-31T06:20:31,2024-06-16T06:20:31,in progress,"Enter dream six site.
Over position tell sign son know.",East Erin,43663.88,"4 days, 0:00:00",routine,8ccbeeea-7836-45ae-bfa9-a2f4b7a10bd4,2024-05-17T13:55:13,2026-04-07T18:12:43.690982,cdc91757-7e35-4f7c-aee4-eb567b732bc3,a12b9d7d-8c17-4856-8910-c2fc346e25b5
86085eb1-34a6-4da5-b93f-1e9b310ac010,a0da5163-88a0-42a9-b2ef-6fd8f4f914c4,2024-06-26T23:46:01,,"Work choice goal its every say get. Machine have power yard us word foot.
Hit PM world reality. Build thing interview yet lawyer.
Week board pressure federal dark girl. Marriage event training take.",2024-07-03T19:35:41,2024-07-13T19:35:41,assigned,Sell view cup suddenly medical think. Season rate change common. Reality add use personal manager.,North Jeffrey,33355.44,"14 days, 0:00:00",urgent,ffe072bd-1efe-430f-8b5c-9559479b12c2,2024-06-21T11:31:37,2026-04-07T18:12:43.691140,e0133184-731c-4748-a743-90bfe91fb78e,012f29e7-277a-44e6-82f6-a2b3665f08f1
cd252d01-cba7-4733-9bc2-356acca46e5d,1b193ccd-19a1-4d90-802b-c54dafe33648,2025-10-27T08:06:23,,Wind sound film skin note. Reason center sell majority behavior suffer. Develop across no number discover certain view.,2025-10-29T02:32:44,2025-11-06T02:32:44,in progress,Maintain within themselves turn. Five what edge however serve.,Rasmussenhaven,27812.56,"4 days, 0:00:00",emergency,e76cf210-451d-4144-b4f4-a70e6ce65606,2025-10-19T02:19:18,2026-04-07T18:12:43.691330,14fdce8f-43f3-4529-ab59-4c6b170033d1,144e9eba-6e51-4373-85e0-a607ac111cfb
ad8f0d12-d2d9-414c-b188-ac78ed335645,b0f3789f-11b3-4e6d-8205-dcb3381ef2ba,2025-08-19T04:35:35,,"Citizen administration director trade seek memory. Old just expect care. Bring memory service among billion.
Sea already cause reality doctor.",2025-08-31T12:04:20,2025-09-19T12:04:20,unassigned,A agent on show federal much. Response radio where message push chair future public.,Port Arianamouth,3633.34,"17 days, 0:00:00",routine,ae2b4f3a-8d15-43a4-a5a5-0dc6cab6ca7a,2025-08-11T22:05:18,2026-04-07T18:12:43.691474,e9020349-7dac-4fed-818e-8fdc94008f57,52c0c456-b4ff-4a05-a1c7-d79f24667ce6
3503ff7c-1e0f-4266-83df-3307043e6716,1b193ccd-19a1-4d90-802b-c54dafe33648,2025-08-23T20:24:22,2025-09-29T22:09:55,"Still Mr imagine statement. Black answer reality local figure somebody common. Resource son rule position.
Page avoid spend exist rule.",2025-08-24T08:40:06,2025-09-15T08:40:06,completed,Attack tonight none give. Scientist what story cold job.,Lewisside,15750.31,"23 days, 0:00:00",emergency,c05ac704-a0ac-4e03-b0a8-e06aa01c4b9e,2025-08-11T00:41:47,2026-04-07T18:12:43.691643,0803f797-edf1-44c8-b82b-cac38df644d6,3802dc87-1604-4abf-ab56-f4562c4b3e0f
de188752-30c5-4738-9fdb-0638fe591464,a0da5163-88a0-42a9-b2ef-6fd8f4f914c4,2025-09-27T07:08:30,,"Quite tonight see born. Such close rich collection suffer.
Partner and compare. Wall it ask generation field good provide.",2025-10-02T15:46:20,2025-10-07T15:46:20,unassigned,Compare scene factor. Subject sign catch source.,Lewisstad,1805.49,"29 days, 0:00:00",urgent,4d5f9e80-4c35-4f56-9189-53a3b857d5d0,2025-09-26T03:55:48,2026-04-07T18:12:43.691796,3bb27a6a-87f6-4355-b58e-b753c19118ef,46ded435-4b1d-4271-a66e-d1818809ed70
f3951bba-21a7-4667-8801-8000d2ad23a6,0fd09b32-d37a-4f44-ab04-a4366606e6c9,2024-12-11T18:36:01,2025-02-04T12:59:11,"Foreign live final. Year wrong claim child institution speak effort. Little force onto audience car participant.
Television player garden dark. International price eye room future body.",2024-12-17T07:40:49,2025-01-09T07:40:49,completed,Man road south cultural understand. Me resource newspaper another.,Lake Josephport,39594.47,"17 days, 0:00:00",emergency,8ccbeeea-7836-45ae-bfa9-a2f4b7a10bd4,2024-12-07T13:03:35,2026-04-07T18:12:43.691948,429bd094-30fa-4b36-a987-f5e8490dc579,719da42a-1bad-47ee-882b-31c1ff45ec7c
540f74c8-6081-4714-a263-dc671c4c7367,a0da5163-88a0-42a9-b2ef-6fd8f4f914c4,2024-11-26T19:02:14,,Behind raise next owner successful share. Note anyone join fine operation. Easy often sort possible. Decade factor fall and situation speech former.,2024-12-02T21:47:11,2024-12-19T21:47:11,in progress,Six within class strong across imagine see. Prepare left me beautiful thought.,New Daniel,32398.38,"4 days, 0:00:00",routine,688e356a-ed62-42a7-9119-398fde5d343a,2024-11-16T20:14:37,2026-04-07T18:12:43.692099,0159775f-1701-4e6e-b35f-673ec39e3022,e0133184-731c-4748-a743-90bfe91fb78e
a4beb720-b002-4887-8af6-b4c0d215cdb9,0fd09b32-d37a-4f44-ab04-a4366606e6c9,2024-10-25T17:19:40,,"Human son interest own box after.
Listen past truth each heavy hit treatment. Side third feel design should truth.",2024-10-29T00:08:01,2024-11-05T00:08:01,unassigned,Worker report dog top really head student leg. Our here in director.,Lake Jamesberg,20367.41,"13 days, 0:00:00",routine,8ccbeeea-7836-45ae-bfa9-a2f4b7a10bd4,2024-10-19T23:27:48,2026-04-07T18:12:43.692242,db17637c-f6d9-4872-be96-731e3df37ea2,a9d401f8-e31a-477d-8280-164fad0cc525
180c3125-02a4-4ad8-a973-bc0613ffc49e,0fd09b32-d37a-4f44-ab04-a4366606e6c9,2025-03-24T23:33:36,,Power could should usually on serious personal. Type about will decade figure sometimes vote east. Poor church cell though mission word whom.,2025-03-25T00:06:18,2025-04-01T00:06:18,in progress,Water plan prevent health who eat child. Player movie bag paper doctor debate.,Alyssaville,44309.75,"8 days, 0:00:00",urgent,84504bc3-0b9d-40ca-824e-4b9168bd1c76,2025-03-21T23:07:15,2026-04-07T18:12:43.692394,a0134807-e371-4430-9b52-09ebb46f69ab,b7786796-cd80-4eb3-96fa-2ac081ec6902
3ee97caa-0f5d-418d-9397-6db0ba9b92f7,0fd09b32-d37a-4f44-ab04-a4366606e6c9,2024-10-22T11:24:44,,"Return experience fill. Source fill game.
Much space hand about identify society heart. Black soldier size quickly tonight play. How property piece ball usually tend.",2024-10-31T06:17:04,2024-11-14T06:17:04,assigned,Side help remain drop. Dinner number safe ask thought crime. Pass experience decide nor evening.,New Loriborough,45401.06,"20 days, 0:00:00",emergency,8ccbeeea-7836-45ae-bfa9-a2f4b7a10bd4,2024-10-09T04:00:20,2026-04-07T18:12:43.692587,fe97225d-58b9-4015-94d2-7e20bc89faa1,0fac9741-d6a9-4cc0-8432-fbc4975c0d56
986e755c-6367-41eb-a9a0-6a86e4039c95,393b03aa-8e0e-4af1-a284-946ca7e0b61c,2025-04-09T06:22:40,,Enjoy relate mouth evidence teach accept. Popular success again here cup subject early common. Prevent few training.,2025-04-23T05:42:29,2025-05-01T05:42:29,assigned,Despite former yeah organization. Pm require most source.,Bishopville,22182.72,"30 days, 0:00:00",emergency,4d5f9e80-4c35-4f56-9189-53a3b857d5d0,2025-04-06T10:40:39,2026-04-07T18:12:43.692763,e5179414-4361-441f-b715-ad699274ec10,c54ff0be-34c7-4684-bc83-364772459a80
0bfa37a5-8463-423a-a2ac-a3d9a1677bcf,69671a86-729f-4257-a953-c3099d1a5bf1,2025-12-11T18:35:22,,Large actually word place position particular four. Debate list research line.,2025-12-18T00:21:58,2025-12-19T00:21:58,assigned,Material age sister meeting. Short yes technology fire could eight.,Edwinhaven,35540.83,"9 days, 0:00:00",routine,dba07dea-2fef-48d6-8da4-18c9bf395426,2025-12-09T05:55:08,2026-04-07T18:12:43.692907,7c2cde9e-919d-4409-a1b1-2c8bd6298d47,1a55580f-e3c0-4cd8-b302-2cc29527f85d
b2f0de4d-5e4b-41e3-b2b7-6963836df426,69671a86-729f-4257-a953-c3099d1a5bf1,2024-07-18T14:42:44,,"Cut thing hear across activity up decision. Hear could air see left husband usually.
Top environmental boy. Real commercial near make.",2024-07-21T08:51:01,2024-07-31T08:51:01,in progress,Enjoy list enjoy last first. Carry food their surface. Sit some down interview agree important.,Singhville,35433.75,"14 days, 0:00:00",urgent,ee0af0c8-bb94-4a92-a50a-33702a2938e7,2024-07-08T11:49:22,2026-04-07T18:12:43.693066,a0e80479-a837-49b6-b4ee-22f1d37cbd75,b9b5975f-979a-4806-891e-fe8367200d13
94a3b2ba-25a7-454a-a53c-fc08b4db60b9,1b193ccd-19a1-4d90-802b-c54dafe33648,2024-10-03T10:36:09,2024-11-10T00:51:48,Peace see business base fund. Go always firm but skin enjoy force. Put health cost truth issue but out.,2024-10-16T11:08:15,2024-10-21T11:08:15,completed,Identify air which often hold foot. Least again fact officer several. With be truth fund air.,East Victoriaborough,21412.87,"14 days, 0:00:00",urgent,f539b85d-0912-49e5-ae16-baabd6eeb761,2024-09-27T01:01:49,2026-04-07T18:12:43.693240,82efd2aa-fb32-4367-a640-554d79bf86e9,0777c28b-ada4-441c-ab06-b4f98741662b
697e0942-ea96-49ee-901d-bb2a1b47be60,2c8d1ddb-8c56-4e93-bd93-d4aaf06847fc,2025-12-20T07:58:05,,"Street culture street director. Nation test true by they loss either. Owner player collection perhaps talk.
Event important that. Run future state measure left.",2025-12-26T10:37:24,2026-01-11T10:37:24,assigned,Mrs character bank ahead art rest particular. Never term everybody.,Shawnshire,5164.94,"27 days, 0:00:00",emergency,a0f36930-7b0e-49ee-b38f-22cf1faf6ba3,2025-12-12T02:28:02,2026-04-07T18:12:43.693407,9be46dd7-156c-4cae-9c47-8cbb0f0bde9d,54b18e61-3e18-4863-b948-c0b875efb453
2d808a8a-5ebe-4a0e-9088-c595969b3deb,393b03aa-8e0e-4af1-a284-946ca7e0b61c,2025-08-24T03:38:01,,"Win expert give better. Article go help wrong example. Race light ago air serious necessary.
Student perform training physical. Development arm view knowledge less us less.",2025-09-01T16:32:00,2025-09-29T16:32:00,unassigned,Close hot people. Store however owner city.,Tuckerchester,10305.1,"23 days, 0:00:00",routine,f9c6a065-6416-44bb-8d89-191aed28b4b9,2025-08-10T08:21:23,2026-04-07T18:12:43.693604,2697f30a-e7b4-45dc-b7ab-b6b24f925768,66f1ae5c-81fb-40aa-abdb-7a6aba464cdf
5936571e-3db1-4586-9deb-ff49e2563ca7,a0da5163-88a0-42a9-b2ef-6fd8f4f914c4,2026-02-02T18:16:52,,"And important teach kid. Class art his. Family far evidence week.
Space play act future suggest. Style voice imagine down. Control perform send art author.",2026-02-03T01:18:57,2026-02-15T01:18:57,unassigned,Join field nice husband image stock difficult season. Bed within tough. Health sea fight meet wear.,Troyport,29603.35,"10 days, 0:00:00",urgent,7bda854b-e7dd-4452-96bd-6274f049f7e1,2026-01-21T07:30:57,2026-04-07T18:12:43.693821,54b18e61-3e18-4863-b948-c0b875efb453,ef0fa9af-4946-4413-b4c5-6fa1868e22a1
b6f4d7ff-3def-49e6-9044-3addfe7ff5b2,2c8d1ddb-8c56-4e93-bd93-d4aaf06847fc,2026-01-11T01:23:51,,Likely adult friend table vote bit throughout clearly. Scene medical why accept how total evening more. Late start compare top decision leader democratic.,2026-01-20T18:10:54,2026-01-25T18:10:54,assigned,Song rise catch six. According itself those agree.,Wigginsview,38150.69,"12 days, 0:00:00",routine,84504bc3-0b9d-40ca-824e-4b9168bd1c76,2026-01-05T10:57:00,2026-04-07T18:12:43.694002,0159775f-1701-4e6e-b35f-673ec39e3022,9a552a57-d336-4331-9c31-badcbfec7e2c
177f6068-83ad-490e-88aa-ea26dab9cd3a,01788852-2904-489e-8f04-bb0c9a204f53,2024-09-16T07:58:22,,"High from investment phone trip school hair able. Expert civil figure Democrat why suffer.
Professor data subject Democrat player. Figure door card employee my.",2024-09-20T11:09:23,2024-10-07T11:09:23,unassigned,"Anything view you power. Watch film author course.
Blue in vote without onto about PM.",Mejiahaven,32485.09,"27 days, 0:00:00",emergency,b9abee31-271d-48c6-91ea-09e3bb02d93b,2024-09-14T23:15:18,2026-04-07T18:12:43.694225,a12b9d7d-8c17-4856-8910-c2fc346e25b5,627de795-ae94-45e3-842d-8eb7ef5dd83a
92529a7b-5b68-433e-bf04-ce33335307f2,a0da5163-88a0-42a9-b2ef-6fd8f4f914c4,2025-02-27T22:15:42,,"People become near increase. Provide power bill at successful. About past reveal degree interest reality million follow.
Ten approach serious long put issue only.",2025-03-07T04:20:34,2025-04-04T04:20:34,assigned,Dream visit treatment look fire hold.,Port Deanna,36407.42,"3 days, 0:00:00",urgent,67b8928d-0e26-4400-b275-a44b4be5f63f,2025-02-15T19:25:46,2026-04-07T18:12:43.694409,c7832738-ec2f-4309-a59b-b0510d9f3f24,d26a8b4b-6c6c-41e5-990f-801527ebd8ca
714892ea-58df-4ede-b2d5-f2c1c1d1a624,69671a86-729f-4257-a953-c3099d1a5bf1,2024-10-01T16:30:01,,"Remain consumer consumer stage. Type avoid happen up us. Second name between group during.
Woman news explain. Past together let upon. Suddenly law enough law clearly.",2024-10-11T23:25:07,2024-10-15T23:25:07,in progress,Month president run hot. President stop sea. Two miss between office fire.,Port Matthewtown,46595.39,"29 days, 0:00:00",emergency,dba07dea-2fef-48d6-8da4-18c9bf395426,2024-09-29T09:26:54,2026-04-07T18:12:43.694607,2573dc7a-8ba3-49c7-86c4-c3552bdfbf9e,45411961-c2f8-4474-9516-065687888875
158271cd-ab22-41c0-a62c-617241a962b3,0fd09b32-d37a-4f44-ab04-a4366606e6c9,2025-12-13T13:54:36,,"Without unit put baby music color job check. Blood begin discover so close. Free wrong strong without answer huge.
Involve direction both. Direction team serious.",2025-12-20T03:45:51,2026-01-12T03:45:51,unassigned,Human expect fear change hundred state focus. Pay along learn chair catch so.,South Kim,14523.74,"3 days, 0:00:00",emergency,17941284-a857-4947-9263-fe63bfd59d7c,2025-12-03T06:48:51,2026-04-07T18:12:43.694756,32596b3c-b469-4d36-be43-1c46ada5d363,f30834ff-ccff-4479-bdb7-3cb27ee20209
98f2fcb0-afdc-442c-8f54-215aa60db4ea,a0da5163-88a0-42a9-b2ef-6fd8f4f914c4,2024-07-28T04:04:57,,"Suffer PM north mission by.
Collection need sometimes agency.",2024-08-03T04:47:04,2024-08-12T04:47:04,in progress,Discover article term appear see. Miss score reduce phone behavior.,Tiffanyside,18136.64,"11 days, 0:00:00",routine,67b8928d-0e26-4400-b275-a44b4be5f63f,2024-07-27T13:31:41,2026-04-07T18:12:43.694902,c7c7533a-3b39-424b-b58b-720d57343360,7f0f84b9-e29b-4d5c-befe-4983a427bc29
40d862a0-b936-498f-8fd3-3efd8ea99374,393b03aa-8e0e-4af1-a284-946ca7e0b61c,2025-11-01T13:39:09,,"Second left guess.
Walk sell high adult affect conference have. Son enjoy mission.
Organization turn accept small see himself important road. Method very stock I plant third brother.",2025-11-07T04:02:44,2025-11-14T04:02:44,assigned,Important reason similar push. Different dream environment leg difference example food.,West Angelica,35542.08,"17 days, 0:00:00",emergency,941e3251-200d-4be4-b559-e5e95ff99e27,2025-10-26T17:39:57,2026-04-07T18:12:43.695069,224d4007-e48a-4a21-b3f6-5ba6d814a914,05f0847a-0813-45b3-bc47-3796fa9e0b71
acc143a7-5dba-4245-839e-78b380ebd154,69671a86-729f-4257-a953-c3099d1a5bf1,2024-06-11T16:52:22,,"Best them strategy suggest deal painting require. Ok return room total truth staff.
Station itself our focus. Race young key machine see. Follow bill raise point not describe air fill.",2024-06-25T15:34:07,2024-07-08T15:34:07,assigned,Both law lot away move. Interesting audience work stay. When yourself eight myself plan.,Port Raymondview,16322.96,"19 days, 0:00:00",routine,c02b8fdc-cb42-431e-814a-dbb7439b41a2,2024-06-10T12:27:49,2026-04-07T18:12:43.695282,dc8c4e25-1686-4ec5-801d-97af24c02908,a94a5e43-0ef8-44f0-8fbc-8a368cd8cc91
22d14e1f-d7be-4f95-8053-626db8beec2d,1183ff2b-4d45-4bb5-b674-7441c73903cc,2025-11-27T00:01:01,,Bank safe ahead president may chair method. Mention site sort get determine serve paper get. Doctor happen special level professor mission.,2025-12-01T17:00:46,2025-12-04T17:00:46,in progress,Security strong along television. Speech product couple Congress.,East Matthewhaven,38927.44,"20 days, 0:00:00",routine,ff7bd950-a908-4140-a347-d5f256e7c93c,2025-11-16T14:30:43,2026-04-07T18:12:43.695450,2d0cbf7f-2660-48d1-8e00-a5716dabd128,144e9eba-6e51-4373-85e0-a607ac111cfb
899da3ae-78fe-47ae-ac41-accc01584f71,1b193ccd-19a1-4d90-802b-c54dafe33648,2024-05-17T22:45:14,,"Food various thing direction nothing. Positive fill both appear yard every. Development administration PM.
Term mother game range everything receive finish poor. Happen radio really exactly.",2024-05-22T13:29:09,2024-06-10T13:29:09,in progress,Get west material laugh. Worker from represent finally. Image half one store throw.,Vangstad,13240.89,"20 days, 0:00:00",routine,c05ac704-a0ac-4e03-b0a8-e06aa01c4b9e,2024-05-10T16:56:28,2026-04-07T18:12:43.695659,17bc4746-d13f-411f-941a-04e764b2f86e,d7589d31-31b4-422e-ad3e-7ad87efb2c28
c921d182-7437-42bb-9ee6-7ccaaa381969,1183ff2b-4d45-4bb5-b674-7441c73903cc,2025-01-30T06:01:40,,"Material more seat sell apply party. National necessary available enough car thousand.
Unit reality should. Federal stand not yet himself religious it.",2025-02-12T20:45:59,2025-03-04T20:45:59,in progress,Week partner recent. Mention the important think.,Lake Jasonberg,22796.34,"24 days, 0:00:00",emergency,574ef814-9815-424b-be6f-7af4027e2b03,2025-01-17T20:16:22,2026-04-07T18:12:43.695805,ac5e3a1f-1848-4fe0-8431-a5bb19c4154b,9db0c5a3-3c90-4773-8720-73b297949319
4930a4ab-d095-4908-a6ba-324845cbc5dc,393b03aa-8e0e-4af1-a284-946ca7e0b61c,2024-12-17T20:32:33,,"Administration end situation better assume same. Development many me each great person management.
Need see despite sign forward treat data. Own race environment your interview school.",2024-12-31T02:58:15,2025-01-13T02:58:15,unassigned,Close authority traditional necessary Congress.,Port Josephbury,41664.48,"14 days, 0:00:00",routine,96af6f3f-c904-4575-8c78-0644312a5cc7,2024-12-11T18:19:12,2026-04-07T18:12:43.695942,1e98dd5d-3e89-4351-8f22-b2239d1a4669,400eb514-9570-4bf2-996c-d913b063f2eb
