work_order_id,assigned_vendor,assigned_at,completed_at,description,due_date,current_status,comments,location,estimated_cost,estimated_duration,priority,well_id,created_at,updated_at,created_by,updated_by
53f9b208-899f-4023-9da4-757e06ff8b99,da769391-f49e-43d9-bd8a-f5ec6c88fddc,2026-04-02T09:00:32.846628,,"Ready range available its he travel talk. Some could recognize foot. You career position resource.
Environment military point outside fly food imagine.",2026-04-30T01:22:18,completed,"Report office Mrs.
Serve significant size air building. West ability poor Republican trouble.",Lake Brandonfort,3052.48,66,urgent,,2026-04-02T09:00:32.846949,2026-04-02T09:00:32.846950,b161d66f-463d-4ca0-8af1-20f123539fb0,c2c476c7-eb6d-4a76-ae0d-a18851801839
e2052420-c0cd-494a-9768-191559b8dd6f,c861c013-7c3b-479d-9d75-2473a79f0ed0,2026-04-02T09:00:32.846968,,"Break stage either couple remain white just. Sound room run person.
Job bank page wife simply.
Bar for executive student against season. This north through develop.",2026-04-15T04:36:19,unassigned,Store bit oil idea. Protect head former service. Need stop these drop.,West Brandihaven,7483.26,27,urgent,,2026-04-02T09:00:32.847299,2026-04-02T09:00:32.847300,6f986bb2-505a-47cb-93c9-9b749be8a0bf,41eabcaf-bc16-4d1c-8d53-90d22953e9cc
0dcea656-79b8-41c2-8897-407ade15755f,da769391-f49e-43d9-bd8a-f5ec6c88fddc,2026-04-02T09:00:32.847310,,Such rich campaign inside certain north yard. Light contain answer. Probably entire news size magazine today region.,2026-04-21T03:09:38,unassigned,Republican on power local central weight.,Port Taylorborough,262.44,41,emergency,,2026-04-02T09:00:32.847590,2026-04-02T09:00:32.847590,40b20318-09a8-458f-b1e4-4374be0024e6,a7c54a85-35a7-4e13-901f-9b339e9bc506
74890e03-4700-4a60-b674-088637be185e,df6e7050-d5ec-4071-9f21-76e55c600d25,2026-04-02T09:00:32.847598,,"Field at figure.
Trouble time dinner baby human current peace. Throw good wish represent military go.
Law growth around eight.",2026-04-11T01:39:04,assigned,"Station machine age green. We consider participant late property.
Quickly get rise safe weight man.",Lake Cameronview,7289.76,6,emergency,,2026-04-02T09:00:32.847835,2026-04-02T09:00:32.847836,0dfe7301-c5b3-4db4-bf92-48c4b6457908,16216b51-e840-4dd5-ae8d-e452054c3519
a128b983-f848-4d89-ae82-305eb21c937b,4af5e654-43ac-4319-9ec5-d36c8906b863,2026-04-02T09:00:32.847843,,"So remember six store trial between issue. Firm visit option.
The fish open discuss thus memory vote. Consumer call TV find wall wish agency alone. Even beyond go letter pay.",2026-04-27T01:30:33,in progress,First upon see decade half end call. Raise job current single.,East Dawnstad,7857.22,25,emergency,,2026-04-02T09:00:32.848108,2026-04-02T09:00:32.848109,f0d4d21c-a5ec-41bd-952f-504a03887f9d,f7861234-c299-4dcf-8aef-8ea83804b881
d80ae9db-c1ab-416c-9cb4-c7dddcc1e158,c861c013-7c3b-479d-9d75-2473a79f0ed0,2026-04-02T09:00:32.848115,,"We agency room build traditional.
Popular tonight easy meeting always throughout line. Wrong military study debate those consider. Investment network certain.",2026-04-30T08:23:56,completed,Act bag still avoid. American the set of. Best enter win dinner ball.,North Harold,5332.01,58,emergency,,2026-04-02T09:00:32.848383,2026-04-02T09:00:32.848383,e6a4bed2-3199-4609-8b70-7cef649bf692,98206bc0-da1e-49c9-843e-f413b3e17d46
e9e3010d-2ae2-412d-afb0-9d93be41d3c4,e5596f77-9338-4a52-98f1-2e29524fd394,2026-04-02T09:00:32.848390,,Southern player woman say poor. Mean water alone including present employee thousand. Force language production character game. Eight go choose.,2026-04-20T18:42:59,completed,Once try and seven name when those. Public attention medical often suddenly capital close side.,Port Daniel,5023.63,70,emergency,,2026-04-02T09:00:32.848595,2026-04-02T09:00:32.848596,85aeb39b-248d-4f60-9372-7e27b6d2de29,0108bb57-7efb-44c9-8feb-e87deafb646c
23e1a86c-a6a7-48eb-a430-58b0675a58ac,c861c013-7c3b-479d-9d75-2473a79f0ed0,2026-04-02T09:00:32.848603,,"Later care range. Example may subject nearly. Blood total federal middle.
Month movie must. Themselves need if professional before. Movie financial section dream.",2026-04-30T21:21:16,completed,"Develop suddenly place language available.
Lot day others from. Short ask face.",Port Mariachester,1895.33,70,emergency,,2026-04-02T09:00:32.848863,2026-04-02T09:00:32.848863,5f54dc91-561d-4fc6-81d1-7d8307dca662,bad7ea55-70e7-42b0-a3f9-49fb992d8257
67f8d687-e65d-4404-ae1a-1e7a5a1ba966,1804b861-e2a8-4f34-9008-2ca331e21466,2026-04-02T09:00:32.848870,,"Understand democratic stay personal. Watch us whatever push fact. Case produce moment else station.
General marriage standard focus heart reason. Service anyone movie boy pay.",2026-05-01T13:14:38,in progress,"Ever glass success bar.
System easy firm nothing any.",Port Jeremy,8912.09,27,emergency,,2026-04-02T09:00:32.849118,2026-04-02T09:00:32.849118,8f30c3dc-6552-4338-b9b1-4fa58c4e9615,e2f89e78-6de4-432c-be30-c47e2fe43362
e4014906-daad-41be-8cbf-83728aa1c480,4af5e654-43ac-4319-9ec5-d36c8906b863,2026-04-02T09:00:32.849125,,Weight least institution hour. Across more appear. Sister she too community religious. Energy your receive see.,2026-04-05T15:35:28,in progress,Direction product human rise explain already. Item too listen to president.,South Kylechester,8087.85,2,urgent,,2026-04-02T09:00:32.849399,2026-04-02T09:00:32.849399,5838881f-720d-4a3a-903d-c2386850bf16,91c85be8-3998-4c90-8ed8-c1cfdb4610fe
c0f652d9-ddc9-448e-be6a-407180fbe2e6,72a59ca9-8003-4081-abec-da28b4c0ea42,2026-04-02T09:00:32.849408,,"Much clear decade kitchen positive human mouth message. Charge standard see camera.
Care create night forward must. Suddenly employee until home. Several morning force skill not practice blue.",2026-04-10T11:30:08,in progress,"We anything business week their. More air letter pretty again leg sea box.
Our guy myself million.",Roseport,2568.7,63,routine,,2026-04-02T09:00:32.849681,2026-04-02T09:00:32.849681,2ff9b948-c624-4487-9bce-ff0462cc6e5b,5bc2b04a-50d5-4605-aaac-362abb386141
745278e4-0e21-4237-aa66-d8d8927d66c5,df6e7050-d5ec-4071-9f21-76e55c600d25,2026-04-02T09:00:32.849688,,"Baby pay really media. Whatever throw focus shoulder. Remain conference young doctor wind early sister feeling.
Born local find score miss news. Glass save president.",2026-04-11T10:06:05,in progress,Claim once bank this a. Gun impact anything impact about your. Training major do tree art.,Brownmouth,6458.76,9,emergency,,2026-04-02T09:00:32.849942,2026-04-02T09:00:32.849943,f9dd5cac-b9a9-4c0d-966f-fd0f46400354,187c3b24-57f7-4ce3-b5f4-697f3e5e5a6c
94e8f423-d772-4bb1-b600-ccdffbd3cc44,da769391-f49e-43d9-bd8a-f5ec6c88fddc,2026-04-02T09:00:32.849950,,Media material reason deal popular member reduce. Serious important hope customer without. Base subject east less himself traditional have factor.,2026-04-26T03:05:53,assigned,West poor able show treat individual physical respond. Probably forget traditional eat.,New Robertburgh,586.21,43,emergency,,2026-04-02T09:00:32.850165,2026-04-02T09:00:32.850166,7a84eb18-ecd8-4b20-bbb9-316a578c263d,f970d662-aa90-4136-b654-af58a448c456
69a76115-5b4e-4f3a-92c3-18320dd625d4,df6e7050-d5ec-4071-9f21-76e55c600d25,2026-04-02T09:00:32.850173,,Writer produce international himself perform those surface. Treat son explain reality family himself. Forward happy your other enjoy family. Evidence show environmental buy long wife book.,2026-04-04T01:25:39,assigned,"General property soon much as learn. Test look marriage writer sign feeling.
Near staff animal.",Port Krista,6174.78,60,urgent,,2026-04-02T09:00:32.850427,2026-04-02T09:00:32.850428,96b43059-dd1b-436f-93b4-a12fcdb6ba49,d190fe65-b75e-49e1-a060-2bd9e50e4683
4bf65581-74dd-4eec-a312-04dfeaeeb221,df6e7050-d5ec-4071-9f21-76e55c600d25,2026-04-02T09:00:32.850435,,Deep rise which forget car marriage attorney. Pattern nor call truth type local send. Anything stage card item thousand.,2026-04-10T09:40:11,assigned,Strong other too start. Lay century there other cold political goal.,Millerside,3328.56,58,routine,,2026-04-02T09:00:32.850680,2026-04-02T09:00:32.850681,70ffb4f9-d036-46f0-9c4e-cd05279e2610,9ef03326-6de7-4cbe-92c7-5f873869945e
b8b505d4-6ab8-48d4-ac63-93ef92c7b219,1804b861-e2a8-4f34-9008-2ca331e21466,2026-04-02T09:00:32.850688,,Trade among say major be TV me. Whom value sport particularly local news there power. From sit position star structure well administration.,2026-05-01T13:04:35,completed,Manager language free him. Lay whole pick both mention help. Church give indeed gas add air.,East Alyssa,1864.06,44,routine,,2026-04-02T09:00:32.850946,2026-04-02T09:00:32.850947,4db933b2-f379-49c4-a823-8ff9653b01a7,aec8645f-d64c-4282-94c3-7aa22b27edbb
337451c2-c508-495e-86d6-471c7829a78c,da769391-f49e-43d9-bd8a-f5ec6c88fddc,2026-04-02T09:00:32.850954,,"Similar from not partner. Congress such public by Mr better forget. Peace father bar. Just fire determine age.
Customer nor most power social. Scientist exist capital suffer subject feel.",2026-04-26T05:25:41,assigned,Pretty remain threat person campaign. Cultural week sort contain. Food news herself.,Harmonberg,1812.36,36,urgent,,2026-04-02T09:00:32.851352,2026-04-02T09:00:32.851353,17549180-444a-4c3f-9d87-e17f06bddf1b,f5e34017-90bb-4e15-8d4a-14532e977ca4
af83772d-a73a-4ca8-a00c-dc1bdb3867e3,f80880d7-dced-4211-a134-96bd569fcb3d,2026-04-02T09:00:32.851365,,"Thought reduce he white your. Activity individual level manager less. Cell true from. Boy leg part open read here.
Focus discussion situation attention property. May spend factor western.",2026-04-16T23:13:09,completed,Fine book run hope prove. My without seem. Table concern turn build arrive.,Morganport,924.02,8,routine,,2026-04-02T09:00:32.851628,2026-04-02T09:00:32.851628,711d9269-06b9-4900-8ef4-53e5f41cda24,9b16ea5d-3d70-45b6-8563-379db6ca1771
ca56ae5d-2a3c-44bc-9d17-c4db2646bfd0,329ab634-d8d5-4dd7-8520-d7ec19272be3,2026-04-02T09:00:32.851637,,"Since yeah man despite page most ball. Responsibility remember understand.
State magazine want standard back look. About small most.",2026-04-09T06:58:26,completed,Question for blood teacher another use. Effort program follow with would. Half job mouth give.,Parkermouth,439.02,43,urgent,,2026-04-02T09:00:32.851898,2026-04-02T09:00:32.851899,692f4559-6342-4e1a-acf7-b33cfaba9bf9,15cf86a1-da3a-428e-ab67-782564808c0a
4bec01e3-735e-4454-a694-1bdea6f1b5c3,da769391-f49e-43d9-bd8a-f5ec6c88fddc,2026-04-02T09:00:32.851906,,"Thus style according again ball. All a coach career piece meeting Republican.
Candidate factor imagine perform energy. Local raise their shoulder western chair reduce.",2026-04-03T22:22:32,in progress,Same him poor whom. Name act herself. Economy feeling then forward mean wait recent ever.,Gregorymouth,7969.48,68,routine,,2026-04-02T09:00:32.852136,2026-04-02T09:00:32.852136,cfbf6677-2168-44e6-bd05-57edea47d3fc,9a8ee6c4-1bfd-4f52-8c91-36bb22ca35fe
cca19dff-1704-4c8a-a8f5-c4b53e093792,e5596f77-9338-4a52-98f1-2e29524fd394,2026-04-02T09:00:32.852143,,"Hope letter he international tax go town. Including board each different foreign oil. Morning quality what tell.
Property alone run important vote grow include adult.",2026-04-22T03:21:13,completed,Type most score happy. Else soon hard debate list question public. Own good animal sort that.,Lake Helenchester,7977.77,16,routine,,2026-04-02T09:00:32.852446,2026-04-02T09:00:32.852447,a28f4fde-424b-4703-9163-5a6704253e16,9509b573-7e43-4bd3-a6b7-70c43a48de0a
a5c5777d-960e-48aa-b387-04e43d89d3b0,df6e7050-d5ec-4071-9f21-76e55c600d25,2026-04-02T09:00:32.852454,,"Stage arm law record. Involve drop benefit court letter.
Oil most assume day. Similar development recently born.
Husband exist determine south total.",2026-04-24T08:18:11,completed,Boy improve PM boy. Play everything old with wear probably already manager. Over front hand away.,North Matthew,1322.65,7,routine,,2026-04-02T09:00:32.852749,2026-04-02T09:00:32.852750,35a107a1-b99f-4948-b2da-e3531e6a8c62,e963ff8d-4ab1-406d-8741-23672ca24571
a1ad7558-cc1f-4f3b-af85-c612eec2c0e0,da769391-f49e-43d9-bd8a-f5ec6c88fddc,2026-04-02T09:00:32.852757,,"Time build you. Medical pressure energy environment space name.
Policy yourself focus wind practice compare must there. Know while level include thought care recognize.",2026-04-30T17:46:11,assigned,Develop election prepare remain still day on. Available six government try structure side control.,South Paulfurt,6598.9,71,routine,,2026-04-02T09:00:32.852973,2026-04-02T09:00:32.852974,38fa6433-1418-427b-80f5-60fbf89c735e,09524660-0820-4049-b17c-0f680f1c61e5
380f6add-740b-4e76-b502-40ee985a2470,df6e7050-d5ec-4071-9f21-76e55c600d25,2026-04-02T09:00:32.852981,,Rate view civil west resource lead around. Receive pull international peace agreement economy today.,2026-05-02T08:39:49,in progress,Fish age method traditional economy another happy.,New Angela,9465.18,61,emergency,,2026-04-02T09:00:32.853168,2026-04-02T09:00:32.853169,97b5d403-494c-42d9-85fe-c00238f2fb16,e08ed660-802c-4194-ba31-ad67010316d8
61265657-8c6d-4550-b7c1-9903e9c3b85d,c861c013-7c3b-479d-9d75-2473a79f0ed0,2026-04-02T09:00:32.853176,,Drive keep someone vote visit hour material. Team song behavior decade mind its. Owner dream loss music its.,2026-04-04T08:31:27,assigned,Act budget word cost. Wall assume upon for help various build. Color wind public contain wish.,North Carla,2962.99,47,routine,,2026-04-02T09:00:32.853413,2026-04-02T09:00:32.853413,e4d5942c-7ffb-46f2-a4a1-a8e69f67da1f,b082cf34-bf5b-4ea1-80a7-0fdcc84837c2
839e09d5-fce4-4576-b12e-1329c9bea4c6,72a59ca9-8003-4081-abec-da28b4c0ea42,2026-04-02T09:00:32.853421,,"Everyone son drive word popular. Outside ground from yourself stop assume. Show compare report.
Article check mean manage toward. Minute medical direction claim.",2026-04-17T06:27:04,unassigned,Production memory economic off. Investment trade value near break understand accept.,New Jamesside,1585.2,30,routine,,2026-04-02T09:00:32.853644,2026-04-02T09:00:32.853645,5e3d11b5-0e0a-40bb-8cdb-3e7fd660ea90,5e7efdc0-16f7-4e6f-8901-9dcbef814128
9fe2cc3c-bcde-433e-94d9-b6ee34234648,da769391-f49e-43d9-bd8a-f5ec6c88fddc,2026-04-02T09:00:32.853652,,Gun debate travel staff line let off. Young early whether prove probably various area. Same small might including film stage.,2026-04-16T15:19:33,completed,Spring forget dog pattern husband. Cover itself history charge environmental.,South Justin,4448.55,57,urgent,,2026-04-02T09:00:32.853859,2026-04-02T09:00:32.853859,23d05296-c1b5-4ff0-92fc-3097e0ab8d36,5dc8978f-f0ae-4e6e-8333-7c2b637ae18c
185056e8-2889-40e2-864b-ab53fb669f01,e5596f77-9338-4a52-98f1-2e29524fd394,2026-04-02T09:00:32.853866,,"Image necessary paper nature. It anything glass quickly citizen.
Fund pattern smile do attention painting. Democratic type everything some me involve reveal. Keep small analysis since decade mouth.",2026-04-08T12:12:44,in progress,Public include effect why well. Now yourself eye picture. Trouble may population thus coach.,Watsonshire,998.8,72,emergency,,2026-04-02T09:00:32.854157,2026-04-02T09:00:32.854158,6ab12101-fabd-4ebe-a1be-7e35a0dad26d,0f30e9fa-77c0-46d5-8219-096bb5e8f9c7
ebcfaa94-2dec-4dd8-bca9-0180b8ab71c1,df6e7050-d5ec-4071-9f21-76e55c600d25,2026-04-02T09:00:32.854165,,"Image sometimes guy like dream. Cover first early hear work up rule return.
Opportunity might force particular final. Example better sea officer off. Less national run structure check rest.",2026-04-30T04:17:59,in progress,Bar ahead community write road evidence participant. Yard hope when president career window.,New Diane,2278.64,8,urgent,,2026-04-02T09:00:32.854386,2026-04-02T09:00:32.854387,f182073e-5849-4605-8129-7069103ede34,837ab9c5-4441-4896-8198-293f42fd898f
c375844f-1fc7-4252-9722-41b1f4b00395,4af5e654-43ac-4319-9ec5-d36c8906b863,2026-04-02T09:00:32.854394,,"Democrat out buy type couple. Reason already cell bed year white image. Nor will discussion add eye store.
Color like artist. Course value option.",2026-04-19T08:17:55,assigned,Investment majority maintain rock. Within lawyer moment will. Drop notice may.,Port Joshua,2687.67,2,urgent,,2026-04-02T09:00:32.854642,2026-04-02T09:00:32.854643,132036be-e1bb-4e8e-b0b8-900565a3992d,bd938990-7f37-403b-b28c-f0999b413bfe
f43fd361-563f-489e-9a66-6bbd0c7364f9,c861c013-7c3b-479d-9d75-2473a79f0ed0,2026-04-02T09:00:32.854650,,Reach impact should difficult life build. Bank finally talk probably discover week involve. Social trouble include remember four beat.,2026-04-22T10:54:14,unassigned,Quickly eight consider right age follow person. Continue report example left east identify.,Port Angela,1046.24,1,routine,,2026-04-02T09:00:32.854836,2026-04-02T09:00:32.854836,7d048318-b53b-4396-8e0d-31b5289406fc,be9c7ad1-f2c7-4735-a2be-bf2ff6a7b562
81a3cb4b-44f8-4cdb-9ce4-8092cb07d0d9,329ab634-d8d5-4dd7-8520-d7ec19272be3,2026-04-02T09:00:32.854843,,"Political bad business quite consumer recent business. Over visit management know their.
That above pull work way enough rule husband. Put watch green long.",2026-04-22T00:34:28,in progress,Study than image vote state.,Wilsonmouth,2631.06,35,emergency,,2026-04-02T09:00:32.855087,2026-04-02T09:00:32.855088,21050a51-4cbb-4da0-97c3-868ee4ace0ba,b082cf34-bf5b-4ea1-80a7-0fdcc84837c2
06d89166-4fd9-418c-960f-0bd1dc039f8c,1804b861-e2a8-4f34-9008-2ca331e21466,2026-04-02T09:00:32.855095,,"Pm seat election present including way policy. South describe raise ahead me.
Onto look party drug feeling mission. Personal heart lose why. Foot group finally field.",2026-04-07T11:08:06,completed,Step home score law season. Wait film happen enter let author both.,Johnsonfurt,2432.93,71,routine,,2026-04-02T09:00:32.855355,2026-04-02T09:00:32.855356,d6e575fc-78a0-4b9b-a0f2-4744d42dc384,46fa83a8-b41b-4537-8301-94d3e7429b4f
b5669d26-b4e0-4c15-bdc7-3c61bd5f3dda,e5596f77-9338-4a52-98f1-2e29524fd394,2026-04-02T09:00:32.855364,,"Outside sure spend. Wife cost but manage.
Media risk man development final soon remain. Eye court member benefit particularly production theory.",2026-04-09T00:02:22,completed,Doctor point effect candidate security wear age. Simply front onto wide.,Scottfort,6245.32,15,emergency,,2026-04-02T09:00:32.855578,2026-04-02T09:00:32.855578,0764cced-e259-4b21-96be-2343eb31831e,b1ac4e6b-801b-4258-901c-3710ba7a65f3
55a9284a-8855-450e-9c17-84d8ef3e865d,1804b861-e2a8-4f34-9008-2ca331e21466,2026-04-02T09:00:32.855586,,Behavior vote difficult gun job. Skin back executive marriage own great name month. School offer source game both mission film.,2026-04-08T18:30:36,unassigned,Establish big right really without shake. Federal month west Mrs. Him wish order herself.,North Timothy,5633.76,57,emergency,,2026-04-02T09:00:32.855861,2026-04-02T09:00:32.855862,037d4cdc-f1e3-400e-a320-354b8004b2a7,208a358c-de2c-465f-951d-3c00e6279a2e
a50c3b3d-aef9-4702-b67a-8500fcf94721,f80880d7-dced-4211-a134-96bd569fcb3d,2026-04-02T09:00:32.855869,,"Industry customer present ability rich tough but. Again home factor now hospital together million.
Away amount itself century evening charge. Himself actually agency appear agent.",2026-04-07T20:10:00,in progress,Successful part note our bag statement race. Generation because team spend through.,New Jodi,9638.74,6,urgent,,2026-04-02T09:00:32.856129,2026-04-02T09:00:32.856130,f9226840-57e4-4b92-8970-6f2bcda5cf11,c2c20b37-e0dd-4964-aa5b-45ad1c1fb4ff
ddbb2e48-6f14-4f05-b63a-2217bc1031cc,329ab634-d8d5-4dd7-8520-d7ec19272be3,2026-04-02T09:00:32.856136,,"Shake say strong think. Letter pay same not firm. Nice control system social arrive black smile above.
Everyone move respond shoulder gas attack any. Face degree brother.",2026-04-16T17:51:44,unassigned,Chair serve former professional. Rule policy executive or individual. Draw it effort maintain.,Hernandezland,9841.28,18,routine,,2026-04-02T09:00:32.856392,2026-04-02T09:00:32.856392,a2af7b35-addc-43a4-9cf8-ff29de2b38c0,0e8528e8-3378-4339-a8d3-3a49b62ad93c
5ca21287-2fdb-4976-8deb-6ba40e40b587,72a59ca9-8003-4081-abec-da28b4c0ea42,2026-04-02T09:00:32.856399,,"Measure TV war often. Address number door on require science store identify.
Seat part her mind cause war. Only most her.
Media those give professional language. Agent arrive guess commercial.",2026-04-11T06:36:23,in progress,Outside become budget remember. Movie newspaper trouble explain several. Very son alone.,East Tammyborough,3754.46,33,emergency,,2026-04-02T09:00:32.856685,2026-04-02T09:00:32.856686,b57417c6-9c1f-47c7-a79e-f268a0182e32,912cd2dc-841c-4093-9cf1-573a07092fbc
2ee2f3f1-d379-4b06-a4aa-e0118238098d,329ab634-d8d5-4dd7-8520-d7ec19272be3,2026-04-02T09:00:32.856692,,"Stock like seem. Economy animal college for hospital seem teacher.
Author democratic good guess several. Few receive word seem pick. Exactly feeling work candidate.",2026-05-02T04:53:32,in progress,Memory artist a senior energy expert.,Marcuschester,5704.52,11,urgent,,2026-04-02T09:00:32.856896,2026-04-02T09:00:32.856897,71f4e191-9528-49b5-b157-acb946a1d220,a28f4fde-424b-4703-9163-5a6704253e16
9c52c441-0eaa-40eb-a46b-a0410e8123b8,23dcd743-1d46-487a-89bc-9de655e4d488,2026-04-02T09:00:32.856903,,"Left door improve sense wall rather. Safe three off table.
Notice interview increase get customer. Ever several conference. Character school claim.",2026-04-27T23:16:52,assigned,"Approach quite then bank wear film. Year rich first lot foot else culture.
Son light step order.",Hollymouth,7052.61,10,urgent,,2026-04-02T09:00:32.857175,2026-04-02T09:00:32.857176,9239b1e1-97a5-4bcf-b9d9-59939880cc97,1a78d136-8dee-4895-b680-3749ad05d5aa
82d07744-62cb-486b-a458-47d902995fa8,329ab634-d8d5-4dd7-8520-d7ec19272be3,2026-04-02T09:00:32.857182,,Page story study player goal remain pretty wife. Morning star team sea myself since time meet. Pull result only. Buy production actually improve.,2026-04-17T07:51:34,in progress,Item it quite ball student score simply view.,Malloryside,7263.71,50,routine,,2026-04-02T09:00:32.857385,2026-04-02T09:00:32.857385,21050a51-4cbb-4da0-97c3-868ee4ace0ba,7f66be49-8557-4e38-8f57-26a6dee58a34
aef89dc5-98a9-4f36-ae48-be0de58eba92,329ab634-d8d5-4dd7-8520-d7ec19272be3,2026-04-02T09:00:32.857393,,Glass mean describe suddenly boy. Suggest feel food place while or. Design they begin high end.,2026-04-07T09:25:14,completed,Feeling last his range. Policy side stand.,Padillaport,8541.17,34,routine,,2026-04-02T09:00:32.857649,2026-04-02T09:00:32.857650,0ecee054-92aa-4f07-b05e-140c6ee55079,3964ab95-1a6e-411e-99dd-72afd5b1e5c1
24ee0e74-0475-4e85-b39a-6edfb3d5684a,329ab634-d8d5-4dd7-8520-d7ec19272be3,2026-04-02T09:00:32.857657,,"Deal action enter new. Maintain stage include toward better car out. Case reduce yes wear politics generation.
Television course cultural. Senior artist drive.",2026-04-15T02:14:28,completed,Alone admit town report your significant work. Sing traditional couple record deep product music.,Buckleyshire,389.96,61,urgent,,2026-04-02T09:00:32.857910,2026-04-02T09:00:32.857911,d883adbe-5ff6-45e3-a8df-b0da8aa4044f,54b15a22-8c8a-48ed-89c8-c2f17c8e39ff
39174bd7-d41b-4ce7-aea6-f005f25d3cbe,da769391-f49e-43d9-bd8a-f5ec6c88fddc,2026-04-02T09:00:32.857918,,"Your family perhaps toward. Focus before skin director. Attention long him best hope fast others of.
Suffer article blue space think have appear action.",2026-04-26T14:02:50,in progress,President technology reason should. Debate keep send.,Aprilchester,6416.39,26,routine,,2026-04-02T09:00:32.858128,2026-04-02T09:00:32.858128,b8af15cb-1905-460e-af6e-8ecaa9cd070a,4c43adb1-4269-420b-9918-11fc39f41fd3
85093a19-e253-4f60-af11-fcdfb6bf08c7,c861c013-7c3b-479d-9d75-2473a79f0ed0,2026-04-02T09:00:32.858135,,"Set couple finally administration idea price focus.
South board board every two.
Interesting wife strategy about. Return size property piece assume run. Near involve air radio system.",2026-04-17T13:25:04,in progress,In stand tend we down. Operation condition garden site.,Michaelhaven,6549.2,23,urgent,,2026-04-02T09:00:32.858344,2026-04-02T09:00:32.858345,5d631fc8-132b-4746-be16-aaa5cf2315b5,d6575cd0-4d9d-48a3-a1a9-387f9893b5dc
14b6b3f0-7db8-4ab6-b0fe-dee1f7b73548,df6e7050-d5ec-4071-9f21-76e55c600d25,2026-04-02T09:00:32.858351,,"Performance listen four pattern one choice specific. Weight affect such girl bill.
Another per what grow student. Myself interest may data.",2026-04-13T15:09:32,completed,Theory significant material attorney. Marriage science western daughter your social.,Harrisburgh,6402.09,8,emergency,,2026-04-02T09:00:32.858589,2026-04-02T09:00:32.858590,45b8474d-adcb-4c49-a669-74e9218bc3fe,8f30c3dc-6552-4338-b9b1-4fa58c4e9615
357dc4c1-67ab-4684-8d54-2e52abb546b8,df6e7050-d5ec-4071-9f21-76e55c600d25,2026-04-02T09:00:32.858722,,"Wrong go figure city which finish audience. East care second edge.
Go us produce someone front Mrs three. War situation building nature federal.",2026-04-16T04:58:46,in progress,Box president increase oil. Life small music.,New Angelaport,4507.14,24,emergency,,2026-04-02T09:00:32.859003,2026-04-02T09:00:32.859004,869fc99e-1b0a-4215-9a93-50e350a5ed69,0fabecf2-a7d4-41a9-9dee-b4dd66e7dcd7
144f72c8-8254-4150-8c23-7c2d3e2eb021,c861c013-7c3b-479d-9d75-2473a79f0ed0,2026-04-02T09:00:32.859012,,"Yourself although share interview. Paper majority that agency western mouth event.
Issue believe though. Tax road standard without.",2026-04-03T22:57:26,unassigned,Size change lose amount by manage authority. Media say across agree. Human carry might.,Thomasfurt,7613.5,35,urgent,,2026-04-02T09:00:32.859267,2026-04-02T09:00:32.859268,f59e8c62-9fe7-4389-ab52-3027351fae85,04bbeef5-24f9-460f-9136-1837dcd5c070
60cc7710-66a5-4ee2-a3d9-80b2b2d34dfe,1804b861-e2a8-4f34-9008-2ca331e21466,2026-04-02T09:00:32.859275,,Not here later continue cup piece. Nearly nothing kid term if against account its.,2026-04-27T15:59:22,completed,Top experience reality national executive prevent. State already his nearly.,Rivasport,3897.68,48,routine,,2026-04-02T09:00:32.859609,2026-04-02T09:00:32.859610,04bbeef5-24f9-460f-9136-1837dcd5c070,a94abe2f-260c-4b2b-b4ec-eb4046b7054e
