work_order_id,assigned_vendor,client_id,assigned_at,completed_at,description,estimated_start_date,estimated_end_date,current_status,comments,location,location_type,latitude,longitude,estimated_cost,estimated_duration,priority,well_id,service_type,estimated_quantity,units,is_recurring,recurrence_type,cancelled_at,cancellation_reason,created_at,updated_at,created_by,updated_by
7e34dd41-196a-40ae-9b0f-a4c7d2aef610,0709cc65-6c9f-4f4d-8ae3-f0bbc2a2a1a8,e51e2d86-c1f3-4d90-90f1-7117fb277a1d,2025-07-08T09:38:29.946050,,"Someone treatment reflect skin possible participant right each. Issue really drive receive rather.
Seem yard live budget.
Against rule the college. Hour west major protect.",2025-07-09T19:38:59.439784,2025-07-10T19:38:59.439784,ASSIGNED,Opportunity than large capital history. Decision unit person company month. Act station politics.,Rodriguezbury,WELL,68.0358005,-63.197708,41564.42,"3 days, 0:00:00",MEDIUM,b6513343-bf17-4c49-aefc-8503164485d0,4e7fc312-7d39-40c4-8680-e6cb72b0aa8b,67.45,days,False,,,,2025-07-06T06:43:43.176565,2026-04-12T23:49:46.165011,0341240c-2dc2-4a47-a7df-c064605d4cc1,cabbe7b4-b81d-4736-9f81-1301575d7927
eed2d0df-1375-4846-a6cd-f879db36daf8,ad31d7e7-9a34-4eb1-8030-317d6d9d1a4d,4ec8e0e9-3415-4edc-8390-bb350c4d0b20,2024-09-06T14:55:07.302663,,"Evidence president on kid star read race from. Significant race night keep girl. Lead away center term service late.
Administration draw dream up fine trial page reflect.",2024-09-07T19:17:17.609032,2024-09-09T19:17:17.609032,HALTED,Certain pull manage find. Young machine deep support. Much truth key chance simple full.,North Ray,WELL,72.430812,91.165228,6392.02,"1 day, 0:00:00",HIGH,e9a9542b-1a69-4849-8bd7-5f03059a47ee,ba2aec32-4f9f-4149-8dcb-c98d113c1dd1,37.22,visits,False,,,,2024-09-06T08:22:17.020937,2026-04-12T23:49:46.165207,1e10bd6f-d931-47a1-9b56-76e3010977a6,ddae1375-d420-4d76-b264-e428eac30c23
1bc29e18-9b3d-46e9-b533-fc802ffcab6a,62aab707-f2c5-4283-86fb-7bdb83f4ac9b,088edccc-2f3d-4fae-874a-0a4ed06779c6,2024-07-22T04:45:45.763731,,Sea each research card play ahead improve maybe. Difference grow step how first home thing. Top support question much account drug with although.,2024-07-23T18:19:30.717801,2024-07-28T18:19:30.717801,CANCELLED,Court product resource production charge. Always president simple offer.,South Saraside,WELL,87.7855355,107.113792,11135.22,"2 days, 0:00:00",HIGH,6b2f79d6-d6d0-4041-8e07-26bcf5b0c7e2,73148b49-8f75-4090-8b7e-23d5ea575b39,20.82,loads,True,MONTHLY,2024-07-23T15:21:11.046107,Resource unavailable,2024-07-19T13:35:19.753221,2026-04-12T23:49:46.165458,994dab97-b472-47f6-a8d2-1bfe24905c42,c7e23e7b-14da-4bec-abc4-f69deec32ede
f6869fce-0eb6-485e-98b5-22431027103c,62aab707-f2c5-4283-86fb-7bdb83f4ac9b,a0be935d-e8a0-460e-9e83-b7480a847df3,,,Its contain institution I. Live series cause they theory talk turn. Under wind fight find attention leave role. Few risk type learn attack which.,2025-09-20T07:46:11.100836,2025-09-23T07:46:11.100836,UNASSIGNED,Available stock character study money. Sort space feeling on trip hotel. Action around main it.,New Natalie,WELL,39.463938,-104.770581,9674.9,"2 days, 0:00:00",LOW,5bac6ecc-7104-4ea1-ad26-42664373e19e,73148b49-8f75-4090-8b7e-23d5ea575b39,72.74,hours,True,MONTHLY,,,2025-09-16T22:58:02.746124,2026-04-12T23:49:46.165634,0a8bf599-a59f-4bc3-b488-30aab8e54dc0,29b49502-048b-4212-aa3c-8b0930ef4952
64609072-2461-41ee-8b9d-64447fed5a7e,87557121-007b-4e66-9a6e-733b6e2bc363,458c914b-8ff0-421f-b274-6701c9d3dc4f,2025-07-11T10:20:41.695282,2025-07-17T11:02:51.947419,Suddenly wait it several. Little provide modern east choice someone focus feel.,2025-07-13T05:14:12.731408,2025-07-16T05:14:12.731408,COMPLETED,Walk manage hair rate official. Many step offer until event performance you.,East Diane,WELL,-65.23375,35.856502,26111.7,"2 days, 0:00:00",HIGH,40b5eabe-a90c-4a58-b6b3-f99ee728e400,c357ce45-c285-4528-a39f-f2b46f1d7cd8,19.78,loads,True,ONE_TIME,,,2025-07-09T01:13:43.851577,2026-04-12T23:49:46.165866,9e51c4a5-9cca-47ca-9d74-153378db8c95,7561f17f-427b-4bfd-a87d-c3dea26b4b8b
908afb85-87a3-4169-8cf1-df0aca813366,0709cc65-6c9f-4f4d-8ae3-f0bbc2a2a1a8,dcc1e17c-3547-4d18-8cc2-b9e8053b19d4,2025-07-07T12:17:31.152971,2025-07-15T06:43:11.460669,Everyone politics coach remember order beyond song government. Teach anything remain indeed word.,2025-07-09T03:13:45.935529,2025-07-14T03:13:45.935529,COMPLETED,Name next civil catch glass sit evening. Foreign arm former account result occur.,New Cynthia,WELL,2.5827595,21.902533,45850.5,"3 days, 0:00:00",MEDIUM,613e5115-980b-48b6-a587-4d146b255bb1,1fa126ef-30c4-4cf2-9294-a6d23c75936f,41.57,hours,True,MONTHLY,,,2025-07-06T02:32:46.895040,2026-04-12T23:49:46.166085,bbde74db-ccf6-44f1-802b-82a5e20116f5,74d6410a-93f7-4f34-9fb5-5d9e3aeee533
ee2e7e08-6979-459d-85eb-01060ba3179b,600ad80b-c837-4db6-b132-5c5f8b995ef6,60bb88d6-bc9d-4ef9-aa1a-8c2aeb77deed,2025-12-04T19:20:54.942378,2025-12-07T05:47:20.503234,"Pm look student well. Cost very street build environmental Democrat either. Leader worry place society easy himself single.
Method sure game ok pull improve. Behind me sort cell discussion real test.",2025-12-05T22:53:52.479211,2025-12-06T22:53:52.479211,CLOSED,Close land yes usually this oil line. Magazine almost sport within often media traditional.,Lake Gregoryburgh,GPS,54.031881,170.55798,36362.78,"2 days, 0:00:00",LOW,4f1b3fa1-5528-421f-93e4-caf6c5422b2a,ba2aec32-4f9f-4149-8dcb-c98d113c1dd1,21.55,days,False,,,,2025-12-03T06:31:09.412980,2026-04-12T23:49:46.166278,423a0457-a3cb-4af9-94f8-ccd34897ee41,85aefd78-1d87-4ea4-9fbd-3469872d787f
cd2a6707-2db3-427d-a38b-9c4cc5907869,600ad80b-c837-4db6-b132-5c5f8b995ef6,29689696-7a26-4c08-8f61-b3d86c203be7,2025-07-20T13:09:26.565491,,Role structure pressure their sport. Popular TV pull quickly. Mother record whatever area. According power begin piece.,2025-07-20T22:14:33.431498,2025-07-22T22:14:33.431498,ASSIGNED,Foot rest listen different sign. Approach floor certainly thing mind billion recently.,Gabrielleville,GPS,30.860322,73.64718,12194.54,"2 days, 0:00:00",HIGH,3343f424-98c3-4281-aea8-ca3705a6031f,73148b49-8f75-4090-8b7e-23d5ea575b39,9.6,days,False,,,,2025-07-18T12:25:47.831843,2026-04-12T23:49:46.166476,14f10efc-c0b6-4e74-b4c1-4c530085806e,e5072a12-24c2-4d12-8cf8-05a6f410c909
95f488e9-1dc2-491b-bcbd-05a753e6619a,f1c4b27c-6e22-48a1-a23c-8d646460dcc9,e51e2d86-c1f3-4d90-90f1-7117fb277a1d,2024-08-25T09:29:40.967490,,Control reveal executive small lose much evening avoid. Couple laugh during probably hour provide.,2024-08-26T06:27:13.874708,2024-08-28T06:27:13.874708,HALTED,Him red these short girl company rather. By arrive wife write middle station south.,Rogersberg,WELL,-46.80082,-140.249483,31850.01,"3 days, 0:00:00",LOW,55cc771e-8dbf-4458-99f1-b737796f672a,7b6dfde4-99be-4a0d-8299-9105d88c6974,12.52,days,False,,,,2024-08-22T20:31:11.166912,2026-04-12T23:49:46.166653,3ad52519-7238-479c-b1ca-71a3fd833fc8,df848529-5d41-4910-84b7-c1a375ced380
89af75b4-66c5-4f75-b84c-673e9c1fbf4b,9deb59e9-2b41-4fa0-b272-fa2b3dc749de,4ec8e0e9-3415-4edc-8390-bb350c4d0b20,2025-03-10T01:11:30.603698,,"Surface audience official customer religious. Human ready writer south. Maybe weight by such interesting treat.
Join natural only window first. Thus reveal hair class certain manage need price.",2025-03-10T20:50:44.139010,2025-03-14T20:50:44.139010,IN_PROGRESS,Pay kind five a threat. Nearly person defense. Seven them already bill investment structure.,Grahambury,WELL,62.928727,-17.160187,18781.87,"3 days, 0:00:00",LOW,2b3ba57d-b54a-4003-8d4c-74386d6be2a9,1fa126ef-30c4-4cf2-9294-a6d23c75936f,41.91,loads,False,,,,2025-03-10T00:32:57.620853,2026-04-12T23:49:46.166907,16a2ff4a-bf83-490e-b90c-cdb1ad04c58c,3b58223b-0fda-4811-ac09-f430449ce152
195fcfe1-ea5a-48d2-8042-5e19c7ec9392,f1c4b27c-6e22-48a1-a23c-8d646460dcc9,ac5b1c50-7bd0-4ab9-ae40-7f1e992ad093,2024-04-25T17:32:21.867552,2024-05-01T15:40:35.545337,"Remember trouble major hard field. Page support less this appear who character. Leg partner machine pattern him early.
Over five test air. Lay book finish month wife life data.",2024-04-27T15:49:50.719787,2024-04-30T15:49:50.719787,CLOSED,Hundred ahead interest range seven lose.,South Alyssa,WELL,-24.551856,46.501663,29439.78,"3 days, 0:00:00",HIGH,658b2dbd-d06a-43f4-9e1b-d7a9ca2fc850,4e7fc312-7d39-40c4-8680-e6cb72b0aa8b,42.46,visits,True,DAILY,,,2024-04-25T11:24:39.543998,2026-04-12T23:49:46.167125,9c02f61d-07b5-468c-88a5-5abf61e3eca9,7985404f-ffd2-4d21-a385-ffce70894bf6
c3fcc41c-e749-4c57-9e0d-f53651659e20,0709cc65-6c9f-4f4d-8ae3-f0bbc2a2a1a8,3a1b6912-f450-4445-8dc1-82e07aa292b9,2025-06-14T23:31:19.364850,,Production laugh stock ask between himself prove. Those it before myself all stay contain force. Line program after debate meet then. Town tonight act produce goal foreign produce.,2025-06-15T00:09:58.104352,2025-06-18T00:09:58.104352,ASSIGNED,Us operation she certain capital get. They dark culture participant rather.,East Heather,ADDRESS,-31.469906,34.692971,23257.23,"3 days, 0:00:00",LOW,e69055ba-a4be-46cd-9e35-7ccc6c58611e,4e7fc312-7d39-40c4-8680-e6cb72b0aa8b,97.98,days,True,MONTHLY,,,2025-06-12T03:04:56.618174,2026-04-12T23:49:46.167283,996b72a5-8977-4ce9-ba40-6c4fa211f97a,fe46071b-8bcb-4cd7-a2d8-4e0a6f9c73f2
e5909ae7-c5c2-413d-98ec-748dfea3979a,62aab707-f2c5-4283-86fb-7bdb83f4ac9b,a0be935d-e8a0-460e-9e83-b7480a847df3,2025-07-14T19:11:14.824337,,Safe address effort power recently way. Fear too than activity plan. Big stuff style know policy news southern.,2025-07-15T01:53:26.967449,2025-07-16T01:53:26.967449,ASSIGNED,Cup work test daughter defense.,Burnettburgh,WELL,4.272373,-50.544633,3223.06,"2 days, 0:00:00",MEDIUM,5bac6ecc-7104-4ea1-ad26-42664373e19e,73148b49-8f75-4090-8b7e-23d5ea575b39,69.29,loads,True,ONE_TIME,,,2025-07-14T01:59:16.311632,2026-04-12T23:49:46.167461,b6aa3050-b41e-4c58-adec-a8c2b330e786,c432ce71-01df-42ef-b00b-fb3e2e488e1c
ed8d60e8-6418-42ee-baa2-305a531d6dfe,1d7e9e8f-40be-49dc-9672-3aa65ee2f0d0,d3d1c29a-f1f9-46d1-bd15-d62e528334f9,2024-04-22T15:30:03.326499,2024-04-30T13:26:37.932736,Key door under husband.,2024-04-23T22:42:37.331321,2024-04-28T22:42:37.331321,COMPLETED,Ask then also claim or six. Fear result blue nation say.,Smithtown,WELL,-55.3620705,140.10031,46639.32,"3 days, 0:00:00",MEDIUM,a3c01c7f-ca81-4827-9505-c5ce4bd909ec,4e7fc312-7d39-40c4-8680-e6cb72b0aa8b,21.09,loads,False,,,,2024-04-21T20:14:56.785137,2026-04-12T23:49:46.167639,b9f8bf51-4a1f-4c31-a8af-f8ddc7a72bf2,18fe73b5-0d04-494c-b956-f1038d3afc03
1f845c1e-9639-4edf-8657-ac8e3c313c7b,ad31d7e7-9a34-4eb1-8030-317d6d9d1a4d,ac5b1c50-7bd0-4ab9-ae40-7f1e992ad093,2024-09-04T02:39:12.197101,,Politics ago agency laugh check after reason. Ground order base would according relationship. Staff small enter money example.,2024-09-04T18:53:02.354238,2024-09-05T18:53:02.354238,REJECTED,Us play foot leader each. Tough magazine side near become we. Ever their discuss material.,Robertbury,GPS,44.6781975,-175.650083,5182.21,"3 days, 0:00:00",MEDIUM,fe5d382f-6ee8-4373-b91c-8b0f1ba72f6a,19e95c4f-f46c-4431-bab6-f5797bcd52f8,31.04,gallons,False,,,,2024-09-04T02:31:40.350547,2026-04-12T23:49:46.167809,f5ba26a5-484c-4b08-8746-e6d1c00477a4,d66390b3-8bd3-4d7f-967e-f02bde3bbbcb
8cc94698-6a15-471e-9ef2-6a6480a2301e,ad31d7e7-9a34-4eb1-8030-317d6d9d1a4d,d3d1c29a-f1f9-46d1-bd15-d62e528334f9,2024-08-25T07:32:04.498404,,"Station politics identify.
Remember technology happy note if music. Still could structure use military address party. Risk nature test.",2024-08-25T23:38:41.617293,2024-08-28T23:38:41.617293,CANCELLED,What four in half. Prevent campaign specific director process surface wish. Left week near lay.,North Jessicamouth,WELL,-72.5658485,-122.222608,21793.85,"2 days, 0:00:00",HIGH,14f71232-c064-4b7b-94b5-f2dc7966d2ff,19e95c4f-f46c-4431-bab6-f5797bcd52f8,36.0,visits,True,WEEKLY,2024-08-25T10:50:49.495439,Safety concern,2024-08-23T16:17:18.854571,2026-04-12T23:49:46.168006,cd4782cd-052a-4495-b1ac-aaf22118dc44,9a9e61af-25c1-4bff-8f7e-cf45db4cebd3
6a65699c-6e19-4a7f-a0c9-162bed102eaf,4c23bea9-bb9e-4064-83d9-a54f94a01185,f8d92e72-d7a6-43be-84af-1bb71e1c8d32,2024-05-04T03:47:31.304464,,Certain ground senior however perform. Total view artist my various why expect feeling.,2024-05-05T04:12:30.103424,2024-05-10T04:12:30.103424,IN_PROGRESS,Money risk water page. Camera along attorney cover really avoid or sell.,Glenbury,WELL,-14.147139,-142.671689,1036.02,"1 day, 0:00:00",MEDIUM,790d683e-53aa-4959-8027-84972b68cb4e,19e95c4f-f46c-4431-bab6-f5797bcd52f8,89.31,gallons,True,MONTHLY,,,2024-05-01T07:55:55.366050,2026-04-12T23:49:46.168272,368b81b4-59cc-415c-8469-a4ac7d866226,94bb48ed-a3f6-4eb2-a227-81fc8a5a2f60
e9b816ff-3d39-4faa-81d2-41151a9e4db7,62aab707-f2c5-4283-86fb-7bdb83f4ac9b,d4347d99-2c69-4d0e-a2c0-37c94f738087,2026-04-05T03:59:23.482699,,"When black arrive half. Fire perform actually agency city.
Loss subject none Mrs. Choose simple poor. Even yeah goal bring serious part senior.",2026-04-06T01:55:48.539906,2026-04-08T01:55:48.539906,REJECTED,Go eye will discussion wear. Reason rather major appear. Floor lose they smile daughter.,Scotttown,ADDRESS,70.395503,-67.378232,29697.39,"3 days, 0:00:00",HIGH,d1e8d137-cb36-4c77-a505-018795e38454,73148b49-8f75-4090-8b7e-23d5ea575b39,93.78,loads,False,,,,2026-04-02T07:28:05.942295,2026-04-12T23:49:46.168529,38f939b2-043e-40d2-907b-05fed8f10e35,e4c5446d-af1e-4c4a-9bfb-4add2dedbf3e
4f2dd236-ce26-4769-8ad4-1b340846fd72,600ad80b-c837-4db6-b132-5c5f8b995ef6,a0be935d-e8a0-460e-9e83-b7480a847df3,2025-10-19T05:58:02.139359,,"While himself scientist hot analysis. Choice increase girl major although.
Technology front kitchen enter face avoid world. Us stuff firm possible responsibility simply goal. Hotel least early she.",2025-10-19T21:20:27.381212,2025-10-21T21:20:27.381212,CANCELLED,Provide method media. Technology its arrive vote.,Peterstown,GPS,64.072465,94.680973,29774.7,"1 day, 0:00:00",HIGH,d46b648f-44f5-4a60-b0f3-1ea65760d1b5,19e95c4f-f46c-4431-bab6-f5797bcd52f8,92.97,hours,False,,2025-10-20T03:05:33.471686,Duplicate order,2025-10-17T03:25:33.605479,2026-04-12T23:49:46.168741,2211061a-8816-4c4f-9697-fe307463d044,cdd8f656-b4b8-41ab-9c00-ea0c2d2aa933
bfcaf130-2503-43b2-bab7-f4ff0165a929,ad31d7e7-9a34-4eb1-8030-317d6d9d1a4d,4ec8e0e9-3415-4edc-8390-bb350c4d0b20,,,Pass student detail his will. Own pick instead both party along. Mind choice similar challenge suggest. Piece coach dream deep first quickly word.,2025-12-16T00:17:36.646036,2025-12-17T00:17:36.646036,UNASSIGNED,Let sport adult see note support. Truth account design baby result federal argue.,Markland,ADDRESS,-16.0740425,-146.050933,26952.72,"3 days, 0:00:00",LOW,2b3ba57d-b54a-4003-8d4c-74386d6be2a9,ba2aec32-4f9f-4149-8dcb-c98d113c1dd1,31.06,loads,True,WEEKLY,,,2025-12-14T14:45:37.824928,2026-04-12T23:49:46.168931,093508a6-a25e-4bd6-9dfc-3dc07bcb63cc,1649c296-aeba-4591-a8e0-c9e56f982ee2
5d324434-26db-44da-b7eb-85e36e69585b,0709cc65-6c9f-4f4d-8ae3-f0bbc2a2a1a8,e51e2d86-c1f3-4d90-90f1-7117fb277a1d,2026-04-09T19:02:44.148542,,"Agreement similar season cup single local. Memory brother red others recent senior popular. Change purpose imagine step couple reach.
Service contain of ok election.
Pass drop of fine.",2026-04-10T20:02:14.709808,2026-04-14T20:02:14.709808,CANCELLED,Shake develop scene to picture civil wind itself. High society career raise always lead from.,Johnsonport,WELL,-12.9487385,-134.595392,26441.18,"1 day, 0:00:00",LOW,b6513343-bf17-4c49-aefc-8503164485d0,3e1fd343-c96f-4490-a7f7-233a93117cfd,83.65,loads,False,,2026-04-10T05:32:08.168541,Client cancelled request,2026-04-08T11:15:30.593087,2026-04-12T23:49:46.169142,cccb3073-2ffb-47e8-a440-1c54bd45d6b1,c01c886b-4bca-408a-a44c-f984d12e6568
6830670e-6fca-4e56-9ae1-dc7ebdbce250,3dd270ee-41ef-47ed-98c8-22b2af21b4aa,dcc1e17c-3547-4d18-8cc2-b9e8053b19d4,2025-11-13T08:38:56.064526,,"Consumer fund food. Newspaper they step too decade suffer painting.
Policy human myself great. Work hotel set hear.",2025-11-13T15:46:43.875459,2025-11-16T15:46:43.875459,ASSIGNED,Everyone somebody worry least safe professor. Various person result cup attorney movie.,West Georgemouth,GPS,-82.018194,-137.270039,17313.34,"2 days, 0:00:00",MEDIUM,3a12e2fa-0e57-466b-90ce-44b3075c8ff5,4e7fc312-7d39-40c4-8680-e6cb72b0aa8b,20.32,loads,True,MONTHLY,,,2025-11-11T19:56:46.577631,2026-04-12T23:49:46.169426,d9b40d64-7fe0-4895-abf7-0a1a88ea1d92,96fe481f-d0a2-443b-b5cc-aadb95d2abda
aa6f83a4-741d-42cb-8202-f19df6e2b14e,3dd270ee-41ef-47ed-98c8-22b2af21b4aa,d3d1c29a-f1f9-46d1-bd15-d62e528334f9,2025-06-23T00:04:14.723531,,Finish suggest federal policy all technology hundred. Follow stuff analysis visit. Four back rate sort population also outside.,2025-06-23T23:13:24.220978,2025-06-28T23:13:24.220978,CANCELLED,Manage herself fly line officer smile.,Millerfort,GPS,-86.1010805,-49.182453,16660.8,"3 days, 0:00:00",LOW,a3c01c7f-ca81-4827-9505-c5ce4bd909ec,4e7fc312-7d39-40c4-8680-e6cb72b0aa8b,99.22,gallons,True,MONTHLY,2025-06-24T20:27:04.786275,Safety concern,2025-06-22T18:22:50.744864,2026-04-12T23:49:46.169618,4e0cf183-03ac-4fc7-958a-c3c286eedc47,e7ff1391-42b8-4ec1-80e4-dfce349e5065
7e0b66dc-7ab3-430a-bbc0-2b2b6827f3ff,600ad80b-c837-4db6-b132-5c5f8b995ef6,d2da7803-13a5-4798-9361-17fc24fad9ff,2024-10-22T07:12:34.380733,,Minute different fish and their window personal. Drug during paper there tax. Raise herself everyone option. Agency care official first capital send party.,2024-10-23T15:19:45.980210,2024-10-25T15:19:45.980210,ASSIGNED,New deal of method. Upon tend style trade certain heavy with. Nearly both modern community share.,Nicholsonport,GPS,-41.6644765,177.290302,20605.09,"3 days, 0:00:00",HIGH,43ba865c-66cd-4386-afe3-40990265f0a5,ba2aec32-4f9f-4149-8dcb-c98d113c1dd1,85.67,gallons,True,DAILY,,,2024-10-19T19:46:50.431881,2026-04-12T23:49:46.169807,1d982bdf-d176-421b-9f1a-e2ca2efa2a0d,c2460bae-3fee-4559-8d17-55700f98cf2a
5c6e9fd5-07bc-4556-b770-c8a5abb1d764,ad31d7e7-9a34-4eb1-8030-317d6d9d1a4d,29689696-7a26-4c08-8f61-b3d86c203be7,2026-04-06T12:20:24.622525,,"After factor help authority grow carry to.
Human type once ground. Great note themselves boy nothing address follow.",2026-04-07T17:45:12.650677,2026-04-12T17:45:12.650677,CANCELLED,"Especially significant never special add before.
Their tree boy hard.",Henrystad,GPS,89.0101635,-116.898786,42569.02,"1 day, 0:00:00",HIGH,3343f424-98c3-4281-aea8-ca3705a6031f,19e95c4f-f46c-4431-bab6-f5797bcd52f8,83.49,hours,True,WEEKLY,2026-04-08T00:59:42.392347,Safety concern,2026-04-05T15:24:22.391018,2026-04-12T23:49:46.170005,f2b62cd8-b510-4c2f-95ec-d51705341ef4,9c02f61d-07b5-468c-88a5-5abf61e3eca9
35b1122b-78c1-4069-bbda-53ccb590480d,62aab707-f2c5-4283-86fb-7bdb83f4ac9b,a0be935d-e8a0-460e-9e83-b7480a847df3,2025-12-31T07:50:06.558454,,"Market fast city. Ability court yes light. Something activity blood focus usually.
Capital perhaps serve card town. Sell maintain defense of detail.",2026-01-02T04:21:59.518018,2026-01-05T04:21:59.518018,REJECTED,Crime high along sort recently challenge set. Cut author study seven include television include.,New Samuel,GPS,65.884435,-32.626615,14457.56,"3 days, 0:00:00",HIGH,5bac6ecc-7104-4ea1-ad26-42664373e19e,73148b49-8f75-4090-8b7e-23d5ea575b39,97.58,loads,True,WEEKLY,,,2025-12-30T22:14:01.236199,2026-04-12T23:49:46.170194,1d2b8da5-d8ea-4eb4-80c6-7bfc8d045b52,161d43b5-6d50-4e4f-9b60-c958eacae789
279c4850-6854-49b9-b378-c76fe59e7b59,9deb59e9-2b41-4fa0-b272-fa2b3dc749de,088edccc-2f3d-4fae-874a-0a4ed06779c6,2024-08-05T19:54:15.141576,2024-08-09T16:41:13.710289,"Series group authority stuff product. Minute your church participant official reduce natural attack. Then according wide speak nor be like.
Offer reach cost maintain.",2024-08-07T16:19:12.593099,2024-08-09T16:19:12.593099,COMPLETED,Board study growth experience way. Throughout from why outside contain vote avoid.,Lake Jenniferport,WELL,78.3623415,126.524583,28563.62,"1 day, 0:00:00",HIGH,6b2f79d6-d6d0-4041-8e07-26bcf5b0c7e2,1fa126ef-30c4-4cf2-9294-a6d23c75936f,90.63,hours,True,WEEKLY,,,2024-08-05T04:41:57.952636,2026-04-12T23:49:46.170378,5fe22bd3-dd39-453f-a024-1ccba429e793,423a0457-a3cb-4af9-94f8-ccd34897ee41
ce3023e8-8102-4793-ab5c-acef7a760721,600ad80b-c837-4db6-b132-5c5f8b995ef6,d2da7803-13a5-4798-9361-17fc24fad9ff,2024-06-12T19:12:21.940146,2024-06-19T04:11:40.257452,Marriage area rock green. Fly some attack concern argue. Sport institution between series effort control old.,2024-06-13T07:54:40.465840,2024-06-17T07:54:40.465840,COMPLETED,Go effort character recently. Travel must thank realize. Church build foreign democratic.,West Margaretstad,ADDRESS,-7.173863,-57.120274,7304.21,"2 days, 0:00:00",HIGH,43ba865c-66cd-4386-afe3-40990265f0a5,ba2aec32-4f9f-4149-8dcb-c98d113c1dd1,46.42,visits,True,DAILY,,,2024-06-12T11:27:27.443728,2026-04-12T23:49:46.170558,a0629d6a-0118-4c7b-85e6-c71a346f3c79,fc5a4af2-e2e1-4dfe-835c-fa6d2012dbb2
d8b4207f-2044-44fa-a03e-a9545adf9a3a,0709cc65-6c9f-4f4d-8ae3-f0bbc2a2a1a8,ac5b1c50-7bd0-4ab9-ae40-7f1e992ad093,2026-03-04T11:37:30.730890,,"Such role night couple long network short. Or it class under.
Near buy check assume real program. Rather spend human outside late represent.",2026-03-06T00:48:14.933647,2026-03-08T00:48:14.933647,REJECTED,Song entire carry game top run section memory. System develop institution writer section.,East Noahside,ADDRESS,-60.669452,116.77969,23967.83,"3 days, 0:00:00",MEDIUM,20d17604-106d-416e-b623-92bcea21b9ec,1fa126ef-30c4-4cf2-9294-a6d23c75936f,43.42,gallons,False,,,,2026-03-04T01:10:26.729669,2026-04-12T23:49:46.170774,fa09f833-c5ce-4f2b-8b35-695221cc7c23,b3138dd4-4cd6-43f9-a55b-14f1292efad3
9130ca93-caec-4ad6-b962-9ca5d93b09ee,62aab707-f2c5-4283-86fb-7bdb83f4ac9b,088edccc-2f3d-4fae-874a-0a4ed06779c6,2025-02-07T14:28:11.708403,,"Who money game second operation truth. Ability happen wife measure.
Its recognize few stage. Deal pattern most mind. Activity administration career bank decide consider TV.",2025-02-09T07:08:50.500846,2025-02-11T07:08:50.500846,CANCELLED,A agency teacher expect heavy. Apply market my west door.,New Garymouth,WELL,-22.355916,158.450007,35800.73,"2 days, 0:00:00",HIGH,6b2f79d6-d6d0-4041-8e07-26bcf5b0c7e2,73148b49-8f75-4090-8b7e-23d5ea575b39,86.0,days,False,,2025-02-08T09:13:52.143646,Resource unavailable,2025-02-06T11:48:52.674222,2026-04-12T23:49:46.171046,516bb09c-c38a-4256-9a28-5a7166886f95,66f7c067-b72f-4add-bb14-f4320c8a5bc4
27a6a68e-a8e5-4a88-bd29-bd880ad320b8,9deb59e9-2b41-4fa0-b272-fa2b3dc749de,29689696-7a26-4c08-8f61-b3d86c203be7,2025-05-28T06:46:56.177269,2025-05-31T00:19:38.151822,"Both south half thought. Early easy blue try list notice.
Challenge with traditional traditional big. Ago heart poor real form director cultural. Rate outside door dinner.",2025-05-28T13:11:44.071216,2025-05-29T13:11:44.071216,CLOSED,"Son increase around will easy.
East total inside address maintain least.",East Jon,GPS,45.2506625,24.576843,25753.54,"1 day, 0:00:00",LOW,e8c8c122-0036-4c3c-a569-ea1b7cc604fb,1fa126ef-30c4-4cf2-9294-a6d23c75936f,44.93,loads,True,MONTHLY,,,2025-05-26T08:02:56.691362,2026-04-12T23:49:46.171238,a15b43e2-d9ff-44b8-a875-5c98702ffac7,31f766fc-c67f-4a9a-9ca0-0e635735ee21
371d99bc-df08-4b47-bf08-8a5b01f0605c,ad31d7e7-9a34-4eb1-8030-317d6d9d1a4d,d3d1c29a-f1f9-46d1-bd15-d62e528334f9,2025-05-31T11:59:14.818856,,"Computer address partner instead.
Cut remain marriage professor reach pattern. Industry rather picture enough station discussion walk. Thus check reality explain.",2025-06-01T14:13:15.416770,2025-06-05T14:13:15.416770,HALTED,Shoulder according better main Congress daughter. Card lay authority dream nice involve wonder.,South Ana,ADDRESS,-13.579308,-142.384139,14977.2,"1 day, 0:00:00",MEDIUM,14f71232-c064-4b7b-94b5-f2dc7966d2ff,19e95c4f-f46c-4431-bab6-f5797bcd52f8,57.19,days,True,MONTHLY,,,2025-05-30T13:47:19.154630,2026-04-12T23:49:46.171454,1ce23af8-1604-4780-8f40-d972f6f11465,f1cde1e8-85e4-412f-8f16-494b6e2204c7
70323b71-907a-4447-9507-49fe1e500d4d,1d7e9e8f-40be-49dc-9672-3aa65ee2f0d0,4ec8e0e9-3415-4edc-8390-bb350c4d0b20,2024-07-07T16:37:39.216103,,"Thus theory include television discussion always. Thousand already glass control.
Deal laugh north meet dinner standard. Main industry case these indeed water. Assume life four new behavior far can.",2024-07-08T15:02:49.892695,2024-07-09T15:02:49.892695,HALTED,Turn wear money way wife. Well beat glass say. Level decade goal southern ok.,North Mariahview,GPS,22.0442005,103.946902,12250.14,"1 day, 0:00:00",LOW,e9a9542b-1a69-4849-8bd7-5f03059a47ee,4e7fc312-7d39-40c4-8680-e6cb72b0aa8b,46.94,days,False,,,,2024-07-06T13:40:14.795556,2026-04-12T23:49:46.171647,93b06b0e-9196-456a-9057-69f54cd51f99,4f8f21ae-40b0-4e39-96f6-90e0216ce988
6b32e14c-fa6c-408d-90f7-6ae8bc9a55a5,1d7e9e8f-40be-49dc-9672-3aa65ee2f0d0,6bb8f685-7691-4a60-88bb-50753e20ce29,,,Risk dinner available model current weight would offer. Society receive reality care everything. Maintain sound and everything let.,2025-07-17T17:43:03.087444,2025-07-19T17:43:03.087444,UNASSIGNED,Single debate region sure. Everyone represent step cold structure. Room student bit order.,Mitchellton,WELL,-86.6716945,-91.337622,13426.42,"1 day, 0:00:00",HIGH,a0de8f0e-86b9-4bf3-af25-6fe76a535177,4e7fc312-7d39-40c4-8680-e6cb72b0aa8b,7.48,visits,False,,,,2025-07-16T12:37:47.733426,2026-04-12T23:49:46.171869,efbbf6ce-7124-4379-b4bd-cdcd4243004d,f53435a0-0d94-4b5f-9ae2-8feeba9d8177
