work_order_id,assigned_vendor,client_id,assigned_at,completed_at,description,work_order_name,estimated_start_date,estimated_end_date,current_status,comments,location,location_type,latitude,longitude,estimated_cost,estimated_duration,priority,well_id,service_type,estimated_quantity,units,is_recurring,recurrence_type,cancelled_at,cancellation_reason,created_at,updated_at,created_by,updated_by
a35771c4-4779-4ee4-95b3-8a11333eb105,d8cec599-00d6-4641-bcf6-6aae6d798d2b,22b09298-43b0-48bb-8958-0cff8a7e1a91,2026-04-11T15:07:37.661359,,"Indeed drug music animal much. White listen produce soldier enjoy front. Main paper ball civil.
Must station force. Under baby this land option.",WO-19888,2026-04-13T14:44:23.859150,2026-04-14T14:44:23.859150,IN_PROGRESS,Music health increase sell rest. Table relationship final wind.,Davidshire,GPS,-49.8756565,-165.766171,35072.25,"1 day, 0:00:00",HIGH,235632f0-1c0e-4954-9584-bd3027642d49,ce8f766e-041c-4139-8e39-0beb4382b441,56.09,loads,True,MONTHLY,,,2026-04-08T23:54:02.609808,2026-04-15T19:08:41.194954,93c7e15c-67d9-4386-97a9-4b49883415e0,0d66b4ee-dcf0-47b1-8d02-5d68dedd8b47
696043ce-c708-4362-b1f1-93a9466f843e,e9f75d4b-f495-4b3b-b961-6e5fcc86158c,88c511c2-8c1e-442c-9ed1-d5017c094726,2024-05-17T19:59:05.003372,,Rest show usually unit although wish. Play nor cut civil machine forget.,WO-10900,2024-05-18T15:05:27.306930,2024-05-21T15:05:27.306930,REJECTED,Usually a after time section human support. Night meet memory image either really try.,Jonesshire,ADDRESS,34.5532265,32.134997,14014.15,"3 days, 0:00:00",MEDIUM,9cb07870-85f9-47ce-8750-c33cce2f82a1,4e78a7e9-49e1-48b7-9800-4a1c34bc9afe,34.82,visits,False,,,,2024-05-16T20:31:55.645184,2026-04-15T19:08:41.195402,bd3a47b1-a126-49ae-b3d6-5cbce5da3e65,3747b7be-fa6b-42e8-b628-5e1a200e7a82
3028dda6-4303-469b-a6f5-84e0714586a3,a729f017-ee54-49b2-b16f-e5d33223b156,22b09298-43b0-48bb-8958-0cff8a7e1a91,,,"Eye paper skill defense. Body protect shake. Third and just senior trade final after.
Wrong travel enter bring sea. Lay service try.",WO-03751,2025-09-23T04:30:32.953714,2025-09-28T04:30:32.953714,UNASSIGNED,Here night say reason. Rate nice try couple responsibility purpose there.,Lake Carolineshire,GPS,-68.271783,-39.045823,33798.97,"2 days, 0:00:00",HIGH,63fa96ab-3138-4fbd-8793-9de345ba3338,ce8f766e-041c-4139-8e39-0beb4382b441,89.63,visits,True,ONE_TIME,,,2025-09-18T15:32:36.431691,2026-04-15T19:08:41.195760,2b8b49ea-cab0-4932-9b24-710e9f0077b6,60dd7573-c7dd-4fb1-9bec-1d29a37743dd
c803f943-0add-45bb-a0f1-0d38653b0a9c,d8cec599-00d6-4641-bcf6-6aae6d798d2b,34dcbc1a-d3ab-4c1e-ae41-74bce2f7ad66,2026-01-23T16:46:33.082903,2026-01-25T06:22:59.580732,"Office door account similar hold even. Around social perhaps face eight question onto.
Fine side audience carry policy. Mean program ability later east.",WO-56862,2026-01-24T21:04:54.665230,2026-01-25T21:04:54.665230,CLOSED,Pay well poor southern. Southern least adult white him.,New Cynthia,GPS,64.560112,178.048189,41459.61,"2 days, 0:00:00",MEDIUM,d55c45ae-54d5-4599-8a82-1c5543fdace0,ce8f766e-041c-4139-8e39-0beb4382b441,18.54,hours,False,,,,2026-01-21T22:08:45.722438,2026-04-15T19:08:41.196090,884fd190-2b31-4295-b366-79aef9c0ba98,3da455eb-70d2-4112-809c-6c8ad0ee087f
2e7de400-9a3f-4fb8-935c-6cb4afe87c09,c46d5c72-fd67-4f18-8924-a3d1249f4dfb,22b09298-43b0-48bb-8958-0cff8a7e1a91,2026-04-15T18:53:42.989086,,"Approach let age fill. Recently reach land can themselves. Gun degree citizen successful.
Next choose standard several claim. Front international six fight.",WO-95418,2026-04-15T18:54:56.276671,2026-04-18T18:54:56.276671,IN_PROGRESS,Article once black analysis. Realize after sense describe. Hair amount much.,Petersonland,ADDRESS,71.8673175,-67.15647,9979.83,"3 days, 0:00:00",HIGH,23c1d054-abca-4124-84e9-eaadcf5e7693,d24895a1-476d-492f-9608-a5fa43530a07,31.01,gallons,False,,,,2026-04-15T16:58:08.215875,2026-04-15T19:08:41.196476,032716f2-6f9f-4fed-b822-06ecee89b8fe,0833871b-b48d-4374-9b49-950b434dc9f1
cf2c54f5-a914-48fc-a0c5-5fc93b77de11,c46d5c72-fd67-4f18-8924-a3d1249f4dfb,22b09298-43b0-48bb-8958-0cff8a7e1a91,2024-07-27T19:40:27.557749,2024-07-31T17:02:16.061273,"Evidence teach several community interesting around which great. Meeting bill ever natural away.
Section room red professor. Thing last determine computer anything operation military.",WO-65858,2024-07-29T05:39:27.293694,2024-07-30T05:39:27.293694,COMPLETED,Think issue green type picture home whose. Only attack put they now despite agreement each.,Staceystad,WELL,7.6603335,-127.989424,5991.85,"2 days, 0:00:00",HIGH,23c1d054-abca-4124-84e9-eaadcf5e7693,d24895a1-476d-492f-9608-a5fa43530a07,50.53,gallons,False,,,,2024-07-26T17:47:10.016976,2026-04-15T19:08:41.196847,12afcf9a-0b54-412d-976b-29d8d54ca147,258ea314-4092-4b0e-9780-6eb2719f74cd
39b2b6e4-8df5-4ea5-a2a5-475559e704f3,a729f017-ee54-49b2-b16f-e5d33223b156,2697e244-3ffd-4132-b5d7-a30cb0b44073,2024-05-18T10:41:30.396545,,But miss somebody paper high bit head. Part ask author me street or tough. Role think medical politics. Serve collection their control hospital hear.,WO-19471,2024-05-20T01:24:30.094007,2024-05-22T01:24:30.094007,ASSIGNED,Western daughter wife bank case. Say position evidence worry. Side at author reality seven.,Smithshire,GPS,65.738232,88.235958,9996.65,"3 days, 0:00:00",LOW,7e17d15e-235e-40dc-b066-f0e289eaf84d,4e78a7e9-49e1-48b7-9800-4a1c34bc9afe,99.2,days,True,WEEKLY,,,2024-05-15T15:40:17.044296,2026-04-15T19:08:41.197300,c85d571e-2661-4032-b580-95aee749c656,f2ca2813-a737-4af1-9adc-1fca73f2864a
f21bf847-555d-48d1-b1f0-03cfaf0eb531,a80bb39a-c58e-45c1-b533-bac9d8013fa0,34dcbc1a-d3ab-4c1e-ae41-74bce2f7ad66,2026-04-15T16:24:42.249496,,"Everything according together in seem lot.
Reality picture establish important ready country. There toward wall send example. Single store sit.",WO-72527,2026-04-15T17:03:23.640221,2026-04-16T17:03:23.640221,ASSIGNED,Raise million cold. Themselves young young continue director work.,Anthonyburgh,GPS,30.0663435,59.415094,42294.91,"2 days, 0:00:00",MEDIUM,353f25dd-07d2-4d3c-9ad5-1b5e5ec00c0b,509beb3f-897a-4f8d-9d3a-fd081e1f4600,13.05,days,False,,,,2026-04-15T03:41:48.079724,2026-04-15T19:08:41.197692,4706dc98-8f58-4fce-8004-8db847ff0e79,d5c8358c-5296-4e79-9e12-fbb7d89d8609
30e0db3d-5e7e-4943-bc00-f33656947202,c46d5c72-fd67-4f18-8924-a3d1249f4dfb,22b09298-43b0-48bb-8958-0cff8a7e1a91,2024-10-16T11:00:29.714418,,"Military man book until thought. Month management rather make friend class.
Property without traditional almost figure plant Democrat wife. Whole yourself could question.",WO-94919,2024-10-17T14:48:20.095762,2024-10-21T14:48:20.095762,HALTED,Huge industry director spend. Society special owner best. Rule here common paper less.,Port Royview,ADDRESS,42.620224,32.998956,16153.98,"2 days, 0:00:00",LOW,23c1d054-abca-4124-84e9-eaadcf5e7693,cad184f7-eb41-4fb5-8d99-23e0d00e60e3,34.14,days,False,,,,2024-10-15T06:31:45.367650,2026-04-15T19:08:41.198083,fdd671ae-3a78-43d2-b83d-fa13d91a7364,5fb1c3cf-9254-410f-a539-997472160b8d
d3e32305-fd01-4f2a-b6a9-5d7bb306cf05,a729f017-ee54-49b2-b16f-e5d33223b156,664eb1f4-0f02-4b63-aab2-9855a3767b74,2024-12-21T10:08:02.079079,2024-12-24T23:23:58.242347,"Through leader sound give customer eat very including. Democratic few over instead former free mother.
Suffer order write main already. Interview impact science hair several base event.",WO-29083,2024-12-23T06:41:19.334620,2024-12-25T06:41:19.334620,COMPLETED,Reduce read method language. Though enjoy standard model join.,Jeremyshire,WELL,59.277599,68.196812,15884.89,"3 days, 0:00:00",HIGH,b8674859-f3b6-4e2e-a352-b90bc8865c53,d24895a1-476d-492f-9608-a5fa43530a07,10.58,visits,False,,,,2024-12-18T11:46:25.765566,2026-04-15T19:08:41.198448,3e0295e1-8cab-45cd-b306-c688ebfe6f94,15f2d26c-6d66-45fe-b2d4-86c254c5ae67
11432a7c-c593-4999-a70e-9a51896cbc17,54f29160-579c-4454-afea-3f90f630d4bd,22388918-384a-4cdd-b3c6-3f32ffe72d8c,2024-10-22T07:49:41.568361,2024-10-24T02:45:46.016381,"On talk one federal. Move five small suffer trip eye hospital find. Thus financial father bank.
Model forget successful soon. Poor training power air boy sea generation.",WO-99726,2024-10-23T00:39:49.080353,2024-10-25T00:39:49.080353,CLOSED,Present apply author network. Kind apply up similar say grow.,Charlesburgh,GPS,-68.396604,-100.212761,26223.91,"1 day, 0:00:00",LOW,d928f53c-1897-4872-8391-73c1d75cc721,ec85f926-f00a-4d57-8835-f1f452018492,77.8,days,True,WEEKLY,,,2024-10-19T20:54:18.644427,2026-04-15T19:08:41.198807,3747b7be-fa6b-42e8-b628-5e1a200e7a82,3e0295e1-8cab-45cd-b306-c688ebfe6f94
2abd222a-17ab-4a26-a3ed-d08388d42864,54f29160-579c-4454-afea-3f90f630d4bd,cb02ddbf-6d9b-4525-a9bb-805fbc0b6fc7,2024-09-30T09:42:46.781497,,Serious amount hot less difficult. Hot Republican so high. Early west million this. Around fly bill such class per exactly.,WO-78953,2024-09-30T11:23:22.368916,2024-10-01T11:23:22.368916,ASSIGNED,Peace she sometimes party among. Usually themselves number decade her again.,South Justinfurt,WELL,-58.7955355,-101.301493,16007.33,"3 days, 0:00:00",LOW,efefab16-8d7c-44bb-bae3-c4dffb79f2ca,ec85f926-f00a-4d57-8835-f1f452018492,78.48,hours,False,,,,2024-09-28T16:42:36.613884,2026-04-15T19:08:41.199230,e1a30b49-5bc6-426d-8c8a-8096a01befdc,a20903ec-784f-4bcc-866b-7286b78d7218
6ea6a296-1c06-4f0e-b0bb-7f3996ad3039,d8d8da12-0220-4369-b5b0-535c355a22c7,0b6bcfd3-35f2-4765-a6e6-645e93130da5,2024-05-15T07:47:24.306374,,"Hope real see decide crime relationship. Decade people someone specific. Decision around exist sense.
Discuss organization will number. Tough few Mr none.",WO-29299,2024-05-16T00:00:23.946860,2024-05-17T00:00:23.946860,CANCELLED,Choice agency doctor know season fly listen environment. Product threat any.,New James,ADDRESS,-26.871675,52.846904,15098.38,"2 days, 0:00:00",MEDIUM,b45e3f6a-2091-47b1-8e00-2392698cb981,ec85f926-f00a-4d57-8835-f1f452018492,10.49,visits,True,ONE_TIME,2024-05-15T23:27:56.260237,Client cancelled request,2024-05-12T19:32:42.200423,2026-04-15T19:08:41.199590,b84577c3-e9b1-4bdf-a798-b15525cd0144,893e5978-1355-4522-9dc9-6684eb2bf5ae
be4a26e7-8303-4c7a-be75-74a5a56b594f,d8cec599-00d6-4641-bcf6-6aae6d798d2b,747ad838-966c-42f7-b322-a9a9b71b627d,2025-09-23T20:36:12.795182,2025-09-26T17:14:14.889521,"Federal walk exist pull. Paper those thousand inside. Movie measure population activity record participant.
Sometimes throw official clearly. As per sea often treatment.",WO-10883,2025-09-25T12:37:15.599645,2025-09-29T12:37:15.599645,CLOSED,"Economy fund magazine catch our. Begin many former enjoy see.
Democrat candidate prove couple.",Port Kevin,ADDRESS,3.4684685,-155.268542,32720.61,"3 days, 0:00:00",LOW,6ee4767b-5962-4350-a930-007daf980b05,ce8f766e-041c-4139-8e39-0beb4382b441,45.95,loads,True,WEEKLY,,,2025-09-21T14:48:23.225090,2026-04-15T19:08:41.199937,12afcf9a-0b54-412d-976b-29d8d54ca147,f4484d67-349f-4088-b391-d430c9111260
f20ebf69-5070-45e0-b42a-db9cfd838f53,e9f75d4b-f495-4b3b-b961-6e5fcc86158c,cb02ddbf-6d9b-4525-a9bb-805fbc0b6fc7,2024-11-28T15:05:35.584988,,"Several interest night example at nature. Skin street TV particularly beautiful light into.
Reduce none indicate rich after color. Manage soldier national because we read three as. Money way general.",WO-50849,2024-11-29T00:51:13.788742,2024-12-04T00:51:13.788742,ASSIGNED,Listen trouble trial call. Service look style. Stock next state former camera difference close.,East Mark,WELL,-83.696372,54.419813,18091.87,"2 days, 0:00:00",HIGH,efefab16-8d7c-44bb-bae3-c4dffb79f2ca,4e78a7e9-49e1-48b7-9800-4a1c34bc9afe,62.46,gallons,True,WEEKLY,,,2024-11-26T13:38:20.226225,2026-04-15T19:08:41.200280,55830a82-8c81-494a-bc36-bd4efa4cdf52,7fcb323c-8e16-49bd-b607-03f3380a7c85
655906f9-f955-4764-89d7-e28be8e3472b,cd79ed9d-99fc-4878-bbcb-3b3df59226f9,88c511c2-8c1e-442c-9ed1-d5017c094726,2024-08-15T21:42:54.156354,,Today throw voice themselves most cold yet. Enough herself find. Stuff detail require once both sell.,WO-81815,2024-08-16T01:41:01.124587,2024-08-21T01:41:01.124587,CANCELLED,There order effort box cold boy. American law toward upon ever.,Port Daniel,GPS,28.4565235,-50.294994,23741.43,"3 days, 0:00:00",MEDIUM,5ce11006-bd6f-4dc6-b623-df4f52e60dad,4e78a7e9-49e1-48b7-9800-4a1c34bc9afe,29.82,hours,True,DAILY,2024-08-17T12:39:36.861284,Resource unavailable,2024-08-14T23:22:48.073126,2026-04-15T19:08:41.200683,bd8e9837-1d09-43ca-a582-54ddfa3c71b5,14241f36-79b8-47ec-89d0-b08e7c14cb17
a8e40c5a-9598-4598-940a-668c77b71436,a729f017-ee54-49b2-b16f-e5d33223b156,2697e244-3ffd-4132-b5d7-a30cb0b44073,,,"Data believe grow practice drop pattern. Tell fly big word capital worker stay. Beyond continue produce effort age today.
Care off management.",WO-02642,2024-11-20T11:47:25.880058,2024-11-24T11:47:25.880058,UNASSIGNED,One the remember father hold. Vote remember themselves make practice.,Joycemouth,GPS,-88.503319,-45.240825,32207.46,"1 day, 0:00:00",LOW,7e17d15e-235e-40dc-b066-f0e289eaf84d,4e78a7e9-49e1-48b7-9800-4a1c34bc9afe,34.81,visits,True,DAILY,,,2024-11-17T10:57:57.638880,2026-04-15T19:08:41.200983,568dac46-fb4b-459b-9ef3-a0ff4e52b48e,55830a82-8c81-494a-bc36-bd4efa4cdf52
3858a9bd-6918-461e-880b-f0025031576f,83853f5e-c1cc-4f0c-8566-d798f4b3342e,cb02ddbf-6d9b-4525-a9bb-805fbc0b6fc7,2025-11-07T12:45:04.824288,,"Despite perhaps new gun note.
Real might fall determine. Trade deal window piece action participant dinner. Anything blood reach.
Parent audience poor actually general.",WO-88161,2025-11-07T21:48:38.545913,2025-11-10T21:48:38.545913,CANCELLED,President ok force middle task ahead difficult. Travel business herself give.,Port David,WELL,-73.7470415,-12.396134,43867.22,"1 day, 0:00:00",MEDIUM,3a12c4b6-6890-4dc5-8834-5d76d06eb20c,d24895a1-476d-492f-9608-a5fa43530a07,22.72,hours,False,,2025-11-09T00:15:32.771603,Weather delay,2025-11-04T22:17:38.655971,2026-04-15T19:08:41.201334,17639e07-940d-44a0-959c-723105c25fd9,a1e70a42-693c-4e55-b989-ce1799037c10
f1c5de22-c496-4310-8221-498b5ec15c49,a80bb39a-c58e-45c1-b533-bac9d8013fa0,0b969507-30c4-4933-b465-af089dff16bd,2025-06-16T10:25:18.881157,2025-06-21T01:24:22.590071,"Civil good near. Congress happen until close return easy ahead between.
Result role stand second skin. Dog might report listen maintain. Tough animal of prevent market.",WO-13354,2025-06-18T04:43:50.658157,2025-06-22T04:43:50.658157,COMPLETED,Someone easy arrive television focus. Sense seek hospital fact near top. Take position leg lawyer.,Lake Jonathonshire,ADDRESS,-89.9716245,95.146061,40459.93,"2 days, 0:00:00",LOW,06c21883-e7e4-40df-ad7c-3adfdef4680f,509beb3f-897a-4f8d-9d3a-fd081e1f4600,40.63,hours,False,,,,2025-06-15T17:12:33.820567,2026-04-15T19:08:41.201697,0c327cd1-5c9a-4890-8c0d-adcdb749ac1e,94514a2b-9e7a-49e9-a207-f4f29017485d
48915749-a561-4872-bb49-b41f8bf33de2,cd79ed9d-99fc-4878-bbcb-3b3df59226f9,2697e244-3ffd-4132-b5d7-a30cb0b44073,2025-09-29T21:01:43.187051,,"First laugh health give threat. Change he maintain that work little ready discover. Suggest cut sense discover born.
Hour apply art tell part. Most south either sign those type.",WO-89740,2025-10-01T09:52:10.451346,2025-10-04T09:52:10.451346,IN_PROGRESS,Difficult difference where rule hold six. Our receive case human society event offer.,Lake Kelsey,GPS,59.131825,132.348538,2673.29,"1 day, 0:00:00",LOW,f731c822-cfd9-4152-89e9-9aeb543bb53a,4e78a7e9-49e1-48b7-9800-4a1c34bc9afe,20.58,gallons,True,WEEKLY,,,2025-09-27T02:45:50.828688,2026-04-15T19:08:41.202123,d81a3804-59b5-41f3-b489-b93e92370f7c,60f36b8b-ad8c-47fd-b19d-6bc859f2a2ae
909001bc-1a0d-4e8a-b3a2-75b7ac6b2749,a80bb39a-c58e-45c1-b533-bac9d8013fa0,1e1a3fa3-d7a0-495c-ad54-0f31f5908345,2025-12-20T00:29:17.979740,2025-12-21T19:40:33.616575,Tell determine continue board we never. Score center poor team. Local detail science bring answer suddenly someone. Left federal sit in gas yeah already family.,WO-52736,2025-12-21T00:02:20.075685,2025-12-23T00:02:20.075685,COMPLETED,"So laugh happy.
Prepare every remember. Discuss matter anything at fish chance name.",Martinezhaven,WELL,-43.2450505,20.61574,42222.63,"1 day, 0:00:00",LOW,8af2a2bb-4d75-48e4-a390-8cd1de0a7e98,ec85f926-f00a-4d57-8835-f1f452018492,83.31,gallons,True,DAILY,,,2025-12-18T14:22:06.899405,2026-04-15T19:08:41.202565,92468648-c1de-42e3-a5a2-5f4a433260b7,0cfaafa1-b10c-4842-8a47-fa7f524732a7
5b037348-c16b-447f-a8aa-268a9c76b0aa,d8d8da12-0220-4369-b5b0-535c355a22c7,5eaf6aac-6102-4fca-9675-c7559ae63360,2025-01-30T06:46:34.178673,2025-01-31T08:03:31.899561,Political capital type ago color who quickly. Subject item win including begin.,WO-49857,2025-01-31T03:14:34.565645,2025-02-03T03:14:34.565645,COMPLETED,Like him protect appear civil agent try. Final candidate memory carry gas Congress. Own big yeah.,Moranside,GPS,-30.8658085,46.460029,43980.2,"1 day, 0:00:00",LOW,67c26f37-6a64-4887-8571-512e9e7e6bc8,4e78a7e9-49e1-48b7-9800-4a1c34bc9afe,15.3,gallons,True,MONTHLY,,,2025-01-30T01:50:07.730125,2026-04-15T19:08:41.203281,bf3f5689-35e4-40f2-ba04-83a18f336753,240ca425-cd24-45a1-8eaf-0bf4b20d6a06
1c9b7e8d-ca14-4b2a-8d21-5a692a176b80,cd79ed9d-99fc-4878-bbcb-3b3df59226f9,7f893179-b166-4b75-9111-d61e648bf526,2024-11-15T04:44:35.386880,,"Imagine memory pattern lot. Check why professional court tonight expert cultural. If federal speech. Matter hand more perform laugh outside on.
Our rock natural necessary campaign small.",WO-87858,2024-11-15T20:16:29.239822,2024-11-20T20:16:29.239822,REJECTED,"Out central soon somebody low.
Course provide sea four rest medical.",Cynthiaville,GPS,-87.8631605,-38.251722,38272.58,"3 days, 0:00:00",LOW,81ae6d72-ac14-417e-94b1-2ddb4b72a568,4e78a7e9-49e1-48b7-9800-4a1c34bc9afe,85.59,loads,True,ONE_TIME,,,2024-11-13T09:24:05.863656,2026-04-15T19:08:41.203803,98a6b2dd-aa7e-4ee7-927b-282eb727ece7,3bf2310c-f066-4b03-9367-cb1586f5fe71
8967d81e-71a0-465b-bb21-af8de838d35e,83853f5e-c1cc-4f0c-8566-d798f4b3342e,34dcbc1a-d3ab-4c1e-ae41-74bce2f7ad66,2025-10-05T16:45:38.207366,,"Throw recent raise.
National company traditional couple development no. Attack director teacher today as expect population. Light teach main college first remain.",WO-92476,2025-10-07T07:50:07.554463,2025-10-09T07:50:07.554463,HALTED,Event direction PM daughter also shoulder travel. Worry buy large majority even hospital student.,East Natalie,ADDRESS,-81.8040485,-44.151217,10857.26,"1 day, 0:00:00",MEDIUM,88eb5d60-9f8f-465b-8331-90a32a22bf84,ec85f926-f00a-4d57-8835-f1f452018492,79.31,days,False,,,,2025-10-02T20:51:26.695685,2026-04-15T19:08:41.204111,1efc5ce0-9974-4965-a662-f908e51752bb,e85d35d8-609a-4dce-9c9c-8ddf893eba9e
71c46d6f-2f3e-4eaf-b7ed-2779d355bd5a,d8cec599-00d6-4641-bcf6-6aae6d798d2b,22b09298-43b0-48bb-8958-0cff8a7e1a91,2025-07-28T16:04:59.163473,2025-07-31T08:18:46.509802,"Will many people create improve mean. Sign friend catch hard bring. Purpose yet Mr from myself material.
Here themselves population child. Interesting wide response movement kid information these.",WO-59713,2025-07-28T18:04:33.616282,2025-07-30T18:04:33.616282,CLOSED,Box watch candidate challenge. Range mind across collection defense picture foot.,Carolineton,GPS,13.881332,128.021826,26511.05,"2 days, 0:00:00",HIGH,235632f0-1c0e-4954-9584-bd3027642d49,ce8f766e-041c-4139-8e39-0beb4382b441,95.62,visits,False,,,,2025-07-26T07:20:45.840476,2026-04-15T19:08:41.204446,ad7c93b5-321b-4be8-a716-0d41608f7602,0ec52e81-a244-4f8c-8db7-8ff40b96ff17
c67567b6-6b24-43b9-9008-868aec491fc0,2a176a68-3d26-483d-b147-5cbd65c2dc42,747ad838-966c-42f7-b322-a9a9b71b627d,2024-05-21T05:21:21.788795,2024-05-25T15:24:26.480097,"Whether official eye policy name three should. How certainly hold. Number hand film.
Black not off adult. Somebody market material. Mouth time these.",WO-32533,2024-05-22T18:59:58.806950,2024-05-26T18:59:58.806950,COMPLETED,Mind night sit side sister ready. Serious institution main concern best.,Wolfetown,WELL,-71.062388,28.774601,11320.39,"2 days, 0:00:00",MEDIUM,9b2453da-5f8a-4de1-b3e3-58f4ecba97f7,ec85f926-f00a-4d57-8835-f1f452018492,57.57,loads,False,,,,2024-05-20T12:03:14.173460,2026-04-15T19:08:41.205172,9d7a29f3-cf4c-4ba3-b22f-4def6e56be65,f703d663-4ccf-4927-a223-c9936489fb40
5a304e5a-6407-45dc-9f3b-93bd36acc6a2,83853f5e-c1cc-4f0c-8566-d798f4b3342e,88c511c2-8c1e-442c-9ed1-d5017c094726,2025-11-18T13:05:55.776428,,"Three machine oil season discuss. Plant friend believe field wear hour land tend.
Film during concern push. Across field after citizen knowledge.",WO-67756,2025-11-18T13:16:05.364979,2025-11-20T13:16:05.364979,REJECTED,Time whom staff sign cut drug. Alone executive season image.,West Lauren,ADDRESS,33.898986,108.923777,25856.97,"2 days, 0:00:00",MEDIUM,e9759881-cc27-4303-8adf-2a3677236513,ec85f926-f00a-4d57-8835-f1f452018492,45.66,visits,True,MONTHLY,,,2025-11-18T06:21:32.565377,2026-04-15T19:08:41.205832,251d4540-f286-4f4b-8e3e-f414cd1d8d50,acf2da35-8edc-4f84-b344-542fcd7cde1e
f576d625-b01b-4fad-86af-3b2b9436ef01,54f29160-579c-4454-afea-3f90f630d4bd,747ad838-966c-42f7-b322-a9a9b71b627d,2025-10-13T11:24:52.486955,,"Citizen sign meet military compare. Similar plan person strong. Surface reveal window provide question make.
Man eight third require clearly. Power east catch way.",WO-69134,2025-10-15T09:55:38.022445,2025-10-19T09:55:38.022445,IN_PROGRESS,Service push audience share night another floor hot. Outside establish job feel.,Lake Anthonyburgh,WELL,-7.972466,68.590481,32445.07,"2 days, 0:00:00",LOW,1a5d40c8-1040-4259-8e0a-5aa64cfe10a1,ec85f926-f00a-4d57-8835-f1f452018492,30.16,days,False,,,,2025-10-13T04:59:44.186179,2026-04-15T19:08:41.206268,261857bd-0f2a-430e-994f-01364bcb2308,2c834cdd-36fd-47bf-ac81-9e2fbe46641b
2d5efcc7-cd16-4e7b-9411-a2f43d48f30c,d8d8da12-0220-4369-b5b0-535c355a22c7,7f893179-b166-4b75-9111-d61e648bf526,2026-01-07T08:52:44.907493,,"Simple design subject pattern lose more.
Local here return site manage. Treat control sign computer either lot find. Computer much man include.",WO-99481,2026-01-09T07:31:30.789742,2026-01-10T07:31:30.789742,ASSIGNED,Despite necessary stuff up case stage. Fund although everyone. Smile second we run politics shake.,West Virginiahaven,WELL,-23.919595,-92.449764,2394.93,"1 day, 0:00:00",MEDIUM,eec2d04f-b201-4d96-a8ea-7ebde78e5d1b,ec85f926-f00a-4d57-8835-f1f452018492,20.47,loads,False,,,,2026-01-04T16:34:16.142728,2026-04-15T19:08:41.206711,acbd888f-102f-4d02-97dd-b8621ea256dc,74daa82c-5aef-49be-b0fb-28c979bf742b
60482b05-e7c7-4fb1-9c2f-452ab822490b,d8d8da12-0220-4369-b5b0-535c355a22c7,664eb1f4-0f02-4b63-aab2-9855a3767b74,2024-08-03T01:10:23.257243,,"Blue myself hospital wife. Claim much project.
These behavior pass paper treatment thousand team. Product behind research necessary west various TV yard.",WO-45661,2024-08-04T00:39:01.745018,2024-08-09T00:39:01.745018,IN_PROGRESS,Value human population thus turn other. Film arm keep management into agree.,South James,GPS,-59.9815495,135.365862,14451.34,"2 days, 0:00:00",MEDIUM,b8674859-f3b6-4e2e-a352-b90bc8865c53,4e78a7e9-49e1-48b7-9800-4a1c34bc9afe,94.64,days,True,WEEKLY,,,2024-08-01T22:11:53.618959,2026-04-15T19:08:41.207035,fa4a204f-dd9c-44e4-aa91-149c33ec812e,443d0f23-084f-47c2-8427-395f2a3bf440
cf1a6b8a-dde4-4575-85f9-bdd4bee2fed4,c46d5c72-fd67-4f18-8924-a3d1249f4dfb,3beb826b-8167-463f-986b-7e430bbcefba,2026-01-04T12:06:40.686215,,House health site check little. Present fire old realize movie crime. Interest fast field difficult newspaper property third. Blood field letter offer your.,WO-94973,2026-01-06T02:01:53.700411,2026-01-10T02:01:53.700411,IN_PROGRESS,Compare specific here debate man. North someone company cover.,Jenningsstad,WELL,-78.6792875,-179.379169,23984.69,"3 days, 0:00:00",HIGH,e1636b14-49e0-4c43-9534-8dd19ed59b46,cad184f7-eb41-4fb5-8d99-23e0d00e60e3,78.81,visits,True,DAILY,,,2026-01-03T05:20:33.649805,2026-04-15T19:08:41.208053,88490d4d-e6cc-4857-98e0-a3bda8cb41c0,240ca425-cd24-45a1-8eaf-0bf4b20d6a06
8ca92128-8828-42fc-9f40-e68294691570,83853f5e-c1cc-4f0c-8566-d798f4b3342e,cb02ddbf-6d9b-4525-a9bb-805fbc0b6fc7,2025-02-13T05:55:34.475485,2025-02-19T12:20:59.066793,Toward anyone employee hear reason meeting. Move song peace change television tend. Adult his some.,WO-81796,2025-02-14T00:48:20.389388,2025-02-18T00:48:20.389388,COMPLETED,Ball its board dog. Hope gas difficult think southern.,Greershire,ADDRESS,-20.143085,80.310474,10874.45,"2 days, 0:00:00",HIGH,3a12c4b6-6890-4dc5-8834-5d76d06eb20c,ec85f926-f00a-4d57-8835-f1f452018492,3.98,gallons,False,,,,2025-02-11T03:52:24.130028,2026-04-15T19:08:41.208883,9a5cb869-1eea-419a-9b36-8e3e9a11d5bd,f0cd2ef8-b969-4da7-81ab-15590ca7754b
c83933a1-c0ec-4dff-ae9c-4987734428e7,54f29160-579c-4454-afea-3f90f630d4bd,2697e244-3ffd-4132-b5d7-a30cb0b44073,2025-05-08T03:50:54.807806,,"However serious worker next employee. Few yard life real few debate.
Sometimes provide level hard investment. Become while huge because color within.",WO-30904,2025-05-09T05:16:20.438559,2025-05-12T05:16:20.438559,REJECTED,Member house thus study over bar walk act. Single almost where hand. Sign civil dinner back.,Jonathanview,WELL,-82.6509565,34.730367,21573.11,"2 days, 0:00:00",HIGH,c5444841-5bde-48de-b7da-29b870e87bee,086a9247-2173-4fe0-8bc7-37f146dce3b7,54.22,loads,False,,,,2025-05-05T11:33:23.662339,2026-04-15T19:08:41.209627,c594e2db-f58a-473d-ab17-1c20f1addce9,d7b2d9f6-dbd7-468c-9c68-16522483e953
26b87edf-eb2a-49b4-9640-5e090548c7be,c46d5c72-fd67-4f18-8924-a3d1249f4dfb,cb02ddbf-6d9b-4525-a9bb-805fbc0b6fc7,2026-04-01T11:23:25.958716,,Really care then make. Red everyone music assume could visit. Give they read budget. Computer avoid boy lot evidence.,WO-32420,2026-04-01T15:30:18.864661,2026-04-04T15:30:18.864661,CANCELLED,Century beat write lose Congress issue. Him begin treat little.,Lake David,ADDRESS,64.93375,-52.345193,49018.52,"1 day, 0:00:00",MEDIUM,72dfe0e3-5cd5-47cc-b3bc-e3b8596b6e61,509beb3f-897a-4f8d-9d3a-fd081e1f4600,7.31,visits,False,,2026-04-02T03:58:44.451832,Safety concern,2026-03-29T18:16:24.388594,2026-04-15T19:08:41.210294,55830a82-8c81-494a-bc36-bd4efa4cdf52,d8f62e92-ffc3-49df-adff-15c3f649a28c
