id,assigned_vendor,client_id,assigned_at,completed_at,description,work_order_name,estimated_start_date,estimated_end_date,current_status,comments,location,location_type,latitude,longitude,estimated_cost,estimated_duration,priority,well_id,service_type,estimated_quantity,units,is_recurring,recurrence_type,cancelled_at,cancellation_reason,created_at,updated_at,created_by,updated_by
9947ae42-48ef-4bd2-b807-39375d006cb9,ab06f125-03cd-4efa-b705-80a382abe9d7,84e86518-3a3e-4445-8f1c-4328934ff3f3,2025-01-14T12:37:12,,Theory policy concern purpose social expert whatever. Yet economy spend energy imagine yourself indeed share.,WO-43320,2025-01-14T18:54:27,2025-01-15T18:54:27,REJECTED,Physical sit road hotel. Child cover assume director east add.,Lake Laura,WELL,-36.033594,17.967723,5072.65,"3 days, 0:00:00",HIGH,a75a517d-feb9-447d-9adb-b23cd88de375,cb49e5de-7799-42e2-98e8-44fad7981926,5.96,hours,True,DAILY,,,2025-01-11T23:39:01,2026-04-15T18:10:31.034439,f250fc97-1715-4049-98e4-35f25cae9d61,a355d021-f24a-4ac1-91ac-c79883b3d690
0f27684e-dbe3-40da-b7ae-0e3adc0c58a9,58f9dbaf-1659-4d39-9ffe-a44624472704,731e4fd5-b8ef-4d21-add8-632f22763d09,2025-11-25T15:05:52,,"Should success society industry newspaper event scientist argue. Ground miss bar production assume issue town.
Box book beat detail than relationship. Response international myself happen put.",WO-03843,2025-11-25T22:45:22,2025-11-28T22:45:22,CANCELLED,Member may leader different fine lawyer point. Need word send cup over.,Ruizfort,WELL,3.186382,65.180366,15924.12,"3 days, 0:00:00",LOW,054abf16-2d48-4ac2-96ae-1658db6e0fb2,af516e74-dbad-4474-9b38-fee85f1c5f93,23.95,hours,False,,2025-11-26T19:44:10,Weather delay,2025-11-23T23:06:30,2026-04-15T18:10:31.034960,390eb692-63ab-43a8-a156-6755e0b357bb,c67c476b-7981-4a89-a6e2-7f3f83528e17
56d37936-6563-4634-895f-ad31e7edb016,646727fe-d9d3-47f4-abd3-a0bbe4e4c1bc,f525d920-9583-480f-bd27-5dff2c94820f,2024-09-10T10:17:28,,"Treat with send act. Lot look investment push suggest. Your rich drop top.
Claim candidate alone mission hour cover may. Religious between whether go treat become.",WO-79200,2024-09-11T12:42:40,2024-09-13T12:42:40,CANCELLED,Maybe clear edge over employee often. Democrat prevent visit six base. Author up bill health.,North Conniemouth,WELL,-62.893482,-135.26899,3835.41,"1 day, 0:00:00",MEDIUM,64db6a55-8918-4153-82b2-49b26e782579,cb49e5de-7799-42e2-98e8-44fad7981926,81.91,gallons,True,ONE_TIME,2024-09-12T04:28:32,Weather delay,2024-09-10T06:05:25,2026-04-15T18:10:31.035390,9ce0ee64-fe95-4e98-a6de-887ccd408db9,180d9e88-da10-4dc9-89d8-f502e45afd6f
764fe910-e62f-4525-a920-38e1edd0d5ed,ab06f125-03cd-4efa-b705-80a382abe9d7,fb7640ea-e12f-44b2-a4e1-18957b81adb3,2025-08-10T20:47:05,,Tree with voice I build series. Individual far Republican fight these medical before. Policy send popular law rest born.,WO-25632,2025-08-12T05:02:23,2025-08-14T05:02:23,IN_PROGRESS,Onto attention animal prepare.,Toddshire,ADDRESS,-19.7784525,-114.143071,39451.96,"2 days, 0:00:00",LOW,7b14f2f2-2f53-433e-bdac-8b20cd4db741,16c270b4-3b14-467e-9cc3-879f37e9a5db,76.87,days,True,DAILY,,,2025-08-08T05:37:34,2026-04-15T18:10:31.035786,62cb05f6-ae44-4ed6-9044-2ecdc928068f,11d8621a-1446-48a2-8f95-38847ccab4f5
1795b3ac-cf1e-4bdb-b47e-f66df82d0bdd,faa66382-4806-43a8-8a5d-ac3393c400fd,84e86518-3a3e-4445-8f1c-4328934ff3f3,2024-07-29T08:36:27,,Detail there protect management realize street different. Each daughter owner religious population add.,WO-21477,2024-07-30T09:55:19,2024-07-31T09:55:19,IN_PROGRESS,To teach thank.,Hendersonmouth,GPS,-34.32596,-159.024623,12475.32,"3 days, 0:00:00",MEDIUM,26674d61-d034-4f7e-8a6f-7303b6c6ec24,11140ee8-eb7c-4db8-bf89-1b9b4dec4035,57.81,loads,True,DAILY,,,2024-07-27T05:40:07,2026-04-15T18:10:31.036170,c353389d-a432-4ee8-8c3e-88fbcdc340c5,3c70ab3a-f606-4132-a173-4533a76603b6
631d3ab1-3469-44e0-8443-5991a9ee77ad,174a76cb-9bbd-48fa-82c3-f88bcdf4c7aa,f525d920-9583-480f-bd27-5dff2c94820f,2024-07-14T13:19:44,,"Usually others population entire.
Yourself its collection drug view. Much alone quickly. Build despite down himself so itself.
Television true security much billion.",WO-50571,2024-07-15T23:48:09,2024-07-20T23:48:09,IN_PROGRESS,Take employee seem computer place. Ever game member ability herself field.,Pattersonshire,WELL,-63.0498605,-85.568059,7227.26,"2 days, 0:00:00",MEDIUM,2d88c350-49b5-45ac-8519-760a73b80453,9cec2b70-8268-49b0-9790-027f56d65b08,53.36,visits,True,MONTHLY,,,2024-07-13T02:02:34,2026-04-15T18:10:31.036679,70076567-d9be-4a2e-9452-2907bd46a2cc,adab5100-c8fb-47d2-adaa-89f6d0701535
0c276949-b31e-4624-830b-e2bba746c91a,8d2e71e3-0422-4b11-bab4-6af9543a3839,678c61ab-e0a4-40b1-af00-261f9020c2ca,2024-08-07T22:59:11,,"Others morning commercial institution create usually. Police think magazine. Behavior them protect single.
Dream home let city do cup difference. City quickly space then truth model mouth explain.",WO-99955,2024-08-09T11:43:04,2024-08-14T11:43:04,REJECTED,How fear morning serious. Rate sort development easy. Military myself throughout our improve.,Woodsbury,ADDRESS,5.763699,38.162148,37705.75,"3 days, 0:00:00",MEDIUM,492f99aa-15c9-4d77-9b8f-61e9ca734db1,9cec2b70-8268-49b0-9790-027f56d65b08,17.52,visits,False,,,,2024-08-05T09:16:21,2026-04-15T18:10:31.037241,d8f1cf1d-0677-469a-a8b4-ac7dcd69ef4a,2101a9f1-e10e-4722-a754-49c514d6710e
20fc42f7-b9ba-4b2a-8466-f371bc546f8f,4efb429c-f661-47c7-8be1-26bcd85624cc,c47f7a97-07de-45fc-b329-df9d514c1dd8,2025-12-08T17:11:22,,Poor large place pass participant. Property indicate dog region pick without another. Wind tonight have right through.,WO-75373,2025-12-09T11:58:28,2025-12-12T11:58:28,REJECTED,Lot class raise out newspaper true tonight available. Follow adult drug weight.,Lindsayshire,WELL,-41.030729,176.287091,19437.33,"2 days, 0:00:00",MEDIUM,55abbe3d-3bd9-4289-b279-ab674df24bc8,1ecd42cc-80e4-426b-8a62-3e3dc4dc248a,3.36,visits,False,,,,2025-12-07T21:32:08,2026-04-15T18:10:31.037819,7cc00987-4cd0-4544-b78f-acdb621d7330,c22fb3af-b27a-40fa-a1ff-43719eb67669
4f7589fc-707e-4234-b161-a3eb8ac17aa6,58f9dbaf-1659-4d39-9ffe-a44624472704,66d9ecee-f243-482d-98d8-69b8b0179d6b,2025-06-13T08:45:42,,"Machine report side year. Woman treat data thing. Anything end resource former around production especially.
Now friend prevent fly mouth. Rest one quite everything out. Range capital wife she old.",WO-59651,2025-06-14T05:51:18,2025-06-18T05:51:18,IN_PROGRESS,Common morning trial us. Right benefit decision hair could American.,East Jane,ADDRESS,-73.474853,144.415611,20119.86,"1 day, 0:00:00",LOW,c939336d-7723-43ae-9052-08348184324c,16c270b4-3b14-467e-9cc3-879f37e9a5db,90.15,visits,True,WEEKLY,,,2025-06-11T06:54:10,2026-04-15T18:10:31.038278,356bfa35-d694-48fb-ba71-be738be3d0e9,81e7a2b0-4bda-4f58-8407-da27e6c1d093
e6cab31c-13ad-4577-bd11-24ee01192ecd,8d2e71e3-0422-4b11-bab4-6af9543a3839,678c61ab-e0a4-40b1-af00-261f9020c2ca,2025-01-07T10:11:30,2025-01-08T21:58:45,"White seem authority simply. Sit popular actually decision laugh easy.
Important keep place heart shoulder save kitchen. True mean after serious.",WO-45387,2025-01-08T13:12:37,2025-01-12T13:12:37,COMPLETED,Up book former past oil continue tough. Thing control example century staff.,Chadview,WELL,2.459662,69.747788,48001.11,"1 day, 0:00:00",LOW,492f99aa-15c9-4d77-9b8f-61e9ca734db1,cb49e5de-7799-42e2-98e8-44fad7981926,89.81,hours,False,,,,2025-01-05T22:06:47,2026-04-15T18:10:31.038656,d9870605-0191-42ff-b25b-83759a157581,5e959909-e85e-42e2-b27f-9e9ee23af7bc
6df9f1b4-ff86-427e-a71b-ad99ff3ca30c,4efb429c-f661-47c7-8be1-26bcd85624cc,c47f7a97-07de-45fc-b329-df9d514c1dd8,2025-10-09T07:38:47,,Meeting black parent past employee which all. Sell five item husband. Former marriage week now.,WO-12818,2025-10-10T10:59:12,2025-10-11T10:59:12,CANCELLED,Article trade party front economy. Improve accept future.,South Louisburgh,GPS,-82.2768675,-125.354314,41144.16,"3 days, 0:00:00",MEDIUM,7436bc8d-5f3d-489d-af7e-a17fb7bfe119,1ecd42cc-80e4-426b-8a62-3e3dc4dc248a,5.01,visits,False,,2025-10-10T03:54:57,Safety concern,2025-10-07T13:16:53,2026-04-15T18:10:31.039214,0ceefc94-1e70-47dd-886d-08519e0f9eeb,2c1bc234-7f2a-41db-acdd-953ace881371
b8df24f7-3721-4de6-8665-61555c72990f,8d2e71e3-0422-4b11-bab4-6af9543a3839,84e86518-3a3e-4445-8f1c-4328934ff3f3,2025-10-14T14:28:27,,Notice more gas play without television. Music south establish discover brother. Within both ago year everyone. National civil smile people enjoy business.,WO-98433,2025-10-15T03:02:16,2025-10-16T03:02:16,IN_PROGRESS,Drug anyone none among. Natural agreement year kitchen organization my.,Bensonside,WELL,-68.15717,145.433463,3464.4,"3 days, 0:00:00",LOW,d15d4e10-fb48-4ffd-871d-a6be1c1a8c60,0e86a864-3c22-4865-be33-9cbe67fc6cba,63.44,loads,True,WEEKLY,,,2025-10-13T15:46:38,2026-04-15T18:10:31.039766,9a17e72c-3705-48f9-9fb3-13ec00547b4b,f60b8030-fc99-427d-a55e-33e7410046d9
ffa8d4c2-da77-44ed-8e2f-7152e41bf4c1,8d2e71e3-0422-4b11-bab4-6af9543a3839,678c61ab-e0a4-40b1-af00-261f9020c2ca,2025-12-15T07:54:48,,"Simple military size another western wish. Anything citizen seat each.
Though on market happen win. Father again wonder affect exist. Enter visit feeling rule option serve point difficult.",WO-11513,2025-12-16T21:41:22,2025-12-19T21:41:22,REJECTED,Style fight interesting hospital.,Lake Dianebury,GPS,16.434734,156.048813,44234.89,"2 days, 0:00:00",MEDIUM,492f99aa-15c9-4d77-9b8f-61e9ca734db1,9cec2b70-8268-49b0-9790-027f56d65b08,76.6,hours,True,ONE_TIME,,,2025-12-15T05:07:39,2026-04-15T18:10:31.040222,793edc3f-30d6-43cf-bbce-c79977fe1502,0bc4a041-86be-4fa6-b988-3cf1c8571547
83b397bc-fb5c-4b68-b440-b1d599a2b416,8d2e71e3-0422-4b11-bab4-6af9543a3839,a922b7d7-c9d0-429d-82e0-ab8fd3161e02,2026-02-13T11:22:45,,"War stand wonder think during power. Situation group fear at minute. Standard body lawyer rock card vote building.
Sit not research appear try defense marriage relationship.",WO-64830,2026-02-15T07:19:47,2026-02-19T07:19:47,IN_PROGRESS,Drug always program administration serious. Summer kid despite knowledge.,Devintown,GPS,56.567475,-32.334385,36706.77,"3 days, 0:00:00",MEDIUM,8c8df8d2-74ef-4891-a381-40cf7f38512b,9cec2b70-8268-49b0-9790-027f56d65b08,15.25,gallons,False,,,,2026-02-11T01:29:09,2026-04-15T18:10:31.040598,7fba2b75-a5ea-4bb9-a4ed-4f44791dcd21,00bb9362-738a-463b-8caa-28c639215900
41adcf8b-d6d8-4a06-adca-90a7f8a713ec,8d2e71e3-0422-4b11-bab4-6af9543a3839,3b7581cb-ea6e-4a86-a15f-e6d5897da24c,,,"Process within be. Show now present physical lawyer.
Much at television service. Successful ten third step more.
Staff increase trouble forward. Peace common any budget here vote note.",WO-69351,2024-11-13T05:01:13,2024-11-16T05:01:13,UNASSIGNED,Wish sit word back. Get effect amount provide themselves television certain. Pay lot understand.,East Trevor,WELL,-37.8951355,-135.987899,21209.61,"1 day, 0:00:00",MEDIUM,4baeb96d-8da3-4b5f-82cc-cc08c13b5aac,cb49e5de-7799-42e2-98e8-44fad7981926,80.15,gallons,True,DAILY,,,2024-11-11T10:52:21,2026-04-15T18:10:31.041066,f3901d18-3c62-4871-87c9-1e309b86eafc,ed54a112-aa22-4d08-947f-a65a405c25f6
247d9f02-bfac-43d5-bd3e-0c0d08ef3e96,8d2e71e3-0422-4b11-bab4-6af9543a3839,f525d920-9583-480f-bd27-5dff2c94820f,,,"Others either follow accept.
Important build economic major. Partner ability join black set father difficult end.",WO-02548,2026-04-15T14:52:31,2026-04-16T14:52:31,UNASSIGNED,Tax song position join become floor politics. Kitchen throw arrive account rise.,Port Joanne,GPS,-13.785267,173.75261,39457.1,"1 day, 0:00:00",MEDIUM,64db6a55-8918-4153-82b2-49b26e782579,af516e74-dbad-4474-9b38-fee85f1c5f93,91.6,gallons,False,,,,2026-04-15T05:46:32,2026-04-15T18:10:31.041418,c3fddb5e-2ca4-426d-a6f1-c95eafb373bd,a80a73af-85b1-49cc-8a98-4b00d28bcd8c
41376023-d7b7-4c0f-b567-28be2b7e70e2,174a76cb-9bbd-48fa-82c3-f88bcdf4c7aa,678c61ab-e0a4-40b1-af00-261f9020c2ca,2026-03-14T20:04:26,,"Control although participant too sign director. Social you themselves yourself.
Blue also career understand everybody. Commercial fund study.",WO-54582,2026-03-14T20:38:31,2026-03-19T20:38:31,REJECTED,"Explain hear cause need phone executive.
Concern whatever expect after. A assume design thus owner.",New Mark,ADDRESS,85.7731805,-60.299226,42604.39,"2 days, 0:00:00",HIGH,c3da1d19-9580-4a71-bccb-a3c18e8f9096,9cec2b70-8268-49b0-9790-027f56d65b08,56.3,loads,False,,,,2026-03-12T19:09:24,2026-04-15T18:10:31.041862,e58195c3-fdae-4f5a-b730-210ce6693e89,0c44a8f7-00aa-4629-84bb-202cbdc63e60
9491a08f-f5be-4f53-a286-ad64b0d7bcc8,faa66382-4806-43a8-8a5d-ac3393c400fd,ed8cf4c2-c280-4462-92ab-89c394e00cfc,2025-05-29T16:59:23,,"Fire themselves team loss clearly trouble often. Maybe best occur break keep if rate.
Trip perform policy always put subject begin. Final oil course there rich simple may body.",WO-97804,2025-05-29T17:30:55,2025-06-03T17:30:55,HALTED,Sure own anyone girl. General her indeed be owner season. Player fast head politics rest industry.,Pollardshire,WELL,31.9935995,-79.521352,21976.73,"2 days, 0:00:00",MEDIUM,f633e0a6-c872-4259-91e6-e6e873076c1d,11140ee8-eb7c-4db8-bf89-1b9b4dec4035,94.05,loads,True,ONE_TIME,,,2025-05-28T06:28:56,2026-04-15T18:10:31.042300,d5fe0d6b-2de6-48f5-95eb-0fd7158fceba,40a3f780-9865-44d9-a045-ab039d1cb18c
8850553c-b6fc-4c66-b574-65c55bce64e7,4efb429c-f661-47c7-8be1-26bcd85624cc,678c61ab-e0a4-40b1-af00-261f9020c2ca,2025-04-03T23:19:59,,"Line minute exactly book check economic. Heart attack wrong read despite whom. Human show argue pull even.
Even soon strong believe official teacher. More audience gun.",WO-56113,2025-04-05T19:41:53,2025-04-08T19:41:53,HALTED,Same edge oil social very. Mother trip trial direction. Under spring Democrat answer.,Sarahside,WELL,33.184098,45.73402,42302.17,"1 day, 0:00:00",LOW,edc1cbc0-6981-4e5b-accb-e54d573652b3,1ecd42cc-80e4-426b-8a62-3e3dc4dc248a,46.97,gallons,True,DAILY,,,2025-04-02T18:24:08,2026-04-15T18:10:31.042735,f1302a9f-d0b4-4abd-864e-491fcb213923,5da395e1-3486-4970-a3ac-2f4601a0aae6
888df83a-1534-4f12-a24e-41dff5b4da84,cddd5f7c-18e5-439d-b906-a347d43c668d,b43e3365-5df9-4195-a65d-d09d87c032b0,2024-12-02T21:50:14,,Clear now need data view. Third impact section arrive they way.,WO-00267,2024-12-04T01:59:09,2024-12-09T01:59:09,CANCELLED,Option show attention. Actually letter father area natural property. Blood hard finish player.,Lake Laurenmouth,GPS,15.0513105,-50.947645,8541.05,"2 days, 0:00:00",HIGH,254ea4de-f7cc-422e-86bb-4db3d83aaee0,9cec2b70-8268-49b0-9790-027f56d65b08,7.57,loads,True,DAILY,2024-12-03T04:37:33,Resource unavailable,2024-11-30T08:29:08,2026-04-15T18:10:31.043357,d43be58b-7340-447c-8ea2-06b74837a4cf,2ea297e6-d2f1-4804-8aff-1c45fb62ba4e
9d8f0cdb-cc39-46d2-8745-22310b11673b,4efb429c-f661-47c7-8be1-26bcd85624cc,c47f7a97-07de-45fc-b329-df9d514c1dd8,2024-05-18T23:09:40,,Ask tonight create be bit. Together body raise move describe. Family yes call them meet some window focus. First pressure argue interesting.,WO-40383,2024-05-19T19:58:27,2024-05-23T19:58:27,IN_PROGRESS,Claim process bed physical writer. Up scene space. Whatever way type leave subject management less.,Adamland,GPS,-60.79038,-5.137473,46910.9,"1 day, 0:00:00",MEDIUM,7436bc8d-5f3d-489d-af7e-a17fb7bfe119,1ecd42cc-80e4-426b-8a62-3e3dc4dc248a,24.33,visits,True,WEEKLY,,,2024-05-16T00:36:21,2026-04-15T18:10:31.044015,d43be58b-7340-447c-8ea2-06b74837a4cf,f17f327d-003f-4c68-a351-da3d5a872ca2
99da518f-fda2-4c6d-81e8-01a644d07f9d,cddd5f7c-18e5-439d-b906-a347d43c668d,678c61ab-e0a4-40b1-af00-261f9020c2ca,2026-02-20T20:22:42,2026-02-22T09:03:50,"His professional among fill establish young most. Answer southern energy company research under hard.
Place management college according. Appear stay approach girl.",WO-11684,2026-02-21T11:02:37,2026-02-24T11:02:37,COMPLETED,Social four lay. Market source marriage human.,Barkerchester,WELL,28.917377,-84.266549,8380.0,"2 days, 0:00:00",HIGH,492f99aa-15c9-4d77-9b8f-61e9ca734db1,9cec2b70-8268-49b0-9790-027f56d65b08,38.31,hours,True,WEEKLY,,,2026-02-18T19:49:32,2026-04-15T18:10:31.044799,d8840499-e1b2-4e40-8230-1144f814d57b,aedabaf5-3362-4489-a72d-fd6d04369d85
bf5deba7-7070-481e-a3ef-9811e318ce13,174a76cb-9bbd-48fa-82c3-f88bcdf4c7aa,c47f7a97-07de-45fc-b329-df9d514c1dd8,2025-05-04T16:27:44,2025-05-08T19:50:35,"Once land prevent hope. Analysis animal environmental floor.
Time send every painting us can.",WO-04658,2025-05-05T22:28:55,2025-05-06T22:28:55,CLOSED,Fly figure capital action beyond sometimes compare. Occur arm look five inside imagine include.,South Brianville,ADDRESS,65.016658,-177.545102,603.32,"1 day, 0:00:00",LOW,0e3fb706-69e2-498c-b02f-99e12010398b,16c270b4-3b14-467e-9cc3-879f37e9a5db,14.21,loads,True,ONE_TIME,,,2025-05-04T13:28:06,2026-04-15T18:10:31.045400,b658a5cb-6a32-4658-abb4-ec807123c562,02019fdb-1856-4902-b6dd-23dd6d6382bd
8f369680-826d-4e75-8c38-564c06488982,cddd5f7c-18e5-439d-b906-a347d43c668d,b43e3365-5df9-4195-a65d-d09d87c032b0,2026-04-15T08:48:58,,Thought knowledge suddenly six. Herself structure well decide catch day. Over mission western view season state group represent.,WO-76398,2026-04-15T11:17:18,2026-04-18T11:17:18,IN_PROGRESS,Any society individual page south popular. Reduce their allow spring may class so material.,Gilmoreview,WELL,86.286896,43.44884,49415.14,"3 days, 0:00:00",LOW,254ea4de-f7cc-422e-86bb-4db3d83aaee0,9cec2b70-8268-49b0-9790-027f56d65b08,82.32,gallons,True,ONE_TIME,,,2026-04-15T04:29:04,2026-04-15T18:10:31.045966,4f2b1b97-ce6a-4a15-9a6a-8e7496404d34,920b13b3-ff95-4083-91c3-e70876ca5cfb
775431d6-7f1a-4205-853b-c61155085e35,8d2e71e3-0422-4b11-bab4-6af9543a3839,678c61ab-e0a4-40b1-af00-261f9020c2ca,2026-02-04T05:49:33,,Necessary myself left prove along occur would. Risk usually significant factor question personal history. Report deal small difference drug age.,WO-17509,2026-02-04T18:15:12,2026-02-09T18:15:12,HALTED,Care free system full. Education yard wife foreign raise per help.,South Rachel,ADDRESS,-80.9166905,10.882549,7361.49,"2 days, 0:00:00",HIGH,492f99aa-15c9-4d77-9b8f-61e9ca734db1,1ecd42cc-80e4-426b-8a62-3e3dc4dc248a,85.39,gallons,True,WEEKLY,,,2026-02-02T01:59:37,2026-04-15T18:10:31.046420,3f925fa2-6865-403e-bce8-6051462fdfd2,4a4a0e18-c206-48f8-a215-731a45dd6bbd
b28b38dc-b460-4468-bc55-7575eac1b142,58f9dbaf-1659-4d39-9ffe-a44624472704,b43e3365-5df9-4195-a65d-d09d87c032b0,2026-01-28T02:42:07,,Energy during top hair indeed quickly happen. Us mention everything get happen. Best rest control her administration.,WO-02640,2026-01-29T19:15:27,2026-01-30T19:15:27,HALTED,Generation without he place guy. Thus score resource site.,Tiffanyfort,GPS,25.820747,131.369372,33417.92,"3 days, 0:00:00",MEDIUM,254ea4de-f7cc-422e-86bb-4db3d83aaee0,16c270b4-3b14-467e-9cc3-879f37e9a5db,81.22,loads,False,,,,2026-01-25T04:47:49,2026-04-15T18:10:31.046862,d4a03d04-ac17-46af-81ff-fd0a62d722b1,a587d530-98fc-470c-bc73-476c54fefc64
d9480845-267b-46c4-82cd-fd8218c2fca9,d37db5f8-d37f-49c0-b8b2-76d6a45ab850,75a0afd8-df78-48b9-ae6b-7116f2e24eba,2024-12-08T06:04:47,2024-12-12T12:39:56,"Prevent some blue phone plant away nature. Common outside weight attention. Exactly stay guess price mother tonight care eye.
Claim that professor yard. Red physical more.",WO-35200,2024-12-09T04:54:37,2024-12-12T04:54:37,COMPLETED,"Create culture newspaper wind light account.
Station send base then when pay newspaper.",Victorfurt,ADDRESS,51.5201975,-37.597655,10922.09,"2 days, 0:00:00",LOW,c545a2d5-2d2e-4fae-8313-79be1d1e6aee,af516e74-dbad-4474-9b38-fee85f1c5f93,70.62,hours,False,,,,2024-12-08T00:09:53,2026-04-15T18:10:31.047354,bb55c687-fe5a-44b2-8157-8b62ebff0a95,0544bda5-f8e4-438e-8462-fc96cde7c4b4
237b7e08-bb0f-41d0-bac3-d0637d3ab62f,ab06f125-03cd-4efa-b705-80a382abe9d7,84e86518-3a3e-4445-8f1c-4328934ff3f3,2026-04-10T03:48:17,,Agreement would stuff test southern prove. Arm case product daughter. Common life example these.,WO-93084,2026-04-10T21:50:05,2026-04-12T21:50:05,ASSIGNED,Watch across few cause chance for specific. Project represent manager stay.,Dennisbury,ADDRESS,-22.42937,-1.786908,38633.15,"3 days, 0:00:00",MEDIUM,a75a517d-feb9-447d-9adb-b23cd88de375,1ecd42cc-80e4-426b-8a62-3e3dc4dc248a,58.35,visits,True,WEEKLY,,,2026-04-09T09:43:07,2026-04-15T18:10:31.047751,8967424e-b041-4377-8585-a50cb8832972,36c0a4cc-f2c5-4a36-a9dd-3d6595e24690
82c1933e-4edd-4f8d-a71c-76a82a35019a,ab06f125-03cd-4efa-b705-80a382abe9d7,3b7581cb-ea6e-4a86-a15f-e6d5897da24c,,,"Like home water charge. Step message friend skill. Popular positive road work notice. Employee short range might sport.
Easy fear window describe fast fast. Face garden relationship only in.",WO-46748,2025-09-20T03:11:12,2025-09-23T03:11:12,UNASSIGNED,"Require administration impact if.
Her store kid size keep. Left message impact. Morning skin city.",New Patricia,WELL,8.4672475,-164.82856,9978.69,"1 day, 0:00:00",LOW,1deb90dc-c05c-42e8-89cd-c64fb0effa7a,1ecd42cc-80e4-426b-8a62-3e3dc4dc248a,4.11,loads,False,,,,2025-09-19T02:45:20,2026-04-15T18:10:31.048355,fad40b6c-ed4e-4434-a688-6bd8104bcf62,f1f35c57-8a89-4d75-b79f-173640d2bb56
bedb162d-1b08-4fd2-acfd-c7a446f6e1f9,faa66382-4806-43a8-8a5d-ac3393c400fd,678c61ab-e0a4-40b1-af00-261f9020c2ca,2025-02-08T03:59:55,,Dog air spring short treatment. Mrs north wall low draw. Least price husband together until. Up society enjoy.,WO-18722,2025-02-08T06:57:37,2025-02-12T06:57:37,REJECTED,Rule once wear three contain play soldier. Return dark yard fund man positive team.,Andersonhaven,WELL,-29.9429065,-156.807994,37391.42,"3 days, 0:00:00",MEDIUM,c3da1d19-9580-4a71-bccb-a3c18e8f9096,9cec2b70-8268-49b0-9790-027f56d65b08,66.18,days,False,,,,2025-02-07T02:24:12,2026-04-15T18:10:31.048827,1c5bf441-cba3-4f46-8b9a-e06ad17e45b4,1300191e-48fb-4dd4-bf98-cf116587a4bb
a1553810-38f5-4e18-ba63-1f6bb1328b53,9863f9e7-9e3e-4991-ae05-2fcfca5ff7d0,f525d920-9583-480f-bd27-5dff2c94820f,2024-09-25T02:13:41,,Fire defense exactly chair cover remember outside. Employee write defense common. At even letter former future home general speech.,WO-80847,2024-09-26T13:20:03,2024-09-27T13:20:03,CANCELLED,Use agency with conference design. Receive strategy role. The before security realize drug.,Quinnchester,GPS,-60.1191715,54.172409,44268.85,"1 day, 0:00:00",HIGH,1d368a2a-1655-46a6-a06f-99658461cf29,1ecd42cc-80e4-426b-8a62-3e3dc4dc248a,60.79,loads,True,ONE_TIME,2024-09-26T02:49:14,Duplicate order,2024-09-22T10:10:53,2026-04-15T18:10:31.049295,8ad4c495-b793-4a0a-b4b4-0d213b5bfce9,1172fe1a-72ef-4dde-bb56-74cdba00f9b2
83cbc38f-5e14-473b-ade7-4a7a654e7bb9,4efb429c-f661-47c7-8be1-26bcd85624cc,678c61ab-e0a4-40b1-af00-261f9020c2ca,,,Decision wrong process. Remember rise than man education sell. Leg box address range beyond group.,WO-08102,2026-04-15T15:30:57,2026-04-18T15:30:57,UNASSIGNED,Value over scientist dream few. Situation office later wish human source.,South Eric,ADDRESS,-38.9272015,133.638012,40110.33,"2 days, 0:00:00",MEDIUM,edc1cbc0-6981-4e5b-accb-e54d573652b3,1ecd42cc-80e4-426b-8a62-3e3dc4dc248a,1.27,visits,False,,,,2026-04-15T15:05:41,2026-04-15T18:10:31.049848,050ed981-7e56-42be-90af-6c99679e84cc,d6038030-b4be-4ef1-9d8a-fd91a735b68f
b3ba6209-e3c8-4141-99c4-2ec5925c96b1,ab06f125-03cd-4efa-b705-80a382abe9d7,84e86518-3a3e-4445-8f1c-4328934ff3f3,2026-04-08T07:37:56,,"Probably add painting election. Person southern still common week news road.
Sort middle network story. Positive like house matter but.",WO-90878,2026-04-09T22:37:32,2026-04-14T22:37:32,IN_PROGRESS,Key question however occur rock. Hard available opportunity.,North Jonathan,GPS,-61.3079005,-100.800392,44534.53,"3 days, 0:00:00",HIGH,26674d61-d034-4f7e-8a6f-7303b6c6ec24,1ecd42cc-80e4-426b-8a62-3e3dc4dc248a,92.73,gallons,False,,,,2026-04-07T20:20:22,2026-04-15T18:10:31.050248,a10c7988-b4b3-43b6-a1b0-40e838b925ce,b3cb6ad1-9d1d-44f8-ab97-a2c555636bc7
0491add2-116c-4c23-bc02-f86ee5798bc3,4efb429c-f661-47c7-8be1-26bcd85624cc,678c61ab-e0a4-40b1-af00-261f9020c2ca,2025-04-22T14:32:36,,Remain lawyer event site discover after. Ten environmental though.,WO-01007,2025-04-24T10:22:37,2025-04-29T10:22:37,HALTED,Tell want hold kitchen. Meet send gun total new bit. Great large item tonight choose and bill into.,Lake Margaret,GPS,44.2819395,89.280743,16963.97,"2 days, 0:00:00",HIGH,edc1cbc0-6981-4e5b-accb-e54d573652b3,1ecd42cc-80e4-426b-8a62-3e3dc4dc248a,63.08,hours,True,WEEKLY,,,2025-04-21T15:57:44,2026-04-15T18:10:31.050719,fad40b6c-ed4e-4434-a688-6bd8104bcf62,6733d068-7fe3-41da-a431-27ca7a0ebc4e
3460e2c0-6a91-4b3e-8830-34d7e7d517e2,174a76cb-9bbd-48fa-82c3-f88bcdf4c7aa,04139841-be62-450b-bd98-1aa2a541894b,2025-10-27T23:02:56,2025-11-01T11:33:06,"Always enough buy staff hold. Family include remain only machine debate protect join. Why carry worry.
Chance pay season administration security. Goal deal street front practice.",WO-12478,2025-10-28T18:08:05,2025-11-01T18:08:05,COMPLETED,Almost case officer care wish. Owner hold ball a service. Several stop spring social whole agency.,Port Michelle,GPS,-40.9734895,146.095261,44629.9,"1 day, 0:00:00",LOW,64ee6292-ed9b-4a4c-908c-2264b84270db,16c270b4-3b14-467e-9cc3-879f37e9a5db,67.17,days,False,,,,2025-10-25T17:07:58,2026-04-15T18:10:31.051171,23ae6dda-4cdc-44f5-9824-c00d9c84e150,73d43e39-a8fb-4300-8bf7-eb0228a0c9d9
8e27d2c7-1cc1-4516-8bef-e470d4ca6f74,58f9dbaf-1659-4d39-9ffe-a44624472704,731e4fd5-b8ef-4d21-add8-632f22763d09,2026-04-15T17:51:47,2026-04-15T18:07:58,Character agent out else sure own. Lawyer threat stop room. Age choice event society team hear meet.,WO-63044,2026-04-15T17:55:59,2026-04-19T17:55:59,COMPLETED,Style level war community factor understand. Describe gun carry form popular project.,Cooperhaven,WELL,25.387856,11.113731,611.4,"1 day, 0:00:00",LOW,054abf16-2d48-4ac2-96ae-1658db6e0fb2,af516e74-dbad-4474-9b38-fee85f1c5f93,80.44,loads,False,,,,2026-04-15T13:58:28,2026-04-15T18:10:31.051654,8d703a54-1a6f-4f13-8590-b52f819b760e,48712e39-be14-4a59-9c59-9aa154f8c482
