work_order_id,assigned_vendor,assigned_at,completed_at,description,due_date,current_status,comments,location,estimated_cost,estimated_duration,priority,well_id,created_at,updated_at,created_by,updated_by
0bf6a193-1fc7-474a-bf03-1b51df309aa1,4195973a-1e8f-47c7-af89-4b7e5e46de81,2026-04-04T01:20:30,,Stock help happy cost speech. Base Democrat assume successful fall improve. Conference risk man what add. Serious what country turn wrong marriage base.,2026-04-01T17:47:35,assigned,Know stop cause life listen about election.,Jenniferstad,9096.65,50,urgent,9e14feee-755f-49ec-be19-c06f1a246c94,2026-03-29T02:08:42,2026-04-07T10:18:07.825934,e71c11b3-5c59-46ad-87a4-51e5a7d7aad2,5c66a987-fd92-4f91-98e8-3462041422f9
1b7fe86a-c931-4e6d-bd94-b1060a913d59,ca08ace8-52c5-4d85-8659-6c4ca8d07a0c,2025-10-02T04:43:51,,"It technology friend teacher. Key religious sign able oil feeling mention.
Pattern friend on say.
Day statement but after truth. Hope act writer drug type. Task recognize firm you spring lead.",2025-08-20T15:50:53,completed,She artist simple. Quality city blood set husband its public. Value put popular fear.,East Melissaton,9676.92,33,urgent,08d7a575-b2cd-4102-92e6-261b6319675f,2025-05-16T08:34:28,2026-04-07T10:18:07.826138,286d4be9-502a-4e48-8339-7cceb8dba891,9e47d1ac-2fb0-4ca0-aec1-ff58bd9e780d
81758bff-3421-4139-af48-d162f685a00e,00ce0e5d-dabe-447d-8247-cec72142417d,2026-02-27T09:29:58,,"Owner else top receive during successful energy. Become near until poor entire walk necessary.
Remember their test natural pay. Run PM lay year why.",2026-04-12T17:49:31,unassigned,Somebody gun forget pattern his. Whole situation always. No at reach particular watch fly.,Darlenebury,4117.4,29,routine,9774c0b5-6317-4794-bf97-42efa48f1dce,2026-01-21T08:03:08,2026-04-07T10:18:07.826345,4d5636a9-96ba-4717-8f19-c2568a3f852a,1a1a12df-33a5-411b-af33-e247308e13e6
85783787-dee5-4178-9df6-f5f8bad95e74,ec609920-5b8b-4710-99cf-185d2b003772,2026-03-10T06:56:48,,End too million alone subject. Religious item knowledge discuss television a watch produce.,2026-04-14T04:46:39,completed,"Relationship anyone movement. Many wife amount win.
Teach subject center response maintain.",New Brucestad,4038.7,48,urgent,65243d2f-5486-4599-87f2-5f271bc649aa,2025-10-31T13:29:23,2026-04-07T10:18:07.826546,ee392b87-79b1-43cd-8b80-cb5f73130a43,2c8a8ca0-9c7b-4a46-a0ee-0985712e5bc8
d37a6f66-b69c-4e24-b17f-7e0eb7f37938,38939c64-27d8-477b-adbf-3eb952a9ff97,2025-04-26T00:06:17,,"Stand fast top specific development rise hold.
Security new around quickly forget health month few. Senior between work thing. Of forward country quickly trouble.",2025-07-12T02:04:56,unassigned,Those me dark. Thank experience again huge including stuff. Space draw usually task trip.,Vanessastad,3173.96,47,emergency,0bfb698e-0d8e-4ba6-9f17-7ac0a4ca2180,2025-04-19T19:42:21,2026-04-07T10:18:07.826736,78d15b48-a2a8-4d1f-94eb-de4f58401c3e,0e7d824b-9392-4dee-a491-932632877bf0
75627a49-2f9d-4e3b-8039-60824227239a,38939c64-27d8-477b-adbf-3eb952a9ff97,2025-12-07T18:19:32,,But in pretty. Station buy should dog real prevent former she. Eye bank apply shoulder just once letter.,2026-02-16T21:52:28,unassigned,First recognize store agency. Exist may heart production defense star argue.,East Virginia,8117.46,17,urgent,600ff490-cf6d-4fb9-97a2-f24a0457b52d,2025-10-22T19:30:53,2026-04-07T10:18:07.826960,a2eaf5ba-a2d9-42be-a20d-42ccb25b3882,1b9d4cb4-e346-4258-bc8e-a22a46de4f1a
f032198e-2a00-4603-a1d5-05d42942875f,3e45d3ec-4483-4235-88c0-8042057d7cff,2025-08-19T09:38:34,,"Less effect benefit. Material beat realize today. Whose budget great by business cold. Matter red apply strong.
Near green race change once. Study different miss hair ago south.",2025-05-24T22:48:28,unassigned,Dog occur history himself begin reason. Usually same black miss TV.,Warefort,4058.34,28,routine,93215096-0b30-4bd1-8932-efa7bf5e7fd3,2025-04-16T05:20:13,2026-04-07T10:18:07.829079,0bd48c71-5474-4936-a496-da79256b29f5,8056b8ca-a722-4694-9637-2f09d72c1410
c5c04ab9-dfb4-4a5f-9dea-09fa6bfa9e33,9469901e-742d-4522-9bba-d1217399375e,2026-02-20T04:15:30,,Where you technology of difficult account. Ever station right PM cultural indicate military. Should oil type show.,2025-12-31T09:28:04,completed,Old sometimes prevent team. Whose usually sense girl term then.,Lake Jason,7543.48,30,urgent,53ed9b92-d8a2-4f53-99e9-d402d60b4249,2025-12-03T14:51:14,2026-04-07T10:18:07.829275,f6eb6eaf-256d-4d84-abe8-ec420856225c,d206c472-b7e6-40f7-b5f7-b957527dcb15
5bf3b0c3-475d-4aea-9772-dbb6d7012541,3e45d3ec-4483-4235-88c0-8042057d7cff,2025-11-28T00:03:21,,Teach middle before information. Heart their matter. Run argue work pass instead crime manage. Form participant information morning smile student top audience.,2025-10-09T06:49:53,assigned,Ever establish look wife office house industry. Country blue upon dinner reveal teacher.,South Melissaview,9445.81,4,urgent,79a1931c-3d03-43f3-b9a5-69caf18b43ff,2025-05-25T11:14:27,2026-04-07T10:18:07.829474,147c2d09-ef68-4bfa-8cb5-a1cf48c4c0a4,0330731e-1ce0-42bd-8acc-20b230f04f5b
e37fe4f8-6eac-46e6-b627-c605c819c9fa,f9923c46-a9a0-4f7d-95b8-8b0238e212f8,2026-03-27T13:31:47,,"Everybody which people realize right both Republican. Organization chance seek that right.
Eye task police play. Sense break line expert positive.",2026-03-30T09:26:21,completed,Unit call national different. Child fine very another energy political land environmental.,Cristinaview,5383.75,36,urgent,2fc55cb8-ba54-4615-84aa-f727953c1a26,2026-02-02T19:58:28,2026-04-07T10:18:07.829674,0f70b477-ca79-493d-9fc1-e1a3af6339df,feb5d067-6079-455c-b2d9-b8bd72b29fec
a41d53de-92da-45ee-a550-979aa100f5a7,ca08ace8-52c5-4d85-8659-6c4ca8d07a0c,2026-04-02T09:26:30,,"Perhaps politics activity side.
Always trip compare continue sound. Available blood learn ask voice front likely.",2026-02-26T12:14:54,assigned,Style miss do southern. Drive in leg top notice collection occur.,Cooperland,9534.4,17,routine,185a873d-df59-40d1-ad4c-4609f608b033,2025-12-19T01:12:22,2026-04-07T10:18:07.829897,c3cd8121-f35e-423d-9bf4-96111c6b1a03,0cc40a0b-4c26-45c1-b486-dac75872949f
642ab8c4-9912-4d4a-8727-e736e3fbdfb0,38939c64-27d8-477b-adbf-3eb952a9ff97,2026-04-02T18:02:56,,"Although degree after lawyer ago popular claim. Level edge play task data serve. Candidate under anyone voice her.
Report feel peace into because become.",2026-03-17T19:01:19,unassigned,Know thing threat middle trip. Safe heavy away send social child Mrs.,East Nicolechester,636.15,57,emergency,8e2c1c85-0fc3-40ad-b842-0237c0f9b2be,2026-03-17T00:32:44,2026-04-07T10:18:07.830096,ce6f90b3-d57e-4f90-ae80-997211dd4787,80f5d509-ef21-4d09-840c-b66a5661d72c
e31d80c3-42fd-4cfd-a2ad-02024953ac70,159610a4-4b4f-4948-abd0-c010992f70a8,2026-03-06T04:14:20,,Reduce others in positive answer hair partner animal. Imagine again huge same again structure. Friend everyone agency then those.,2026-02-08T01:04:31,unassigned,Their subject agreement how eye gun run.,Nguyenport,1089.3,40,routine,ea41f7e6-a8ac-40f5-85af-85bed4e02578,2026-01-22T07:28:34,2026-04-07T10:18:07.830268,4c19b1b2-b314-47eb-a7dd-e64b15635c8e,7e60b368-7f1b-4be5-9da1-924dffab8ea6
c52a2b2d-dd38-4a03-b8ed-3cb5faf580f3,9469901e-742d-4522-9bba-d1217399375e,2026-01-29T00:07:01,,"Front street certain political turn sing. House better song general on tree soldier.
Head chance hotel computer truth old woman even. Other ahead unit system whose improve. Glass old much box base.",2026-03-05T06:06:05,assigned,School skin mother wish have. Executive former likely ask sister body great.,South Michael,2345.25,52,routine,b3d2c9bf-a801-4277-8a1d-107b3160265a,2025-09-07T16:25:06,2026-04-07T10:18:07.830433,67089f9a-8ea9-420f-aa34-55c049da50e7,1de39b55-7877-4358-b91f-20faf03a6272
dcc17f08-1a15-4c03-b613-444b67488c0a,d5f6ba26-1832-4314-a2fd-f9b60850c485,2026-03-30T13:58:02,,"Others realize oil order box because. Any occur some himself skill coach.
Range ok member school himself.
Individual heavy sell. President nor clear which.
First whole likely fight surface.",2026-03-10T16:17:09,assigned,Sea among interview a. Environmental south collection son.,West Cynthia,8284.26,25,urgent,2cddc46a-a152-402d-9bba-a81dbc516e31,2026-02-22T13:36:22,2026-04-07T10:18:07.830648,8c7caefe-2471-455e-81f6-e9f3c1111829,0dc81666-cb3d-4c8e-81e8-ecadb95d0de6
22a46c59-7a48-464a-ac9d-c8fd633818a0,ca08ace8-52c5-4d85-8659-6c4ca8d07a0c,2026-02-12T04:59:37,,Tv morning word not page less sure. Particularly with least per or eat campaign.,2026-02-25T08:02:49,assigned,Gas but good today nation guy early. After term picture those.,Port Candaceborough,964.26,32,emergency,1fab7158-54bc-4774-afef-3c6f0c7b6c1e,2025-08-04T20:16:02,2026-04-07T10:18:07.830800,3af91729-a2fd-481b-a385-1b4a4b372430,556663d9-519b-40f3-bac4-f4e4b72eec5f
bb57680f-67e0-424c-a0a6-00963663ea9c,159610a4-4b4f-4948-abd0-c010992f70a8,2026-03-05T11:53:39,,Season another husband training care religious still. Fast industry full bill clear.,2026-02-27T02:07:30,assigned,Eight sure hold president young. Represent culture safe step reason degree require point.,Victorland,1164.53,68,urgent,7e65792d-9921-4c85-8102-cccf8186193b,2025-12-07T12:28:35,2026-04-07T10:18:07.830969,7c4ee3e9-de5e-4247-bdeb-29819de2cdfc,7e60b368-7f1b-4be5-9da1-924dffab8ea6
c6c1f2c8-7be6-4c4b-a24b-11398beef633,4195973a-1e8f-47c7-af89-4b7e5e46de81,2025-08-03T00:41:31,,Respond suffer early bed than around. Door bad employee tree turn create trade. Thank nearly no send onto time. Animal movie yard that college action.,2025-09-08T18:48:57,unassigned,Pick network day with data kind. Hard company tax recently. Close send law run.,Ronaldhaven,9294.37,9,routine,65243d2f-5486-4599-87f2-5f271bc649aa,2025-04-12T21:00:16,2026-04-07T10:18:07.831134,d9f242d8-ee68-4b0f-9038-7fa7f01dfa1c,3d70efcf-287c-4444-a7a5-22ab269331f8
3e7bf2e9-8e89-4037-ac53-d5e7f1d0ee6b,38939c64-27d8-477b-adbf-3eb952a9ff97,2026-03-10T09:13:16,,"Now despite to try politics. Production Mrs shake behavior safe whatever eye.
Then against billion toward education son minute. High fund see defense sound color eight. Front policy sister dog.",2025-09-08T18:46:31,in progress,Direction level entire detail foot son. Magazine above president whom player enjoy support.,Nelsonstad,2404.01,15,routine,8c2e0996-ae50-4c15-bc25-3b3b3a95896c,2025-07-24T20:24:01,2026-04-07T10:18:07.831307,a4c61627-9d6e-4413-93e5-7a460e3cb5a8,70a1212b-13e7-4ae5-9a0b-5c5f9e0b80dc
7f15f502-73b6-45ec-af99-49a2dad71969,d5f6ba26-1832-4314-a2fd-f9b60850c485,2026-03-07T03:08:02,,Everything then town fill though body resource. Can first even but direction matter.,2026-04-12T01:10:38,completed,Author for fear kitchen myself girl prepare behind. If chair concern allow include Democrat.,East Madelinechester,1490.58,31,emergency,6c483a54-0e49-4e56-b143-f6e53094418e,2026-01-21T12:27:59,2026-04-07T10:18:07.831449,bc0be9a8-961e-4819-bb8d-a0e149674352,4c374c69-b90d-4072-8235-ea44a9ae98c9
22d9f4a9-6fc2-462d-83ec-da06a7ee381a,9469901e-742d-4522-9bba-d1217399375e,2026-03-13T13:35:32,,"Until now effort why. Program simply body its husband yourself less else.
Old sound model between. Social forget commercial part marriage.
New page personal not staff decide free.",2026-03-22T18:32:38,assigned,Power notice with country direction last security. Forward challenge could yeah.,Yatesmouth,137.4,64,emergency,cc6b5a32-4f32-4a4b-8cb9-14c4cd447a59,2026-03-06T00:09:14,2026-04-07T10:18:07.831664,89ca99f1-0735-4e33-ace9-27e38657f08e,5a2cd4b3-6bee-4fec-babf-c51b4a135352
2bc716a9-9250-416a-aa18-17cdf0b6f142,9469901e-742d-4522-9bba-d1217399375e,2025-07-09T05:36:17,,Growth nice throughout miss window design identify kitchen.,2025-09-04T12:41:13,unassigned,Left yes election main eye body bed. Trip southern prepare action. Make threat rise.,New Lukestad,2576.76,60,routine,b3d2c9bf-a801-4277-8a1d-107b3160265a,2025-04-07T07:38:03,2026-04-07T10:18:07.831820,a7b1d675-a493-4949-bdb2-4ea6293f5784,6f016478-384b-4a25-8b16-52e16dd97d9e
811f3627-78d5-4298-9705-0f1550d7ee53,9469901e-742d-4522-9bba-d1217399375e,2025-10-22T09:09:58,,"Degree create go wife page. Result spring music war.
Last couple skill wind. Start push indicate wish fast. Today father like better worry then art.",2026-02-10T22:00:40,completed,Middle act pick. Across range policy then.,West Josephfort,1486.24,39,routine,cc6b5a32-4f32-4a4b-8cb9-14c4cd447a59,2025-09-30T20:45:03,2026-04-07T10:18:07.832009,e237d37b-dbe6-4ac8-8fa5-358cddfe59a7,c791239a-b113-445d-a559-c79af50ebc2e
4e8d8032-b318-4978-8a56-eac7d660848d,ca08ace8-52c5-4d85-8659-6c4ca8d07a0c,2025-12-03T09:42:04,,"Fill group huge south. Learn whom leave student case summer five.
Dream since either series agent. Any police wife throw effect.",2026-02-12T22:03:29,assigned,Knowledge area at realize trade build produce together. Boy turn smile class strategy human wonder.,Lake Jeffrey,4248.34,37,urgent,6edce5fb-6eb5-4d55-bfd0-c35755c6e9cc,2025-10-23T17:50:42,2026-04-07T10:18:07.832202,91044009-1d8a-4f3d-9a12-859a202a666b,dbe685ff-199f-4be3-88a4-69f81bec126a
7ed822ad-4749-4ded-bb63-13211a750ea8,4195973a-1e8f-47c7-af89-4b7e5e46de81,2025-08-15T19:58:10,,Success enough exist suddenly the. Account along indeed ground weight. Accept wrong speak laugh.,2026-04-10T11:28:44,unassigned,Successful suggest ball sing church. Boy give finish. Modern little but late take.,South Brent,160.98,27,emergency,69cefa9a-d560-4a17-a13d-a5652e00e8a1,2025-05-02T08:13:11,2026-04-07T10:18:07.832367,546d4059-73dd-4792-83e2-ed45c109cabc,92b61437-66c8-4510-85d7-09f0e1b8fad1
4cb33084-0e5e-4832-8b5a-fb939b621f3a,d5f6ba26-1832-4314-a2fd-f9b60850c485,2026-01-14T10:20:58,,Artist realize born too. Else difficult world impact follow idea kid. Fact job quality pay boy.,2025-12-07T23:53:11,completed,Bank ever drug eye start student. Budget away take budget pull decide task. Wind risk program Mr.,Port John,2283.75,64,urgent,08d7a575-b2cd-4102-92e6-261b6319675f,2025-11-13T06:12:00,2026-04-07T10:18:07.832655,25a6a9c6-b55c-4db9-a647-b7fb0af4d9ec,92b1ab8a-cbd4-4adc-9bb3-3fe6ad655496
e8de72e6-1d62-469c-9367-19573e7064d0,d5f6ba26-1832-4314-a2fd-f9b60850c485,2026-03-28T16:44:07,,"Everyone back away treat executive price part. Fear option painting man.
Drop bring company rich piece. Before owner others why serve group because pull. Strategy my author court maybe in.",2026-01-06T16:37:28,in progress,Glass myself around pull cell cup. Allow special must race behind middle.,Whitechester,174.5,62,urgent,30d0a7b2-e936-429a-802f-51418eade57a,2025-12-09T02:21:13,2026-04-07T10:18:07.832932,433d81af-d435-400f-8b00-93997923f423,6049a750-8a66-492c-88bc-407b3c6aede4
f1185245-d5d5-4806-90f8-ac02702c99df,d5f6ba26-1832-4314-a2fd-f9b60850c485,2025-06-23T00:44:29,,"Wrong mean less official little weight him. Factor some book until budget class.
Language none medical push travel. Have floor rise every training second much.",2025-10-03T05:32:14,completed,Simple treat soldier drop maybe perform. Heart resource reduce century civil cup it evidence.,North Michelle,6218.55,9,urgent,05cf787c-49ff-4d04-b65a-b5fe04cba979,2025-05-22T03:09:10,2026-04-07T10:18:07.833097,818e86c0-653b-4564-a049-944030cba6fd,789f2a28-fb91-4b9b-99ae-2d8d17e3795a
0ace2fe1-7a1e-47c4-9201-c005553fb32a,00ce0e5d-dabe-447d-8247-cec72142417d,2026-02-04T15:10:30,,Despite activity difference imagine our. Before force way audience class person. Unit security bed figure financial.,2026-02-02T10:50:39,assigned,Building learn hold of respond wear guess. Popular raise detail cover every.,Port Christopherfort,2003.73,48,emergency,1d29b680-7148-45d8-8082-e64384b3fcc2,2025-12-13T13:41:11,2026-04-07T10:18:07.833271,00488eee-5013-4af0-8216-8507bdf20384,44d6fd73-740e-49d4-9c55-debac7607b40
ae458319-beec-4bc4-8792-ff63e461953e,00ce0e5d-dabe-447d-8247-cec72142417d,2026-04-04T05:59:41,,"Price fall throughout bring person. Central discussion hospital bit improve follow company standard.
Production partner get relate film resource. Evidence go project. Where bar TV sing.",2026-01-20T20:44:17,assigned,Official dark those day growth audience. Few rock responsibility article hair scene arm official.,East Sara,6783.29,71,emergency,d0bf40fa-83f2-4c23-898b-3cb9013ee7fc,2025-09-04T04:04:03,2026-04-07T10:18:07.833475,920c9149-72a2-4e64-b48f-3fcd7cb9d9d6,2525b911-0be2-4904-8c52-eb3634a6f1fb
b1c54b0b-890b-4694-8481-919babe0eb47,ec609920-5b8b-4710-99cf-185d2b003772,2025-12-25T15:01:11,,"Pm hold study although trial factor.
Southern address ready ago step half happen money.",2025-12-10T12:44:42,assigned,Way anyone news moment. At person generation great read small message.,East Alejandratown,1369.89,3,emergency,d05489c3-cf4a-49c6-840c-5f7bc11506f2,2025-11-28T06:42:49,2026-04-07T10:18:07.833663,adedc788-d8af-4432-a0db-72f049c3813e,f0e6271c-6995-48d5-8de6-d9dc5dd02dd2
c2bf758e-0bb8-4c41-83e5-7e97b2a1b302,f9923c46-a9a0-4f7d-95b8-8b0238e212f8,2026-03-17T19:30:12,,"Create build either past dream. Nice suffer production guess wind.
Role business determine board. With increase thank great study ever. Air still sport each investment.",2026-03-30T15:46:46,assigned,Happen upon region daughter section which. Various yourself among modern. Else husband would.,Monicaborough,783.38,37,urgent,2fc55cb8-ba54-4615-84aa-f727953c1a26,2026-03-04T09:11:09,2026-04-07T10:18:07.833849,cb514206-c824-49cb-b19d-faf132ea65ca,85c0b1d4-05b5-4c35-b1b7-106cb8011f0d
61cdeea9-57dd-4aa4-a799-95f9a2e581df,ec609920-5b8b-4710-99cf-185d2b003772,2025-08-25T16:15:47,,"Will win culture by laugh as. Movement serious foot responsibility whom. Room anything kind.
Add prevent present describe the its test. Voice east difference box forward note commercial perform.",2025-10-19T04:40:26,completed,Actually when meet director without kid. Will young hour trial serious.,Colleenton,3555.17,62,emergency,65243d2f-5486-4599-87f2-5f271bc649aa,2025-07-08T21:36:24,2026-04-07T10:18:07.834017,9361f1a2-0636-407a-be2d-ff5183865500,61901146-88fe-45a5-8029-68f5e61796d5
0f579aac-c73d-43de-b9d7-aa79cacd2515,38939c64-27d8-477b-adbf-3eb952a9ff97,2026-03-08T10:32:54,,"History market woman boy vote much. Any head them nation out.
Her paper pick whether race seven education. Television popular miss. Environment church authority three around.",2025-12-23T20:19:05,assigned,Station play again help compare. Nice to agreement raise hair give.,South Lisa,5630.9,20,urgent,17dab9f7-fc8f-4bea-b9a5-8a0b11775be2,2025-08-18T14:06:05,2026-04-07T10:18:07.834188,20e68283-9d9a-457c-ac74-f69cb9c2ad84,c415ed5f-7b4c-47d6-8957-556efa387c02
b7d6c6d1-a790-495d-961c-654dfd9f1e25,159610a4-4b4f-4948-abd0-c010992f70a8,2026-01-08T00:25:28,,"During ahead yet front. Outside old wind operation family.
Choose might adult. Audience recognize you speak nice less back company.",2025-09-20T19:25:10,in progress,"Threat example personal million must take.
Apply school meeting clearly. Yourself lot mention.",West Thomasbury,2541.53,8,routine,9877b53f-f558-4a80-9047-f136e062e325,2025-08-13T22:24:38,2026-04-07T10:18:07.834357,7b45ca3f-3856-4e60-a3e4-dcbc0b83f1fd,cc85b91b-5da8-43d4-8e69-4c4fccdadffb
c32bb3ad-5d12-4bb7-b06b-b57a693387d0,ca08ace8-52c5-4d85-8659-6c4ca8d07a0c,2026-04-05T14:21:06,,"Movement member your meet score move. Imagine recognize reality international. That against lawyer night coach.
Like choose condition put. Blue feeling young instead.",2026-01-23T04:54:18,assigned,Mean very year number decision appear ask energy. Floor resource management heart smile.,East Deborahton,9391.33,4,urgent,9774c0b5-6317-4794-bf97-42efa48f1dce,2025-12-13T18:28:01,2026-04-07T10:18:07.834543,48f2faef-aab1-43d3-8593-e5209eaedfb8,19b68d7f-8bc7-4380-aefb-1112fe8e0e7c
b8b27837-d410-4a51-9dcb-f2b89f85e079,38939c64-27d8-477b-adbf-3eb952a9ff97,2026-03-30T00:10:27,,"He political step race than successful. Our room community unit. Much throw machine any.
Number outside clear benefit for his national. Whatever son natural first claim computer.",2026-03-24T11:57:48,assigned,Seek recently wife bill road really. State start half beat memory under.,Smithfort,6178.33,16,routine,8c2e0996-ae50-4c15-bc25-3b3b3a95896c,2025-12-19T12:54:21,2026-04-07T10:18:07.834817,619c3d4d-7275-4613-a292-239d95a75771,96b83516-e6d7-4c50-bc91-255230dfc0f7
203dc266-4bed-46cb-bfce-3bb54877ea18,159610a4-4b4f-4948-abd0-c010992f70a8,2026-04-04T12:29:16,,"Threat represent music window like dream mention.
Activity among together condition follow American fill. Executive occur onto investment. Movement itself action market left.",2025-12-19T09:31:12,unassigned,Site everything region. Effect mother area camera similar store. Them onto she.,Raymondchester,4143.86,63,routine,7e65792d-9921-4c85-8102-cccf8186193b,2025-10-31T13:34:38,2026-04-07T10:18:07.835037,4acf9c29-d3e3-4937-a67f-085e4db26430,80c92deb-27aa-485f-b2e9-ff39cea434af
57ae7202-4308-4e80-8d06-c9bc5aacefa3,ec609920-5b8b-4710-99cf-185d2b003772,2026-02-22T17:42:52,,"Race necessary approach tough provide. Just cause wonder voice.
Arrive born series attack fall. Bill head speak medical side camera recently.",2025-10-21T14:30:06,in progress,Rich prove effect question couple.,North Jeffrey,4587.31,21,routine,53ed9b92-d8a2-4f53-99e9-d402d60b4249,2025-09-22T00:07:10,2026-04-07T10:18:07.835205,7651cb43-3929-459d-84d7-b6031fb976d7,5bd3dd6d-01f9-4487-ba34-998901ce45ae
2882f025-9ef2-490e-945d-5a5c99ccec42,ca08ace8-52c5-4d85-8659-6c4ca8d07a0c,2025-09-02T10:07:10,,Live trouble improve appear risk hold. Four blue line her throughout indeed eight. Back before all end stand seem fact.,2025-11-16T08:26:12,unassigned,Series sure most. Cold remember improve radio project.,Bowmanfort,4083.19,44,routine,73f34cca-7069-47c7-bbe4-07ffcddfe219,2025-07-07T10:59:04,2026-04-07T10:18:07.835417,9d740dd4-86c1-4812-9be3-663b90865977,facf7bbc-3f6f-49d3-ae4d-f63b8cf2ffab
02600eeb-9812-4e3c-93bc-d2ae6e9d6614,f9923c46-a9a0-4f7d-95b8-8b0238e212f8,2026-03-19T10:32:22,,"Open represent culture animal.
Open down former safe various language. Candidate possible network prepare.",2025-12-05T02:37:57,assigned,In not relationship agent.,New Monica,4275.72,54,emergency,6edce5fb-6eb5-4d55-bfd0-c35755c6e9cc,2025-09-22T20:49:32,2026-04-07T10:18:07.835587,63109c3c-cd9f-4073-aea9-e546bab2c9a9,3e16b320-c4ae-4b25-853c-59b034fcca4f
e8683d6e-22ac-4a5e-bd0d-7c4909f01ee1,f9923c46-a9a0-4f7d-95b8-8b0238e212f8,2025-09-23T10:35:31,,Tough trade people much charge. Data win explain including history hot political. How reason only continue pull risk quite. Four require take scientist pretty effort heavy.,2026-03-13T16:06:05,completed,Age miss student visit situation expect. Understand of garden character.,South Nancy,342.46,14,emergency,c2b6b348-b8de-47ff-a980-4cc2907db28f,2025-04-26T11:55:22,2026-04-07T10:18:07.835734,6391316e-cad6-45e4-b68f-87050032d1f2,67a1333c-76b3-46ec-9652-834510e9003d
0b7a5923-f84d-49f0-b774-79f4e38cc051,9469901e-742d-4522-9bba-d1217399375e,2026-03-10T10:25:40,,"On push week economy thing least husband. Hot town provide approach. Science yet professional girl unit.
Process guess argue. Money big certain become candidate today development note.",2026-04-12T07:42:35,completed,"Word certain design student.
Party play risk practice seek.",New Denisemouth,6701.41,5,routine,cc6b5a32-4f32-4a4b-8cb9-14c4cd447a59,2026-03-03T14:00:01,2026-04-07T10:18:07.835923,efdcfff7-ddd3-4d53-8e96-e2930ba6506f,cb9292d4-570a-4690-b2d7-e7ed535088a9
12dfab02-c7d7-40f7-9c7e-4cc551f42cfc,d5f6ba26-1832-4314-a2fd-f9b60850c485,2026-01-04T04:30:13,,"Understand ok share question conference eye my. Ask list dream unit avoid standard among.
Green now effect economic. High thus glass onto.",2025-12-26T20:39:19,unassigned,Someone discover draw. Expert yet popular analysis identify top wait our.,New Ashleyberg,8202.62,26,routine,05cf787c-49ff-4d04-b65a-b5fe04cba979,2025-12-03T23:09:26,2026-04-07T10:18:07.836123,d677f86e-80c0-4b89-9705-5dbdafc57ede,18b7f3ac-2d09-4381-9c1a-cf613c5cf139
a71cae8c-bc37-4986-972c-e01a0a05f28d,38939c64-27d8-477b-adbf-3eb952a9ff97,2026-01-09T00:00:57,,"Care save be cell admit. Old to brother exist state environment work anyone.
Drug arrive reduce city. Beat our staff down on attention. Vote foreign need difficult town community.",2025-12-30T03:47:01,completed,Spring mouth meet Congress your interest. Simple since point physical deal lose.,Jimfort,1353.47,8,urgent,e5bb5156-6f65-4357-9528-0e03c0bda526,2025-07-26T12:22:48,2026-04-07T10:18:07.836293,f9dda743-82cd-44ac-b63a-52c114a3da17,37d11928-f720-4dbd-b08f-2580ac399131
9b696c2b-203f-4cba-b525-fad443b5b8fb,159610a4-4b4f-4948-abd0-c010992f70a8,2026-02-15T08:27:45,,Could product think PM reach author leave. Hundred state cold under send she get. With miss visit little agency move.,2026-04-12T13:06:17,in progress,Your course ball late better. Up also in memory. Per mother possible decade run coach this.,Billyview,269.17,70,emergency,9877b53f-f558-4a80-9047-f136e062e325,2026-02-13T01:53:57,2026-04-07T10:18:07.836521,81f4883e-7020-4883-9863-c0f2c631fc97,3d78bbc8-c708-476b-a796-afe9f2cd451f
b1d94a9e-1c4f-4454-b17c-a2a423b518d3,38939c64-27d8-477b-adbf-3eb952a9ff97,2026-03-20T10:02:05,,"Television commercial fall hand. Plan still raise month fund blue. Himself give fight result.
Partner stage base admit large financial. Tree our single hour. Down save summer take.",2026-04-07T19:16:42,in progress,Money wonder recognize. Live likely stand prove worker.,Mccallberg,9299.95,1,emergency,0bfb698e-0d8e-4ba6-9f17-7ac0a4ca2180,2025-11-18T03:49:22,2026-04-07T10:18:07.836754,5d9a533e-58ec-41f6-9859-e4be357aecaa,e27e5e75-5b29-4359-9af6-a287ff9fed1f
711a122d-1440-4cdd-a927-89058d033f9e,ec609920-5b8b-4710-99cf-185d2b003772,2026-01-25T19:03:08,,"Tend she good human statement artist score. Two successful fund. Four condition decide while parent.
Type represent cultural image likely I. For might enter us.",2026-02-26T21:27:02,in progress,Operation rate then case.,Marytown,7343.93,59,routine,51ca7b96-72d2-4eb0-8c58-e0e0074f6858,2025-08-05T11:58:11,2026-04-07T10:18:07.836928,368c2b1b-4958-4c7b-a4db-5bc4b3e8342d,ecca3f03-4c27-4541-a997-1e8adecf8528
