work_order_id,assigned_vendor,client_id,assigned_at,completed_at,description,estimated_start_date,estimated_end_date,current_status,comments,location,location_type,latitude,longitude,estimated_cost,estimated_duration,priority,well_id,service_type,estimated_quantity,units,is_recurring,recurrence_type,cancelled_at,cancellation_reason,created_at,updated_at,created_by,updated_by
39898bdf-e1a7-45d9-a64d-e9938f01ac3c,3dd270ee-41ef-47ed-98c8-22b2af21b4aa,e51e2d86-c1f3-4d90-90f1-7117fb277a1d,,,Much have series last again different. Huge leave rock plan seek. Should use with street again.,2024-10-30T03:45:52.082032,2024-11-01T03:45:52.082032,UNASSIGNED,Soon compare home different easy ahead short. Situation security election.,Kevinbury,GPS,-73.8731845,33.571414,26043.22,"2 days, 0:00:00",LOW,4129097d-5780-4d9f-b4d4-0e0d8773a7c8,ba2aec32-4f9f-4149-8dcb-c98d113c1dd1,10.89,loads,True,ONE_TIME,,,2024-10-26T23:14:18.277173,2026-04-12T23:49:46.115565,a64defd1-cd84-4c78-bea9-1afe6e33f20e,70376818-fc51-4152-b27f-9c6707be5fb9
e8a237d8-84a9-42f4-8f2a-a1f9572caf8f,4c23bea9-bb9e-4064-83d9-a54f94a01185,60bb88d6-bc9d-4ef9-aa1a-8c2aeb77deed,2026-03-29T15:09:43.644188,2026-04-07T00:49:50.956016,"Beyond knowledge reduce might. North tonight who.
Too wind tree campaign free usually. Dark president boy actually share very move. Population ever yeah story beyond line dog.",2026-03-31T04:32:47.028604,2026-04-05T04:32:47.028604,CLOSED,Science air enter right think good position. Quickly somebody specific go.,Gloriabury,ADDRESS,-28.231947,91.186743,47650.91,"3 days, 0:00:00",MEDIUM,fa7d170b-641d-4d49-8537-bfc423984553,73148b49-8f75-4090-8b7e-23d5ea575b39,45.31,loads,False,,,,2026-03-27T14:06:00.679307,2026-04-12T23:49:46.115782,bbba68ed-4135-4f33-bbf5-c1785d4dcbd7,a15b43e2-d9ff-44b8-a875-5c98702ffac7
3aff0d2f-ebd0-4baa-bdcd-2ae4cbf19daa,0709cc65-6c9f-4f4d-8ae3-f0bbc2a2a1a8,e51e2d86-c1f3-4d90-90f1-7117fb277a1d,,,"Raise training similar its natural shake beautiful rest. Huge product social cover wife offer.
Walk police democratic use ever note. Economic itself article you mission kitchen.",2025-10-27T17:19:59.470134,2025-11-01T17:19:59.470134,UNASSIGNED,Turn life game consider shoulder. Husband particularly might former several.,Edwardsmouth,ADDRESS,48.9575105,-19.949613,21532.46,"3 days, 0:00:00",MEDIUM,f604a61f-acf2-4152-9792-47a6dc2ac94e,73148b49-8f75-4090-8b7e-23d5ea575b39,6.11,gallons,True,ONE_TIME,,,2025-10-27T06:20:17.604514,2026-04-12T23:49:46.116015,e17714c2-9ee1-4223-af8c-811e8d477cfd,17cd6f76-0710-4115-91d1-50efca3a9c7a
76ad5ad8-8946-4a8b-a2bc-1262f631b86b,9deb59e9-2b41-4fa0-b272-fa2b3dc749de,29689696-7a26-4c08-8f61-b3d86c203be7,2024-07-06T19:59:07.760197,,"Job many significant cultural parent music PM. Turn gun expert well.
Budget their professional they southern finally maintain. Find blood energy billion she pretty. Pressure fall simply.",2024-07-07T07:58:19.510891,2024-07-10T07:58:19.510891,IN_PROGRESS,Career kind majority black. History maybe full still own strategy. Race example maintain travel.,Nguyenport,ADDRESS,-81.158666,-97.024922,42947.71,"2 days, 0:00:00",HIGH,e8c8c122-0036-4c3c-a569-ea1b7cc604fb,1fa126ef-30c4-4cf2-9294-a6d23c75936f,25.56,loads,True,ONE_TIME,,,2024-07-05T04:42:02.380329,2026-04-12T23:49:46.116221,6bdadb47-8c52-485b-867a-c077983abe87,d1b25bdf-3f90-4cee-a9b0-cda0b2fdf72e
c0580273-26a7-429f-a58d-107815a807ef,4c23bea9-bb9e-4064-83d9-a54f94a01185,60bb88d6-bc9d-4ef9-aa1a-8c2aeb77deed,,,"Focus start policy never whom. Add collection nearly his information wrong analysis. Never half myself.
Shoulder memory according easy a until lay. National however model look.",2025-08-31T23:58:13.415500,2025-09-05T23:58:13.415500,UNASSIGNED,Both especially give within. Wish yeah arrive able. Lawyer care production story.,New Debra,GPS,-19.523726,34.749605,8098.46,"3 days, 0:00:00",HIGH,4f1b3fa1-5528-421f-93e4-caf6c5422b2a,73148b49-8f75-4090-8b7e-23d5ea575b39,85.17,days,False,,,,2025-08-30T18:33:28.542408,2026-04-12T23:49:46.116412,eebfc817-5a6a-43dd-9648-9f389e0d6add,e8b80f30-48bf-4c80-8f9f-729bac9eaf64
2f8a257a-8e8b-43d1-b110-0f9cb959fafc,62aab707-f2c5-4283-86fb-7bdb83f4ac9b,a0be935d-e8a0-460e-9e83-b7480a847df3,2025-08-03T19:20:21.122215,2025-08-09T15:11:10.699911,"Production ago fly travel. Hand affect player only beat rest own. Wonder themselves teach various.
Investment not physical church. Cost other trouble.",2025-08-05T10:30:32.920378,2025-08-09T10:30:32.920378,CLOSED,Prevent would stock newspaper product green soon.,Morganchester,GPS,44.2762985,-166.851333,32246.57,"3 days, 0:00:00",MEDIUM,5bac6ecc-7104-4ea1-ad26-42664373e19e,73148b49-8f75-4090-8b7e-23d5ea575b39,81.11,loads,False,,,,2025-08-01T20:42:33.623782,2026-04-12T23:49:46.116599,0ac85ecb-0e78-4d3e-806a-01ed4aaf145f,8efdfcbd-5362-4af3-bafc-ff6b7cb4bb25
db1e5488-e811-488a-8950-e44ad3a6cf76,62aab707-f2c5-4283-86fb-7bdb83f4ac9b,d4347d99-2c69-4d0e-a2c0-37c94f738087,2025-09-06T23:49:48.721550,2025-09-13T00:59:19.087490,"Billion reason no.
Herself charge region fall population. Six question above win general.
Hotel prepare tough. Reason sit anything voice speak. Ready today study mouth machine leader drug.",2025-09-07T20:11:55.234463,2025-09-11T20:11:55.234463,COMPLETED,Respond stop economic. Film show ball add enough simple animal.,New Melinda,GPS,11.507877,4.802918,29421.13,"1 day, 0:00:00",HIGH,d1e8d137-cb36-4c77-a505-018795e38454,73148b49-8f75-4090-8b7e-23d5ea575b39,94.65,hours,False,,,,2025-09-05T08:25:44.934142,2026-04-12T23:49:46.116812,b877c947-262a-47f9-9c94-768101dc201a,e7ff1391-42b8-4ec1-80e4-dfce349e5065
f2876a86-b11f-411f-8236-548ea4752d2e,9deb59e9-2b41-4fa0-b272-fa2b3dc749de,ac5b1c50-7bd0-4ab9-ae40-7f1e992ad093,2026-03-11T04:34:59.177224,,Meeting newspaper wait theory growth right. Several environment whose local cold husband.,2026-03-11T21:43:48.331606,2026-03-15T21:43:48.331606,HALTED,Professor east use charge. Pattern pass suggest three. Ball accept blue really.,Lake William,WELL,-68.123678,29.896305,32059.87,"1 day, 0:00:00",HIGH,a127374c-ede5-421e-8ccf-3697b632f691,1fa126ef-30c4-4cf2-9294-a6d23c75936f,72.37,gallons,False,,,,2026-03-10T02:40:08.574246,2026-04-12T23:49:46.117005,43055e3b-0d0c-4554-b22b-50680a78d57a,b134fa5b-490d-4339-b10b-a33f5699f43d
60d5261d-2999-4c53-92da-6ca3d6684e8f,600ad80b-c837-4db6-b132-5c5f8b995ef6,dcc1e17c-3547-4d18-8cc2-b9e8053b19d4,2025-07-16T10:41:39.617375,,"Him whose first purpose music country smile. Play class attack reason student save. Teacher create ask.
Have recent majority. Cause physical son sell. Unit perform Mrs why kind.",2025-07-18T06:58:29.915385,2025-07-23T06:58:29.915385,ASSIGNED,Computer have might who Congress. Five matter true she year specific.,Smithfort,GPS,14.1181,-55.22256,20823.91,"3 days, 0:00:00",HIGH,613e5115-980b-48b6-a587-4d146b255bb1,ba2aec32-4f9f-4149-8dcb-c98d113c1dd1,55.59,hours,True,MONTHLY,,,2025-07-16T04:09:55.702696,2026-04-12T23:49:46.117224,2f227ddc-d0f5-46e8-935d-bcc06437ee28,a3a73cf1-76a1-4383-9a29-4e7ecd3f7be2
bcf0b9c2-22ea-4575-9ded-56a50de6e03e,4c23bea9-bb9e-4064-83d9-a54f94a01185,60bb88d6-bc9d-4ef9-aa1a-8c2aeb77deed,,,Quite able power whom section. Early happen everyone report point.,2025-12-08T23:49:07.077484,2025-12-13T23:49:07.077484,UNASSIGNED,Expert like theory either through until. Sort to animal if baby break.,East Matthew,ADDRESS,6.022047,35.738951,46915.88,"3 days, 0:00:00",MEDIUM,4f1b3fa1-5528-421f-93e4-caf6c5422b2a,73148b49-8f75-4090-8b7e-23d5ea575b39,74.0,loads,True,MONTHLY,,,2025-12-07T14:57:48.025559,2026-04-12T23:49:46.117408,c575516b-9fca-47d4-a373-63a7945c1c0f,dd68000e-ac5e-4586-8ee2-a7a10c718a87
cee1f916-fb74-4048-a980-a1ce5d604523,9deb59e9-2b41-4fa0-b272-fa2b3dc749de,29689696-7a26-4c08-8f61-b3d86c203be7,2024-10-05T02:51:30.503113,,News third partner sing. Morning hope night analysis generation. Major where stay subject traditional about.,2024-10-06T05:29:21.986042,2024-10-08T05:29:21.986042,IN_PROGRESS,Production four political structure note. Friend serve page win bring.,New Brianbury,WELL,-26.251434,22.248803,31972.57,"2 days, 0:00:00",MEDIUM,def1f21a-dcf1-4f27-9d19-42340a3ec6a2,1fa126ef-30c4-4cf2-9294-a6d23c75936f,92.3,loads,True,WEEKLY,,,2024-10-04T00:10:22.698093,2026-04-12T23:49:46.117658,18cebf99-499a-4493-bb86-f6b24243ac7d,5005a0f5-0c63-4635-a962-8e3d8dbb5915
4bebedd8-3708-45b9-9a23-8967be22d4db,1d7e9e8f-40be-49dc-9672-3aa65ee2f0d0,ac5b1c50-7bd0-4ab9-ae40-7f1e992ad093,2024-05-23T19:08:53.023669,2024-05-27T10:00:43.307842,Like right instead majority usually sit. Cost certainly fly our nation likely. Ten crime risk consumer feeling watch choose.,2024-05-24T04:09:25.564905,2024-05-27T04:09:25.564905,CLOSED,"Certain race sign technology fact would.
Your federal commercial full.",Port Heidi,GPS,3.5370665,-161.42127,14832.08,"1 day, 0:00:00",LOW,20d17604-106d-416e-b623-92bcea21b9ec,4e7fc312-7d39-40c4-8680-e6cb72b0aa8b,27.11,visits,True,MONTHLY,,,2024-05-22T08:13:01.889513,2026-04-12T23:49:46.117825,a76fc7e7-36a9-497d-8346-b7b3fdec1c03,63c5290f-a5d9-4460-b6b9-41a8b538ef54
770339ef-1212-48c0-a8c6-9901b55b35d8,3dd270ee-41ef-47ed-98c8-22b2af21b4aa,d4347d99-2c69-4d0e-a2c0-37c94f738087,2024-11-04T14:24:58.067459,,Cultural west everything good culture. Need speech those tell debate mission. Popular old skin bag town unit against. Several often season future lot.,2024-11-05T23:44:05.012523,2024-11-08T23:44:05.012523,IN_PROGRESS,Great improve president without central process. Inside population ago positive now enter any.,Lake Elizabethborough,ADDRESS,38.4344515,-141.777075,37029.84,"2 days, 0:00:00",MEDIUM,b8c78a4b-7965-4d4c-9546-ad7c50461653,ba2aec32-4f9f-4149-8dcb-c98d113c1dd1,90.82,visits,True,ONE_TIME,,,2024-11-01T20:58:37.421685,2026-04-12T23:49:46.118034,e8bec9f1-de12-4a45-9310-a83a96db639c,afc24f12-bee0-4fb8-b471-17af0e1bfafb
96dd7fa9-a40c-49d8-b2f8-a1b7f7e3ce35,f1c4b27c-6e22-48a1-a23c-8d646460dcc9,17466069-387c-486d-be2b-cfeb30f62c1a,,,"Some amount assume put very. Easy travel people throw half risk way.
Yard clear teacher I. Know just less itself practice property fact clear.",2024-12-24T02:36:54.274202,2024-12-27T02:36:54.274202,UNASSIGNED,School lot respond present. Evidence once step.,Robertsview,GPS,-67.0223205,-110.157516,12769.78,"3 days, 0:00:00",MEDIUM,04847602-db19-4c1a-8aa5-9b8645d42d3d,7b6dfde4-99be-4a0d-8299-9105d88c6974,67.25,days,True,WEEKLY,,,2024-12-19T15:51:34.281311,2026-04-12T23:49:46.118217,5be62967-d4bf-42b7-b32c-23d519a6127c,3d538fa4-5162-4f33-9d38-8358a2405af4
587421d4-bd86-44f3-810f-13a2c5c80e21,87557121-007b-4e66-9a6e-733b6e2bc363,e51e2d86-c1f3-4d90-90f1-7117fb277a1d,2024-06-06T06:34:27.566682,,"Avoid song have act because. Message near although indeed side know special.
Break mission generation author idea. Go entire capital leader appear choose garden.",2024-06-07T14:47:38.151470,2024-06-08T14:47:38.151470,IN_PROGRESS,Action effort recently material water girl. Support along customer to. Certainly just focus all.,Katiebury,WELL,-26.974175,38.779991,49952.03,"2 days, 0:00:00",HIGH,55cc771e-8dbf-4458-99f1-b737796f672a,73148b49-8f75-4090-8b7e-23d5ea575b39,95.14,hours,False,,,,2024-06-04T21:34:05.289783,2026-04-12T23:49:46.118389,3d09cfd6-08ce-4de2-beb9-bb09153548c5,a54aec89-3125-40e0-98b5-77b5c14fbd2f
848e89a6-caae-4e08-88fa-7f68c3118a18,1d7e9e8f-40be-49dc-9672-3aa65ee2f0d0,6bb8f685-7691-4a60-88bb-50753e20ce29,,,Offer site strategy opportunity better significant study significant. Specific particularly measure. Strong technology later religious. Career red society continue minute tax fill baby.,2024-05-14T05:28:21.049286,2024-05-16T05:28:21.049286,UNASSIGNED,Recognize life standard country. Manage marriage might production lay medical. Manage member three.,West Shawnburgh,ADDRESS,-75.29983,121.682221,35516.93,"1 day, 0:00:00",MEDIUM,a0de8f0e-86b9-4bf3-af25-6fe76a535177,4e7fc312-7d39-40c4-8680-e6cb72b0aa8b,32.31,gallons,True,ONE_TIME,,,2024-05-10T20:48:51.908229,2026-04-12T23:49:46.118571,a5b368a3-d1d6-420b-ad10-4337e5518caf,996b72a5-8977-4ce9-ba40-6c4fa211f97a
29fb039a-5b7f-4bc3-80d9-c5ad32ac6bb5,3dd270ee-41ef-47ed-98c8-22b2af21b4aa,ac5b1c50-7bd0-4ab9-ae40-7f1e992ad093,2024-08-22T10:01:23.147486,,"Poor administration land window character speech. Safe quickly high successful husband think.
Week institution book beautiful who never. Pull person score. Probably public yourself hospital.",2024-08-23T06:46:19.692581,2024-08-28T06:46:19.692581,HALTED,"Fund TV quickly.
Design indicate perform guess reality opportunity measure.",Kimberlyberg,ADDRESS,-19.8714275,-66.622246,45320.97,"2 days, 0:00:00",HIGH,20d17604-106d-416e-b623-92bcea21b9ec,ba2aec32-4f9f-4149-8dcb-c98d113c1dd1,54.09,days,False,,,,2024-08-21T16:05:56.822162,2026-04-12T23:49:46.118775,2979ce04-5e0f-4446-8b71-089aef3820c4,15246876-d543-4e98-909d-e517b0e94f99
058f8c98-05e8-4c90-9ab2-d7e53c6ac9e5,0709cc65-6c9f-4f4d-8ae3-f0bbc2a2a1a8,d2da7803-13a5-4798-9361-17fc24fad9ff,2025-02-11T14:48:18.955299,2025-02-17T18:12:40.927499,Particular amount human ok several measure score too. Theory decision management enjoy add care watch last. Nor western behavior budget long. Four age really property American could.,2025-02-12T08:39:05.376983,2025-02-16T08:39:05.376983,CLOSED,"Debate music task.
Eat century tend. Charge dream trade spend if others pass.",East Hannah,WELL,35.154851,58.322639,43449.44,"1 day, 0:00:00",HIGH,43ba865c-66cd-4386-afe3-40990265f0a5,4e7fc312-7d39-40c4-8680-e6cb72b0aa8b,12.29,hours,False,,,,2025-02-10T10:32:59.090684,2026-04-12T23:49:46.118999,8c0c5399-7c43-47e3-bafa-179cf14deb63,0bd2dc22-b480-45d7-92d6-8a99c46bae9b
8a3e8e86-dd92-4ce0-a5aa-9d7324d044f9,ad31d7e7-9a34-4eb1-8030-317d6d9d1a4d,6bb8f685-7691-4a60-88bb-50753e20ce29,,,Sister social water college high. Model few somebody green. Once total religious onto him medical.,2024-07-18T05:36:13.875333,2024-07-20T05:36:13.875333,UNASSIGNED,Citizen usually coach.,Shawburgh,ADDRESS,-6.668616,-110.510303,23826.69,"1 day, 0:00:00",LOW,f0a7005a-7fa6-4d63-b289-e191fd63aec1,ba2aec32-4f9f-4149-8dcb-c98d113c1dd1,84.26,loads,True,ONE_TIME,,,2024-07-17T17:02:43.974824,2026-04-12T23:49:46.119199,6de7e87a-ecae-4105-ba53-ee33b6d181d7,9dbfdd74-d4aa-4904-abff-969329021e50
9afbda03-3f76-46fe-83dc-a4b1927f0bf4,f1c4b27c-6e22-48a1-a23c-8d646460dcc9,e51e2d86-c1f3-4d90-90f1-7117fb277a1d,2025-10-01T18:54:34.157236,,Despite stand economy police among probably return. From ready thing nearly create third cup effect.,2025-10-02T12:12:54.126119,2025-10-07T12:12:54.126119,IN_PROGRESS,Relationship receive might want away.,Joshualand,WELL,46.352388,-67.93609,3401.57,"2 days, 0:00:00",LOW,4129097d-5780-4d9f-b4d4-0e0d8773a7c8,4e7fc312-7d39-40c4-8680-e6cb72b0aa8b,10.95,loads,True,ONE_TIME,,,2025-09-29T05:53:14.156314,2026-04-12T23:49:46.119366,fadf2bd8-8c62-493b-8e3d-d6430beb8d16,83164cb6-ccb6-4db4-a546-0f442e32a3f0
41ed01a2-c87f-4f4d-bdeb-e3e9ddd22ae7,1d7e9e8f-40be-49dc-9672-3aa65ee2f0d0,dcc1e17c-3547-4d18-8cc2-b9e8053b19d4,2024-09-05T23:44:43.240136,,"Sell remain certain glass leader trip develop. Animal customer green pull.
Meet language test free alone fly. Machine traditional PM throughout himself arrive.",2024-09-07T00:44:50.404752,2024-09-11T00:44:50.404752,IN_PROGRESS,Firm indeed ask every thing some real whether. Present indicate nation away month.,Port Erica,WELL,71.198216,171.529878,45170.17,"2 days, 0:00:00",HIGH,27055957-25b4-46d4-b604-9328f729f93e,4e7fc312-7d39-40c4-8680-e6cb72b0aa8b,32.81,days,True,DAILY,,,2024-09-04T12:01:15.584503,2026-04-12T23:49:46.119550,bf364eee-94f4-40ee-9db8-da0e2cb5c7ae,fabde931-a7f2-43ef-adb3-55ebf74ee419
614410cc-c30a-485b-bc95-7b4fd255056b,ad31d7e7-9a34-4eb1-8030-317d6d9d1a4d,d2da7803-13a5-4798-9361-17fc24fad9ff,2026-02-13T21:07:58.786242,,"Southern news local him end care fear young. Executive boy cover evening.
Mother site industry green.",2026-02-14T18:32:45.655928,2026-02-16T18:32:45.655928,ASSIGNED,War rock life significant.,Loriside,GPS,-88.011314,-18.110178,1473.44,"2 days, 0:00:00",LOW,fcb34d6e-59f7-444f-a551-3fe69d12d4ba,19e95c4f-f46c-4431-bab6-f5797bcd52f8,79.57,days,True,ONE_TIME,,,2026-02-11T09:26:46.778352,2026-04-12T23:49:46.119739,8e3e6aa7-d9a7-48a2-a839-58e9c7e3ca31,c3ad2ebf-a998-4428-a3f8-cc52e85a91ce
84745a93-d12a-4618-a86e-a74f8f287ef9,3dd270ee-41ef-47ed-98c8-22b2af21b4aa,a0be935d-e8a0-460e-9e83-b7480a847df3,2025-09-04T11:32:00.593620,,Represent newspaper perform much later current today effort. Maintain film source billion. Knowledge lay lose wall be threat. Stuff idea assume major.,2025-09-05T06:01:28.722914,2025-09-09T06:01:28.722914,REJECTED,Rich poor it they hotel very away. Conference less wind picture. Election if window up.,West Katherine,GPS,-30.2181195,57.015961,36275.08,"1 day, 0:00:00",LOW,550bc3cd-5606-474c-a707-af5fb0d083ab,ba2aec32-4f9f-4149-8dcb-c98d113c1dd1,77.0,gallons,False,,,,2025-09-02T22:24:47.328415,2026-04-12T23:49:46.119921,c7e23e7b-14da-4bec-abc4-f69deec32ede,3c4d9bad-cd2d-43ba-85ae-6b4bebccd937
5f073987-580b-4bc1-b17e-d0a464929e63,600ad80b-c837-4db6-b132-5c5f8b995ef6,ac5b1c50-7bd0-4ab9-ae40-7f1e992ad093,2024-10-04T12:47:00.844172,,"Strategy stand benefit assume then military control. We newspaper step four.
Site whose late ago. Line into property culture that decide soldier. Top fear during cultural hundred fast.",2024-10-04T18:57:18.029875,2024-10-07T18:57:18.029875,ASSIGNED,"Rest today meet bring product. Seem six teacher seven north.
Star six ever test oil chair.",New Katherine,GPS,69.937349,-158.02143,15237.5,"3 days, 0:00:00",MEDIUM,dac3e8aa-5570-49ca-aa41-8c964b8f5bf1,19e95c4f-f46c-4431-bab6-f5797bcd52f8,32.04,loads,False,,,,2024-10-03T12:13:23.527407,2026-04-12T23:49:46.120146,6e8c60d0-d75e-4924-93ec-a4cc0b3e7bab,0a0ff648-1373-4aed-bcbe-f7573520c5e8
a31621a0-a444-4095-a211-37edb5da0730,ad31d7e7-9a34-4eb1-8030-317d6d9d1a4d,d2da7803-13a5-4798-9361-17fc24fad9ff,2024-06-30T11:00:30.423251,,"Glass fear worker bad next sell rich with. Alone down financial whom air ten force. Thank minute bad red customer.
Truth indicate trouble management cultural. Save blue travel general.",2024-07-02T00:29:47.799196,2024-07-07T00:29:47.799196,IN_PROGRESS,Training step within. My daughter huge too wrong.,Patriciafort,WELL,-34.2797865,-112.301263,12243.93,"3 days, 0:00:00",HIGH,fcb34d6e-59f7-444f-a551-3fe69d12d4ba,ba2aec32-4f9f-4149-8dcb-c98d113c1dd1,36.03,hours,False,,,,2024-06-27T19:01:01.460477,2026-04-12T23:49:46.120321,6d2ceeb0-f1a5-4e8d-895f-e5bc49fb2247,602ea732-24ef-4966-b6bd-3827f828394b
69c20734-ad21-47ec-9db7-ed8141ceed84,87557121-007b-4e66-9a6e-733b6e2bc363,458c914b-8ff0-421f-b274-6701c9d3dc4f,2024-05-27T20:31:15.366517,,"Cultural cut piece window ahead determine. Whole seat until quality young national.
Admit son yes many enter everybody third. Follow word best identify rule clear. All four share throughout series.",2024-05-28T16:23:43.382993,2024-05-30T16:23:43.382993,ASSIGNED,Radio program media billion. Expect foot five this record history follow guess.,Danielchester,GPS,-60.582241,-120.577645,5708.27,"1 day, 0:00:00",MEDIUM,40b5eabe-a90c-4a58-b6b3-f99ee728e400,3e1fd343-c96f-4490-a7f7-233a93117cfd,17.63,loads,True,ONE_TIME,,,2024-05-25T07:18:10.901234,2026-04-12T23:49:46.120579,8e3a90e3-e6e5-40bf-8845-62c53e209a53,7084e7f2-1465-4c2d-bcba-dc1fd3b0b29c
fc789704-0883-4755-8cc6-a3a0a1d8f900,87557121-007b-4e66-9a6e-733b6e2bc363,dcc1e17c-3547-4d18-8cc2-b9e8053b19d4,2024-06-24T01:50:49.422019,2024-06-27T13:48:45.540396,"Out see up. Use in baby but.
Fear because reflect PM ability ask report. With age information often high. Personal hope let early determine risk.",2024-06-25T02:34:19.419759,2024-06-27T02:34:19.419759,CLOSED,Garden party account. Class political job discuss charge. Man beat record make level well business.,West Matthewland,WELL,58.1252845,-12.503842,40689.86,"1 day, 0:00:00",LOW,4dfe3479-c870-45e9-a84a-6bc72280dcaa,73148b49-8f75-4090-8b7e-23d5ea575b39,14.66,loads,False,,,,2024-06-21T12:34:29.931163,2026-04-12T23:49:46.120763,96fe481f-d0a2-443b-b5cc-aadb95d2abda,bce40d19-348c-46f4-9c9a-2d82b211e7fa
b6e83367-4ba8-4655-a3d2-fd33cc750813,1d7e9e8f-40be-49dc-9672-3aa65ee2f0d0,60bb88d6-bc9d-4ef9-aa1a-8c2aeb77deed,2025-06-20T00:44:20.026699,,Interest east fish case low campaign figure enough. Look poor commercial movement production against choice.,2025-06-21T14:39:41.541688,2025-06-26T14:39:41.541688,HALTED,Dinner despite this exactly assume administration. Both at interest strategy.,Lake Dean,GPS,38.425614,74.614762,27314.16,"2 days, 0:00:00",LOW,4f1b3fa1-5528-421f-93e4-caf6c5422b2a,4e7fc312-7d39-40c4-8680-e6cb72b0aa8b,5.93,gallons,False,,,,2025-06-17T21:01:47.465654,2026-04-12T23:49:46.120914,1a8b3bcd-4b4e-46e1-9703-4e4ba3f45e9a,f2cd27ea-19ec-4acb-9f1d-213a43b35e5b
9f18c2ee-f818-4ec0-b927-b56d0bdbc202,0709cc65-6c9f-4f4d-8ae3-f0bbc2a2a1a8,d2da7803-13a5-4798-9361-17fc24fad9ff,2024-05-01T14:49:11.899751,,"Letter performance practice partner save million last. Goal public job sister.
Deep address language its. Peace herself collection language idea.",2024-05-02T11:20:09.471796,2024-05-06T11:20:09.471796,IN_PROGRESS,Believe century successful. Sport win rule central what hard now.,Parkerport,ADDRESS,20.9491135,132.574215,19142.42,"3 days, 0:00:00",LOW,43ba865c-66cd-4386-afe3-40990265f0a5,4e7fc312-7d39-40c4-8680-e6cb72b0aa8b,8.47,days,True,ONE_TIME,,,2024-04-29T15:15:26.838002,2026-04-12T23:49:46.121094,18cebf99-499a-4493-bb86-f6b24243ac7d,5e6e1247-d91f-4959-88c4-c43635dcdbbd
0cea68a7-5f3d-4d2a-a66f-f88940f72a21,600ad80b-c837-4db6-b132-5c5f8b995ef6,ac5b1c50-7bd0-4ab9-ae40-7f1e992ad093,2025-04-02T22:35:36.689398,,"Form attack body have nation law dream art. Manager focus hard two husband. I candidate idea concern.
Someone Mrs woman represent scientist surface. Attorney example positive market ten mind age.",2025-04-03T03:58:10.530921,2025-04-06T03:58:10.530921,REJECTED,Stop tough bit indeed force expect standard. Everyone should plan gas just lead.,Tanyatown,WELL,-84.709654,-141.755374,28765.6,"1 day, 0:00:00",HIGH,dac3e8aa-5570-49ca-aa41-8c964b8f5bf1,19e95c4f-f46c-4431-bab6-f5797bcd52f8,57.77,hours,False,,,,2025-04-01T11:28:35.384274,2026-04-12T23:49:46.121286,d2691a13-ed9b-4893-b70a-b7af5cfc48e1,4751052b-b294-45a4-9278-1e87506f24f6
c23fc3c8-37cc-4745-b17a-9fc731481a73,0709cc65-6c9f-4f4d-8ae3-f0bbc2a2a1a8,4ec8e0e9-3415-4edc-8390-bb350c4d0b20,2025-03-31T14:30:11.734994,2025-04-04T16:03:35.178410,Which onto board contain. Never high real election happen garden position phone. Surface bit light play great fly.,2025-04-02T11:03:07.760057,2025-04-04T11:03:07.760057,CLOSED,Leave another in week keep hear area. Yard wind same garden result.,New Ashleyfort,GPS,18.4241095,-161.697484,32100.95,"3 days, 0:00:00",MEDIUM,e9a9542b-1a69-4849-8bd7-5f03059a47ee,4e7fc312-7d39-40c4-8680-e6cb72b0aa8b,36.14,gallons,False,,,,2025-03-31T07:01:26.828988,2026-04-12T23:49:46.121496,8b8807f4-c988-4fd1-8838-a2d500359eb1,ca37e576-9d25-48f8-bc6a-39c0d62ff3e3
e920f93b-9503-4042-9227-469739cbee17,62aab707-f2c5-4283-86fb-7bdb83f4ac9b,d4347d99-2c69-4d0e-a2c0-37c94f738087,,,"Each cost student build. Fire own list society three imagine front. Government ball establish someone establish concern.
Step top describe so and lay collection.",2024-11-19T15:48:45.999292,2024-11-20T15:48:45.999292,UNASSIGNED,Late degree me themselves arm billion southern. Present common various. War morning hair whole.,Johnsonville,WELL,-44.5497195,44.476883,22305.43,"1 day, 0:00:00",MEDIUM,d1e8d137-cb36-4c77-a505-018795e38454,73148b49-8f75-4090-8b7e-23d5ea575b39,27.81,gallons,False,,,,2024-11-14T22:05:44.020168,2026-04-12T23:49:46.121679,869b3945-33dc-488f-929e-7048f76f21bf,8cbe8dc2-bc89-486b-b29d-340944e6d79f
859b10e3-8711-4d27-8efd-01cb3c24e91e,ad31d7e7-9a34-4eb1-8030-317d6d9d1a4d,d4347d99-2c69-4d0e-a2c0-37c94f738087,2024-06-29T22:43:04.996643,,Candidate one cultural onto light. Building this prove back. Partner season alone list herself anyone. Tax product possible write enjoy bar security serious.,2024-06-30T16:18:23.092740,2024-07-04T16:18:23.092740,REJECTED,We stage woman ever property. Word speak act Mr today ground.,Port Travismouth,ADDRESS,-59.383959,-83.52125,36847.29,"3 days, 0:00:00",HIGH,13dcc75b-5843-4681-87ce-e3ac603d363c,19e95c4f-f46c-4431-bab6-f5797bcd52f8,88.09,gallons,False,,,,2024-06-27T18:35:34.812419,2026-04-12T23:49:46.121843,8e138dba-694f-48e1-b151-3c197a2d1f3c,4488f375-c869-4be0-8b3e-16d78a582e63
7bec5494-3c81-4fb5-9135-37270bdf0fce,3dd270ee-41ef-47ed-98c8-22b2af21b4aa,d3d1c29a-f1f9-46d1-bd15-d62e528334f9,2024-12-23T13:10:16.973818,,If fact cause certainly. Center give national audience kitchen so long up. Majority hear machine civil. Television upon subject together minute.,2024-12-24T21:53:11.290311,2024-12-25T21:53:11.290311,CANCELLED,Street office system increase image popular. My against open.,Douglasville,GPS,-32.0394245,73.548832,39498.92,"2 days, 0:00:00",MEDIUM,a3c01c7f-ca81-4827-9505-c5ce4bd909ec,ba2aec32-4f9f-4149-8dcb-c98d113c1dd1,14.76,hours,False,,2024-12-23T21:44:28.763391,Safety concern,2024-12-21T09:56:56.970172,2026-04-12T23:49:46.122016,9a68bd89-d520-4103-a732-af95cfff47be,213c1f33-51f4-4252-ac5d-8ae6888de869
1edf3c00-4c2e-4c01-8c7f-71807d7f4daa,0709cc65-6c9f-4f4d-8ae3-f0bbc2a2a1a8,e51e2d86-c1f3-4d90-90f1-7117fb277a1d,,,"Direction compare century imagine rich me everything. Foreign citizen statement scientist call east rock. Vote room the member center.
Quickly community trouble. Site pay generation maybe.",2024-11-12T15:28:32.748273,2024-11-15T15:28:32.748273,UNASSIGNED,House fight where assume quite mention. Tree care about choice say. On beautiful enjoy hundred.,Richardsfurt,WELL,-73.5067725,-81.331735,39644.02,"2 days, 0:00:00",LOW,b6513343-bf17-4c49-aefc-8503164485d0,1fa126ef-30c4-4cf2-9294-a6d23c75936f,15.96,hours,True,ONE_TIME,,,2024-11-08T12:35:37.060610,2026-04-12T23:49:46.122261,e4bb3dde-65b9-4a3b-ada1-8e1428f97cfc,93b06b0e-9196-456a-9057-69f54cd51f99
