work_order_id,assigned_vendor,client_id,assigned_at,completed_at,description,estimated_start_date,estimated_end_date,current_status,comments,location,location_type,latitude,longitude,estimated_cost,estimated_duration,priority,well_id,service_type,estimated_quantity,units,is_recurring,recurrence_type,cancelled_at,cancellation_reason,created_at,updated_at,created_by,updated_by
44ca54df-2ea0-457f-8cc3-7348cacb0a1a,34a45051-a13a-4bfa-92d4-c3f90c3c95dc,0a21c75f-3838-47f7-901c-6401b390b0cc,2024-07-21T07:58:18.769444,,Simple role company lead phone production laugh war. Though policy water. Concern history scientist catch mention.,2024-07-23T07:25:03.194632,2024-07-24T07:25:03.194632,assigned,Medical miss you. Peace experience approach kid write ability himself.,Watkinsview,WELL,72.0046545,173.03793,43753.5,"1 day, 0:00:00",MEDIUM,20161a44-eb36-480e-b053-bf2fcdab67b2,f3ec3133-59db-4438-a2c7-e7ef726d6be4,93.71,loads,True,MONTHLY,,,2024-07-19T18:05:15.260869,2026-04-11T23:28:35.773543,7237214b-76bd-43d1-ac0e-5fc6344f743f,0b39891d-fb49-4163-a6ab-36356cfa5189
4549325e-65d8-4624-96c0-1a43b353cb9e,279f7fdc-14a0-4446-b6ce-4810b1281dbb,7ed0d1fe-6706-4ca7-9ad5-9cdffbbfa493,2026-01-12T12:46:39.769415,,Scene exactly politics door suggest yet billion. Concern remain southern. Age process challenge issue trip.,2026-01-14T08:18:52.941219,2026-01-19T08:18:52.941219,rejected,Decide marriage data and my. Anyone husband sport. Detail home little citizen democratic.,Floreston,GPS,0.215716,161.709719,27620.92,"3 days, 0:00:00",MEDIUM,41527c18-628d-4940-ac66-8e9c65189cf1,4163a5d4-955d-4a25-abd7-854c4e83b2ac,45.19,gallons,False,,,,2026-01-10T18:14:31.639423,2026-04-11T23:28:35.773738,5426d242-5bc2-4c82-9e13-dca260a6e825,6b6b3d30-d29a-4601-8cb0-9c9cd9a60752
bd2803ce-5a6d-4296-aa0e-ac65459bfe0d,656b008b-6556-4e21-a60c-4ad6a3412f4f,ede7db27-f41b-4233-90aa-2747d99c010d,2025-04-07T22:54:17.319747,,"Read ahead dark.
Agent field sister. Dinner himself herself suddenly. Child future series money animal serious word his. Whole baby language message.",2025-04-09T01:20:50.332625,2025-04-10T01:20:50.332625,rejected,Town common perhaps decade happen possible. White pass service soldier fire might. Item sing owner.,Wolfmouth,ADDRESS,13.656926,-172.810673,36045.11,"2 days, 0:00:00",HIGH,0ec9f115-6f77-4123-9e09-f280e8b1c690,6bc12c93-a9f7-4d75-b811-9bebbf7039cb,54.98,visits,True,DAILY,,,2025-04-06T19:20:43.190964,2026-04-11T23:28:35.774058,45fafbcd-6773-4d93-b14a-de0eaa352698,77e501e1-a525-4999-bf92-3292e5318c68
ea1a7068-90dd-4cb6-b868-382876e51423,656b008b-6556-4e21-a60c-4ad6a3412f4f,620824d3-d15f-4fbf-82ba-219a029f0e3a,2024-07-04T15:18:34.445360,,Name author may water job campaign we why. Time material indeed return perform member.,2024-07-04T23:28:48.841219,2024-07-06T23:28:48.841219,cancelled,Voice how join whose herself market. Street trouble glass pick their own.,New Kelly,GPS,64.1180075,94.555577,1463.68,"1 day, 0:00:00",HIGH,aa3e5708-9c64-4b9f-85a5-159363d3c9be,aae0e4d8-2cec-412c-b24f-bd332e960900,49.39,gallons,True,WEEKLY,2024-07-06T00:53:06.333126,Weather delay,2024-07-03T07:09:31.151380,2026-04-11T23:28:35.774289,ff298394-b40d-46bb-8d61-64e108c6365a,15106b75-43a1-41cc-b402-3c9502889102
606152ee-c37e-4256-88a3-4c1210ba1fb2,133f90fe-7e31-4d27-8cda-4d82237347ba,85a258d7-b0ef-4d6b-90dc-5661b7c3d48c,2025-07-10T16:31:02.098396,,"Detail TV tonight. Partner pull national prevent war trouble.
Lot he board energy. Heavy chance treatment which paper forward name eight.",2025-07-10T20:03:56.490678,2025-07-14T20:03:56.490678,rejected,What magazine reveal yeah environment. Bed animal development.,New Ronald,WELL,86.7908025,84.955236,49403.57,"2 days, 0:00:00",HIGH,cd0cbf2b-d8b7-4042-89e5-d608743d6c06,6bc12c93-a9f7-4d75-b811-9bebbf7039cb,31.03,gallons,False,,,,2025-07-08T01:58:58.812574,2026-04-11T23:28:35.774492,a180b251-7a55-476e-8159-4fea580eb31c,d0e42716-9856-4ea8-83ce-60ca32958ada
222e4395-2910-45b6-b6db-c4f484529974,c2271158-1a66-4531-9772-0e175585c41f,95d96392-189d-4782-8790-5c23325e8a0c,2026-03-27T13:17:07.717155,2026-03-31T22:02:58.809837,"Foreign provide determine despite break wonder. Learn fly us. Standard strategy physical speak theory.
North fly sense discuss director realize. Value family find born week.",2026-03-29T02:51:09.227651,2026-03-30T02:51:09.227651,closed,Record ground daughter court deal. Capital war street particular bag church Mrs save.,Lake Charlesville,WELL,-40.25291,76.282917,32683.88,"2 days, 0:00:00",HIGH,d33f52a8-74ca-4fb9-9fd0-9831f1d31216,4163a5d4-955d-4a25-abd7-854c4e83b2ac,78.93,gallons,False,,,,2026-03-26T03:29:45.899834,2026-04-11T23:28:35.774776,c4945ff1-3458-47c4-bac0-521d8a1d3475,1d0efcb8-643f-4039-b1ed-f3e18f1525ea
f0f497dd-5b67-4bc3-a479-770d3ddb6edf,23a09d52-0fe3-421e-bb91-3202f9a30091,296fa3db-c335-4523-8a1c-df606cb83295,2025-03-30T14:18:07.791661,,"Second big herself concern measure product author. Necessary quality now soon. Tell bit score candidate movie raise.
Analysis plan important far.",2025-03-30T17:08:00.243879,2025-04-04T17:08:00.243879,halted,Animal young positive foreign officer fall partner. Same character land treat whose end.,Lake Gabriella,GPS,5.2836495,51.022692,43927.31,"1 day, 0:00:00",MEDIUM,f4366471-8102-464c-bebd-9f4ca3c3b19d,4163a5d4-955d-4a25-abd7-854c4e83b2ac,46.11,days,False,,,,2025-03-30T12:34:45.990485,2026-04-11T23:28:35.774965,90351706-f256-435e-9909-6089dc74e81f,d0357645-a561-461d-ab6b-fe0012729827
45347d23-214b-46b6-8358-527775a2380a,279f7fdc-14a0-4446-b6ce-4810b1281dbb,dc7f0910-53d4-4ec1-8f74-7abe480627b6,,,Fly movie executive again true smile. Respond politics during year language different mission history. Base audience have whether.,2025-12-02T22:57:16.789780,2025-12-03T22:57:16.789780,unassigned,Field yes draw agent trouble. Price never worry conference present cover.,Angelafort,ADDRESS,-86.713106,-103.466358,44939.41,"3 days, 0:00:00",LOW,a0bb034a-f039-44e5-ae1b-93e0c0702602,4163a5d4-955d-4a25-abd7-854c4e83b2ac,19.72,loads,True,ONE_TIME,,,2025-11-29T15:47:58.294001,2026-04-11T23:28:35.775124,1067fda7-06b3-41ff-97fd-0fbfba34e090,2890c9b5-893f-44ff-8071-8969069f506e
1b74b39c-829f-4808-90a8-52c01f418753,656b008b-6556-4e21-a60c-4ad6a3412f4f,a22409a7-10b0-42f2-875e-12eefdb46912,2026-03-02T20:57:23.891346,,"Computer behind goal control. Everyone for hard Congress.
Our ever laugh determine. Chair whether various want play. Candidate affect since meet section without effect bed.",2026-03-03T11:58:08.595612,2026-03-05T11:58:08.595612,halted,Whatever charge also any bar sport.,Blacktown,WELL,-13.7323905,-39.265552,46963.75,"1 day, 0:00:00",LOW,a4e9d072-a01a-44f7-bb13-3ec85c731bad,aae0e4d8-2cec-412c-b24f-bd332e960900,87.51,gallons,False,,,,2026-02-27T23:37:50.285839,2026-04-11T23:28:35.775348,77e501e1-a525-4999-bf92-3292e5318c68,073cd302-61e3-4af3-a973-8dfdbf7fcd72
d0a4ab10-b489-4769-ac32-7189bc133a55,34a45051-a13a-4bfa-92d4-c3f90c3c95dc,ede7db27-f41b-4233-90aa-2747d99c010d,2025-09-16T13:05:44.132224,,"Step easy dark man it sing. Practice office air table. Happy finally since future.
Chance others network born authority. Security everything already strategy food money red prepare.",2025-09-18T07:33:49.497194,2025-09-19T07:33:49.497194,cancelled,Community should information gas. Out watch check team perform sound bag issue. Modern late write.,West Bridget,WELL,-67.052823,-153.122622,35908.68,"1 day, 0:00:00",LOW,89602d9d-ad22-473d-b46f-9485cb35cbf5,f3ec3133-59db-4438-a2c7-e7ef726d6be4,11.33,days,False,,2025-09-17T18:45:28.834051,Safety concern,2025-09-14T15:35:08.895265,2026-04-11T23:28:35.775557,2466dd41-1f7c-4751-a333-5d1a370e9ad7,48d57272-ff14-4290-9388-cae5db5807a6
5d0f4547-1baf-4784-b927-da17ce3e54b1,e6da2d90-c782-409c-8616-856c4871d2ca,85a258d7-b0ef-4d6b-90dc-5661b7c3d48c,2025-06-17T20:56:56.121424,,Account mind manage success smile. Tend control light return. Really price relationship onto. Note sport message yes.,2025-06-18T22:07:02.757573,2025-06-22T22:07:02.757573,rejected,Sign including before audience. Hair style step majority if. Ground well successful watch.,East Kylebury,GPS,4.2178435,-56.330063,29057.79,"3 days, 0:00:00",LOW,cd0cbf2b-d8b7-4042-89e5-d608743d6c06,4e7b5962-dbd8-452f-81b7-4aee649a667c,19.04,days,False,,,,2025-06-15T06:45:19.919281,2026-04-11T23:28:35.775877,427c0635-c7a0-438e-94fd-0af27f5d7881,7e12a668-1cd7-4664-b712-e6bb37540d35
c2b327a5-6839-41e7-931f-231c70d1d05e,656b008b-6556-4e21-a60c-4ad6a3412f4f,620824d3-d15f-4fbf-82ba-219a029f0e3a,2024-06-22T02:45:13.258706,2024-06-26T16:18:42.663646,"Population nor several bank. Article board decade bar parent some agency.
Finally red throw authority kitchen as time. Almost operation woman talk. Pull often in by we guess discover measure.",2024-06-23T13:20:13.562110,2024-06-26T13:20:13.562110,closed,Open leader he no. Produce international federal. There real act success quite speak stuff.,South Timothyborough,ADDRESS,-17.8716015,105.877697,27699.84,"1 day, 0:00:00",MEDIUM,aa3e5708-9c64-4b9f-85a5-159363d3c9be,aae0e4d8-2cec-412c-b24f-bd332e960900,31.43,hours,True,WEEKLY,,,2024-06-19T23:36:51.387887,2026-04-11T23:28:35.776131,57c0d212-add5-4bb4-8fca-d0cfaa81d915,62b953c0-d0d2-4396-bdc4-95b25723334a
533dc1bc-43f2-4c7f-8aa5-6b6b2ad1a14b,e6da2d90-c782-409c-8616-856c4871d2ca,85a258d7-b0ef-4d6b-90dc-5661b7c3d48c,2025-07-15T20:12:58.311437,,"Painting accept billion. Everybody action health effect.
Fall population according really truth. Price special address strong six here any. Change left PM hit ago not.",2025-07-17T07:50:12.240993,2025-07-20T07:50:12.240993,cancelled,Least claim argue let turn rock law. Contain call example quickly rich.,West Amanda,GPS,-34.594767,101.604869,25388.73,"1 day, 0:00:00",MEDIUM,cd0cbf2b-d8b7-4042-89e5-d608743d6c06,4e7b5962-dbd8-452f-81b7-4aee649a667c,22.39,loads,False,,2025-07-17T19:21:34.478869,Client cancelled request,2025-07-13T21:16:55.796619,2026-04-11T23:28:35.776353,411ff2cf-0d56-4bef-92d5-7c163227c90d,3b2473ab-bfff-427b-b8d0-ba5137391790
b2fac16b-15cf-47b5-bd98-20ffccfb803c,e6da2d90-c782-409c-8616-856c4871d2ca,a22409a7-10b0-42f2-875e-12eefdb46912,2025-06-17T18:00:33.271407,2025-06-23T21:45:23.851264,"Exactly daughter maintain receive. Continue just amount per miss.
Certain home especially gun save sign. Home realize measure purpose total.",2025-06-19T03:52:38.637153,2025-06-23T03:52:38.637153,completed,Health probably alone age home theory. For while suddenly less.,Port Amytown,GPS,50.6347375,-138.565268,28922.03,"1 day, 0:00:00",MEDIUM,a4e9d072-a01a-44f7-bb13-3ec85c731bad,4e7b5962-dbd8-452f-81b7-4aee649a667c,91.31,gallons,False,,,,2025-06-15T21:17:01.286207,2026-04-11T23:28:35.776534,44128dea-33e5-444e-968e-78c00fee79d2,69270775-1d57-4bb6-ac0e-e64feb403a84
55eeb9c2-8543-482d-b275-5094175b88e8,279f7fdc-14a0-4446-b6ce-4810b1281dbb,7ed0d1fe-6706-4ca7-9ad5-9cdffbbfa493,2025-10-16T13:48:14.452313,,"History full certain involve go. Join second look foreign home official. Avoid movement similar.
Style look lot hold leader manager mention. Data good less fact participant these main.",2025-10-17T20:19:20.539413,2025-10-21T20:19:20.539413,in progress,Leave citizen major result themselves growth summer eat. Way collection before offer yeah only.,West Kristin,ADDRESS,31.7254795,84.963948,34152.43,"1 day, 0:00:00",HIGH,41527c18-628d-4940-ac66-8e9c65189cf1,32a1f4ff-8cad-447c-8433-21af7ee7c7a6,65.86,gallons,False,,,,2025-10-13T19:44:59.962597,2026-04-11T23:28:35.776710,4aef811d-f07b-4b0e-b566-828bd39c1927,745a134b-4aed-442c-8f28-1c17fc2f7db6
569c2f35-c288-46c1-a1a3-cc09705cef5d,133f90fe-7e31-4d27-8cda-4d82237347ba,0a21c75f-3838-47f7-901c-6401b390b0cc,2025-03-16T00:35:45.845120,,Someone marriage red third recognize. Despite process official south. Mind evening small.,2025-03-16T04:34:31.482723,2025-03-20T04:34:31.482723,halted,Reveal present consider many pay. North on decision research.,Perezland,WELL,58.8837755,-81.018778,48702.41,"3 days, 0:00:00",LOW,20161a44-eb36-480e-b053-bf2fcdab67b2,d1e18f8f-1284-4e35-8fff-1745bbfa3935,67.83,loads,True,DAILY,,,2025-03-14T09:07:07.600847,2026-04-11T23:28:35.776957,e6f6f8f2-c4a2-417a-8b61-586ec7a8bf36,35f04545-2a42-47e5-8fec-169cf39ea3b8
7c4fa419-3319-4078-8948-80b5725b63d7,0d4458dd-5ad6-4786-9888-2bff9f05336e,04c01860-11e0-43ee-ace0-ffb53146f1b0,2025-09-06T23:20:34.318358,,"Ground election behind into energy. Best rather strategy company do or assume.
Garden sort fund full politics church. About before budget business executive.",2025-09-08T00:48:29.073827,2025-09-09T00:48:29.073827,halted,Blue upon lead blood appear. Whose join evidence billion. To leg popular from the.,Powellview,WELL,36.2459115,76.40471,38965.51,"1 day, 0:00:00",LOW,746ff6e9-815d-4d37-ace7-b49f52121662,4e7b5962-dbd8-452f-81b7-4aee649a667c,98.49,visits,False,,,,2025-09-06T02:12:43.591686,2026-04-11T23:28:35.777170,e9e5ce78-ea1c-49eb-822b-52b577c76806,d6594e30-e1d7-4dfd-ab26-bfd439ba345a
fbe2b3f9-2fba-44b1-b8ba-aca2aa003f08,c2271158-1a66-4531-9772-0e175585c41f,95d96392-189d-4782-8790-5c23325e8a0c,2024-09-24T04:54:25.848528,2024-10-01T00:22:10.583276,"Fund top model property. Option meeting people security well painting quality option.
Career you dog country power that. Six list budget reflect. So choose bed.
Want customer newspaper partner.",2024-09-24T10:33:52.467175,2024-09-29T10:33:52.467175,closed,Appear very help less arrive turn more. Ago bill plan story window land level.,Port Melanieshire,ADDRESS,78.3203715,-34.494178,32372.11,"1 day, 0:00:00",HIGH,d33f52a8-74ca-4fb9-9fd0-9831f1d31216,4163a5d4-955d-4a25-abd7-854c4e83b2ac,99.32,visits,False,,,,2024-09-23T20:24:52.649168,2026-04-11T23:28:35.777382,24e8555a-6b9d-4c8c-ac29-2d33cbccdffb,e781681a-7b99-4407-a308-81a3a9fb76cd
a0a12f62-6292-431e-84fe-a68e0103f8d5,23a09d52-0fe3-421e-bb91-3202f9a30091,296fa3db-c335-4523-8a1c-df606cb83295,2024-11-10T21:33:42.429474,,Leg ability certain executive clearly. Beautiful loss environment wind here drug. Policy test enter financial citizen material sport.,2024-11-12T13:42:51.510333,2024-11-14T13:42:51.510333,halted,Thank scene fast TV even material enter. Sit join firm clear media deal necessary.,Crystalberg,WELL,-25.4908855,-75.079717,48320.42,"1 day, 0:00:00",MEDIUM,f4366471-8102-464c-bebd-9f4ca3c3b19d,4163a5d4-955d-4a25-abd7-854c4e83b2ac,19.91,loads,True,MONTHLY,,,2024-11-10T09:22:52.926471,2026-04-11T23:28:35.777606,11bccdfb-ff24-42ba-ada9-06786a04f18d,02b8d0a1-e607-4b6d-8a7a-a173faacbd01
3c7cbe6f-40bd-48c6-a159-8102c6606fbf,34a45051-a13a-4bfa-92d4-c3f90c3c95dc,ede7db27-f41b-4233-90aa-2747d99c010d,2025-11-07T11:59:06.403882,2025-11-12T09:33:24.863430,Expert culture exist wish behind foot. Outside hold major I industry boy important. Send indicate move church society despite single.,2025-11-08T12:52:49.886759,2025-11-10T12:52:49.886759,closed,Or member wait. Let matter scientist environment rate. Own clear customer.,Hallburgh,ADDRESS,81.7934245,-0.106584,8352.25,"2 days, 0:00:00",LOW,89602d9d-ad22-473d-b46f-9485cb35cbf5,32a1f4ff-8cad-447c-8433-21af7ee7c7a6,94.93,days,True,DAILY,,,2025-11-04T18:33:01.328997,2026-04-11T23:28:35.777815,70fe86e4-a790-4e82-8a7a-4dcadd6f168a,7a5bc18e-0580-470a-a98e-4c51efee4f2e
8e1a085a-314d-4262-b4b2-f789c300341a,e6da2d90-c782-409c-8616-856c4871d2ca,ede7db27-f41b-4233-90aa-2747d99c010d,2024-09-22T07:07:44.115294,2024-09-26T18:29:57.304981,"Might control music movement. Entire region talk side because.
Chair itself ever base here figure. Best away quickly government.",2024-09-23T14:10:11.667251,2024-09-25T14:10:11.667251,closed,Return tough conference attack just structure it foot. Tree run education low paper stay.,West Kevinmouth,ADDRESS,-72.8159135,91.649465,41107.24,"2 days, 0:00:00",HIGH,89602d9d-ad22-473d-b46f-9485cb35cbf5,4e7b5962-dbd8-452f-81b7-4aee649a667c,30.57,gallons,False,,,,2024-09-21T00:15:54.094045,2026-04-11T23:28:35.778136,a3e8fd90-8958-4a5d-9c53-484ebe56f452,9706d9e7-8777-42fc-905e-6a9a525fccb4
2dfe5635-5cd6-438a-af35-33ef508367aa,133f90fe-7e31-4d27-8cda-4d82237347ba,85a258d7-b0ef-4d6b-90dc-5661b7c3d48c,2025-10-10T04:40:33.955823,2025-10-13T00:07:51.544399,Really lose yeah or herself dream become. Bar side staff value TV food treatment. Environment level already fact.,2025-10-10T10:08:25.957572,2025-10-12T10:08:25.957572,completed,Form security program.,East Gregory,WELL,33.0653775,-127.639151,34311.45,"1 day, 0:00:00",MEDIUM,cd0cbf2b-d8b7-4042-89e5-d608743d6c06,6bc12c93-a9f7-4d75-b811-9bebbf7039cb,16.48,loads,False,,,,2025-10-08T09:29:58.169239,2026-04-11T23:28:35.778352,5b597df8-0457-47be-bdad-93bcb2cae3e8,0be58505-a65d-455c-bd71-61b581ad63bf
1941e4a2-5122-4c69-a5b0-ffee4c7e2d51,656b008b-6556-4e21-a60c-4ad6a3412f4f,a21dbcb0-9f45-4f8b-a280-0920b3905c61,2025-08-31T23:06:07.418241,2025-09-05T04:46:08.295096,"Really activity stand early paper. Process check marriage raise relationship per buy.
White chance generation suggest. Than majority gun kind for land glass community. Hard really design bit.",2025-09-01T13:59:29.914407,2025-09-04T13:59:29.914407,completed,Practice buy nothing red choice. A think door lay much.,Montoyatown,ADDRESS,26.1022425,9.084716,12116.62,"3 days, 0:00:00",HIGH,a933cbab-be4d-414a-a211-9d3b9221c00e,4e7b5962-dbd8-452f-81b7-4aee649a667c,23.26,gallons,False,,,,2025-08-30T23:41:11.960925,2026-04-11T23:28:35.778588,e4933510-c1e9-4c29-a506-d6fcf5a435af,cc52aaa2-f028-4361-843b-4a923af50227
c8628df8-6f00-4d4f-8e82-82504e025e33,c2271158-1a66-4531-9772-0e175585c41f,9d2875b2-791e-44ff-bbba-86e27e9f0c77,2025-12-14T22:40:16.995558,,"Really population help appear. Thousand six theory century against whose always old.
Method brother everything including number society. Improve manage my get.",2025-12-15T23:53:40.029093,2025-12-19T23:53:40.029093,in progress,Agreement through thus doctor onto cultural. Station difficult stage hard.,Millerton,WELL,-14.503404,-21.987159,42447.85,"1 day, 0:00:00",LOW,e04f60c2-6744-4d5e-9202-a454a1f1741c,d1e18f8f-1284-4e35-8fff-1745bbfa3935,23.93,gallons,True,ONE_TIME,,,2025-12-12T21:32:09.562145,2026-04-11T23:28:35.778851,c2d7c420-847d-4be7-9933-b8c37f570e4b,011846a9-5115-4a2e-a7a6-b129ee48f4e4
9e6123e7-f827-48c9-87eb-5005975d8c37,279f7fdc-14a0-4446-b6ce-4810b1281dbb,34a30a97-c3af-454e-afb6-60950528910e,2025-07-08T16:05:14.807065,,"Population consider seek write health voice camera. Myself now so. His remain all shoulder claim nice.
Foot group stock. Have establish floor full rule. Mr his tell less less successful ground.",2025-07-09T19:24:09.513663,2025-07-12T19:24:09.513663,in progress,College Mrs official end.,Normahaven,GPS,-23.911067,-114.15751,22557.45,"3 days, 0:00:00",HIGH,b405cd82-a19b-4d5b-a7a8-3dfde9f903d6,32a1f4ff-8cad-447c-8433-21af7ee7c7a6,22.37,visits,False,,,,2025-07-05T17:40:40.429496,2026-04-11T23:28:35.779049,3b38c4ff-4922-4c45-8be6-f2d67ed808b8,966495f6-85d9-4495-a7b6-eaef565e586c
1b85d95c-515d-4d0b-b150-801e84e9b7d6,279f7fdc-14a0-4446-b6ce-4810b1281dbb,34a30a97-c3af-454e-afb6-60950528910e,2025-01-24T16:37:35.084270,,"East show front somebody. Wait career card minute international expect.
Financial court yet. Try cell everybody turn something explain.",2025-01-26T08:38:42.415456,2025-01-31T08:38:42.415456,rejected,Rate interest thousand society. Through we character fly various color.,Middletonborough,GPS,75.387185,108.405198,21818.32,"1 day, 0:00:00",HIGH,b405cd82-a19b-4d5b-a7a8-3dfde9f903d6,32a1f4ff-8cad-447c-8433-21af7ee7c7a6,35.67,gallons,True,WEEKLY,,,2025-01-23T07:25:58.117715,2026-04-11T23:28:35.779237,5689bcba-c910-482d-9b24-2b7ded60112c,8bced36a-72fc-4e8f-9257-832c5203f60f
bbc21294-3a33-4ce6-94ac-8ace45e1410c,133f90fe-7e31-4d27-8cda-4d82237347ba,296fa3db-c335-4523-8a1c-df606cb83295,2025-10-23T02:39:01.810899,2025-10-28T03:03:47.837725,"Increase style camera responsibility kitchen word. Push strategy speak model vote eye street.
Whether employee I woman him. Evening return scene easy identify.",2025-10-24T12:56:52.675790,2025-10-26T12:56:52.675790,completed,Bar always hotel. Better movement traditional particular. Heavy story miss benefit.,Kennethfurt,GPS,62.16042,-28.753161,4687.05,"3 days, 0:00:00",MEDIUM,f4366471-8102-464c-bebd-9f4ca3c3b19d,d1e18f8f-1284-4e35-8fff-1745bbfa3935,23.68,days,False,,,,2025-10-20T14:38:50.578939,2026-04-11T23:28:35.779455,45d7c5ad-d35c-4ea9-81e7-70962cd495e6,37bd81ea-fbdb-4cf7-905e-fd979f3465be
295d0420-90cd-46fe-bb11-d3ca32d9076b,23a09d52-0fe3-421e-bb91-3202f9a30091,285f3784-ef10-4b42-ae2b-9ae729cb8219,,,"By her part talk. Talk able yes sound. Bank concern level budget message bit guy.
Executive speech never message lay international blue treat. Group customer improve company look.",2024-07-26T17:05:22.781337,2024-07-31T17:05:22.781337,unassigned,Machine like pass pass. Rich how about Republican experience.,New Scottmouth,WELL,40.2514555,18.483018,9374.1,"3 days, 0:00:00",MEDIUM,614a2a2e-591b-4e4a-929f-a1b660400fff,4163a5d4-955d-4a25-abd7-854c4e83b2ac,87.39,hours,False,,,,2024-07-24T21:02:35.292491,2026-04-11T23:28:35.779636,54142598-7dd3-42fd-9a19-646c822bd0a7,05326bed-f230-47a9-82cd-729cbe3f23b5
954511a7-17a7-4762-bac1-14057f47491e,c2271158-1a66-4531-9772-0e175585c41f,9d2875b2-791e-44ff-bbba-86e27e9f0c77,2024-12-31T15:25:50.827148,2025-01-07T18:12:18.016235,"Soon term gas. True certainly war far brother.
Seat prepare still executive free region third. Off concern none lot what particular guess eye.
Happy now partner ground.",2025-01-01T04:06:02.483398,2025-01-06T04:06:02.483398,completed,Various happy she far wall live mother. Environmental view author from when.,Lake Melissaton,WELL,20.376635,12.124619,8955.41,"2 days, 0:00:00",HIGH,e04f60c2-6744-4d5e-9202-a454a1f1741c,6bc12c93-a9f7-4d75-b811-9bebbf7039cb,62.47,days,False,,,,2024-12-28T16:52:48.924650,2026-04-11T23:28:35.779907,a03effed-e7cb-4d0f-95ef-492dff379a40,d3c0beef-c6cb-4751-b45f-731afd8d8fd4
ebdad1e8-9bf1-4519-aab6-7d2e6faaf699,23a09d52-0fe3-421e-bb91-3202f9a30091,45f09fb8-ad23-4286-a44e-b860446031aa,,,"Left themselves skill national per management. Memory ready great administration lead such until.
Sign kind possible course spend experience. Leader of nor reality describe.",2024-09-23T21:09:46.270700,2024-09-24T21:09:46.270700,unassigned,Scientist couple large prove international. Strategy two treatment particular worker.,North Hannah,GPS,36.264132,-18.44307,39179.81,"2 days, 0:00:00",HIGH,4a7d0e68-5575-4605-874f-c8ef41f4b1b3,4163a5d4-955d-4a25-abd7-854c4e83b2ac,99.8,loads,True,WEEKLY,,,2024-09-18T21:16:36.555944,2026-04-11T23:28:35.780128,8124286f-49c1-4309-8d1d-5c2aa796c9e7,abafcabb-093a-48d0-99e4-d18f4918f3b6
b8a72bf3-4bfb-492d-849b-42b660a5c1d2,0d4458dd-5ad6-4786-9888-2bff9f05336e,296fa3db-c335-4523-8a1c-df606cb83295,,,Here across however figure. Summer chance seem if. Smile south whose special within rest. Share interesting green resource.,2025-09-26T18:06:34.456166,2025-10-01T18:06:34.456166,unassigned,Play join future month human chance large. Man high deal product woman budget return.,East Jonathanside,WELL,-42.78035,-1.293891,43626.08,"2 days, 0:00:00",LOW,0d744722-b9a3-4d41-9b6f-ed05c6fef9e1,4e7b5962-dbd8-452f-81b7-4aee649a667c,31.6,hours,True,DAILY,,,2025-09-23T00:40:19.939161,2026-04-11T23:28:35.780337,d9fd923d-a9cd-405b-8659-39713a8eab49,5f58e670-d512-4f26-8792-53a2147923e2
1ee01ef0-173b-4448-8e74-c84fd0ffd79a,e6da2d90-c782-409c-8616-856c4871d2ca,a22409a7-10b0-42f2-875e-12eefdb46912,2025-04-24T14:30:11.695202,,"Top red project hit. That way trouble common hear side crime.
Car long behavior. Treat be view strategy get involve. Environmental matter they.",2025-04-24T20:04:42.807247,2025-04-26T20:04:42.807247,rejected,From near worker country figure money. Item reduce short watch shake.,Reevesmouth,WELL,-42.791145,33.059182,24741.37,"3 days, 0:00:00",HIGH,a4e9d072-a01a-44f7-bb13-3ec85c731bad,4e7b5962-dbd8-452f-81b7-4aee649a667c,1.4,loads,True,WEEKLY,,,2025-04-24T10:22:59.649632,2026-04-11T23:28:35.780521,2535de79-3252-4f4b-864d-3afb170861de,746d496c-fb79-4c76-849e-17c34187491f
f52fe9d9-e883-4938-aacd-dadb558e862d,06d009b4-72da-4d9d-b3b7-57e8599d7117,ede7db27-f41b-4233-90aa-2747d99c010d,,,"Around with threat young hour authority specific father. World no appear yet.
Often strong board ago believe itself range wall. Nice total stay. Face fund act represent school per.",2025-03-24T00:16:34.689632,2025-03-27T00:16:34.689632,unassigned,Anything some environment minute. Election similar on away.,East Lindseyberg,WELL,49.7119935,-37.022454,7728.9,"2 days, 0:00:00",HIGH,f8f14ff0-ba1c-4975-b650-6abfe63465d8,aae0e4d8-2cec-412c-b24f-bd332e960900,38.6,visits,True,ONE_TIME,,,2025-03-22T06:54:42.240919,2026-04-11T23:28:35.780705,5d23324a-fe28-4a5b-ae18-09a00ecba349,787e4385-83c9-4408-a6bf-095da5e7ad30
bb34d91f-4811-4b52-8ce3-8ba4532f7dc1,133f90fe-7e31-4d27-8cda-4d82237347ba,13740cf2-33c5-492f-aedf-c2319bcbafa2,,,"Economy approach able watch by him. Ago idea will carry. Focus else boy same science family something.
Glass rich purpose have seat attention. Same section believe will heavy at.",2026-02-20T03:47:56.657100,2026-02-22T03:47:56.657100,unassigned,Prove whatever seat especially. Tend who bit any other explain.,New Jessicatown,GPS,-86.494238,159.303328,22806.11,"2 days, 0:00:00",MEDIUM,42e8757c-99d8-490a-9059-3d47390910ba,d1e18f8f-1284-4e35-8fff-1745bbfa3935,18.98,loads,True,ONE_TIME,,,2026-02-16T17:56:15.535942,2026-04-11T23:28:35.780983,5771b7e3-e41a-4800-8dd4-41f262c1abfd,5134aa99-8d04-432e-a0c7-b8bea774c0db
