work_order_id,assigned_vendor,assigned_at,completed_at,description,due_date,current_status,comments,location,estimated_cost,estimated_duration,priority,well_id,created_at,updated_at,created_by,updated_by
1bf13496-533b-4d24-858e-392ae0bdace1,0cfc4b3e-0118-42f1-8bd8-617ccf8310cd,2026-01-20T19:23:39,,"Pass piece chance focus yes early mean every. Piece card great professional artist church. Stage yard rise evening.
Factor question matter join meeting. Agency material talk health return late.",2025-10-09T09:43:45,assigned,Brother remember property industry second. Interview vote prove effect deep economy among.,New Sarahmouth,3776.85,39,emergency,3ae0b252-36c7-429b-8b7b-bf3f98e234a2,2025-07-26T18:26:16,2026-04-05T08:43:54.282206,5fc2697c-4d85-48cd-8662-d83c81f160fb,16442b35-6e63-4084-b77c-11c3971d9694
0b152cff-c68d-4ed2-85c4-f5d1c7d3dd34,ca790bf9-a3d5-441e-9e35-13b30dd2f3a3,2025-12-27T23:32:20,,People everything cost consider area east investment. Data from lot good PM. They tree art together start government guess born.,2026-03-16T23:34:34,assigned,Animal girl establish stand smile leg society build. Risk impact wear. Hundred minute bit from.,Rachaelville,1148.72,50,urgent,9b874a7c-4abb-499d-ad5d-6a35f1530d91,2025-12-05T19:14:00,2026-04-05T08:43:54.282462,22fe7b35-e0e5-4805-812e-dcee4feaf8b2,4b105b16-4123-4b47-9364-d6848f10582e
38c88738-adf6-4ead-b401-1b3419586bc9,0ded7f06-ed67-4a95-a21d-2c431e38c883,2025-07-29T10:47:28,,"Community church on direction. Thought write investment speech rather health series.
Bit across fish hit song. Chance and her special soon join.",2026-02-19T23:51:00,assigned,Tree arm example still. Choose face nation play fight recently apply try.,North Juliebury,9154.29,19,emergency,4fbf5b76-1e33-47e3-9ab2-81c5589251fc,2025-07-24T09:49:43,2026-04-05T08:43:54.282725,deed4b7f-da7e-417c-8f7e-8b745d137bf0,aba5d7ef-38a1-4351-9d4d-240e9c6df9d3
1c00abfd-c308-4f31-b131-f775fcfe7fc8,ca790bf9-a3d5-441e-9e35-13b30dd2f3a3,2025-12-06T10:16:31,,"Mind vote yeah thus. Just though outside couple day week member. Four long language must.
Adult cup he at story special job follow. Decide together type. Treatment accept happen always.",2026-04-09T19:41:54,unassigned,"War allow physical.
End these decide carry pull.",Burnettchester,2056.0,49,emergency,b482626d-8c28-49d5-9742-a6976bfa26e0,2025-11-29T05:57:54,2026-04-05T08:43:54.283082,2b8089f5-92aa-4454-8458-1f5fca7efadd,5ebeb8e8-495e-4e13-a058-8b82deb02a1b
10c84aa6-3d6d-4af1-8575-582f8c97b980,0ded7f06-ed67-4a95-a21d-2c431e38c883,2026-02-13T06:48:26,,Yet respond buy fly miss newspaper. Claim share exactly discuss we suddenly. Enough collection material be region.,2026-03-25T20:00:41,assigned,"Pick face room.
Society business sense quickly amount. Modern something performance TV notice as.",Port Oliviaborough,2198.68,34,routine,8d00c11b-cc54-4705-9ad8-18572e5aa4b3,2025-12-20T23:57:15,2026-04-05T08:43:54.283386,06f8f4ff-7501-47aa-8a49-9963ae5c6e59,00c3cbf2-a904-4ddc-931c-978e060ed61d
a24f7046-3de1-4ad4-971f-e6c2d7d448e4,ca790bf9-a3d5-441e-9e35-13b30dd2f3a3,2025-09-27T07:15:40,,"Pretty toward free former. Read way other focus million. Under network religious around state we.
Kind consumer provide hard. Off learn win speak. For reveal service eight chance.",2025-12-22T10:40:20,completed,Join safe just since eight bill reason.,North Meagan,687.34,15,routine,7aee536d-0793-4ef7-83b1-999a1ba41050,2025-09-19T01:37:51,2026-04-05T08:43:54.283664,e2a010dd-34bc-4328-8e96-9c1f13b84d8f,13d75571-dd94-4f69-8657-5fa3de234815
93c243d7-412f-44af-a995-7f5f63823410,0cfc4b3e-0118-42f1-8bd8-617ccf8310cd,2025-11-08T06:18:25,,Least sign imagine take suffer. Individual central world two movement eat. Design economic approach table various job else.,2026-03-22T06:30:26,in progress,Bag magazine guy today check. Every true rather whatever maintain question much.,East Alexander,6615.61,16,emergency,3b573514-9a6b-4950-8eb8-8779bad3cf3b,2025-10-06T23:54:38,2026-04-05T08:43:54.283905,e75cd55e-d280-4fed-928c-34339b9a1546,0adc306e-eeb7-4012-bcb8-e48c850e7724
54cb77ee-b370-4d65-b140-b48b944bba6f,ca790bf9-a3d5-441e-9e35-13b30dd2f3a3,2026-02-01T14:16:56,,Before condition federal machine save. Total threat follow appear church individual this answer. Politics month war national baby fly design speech.,2026-01-05T19:51:10,unassigned,Last bring night institution. End open weight.,Chadberg,9115.63,11,urgent,b482626d-8c28-49d5-9742-a6976bfa26e0,2025-09-21T18:19:07,2026-04-05T08:43:54.284148,8df1a50f-fb9b-46f4-a436-f08944df2e07,eb419d0d-0372-4f0f-92f7-6d6e7299dce1
c5440961-e2e4-44be-8474-012c6c77dc55,cd464691-0ec1-4610-90bd-ddf7f41e4b75,2025-05-18T21:35:06,,"Role a go medical together. Impact minute child life. The address loss argue state. Network soldier seem this.
Fear threat nature floor inside than indeed.",2025-06-23T08:38:07,assigned,Most example order open particularly. Prepare factor arm throughout senior.,Escobarmouth,8941.01,16,routine,e8844ffb-9054-4bbb-a468-5f0edbb4c036,2025-04-25T23:17:31,2026-04-05T08:43:54.284446,a4c07952-be1d-403e-9743-cb4e7022abcb,e1231437-bf93-42cb-9701-079884c537f5
8127d7a1-83b9-4c87-89b3-f9527508ae48,cd464691-0ec1-4610-90bd-ddf7f41e4b75,2025-09-25T09:13:49,,"Situation war itself quickly. Sister today address decide sea majority.
Reality across on step charge crime executive visit. Stage deep real forward firm.",2025-11-08T04:15:36,in progress,Pull individual action their street itself economy organization. Check evening some daughter table.,Karenshire,1419.58,51,routine,ed2da5e7-d501-4d62-952e-1d3134a962fd,2025-07-14T17:48:32,2026-04-05T08:43:54.284710,06f8f4ff-7501-47aa-8a49-9963ae5c6e59,c8155ae5-77cd-477b-ace9-96c40e6ef19b
647533a5-0fad-4a26-b10a-40c806c5bd94,1c9ccf14-5176-4c6c-8254-4abf7d027bfa,2026-03-07T20:57:43,,"Treat finally word section several reduce.
Piece often heavy seem rich recently. Clearly quality most.",2026-03-19T21:22:05,unassigned,Quickly community wife few how. Business should box continue impact culture politics.,Rileyhaven,2869.63,65,emergency,22a17616-9d6c-4127-babc-9b9ee93a4565,2026-02-20T06:50:21,2026-04-05T08:43:54.285016,efc96e8d-cfbb-46ee-9f00-92a9b95b268e,dbde3315-de47-45ef-b9cc-d88e50383d62
c90476c3-122a-4cc6-9bd7-771c3db755ad,8d975f8a-3c15-42d6-a033-74e9628c5264,2026-03-28T01:14:25,,"Pattern work wonder manage age. Husband rate popular research as example stage even.
Class technology different something executive Democrat. Account institution age. Huge interest music paper.",2026-03-07T02:37:38,unassigned,Popular try personal together a. Member court to. Hospital always final you central billion blood.,Calderonside,6291.51,5,routine,2451583c-74f2-4dc7-a31c-1d16ec257f7e,2026-03-01T19:51:31,2026-04-05T08:43:54.285375,30c411ab-5d95-4f78-a9a4-527586ec4d96,d15b45d9-41cf-4778-89f4-9373e04de01f
15f313e1-2aae-4404-ba32-84b0e3b38998,084e231e-e1f9-43f1-9eea-8501ecc87efe,2026-03-09T02:01:21,,Federal respond after see. Item gas leg. Serious example stage eye administration east single consider.,2025-12-23T22:40:10,assigned,Simply pattern sit much American. During share deep rich already new.,South Ronald,910.54,19,urgent,ef4bb67f-078e-4329-bab2-0f18a1934f6f,2025-08-29T20:20:39,2026-04-05T08:43:54.285659,875c7e0e-14bc-4d4f-99b6-2fd0dff0b71a,43a6af7c-9d53-403e-b346-784d5ea5e32f
93d7069b-9f1b-4d5a-a980-d94245289b70,1c9ccf14-5176-4c6c-8254-4abf7d027bfa,2026-02-02T21:09:14,,Occur beautiful crime theory manage pass heavy notice. Keep only account two floor cell sing. Artist beat camera just forward best.,2025-07-08T02:17:24,unassigned,Situation current evening measure talk. Color society probably former very area.,Robertstown,9693.7,28,emergency,25be841a-77c7-4ba2-a472-92a8a60beeaa,2025-06-07T16:20:06,2026-04-05T08:43:54.285962,9c4752b5-85e9-4b04-a5f8-7c453f5d0af8,111b2342-98fa-4ce2-9bf1-187ad7c5575d
483f9a7d-4346-4065-84c5-a4b5607cfb1e,2420f3e7-c826-47ed-9895-1c516c602cfa,2026-03-04T13:53:11,,Bed more air where life. Office coach as address quality nation would. Current serious do might especially great.,2026-03-29T05:02:08,completed,Operation indicate arm story. Inside evidence bag.,Kathrynborough,7078.49,31,emergency,9781227f-2478-4bac-8545-dd175c9c55b5,2026-02-12T09:54:25,2026-04-05T08:43:54.286345,1ee2abe4-3891-46e9-8e90-f329079fff35,17c11774-ae8f-4aca-aff6-3c3425f15503
df42678b-e456-46e1-99ed-79972b07e09c,8d975f8a-3c15-42d6-a033-74e9628c5264,2025-10-28T10:06:06,,"Few various matter ball. Fine social raise life north positive camera.
Himself among skin I recognize such total. May argue after truth onto.",2025-10-26T00:21:16,completed,People green base successful then religious current. From country various capital give.,South Whitney,1890.13,68,urgent,0e694953-3067-40a7-881c-3d5676a57180,2025-08-26T19:17:53,2026-04-05T08:43:54.286614,e885c0be-fc0b-49da-8b9d-1794472f9b90,94255a8b-7576-4c21-a190-4da2711283a3
8bd0e259-e3d5-4bff-9545-0e9eeea2b53f,8d975f8a-3c15-42d6-a033-74e9628c5264,2025-12-16T11:05:12,,"Their author western true tell. Guess final set sister land keep.
Fish single turn administration. It option in enjoy. Page paper join light according entire.",2026-03-23T16:35:30,in progress,Almost along forget maybe friend speech community. Minute tonight eye with agreement more.,West Paulaburgh,5142.0,60,emergency,74fd9138-7b37-4fc4-8332-ea58a5c72481,2025-10-18T12:43:35,2026-04-05T08:43:54.287007,9ab0a9c3-bf7b-43c7-98b6-6f74dbd87bff,fec799f5-4aec-4d0d-b3af-df23816d1497
c1eacfaa-53a4-458a-8eb7-e55bd4f049b1,1c9ccf14-5176-4c6c-8254-4abf7d027bfa,2025-12-04T06:12:26,,Eight but general right watch owner better new. Already movement save line travel these. Reduce place center hotel month experience.,2025-10-14T08:17:38,unassigned,Dream bag value. Interest nearly stock option bank. Teach feel forward involve wife.,Margaretchester,7395.0,12,urgent,22a17616-9d6c-4127-babc-9b9ee93a4565,2025-06-07T05:30:36,2026-04-05T08:43:54.287273,045a98bd-cf95-4b06-a01d-1bdb21fa5f5b,eb2235a6-4037-40a9-a13f-2bdb2ee441da
1e9d411c-f932-4bbb-acb8-c02a2324c6c6,0ded7f06-ed67-4a95-a21d-2c431e38c883,2026-02-05T14:18:38,,"Worry artist tree these make but. Account place pass.
Check report receive.",2025-12-06T02:30:38,unassigned,Close may more water. After measure around position.,Reedshire,7830.62,50,routine,c629260e-b0e0-4c16-b426-26b0d53a24a8,2025-05-31T08:48:56,2026-04-05T08:43:54.287572,cfb8da72-d103-4cf8-8e8e-9cf07a9da467,24b81944-ec33-4371-9bc1-d7c644414d5a
3e3ec19c-c585-4ad9-9bbf-4b6e17296468,0cfc4b3e-0118-42f1-8bd8-617ccf8310cd,2026-03-05T20:35:46,,Out street service doctor listen young nearly. Water him director cost serious north. However other finish whom fine media contain.,2026-03-15T13:56:27,completed,Us leg response exist. Subject size forward feeling north often.,East Heatherchester,4354.65,31,routine,231fe4ef-9dfa-4029-a4b7-07ba7d1b832f,2026-01-22T05:27:50,2026-04-05T08:43:54.287829,916f1d28-540b-4440-b7d3-d29d8d86f83e,5aef8d6a-0ad6-4425-9a65-47b066e23a99
8757d733-cd1a-4b3a-9797-2f062610ba48,a64c8bad-2eed-4f71-9a2c-ab6446555b42,2026-04-05T00:22:49,,Pass back become past. Sound third care woman. Wife history Democrat.,2026-04-04T13:49:40,completed,Actually friend thought she front resource. All walk old policy nothing shoulder.,Greggville,4835.55,67,urgent,0fd3f492-fdf8-43cf-a536-3746bb53375e,2026-04-04T07:21:00,2026-04-05T08:43:54.288148,882f4f4e-f422-4fd5-a168-d40618cb6936,35284735-f28f-4d1e-82f9-c29da368c7e3
1300a426-1d6c-4c9b-8c5d-580a88f26275,cd464691-0ec1-4610-90bd-ddf7f41e4b75,2026-04-02T23:52:22,,"Most garden director audience road. Go war career agent less like.
Beyond table someone crime pay. Campaign knowledge single.",2026-03-19T01:26:30,unassigned,Out these cold soldier what. Million yourself visit forget.,West Josemouth,6614.91,34,emergency,ed2da5e7-d501-4d62-952e-1d3134a962fd,2026-03-12T06:43:00,2026-04-05T08:43:54.288466,aaa3c9d6-2936-4789-831a-1ebfdd482b74,967d7cea-8d67-4e3b-aff8-778f3a5896c5
e43b5914-e7d5-49bb-a35b-7277e7f863c8,ca790bf9-a3d5-441e-9e35-13b30dd2f3a3,2025-09-30T06:13:35,,"Surface black its personal position view. Future exist address between smile.
Raise middle smile entire population decision. Religious if order mind nice usually them.",2026-02-04T00:08:46,unassigned,Against bad by. Place give home play improve drug wife.,Johnstonland,8847.02,8,routine,3803b625-6eee-4e05-8448-2e7804e643fe,2025-08-27T16:54:12,2026-04-05T08:43:54.288751,cfb8da72-d103-4cf8-8e8e-9cf07a9da467,b5181284-01f9-4505-8e1e-f6ca2046ad5e
b4113981-2b26-4625-a97b-8b0130461eb3,8d975f8a-3c15-42d6-a033-74e9628c5264,2026-03-29T13:05:43,,"Figure executive oil page like life. Job without else. How scene all month most defense.
Where ten thank certain receive dark bed offer. Theory back try card world.",2026-04-02T11:14:05,assigned,Use Mrs reduce. Friend address exist fine tell method. Since scene raise.,Johnstad,3289.39,57,routine,0e694953-3067-40a7-881c-3d5676a57180,2026-03-10T23:58:08,2026-04-05T08:43:54.289050,04fa6ca4-472b-452a-8add-0b5e86bf949f,87ae3b78-bd69-4dc5-90c8-b6639ea61523
d7368773-7b2d-4fc9-87a7-36bd99191da2,8d975f8a-3c15-42d6-a033-74e9628c5264,2025-11-15T03:24:46,,Tonight window run your final cut stop. Coach company measure where. Health believe want.,2025-12-09T00:44:32,assigned,Society husband true own purpose. Movement rule also hair way bag hundred.,Georgeton,4806.75,24,urgent,74fd9138-7b37-4fc4-8332-ea58a5c72481,2025-06-13T18:23:55,2026-04-05T08:43:54.289293,accf4cfa-d26d-4b3e-a519-844d943b56c6,1b66dd10-b034-4116-a0be-cafcd990b36d
c40600ae-8b83-401d-8fc6-351c0af4fdc7,8d975f8a-3c15-42d6-a033-74e9628c5264,2025-12-19T17:33:47,,"Require moment understand customer usually beyond.
Why I enjoy role require ball. His gas president mean.",2026-03-04T00:53:58,in progress,High animal although near particularly. Until east order in under student office.,Cathyborough,5828.15,9,routine,63f4b8f1-3a9d-457e-8a34-e3e719900a1c,2025-12-12T09:28:21,2026-04-05T08:43:54.289603,d21f9055-34d8-487a-9e6b-f36444f142c2,15582bc8-7f39-4b6a-a816-651faf32017e
50cae5a1-c8e9-4f21-aa80-7bb9c54952ea,084e231e-e1f9-43f1-9eea-8501ecc87efe,2026-02-05T23:45:04,,"Simply without notice condition table necessary.
Forget five case like really draw technology. Play remember water through direction note industry. Side office night kid matter board soldier.",2026-02-25T20:42:57,assigned,Garden poor apply system. West our strategy bed. Quickly adult life put woman.,Christinaland,1102.12,24,emergency,5a8e64fa-c78c-430f-808f-b3712dc2253f,2026-01-15T17:18:26,2026-04-05T08:43:54.289860,150bece9-161c-43a8-8c73-5a669682d52b,2df23181-d730-4a2e-bb1e-7d5ec3bff68d
447202c5-7066-4699-a7fa-1d2dff8aa461,ca790bf9-a3d5-441e-9e35-13b30dd2f3a3,2026-03-30T05:19:12,,"Throw you shake whatever no series never collection. Manage white strong still mission stock. Career arm drop candidate.
Figure believe energy point. Dinner avoid race mouth travel hour plant.",2026-04-01T17:29:52,completed,Cover doctor claim per practice apply. Name account establish class whatever stay employee nation.,Davisfort,8600.52,60,routine,9b874a7c-4abb-499d-ad5d-6a35f1530d91,2025-12-26T02:04:40,2026-04-05T08:43:54.290146,a279fed7-9b0a-4c08-a39d-2db938ff3b57,b03fd6c1-452f-4eb9-8254-02dd733580d5
bdea2163-7135-4566-a86b-ab790e398e79,8d975f8a-3c15-42d6-a033-74e9628c5264,2026-03-03T02:23:55,,"Loss billion majority couple. Another address director.
Method method child follow stop whose respond. From daughter senior those trial.
Pay instead wrong. Reality letter these.",2026-01-09T09:00:20,assigned,Road industry how large weight again last. Degree author opportunity decide soldier.,Andersonberg,6014.33,21,routine,e86fef08-42cf-49ee-b84d-4480cf6dd429,2026-01-07T16:23:59,2026-04-05T08:43:54.290457,971f8d3d-9c5f-43c3-b7c3-799bbdef7f4a,2ae96662-5d1c-41a7-848b-bcf626cef07c
0b249f40-834f-4c34-be9c-61edba00ea4c,084e231e-e1f9-43f1-9eea-8501ecc87efe,2026-03-15T03:21:48,,"Them small computer grow. Of let hair idea party.
Step better view. Nothing partner sport heavy hundred.
According assume stuff almost several party. Live agent lead white. Among culture help.",2026-03-24T10:52:26,completed,Station provide record see physical wear activity. Accept garden behavior leave risk fall.,Aaronville,244.8,9,emergency,d977449a-fa06-4edb-b2b4-806595da6995,2026-03-09T11:22:51,2026-04-05T08:43:54.290726,ed256a75-7d59-43be-b351-e3f10340c34d,15c16cad-56d6-4650-a9b9-ccd6b62e4363
69b0b54e-8d8f-438f-a583-8694124e15a3,a64c8bad-2eed-4f71-9a2c-ab6446555b42,2026-01-03T05:05:48,,Toward sport exist general as. Least respond culture appear buy join. Again situation away everything travel sort value.,2026-02-28T09:37:51,completed,Trade identify professional smile listen. Dark sport image.,East Carrie,2808.76,70,emergency,7aee536d-0793-4ef7-83b1-999a1ba41050,2025-11-27T19:46:56,2026-04-05T08:43:54.291012,1d390683-e705-4714-8829-d813b837438f,1fe85a36-d7d2-4d4c-8979-1a4d1da90679
d216184e-619c-4994-bd50-a75fbb8fbf99,ca790bf9-a3d5-441e-9e35-13b30dd2f3a3,2026-01-14T15:31:08,,"Suffer future hot become with unit. Wonder history record eye fight though.
Board size read drop. Last model whom laugh next edge clear.",2026-03-22T14:33:21,unassigned,Heavy church eye in. Account better push why learn couple both.,Munozfurt,8759.27,4,urgent,9b874a7c-4abb-499d-ad5d-6a35f1530d91,2025-12-31T03:33:15,2026-04-05T08:43:54.291319,408dbb08-b58b-45ec-b0ed-1973dc4dd51c,74bf885e-ae05-4f1f-91c1-973993fce2b0
cf3d5efc-0616-45a5-907e-0a4b76a4d0c2,0ded7f06-ed67-4a95-a21d-2c431e38c883,2026-02-05T21:16:42,,"Image stay kid research price. Beautiful suggest staff large piece agency range.
Wait available hope statement.
Thing suffer decision cost. Say where resource manager.",2026-03-26T18:19:26,in progress,Able card interest word age item human us. Century sense reduce we like bed letter.,Mariahview,8801.3,34,emergency,31864a77-6c37-4e89-b0c6-17161a0eb3e3,2025-12-26T00:46:50,2026-04-05T08:43:54.291687,3c3a8fb2-58b7-44d1-b225-48b853005dee,f8b3e032-7403-4007-a77f-e3c97e546a36
594b8a6f-2533-493a-99d5-1f3c3fc207ca,1c9ccf14-5176-4c6c-8254-4abf7d027bfa,2025-10-20T12:47:19,,Final help compare professor first present indeed. Address service produce building.,2025-09-18T03:31:09,unassigned,Much report radio exist free. Arrive go network across result.,Port Ashleymouth,4629.34,1,urgent,3f9ad0b7-2433-443c-a2e6-c5544f0aff0e,2025-09-11T05:06:41,2026-04-05T08:43:54.291998,5d572e4e-2980-4b59-bfd9-3cbe6a317767,bcf7c218-ed23-4612-9265-2932930cd0af
eff1b154-8b75-423b-a008-4b75aae58d3d,0cfc4b3e-0118-42f1-8bd8-617ccf8310cd,2025-10-22T11:28:53,,Loss coach white treatment offer indeed. International prepare lot admit bit interest forward.,2026-03-13T10:40:35,completed,Perhaps project collection rise star strong seek. Service life benefit.,Bakerside,3057.13,33,urgent,db10f7b3-0b9c-433e-8ee7-109f1e0a5e43,2025-08-30T19:59:40,2026-04-05T08:43:54.292251,a9622991-45fb-40b4-9e86-dc37d6ac41e0,28f54771-b36e-4b54-9063-f68e0a07dd30
21ea6ef2-32dd-4f59-86cd-6cb44f0bae49,0cfc4b3e-0118-42f1-8bd8-617ccf8310cd,2026-02-28T19:08:59,,"Let like laugh.
Remember adult peace. Itself system just box from support little.
Threat itself throughout simply. Method not church. Pay tonight even.",2026-01-31T22:23:24,unassigned,Medical investment certainly big management article. Final choose woman brother couple.,Hernandezville,9443.15,19,routine,db10f7b3-0b9c-433e-8ee7-109f1e0a5e43,2025-08-08T00:14:45,2026-04-05T08:43:54.292555,a7881301-1241-455d-a29f-094df9bacf06,8e4442a2-4375-4fdc-9e6e-3c940be32e4c
ac9b9564-8802-4440-8028-350ea05d68df,8d975f8a-3c15-42d6-a033-74e9628c5264,2025-08-19T23:07:35,,"Cold live accept increase. Piece share probably industry size.
Hotel maybe PM certain central chair beyond. Them condition entire according. Guy day training music.",2025-09-08T09:31:51,unassigned,Us adult vote Mr blue environment. Reduce outside send across western hotel road.,Ericberg,3542.56,72,emergency,63f4b8f1-3a9d-457e-8a34-e3e719900a1c,2025-06-18T10:29:03,2026-04-05T08:43:54.292822,12cb8fb2-8e3e-4274-becc-1a1b2e4364f1,16f0d130-bec4-49b6-bc87-29fc1c8c2e91
e7bc51bc-496f-41a2-a0e8-ea8ec4755e2a,0cfc4b3e-0118-42f1-8bd8-617ccf8310cd,2025-08-26T18:22:32,,"Be issue without. Room drug assume culture.
Reach trial center high situation heavy star. Fund Democrat the manage. However today American party.",2025-09-23T15:09:58,assigned,Have floor audience seek. Red style with collection like woman reveal.,New Chad,5138.18,69,routine,29f7720e-b3e1-4b2b-bae3-d90c474d8fd6,2025-05-13T06:47:23,2026-04-05T08:43:54.293113,1e4b11b0-aa95-4562-a39a-e082e930ee36,24758b40-e476-4aac-9b50-cf6e3856266e
062f853e-9d15-4bbf-956a-636314071149,2420f3e7-c826-47ed-9895-1c516c602cfa,2026-02-12T11:12:05,,"Health crime series happy. General admit how agency. Difference bar theory middle agree into.
Education doctor later political skill finish leg. Course dinner appear peace manager.",2026-01-20T04:14:45,assigned,Safe whatever real born environment power sell. We reflect report so at.,Shieldsberg,2645.75,26,routine,80040808-cc84-4679-baa9-bf31134fb1e1,2025-05-19T00:42:32,2026-04-05T08:43:54.293483,393bad37-fa4c-4af0-b44f-fdc369d111bf,5b458ef6-f537-4f3b-85ae-8a356b599206
3189a249-fd36-424e-8a65-26f356227382,084e231e-e1f9-43f1-9eea-8501ecc87efe,2026-04-04T17:59:51,,"Occur door Mrs third. Poor yes including. Goal team policy.
Near resource garden public arrive study political. Direction him bar matter. Where first weight foreign push perform often.",2026-04-11T07:13:13,completed,Suffer career theory class and method center attention. Spring enjoy gas interest center save.,North Michelleberg,9286.45,59,routine,ef4bb67f-078e-4329-bab2-0f18a1934f6f,2026-04-02T23:28:58,2026-04-05T08:43:54.293779,da7b03c5-a1cd-4ec8-adf1-27882b351c4a,f2b35040-072b-403f-980c-e7956c2f1cf8
ceb26685-a54e-4646-beda-187d7a244991,ca790bf9-a3d5-441e-9e35-13b30dd2f3a3,2025-06-19T09:13:32,,"Eight standard quickly. Factor within war onto herself fire like.
Cold federal enjoy enough. Much turn exactly.",2025-05-30T10:25:24,completed,Lot old return view about. Six cut throw easy involve after.,Katrinaland,7269.71,5,emergency,b0f74e66-2159-4a2b-80d2-f2bd2ec7883f,2025-04-23T13:27:20,2026-04-05T08:43:54.294104,fce9fe57-0f05-4ebe-b107-45343ef3c971,e7f8bdae-2391-4e59-ade9-96bd5a7068e1
a4b01012-404b-4ab9-89c7-5b495dd7dc1a,a64c8bad-2eed-4f71-9a2c-ab6446555b42,2026-02-21T18:58:48,,"Without benefit few according buy hotel magazine. Long record safe else program. Find edge pattern security.
Range mean watch house main if.",2026-01-27T11:43:40,in progress,Remember last training grow PM. Action phone high choose half agreement.,Bowerston,3240.12,50,routine,e0d1ef75-4a31-4c0c-8a21-9b5cb93a95d2,2026-01-18T19:17:38,2026-04-05T08:43:54.294398,94073e1c-299b-4c75-93d9-8b7e2cb96cc4,28df3e2b-493d-477d-8462-2242a35c3f00
e65d2740-4837-40f9-a48f-7fa99accf3d0,084e231e-e1f9-43f1-9eea-8501ecc87efe,2026-03-29T13:07:18,,Room low remain head bag fact something piece. Blood religious they easy play specific whatever. Analysis already surface thought wear spend rest. Whose cell prevent tree let information degree grow.,2026-03-22T01:39:07,unassigned,Door dog strong specific able he laugh. Reveal forget ahead half. Seek manage do reach bag.,Bradleymouth,954.3,34,urgent,3b573514-9a6b-4950-8eb8-8779bad3cf3b,2026-03-14T19:40:59,2026-04-05T08:43:54.294703,bf639170-d4e7-404e-9456-752f8b29d5f9,a5313216-beec-4d79-b77a-ddadf9bb920a
540b4301-0666-444c-9979-8292c56b517e,a64c8bad-2eed-4f71-9a2c-ab6446555b42,2026-03-08T22:50:28,,"Sell door friend evidence agent most. Public affect size onto boy.
Something even else including between or arrive. To population weight necessary last worker music. Nothing left still rest nature.",2026-03-28T12:39:00,completed,Not organization center door. East education mission baby resource.,East James,8154.97,44,emergency,c7ea2efc-77d3-42db-b76b-0b4785ee288e,2026-03-03T03:54:41,2026-04-05T08:43:54.295092,169785db-6b3f-413b-8b88-5f1e5710377c,b5f914e4-2830-4bc4-a67c-6524ca46b82c
c4291dce-995d-4882-973c-f721413d7d2b,ca790bf9-a3d5-441e-9e35-13b30dd2f3a3,2026-03-27T09:30:26,,"Paper buy along east event no. Individual position seat because show against.
Out past I their time. Which among watch board. Easy rule mind point member.",2026-04-02T00:28:59,in progress,Next city soldier company election gun heavy.,Steinburgh,8411.98,12,urgent,6e2cc6ee-6bac-4671-90d2-86b1c56c0fe5,2026-03-24T08:06:39,2026-04-05T08:43:54.295380,5858bbed-ffb9-4254-b090-1af5f7524617,0fdf2442-7257-490d-bd9c-3251d77b3ce8
f5fc2629-c66e-490b-b979-c416bf5e3aea,084e231e-e1f9-43f1-9eea-8501ecc87efe,2026-02-08T16:05:28,,Especially rise population participant animal do mission. Training current perhaps so. Fish full relationship. Never executive safe outside build evidence.,2026-01-01T07:46:07,completed,Yet his occur local. Might left help activity.,Lake Michelle,6485.16,70,urgent,86d8cfae-3b98-45f5-bf69-5c2c422130b4,2025-09-29T22:16:20,2026-04-05T08:43:54.295644,db36aad4-6cf1-483b-8db4-095537af8dc3,5717fe02-ebb5-461c-95a1-2768559c52d5
6291427f-78f3-425c-baaf-e5e33ad73184,8d975f8a-3c15-42d6-a033-74e9628c5264,2026-02-28T14:57:07,,Born shake model amount write. Style should direction worry. Reveal though president meeting war partner.,2025-12-26T10:33:18,assigned,Hard from white provide return environmental. Dog point concern.,Cynthiahaven,3116.51,28,urgent,63f4b8f1-3a9d-457e-8a34-e3e719900a1c,2025-08-05T02:36:30,2026-04-05T08:43:54.295904,532f582b-6136-4a35-be5d-59d6af47f4a3,700d55de-5e5d-4b19-bd19-df46a12ced3a
d09fe15e-f3c3-439a-9c88-2c6554b2e83a,1c9ccf14-5176-4c6c-8254-4abf7d027bfa,2026-01-10T10:45:40,,"Result college example rise theory after.
Across main mission serious. Arrive growth white improve according. Vote cup under forget security lead source.",2026-03-09T21:18:46,unassigned,Central many require. Difficult energy fund no could.,New James,6005.88,71,urgent,0fd3f492-fdf8-43cf-a536-3746bb53375e,2025-12-12T21:11:46,2026-04-05T08:43:54.296168,58171bd9-9c34-450b-a42f-179be192aef8,209b6d70-19b5-450b-a0b9-0c6e659c0e84
