id,assigned_vendor,client_id,assigned_at,completed_at,description,work_order_name,estimated_start_date,estimated_end_date,current_status,comments,location,location_type,latitude,longitude,estimated_cost,estimated_duration,priority,well_id,service_type,estimated_quantity,units,is_recurring,recurrence_type,cancelled_at,cancellation_reason,created_at,updated_at,created_by,updated_by
380db9c0-614b-4b46-b99a-b325a64076be,976efc1b-14ab-4f55-b545-737e09b5c32a,00433d9c-81cf-4058-bf6a-fed7ddb39ed2,2026-04-12T01:40:19.661359,,"Indeed drug music animal much. White listen produce soldier enjoy front. Main paper ball civil.
Must station force. Under baby this land option.",WO-19888,2026-04-14T01:17:05.859150,2026-04-15T01:17:05.859150,IN_PROGRESS,Music health increase sell rest. Table relationship final wind.,Davidshire,GPS,-49.8756565,-165.766171,35072.25,"1 day, 0:00:00",HIGH,70fd92c8-cb17-49a2-b48d-99d44cfc707d,1ae8c37c-38a8-4360-94a0-0adfc4c9305b,56.09,loads,True,MONTHLY,,,2026-04-09T10:26:44.609808,2026-04-16T05:41:23.004482,f193b79d-44c7-4627-be82-c0600f7f3eac,6edd5d93-c759-46bb-bc23-087336b6d724
bbc500a4-c1db-4a74-93e5-25f363b9c14b,cff59dfd-47ec-43be-8791-91f399189fb6,56f6f056-e13b-44a9-9b75-c474164d6faa,2024-05-18T06:31:47.003372,,Rest show usually unit although wish. Play nor cut civil machine forget.,WO-10900,2024-05-19T01:38:09.306930,2024-05-22T01:38:09.306930,REJECTED,Usually a after time section human support. Night meet memory image either really try.,Jonesshire,ADDRESS,34.5532265,32.134997,14014.15,"3 days, 0:00:00",MEDIUM,a374f166-f69f-410f-b6e0-fd15efb1b060,50332e38-e437-4b90-b168-2b3d2557eede,34.82,visits,False,,,,2024-05-17T07:04:37.645184,2026-04-16T05:41:23.004910,6ca77823-f09a-4f69-b752-d15d08bbc4ee,46cd365c-ed3d-4c73-8e44-9b19ff05ef8c
1786aa29-d42f-4b0e-906c-3db83d1c7912,4678cf0f-ec53-469f-8fdc-1952c6c95524,00433d9c-81cf-4058-bf6a-fed7ddb39ed2,,,"Eye paper skill defense. Body protect shake. Third and just senior trade final after.
Wrong travel enter bring sea. Lay service try.",WO-03751,2025-09-23T15:03:14.953714,2025-09-28T15:03:14.953714,UNASSIGNED,Here night say reason. Rate nice try couple responsibility purpose there.,Lake Carolineshire,GPS,-68.271783,-39.045823,33798.97,"2 days, 0:00:00",HIGH,a8ea5934-3296-44fe-983e-b2702ef80311,1ae8c37c-38a8-4360-94a0-0adfc4c9305b,89.63,visits,True,ONE_TIME,,,2025-09-19T02:05:18.431691,2026-04-16T05:41:23.005337,2c09f72c-b0fe-4405-9429-19b4c8504295,3202e7fb-5311-4fb1-8cc6-69194698d0a8
530ec055-9577-4ec1-8a64-0f76cd41beba,976efc1b-14ab-4f55-b545-737e09b5c32a,c5d2e606-6a9f-49bc-b434-8cfe4e54eec0,2026-01-24T03:19:15.082903,2026-01-25T16:55:41.580732,"Office door account similar hold even. Around social perhaps face eight question onto.
Fine side audience carry policy. Mean program ability later east.",WO-56862,2026-01-25T07:37:36.665230,2026-01-26T07:37:36.665230,CLOSED,Pay well poor southern. Southern least adult white him.,New Cynthia,GPS,64.560112,178.048189,41459.61,"2 days, 0:00:00",MEDIUM,bb84848b-0ead-4180-b882-6cab8742960f,1ae8c37c-38a8-4360-94a0-0adfc4c9305b,18.54,hours,False,,,,2026-01-22T08:41:27.722438,2026-04-16T05:41:23.005886,1df8faf1-5c8a-4f6a-9d16-4cde4e9810aa,0e547418-47ef-4ac3-a1b5-cda3a2d32837
6a4feda5-5504-4a0c-91ad-81b9103b53d7,0c7b6485-a187-4495-9459-142ad8d38f4d,00433d9c-81cf-4058-bf6a-fed7ddb39ed2,2026-04-16T05:36:56.107442,,"Approach let age fill. Recently reach land can themselves. Gun degree citizen successful.
Next choose standard several claim. Front international six fight.",WO-95418,2026-04-16T05:37:18.059923,2026-04-19T05:37:18.059923,IN_PROGRESS,Article once black analysis. Realize after sense describe. Hair amount much.,Petersonland,ADDRESS,71.8673175,-67.15647,9979.83,"3 days, 0:00:00",HIGH,11261453-ccc7-4685-b140-c91680913cd3,2d9f1a62-d4a7-4c88-8ff3-3d3942708b81,31.01,gallons,False,,,,2026-04-16T05:02:35.133062,2026-04-16T05:41:23.006349,e64d299a-7e6d-4737-9360-0c73232e545f,516f773e-9ff4-4160-9217-4989207f2983
011ec054-aa1f-4a4d-8b79-07ea9d4c726b,0c7b6485-a187-4495-9459-142ad8d38f4d,00433d9c-81cf-4058-bf6a-fed7ddb39ed2,2024-07-28T06:13:09.557749,2024-08-01T03:34:58.061273,"Evidence teach several community interesting around which great. Meeting bill ever natural away.
Section room red professor. Thing last determine computer anything operation military.",WO-65858,2024-07-29T16:12:09.293694,2024-07-30T16:12:09.293694,COMPLETED,Think issue green type picture home whose. Only attack put they now despite agreement each.,Staceystad,WELL,7.6603335,-127.989424,5991.85,"2 days, 0:00:00",HIGH,11261453-ccc7-4685-b140-c91680913cd3,2d9f1a62-d4a7-4c88-8ff3-3d3942708b81,50.53,gallons,False,,,,2024-07-27T04:19:52.016976,2026-04-16T05:41:23.006750,03c1da94-f739-40af-a438-3947ed587fbb,558f6db3-49a5-4bbe-9c10-b7b3cab6e8b4
73435fc4-2717-4fda-b77c-f6c6da4f3938,4678cf0f-ec53-469f-8fdc-1952c6c95524,cf5fd7cb-7cc4-4129-a6df-f8e0dfcd7fb7,2024-05-18T21:14:12.396545,,But miss somebody paper high bit head. Part ask author me street or tough. Role think medical politics. Serve collection their control hospital hear.,WO-19471,2024-05-20T11:57:12.094007,2024-05-22T11:57:12.094007,ASSIGNED,Western daughter wife bank case. Say position evidence worry. Side at author reality seven.,Smithshire,GPS,65.738232,88.235958,9996.65,"3 days, 0:00:00",LOW,6e40f587-69c2-48cf-b319-1c55a7bab11a,50332e38-e437-4b90-b168-2b3d2557eede,99.2,days,True,WEEKLY,,,2024-05-16T02:12:59.044296,2026-04-16T05:41:23.007309,23731bd9-b92f-4769-98ae-8e23ecb818a5,8b07ac21-cf18-4266-9439-4b509f5a85e0
fc353914-bdcc-46d4-9a73-37e4dcc66680,88bdb298-8da5-47e4-a4ec-178d9ae25cdb,c5d2e606-6a9f-49bc-b434-8cfe4e54eec0,2026-04-16T04:52:38.955832,,"Everything according together in seem lot.
Reality picture establish important ready country. There toward wall send example. Single store sit.",WO-72527,2026-04-16T05:04:08.191854,2026-04-17T05:04:08.191854,ASSIGNED,Raise million cold. Themselves young young continue director work.,Anthonyburgh,GPS,30.0663435,59.415094,42294.91,"2 days, 0:00:00",MEDIUM,11c7b27c-fdc3-4c54-951c-c2eed5e7ba8a,1d15cc9c-bbe5-46c9-81bb-d76c6d53997b,13.05,days,False,,,,2026-04-16T01:05:55.099273,2026-04-16T05:41:23.007814,52bbaa3d-a87a-4fc2-81f4-d155e74632dd,0f28f863-025e-42e8-83fb-fa34d9254832
9445a8a7-4658-49cd-91be-717cf9263f4c,0c7b6485-a187-4495-9459-142ad8d38f4d,00433d9c-81cf-4058-bf6a-fed7ddb39ed2,2024-10-16T21:33:11.714418,,"Military man book until thought. Month management rather make friend class.
Property without traditional almost figure plant Democrat wife. Whole yourself could question.",WO-94919,2024-10-18T01:21:02.095762,2024-10-22T01:21:02.095762,HALTED,Huge industry director spend. Society special owner best. Rule here common paper less.,Port Royview,ADDRESS,42.620224,32.998956,16153.98,"2 days, 0:00:00",LOW,11261453-ccc7-4685-b140-c91680913cd3,2cc137b9-70a3-4c73-8a9f-7918ef898f2e,34.14,days,False,,,,2024-10-15T17:04:27.367650,2026-04-16T05:41:23.008256,baaef626-0672-4ec1-8702-5d620934b2aa,d71f5776-6150-4e18-9dde-91576736485b
00ce7bba-9d20-4eca-8a9c-c1a9349d1fee,4678cf0f-ec53-469f-8fdc-1952c6c95524,5b5c3c37-70f2-465f-8c5b-3d4e90f804e4,2024-12-21T20:40:44.079079,2024-12-25T09:56:40.242347,"Through leader sound give customer eat very including. Democratic few over instead former free mother.
Suffer order write main already. Interview impact science hair several base event.",WO-29083,2024-12-23T17:14:01.334620,2024-12-25T17:14:01.334620,COMPLETED,Reduce read method language. Though enjoy standard model join.,Jeremyshire,WELL,59.277599,68.196812,15884.89,"3 days, 0:00:00",HIGH,9eacb904-3044-43da-a3fa-f4facf315c0f,2d9f1a62-d4a7-4c88-8ff3-3d3942708b81,10.58,visits,False,,,,2024-12-18T22:19:07.765566,2026-04-16T05:41:23.008843,f7f033a6-a80b-4a0f-a3f1-9ca21970a003,809bb6f0-8fcb-4e50-9428-caf7ee593a81
450d5720-e561-4fc4-9a8f-b20926f5c748,0662f3bb-2c28-4b44-acfe-56565d827f1f,3ae3720e-3bf7-499f-91ed-7e129d4ccdce,2024-10-22T18:22:23.568361,2024-10-24T13:18:28.016381,"On talk one federal. Move five small suffer trip eye hospital find. Thus financial father bank.
Model forget successful soon. Poor training power air boy sea generation.",WO-99726,2024-10-23T11:12:31.080353,2024-10-25T11:12:31.080353,CLOSED,Present apply author network. Kind apply up similar say grow.,Charlesburgh,GPS,-68.396604,-100.212761,26223.91,"1 day, 0:00:00",LOW,6bc3b38c-4935-4336-b333-d0a648931402,521017d3-3b25-4d49-90c9-b7eca5ccd641,77.8,days,True,WEEKLY,,,2024-10-20T07:27:00.644427,2026-04-16T05:41:23.009281,46cd365c-ed3d-4c73-8e44-9b19ff05ef8c,f7f033a6-a80b-4a0f-a3f1-9ca21970a003
fac02320-49a9-4907-8e24-f3bff130b571,0662f3bb-2c28-4b44-acfe-56565d827f1f,87a43abf-a0aa-4b19-bcdd-ea7b1e66a945,2024-09-30T20:15:28.781497,,Serious amount hot less difficult. Hot Republican so high. Early west million this. Around fly bill such class per exactly.,WO-78953,2024-09-30T21:56:04.368916,2024-10-01T21:56:04.368916,ASSIGNED,Peace she sometimes party among. Usually themselves number decade her again.,South Justinfurt,WELL,-58.7955355,-101.301493,16007.33,"3 days, 0:00:00",LOW,10d257dd-d748-428f-83b0-64cbdc34c18a,521017d3-3b25-4d49-90c9-b7eca5ccd641,78.48,hours,False,,,,2024-09-29T03:15:18.613884,2026-04-16T05:41:23.009782,5fcbd4e6-8955-4494-97f8-4ebae5280351,46b6c1b0-88a4-426c-829f-9c17a8c4ac0b
0e6015d1-48b5-432d-8449-e4ad3c806d73,3717f5e0-8ae1-4f1b-a417-590176d14f60,9fbeb236-818f-49c9-99bf-92fd28079bf6,2024-05-15T18:20:06.306374,,"Hope real see decide crime relationship. Decade people someone specific. Decision around exist sense.
Discuss organization will number. Tough few Mr none.",WO-29299,2024-05-16T10:33:05.946860,2024-05-17T10:33:05.946860,CANCELLED,Choice agency doctor know season fly listen environment. Product threat any.,New James,ADDRESS,-26.871675,52.846904,15098.38,"2 days, 0:00:00",MEDIUM,0ebfc049-8b48-4058-8d0f-1bd6dc45cdfb,521017d3-3b25-4d49-90c9-b7eca5ccd641,10.49,visits,True,ONE_TIME,2024-05-16T10:00:38.260237,Client cancelled request,2024-05-13T06:05:24.200423,2026-04-16T05:41:23.010212,3c4fedfc-36b4-450c-b9f4-dae5137bb644,b8c4f676-fbcc-4e32-a894-2064d18e3cda
3f8c3451-062c-4fe9-8918-d049804fc783,976efc1b-14ab-4f55-b545-737e09b5c32a,db8ac4f6-6623-4a62-a8fc-db0ac50bad37,2025-09-24T07:08:54.795182,2025-09-27T03:46:56.889521,"Federal walk exist pull. Paper those thousand inside. Movie measure population activity record participant.
Sometimes throw official clearly. As per sea often treatment.",WO-10883,2025-09-25T23:09:57.599645,2025-09-29T23:09:57.599645,CLOSED,"Economy fund magazine catch our. Begin many former enjoy see.
Democrat candidate prove couple.",Port Kevin,ADDRESS,3.4684685,-155.268542,32720.61,"3 days, 0:00:00",LOW,723974b1-d7d7-4013-b45d-5fedabfb5fa1,1ae8c37c-38a8-4360-94a0-0adfc4c9305b,45.95,loads,True,WEEKLY,,,2025-09-22T01:21:05.225090,2026-04-16T05:41:23.010643,03c1da94-f739-40af-a438-3947ed587fbb,b77a8912-ce3d-40b3-ab27-69e6aac69773
55ec613f-a2c7-42dc-8abf-db6abd2beeb3,cff59dfd-47ec-43be-8791-91f399189fb6,87a43abf-a0aa-4b19-bcdd-ea7b1e66a945,2024-11-29T01:38:17.584988,,"Several interest night example at nature. Skin street TV particularly beautiful light into.
Reduce none indicate rich after color. Manage soldier national because we read three as. Money way general.",WO-50849,2024-11-29T11:23:55.788742,2024-12-04T11:23:55.788742,ASSIGNED,Listen trouble trial call. Service look style. Stock next state former camera difference close.,East Mark,WELL,-83.696372,54.419813,18091.87,"2 days, 0:00:00",HIGH,10d257dd-d748-428f-83b0-64cbdc34c18a,50332e38-e437-4b90-b168-2b3d2557eede,62.46,gallons,True,WEEKLY,,,2024-11-27T00:11:02.226225,2026-04-16T05:41:23.011070,db688f67-8abe-48a4-bb40-9b9f39b51b70,e167fd34-e2ea-4ed3-95b9-ba9b6a97a392
24d329e6-6cdc-4777-93f4-1d973d0518a1,b29a8b42-259b-4fa9-9c07-ac0390374664,56f6f056-e13b-44a9-9b75-c474164d6faa,2024-08-16T08:15:36.156354,,Today throw voice themselves most cold yet. Enough herself find. Stuff detail require once both sell.,WO-81815,2024-08-16T12:13:43.124587,2024-08-21T12:13:43.124587,CANCELLED,There order effort box cold boy. American law toward upon ever.,Port Daniel,GPS,28.4565235,-50.294994,23741.43,"3 days, 0:00:00",MEDIUM,d2b3cab9-1bac-40d1-aa05-0532f66216a6,50332e38-e437-4b90-b168-2b3d2557eede,29.82,hours,True,DAILY,2024-08-17T23:12:18.861284,Resource unavailable,2024-08-15T09:55:30.073126,2026-04-16T05:41:23.011540,e44fd82c-78d8-4eaa-9f85-d1d2edc3f0c8,896ecf12-19b7-4596-9ef3-01858c8c7a68
59498e00-61a4-418f-b953-9ed2100e34d6,4678cf0f-ec53-469f-8fdc-1952c6c95524,cf5fd7cb-7cc4-4129-a6df-f8e0dfcd7fb7,,,"Data believe grow practice drop pattern. Tell fly big word capital worker stay. Beyond continue produce effort age today.
Care off management.",WO-02642,2024-11-20T22:20:07.880058,2024-11-24T22:20:07.880058,UNASSIGNED,One the remember father hold. Vote remember themselves make practice.,Joycemouth,GPS,-88.503319,-45.240825,32207.46,"1 day, 0:00:00",LOW,6e40f587-69c2-48cf-b319-1c55a7bab11a,50332e38-e437-4b90-b168-2b3d2557eede,34.81,visits,True,DAILY,,,2024-11-17T21:30:39.638880,2026-04-16T05:41:23.011993,5e6be2d6-afd4-4d3b-ae06-90c52c5f67bd,db688f67-8abe-48a4-bb40-9b9f39b51b70
ccfec12b-c214-4f43-8250-7583d6a0fa34,b4531ca4-b042-4cf2-9ef5-7c1e35fd541f,87a43abf-a0aa-4b19-bcdd-ea7b1e66a945,2025-11-07T23:17:46.824288,,"Despite perhaps new gun note.
Real might fall determine. Trade deal window piece action participant dinner. Anything blood reach.
Parent audience poor actually general.",WO-88161,2025-11-08T08:21:20.545913,2025-11-11T08:21:20.545913,CANCELLED,President ok force middle task ahead difficult. Travel business herself give.,Port David,WELL,-73.7470415,-12.396134,43867.22,"1 day, 0:00:00",MEDIUM,816a183a-24bc-4f72-9bd4-b1fa7a32478b,2d9f1a62-d4a7-4c88-8ff3-3d3942708b81,22.72,hours,False,,2025-11-09T10:48:14.771603,Weather delay,2025-11-05T08:50:20.655971,2026-04-16T05:41:23.012404,05d7c52d-ae56-44a0-8a73-08bbad2207da,61af3099-e07f-445a-8464-46ba47f31986
d24dc66e-7edd-4ef0-91f1-9be25f4aff40,88bdb298-8da5-47e4-a4ec-178d9ae25cdb,92feeac5-761f-4487-a05b-d4d30859f098,2025-06-16T20:58:00.881157,2025-06-21T11:57:04.590071,"Civil good near. Congress happen until close return easy ahead between.
Result role stand second skin. Dog might report listen maintain. Tough animal of prevent market.",WO-13354,2025-06-18T15:16:32.658157,2025-06-22T15:16:32.658157,COMPLETED,Someone easy arrive television focus. Sense seek hospital fact near top. Take position leg lawyer.,Lake Jonathonshire,ADDRESS,-89.9716245,95.146061,40459.93,"2 days, 0:00:00",LOW,cd343f2e-67d5-4aec-b72b-ecd15989ee86,1d15cc9c-bbe5-46c9-81bb-d76c6d53997b,40.63,hours,False,,,,2025-06-16T03:45:15.820567,2026-04-16T05:41:23.012810,7e715289-b0ff-4047-ad3d-699b6f9be58e,1109e90d-f954-4308-84df-9404b839fe88
7d43cde4-d97a-4df8-9a0c-bb57c15bb1f2,b29a8b42-259b-4fa9-9c07-ac0390374664,cf5fd7cb-7cc4-4129-a6df-f8e0dfcd7fb7,2025-09-30T07:34:25.187051,,"First laugh health give threat. Change he maintain that work little ready discover. Suggest cut sense discover born.
Hour apply art tell part. Most south either sign those type.",WO-89740,2025-10-01T20:24:52.451346,2025-10-04T20:24:52.451346,IN_PROGRESS,Difficult difference where rule hold six. Our receive case human society event offer.,Lake Kelsey,GPS,59.131825,132.348538,2673.29,"1 day, 0:00:00",LOW,1be97949-2a3c-4980-81b7-669dc9a0aedd,50332e38-e437-4b90-b168-2b3d2557eede,20.58,gallons,True,WEEKLY,,,2025-09-27T13:18:32.828688,2026-04-16T05:41:23.013291,40bfcd30-f3c2-4c13-a78d-694591a4424b,eed45db3-0dd3-4bef-8125-c5b5cc6cf12b
1aace202-9fa2-405a-9263-1f53588aeabd,88bdb298-8da5-47e4-a4ec-178d9ae25cdb,d2b63471-5290-4bf5-9d7c-86e2435b53fc,2025-12-20T11:01:59.979740,2025-12-22T06:13:15.616575,Tell determine continue board we never. Score center poor team. Local detail science bring answer suddenly someone. Left federal sit in gas yeah already family.,WO-52736,2025-12-21T10:35:02.075685,2025-12-23T10:35:02.075685,COMPLETED,"So laugh happy.
Prepare every remember. Discuss matter anything at fish chance name.",Martinezhaven,WELL,-43.2450505,20.61574,42222.63,"1 day, 0:00:00",LOW,12990c1a-2a9e-44ae-83db-e296deda81a5,521017d3-3b25-4d49-90c9-b7eca5ccd641,83.31,gallons,True,DAILY,,,2025-12-19T00:54:48.899405,2026-04-16T05:41:23.013820,166eca99-5271-4201-8fc4-587fed6ddae3,02f88948-01c0-46f8-8867-17faa7fa0d1c
6f8caa9b-46fa-4eb1-8416-1177245a1f17,3717f5e0-8ae1-4f1b-a417-590176d14f60,873ed2c3-5db9-4e66-8fd5-eda1ae4e0cbc,2025-01-30T17:19:16.178673,2025-01-31T18:36:13.899561,Political capital type ago color who quickly. Subject item win including begin.,WO-49857,2025-01-31T13:47:16.565645,2025-02-03T13:47:16.565645,COMPLETED,Like him protect appear civil agent try. Final candidate memory carry gas Congress. Own big yeah.,Moranside,GPS,-30.8658085,46.460029,43980.2,"1 day, 0:00:00",LOW,53c27215-e85c-4fa2-8375-cf8f03b98b0c,50332e38-e437-4b90-b168-2b3d2557eede,15.3,gallons,True,MONTHLY,,,2025-01-30T12:22:49.730125,2026-04-16T05:41:23.014349,1bd0259e-c178-49df-a9f2-4f7d380c6b7c,bd532e64-ebc0-4a59-9f95-283d7992f025
bbb1f0b2-147d-4d79-bfa3-9729cbe68fb5,b29a8b42-259b-4fa9-9c07-ac0390374664,028545bf-3cab-4c72-9cdb-f40b5b7308fe,2024-11-15T15:17:17.386880,,"Imagine memory pattern lot. Check why professional court tonight expert cultural. If federal speech. Matter hand more perform laugh outside on.
Our rock natural necessary campaign small.",WO-87858,2024-11-16T06:49:11.239822,2024-11-21T06:49:11.239822,REJECTED,"Out central soon somebody low.
Course provide sea four rest medical.",Cynthiaville,GPS,-87.8631605,-38.251722,38272.58,"3 days, 0:00:00",LOW,f7ab65fd-2789-4536-bdfb-584d848f0760,50332e38-e437-4b90-b168-2b3d2557eede,85.59,loads,True,ONE_TIME,,,2024-11-13T19:56:47.863656,2026-04-16T05:41:23.014771,3669715f-0c57-4695-8317-bbaa80e2dcd1,69c6686e-13fc-41b4-950a-f5f44309af6c
41d5e15a-b356-47fa-ae75-dc6206a959a1,b4531ca4-b042-4cf2-9ef5-7c1e35fd541f,c5d2e606-6a9f-49bc-b434-8cfe4e54eec0,2025-10-06T03:18:20.207366,,"Throw recent raise.
National company traditional couple development no. Attack director teacher today as expect population. Light teach main college first remain.",WO-92476,2025-10-07T18:22:49.554463,2025-10-09T18:22:49.554463,HALTED,Event direction PM daughter also shoulder travel. Worry buy large majority even hospital student.,East Natalie,ADDRESS,-81.8040485,-44.151217,10857.26,"1 day, 0:00:00",MEDIUM,0babe4ef-5e0e-41aa-af1e-e037f115335c,521017d3-3b25-4d49-90c9-b7eca5ccd641,79.31,days,False,,,,2025-10-03T07:24:08.695685,2026-04-16T05:41:23.015157,e4aae49d-de25-4ee1-924e-3a2b278ed3f3,bcf830b7-c0e2-4402-a44f-75b8039ccdba
fe3bcfbe-c8f7-46b0-be1b-d01fcb93912c,976efc1b-14ab-4f55-b545-737e09b5c32a,00433d9c-81cf-4058-bf6a-fed7ddb39ed2,2025-07-29T02:37:41.163473,2025-07-31T18:51:28.509802,"Will many people create improve mean. Sign friend catch hard bring. Purpose yet Mr from myself material.
Here themselves population child. Interesting wide response movement kid information these.",WO-59713,2025-07-29T04:37:15.616282,2025-07-31T04:37:15.616282,CLOSED,Box watch candidate challenge. Range mind across collection defense picture foot.,Carolineton,GPS,13.881332,128.021826,26511.05,"2 days, 0:00:00",HIGH,70fd92c8-cb17-49a2-b48d-99d44cfc707d,1ae8c37c-38a8-4360-94a0-0adfc4c9305b,95.62,visits,False,,,,2025-07-26T17:53:27.840476,2026-04-16T05:41:23.015564,37f021f9-ef71-484f-9a5d-833f894e4f0a,244e466f-816b-4fc1-b656-03e0e3f07c1b
f7bd1460-f267-473b-9748-4c501a53cb4e,86ea9e9c-f1d8-423c-bb34-2f1df47812aa,db8ac4f6-6623-4a62-a8fc-db0ac50bad37,2024-05-21T15:54:03.788795,2024-05-26T01:57:08.480097,"Whether official eye policy name three should. How certainly hold. Number hand film.
Black not off adult. Somebody market material. Mouth time these.",WO-32533,2024-05-23T05:32:40.806950,2024-05-27T05:32:40.806950,COMPLETED,Mind night sit side sister ready. Serious institution main concern best.,Wolfetown,WELL,-71.062388,28.774601,11320.39,"2 days, 0:00:00",MEDIUM,3c2b257c-08f8-4262-a55c-a0a781cf33b8,521017d3-3b25-4d49-90c9-b7eca5ccd641,57.57,loads,False,,,,2024-05-20T22:35:56.173460,2026-04-16T05:41:23.016073,f9fa8ea4-ae81-4cff-bdc0-d6f07fca45cb,486fac9b-dfef-4e71-83c9-412c238db71a
cc54b041-8c7c-4c19-9e9e-47b6144eeb27,b4531ca4-b042-4cf2-9ef5-7c1e35fd541f,56f6f056-e13b-44a9-9b75-c474164d6faa,2025-11-18T23:38:37.776428,,"Three machine oil season discuss. Plant friend believe field wear hour land tend.
Film during concern push. Across field after citizen knowledge.",WO-67756,2025-11-18T23:48:47.364979,2025-11-20T23:48:47.364979,REJECTED,Time whom staff sign cut drug. Alone executive season image.,West Lauren,ADDRESS,33.898986,108.923777,25856.97,"2 days, 0:00:00",MEDIUM,65060607-d4c1-43b9-b74e-d4a08676f8ae,521017d3-3b25-4d49-90c9-b7eca5ccd641,45.66,visits,True,MONTHLY,,,2025-11-18T16:54:14.565377,2026-04-16T05:41:23.016497,af0a1396-4c73-47ae-81ae-18d7efb7ebb3,9879aed1-fcb1-43e9-98de-997828446b85
8e19283b-dbe1-4759-80e7-a1609bef8a39,0662f3bb-2c28-4b44-acfe-56565d827f1f,db8ac4f6-6623-4a62-a8fc-db0ac50bad37,2025-10-13T21:57:34.486955,,"Citizen sign meet military compare. Similar plan person strong. Surface reveal window provide question make.
Man eight third require clearly. Power east catch way.",WO-69134,2025-10-15T20:28:20.022445,2025-10-19T20:28:20.022445,IN_PROGRESS,Service push audience share night another floor hot. Outside establish job feel.,Lake Anthonyburgh,WELL,-7.972466,68.590481,32445.07,"2 days, 0:00:00",LOW,6cc018a5-b3ee-435e-b83c-a1d590df5697,521017d3-3b25-4d49-90c9-b7eca5ccd641,30.16,days,False,,,,2025-10-13T15:32:26.186179,2026-04-16T05:41:23.016912,fce0c62e-9cf8-4dae-8bad-209fd914fcc7,98155a12-0337-42bf-9556-52e775ff787e
ba914356-468e-4237-af58-c43fc0992776,3717f5e0-8ae1-4f1b-a417-590176d14f60,028545bf-3cab-4c72-9cdb-f40b5b7308fe,2026-01-07T19:25:26.907493,,"Simple design subject pattern lose more.
Local here return site manage. Treat control sign computer either lot find. Computer much man include.",WO-99481,2026-01-09T18:04:12.789742,2026-01-10T18:04:12.789742,ASSIGNED,Despite necessary stuff up case stage. Fund although everyone. Smile second we run politics shake.,West Virginiahaven,WELL,-23.919595,-92.449764,2394.93,"1 day, 0:00:00",MEDIUM,0fe53134-2df9-48ca-b3f2-5e0e26576e73,521017d3-3b25-4d49-90c9-b7eca5ccd641,20.47,loads,False,,,,2026-01-05T03:06:58.142728,2026-04-16T05:41:23.018230,00b73270-c656-4975-841e-5aaaef0e5413,0a18cf73-36b7-4784-bdf5-f184913041a4
59bc42a6-8bda-4571-b753-776ac352a77b,3717f5e0-8ae1-4f1b-a417-590176d14f60,5b5c3c37-70f2-465f-8c5b-3d4e90f804e4,2024-08-03T11:43:05.257243,,"Blue myself hospital wife. Claim much project.
These behavior pass paper treatment thousand team. Product behind research necessary west various TV yard.",WO-45661,2024-08-04T11:11:43.745018,2024-08-09T11:11:43.745018,IN_PROGRESS,Value human population thus turn other. Film arm keep management into agree.,South James,GPS,-59.9815495,135.365862,14451.34,"2 days, 0:00:00",MEDIUM,9eacb904-3044-43da-a3fa-f4facf315c0f,50332e38-e437-4b90-b168-2b3d2557eede,94.64,days,True,WEEKLY,,,2024-08-02T08:44:35.618959,2026-04-16T05:41:23.018688,d90e32a7-4cad-44c6-a4c9-cc3573eb83a2,321ff7be-cede-4452-acad-156dc9838c28
e361075b-ff24-4307-8f73-972cf70a9f49,0c7b6485-a187-4495-9459-142ad8d38f4d,e80bd25d-34ed-48c6-be91-6778971a9853,2026-01-04T22:39:22.686215,,House health site check little. Present fire old realize movie crime. Interest fast field difficult newspaper property third. Blood field letter offer your.,WO-94973,2026-01-06T12:34:35.700411,2026-01-10T12:34:35.700411,IN_PROGRESS,Compare specific here debate man. North someone company cover.,Jenningsstad,WELL,-78.6792875,-179.379169,23984.69,"3 days, 0:00:00",HIGH,105ae3aa-3245-4c0b-94eb-c76cf80ebaaf,2cc137b9-70a3-4c73-8a9f-7918ef898f2e,78.81,visits,True,DAILY,,,2026-01-03T15:53:15.649805,2026-04-16T05:41:23.019261,0e3ea1d5-e3af-4992-bc85-98239ef65e48,bd532e64-ebc0-4a59-9f95-283d7992f025
82abe229-117d-49b1-b7fa-9b8385725bba,b4531ca4-b042-4cf2-9ef5-7c1e35fd541f,87a43abf-a0aa-4b19-bcdd-ea7b1e66a945,2025-02-13T16:28:16.475485,2025-02-19T22:53:41.066793,Toward anyone employee hear reason meeting. Move song peace change television tend. Adult his some.,WO-81796,2025-02-14T11:21:02.389388,2025-02-18T11:21:02.389388,COMPLETED,Ball its board dog. Hope gas difficult think southern.,Greershire,ADDRESS,-20.143085,80.310474,10874.45,"2 days, 0:00:00",HIGH,816a183a-24bc-4f72-9bd4-b1fa7a32478b,521017d3-3b25-4d49-90c9-b7eca5ccd641,3.98,gallons,False,,,,2025-02-11T14:25:06.130028,2026-04-16T05:41:23.019772,7cd4528b-e6ac-42a2-a094-1fa1079760b2,bd4c38a8-14f0-4725-9b57-9feed2b1e6cf
bcc6e781-f137-444f-9a5f-feffc43034ca,0662f3bb-2c28-4b44-acfe-56565d827f1f,cf5fd7cb-7cc4-4129-a6df-f8e0dfcd7fb7,2025-05-08T14:23:36.807806,,"However serious worker next employee. Few yard life real few debate.
Sometimes provide level hard investment. Become while huge because color within.",WO-30904,2025-05-09T15:49:02.438559,2025-05-12T15:49:02.438559,REJECTED,Member house thus study over bar walk act. Single almost where hand. Sign civil dinner back.,Jonathanview,WELL,-82.6509565,34.730367,21573.11,"2 days, 0:00:00",HIGH,2bfd5b63-ba0a-4fc0-9232-41b6477ae8fa,f63e6700-3590-44d4-93ee-620634a189eb,54.22,loads,False,,,,2025-05-05T22:06:05.662339,2026-04-16T05:41:23.020236,29df83d5-1cef-4d3b-868c-5f80049b6cc3,9dcaff25-e521-4892-adec-b0135ded74dc
0e839964-ea20-4842-b799-b630802a23f4,0c7b6485-a187-4495-9459-142ad8d38f4d,87a43abf-a0aa-4b19-bcdd-ea7b1e66a945,2026-04-01T21:56:07.958716,,Really care then make. Red everyone music assume could visit. Give they read budget. Computer avoid boy lot evidence.,WO-32420,2026-04-02T02:03:00.864661,2026-04-05T02:03:00.864661,CANCELLED,Century beat write lose Congress issue. Him begin treat little.,Lake David,ADDRESS,64.93375,-52.345193,49018.52,"1 day, 0:00:00",MEDIUM,c65466d1-6281-4ce4-a3fc-5c1e113cff5c,1d15cc9c-bbe5-46c9-81bb-d76c6d53997b,7.31,visits,False,,2026-04-02T14:31:26.451832,Safety concern,2026-03-30T04:49:06.388594,2026-04-16T05:41:23.020683,db688f67-8abe-48a4-bb40-9b9f39b51b70,d73b32fd-2732-4c30-9df0-2cfa5752d953
