id,assigned_vendor,client_id,assigned_at,completed_at,description,work_order_name,estimated_start_date,estimated_end_date,current_status,comments,location,location_type,latitude,longitude,estimated_cost,estimated_duration,priority,well_id,service_type,estimated_quantity,units,is_recurring,recurrence_type,cancelled_at,cancellation_reason,created_at,updated_at,created_by,updated_by
c143cf08-d7a1-4ac8-9455-88c7d545f79e,0662f3bb-2c28-4b44-acfe-56565d827f1f,873ed2c3-5db9-4e66-8fd5-eda1ae4e0cbc,2026-03-26T09:30:02.024172,,"Risk three because trouble moment center. Size life majority nice near off.
Son him bit lead art PM. Dinner task born door.
Anyone week someone tell.",WO-96058,2026-03-27T21:49:48.200606,2026-03-31T21:49:48.200606,IN_PROGRESS,Central cut around huge nothing common me. Customer total upon game education common.,West Christopherstad,ADDRESS,49.6656785,-28.469568,2576.8,"3 days, 0:00:00",LOW,684fa738-2409-4ee0-bb53-09464e185864,f63e6700-3590-44d4-93ee-620634a189eb,7.02,loads,False,,,,2026-03-26T07:22:47.180043,2026-04-16T05:41:23.119410,bd532e64-ebc0-4a59-9f95-283d7992f025,1d096f4a-1a9f-4d99-8138-213a79ea0a67
9bf314fa-02bb-4d8e-a499-b3cb47003f8c,0662f3bb-2c28-4b44-acfe-56565d827f1f,3ae3720e-3bf7-499f-91ed-7e129d4ccdce,2025-04-13T23:39:48.601169,,Suddenly reduce thousand should arm prepare pressure. Clear southern medical business authority black method. Also you glass kind country blue.,WO-28780,2025-04-14T05:54:08.430198,2025-04-15T05:54:08.430198,REJECTED,Animal prevent spring their year tax special provide. Early indeed others food affect.,New Marissabury,WELL,-7.8279355,33.682499,6102.54,"1 day, 0:00:00",LOW,6bc3b38c-4935-4336-b333-d0a648931402,f63e6700-3590-44d4-93ee-620634a189eb,21.2,days,False,,,,2025-04-12T10:01:22.121338,2026-04-16T05:41:23.119826,799d9fc3-d7d8-4f85-b583-c6ea4c872243,ba393847-410f-42e8-ab6b-a1ea46e756e6
a37ca41d-0739-4b2f-869c-dc152b03a094,976efc1b-14ab-4f55-b545-737e09b5c32a,c5d2e606-6a9f-49bc-b434-8cfe4e54eec0,2025-08-06T04:42:20.319754,,"Floor not hour knowledge situation indicate door. South coach along lose short pull one. Thank necessary real sense.
Down small beautiful appear relationship ten personal. Thank price technology.",WO-53349,2025-08-06T05:10:09.041265,2025-08-08T05:10:09.041265,HALTED,Name close method fall. Central include close present medical.,Karenton,WELL,-86.2938775,-177.478235,30544.85,"2 days, 0:00:00",MEDIUM,11c7b27c-fdc3-4c54-951c-c2eed5e7ba8a,1ae8c37c-38a8-4360-94a0-0adfc4c9305b,97.53,loads,False,,,,2025-08-05T23:01:09.127387,2026-04-16T05:41:23.120275,35ad4042-4448-4514-ab4f-7c86a85d853e,6bc4ca05-5fc3-47ee-aa0d-ecc6aee13b59
e6344193-38ad-40f3-a85e-0332decde2a6,b4531ca4-b042-4cf2-9ef5-7c1e35fd541f,1de1a4ae-f248-4934-bbf9-6d89826f25dd,2025-01-15T15:33:15.272007,,Particular well character step work at blue. Rather sea chair mission that another.,WO-56121,2025-01-16T13:57:43.358842,2025-01-18T13:57:43.358842,HALTED,Few about pick my knowledge hundred those election. Blood discover home best really return.,South Ronaldburgh,ADDRESS,-22.7098895,-175.026898,30647.39,"2 days, 0:00:00",HIGH,95652691-70bb-47f2-967e-8f5037cfdfcf,1d15cc9c-bbe5-46c9-81bb-d76c6d53997b,71.86,days,True,ONE_TIME,,,2025-01-13T20:32:19.618804,2026-04-16T05:41:23.120731,51adcfb7-e5d3-49ea-824f-129feb572dd3,8243f43b-f991-493b-8563-862bdd6f4cc0
f61a464f-db55-4184-a183-3ea01e0436b9,976efc1b-14ab-4f55-b545-737e09b5c32a,3226e426-ef49-45fa-b72e-550bd5da5fe9,,,"Near myself opportunity smile game off. Almost standard carry our. Interest this lose among.
Writer myself network car. According cover fast similar another summer.
Large expert activity team night.",WO-34707,2024-07-18T11:53:29.079859,2024-07-20T11:53:29.079859,UNASSIGNED,Item word performance old once. Interview skin capital arrive study free her.,Taylorfort,GPS,38.8127455,-163.468332,47951.95,"1 day, 0:00:00",HIGH,8ca14d7f-e807-4139-9c72-b4303567fda8,1ae8c37c-38a8-4360-94a0-0adfc4c9305b,50.85,days,True,ONE_TIME,,,2024-07-16T11:33:20.233372,2026-04-16T05:41:23.121197,c934fe99-eb05-4956-9150-e2f37d5bfe4a,486fac9b-dfef-4e71-83c9-412c238db71a
4d018de3-5acf-40e7-bb1d-b394c2706d32,b29a8b42-259b-4fa9-9c07-ac0390374664,db8ac4f6-6623-4a62-a8fc-db0ac50bad37,,,Share community remain drug bit course would soon. Then particularly soldier case artist picture resource. Culture black though federal help.,WO-61724,2024-07-23T16:16:19.265461,2024-07-28T16:16:19.265461,UNASSIGNED,Each edge late PM style difficult.,Lake Alexis,GPS,-35.154654,-67.926929,16188.5,"1 day, 0:00:00",HIGH,dc1c92f3-8baa-43c8-8f0b-fd87f46bbeb5,50332e38-e437-4b90-b168-2b3d2557eede,30.01,gallons,False,,,,2024-07-21T04:51:16.723928,2026-04-16T05:41:23.121525,4e503829-1505-49d7-a79c-735f8a69029f,e314ff66-3d32-4c36-bc6d-7254cfe054e7
d5b98aad-fd3b-4ec9-86cb-22114a39e348,3717f5e0-8ae1-4f1b-a417-590176d14f60,028545bf-3cab-4c72-9cdb-f40b5b7308fe,2024-10-15T05:45:07.169042,,"Cold anything loss page surface baby. Cause firm politics role color.
End since forward something bank score. Improve color election difficult music.",WO-17132,2024-10-16T00:01:50.603664,2024-10-18T00:01:50.603664,ASSIGNED,Rock now really network perhaps. As success cut physical.,East Shannon,GPS,-4.7163135,-175.973538,18413.12,"2 days, 0:00:00",HIGH,4122088a-61b2-46a7-985e-2b410d7e692f,50332e38-e437-4b90-b168-2b3d2557eede,51.06,loads,False,,,,2024-10-12T08:12:10.030751,2026-04-16T05:41:23.122247,ef6fa4c3-124d-4de2-b031-51b21c1a6bb5,e44fd82c-78d8-4eaa-9f85-d1d2edc3f0c8
39eac045-30ec-46dc-bc22-327737f3f3a3,b4531ca4-b042-4cf2-9ef5-7c1e35fd541f,db8ac4f6-6623-4a62-a8fc-db0ac50bad37,2026-01-06T04:12:06.620166,2026-01-09T06:23:31.344500,Almost recently similar provide suddenly total person. Me song sign threat fight what author. Model will fear as exactly both.,WO-18432,2026-01-07T00:26:25.585288,2026-01-12T00:26:25.585288,COMPLETED,"Likely this maybe. Support soldier could society task.
Area protect let face.",Scottfort,WELL,84.153925,-164.993419,33868.2,"3 days, 0:00:00",LOW,723974b1-d7d7-4013-b45d-5fedabfb5fa1,f63e6700-3590-44d4-93ee-620634a189eb,60.95,loads,True,MONTHLY,,,2026-01-05T06:23:05.328057,2026-04-16T05:41:23.122770,1332f3ca-d7ef-4945-bb69-0c476427cfeb,a6a75455-1de4-4220-aec6-576ab25b8913
5138c0ab-39e0-41b9-b416-68a6b36bcca7,3717f5e0-8ae1-4f1b-a417-590176d14f60,873ed2c3-5db9-4e66-8fd5-eda1ae4e0cbc,2026-01-01T22:01:46.017481,,"That sport matter structure forward. None middle your itself ground chair might.
Allow exist necessary into read. Agency stuff apply process appear. Deep girl position like material page.",WO-86908,2026-01-03T03:37:07.698740,2026-01-08T03:37:07.698740,IN_PROGRESS,Let she send would with. Fine future peace cause health candidate.,Mitchellburgh,GPS,88.871232,-156.412817,43882.08,"1 day, 0:00:00",LOW,53c27215-e85c-4fa2-8375-cf8f03b98b0c,1ae8c37c-38a8-4360-94a0-0adfc4c9305b,12.96,loads,True,DAILY,,,2025-12-30T19:37:29.939207,2026-04-16T05:41:23.123327,9408635a-7acb-4e5b-b3ae-f02bdcb9db78,e04326a1-a55f-4baa-93ca-72561f17ba98
c2e9ddad-72eb-4fd0-8ac8-b3bc02c67d73,976efc1b-14ab-4f55-b545-737e09b5c32a,3226e426-ef49-45fa-b72e-550bd5da5fe9,,,Service lot door often product various company. Science ready result look science leg small modern.,WO-97991,2026-04-12T13:11:10.712689,2026-04-16T13:11:10.712689,UNASSIGNED,Media nature letter. Fund room off last. Culture wish team authority life.,Elliottborough,WELL,51.3989975,104.715382,7052.7,"3 days, 0:00:00",MEDIUM,8ca14d7f-e807-4139-9c72-b4303567fda8,1ae8c37c-38a8-4360-94a0-0adfc4c9305b,90.52,loads,True,ONE_TIME,,,2026-04-12T09:38:07.474135,2026-04-16T05:41:23.123849,46b6c1b0-88a4-426c-829f-9c17a8c4ac0b,a4ffc46f-8a85-4e60-8a83-0e5a7707b9ec
a5426e06-c18f-4c0e-a374-c64c5f20ba8d,88bdb298-8da5-47e4-a4ec-178d9ae25cdb,92feeac5-761f-4487-a05b-d4d30859f098,2026-03-30T01:50:07.843644,2026-04-02T17:49:04.023422,"Claim hospital national bed in goal go. Be machine quite degree form.
Beat parent a student year policy science. Order will represent reason.",WO-59872,2026-03-31T01:11:25.129627,2026-04-03T01:11:25.129627,COMPLETED,Score eye west apply resource important tell. House major call order.,Allenmouth,ADDRESS,-63.0093905,-171.484349,4150.75,"2 days, 0:00:00",MEDIUM,cd343f2e-67d5-4aec-b72b-ecd15989ee86,521017d3-3b25-4d49-90c9-b7eca5ccd641,91.16,visits,True,ONE_TIME,,,2026-03-29T07:44:35.873659,2026-04-16T05:41:23.124300,54960881-a78d-450d-8e45-dc93d93122ca,aa38f6a6-447c-4b6c-86b6-c4a3b1151130
1f018e44-8043-4f90-88e3-d2c1c92e751c,b4531ca4-b042-4cf2-9ef5-7c1e35fd541f,cf5fd7cb-7cc4-4129-a6df-f8e0dfcd7fb7,2025-07-26T06:31:19.103652,,"Course state school wear site player. Mother cell marriage. Hear director why and seat this lawyer.
Message blood production factor. Stand step enter discover note region likely.",WO-37012,2025-07-27T07:04:09.541306,2025-08-01T07:04:09.541306,IN_PROGRESS,Yourself under study study answer different drop. Determine ball operation last parent.,Moralesmouth,ADDRESS,47.244072,111.196842,44832.16,"3 days, 0:00:00",HIGH,843abead-5e3a-4138-a197-73221c71b385,f63e6700-3590-44d4-93ee-620634a189eb,37.62,visits,True,DAILY,,,2025-07-24T05:01:15.129797,2026-04-16T05:41:23.124717,100f47f3-d631-43f3-9b1a-fa0e25541bea,b59a7adb-6d43-4f27-b127-4c0f36879a07
6d43290b-0b47-4dde-aed8-c12b342b280a,3717f5e0-8ae1-4f1b-a417-590176d14f60,9fbeb236-818f-49c9-99bf-92fd28079bf6,2025-09-14T12:26:56.603362,,"Low center data maintain improve nor. Customer course response score single. Strong green find study character.
Others election stock practice increase behind none total. Agree science single they.",WO-32525,2025-09-14T14:13:44.426241,2025-09-15T14:13:44.426241,HALTED,Knowledge indicate trip. Hotel ability card free add win.,Dawsonton,WELL,-47.2042195,-56.276846,24918.03,"1 day, 0:00:00",HIGH,0ebfc049-8b48-4058-8d0f-1bd6dc45cdfb,1d15cc9c-bbe5-46c9-81bb-d76c6d53997b,52.25,days,False,,,,2025-09-14T06:03:56.597711,2026-04-16T05:41:23.125274,1bd0259e-c178-49df-a9f2-4f7d380c6b7c,6d5f7d9a-17dd-4176-8885-1392be3a98b4
eeb3720c-43b6-45b8-8ee5-87afdc9c86a7,b4531ca4-b042-4cf2-9ef5-7c1e35fd541f,cf5fd7cb-7cc4-4129-a6df-f8e0dfcd7fb7,2025-11-21T13:33:56.307052,,"Ability area affect professor value dark. Report test believe fund. Industry city us song task scientist first.
Oil industry another case.",WO-96764,2025-11-22T14:29:53.026946,2025-11-24T14:29:53.026946,IN_PROGRESS,Out scene feel man manage. Character student step law shoulder character budget provide.,Lake Patrick,WELL,16.322123,-123.471061,26197.18,"3 days, 0:00:00",HIGH,843abead-5e3a-4138-a197-73221c71b385,2d9f1a62-d4a7-4c88-8ff3-3d3942708b81,32.12,loads,True,MONTHLY,,,2025-11-20T12:04:19.022089,2026-04-16T05:41:23.125725,00e5d47f-d43e-4df2-8fb0-82466343d32b,6bfed627-c348-448b-a52c-eb9f83a69736
c2e322c0-d14c-402c-938b-76583fc29389,3717f5e0-8ae1-4f1b-a417-590176d14f60,873ed2c3-5db9-4e66-8fd5-eda1ae4e0cbc,2024-07-29T12:05:16.133515,2024-07-30T06:45:19.063156,Check statement bed read mission choice seven perhaps. Return from mention enough father. But camera face evidence mother.,WO-24528,2024-07-29T17:36:49.075816,2024-07-31T17:36:49.075816,COMPLETED,Step detail executive soon remain degree before. Pay effect almost the. Manager challenge tough to.,East Jeffton,GPS,-69.6082055,53.882945,49445.88,"1 day, 0:00:00",LOW,53c27215-e85c-4fa2-8375-cf8f03b98b0c,521017d3-3b25-4d49-90c9-b7eca5ccd641,66.98,gallons,False,,,,2024-07-27T09:43:17.109359,2026-04-16T05:41:23.126143,47cba1e1-c576-41a5-9f8f-b07db3c8c3fa,a4a3daa0-58ad-4cf4-bc13-b4c8e997e73a
7182791c-ef79-43a8-8db1-6052ed64ff42,4678cf0f-ec53-469f-8fdc-1952c6c95524,84ad090c-2539-4105-ba14-dfe5f61fd3c4,2026-04-16T03:42:32.383150,2026-04-16T05:22:09.633093,"Whole senior worry strategy.
Color join town onto western. Performance message until minute heart real in. By instead agreement operation.",WO-57958,2026-04-16T05:16:34.152907,2026-04-21T05:16:34.152907,COMPLETED,"You number girl strategy.
Thus have project apply firm reduce threat quickly. Child since head.",West Jose,ADDRESS,84.084654,37.450643,24674.11,"1 day, 0:00:00",MEDIUM,fa6fe0fa-e5c9-400c-ba0e-3ee78f3d0251,1ae8c37c-38a8-4360-94a0-0adfc4c9305b,21.11,days,True,ONE_TIME,,,2026-04-16T02:49:57.041580,2026-04-16T05:41:23.126953,9157ee56-4325-4882-ae8c-dbe2735025b3,7f335e43-f635-42b9-8b37-f09d48210459
54f35c67-e361-4c0c-a3c8-426b66ab5973,3717f5e0-8ae1-4f1b-a417-590176d14f60,9fbeb236-818f-49c9-99bf-92fd28079bf6,2024-07-16T01:11:30.180563,,"The practice evening left morning painting. Sit near north analysis enter medical.
Case set at blood stock fear top. Window bit no.",WO-98908,2024-07-16T15:47:01.204422,2024-07-17T15:47:01.204422,ASSIGNED,Take class market letter allow head. Trip type try. Training away put writer.,Matthewchester,GPS,-53.484527,-65.155613,24916.15,"1 day, 0:00:00",LOW,0ebfc049-8b48-4058-8d0f-1bd6dc45cdfb,1ae8c37c-38a8-4360-94a0-0adfc4c9305b,99.31,hours,False,,,,2024-07-13T02:15:14.759304,2026-04-16T05:41:23.127467,022c6902-386a-4ef3-80c2-2b8169d540f5,b9fcb02e-7bfe-4d09-8e38-d3923b51c8a7
2bc870c1-0f3b-4f28-acc4-5accd6911cbe,b4531ca4-b042-4cf2-9ef5-7c1e35fd541f,56f6f056-e13b-44a9-9b75-c474164d6faa,2024-08-16T10:32:18.296053,,"Billion mind his. Response return avoid away address.
With show matter cause subject western occur grow. Race its see common because central.",WO-51737,2024-08-17T13:54:24.200135,2024-08-20T13:54:24.200135,REJECTED,Exist push you chair nation. Four game education herself.,West Vickiehaven,GPS,-89.6818555,89.365894,44667.49,"1 day, 0:00:00",MEDIUM,65060607-d4c1-43b9-b74e-d4a08676f8ae,521017d3-3b25-4d49-90c9-b7eca5ccd641,10.94,days,True,WEEKLY,,,2024-08-16T05:32:05.917311,2026-04-16T05:41:23.127915,6d79566f-7a51-4b47-8a76-2c2cae53c10e,a29e9853-03e1-418d-a2c1-fc28bb10c450
0eac0f0d-60eb-43c7-b18c-bc7ff014e937,4678cf0f-ec53-469f-8fdc-1952c6c95524,84ad090c-2539-4105-ba14-dfe5f61fd3c4,,,Make pick physical low myself. Energy my course property. Challenge born yes teach officer up different grow. Image bank data statement when.,WO-28982,2025-10-08T19:56:31.017403,2025-10-10T19:56:31.017403,UNASSIGNED,Economy experience enter particularly meet staff lot. By best cause of attack letter season.,East Suzanne,WELL,76.0368375,-172.185009,43669.68,"1 day, 0:00:00",HIGH,fa6fe0fa-e5c9-400c-ba0e-3ee78f3d0251,50332e38-e437-4b90-b168-2b3d2557eede,20.37,visits,False,,,,2025-10-05T21:15:51.842848,2026-04-16T05:41:23.128303,43362c8f-5fe7-4be6-91e1-a66d9eb9c16c,69c6686e-13fc-41b4-950a-f5f44309af6c
ae9794fc-543f-4864-80b6-fa9b4f08ff05,976efc1b-14ab-4f55-b545-737e09b5c32a,87a43abf-a0aa-4b19-bcdd-ea7b1e66a945,2025-05-27T12:24:32.520948,2025-05-29T18:04:16.923266,"Hand yes series environmental step report usually.
Manage exactly back manager sound. Piece ready require future how student ball film.",WO-67413,2025-05-28T06:41:39.741919,2025-05-29T06:41:39.741919,COMPLETED,"Shoulder a energy education every.
Modern thank society draw able. Type but process.",Port John,ADDRESS,6.335748,146.208955,21998.78,"2 days, 0:00:00",HIGH,b77b9d82-de70-47d0-9be8-8c3d444ca202,1ae8c37c-38a8-4360-94a0-0adfc4c9305b,61.51,gallons,True,ONE_TIME,,,2025-05-26T14:28:36.088360,2026-04-16T05:41:23.128723,94a593a2-efb3-44b9-9330-d5e04e54714f,18eab616-1d57-4621-a6f8-c5845d4f4066
ecbd7562-67fd-4068-9beb-6d960087d56e,86ea9e9c-f1d8-423c-bb34-2f1df47812aa,92feeac5-761f-4487-a05b-d4d30859f098,2024-12-06T11:40:01.972538,2024-12-09T00:54:05.485394,Lawyer account manage next contain produce. Which film herself citizen.,WO-88588,2024-12-07T09:26:58.307161,2024-12-10T09:26:58.307161,COMPLETED,Budget news hour lawyer so though born. Specific program travel relate financial economic.,North Jenniferton,GPS,-37.676562,103.325994,42114.25,"2 days, 0:00:00",HIGH,cd343f2e-67d5-4aec-b72b-ecd15989ee86,521017d3-3b25-4d49-90c9-b7eca5ccd641,49.02,visits,True,WEEKLY,,,2024-12-06T03:05:52.919164,2026-04-16T05:41:23.129188,bb94971b-a0d7-4ae3-a694-efa5473ff050,7fc8a8b5-01ad-486d-a44e-f98570051b01
84e3a0a2-bd34-450a-ba9b-e139f403a7a5,b29a8b42-259b-4fa9-9c07-ac0390374664,c5d2e606-6a9f-49bc-b434-8cfe4e54eec0,,,"Hold sign her. President son fund never else speak.
Short street fill age I throughout drug. Candidate myself tell above.
Debate live manage phone. Good around guy eight really.",WO-32972,2026-04-07T19:12:48.793366,2026-04-10T19:12:48.793366,UNASSIGNED,Month example soon hot foot appear. Crime commercial half show.,North Coreyview,GPS,84.706177,29.463803,16607.15,"3 days, 0:00:00",MEDIUM,bb84848b-0ead-4180-b882-6cab8742960f,50332e38-e437-4b90-b168-2b3d2557eede,12.47,visits,False,,,,2026-04-06T02:59:04.818610,2026-04-16T05:41:23.129802,3202e7fb-5311-4fb1-8cc6-69194698d0a8,6de27a7b-162e-4161-ac20-21cfc6bbbafd
6f162078-7231-405f-8e30-6616be2650b0,4678cf0f-ec53-469f-8fdc-1952c6c95524,cf5fd7cb-7cc4-4129-a6df-f8e0dfcd7fb7,2024-05-15T21:38:48.038633,,West born size collection. Toward good star from. Common economic see condition issue draw.,WO-27818,2024-05-17T20:27:53.906308,2024-05-21T20:27:53.906308,IN_PROGRESS,Foot fine movie they. Year wife matter conference need west.,Danielland,GPS,84.889329,9.104809,34517.49,"1 day, 0:00:00",MEDIUM,6e40f587-69c2-48cf-b319-1c55a7bab11a,b197cee2-a173-4026-9d78-0664ecf14e76,27.52,gallons,False,,,,2024-05-15T11:26:03.596995,2026-04-16T05:41:23.130195,267163e7-c810-49f6-ba0c-d9d1cf65948b,33950288-1b48-4fb4-9ae6-6b501f22cb78
d569cc8f-584d-4b40-8b68-9b1d65033cae,b4531ca4-b042-4cf2-9ef5-7c1e35fd541f,1de1a4ae-f248-4934-bbf9-6d89826f25dd,2024-11-05T03:11:00.966316,,Help movement agree reduce couple finish draw nor. Rate power ten rest include.,WO-91472,2024-11-06T15:34:50.299937,2024-11-10T15:34:50.299937,REJECTED,Nice amount bad.,Johnfurt,GPS,1.132941,-147.727058,21547.36,"2 days, 0:00:00",LOW,59da93cc-6776-48e0-814b-cc27d537560b,2d9f1a62-d4a7-4c88-8ff3-3d3942708b81,27.56,gallons,False,,,,2024-11-02T09:32:08.718288,2026-04-16T05:41:23.130570,2b84be0d-a021-4adb-aba2-bd2d19b4ae0f,0c62bffd-de22-4aae-bbaf-97faab29b74c
0e020d19-b4f7-44cb-a8c3-970183ca5e52,b29a8b42-259b-4fa9-9c07-ac0390374664,56f6f056-e13b-44a9-9b75-c474164d6faa,2024-07-23T11:26:46.468394,,"Rise friend size value even. Together official city bar and.
Loss artist laugh offer total. Also world production mind hair learn nature. Suddenly successful feel program mind argue.",WO-05321,2024-07-23T15:21:50.781036,2024-07-28T15:21:50.781036,IN_PROGRESS,Organization action without allow community by keep. Customer sort reality foot million lot.,Lake David,WELL,16.726199,17.636761,6896.16,"3 days, 0:00:00",LOW,d2b3cab9-1bac-40d1-aa05-0532f66216a6,50332e38-e437-4b90-b168-2b3d2557eede,95.08,hours,True,WEEKLY,,,2024-07-22T04:54:58.281837,2026-04-16T05:41:23.130991,d63951db-ce7b-49c4-9b84-7878ffef8777,b4cb802d-3dc3-420c-96aa-2890f629d6c1
976231f2-3a78-4bc2-a8e5-7688bc28b295,88bdb298-8da5-47e4-a4ec-178d9ae25cdb,56f6f056-e13b-44a9-9b75-c474164d6faa,2025-03-18T00:34:42.472818,,"Decade fast support manager lay middle charge. Oil own that finally her computer. Local success pull both.
East sea next news. Certainly thought shoulder here seat teacher return.",WO-00174,2025-03-18T14:46:26.696231,2025-03-19T14:46:26.696231,ASSIGNED,Mrs most car true perform. A meeting certainly baby walk. Agreement goal reason arrive nearly.,Cochranstad,ADDRESS,80.078877,-3.815071,27005.9,"1 day, 0:00:00",HIGH,65060607-d4c1-43b9-b74e-d4a08676f8ae,521017d3-3b25-4d49-90c9-b7eca5ccd641,40.16,gallons,True,WEEKLY,,,2025-03-15T02:36:22.282511,2026-04-16T05:41:23.131444,b8c4f676-fbcc-4e32-a894-2064d18e3cda,1bd0259e-c178-49df-a9f2-4f7d380c6b7c
2a75697e-70a4-46d6-bb94-1ade0e98c4cb,b29a8b42-259b-4fa9-9c07-ac0390374664,1de1a4ae-f248-4934-bbf9-6d89826f25dd,2025-06-23T21:40:00.022976,2025-06-26T11:33:57.464499,Follow single sing study raise stage. Research fire oil far enter its fear.,WO-88024,2025-06-25T07:05:19.201460,2025-06-26T07:05:19.201460,COMPLETED,Entire ever scientist team call environmental use. Soldier mention they.,Kimberlymouth,WELL,29.1930905,-74.485301,25324.22,"2 days, 0:00:00",LOW,cf935e7d-233b-4144-be90-2d7cd23ac94b,50332e38-e437-4b90-b168-2b3d2557eede,16.54,loads,True,ONE_TIME,,,2025-06-21T19:48:07.280114,2026-04-16T05:41:23.131866,e6de95be-1f4d-4787-bd3d-92028ade4280,b8c4f676-fbcc-4e32-a894-2064d18e3cda
6e2b7693-e829-43e4-9cfe-fa5c6f74d489,86ea9e9c-f1d8-423c-bb34-2f1df47812aa,5b5c3c37-70f2-465f-8c5b-3d4e90f804e4,2024-04-28T20:06:28.940982,,Public technology music hit. Fill represent nature support light class conference politics. Indeed car true matter class evidence paper.,WO-99695,2024-04-29T14:02:33.399447,2024-05-03T14:02:33.399447,ASSIGNED,Accept week lot production leader minute begin. Firm remain report challenge least recognize gun.,Lake Christopherberg,ADDRESS,47.3398355,-130.557842,6994.06,"3 days, 0:00:00",MEDIUM,ef371920-aa96-4f77-8685-4c601799b250,521017d3-3b25-4d49-90c9-b7eca5ccd641,86.34,hours,False,,,,2024-04-28T03:21:29.927083,2026-04-16T05:41:23.132272,809bb6f0-8fcb-4e50-9428-caf7ee593a81,a778ea69-223e-419b-b550-6bdcaf591d81
9be56905-fab7-495e-8b46-11a2d3c80507,b29a8b42-259b-4fa9-9c07-ac0390374664,db8ac4f6-6623-4a62-a8fc-db0ac50bad37,2026-04-16T01:09:06.977096,,"Summer pull political American politics. Indeed future case.
Family all talk worker none. Throw late sit computer.",WO-87048,2026-04-16T04:43:44.210136,2026-04-21T04:43:44.210136,IN_PROGRESS,Cold kind else study person season. Image bring son sign. Condition under involve.,Lake Tony,WELL,39.997821,-24.329488,10117.06,"3 days, 0:00:00",MEDIUM,dc1c92f3-8baa-43c8-8f0b-fd87f46bbeb5,50332e38-e437-4b90-b168-2b3d2557eede,78.69,visits,True,MONTHLY,,,2026-04-16T00:35:26.689048,2026-04-16T05:41:23.132728,50cdf2c2-2401-4a07-a0af-7ac066c29fd0,0f6b3f9f-a584-4f59-b62b-dd2fb0dd3af0
80a0fb67-1f79-4bd8-966a-265b762e2b4c,0662f3bb-2c28-4b44-acfe-56565d827f1f,3ae3720e-3bf7-499f-91ed-7e129d4ccdce,2025-01-28T18:45:56.270675,,"Certainly though movement help source. Where art already cultural without word. Environmental what author city a.
Bed list spend fill herself become different cup.",WO-70253,2025-01-29T12:46:24.611720,2025-02-01T12:46:24.611720,ASSIGNED,Quickly start right wind marriage. Or summer admit owner Congress whole want. No hour hair.,North Nicolemouth,ADDRESS,-52.7990255,-60.878649,19140.75,"2 days, 0:00:00",LOW,6bc3b38c-4935-4336-b333-d0a648931402,521017d3-3b25-4d49-90c9-b7eca5ccd641,23.0,visits,False,,,,2025-01-27T07:28:19.353345,2026-04-16T05:41:23.133130,00b73270-c656-4975-841e-5aaaef0e5413,4d4f0f45-62a0-4a4c-8eeb-4b9f71291b06
d4ad9892-9059-434e-8b8d-54ffecb0f563,0c7b6485-a187-4495-9459-142ad8d38f4d,028545bf-3cab-4c72-9cdb-f40b5b7308fe,2025-09-04T08:49:22.040349,2025-09-07T23:36:45.277940,"Consumer goal party bar there. Require move natural tree rate.
Boy environment health serve voice. Really relationship around will term long month.",WO-83038,2025-09-05T08:24:00.900069,2025-09-09T08:24:00.900069,COMPLETED,Same foot hear central. Capital western month arm. If economic true all occur add.,Brianborough,WELL,49.0184085,158.475383,36514.09,"2 days, 0:00:00",HIGH,7e84dc11-4931-4089-8edf-2773d2752886,2cc137b9-70a3-4c73-8a9f-7918ef898f2e,71.74,visits,False,,,,2025-09-04T01:01:30.769328,2026-04-16T05:41:23.133537,dcb7d3c7-1c97-4fda-b4be-22a5dafb907d,276f86e7-8216-4558-a316-158255dd3899
ec3e41fc-d902-4f34-82d8-1b852b4427cd,0662f3bb-2c28-4b44-acfe-56565d827f1f,3ae3720e-3bf7-499f-91ed-7e129d4ccdce,2024-09-25T13:00:52.347196,2024-09-29T09:04:35.242522,"Expert perhaps guess moment kid leave mission. Late improve exist discuss reflect finish major heart.
Age law difference like college exist film.",WO-38278,2024-09-26T09:51:30.699438,2024-10-01T09:51:30.699438,CLOSED,Indeed hold major light fear. Each however with national somebody minute statement.,South Ronaldtown,WELL,-68.32969,81.453273,16955.56,"3 days, 0:00:00",LOW,6bc3b38c-4935-4336-b333-d0a648931402,f63e6700-3590-44d4-93ee-620634a189eb,10.44,gallons,False,,,,2024-09-24T16:26:33.642137,2026-04-16T05:41:23.134037,1109e90d-f954-4308-84df-9404b839fe88,29df83d5-1cef-4d3b-868c-5f80049b6cc3
6dd735bb-7f89-45dc-bd57-204897f1ecbd,b4531ca4-b042-4cf2-9ef5-7c1e35fd541f,db8ac4f6-6623-4a62-a8fc-db0ac50bad37,2026-03-27T00:12:55.312218,,"Report agency continue nice.
Tv claim article international student. Region beautiful interview shake look suffer. Share car improve others be.",WO-22217,2026-03-28T20:19:00.342952,2026-04-01T20:19:00.342952,IN_PROGRESS,Whether answer way leave need environment. Poor option ask simply environment news mission.,North Jillianshire,ADDRESS,6.0900205,-110.630543,38486.72,"2 days, 0:00:00",MEDIUM,6cc018a5-b3ee-435e-b83c-a1d590df5697,521017d3-3b25-4d49-90c9-b7eca5ccd641,31.83,loads,True,ONE_TIME,,,2026-03-25T05:58:38.396472,2026-04-16T05:41:23.134419,22bb684a-6f1e-4069-a881-5f9153266b1b,b77a8912-ce3d-40b3-ab27-69e6aac69773
4a124b63-8c71-437c-a778-b359d329b9f2,b29a8b42-259b-4fa9-9c07-ac0390374664,56f6f056-e13b-44a9-9b75-c474164d6faa,2025-01-28T01:26:00.943984,,"Stage ten side people room total.
Seat great institution public think surface employee. Provide machine turn they none free finish.",WO-22253,2025-01-28T10:26:11.368533,2025-01-30T10:26:11.368533,HALTED,Under boy prove buy knowledge east. Tough appear start your rock. Window member network.,North Johnside,ADDRESS,-77.2533715,111.141914,27506.64,"2 days, 0:00:00",HIGH,d2b3cab9-1bac-40d1-aa05-0532f66216a6,50332e38-e437-4b90-b168-2b3d2557eede,24.34,visits,False,,,,2025-01-26T20:51:34.277134,2026-04-16T05:41:23.134825,b59a7adb-6d43-4f27-b127-4c0f36879a07,94a593a2-efb3-44b9-9330-d5e04e54714f
