work_order_id,assigned_vendor,client_id,assigned_at,completed_at,description,estimated_start_date,estimated_end_date,current_status,comments,location,location_type,latitude,longitude,estimated_cost,estimated_duration,priority,well_id,service_type,estimated_quantity,units,is_recurring,recurrence_type,cancelled_at,cancellation_reason,created_at,updated_at,created_by,updated_by
d5e8e17e-4012-402c-837a-4c963fbc53da,5ced5175-6a4b-4acc-aaad-6eee39aba902,544d6c6a-b83d-4633-b842-e6fab7e2bc69,,,"Wall myself describe reach now. Avoid medical effort. Article at only gun force billion.
Fast realize them experience Mr. Five place kind town both blood another.",2024-06-24T07:37:19.936501,2024-06-29T07:37:19.936501,UNASSIGNED,Drug fine future shoulder. Book little return certain item.,New Trevor,WELL,-31.570913,-143.63364,4877.23,"1 day, 0:00:00",HIGH,105e7faa-4a05-4f7c-b0b7-735825f463dc,4c95d91b-4137-4b45-b42a-a196743fc247,90.78,gallons,False,,,,2024-06-21T13:54:14.010197,2026-04-14T22:27:58.600394,297775d8-0378-4ecf-a8fb-d17c7833ceb5,6ae59b23-3d95-4081-bae3-7f39c2993065
33812947-b745-47a8-ba17-d86341da3142,be8a628e-281b-4291-9256-99fe58793399,dedd0eb6-b2fc-496d-994f-79ecc414767e,2024-06-21T15:22:09.854759,,"Anyone factor defense program behavior safe. Behind national wife consumer.
Onto else financial stock. Population floor western. Decide behavior fly reflect pressure.",2024-06-22T16:05:40.350391,2024-06-23T16:05:40.350391,HALTED,"Rich ahead nature newspaper product report.
Reach bar physical leave during she degree.",North Abigailville,GPS,-2.456508,-131.891725,33668.92,"2 days, 0:00:00",HIGH,80a4fcca-af6c-40f6-b3a1-d30b1c812c5d,ac86be1d-d7b3-4c92-8b98-7ec02635ae30,46.56,hours,True,MONTHLY,,,2024-06-20T15:47:33.696664,2026-04-14T22:27:58.600578,736e9f6c-eac5-4a66-bcef-c838b81e9443,34b96a8e-abbc-4ab5-b644-6763dde5d384
b62cea7c-5cfc-4585-aada-02df64943119,fdef058c-0c5f-4035-9f98-d9f60356538d,dedd0eb6-b2fc-496d-994f-79ecc414767e,2024-09-29T04:55:24.627038,,"Along industry your company population. Water clearly sort raise so shake hold myself.
Keep level image expert capital level. First laugh nor ahead plant film hear.",2024-09-29T05:10:35.400113,2024-10-02T05:10:35.400113,ASSIGNED,Dog blood which rate travel we cause tend. Send he billion necessary.,Lake Josephton,ADDRESS,-83.453944,114.468149,34684.35,"1 day, 0:00:00",LOW,6b554c6a-effa-4831-a104-edeb00f241cd,ac86be1d-d7b3-4c92-8b98-7ec02635ae30,74.31,days,False,,,,2024-09-26T14:14:39.174015,2026-04-14T22:27:58.600738,90a60660-ac0b-4bfa-811d-504717814e6d,7fc74b0d-90f4-435c-82fc-21e6f6818821
c82643bf-d6b2-4e15-9349-352fcf7ef3ab,45d86630-0ae0-48cf-91da-da4e2553be12,dcf8d00a-1526-417c-8284-f84cf5b1252f,2025-09-23T23:27:17.979398,,Action movie choose because school energy. Unit edge property. Common father usually enough paper national.,2025-09-24T16:16:00.605417,2025-09-29T16:16:00.605417,IN_PROGRESS,Bed boy total employee mention practice. Himself inside site morning. Tree agency into including.,Irwinchester,ADDRESS,54.193149,-129.712231,7251.94,"3 days, 0:00:00",HIGH,34f1d44e-43a0-414c-a8ab-236c936e3bc9,4c95d91b-4137-4b45-b42a-a196743fc247,85.37,loads,False,,,,2025-09-23T01:45:42.295813,2026-04-14T22:27:58.600948,1333cdce-f905-4184-b219-285c50e0313c,410a38ee-8f71-4219-9217-09a004341d40
297e5f6a-c43f-4cfe-b8f9-673147aed63b,6c08930e-b79b-414d-83b8-3fa71b4f7c3f,75c7e517-dddd-43b4-b8d5-e7eb922003e3,2024-09-24T02:16:13.592949,2024-09-28T09:40:29.247796,"Positive name respond allow.
Old study four right amount property yourself eat. Again firm news tax city model tend contain. Type help call apply marriage structure wind.",2024-09-25T19:45:55.202413,2024-09-26T19:45:55.202413,COMPLETED,Story produce hold open. Just take drug prevent he successful man left.,Hickschester,WELL,36.331195,-101.164451,30387.64,"1 day, 0:00:00",HIGH,fa8bbe27-37fe-473e-9cec-29348e69bbfb,b67890c1-ebe9-46e1-ae62-8f124981c06c,10.59,gallons,True,DAILY,,,2024-09-22T09:41:15.004986,2026-04-14T22:27:58.601143,3d2acc08-af8d-42cd-9c9e-48e2c8b76a04,cdc794dd-e9d8-4245-84b8-c1693d099ef5
b284b301-1149-47ea-9dc4-f42f261a8cdd,90914c41-8379-4db0-8e87-d7a9abf1cd74,dcf8d00a-1526-417c-8284-f84cf5b1252f,2025-05-02T14:14:53.987222,,May stand media amount collection much memory. Class sound modern thousand reality really business paper. Up person line little color. Herself stuff southern year case magazine social.,2025-05-03T05:00:08.988675,2025-05-04T05:00:08.988675,CANCELLED,Discussion everybody human follow into nation. Own specific factor all pick network painting.,Welchchester,GPS,-78.3757015,28.556462,24444.12,"1 day, 0:00:00",LOW,b3798b84-0dd8-423e-b649-40a131592de7,b67890c1-ebe9-46e1-ae62-8f124981c06c,84.33,days,False,,2025-05-04T05:30:26.373971,Client cancelled request,2025-04-30T03:14:59.219253,2026-04-14T22:27:58.601431,40847b9e-7b78-4c68-afe2-aeb99f10a579,ddd348f3-7098-4f97-b89a-bf1ed98ed705
3fe68edd-3d90-41a1-b1c4-0f4f9802df2a,69f88d89-cd4d-4b68-9ea5-d47749a320b4,356ce91e-3d69-4c12-b975-4b312ca62840,2025-05-05T21:28:36.912746,,"Event view human after war there. Too a almost article also. Whatever artist president.
Ready continue well. Past account himself movie. Third seek parent old someone clear change.",2025-05-07T08:22:43.571573,2025-05-09T08:22:43.571573,CANCELLED,Person student situation ago star. Weight the gas democratic half.,Erinhaven,WELL,78.13324,-35.469517,8953.39,"3 days, 0:00:00",HIGH,14a13488-5719-43f4-aad4-f06901c597f5,4c95d91b-4137-4b45-b42a-a196743fc247,55.12,visits,True,DAILY,2025-05-06T20:13:08.892462,Client cancelled request,2025-05-03T02:35:58.935425,2026-04-14T22:27:58.601629,5e7377b6-f788-411e-a5cf-efb30723c427,5ac72478-bdf4-441d-90b2-149b2bd8ccb0
561f3f36-4b26-4667-8f2d-4bd7bd8a9ad3,69f88d89-cd4d-4b68-9ea5-d47749a320b4,fdbcc9da-c12c-4210-9472-0b40b76e6448,2025-03-29T18:34:34.111836,,"Instead rock management focus network. Public PM movement short. Protect wait foreign ahead beat.
Themselves add example administration behind without. Leader one bed PM money.",2025-03-31T01:19:19.748784,2025-04-03T01:19:19.748784,REJECTED,Offer several animal green realize board join.,Patriciashire,GPS,56.2499365,-140.304512,35033.81,"1 day, 0:00:00",MEDIUM,9522783b-21f0-4853-b836-c07e4211ca85,c023f54c-5638-484f-ad7e-cff78fc43d6b,42.27,visits,False,,,,2025-03-29T12:52:09.076263,2026-04-14T22:27:58.601870,c434b202-0f18-4469-8764-11dc8949682d,10af8414-c8ed-4566-a658-d3020b3e8bf4
ae2af4ae-b750-42a1-8952-3e5007dd0d99,be8a628e-281b-4291-9256-99fe58793399,fdbcc9da-c12c-4210-9472-0b40b76e6448,2024-07-02T07:43:49.458692,,"Development mother impact nation ahead any learn. Benefit four fall staff will scientist. Special affect although serve.
Early process tax.",2024-07-04T00:12:28.423487,2024-07-05T00:12:28.423487,CANCELLED,Run contain mean fast identify beyond. Style light base now. Method manager yourself box purpose.,South Tiffanymouth,GPS,-13.688931,-63.558004,2610.27,"2 days, 0:00:00",LOW,9522783b-21f0-4853-b836-c07e4211ca85,b67890c1-ebe9-46e1-ae62-8f124981c06c,47.32,visits,True,MONTHLY,2024-07-03T07:06:30.445558,Safety concern,2024-06-30T09:40:05.249296,2026-04-14T22:27:58.602056,282d8665-b726-4271-8d83-c189211ae9c3,03f64874-d16c-4ac3-a0f8-82edc05b967f
7eec3d38-2dfd-4ad6-8fbb-030885061cac,69f88d89-cd4d-4b68-9ea5-d47749a320b4,fdbcc9da-c12c-4210-9472-0b40b76e6448,2024-12-16T07:53:18.875390,,"Task sister me majority true. Western early within face that. Whole former clear.
Story good nice decision table record girl cultural. Specific health part this present treat nothing.",2024-12-17T01:19:45.765664,2024-12-22T01:19:45.765664,REJECTED,Decade use only measure. Store exactly wide popular foreign upon. Chair inside rather able.,North Gregory,GPS,76.5814555,133.241291,32968.0,"2 days, 0:00:00",HIGH,86b3f7a6-231b-4b4b-ab72-31be724e3a51,3f4dd684-ecaa-4e82-8ad1-5d2ad55c4b71,72.2,loads,True,DAILY,,,2024-12-14T19:10:12.914595,2026-04-14T22:27:58.602240,d4c9ae12-0c6a-4a04-ba13-8be8101c729f,28a66d16-1107-4458-ba0d-4cf24f955a69
33a2f170-126e-4f09-aaef-7b1912f76eee,00321811-ce92-494f-a69e-9f15b650ca5f,75c7e517-dddd-43b4-b8d5-e7eb922003e3,2025-04-13T19:23:34.014184,,"Especially current away big clearly tree.
Establish message other trade house relationship figure. Garden guy finish as environment effort. Everybody cell five across movie score.",2025-04-14T19:46:49.154761,2025-04-15T19:46:49.154761,CANCELLED,Game pressure work set. Age direction check able now positive reduce.,Fosterland,GPS,-67.146146,-152.185878,30489.17,"1 day, 0:00:00",HIGH,46538246-445c-4643-b106-c4bb91b94703,59387f64-573a-4d23-bc4c-94103f3802ff,71.14,days,False,,2025-04-14T16:01:30.858656,Duplicate order,2025-04-13T10:58:28.628005,2026-04-14T22:27:58.602419,0fe14385-26a7-4e03-9609-798835febd64,7bdd0552-c896-4308-99d3-3b6d1239d577
f6e36a7c-76e3-4e66-80dd-b7eb7a755d63,00321811-ce92-494f-a69e-9f15b650ca5f,dcf8d00a-1526-417c-8284-f84cf5b1252f,2025-08-27T02:15:10.022280,,"Clear million war. That rest popular upon gas half.
Nearly summer still government. People blood kitchen ball minute news clearly. News social general prove big.",2025-08-28T18:23:29.556193,2025-09-02T18:23:29.556193,REJECTED,Image old huge nature issue stock past. Box floor try.,South Jeremiahstad,ADDRESS,88.4125385,152.077534,29432.41,"2 days, 0:00:00",LOW,153c28ed-f5be-4a23-8422-0fbe6104a7b9,eddc4c1a-19a5-4a63-9507-8896001501c0,5.45,gallons,False,,,,2025-08-25T07:06:58.411180,2026-04-14T22:27:58.602626,794ff642-4d47-440a-b28d-e40b17c0fdeb,48f98b09-22ed-4803-9a6c-f694849899dd
c14adf80-1254-45d8-87d1-6b7187f0346a,17732c75-269b-4b58-ab32-71c952da0df9,60815a70-5acd-44c4-a751-93e113cd6c10,2025-07-07T15:15:54.960200,2025-07-12T11:25:42.640453,"Him eye throughout bad home concern. Garden where growth lawyer seem cause total.
Study series create choice offer woman investment.",2025-07-08T14:13:39.186352,2025-07-11T14:13:39.186352,CLOSED,Situation growth cause material couple time staff financial. Total fill lot what argue.,Kevinstad,WELL,-85.432595,-58.435108,45039.82,"1 day, 0:00:00",HIGH,0c481a95-02a4-4df0-ace2-91131d50d01a,b67890c1-ebe9-46e1-ae62-8f124981c06c,89.35,visits,True,ONE_TIME,,,2025-07-07T06:25:37.134784,2026-04-14T22:27:58.602803,262a6ae9-1d3c-453e-a3fc-87afa532a0a0,c09b8f51-0c17-4d25-998e-f1bbf35a7b23
eedc6cf4-ff6e-47e4-af68-89053f804491,45d86630-0ae0-48cf-91da-da4e2553be12,dcf8d00a-1526-417c-8284-f84cf5b1252f,2024-08-23T03:12:21.566279,,Worker several statement major campaign quite measure. Growth own fly former. Character lot describe reduce age boy medical.,2024-08-23T10:21:45.528947,2024-08-24T10:21:45.528947,ASSIGNED,Purpose consumer despite.,Ryanfurt,ADDRESS,85.9451065,139.179282,38285.92,"3 days, 0:00:00",HIGH,34f1d44e-43a0-414c-a8ab-236c936e3bc9,b67890c1-ebe9-46e1-ae62-8f124981c06c,84.23,gallons,True,MONTHLY,,,2024-08-22T13:05:53.305031,2026-04-14T22:27:58.602983,ca3e5aa1-e544-4fd2-884c-cac023112bb7,96db0323-91c5-4b06-a531-12ab492afa8d
1feacbc5-5c9e-4188-b260-fff04c95a87f,45d86630-0ae0-48cf-91da-da4e2553be12,ee25c6e3-177b-48c8-b18a-46587520acf9,2024-05-16T20:10:26.597039,,Dream rich movie civil once. Why in available from blue. Way debate anything create pick her edge.,2024-05-18T11:10:28.362304,2024-05-23T11:10:28.362304,IN_PROGRESS,Tonight inside moment social catch push. None run north image his.,Brandonside,ADDRESS,-43.048073,-110.024719,12998.5,"2 days, 0:00:00",HIGH,8dee7a67-491c-48d5-bf66-8a440bc991d4,b67890c1-ebe9-46e1-ae62-8f124981c06c,29.32,gallons,True,DAILY,,,2024-05-15T15:54:16.032104,2026-04-14T22:27:58.603184,3948b296-e546-4030-bccd-62e2151206dd,948a8945-5d2d-49bf-ac6c-5ad9565bd6cd
8a5df77f-9be9-4ebc-b29b-598c9fa986a8,69f88d89-cd4d-4b68-9ea5-d47749a320b4,3c076e25-6365-4a69-8f84-ec6f90b6d934,,,"Price reach determine believe candidate office agree. Evidence member most everything than without political.
Information chair listen tell as population. Body remember development.",2025-09-01T04:36:12.158914,2025-09-02T04:36:12.158914,UNASSIGNED,When order important camera yet movie information. Improve ever phone others as.,East Emily,WELL,-33.856968,51.080962,44717.91,"2 days, 0:00:00",MEDIUM,a960e09a-cb23-4bf5-8b2d-09fd3c6bfdae,4c95d91b-4137-4b45-b42a-a196743fc247,57.26,hours,True,DAILY,,,2025-09-01T03:24:48.894150,2026-04-14T22:27:58.603370,977ba384-8cbb-4713-a95c-e17c2f01dc73,674ff708-267f-4c30-9c3e-8a24c62f35be
20b4f935-4fee-4601-9def-4e72671d76c8,17732c75-269b-4b58-ab32-71c952da0df9,fdbcc9da-c12c-4210-9472-0b40b76e6448,2025-01-26T14:36:21.755430,2025-02-02T12:52:31.771796,"Issue friend present design group entire measure receive. Fly care somebody image.
Song almost already stay gun reason gas part.",2025-01-27T11:38:21.794191,2025-02-01T11:38:21.794191,COMPLETED,Campaign late event alone policy. There under mention fast plant budget.,Edwardstown,GPS,44.361217,95.392594,18146.02,"3 days, 0:00:00",LOW,f2277196-af58-45ae-93cb-9259f5fc3bd2,59387f64-573a-4d23-bc4c-94103f3802ff,80.36,visits,False,,,,2025-01-25T08:27:40.247731,2026-04-14T22:27:58.603597,9e52bb70-98e8-47ec-aac1-bade06ef9e35,26d7bb4e-a611-4b84-9934-fb91e4846700
c84f3bd1-dda4-48ab-a6e3-dafc32bcb630,00321811-ce92-494f-a69e-9f15b650ca5f,fe0211e2-1730-4140-a5c5-59d09ab75793,2025-07-15T22:59:30.574098,,"Tend happy understand new.
Book too and sell treatment dog fact. Where commercial almost difference.
In place of cause. Themselves particularly country ability usually room the.",2025-07-17T21:32:59.379630,2025-07-22T21:32:59.379630,IN_PROGRESS,Build environment American style. Establish low field month. Against especially talk.,Port Tamara,GPS,26.132787,153.689805,25186.26,"1 day, 0:00:00",HIGH,c8dbad2c-f030-4477-8ea7-6bf5da81794e,eddc4c1a-19a5-4a63-9507-8896001501c0,54.51,hours,True,ONE_TIME,,,2025-07-14T12:36:49.486002,2026-04-14T22:27:58.603793,297775d8-0378-4ecf-a8fb-d17c7833ceb5,0b6f3781-f6ed-44e9-9853-92e5b5199749
f8fbc211-7fa5-4966-90c5-38213cd870d7,be8a628e-281b-4291-9256-99fe58793399,fdbcc9da-c12c-4210-9472-0b40b76e6448,2024-07-21T10:33:46.632571,,Claim same former office country too face. Kitchen appear section his entire. Already upon travel general fall central act smile. What who dinner certainly enough draw.,2024-07-23T01:56:05.957398,2024-07-24T01:56:05.957398,REJECTED,Consider allow product table need others. Design security wind player past four sign.,Ramseybury,WELL,-57.6638245,159.483406,4201.47,"3 days, 0:00:00",LOW,9522783b-21f0-4853-b836-c07e4211ca85,3f4dd684-ecaa-4e82-8ad1-5d2ad55c4b71,85.47,days,False,,,,2024-07-19T18:53:11.172627,2026-04-14T22:27:58.603984,34668f16-f021-4d7c-8706-7af058f3a8fe,5ac72478-bdf4-441d-90b2-149b2bd8ccb0
248fdc48-3b52-42da-af9b-47abb81617bc,5ced5175-6a4b-4acc-aaad-6eee39aba902,ee25c6e3-177b-48c8-b18a-46587520acf9,2025-09-02T23:27:16.253545,,"Full response agency worker commercial case religious there. Show next news industry growth church.
Major represent lot plan side writer.",2025-09-04T09:07:38.288864,2025-09-09T09:07:38.288864,ASSIGNED,Lot now week become production city war. Growth product watch.,Port Christinatown,GPS,-61.4063805,-23.283447,32834.98,"1 day, 0:00:00",MEDIUM,b41e53a4-485e-48d7-921d-af170393be27,ac86be1d-d7b3-4c92-8b98-7ec02635ae30,42.72,gallons,False,,,,2025-08-31T15:59:45.982830,2026-04-14T22:27:58.604175,c9332a44-5ca3-4e1d-bdc6-d0016f16d63b,cdc794dd-e9d8-4245-84b8-c1693d099ef5
63c12577-56ca-485a-a879-416735756504,fdef058c-0c5f-4035-9f98-d9f60356538d,544d6c6a-b83d-4633-b842-e6fab7e2bc69,2024-09-27T05:36:58.276336,2024-10-06T01:39:03.296478,"Owner road scene learn. Effort each civil. We town pattern understand.
Relate actually entire company determine glass exist.",2024-09-29T03:25:06.203577,2024-10-04T03:25:06.203577,COMPLETED,Less travel respond official black. Probably friend manager need lot nearly. Miss bill camera new.,Josephfurt,ADDRESS,-26.545201,-104.766691,46246.63,"3 days, 0:00:00",LOW,20d9b627-c980-4e80-a914-7b619d6ce63a,ac86be1d-d7b3-4c92-8b98-7ec02635ae30,24.33,hours,False,,,,2024-09-24T06:39:14.551527,2026-04-14T22:27:58.604358,6999bbaf-2b2f-4250-af2d-c697969bf13b,1e649742-13ab-4a29-8497-b2671baf2f06
136bffe7-9146-423f-9af4-4f81ecf6260a,17732c75-269b-4b58-ab32-71c952da0df9,ee25c6e3-177b-48c8-b18a-46587520acf9,2024-06-17T03:03:31.789321,,"Investment stuff believe amount. Father line whole policy wide. Meet on money history ten minute marriage factor.
Still peace view score tonight. Soon star similar fly someone memory fill.",2024-06-17T04:03:07.312459,2024-06-21T04:03:07.312459,ASSIGNED,Suggest at rich free low full. Environment show water paper control TV improve.,Tashaville,ADDRESS,-57.5797905,47.486338,47356.73,"2 days, 0:00:00",HIGH,13c5f586-a6ef-46bc-9289-9bae0180a683,4c95d91b-4137-4b45-b42a-a196743fc247,5.13,hours,True,MONTHLY,,,2024-06-16T13:56:41.975620,2026-04-14T22:27:58.604528,54832c74-dcc1-4812-b8ce-6fcc80164558,0ccf2991-cc85-44be-97a4-38a7429a5ff6
6998dd64-cfe6-4419-80ad-b6362cef9df5,5ced5175-6a4b-4acc-aaad-6eee39aba902,60815a70-5acd-44c4-a751-93e113cd6c10,2024-04-15T03:46:19.664617,2024-04-18T18:57:04.439867,"Great police nation use. Population support scene size. Among most for begin technology seem.
Television crime husband. Get long art five. Let with easy left day book training.",2024-04-15T04:39:18.642681,2024-04-18T04:39:18.642681,CLOSED,Similar shake high determine worry. According final go power term.,North Christopher,WELL,69.009297,37.93084,1804.51,"1 day, 0:00:00",HIGH,0bb39098-e89d-46bc-adb7-6804cf427142,4c95d91b-4137-4b45-b42a-a196743fc247,61.21,visits,True,ONE_TIME,,,2024-04-14T19:31:19.920254,2026-04-14T22:27:58.604726,2d007e07-6d07-4964-a7bf-0261fc6bca09,3c8fa53e-747b-4468-b05a-d18b9788adba
9c745db2-5d2d-40d1-82a4-ec558d644138,00321811-ce92-494f-a69e-9f15b650ca5f,cd2ffd86-4229-4cf5-8196-bbc447762911,,,"My treatment enter assume simple character. Society lot anything challenge century book my once. Toward include about character.
Production again perhaps box finally.",2024-09-08T01:48:53.966447,2024-09-12T01:48:53.966447,UNASSIGNED,Others later clearly role. These our rest.,Floresmouth,GPS,21.449817,61.220699,35216.22,"3 days, 0:00:00",LOW,4a75e996-2e6d-445b-83e1-b1815c499cd5,59387f64-573a-4d23-bc4c-94103f3802ff,12.44,hours,True,MONTHLY,,,2024-09-05T12:45:37.528952,2026-04-14T22:27:58.604909,64a0847c-087d-45c5-a08c-80253d589ddb,ed74c3e1-0e46-4bd0-b457-a466ca4c637d
ba2e6499-c807-4651-af4d-e234fe76f1dc,17732c75-269b-4b58-ab32-71c952da0df9,dedd0eb6-b2fc-496d-994f-79ecc414767e,2025-01-19T09:08:39.771257,,"Discuss why suffer establish. Reason listen final. Card source get save cover work expect.
Notice book interesting bring room. Change effort five such.",2025-01-19T21:54:30.206394,2025-01-23T21:54:30.206394,REJECTED,Yes light may represent. Throughout attack conference. Thing not because there anything stay.,Williamside,WELL,-84.835607,-140.193002,5053.55,"1 day, 0:00:00",LOW,80a4fcca-af6c-40f6-b3a1-d30b1c812c5d,59387f64-573a-4d23-bc4c-94103f3802ff,41.89,days,True,DAILY,,,2025-01-19T03:21:56.916714,2026-04-14T22:27:58.605108,3c3f08df-32c1-42ef-b505-a162a433eef7,e6d85b7a-4705-4c07-a297-783b20697cf5
beb9017e-76a5-464d-84fa-5178c0b0bbdc,fdef058c-0c5f-4035-9f98-d9f60356538d,cd2ffd86-4229-4cf5-8196-bbc447762911,,,"Stand far else six speak. Build computer energy realize.
Law nice onto air. Leader hour condition north choose teacher. Seven various without loss choose.",2024-09-06T11:14:11.655874,2024-09-07T11:14:11.655874,UNASSIGNED,Yourself there person usually article they dream.,New Carl,WELL,56.883533,128.515485,9439.38,"1 day, 0:00:00",MEDIUM,fc2b6c48-778f-45f2-8707-c81d6eab6330,ac86be1d-d7b3-4c92-8b98-7ec02635ae30,35.62,gallons,True,MONTHLY,,,2024-09-04T06:45:09.101014,2026-04-14T22:27:58.605274,622ad645-ab36-4ade-84c4-bf3d8b4ca488,667e7f9d-71e9-499b-980e-e76bf55b048b
9847d639-726c-4b12-9862-07bfdc4ef979,00321811-ce92-494f-a69e-9f15b650ca5f,dedd0eb6-b2fc-496d-994f-79ecc414767e,2024-05-22T12:55:03.676698,,"Doctor civil behind option significant great evening.
Majority daughter together moment allow raise because sense. Fine hand six machine rock guy represent.",2024-05-23T12:57:07.830479,2024-05-24T12:57:07.830479,ASSIGNED,Place place ahead second form. Finally think expect. Star read industry important boy.,South Holly,WELL,-32.5999235,-165.065968,46949.32,"1 day, 0:00:00",MEDIUM,5d3e9c60-f840-405f-b69c-4d517aeb8a84,59387f64-573a-4d23-bc4c-94103f3802ff,70.82,loads,False,,,,2024-05-20T18:58:29.734155,2026-04-14T22:27:58.605504,8d12ec10-c45f-4adb-961e-37398274b216,ca46ec15-0216-4882-a936-1b0fd934ff7d
7fd6a138-da7b-4b76-889e-dadf1efc524f,5ced5175-6a4b-4acc-aaad-6eee39aba902,60815a70-5acd-44c4-a751-93e113cd6c10,2025-05-11T12:05:52.246297,,Visit loss become. Can anyone election four my. Suffer possible art likely.,2025-05-12T10:17:05.593417,2025-05-15T10:17:05.593417,HALTED,Edge medical indeed important run all close. Old sense travel make. Fear thus court section deep.,Nicholasbury,ADDRESS,-13.636001,84.137768,43514.06,"1 day, 0:00:00",HIGH,0bb39098-e89d-46bc-adb7-6804cf427142,b67890c1-ebe9-46e1-ae62-8f124981c06c,89.4,loads,False,,,,2025-05-09T04:52:36.141727,2026-04-14T22:27:58.605675,3c3f08df-32c1-42ef-b505-a162a433eef7,56e1a251-fdd4-4668-b978-ec1ed85ffb34
094ac2ff-aad8-4576-b454-85b2f4478988,5ced5175-6a4b-4acc-aaad-6eee39aba902,356ce91e-3d69-4c12-b975-4b312ca62840,2025-03-04T20:12:01.293108,,"Themselves personal design quite value but. Because network yard.
Field stock election yet. Time else arm. Growth leader arm his carry lawyer. Painting see picture adult.",2025-03-05T12:50:54.285190,2025-03-09T12:50:54.285190,REJECTED,Conference suddenly official.,Port Amandaside,ADDRESS,-65.784174,39.842132,14349.3,"1 day, 0:00:00",LOW,67ecc6c7-eaa5-48fb-8d16-0122a790562a,ac86be1d-d7b3-4c92-8b98-7ec02635ae30,84.3,days,False,,,,2025-03-04T01:39:39.660511,2026-04-14T22:27:58.605875,24fc0d12-0d38-49f2-ad07-a7bb2706a3c5,f0bb4abd-0fcb-4005-977f-9041d139de9e
75d0456e-7eb5-4d5a-b205-d682a88ec8f3,fdef058c-0c5f-4035-9f98-d9f60356538d,cd2ffd86-4229-4cf5-8196-bbc447762911,2025-02-28T01:13:21.210546,,"Nearly then who owner board brother meet. Who better down quality win. Six bed staff exist.
Value partner interesting on art. Always finish admit investment care man would.",2025-02-28T01:39:38.286603,2025-03-03T01:39:38.286603,ASSIGNED,Almost step test. Art new write question sing ball. Might stock per management since wait.,Kellyville,ADDRESS,-23.0427535,-163.58898,48906.53,"3 days, 0:00:00",MEDIUM,4a75e996-2e6d-445b-83e1-b1815c499cd5,ac86be1d-d7b3-4c92-8b98-7ec02635ae30,65.34,visits,True,ONE_TIME,,,2025-02-25T23:54:37.322974,2026-04-14T22:27:58.606087,262a6ae9-1d3c-453e-a3fc-87afa532a0a0,27bbb3bd-cb7d-46ed-abe2-0f632b4af4a1
5a29a05e-69a7-446d-b571-d5e434afe739,17732c75-269b-4b58-ab32-71c952da0df9,dcf8d00a-1526-417c-8284-f84cf5b1252f,2024-07-02T19:38:07.970961,,"Back customer eye boy again fund care.
Week sort form just. Who common bar painting mother finally drug. Both class many total no sometimes.",2024-07-03T19:35:25.485815,2024-07-06T19:35:25.485815,HALTED,Until art improve enter set baby test. Their pick television. Collection than series great.,Tiffanyshire,ADDRESS,-61.726927,-63.592027,15370.44,"1 day, 0:00:00",LOW,b3798b84-0dd8-423e-b649-40a131592de7,4834abaa-4e84-40a0-99ac-22d1de101e14,28.63,days,False,,,,2024-07-02T18:54:43.059555,2026-04-14T22:27:58.606308,e9210bd4-8bac-4aac-b542-a92cd0667f9e,d4721da3-d95e-47c7-a44d-a73f592da416
5256e958-eb9f-47e9-b629-6ccb523ad741,17732c75-269b-4b58-ab32-71c952da0df9,dcf8d00a-1526-417c-8284-f84cf5b1252f,2025-01-13T23:32:49.445063,2025-01-17T05:37:55.152512,"Like environment southern black skin. Seek age page car business series.
Gas movie not. Budget agency fear fact turn season. Protect specific board spend occur enter.",2025-01-14T21:58:07.442348,2025-01-15T21:58:07.442348,CLOSED,Skin partner college. Usually public eye human others city rest far.,Davidfurt,WELL,32.6684745,109.16371,9629.13,"2 days, 0:00:00",HIGH,b3798b84-0dd8-423e-b649-40a131592de7,b67890c1-ebe9-46e1-ae62-8f124981c06c,6.17,loads,True,MONTHLY,,,2025-01-11T05:16:07.750802,2026-04-14T22:27:58.606518,041ee97f-baf3-4c0f-942b-4ec9f48ae27c,ca1af407-d217-431e-afe4-bc95a3c2436a
cb5ee307-e713-4c02-bc1f-641227af4836,be8a628e-281b-4291-9256-99fe58793399,544d6c6a-b83d-4633-b842-e6fab7e2bc69,2026-01-13T17:47:22.700762,,"Carry mention perhaps especially industry apply police. Sometimes boy trial step responsibility. Black production anything.
Each home drop our. Important fear impact indicate identify cut yeah.",2026-01-14T11:57:59.847859,2026-01-17T11:57:59.847859,REJECTED,Environment down smile reduce. Either seem product herself pattern. Case at away improve add.,Jessicafort,ADDRESS,63.3814195,-155.462156,17376.75,"3 days, 0:00:00",MEDIUM,20d9b627-c980-4e80-a914-7b619d6ce63a,b67890c1-ebe9-46e1-ae62-8f124981c06c,86.71,hours,True,ONE_TIME,,,2026-01-12T02:46:56.527989,2026-04-14T22:27:58.606709,32c44d1b-d96b-448a-9c3f-9d25a57a62b2,f0bb4abd-0fcb-4005-977f-9041d139de9e
28f9d5db-7f98-409c-b8c2-b5f3ba50ca76,00321811-ce92-494f-a69e-9f15b650ca5f,544d6c6a-b83d-4633-b842-e6fab7e2bc69,2025-09-05T20:06:31.432357,2025-09-11T12:03:41.003052,"Media forward whom especially issue bit. Respond town kitchen ground shake including purpose subject.
Friend particular agent treat. Try religious who low remain expect.",2025-09-06T12:21:46.143496,2025-09-10T12:21:46.143496,CLOSED,Age one expect open theory attorney assume. Box continue other job together.,Sanchezburgh,ADDRESS,16.807365,109.348131,8546.17,"2 days, 0:00:00",MEDIUM,506e465b-6062-4d02-92fb-1f584fb21eca,59387f64-573a-4d23-bc4c-94103f3802ff,74.82,gallons,False,,,,2025-09-03T02:12:47.036144,2026-04-14T22:27:58.606904,27323f1c-51f0-446e-9091-b54b336655e8,948a8945-5d2d-49bf-ac6c-5ad9565bd6cd
