work_order_id,assigned_vendor,assigned_at,completed_at,description,due_date,current_status,comments,location,estimated_cost,estimated_duration,priority,well_id,created_at,updated_at,created_by,updated_by
6ac49ecb-0158-43e0-bf88-a9402205ada3,159610a4-4b4f-4948-abd0-c010992f70a8,2025-12-11T03:10:30,,"Once know letter. Ten figure Congress often baby those.
Power around war. Most water per than rather. Last yet pattern tonight college surface. Type hair several identify customer.",2026-01-16T05:03:18,assigned,Writer bring maybe Congress whether. Hope toward contain office.,New Bretthaven,3777.86,36,urgent,53ed9b92-d8a2-4f53-99e9-d402d60b4249,2025-07-21T15:22:55,2026-04-07T10:18:07.877336,a20445ac-c72e-4108-a5f7-5e81ab852754,57a414d9-67ab-484a-9732-2547ff11bf39
640b7b61-1b3f-4096-93b5-a6f7519c2874,3e45d3ec-4483-4235-88c0-8042057d7cff,2025-12-04T05:07:07,,"Amount inside task. Outside my return possible bring up. Probably address experience adult.
Rule travel should. Political shake trial ground power reason special movement.",2025-07-26T02:48:51,in progress,Board history author without meet large forward. Room again bit girl word provide.,Bethburgh,6670.53,37,urgent,30d0a7b2-e936-429a-802f-51418eade57a,2025-05-28T10:04:45,2026-04-07T10:18:07.877956,606dff29-1d7c-498f-9f98-fdb130edba59,b28cdbd1-a595-457b-9c34-a4ebeb5b027d
5adbaa8e-657c-4760-9842-12ab390fde65,3e45d3ec-4483-4235-88c0-8042057d7cff,2026-03-28T01:48:19,,"Five report our yourself power. Feeling know seat. Social seem arrive minute. Former nor still.
Seven beat PM. Girl state manager degree. Require challenge back subject office near.",2026-03-28T19:22:12,completed,Choice environment seek soldier. Later economy leave necessary lay should dream.,North Monique,4705.38,58,urgent,b3d2c9bf-a801-4277-8a1d-107b3160265a,2026-03-17T20:05:13,2026-04-07T10:18:07.878143,7e074bea-668b-4dc4-90d9-9ffd4528355a,56ac7584-66ee-4569-a017-e035fc0ce182
cb76425e-6916-4e25-ba79-119be19039c3,d5f6ba26-1832-4314-a2fd-f9b60850c485,2026-04-02T13:28:21,,"Forget raise seem partner discover. Her market man explain building policy cell.
Writer sense you popular. She scene stuff.",2026-03-26T15:33:20,unassigned,Age would over Mr become officer. Scientist single second relate.,Stevenhaven,6817.76,36,routine,0a4e2374-ae9a-45cf-8169-b74dcb073545,2026-01-15T11:09:31,2026-04-07T10:18:07.878414,52ac0ca1-bf8e-40ef-8237-d3e64c9acf77,2db1af4f-e440-4750-b710-14b82c1ae543
8fa8f99c-10ff-4b5c-93c9-18b655f11d14,4195973a-1e8f-47c7-af89-4b7e5e46de81,2025-12-17T18:16:03,,"Phone majority south fast safe member head. Nation beat choice lay upon. Artist protect book offer travel eat heavy.
Behavior to skill rather indicate research. Loss before participant enough table.",2025-11-13T20:14:27,completed,Per manage general training example knowledge.,Port Alexandra,5870.57,31,urgent,b7bdc965-f9b1-45f8-b871-cfeb9e7c797b,2025-07-09T16:08:43,2026-04-07T10:18:07.878593,e3927083-82ee-47c7-b555-810cdda8a38f,04d90b1f-1989-4ae5-a100-d7a81fc2c4b5
defa4536-cad3-4a7a-96a6-0e0de5f33ddb,d5f6ba26-1832-4314-a2fd-f9b60850c485,2026-02-22T08:15:53,,Your conference fly represent animal treatment. Five key whatever who site line section. Important them room.,2026-03-10T10:47:35,in progress,"Build them story. A suffer customer laugh tree.
Race defense time level ok act.",Obrienbury,1627.87,66,routine,0a4e2374-ae9a-45cf-8169-b74dcb073545,2026-01-01T06:48:42,2026-04-07T10:18:07.878834,c822bb6a-1c42-42fc-b3ae-f01b41362e9c,3d70efcf-287c-4444-a7a5-22ab269331f8
fff13aeb-d2c2-454d-9db4-79d334d182bd,f9923c46-a9a0-4f7d-95b8-8b0238e212f8,2026-02-24T15:06:44,,Whether peace position though write more argue blue. Soon while everybody industry address summer partner try. Turn somebody serve reflect. Also himself direction professor.,2026-02-25T02:42:21,in progress,Read religious beat place. Most officer he fact without.,Priceburgh,6652.57,25,routine,f438b685-e230-42cd-bf14-5469acb5c568,2025-11-30T16:13:34,2026-04-07T10:18:07.879051,c7fcd44d-813a-446d-9db3-eec8b503c041,767e061d-8628-40d6-8f81-62769b9c6d7d
ac21e1b9-49c5-48c8-8865-277145e309d4,159610a4-4b4f-4948-abd0-c010992f70a8,2026-04-04T02:17:13,,The choice along I able speech force. Table individual draw nothing partner investment. Save skill could fill indicate trip yeah. Upon end meet land sport region.,2026-04-03T20:01:17,completed,Visit middle every little I.,West Christopher,9809.13,6,urgent,51ca7b96-72d2-4eb0-8c58-e0e0074f6858,2026-04-01T18:07:36,2026-04-07T10:18:07.879236,0dca05c6-e434-41d3-87f9-60659fb7e089,6f95c9bc-de31-46d9-b208-717376d8e908
46972237-ce1b-40db-98a7-dc88ad9f50a5,3e45d3ec-4483-4235-88c0-8042057d7cff,2026-03-18T20:47:54,,Measure opportunity laugh conference find performance yard interview. Cultural just hit meeting.,2026-03-01T22:18:43,assigned,Source where lead movement scene themselves believe group.,Port Lisa,270.46,12,routine,fe66602b-ecb2-4bfa-884b-3b40b05f0302,2026-02-05T19:18:44,2026-04-07T10:18:07.879405,41c8913c-f6c6-4746-80b9-2e6571d1e695,d0a002f3-eacb-4ca1-b718-a3beef7c2080
ba2db94d-ef42-47a2-8304-8fac026e70bd,d5f6ba26-1832-4314-a2fd-f9b60850c485,2026-03-03T15:57:19,,Customer hospital my ready about social. Fire about interview picture sing treatment important loss. Alone cultural interest.,2026-01-15T02:56:59,unassigned,Other answer force seem light. Sister soldier than whatever anyone imagine.,Williamsstad,3181.95,3,emergency,33b59343-1893-4408-87a1-f574c2411072,2025-07-01T22:00:20,2026-04-07T10:18:07.879614,e829aba1-48b0-4b9b-93a4-bbd03b5e5030,49f8e537-06c2-4bbc-be8e-6fedd8df90aa
c3582a2a-0fc9-4d08-9904-83dcf8b845af,3e45d3ec-4483-4235-88c0-8042057d7cff,2025-12-07T13:50:07,,"Low explain admit throw green charge laugh low. Certain bill vote side. Last animal in per plant race.
Anyone east together very law evidence future well. Table here your list onto dark many.",2025-12-03T13:22:19,assigned,Good store play especially it million. Make card bag around deep.,Michaelbury,3740.58,47,routine,79a1931c-3d03-43f3-b9a5-69caf18b43ff,2025-06-24T09:22:22,2026-04-07T10:18:07.879789,0c94f6e3-cfbc-4547-a48b-cfca69eb6a1e,c5aee64a-d7f3-48d1-8cdf-930bac6cdf29
d70c05ec-f184-4a06-bb0c-0c588f0eaf76,4195973a-1e8f-47c7-af89-4b7e5e46de81,2025-05-12T19:05:09,,Continue box real area whom. He lawyer guy blood person. Beat college money general remember mean.,2025-11-01T23:42:51,in progress,Radio often consumer small. Ground avoid attention beyond.,East Kara,3430.74,39,emergency,55d0d855-36d5-4b6c-bea3-f609f1c1342a,2025-04-10T22:39:55,2026-04-07T10:18:07.879950,29696f86-c838-4f16-a124-9a4d5f266417,712b72b3-aca1-4acd-84c0-2036a8b53c4b
cecf376c-690c-406e-9082-d3532ab29d45,159610a4-4b4f-4948-abd0-c010992f70a8,2026-03-11T18:48:46,,Event between thank politics building. Market tend community break speak. Add film compare fight field space. Thus certain home I rule poor fly.,2026-01-31T05:23:46,assigned,Response kind cause three choice. Across thought apply rise relationship medical.,West Jasonfort,4168.36,21,urgent,b488fd0d-4ad2-4b8a-ac1b-65f22add23ea,2026-01-14T12:50:37,2026-04-07T10:18:07.880118,64b008e6-c97c-436f-9ddb-f178e20e8c42,5a34f956-2462-4873-8f8b-baacf798396e
2a41d465-127e-4dd3-a087-8575eef8d6d1,38939c64-27d8-477b-adbf-3eb952a9ff97,2026-02-11T10:13:34,,"Fish stand I yard score wide force. Similar ever level Mr hand.
Trade personal idea have sit. Especially experience be especially. Actually others bring music sing.",2025-09-08T13:53:24,in progress,Keep process history on face.,New Nicoleport,1811.42,65,routine,1978fe38-03b4-42a6-a4a9-0884c7f3af98,2025-04-09T12:13:09,2026-04-07T10:18:07.880343,1ec11629-3063-47bc-a644-c69247d438e6,ee1f7e5b-d175-4cd4-90ba-8b699aa7f209
c3823b75-8810-474f-a950-079ed491f633,159610a4-4b4f-4948-abd0-c010992f70a8,2026-04-04T00:02:28,,"Wife nation to.
Home large just daughter nice manager. Rock best kitchen station. Capital see federal structure office win various.",2026-04-11T21:10:12,in progress,Space law too left protect according pay. Never someone policy simple yet almost.,Mariohaven,4201.95,2,routine,9877b53f-f558-4a80-9047-f136e062e325,2026-03-17T21:38:16,2026-04-07T10:18:07.880509,ef81d503-6e65-41b0-8145-3400c126f6c0,ea27f072-6137-475c-b9df-00405355cca8
1c8385b3-9334-4fc5-94c5-657b800587f9,ca08ace8-52c5-4d85-8659-6c4ca8d07a0c,2025-12-13T21:54:21,,What sense none ball main. Evidence choose event weight amount. Lose man wonder inside big structure.,2026-01-07T22:11:29,completed,"Car add data away.
Party art near space. Design effect seem. Very gun more.",Buckville,2085.53,29,emergency,11b3fac4-0a2b-48f6-88bd-d93fcb533461,2025-06-04T15:38:16,2026-04-07T10:18:07.880693,79379b08-0d8e-4876-91f7-7ddbdd75c304,ef563937-d68a-49b4-b1d9-0f423ca0226e
bf558008-df49-41a6-8648-014e6ef50d25,38939c64-27d8-477b-adbf-3eb952a9ff97,2026-03-19T20:17:20,,"Expect century fill be tax. Total realize her. Animal check car however sound seven become.
Hotel collection thing west night. Affect marriage sort only.",2026-02-22T10:46:07,in progress,Than to market all way. Or nation mother paper call protect. Create one least room yourself book.,Yvettemouth,1937.65,45,urgent,600ff490-cf6d-4fb9-97a2-f24a0457b52d,2025-12-22T10:46:03,2026-04-07T10:18:07.880900,f54b0831-8b81-42a2-800c-7985ef5253ec,1aba83df-003f-4120-bdc6-24d12f6fddeb
6436679c-b3b0-424a-a779-2a84c1acb91d,00ce0e5d-dabe-447d-8247-cec72142417d,2025-09-25T11:45:08,,"Easy gun election again. Image truth money son.
Fund worry involve local one. Government when up.
Day daughter option suggest detail none. Set end effect off upon too.",2025-10-24T03:17:05,assigned,Table grow situation wall. End drop night if if specific. Understand physical arrive.,West James,296.0,14,urgent,1d29b680-7148-45d8-8082-e64384b3fcc2,2025-09-25T01:31:58,2026-04-07T10:18:07.881091,26371d4e-d093-41ec-a6d2-dd746aab3583,76317262-db0b-4593-899b-384dfd112e68
c24268ac-e3cd-4473-8ea2-11c58802b1b4,3e45d3ec-4483-4235-88c0-8042057d7cff,2026-04-01T07:45:20,,"Year high evening would play. Worker skin name.
Stay soldier scene have agency. Computer mission experience institution draw. Difference example wrong chair onto.",2026-04-03T19:34:42,in progress,Partner long line animal mind guy he need. Laugh new heart follow nice alone growth.,Susanfurt,2399.15,22,routine,86327db3-21ac-429a-82a2-cf3a5b70950d,2026-03-25T13:15:14,2026-04-07T10:18:07.881278,7af7ba8d-ba27-4375-88d1-8462f87ca20c,3a28635f-bcf6-4583-8a38-922335a56894
3ced67c0-e7a8-443f-9d2e-74cbe9dd2403,4195973a-1e8f-47c7-af89-4b7e5e46de81,2026-02-04T20:47:00,,Himself senior bill allow old. Green source major himself top consider remain. Girl particularly consumer teacher later score factor.,2026-02-20T08:33:56,unassigned,Money small room author. Expect news project high south exactly.,Joyceshire,8763.48,6,urgent,45a6ae9a-7d27-4382-8ace-55c4e40c19c8,2025-12-22T02:21:21,2026-04-07T10:18:07.881426,fd2a5bdc-ed77-4de9-93b0-7d7187ee9e2a,50b8eee7-8936-40fc-a2cf-09f34fda8256
f9116b2b-a118-43c0-b5f9-7e3d9d7815d7,4195973a-1e8f-47c7-af89-4b7e5e46de81,2025-08-10T16:10:24,,"Husband she measure hold seek rise. Beat suffer true lose art.
Reach style realize change garden. Nearly knowledge network. Any and half education discuss medical.",2025-05-30T11:12:10,unassigned,Position need benefit smile two senior around type. Behavior else group seat street of.,Brittneyville,235.57,32,urgent,45a6ae9a-7d27-4382-8ace-55c4e40c19c8,2025-05-07T00:59:38,2026-04-07T10:18:07.881612,25a6a9c6-b55c-4db9-a647-b7fb0af4d9ec,309aade5-6c47-4edb-b27b-aea5d48611b6
df3bb62b-91f8-406e-b623-1d1ac1b2d704,f9923c46-a9a0-4f7d-95b8-8b0238e212f8,2026-03-20T22:45:46,,"Far drive my. Prove maybe hour meeting. Particular marriage team.
Set alone free mother picture. Long support some little day go leader.",2026-03-09T08:10:59,in progress,Just laugh organization century marriage. Growth effect step happen authority since likely occur.,Port Michaelberg,1438.9,67,urgent,2fc55cb8-ba54-4615-84aa-f727953c1a26,2026-02-01T20:21:57,2026-04-07T10:18:07.881899,90cad005-f8d5-4f1d-b98c-911b20f0cade,f4823b8a-e3d6-44aa-a4a0-d69e848bbbd9
da6be944-4838-4a03-a2b5-8c415ea73b76,9469901e-742d-4522-9bba-d1217399375e,2025-06-09T04:34:38,,"Those opportunity policy girl drive plant participant attention. Happy despite sense relate full. Next miss television.
Build show but total protect. Could you return.",2026-01-12T20:40:31,in progress,Street outside animal play billion consumer still.,Colemanfurt,261.41,64,urgent,9774c0b5-6317-4794-bf97-42efa48f1dce,2025-06-01T05:10:09,2026-04-07T10:18:07.882094,b9c94cfc-dec0-48ab-8b6e-68691e59b38b,6248a688-2dd2-412b-8d6d-2899d76b5da8
c646d336-de47-4fe5-a142-89caed2c6889,38939c64-27d8-477b-adbf-3eb952a9ff97,2026-03-18T23:30:18,,"Also whom hot consumer them gun side. Mrs answer management grow official.
Anyone economic apply class boy. Kid film learn role marriage turn. Instead little character.",2026-04-05T09:36:50,unassigned,Hundred social mission.,Riosmouth,3002.04,24,emergency,8c2e0996-ae50-4c15-bc25-3b3b3a95896c,2025-08-07T04:43:00,2026-04-07T10:18:07.882275,44617e29-1078-4d54-95c0-b200e3268f0a,15007c8a-40f7-4f01-8d4a-e08727caa0fd
b4e665ec-c9e5-4960-8d6d-127d1bdf2908,9469901e-742d-4522-9bba-d1217399375e,2026-03-11T04:19:43,,"Put already care edge research. Thousand food base wide happy clearly base. Executive two old this.
Security discuss become none music list. Check his Congress even.",2025-12-17T04:54:13,completed,Family local some occur. Majority vote experience trouble bill late possible.,New Jeffreystad,5801.34,15,urgent,6c483a54-0e49-4e56-b143-f6e53094418e,2025-11-21T12:40:27,2026-04-07T10:18:07.882439,a2eaf5ba-a2d9-42be-a20d-42ccb25b3882,9d740dd4-86c1-4812-9be3-663b90865977
fe0f5bf9-916b-4f20-acac-b82c97903f6b,4195973a-1e8f-47c7-af89-4b7e5e46de81,2026-04-04T18:38:11,,Those son question push day. Education bag civil national story research indicate. Spring skill purpose him though attention.,2026-04-08T19:08:33,assigned,Player organization on ability future however week. Include Mr once film.,Kennethland,2173.41,40,routine,55d0d855-36d5-4b6c-bea3-f609f1c1342a,2026-03-15T12:37:54,2026-04-07T10:18:07.882643,9b85ad0c-a339-4c5e-97fd-24d5a2109d0d,b573fc3a-34d1-42a9-9b0c-7aa61266a881
8ad5cf36-6963-4c46-a68e-fa0612b72481,4195973a-1e8f-47c7-af89-4b7e5e46de81,2026-04-03T22:04:12,,Cost bad commercial organization. Someone process while kid manager society policy want. Morning late full camera after sea statement.,2026-01-21T18:13:05,unassigned,Almost into office write your reason thought.,Alexanderborough,3173.32,10,urgent,b7bdc965-f9b1-45f8-b871-cfeb9e7c797b,2025-12-30T10:21:23,2026-04-07T10:18:07.882804,f1d86111-1f7e-4d57-b7f4-f36b3d1a6108,4da05dd7-4f6a-494f-a06a-0dc9b1b914fc
00bc36d0-a088-4a4c-9788-766949a61746,ca08ace8-52c5-4d85-8659-6c4ca8d07a0c,2025-08-23T22:56:49,,"Question mother onto defense that become lead blood. Recognize budget break social west.
Piece board imagine among. Of deep still low rock list. Over great technology catch.",2025-06-28T20:50:05,unassigned,Probably visit me cut. Anyone type drop affect arrive now as common.,New Jenniferberg,7161.82,31,emergency,33b59343-1893-4408-87a1-f574c2411072,2025-06-02T20:02:08,2026-04-07T10:18:07.882974,1be861eb-1807-4107-a626-6abc962e45b1,6ad6100d-1b65-4f5c-8524-561ab04edb09
2895918d-5760-4eb9-a718-12b0b0753b2d,00ce0e5d-dabe-447d-8247-cec72142417d,2025-11-14T15:01:42,,"Group evening course series. Economic understand coach be quality have debate.
Available care safe adult leader. Father that cold daughter. Never floor they leave develop. Speak PM rich piece.",2025-12-27T16:29:25,in progress,Read last high after physical. Care care follow worker similar.,East Jessica,1997.32,38,urgent,9877b53f-f558-4a80-9047-f136e062e325,2025-05-11T04:05:58,2026-04-07T10:18:07.883212,d31e2ff4-2a74-4d7d-9ccf-27230f0eed36,81f4883e-7020-4883-9863-c0f2c631fc97
3142cfb0-7ac4-4f90-ae25-85358aee8f62,f9923c46-a9a0-4f7d-95b8-8b0238e212f8,2025-07-04T13:30:11,,"Program official head though serve coach. Beat give owner condition cold shake Republican.
Describe fact town. Painting plant ball we life. You none event mission Mr able then win.",2025-12-15T21:55:12,assigned,Measure lot manage on it. They rather hear party. Mind minute determine writer might report.,Port Michaelhaven,8502.92,12,emergency,2cddc46a-a152-402d-9bba-a81dbc516e31,2025-05-21T20:52:19,2026-04-07T10:18:07.883385,76b97d96-1b3b-4105-936e-dc9dfdbe5740,77f6dd4b-a619-4ce5-bb16-699b7ab9120a
faa1d69b-7873-4917-b565-8e16e46b36c9,3e45d3ec-4483-4235-88c0-8042057d7cff,2025-10-15T06:41:26,,People store bag economy hard too. Adult federal right could. Six respond morning much include senior.,2026-01-01T01:57:43,completed,Officer true everything pay thought this identify. Bank put provide thing who think politics.,Lake Kenneth,930.97,38,emergency,fe66602b-ecb2-4bfa-884b-3b40b05f0302,2025-09-03T12:57:08,2026-04-07T10:18:07.883577,bd671eab-e149-465c-9aa0-580f45ddedf5,c7fcd44d-813a-446d-9db3-eec8b503c041
4edc7763-a41f-4eeb-a231-dc5dbd378a8e,d5f6ba26-1832-4314-a2fd-f9b60850c485,2025-08-29T06:40:13,,Administration at woman down. Nation away no within. Hotel democratic throughout senior yeah in little father. Community you green.,2025-10-14T19:18:24,unassigned,Adult election language leader improve teacher smile. View decade senior direction usually.,Allisonberg,7557.84,56,routine,2cddc46a-a152-402d-9bba-a81dbc516e31,2025-05-24T12:52:15,2026-04-07T10:18:07.883736,88bb3de8-5379-45d2-9217-6b3f0fc4bdff,d30f440b-dd0d-4e51-8b2c-83d22774f458
6787d93d-03df-487f-a8b8-e7206199aee3,d5f6ba26-1832-4314-a2fd-f9b60850c485,2026-01-20T21:44:12,,"My assume religious pressure environment cut must. Available news tax easy five agency.
Situation buy development evidence along rock yard. Article be federal teacher against mouth Congress.",2025-12-22T23:04:08,assigned,Behind no gas across. Activity themselves kid travel as.,South Katherinestad,1871.88,47,emergency,2cddc46a-a152-402d-9bba-a81dbc516e31,2025-11-13T20:41:04,2026-04-07T10:18:07.883898,7e60b368-7f1b-4be5-9da1-924dffab8ea6,6a4e8baa-cc3d-4dae-9ad1-1b94d87ea22a
9ccf1bf4-bbbe-41de-8627-370cc35d3d1e,4195973a-1e8f-47c7-af89-4b7e5e46de81,2025-05-06T12:36:13,,"They toward school power central organization accept. Manage recognize collection magazine happy.
Shake campaign reduce. Nature check whether election herself dark.",2025-12-16T04:19:02,in progress,Beyond score none clearly rest.,New Robert,2792.63,10,urgent,55d0d855-36d5-4b6c-bea3-f609f1c1342a,2025-04-10T02:41:20,2026-04-07T10:18:07.884060,759cfb08-983c-43d0-8a7f-ffbbe7c1d769,0529cdfd-65e3-4259-b822-65f01df12a58
14317511-22dc-4bf9-855f-d9ad39755f91,00ce0e5d-dabe-447d-8247-cec72142417d,2026-01-22T21:56:53,,"Everything item protect top fact present.
Style good value responsibility rock performance. Action adult relationship strategy reflect condition customer inside. Law interest able fact.",2026-02-08T00:42:07,unassigned,Foot wind federal begin campaign quickly.,Lake Sonia,8579.61,59,routine,d0bf40fa-83f2-4c23-898b-3cb9013ee7fc,2025-11-25T19:12:01,2026-04-07T10:18:07.884262,bd8b4bcb-7e85-434c-a516-e94b59b18f7f,00488eee-5013-4af0-8216-8507bdf20384
c3eb8393-904b-4792-96bc-8e843cf949f2,f9923c46-a9a0-4f7d-95b8-8b0238e212f8,2026-03-20T21:07:02,,"Rest nearly around thousand run stage side whom. Process station language former particularly make lose own.
Treatment wall one believe. Rich a mother deep result.",2026-03-24T20:33:35,completed,Job serious reason lawyer into all worry well. Magazine building stop gun. Goal when outside.,Prattmouth,3468.81,24,emergency,f438b685-e230-42cd-bf14-5469acb5c568,2026-03-19T20:58:33,2026-04-07T10:18:07.884443,da28f92e-08a7-403f-9c58-61183aa1a05e,0f10e685-901b-4415-80ed-2a625e14e289
b25d2322-0f54-4a0d-87de-196d06087a3d,00ce0e5d-dabe-447d-8247-cec72142417d,2025-12-30T06:37:51,,"Parent finally community find cover Mr. Old design present kid maintain factor.
East everybody expert attention cell. Listen space southern man break. Particular yes tough drive sure ever few.",2025-12-23T17:54:41,unassigned,Character kitchen likely argue accept include. Civil mouth skin better anything half memory.,Melaniemouth,8183.97,34,urgent,45a6ae9a-7d27-4382-8ace-55c4e40c19c8,2025-11-25T21:15:52,2026-04-07T10:18:07.884671,8fbe10e9-bd68-429a-b6d0-ee175e8e8342,fccb46ac-cd38-4ec9-90a6-2c8af2bf07a0
d1a9062b-62cc-431f-8710-c4f5d699cdf0,ca08ace8-52c5-4d85-8659-6c4ca8d07a0c,2026-03-12T20:21:44,,"Type industry moment upon out want. Agent sport help everything whole.
Since heavy every speak account radio effect. Table score than particular professional three standard.",2026-03-25T04:26:53,assigned,Actually low civil individual tree religious. Only until beyond guess month suggest ten economic.,New Melissa,539.18,21,routine,08d7a575-b2cd-4102-92e6-261b6319675f,2025-09-14T20:47:28,2026-04-07T10:18:07.884864,0f10e685-901b-4415-80ed-2a625e14e289,9b248c20-f034-4fa7-880f-a2a364a6bc27
066d9b27-ad4a-43e5-a38c-430ac5fb04cd,3e45d3ec-4483-4235-88c0-8042057d7cff,2026-03-29T14:00:52,,Position letter sit American. Beautiful each sell behind almost small.,2026-03-02T21:17:36,assigned,Remember fill car audience. This spend important hot take soldier heart company.,South Justinland,2259.04,31,urgent,79a1931c-3d03-43f3-b9a5-69caf18b43ff,2026-02-25T08:38:56,2026-04-07T10:18:07.885036,1f3ef592-c514-4410-84cb-959e4e7f5ef6,e27e5e75-5b29-4359-9af6-a287ff9fed1f
d599648e-2d71-40f3-995e-f692cbfdf9d8,00ce0e5d-dabe-447d-8247-cec72142417d,2026-04-06T19:03:56,,Expect certain blood serve minute. White name sometimes every southern. Thought require responsibility dinner seem.,2025-12-01T09:12:33,completed,Budget trial dinner sort. Question sure could bar. Us full analysis might us.,West Stevenberg,7244.12,55,emergency,9774c0b5-6317-4794-bf97-42efa48f1dce,2025-11-23T04:21:51,2026-04-07T10:18:07.885227,8e545ab1-3017-4f47-a3c8-64ea8a9caced,2e19b0f6-a5ea-4a79-b3bc-63d33f0970d5
224aa041-0856-4509-809f-67e73f01f541,9469901e-742d-4522-9bba-d1217399375e,2026-03-27T15:26:19,,"Sense government power structure six economy some nice. Free station likely manager.
Lead economy benefit decision executive. Smile back seek food.
Toward low however and.",2025-12-22T19:02:31,assigned,Outside Mrs understand low. Over alone record answer close.,Vazquezport,1376.22,20,emergency,53ed9b92-d8a2-4f53-99e9-d402d60b4249,2025-04-26T10:55:27,2026-04-07T10:18:07.885410,eda3134d-ca7a-435d-ad2a-7acd6b50e775,43ac13a8-9d53-412f-b06c-7883415167e8
4e004193-e283-42cd-923d-64eb0bca70f9,3e45d3ec-4483-4235-88c0-8042057d7cff,2026-02-12T19:35:55,,"Bag maybe model important success foot here. Key if fine simply you college foreign of.
Drive degree keep why whose. Public along to hard here Democrat must.",2026-03-07T10:27:23,unassigned,Accept agency into everyone. Low research manager among.,West Benjamin,8877.72,42,emergency,11b3fac4-0a2b-48f6-88bd-d93fcb533461,2026-02-09T01:18:44,2026-04-07T10:18:07.885600,f1d86111-1f7e-4d57-b7f4-f36b3d1a6108,c75a07ec-e620-4058-9aab-50a5f3d6bae5
7e45251d-0ddc-4c24-8f29-553c8cf232ac,9469901e-742d-4522-9bba-d1217399375e,2025-08-24T07:14:43,,Where letter let future standard doctor group nothing. Crime audience much allow. Mean major rate certainly treat. Production research could war take organization second.,2026-03-05T00:17:01,unassigned,Whom yourself time west. Despite media sound arm.,North Wendy,6443.15,51,emergency,69cefa9a-d560-4a17-a13d-a5652e00e8a1,2025-08-20T03:40:57,2026-04-07T10:18:07.885748,f8cf6c64-4db1-4fdb-aa79-1d52f412e59d,ad894c15-4cd8-4016-b932-6a31f67a4485
cba6e1c2-0a82-4a39-a8d7-cc3913f58241,d5f6ba26-1832-4314-a2fd-f9b60850c485,2026-04-06T11:42:30,,"Class majority picture describe. Seven production future enjoy resource position. Best themselves under population mention key.
Off treat place. Represent race live support. Great my give.",2026-03-30T09:10:48,unassigned,Without mission especially trouble our green while. Sister want simple challenge education.,Tiffanyborough,4475.12,58,emergency,05cf787c-49ff-4d04-b65a-b5fe04cba979,2026-03-27T12:48:07,2026-04-07T10:18:07.885940,c5b012f6-6a1c-422f-a7e8-be1cf656057a,22f1bfaa-b131-4df1-aaee-bbf395ec25b7
7327da10-3b79-4d0b-bec4-b100c7a4550a,4195973a-1e8f-47c7-af89-4b7e5e46de81,2026-04-06T08:12:28,,Avoid popular before professional exactly. Why quality cause staff sure late agree. Edge father increase thing political speech new mouth. Send send sell audience.,2026-04-01T22:47:43,assigned,Just second instead move we. Eight against Mrs I.,Brittanyland,2572.31,63,emergency,55d0d855-36d5-4b6c-bea3-f609f1c1342a,2026-01-05T10:49:13,2026-04-07T10:18:07.886097,5f67d6b4-da56-4ae9-b590-42652a42e284,ca9bbb42-13bc-4006-b974-4e86e33c36c7
72c93840-18f7-4142-863d-9218b997dfa6,00ce0e5d-dabe-447d-8247-cec72142417d,2025-05-27T20:40:00,,"Tonight turn will free. Story event dinner catch bring.
Serious answer here network. Challenge mother include condition local whom. Pull even me woman without write.",2025-08-17T20:48:13,in progress,Meeting each there quality. Use nothing kid management.,South Jason,9605.66,72,emergency,ed9154bc-fd30-4171-9034-88e50ffb17d8,2025-05-20T19:01:02,2026-04-07T10:18:07.886245,9a6ffc91-93b4-42c0-a7f1-4140939a7c54,b20bc0b8-a48e-4199-9a6a-61ee1287daa1
fe8e0aea-cca1-4ad9-a939-eb3704871d4f,d5f6ba26-1832-4314-a2fd-f9b60850c485,2026-02-05T11:02:10,,"Learn hope research modern position recognize. Out find catch reality not. Person base high likely baby.
Any clearly play interest next animal.",2026-03-16T18:04:39,in progress,Kid school see less meet risk prove. Personal official order per.,South Paul,4861.35,29,urgent,79a1931c-3d03-43f3-b9a5-69caf18b43ff,2025-12-05T20:48:14,2026-04-07T10:18:07.886420,3a1584ae-be2f-47d1-9c5e-5a1b6c42ff10,86513908-1d47-4ae8-9ca3-5fc11ae54f14
