work_order_id,assigned_vendor,client_id,assigned_at,completed_at,description,estimated_start_date,estimated_end_date,current_status,comments,location,location_type,latitude,longitude,estimated_cost,estimated_duration,priority,well_id,service_type,estimated_quantity,units,is_recurring,recurrence_type,cancelled_at,cancellation_reason,created_at,updated_at,created_by,updated_by
ec48aa87-5d86-4ca2-9d1a-56e5c60fc955,45d86630-0ae0-48cf-91da-da4e2553be12,ec9afc83-9b84-4021-9754-c0005ccd8025,2026-01-01T06:40:19.262166,,"Real blood close any. Fight region site bed game party all. Sing bit them have.
Behind condition seven from. Democrat us seek research might everyone population.",2026-01-01T14:39:52.482379,2026-01-04T14:39:52.482379,REJECTED,Scene laugh rate service. Car million later wrong.,North Emily,GPS,59.5157385,-102.071629,7089.18,"3 days, 0:00:00",LOW,363d4af0-d16b-4010-8267-8fd3d084a036,b67890c1-ebe9-46e1-ae62-8f124981c06c,25.35,gallons,False,,,,2025-12-31T00:59:11.056540,2026-04-14T22:27:58.649601,f54a1123-3c1a-4b90-9d4c-6fdfa794e6ab,3830d64b-14c8-4c52-88ad-5c03ae08642f
f79dac94-3b49-48af-86a6-3a16ed33fa4e,69f88d89-cd4d-4b68-9ea5-d47749a320b4,75c7e517-dddd-43b4-b8d5-e7eb922003e3,2024-05-06T03:44:50.288009,2024-05-13T11:50:46.787025,"Care also politics stay federal. Travel paper relate blue. Not product speak allow brother.
Door bed nothing father likely point. West current black continue husband explain.",2024-05-06T21:26:09.066441,2024-05-11T21:26:09.066441,CLOSED,Evening catch no democratic indicate today. Choose oil morning.,West Timothy,GPS,81.9885785,46.668202,32378.0,"1 day, 0:00:00",MEDIUM,fa8bbe27-37fe-473e-9cec-29348e69bbfb,b67890c1-ebe9-46e1-ae62-8f124981c06c,14.99,hours,False,,,,2024-05-04T20:01:47.244321,2026-04-14T22:27:58.649789,126fe4cb-0f5c-4b0f-90d2-ae7bdfa228f3,384a95c6-ebe0-4cd1-9374-08f4eaed4faa
b84777f1-d167-4f3d-899e-9242539a4bb9,45d86630-0ae0-48cf-91da-da4e2553be12,ec9afc83-9b84-4021-9754-c0005ccd8025,2024-06-19T16:26:39.787968,,"Head imagine nothing push exactly. Interest nice shoulder buy everybody.
Provide foot firm partner side according before total.",2024-06-20T03:18:53.315210,2024-06-21T03:18:53.315210,CANCELLED,Agreement shoulder project young road. Every decide huge present campaign he.,West Christie,WELL,-24.9344385,-71.427083,27808.81,"1 day, 0:00:00",HIGH,363d4af0-d16b-4010-8267-8fd3d084a036,4834abaa-4e84-40a0-99ac-22d1de101e14,39.04,days,False,,2024-06-20T03:03:28.375706,Weather delay,2024-06-19T11:35:39.302967,2026-04-14T22:27:58.649987,f0bb4abd-0fcb-4005-977f-9041d139de9e,e12ded76-42d7-4146-b7be-124e9903f785
192a2dde-45fe-4da8-90d7-5400f01336f2,50c30f52-4308-407c-9eb4-b29e37f557ed,ec9afc83-9b84-4021-9754-c0005ccd8025,2024-05-30T07:07:04.209512,2024-06-05T10:53:50.235288,"Material yard long your. Surface loss nearly pay activity.
Green body control middle.
Fall whatever officer. Campaign reason surface safe choice. Tv early Congress author your.",2024-05-30T18:09:37.881927,2024-06-03T18:09:37.881927,COMPLETED,Everything company detail ago season no war. By since remember step open truth.,South Richard,ADDRESS,-5.8862385,43.151508,49189.81,"3 days, 0:00:00",HIGH,363d4af0-d16b-4010-8267-8fd3d084a036,59387f64-573a-4d23-bc4c-94103f3802ff,77.15,visits,True,WEEKLY,,,2024-05-27T13:22:08.518658,2026-04-14T22:27:58.650179,0beb14d6-8d09-4ba7-b488-ffc669c16517,a4d2a7db-75b1-4632-aeb5-bfd1da7f8aa5
ab60bb11-1db8-4b76-80af-7c82f0534f3b,00321811-ce92-494f-a69e-9f15b650ca5f,544d6c6a-b83d-4633-b842-e6fab7e2bc69,2025-12-18T22:48:22.925877,,"Group cut my hard small its time. Lay five step little.
Hair pretty sense fast at. Political soldier step realize leg method director. Remember billion black sit strategy.",2025-12-19T12:28:20.452629,2025-12-23T12:28:20.452629,REJECTED,Each reach customer star establish. Amount real letter.,North Matthew,WELL,-77.426124,-78.02881,16152.62,"3 days, 0:00:00",HIGH,4b84c943-16f9-47c6-882e-1eab0e98f1e7,59387f64-573a-4d23-bc4c-94103f3802ff,73.8,hours,True,MONTHLY,,,2025-12-18T20:16:21.098712,2026-04-14T22:27:58.650377,356f8dc3-011c-4c73-9a52-8754c0a827fb,acd76ced-5452-4ce9-b57d-c23c69a123ac
a60da99a-f685-486d-bbf4-986eae4773a3,90914c41-8379-4db0-8e87-d7a9abf1cd74,a6e5f95d-dc4c-474a-a175-bc234e9f170d,,,"Buy important chair. Tree law already home them notice right. Later skin probably.
Word also rather wide one office. Whom cover author outside my often. Seek sense us think recognize world program.",2025-06-20T00:05:27.327319,2025-06-21T00:05:27.327319,UNASSIGNED,See direction just reach.,New Tracybury,GPS,-45.3571865,-100.011879,46612.35,"2 days, 0:00:00",LOW,da444aba-c9f9-4714-9f03-d8e5de0db2b9,3f4dd684-ecaa-4e82-8ad1-5d2ad55c4b71,74.61,gallons,True,WEEKLY,,,2025-06-17T20:05:03.586658,2026-04-14T22:27:58.650571,0d1053f1-abda-42ed-a80f-df4232a94e6c,c09b8f51-0c17-4d25-998e-f1bbf35a7b23
1727d2a2-b82d-4681-8682-546656c7b03c,90914c41-8379-4db0-8e87-d7a9abf1cd74,a6e5f95d-dc4c-474a-a175-bc234e9f170d,2026-02-03T16:17:42.289062,,"Teach rule wait and. Statement thousand include small notice reach nation skin. Program effort medical hold.
Compare six bed simple church few. Race suggest during anything camera pressure.",2026-02-05T09:23:43.867397,2026-02-10T09:23:43.867397,REJECTED,Whatever wonder hotel increase room. Top director season color.,New Richard,GPS,-59.5397655,-2.312539,17261.73,"1 day, 0:00:00",MEDIUM,da444aba-c9f9-4714-9f03-d8e5de0db2b9,59387f64-573a-4d23-bc4c-94103f3802ff,31.02,days,False,,,,2026-02-01T17:17:16.220836,2026-04-14T22:27:58.650752,fbed279e-cc18-49fe-8c97-a83fbbded86f,2b4dd93d-d046-45c3-85ba-87cdd5fc0e42
ebfb5000-9cb0-465f-b062-a03e7afaabd6,90914c41-8379-4db0-8e87-d7a9abf1cd74,922982f5-4278-444a-9836-a8797cdb696d,2025-04-03T17:19:24.004191,,"Month toward population simply member theory start. One reduce pressure add.
Call process let see bag including worry.",2025-04-05T04:53:19.814577,2025-04-10T04:53:19.814577,ASSIGNED,Vote argue treat suddenly oil impact. Tend next mouth within. Open person data order.,East Kathryn,ADDRESS,58.8546755,179.522842,8334.88,"3 days, 0:00:00",HIGH,3fff67a1-02f4-497e-adc9-174104035e62,b67890c1-ebe9-46e1-ae62-8f124981c06c,47.49,loads,False,,,,2025-04-02T20:28:51.458494,2026-04-14T22:27:58.650953,b3f3a2d4-b149-4b1b-af51-2b6ec1cd836c,488a7af8-0b6a-4e44-a6c4-0d96b7fdc468
3be5d913-b9c0-4a29-9dd1-143d09bdc934,45d86630-0ae0-48cf-91da-da4e2553be12,fe0211e2-1730-4140-a5c5-59d09ab75793,2025-12-11T05:54:43.246589,,"Action break from model.
Prove task recent step.
Different contain score move pretty development. Whose relationship worry any.",2025-12-13T04:58:06.201242,2025-12-17T04:58:06.201242,IN_PROGRESS,Soon chance open any. Leg ready this let actually.,Michaeltown,WELL,-41.877016,-28.442743,44071.47,"2 days, 0:00:00",MEDIUM,62c662f7-b719-4960-8734-6af4d36499e8,4834abaa-4e84-40a0-99ac-22d1de101e14,48.21,hours,True,DAILY,,,2025-12-08T23:54:21.616788,2026-04-14T22:27:58.651125,093f1b32-a20b-42ea-b71f-58fadeb86814,add55726-03ef-4479-ab97-eaa6f2a39163
54925bb0-d6a4-4a62-a7a9-7c07ac917b5e,17732c75-269b-4b58-ab32-71c952da0df9,dedd0eb6-b2fc-496d-994f-79ecc414767e,2024-10-02T08:53:14.888509,,"Each station education. Into skin song technology fast suffer but.
Environment worker wrong remain fight put. Lot himself break ok chance. Everything head mouth kitchen only police board.",2024-10-02T23:39:55.550711,2024-10-06T23:39:55.550711,IN_PROGRESS,Tv best kid economic theory. Situation writer evidence one determine own either.,Schmidtland,WELL,-78.4056515,-174.444122,47356.9,"3 days, 0:00:00",MEDIUM,80a4fcca-af6c-40f6-b3a1-d30b1c812c5d,eddc4c1a-19a5-4a63-9507-8896001501c0,88.67,hours,False,,,,2024-10-01T01:32:26.297742,2026-04-14T22:27:58.651402,b0861748-937c-4a0e-bedb-7b573c3d62fb,83773906-9148-49d0-98a9-9f9c13e1debc
33e1b5c4-133a-40ec-821e-2da21f735ef7,90914c41-8379-4db0-8e87-d7a9abf1cd74,a6e5f95d-dc4c-474a-a175-bc234e9f170d,2025-05-28T03:06:18.092253,,"Situation official old answer tell. Cut soon number information laugh our.
President station consumer free buy. Single put drive begin kitchen record.",2025-05-29T08:03:49.615596,2025-06-02T08:03:49.615596,HALTED,Student network past part feel top. Exist particular large agency view once.,Chaveztown,WELL,28.03621,-70.096581,48097.97,"2 days, 0:00:00",MEDIUM,da444aba-c9f9-4714-9f03-d8e5de0db2b9,c023f54c-5638-484f-ad7e-cff78fc43d6b,71.43,hours,True,DAILY,,,2025-05-26T17:39:23.982403,2026-04-14T22:27:58.651597,eb9ae93e-8308-4d52-88f4-9bc07716f433,107f7953-bb61-489c-95b3-140a62297e21
e1e48255-98b9-4e6b-8bfc-c4e9564d2292,69f88d89-cd4d-4b68-9ea5-d47749a320b4,356ce91e-3d69-4c12-b975-4b312ca62840,2025-07-03T11:49:07.145641,,Series sign benefit coach light. My whom anyone while short nice me.,2025-07-04T18:14:07.850126,2025-07-07T18:14:07.850126,IN_PROGRESS,Wear dinner stock near significant. Feeling key around situation.,Lisamouth,GPS,-26.33599,-122.829295,49110.8,"1 day, 0:00:00",MEDIUM,70f10b6a-77b2-4d81-b3d7-6890872d6399,c023f54c-5638-484f-ad7e-cff78fc43d6b,32.54,gallons,True,WEEKLY,,,2025-06-30T15:32:06.345440,2026-04-14T22:27:58.651844,289a6adc-4cc7-403b-964c-787bc7dcb4e3,005cb232-febc-4e23-a9d4-149ad3409b95
64665a4d-afc0-4299-a134-d7fecefad491,5ced5175-6a4b-4acc-aaad-6eee39aba902,fe0211e2-1730-4140-a5c5-59d09ab75793,2025-04-21T04:26:52.217643,2025-04-28T03:56:51.210079,Big me between trade. Physical design bag surface available car. Born amount lay foreign majority.,2025-04-22T13:51:16.498244,2025-04-26T13:51:16.498244,CLOSED,She hope decade maybe. Think land soon political then between wear.,Lake Vincentton,GPS,62.1794595,56.532858,37624.88,"3 days, 0:00:00",MEDIUM,62c662f7-b719-4960-8734-6af4d36499e8,4c95d91b-4137-4b45-b42a-a196743fc247,66.28,loads,True,WEEKLY,,,2025-04-20T19:14:01.991736,2026-04-14T22:27:58.652056,813fe994-3cbe-42b0-ae9b-d91688965c58,3f8b1c12-b3fb-4c94-b224-8dab3422df89
37824dc6-a0db-4011-b38a-51348b53b0ce,00321811-ce92-494f-a69e-9f15b650ca5f,75c7e517-dddd-43b4-b8d5-e7eb922003e3,2025-07-06T19:27:57.938643,,"Easy run guy especially action player truth. Investment within soldier three.
Own up clearly science.",2025-07-06T22:40:55.057684,2025-07-10T22:40:55.057684,HALTED,Some consider add push bank concern. Drive admit civil attorney dog who technology.,North Natashamouth,WELL,-43.9395385,-51.492898,19310.84,"1 day, 0:00:00",HIGH,46538246-445c-4643-b106-c4bb91b94703,eddc4c1a-19a5-4a63-9507-8896001501c0,67.52,visits,False,,,,2025-07-03T20:26:45.784511,2026-04-14T22:27:58.652225,489b9804-6173-49c9-8b71-c7a5f6fc2d44,32c44d1b-d96b-448a-9c3f-9d25a57a62b2
c5f6323d-1f14-49a8-b1e9-ce6c26deff41,50c30f52-4308-407c-9eb4-b29e37f557ed,356ce91e-3d69-4c12-b975-4b312ca62840,2024-09-13T08:59:06.863578,,"Little relate nice save. Wide data yard smile character. Worry book never sing when relationship go.
Change everybody sister hotel outside way. Like best heavy but seven animal.",2024-09-14T12:09:40.233729,2024-09-16T12:09:40.233729,REJECTED,Take member late minute town. The data sister those sound include during space.,Port Ronald,GPS,-35.5762285,170.792187,27842.94,"2 days, 0:00:00",MEDIUM,67ecc6c7-eaa5-48fb-8d16-0122a790562a,3f4dd684-ecaa-4e82-8ad1-5d2ad55c4b71,27.4,visits,False,,,,2024-09-10T20:54:02.507133,2026-04-14T22:27:58.652408,6999bbaf-2b2f-4250-af2d-c697969bf13b,462b7980-f1b7-4b17-be19-49dbded6835a
b8a9ec87-6df6-4ec4-a451-28d20cccac5c,69f88d89-cd4d-4b68-9ea5-d47749a320b4,fe0211e2-1730-4140-a5c5-59d09ab75793,,,"Sister machine land drop his yard exist. Go prevent change others interesting a election room.
Get green significant daughter. Explain state opportunity recent.",2024-09-28T16:03:26.234771,2024-09-30T16:03:26.234771,UNASSIGNED,Possible stage pay break every nice. Value speak pay never customer thus.,North Christina,WELL,-27.5233135,48.843693,9266.81,"1 day, 0:00:00",LOW,80b84377-66d7-4ef6-b04b-60b873aae793,4c95d91b-4137-4b45-b42a-a196743fc247,57.62,gallons,True,ONE_TIME,,,2024-09-26T21:55:01.249814,2026-04-14T22:27:58.652572,bb7726dc-e994-4045-a8a2-dba9fa6a7163,2543cc97-0125-4990-9a29-10f28865bb99
663d666f-6263-477d-a9ec-522576e87b1e,90914c41-8379-4db0-8e87-d7a9abf1cd74,a6e5f95d-dc4c-474a-a175-bc234e9f170d,2024-10-22T21:33:03.216061,,"Other free southern nation return risk two. Land task space size month lawyer. Head several born part.
Ten eight be detail go although.",2024-10-23T00:20:21.069756,2024-10-28T00:20:21.069756,REJECTED,Hotel and bed no kid somebody. Any figure travel maybe memory current bag.,Dawnshire,WELL,69.678725,-99.032562,31734.64,"2 days, 0:00:00",HIGH,da444aba-c9f9-4714-9f03-d8e5de0db2b9,3f4dd684-ecaa-4e82-8ad1-5d2ad55c4b71,11.48,hours,True,MONTHLY,,,2024-10-21T16:54:17.197233,2026-04-14T22:27:58.652754,cd5e7cd9-eb17-4960-ac2c-7f7ee93bd3b5,0bdb409a-c9ea-4fbe-acaf-b66412a4d08f
ad9274ad-039a-49f8-8217-0875c4fe9612,00321811-ce92-494f-a69e-9f15b650ca5f,75c7e517-dddd-43b4-b8d5-e7eb922003e3,2024-10-24T05:33:39.245125,,"Itself where product. Determine whatever history support provide.
Source bad visit rate keep of affect. Who start memory career blue not heart. Continue some Congress himself close half.",2024-10-25T10:08:29.019429,2024-10-26T10:08:29.019429,IN_PROGRESS,However close American method six voice. Wear situation claim another before could organization.,Donaldland,ADDRESS,-66.6134025,138.289154,21931.98,"3 days, 0:00:00",LOW,46538246-445c-4643-b106-c4bb91b94703,eddc4c1a-19a5-4a63-9507-8896001501c0,21.81,hours,True,ONE_TIME,,,2024-10-22T06:55:52.276615,2026-04-14T22:27:58.652928,7fc74b0d-90f4-435c-82fc-21e6f6818821,c80683a0-f185-46a9-a8b1-67f49f5c2b82
f2e40d7a-0941-43f8-9fb4-73dcbaaea81b,17732c75-269b-4b58-ab32-71c952da0df9,271b3705-a1b9-40e4-9dc3-267b73539f55,2025-02-26T21:54:25.573711,2025-03-05T01:20:38.115119,"Here animal scene deal in. Interest try lot listen American.
Whole anyone beat analysis forget both. Majority lead she data. Simple century within PM president wind.",2025-02-27T13:12:27.429652,2025-03-03T13:12:27.429652,COMPLETED,Read kid kid. Family baby then keep product chair event.,East Donaldland,ADDRESS,25.2457825,-117.439832,14759.14,"3 days, 0:00:00",HIGH,db487e36-0dec-42eb-b1c6-8a1ea375a2c5,b67890c1-ebe9-46e1-ae62-8f124981c06c,86.64,hours,True,MONTHLY,,,2025-02-26T19:38:42.704815,2026-04-14T22:27:58.653116,6e65fd88-869e-4fe7-8a24-62cac597098c,3948b296-e546-4030-bccd-62e2151206dd
0db5ce76-778f-4678-a4ec-57b7a904c786,5ced5175-6a4b-4acc-aaad-6eee39aba902,356ce91e-3d69-4c12-b975-4b312ca62840,2025-08-20T17:11:31.380837,,"Nothing price office everyone. Structure red successful network former model.
Responsibility rich guess war beat peace. According minute bring house collection reveal.",2025-08-22T01:00:56.508496,2025-08-24T01:00:56.508496,IN_PROGRESS,Occur too authority year civil head serve. Least low if cell industry.,Port Oliviaburgh,GPS,-14.0334505,-176.279518,35148.37,"3 days, 0:00:00",LOW,67ecc6c7-eaa5-48fb-8d16-0122a790562a,ac86be1d-d7b3-4c92-8b98-7ec02635ae30,19.63,loads,True,DAILY,,,2025-08-20T05:18:57.887012,2026-04-14T22:27:58.653315,fceeda85-bb81-4710-8aad-83a16582b891,26d7bb4e-a611-4b84-9934-fb91e4846700
27d464d9-333e-439b-bd8d-50212c2d6ba7,69f88d89-cd4d-4b68-9ea5-d47749a320b4,fdbcc9da-c12c-4210-9472-0b40b76e6448,2025-08-26T00:26:43.328912,,"Control dream well wonder full move. Sure worker challenge.
Special thousand close western much. Argue strong agent voice Congress message.",2025-08-27T04:22:23.147784,2025-09-01T04:22:23.147784,CANCELLED,Break yet model ready professional address day. Day school person available teacher which fly.,North Crystal,WELL,55.8427205,-27.731682,12922.02,"2 days, 0:00:00",HIGH,86b3f7a6-231b-4b4b-ab72-31be724e3a51,b67890c1-ebe9-46e1-ae62-8f124981c06c,24.84,hours,False,,2025-08-27T19:54:50.206626,Resource unavailable,2025-08-23T16:34:52.749121,2026-04-14T22:27:58.653520,58661ac1-3a13-4a79-b261-e625fc9b1860,f7d07ba5-8911-4075-a9ad-e1b93efdb6d3
9ca4760b-3ea3-4236-8c07-7f672ad73c18,17732c75-269b-4b58-ab32-71c952da0df9,fdbcc9da-c12c-4210-9472-0b40b76e6448,2025-10-06T01:26:22.432982,,Early show professor no senior future option ever. Just Mrs movie. Receive move economic build. Choose cut oil reason car prepare American.,2025-10-06T11:18:02.495486,2025-10-07T11:18:02.495486,IN_PROGRESS,Practice case fast former local. Summer test star eight surface stop. But in suddenly now although.,Port Meganstad,WELL,75.866926,-160.681293,17539.05,"3 days, 0:00:00",LOW,f2277196-af58-45ae-93cb-9259f5fc3bd2,4c95d91b-4137-4b45-b42a-a196743fc247,62.36,visits,True,MONTHLY,,,2025-10-04T13:20:15.551368,2026-04-14T22:27:58.653733,ce693352-d9d5-47f2-8bca-82d6759d8a21,01d0201b-a79a-46ab-92b8-0cb6b91e99eb
7d5e2a3c-d518-4af1-8d6f-6f561e9f23d6,90914c41-8379-4db0-8e87-d7a9abf1cd74,544d6c6a-b83d-4633-b842-e6fab7e2bc69,,,Interest between allow recognize billion job majority. Wife record agency me.,2026-01-12T09:37:38.535820,2026-01-13T09:37:38.535820,UNASSIGNED,Chair pull item position data. Expert by must kitchen study.,Port Paul,GPS,67.6990445,-138.4404,35054.76,"3 days, 0:00:00",HIGH,20d9b627-c980-4e80-a914-7b619d6ce63a,b67890c1-ebe9-46e1-ae62-8f124981c06c,95.97,days,False,,,,2026-01-08T23:52:24.983817,2026-04-14T22:27:58.653952,a96799d0-00b0-4746-a41d-510e70ff7d0c,f1f1ab4c-c19f-47c9-bb84-25cfe7a3f4d4
1ce0295a-5ae2-45f7-ba9a-e5eef98398a5,90914c41-8379-4db0-8e87-d7a9abf1cd74,d33031c3-bb47-4170-a667-97d3e7826c55,2025-11-18T05:21:45.195317,2025-11-22T19:43:24.940507,Responsibility son couple this. Draw generation apply away sit strong child. Song whom public may form spring sing. Similar race school a direction threat right.,2025-11-19T14:02:46.502995,2025-11-22T14:02:46.502995,CLOSED,Line have easy indicate police where. From poor plan.,Lake Lydialand,GPS,-0.2803715,178.484456,38288.92,"2 days, 0:00:00",HIGH,20559f9c-a3d1-4cb2-bf81-3b4780ed02a1,4834abaa-4e84-40a0-99ac-22d1de101e14,99.91,gallons,False,,,,2025-11-15T16:47:14.794025,2026-04-14T22:27:58.654127,0305fb8e-1853-4ad4-9f8f-9bc5be8ed562,a608adb5-75f2-450e-bdd4-fce89b716ef5
acfd78cf-8f72-4cc0-8aa6-531311e325ad,50c30f52-4308-407c-9eb4-b29e37f557ed,fdbcc9da-c12c-4210-9472-0b40b76e6448,2025-10-29T11:34:04.051021,,Hotel box director lay conference cut partner policy. Type technology character under tonight something democratic. Talk everyone enjoy join article. Always decide size act hit difference.,2025-10-31T09:56:44.593902,2025-11-04T09:56:44.593902,REJECTED,Stand everybody easy positive real official street.,East Tracy,GPS,-79.4375665,-68.201879,16556.2,"2 days, 0:00:00",MEDIUM,86b3f7a6-231b-4b4b-ab72-31be724e3a51,59387f64-573a-4d23-bc4c-94103f3802ff,87.0,visits,False,,,,2025-10-26T17:08:56.011407,2026-04-14T22:27:58.654370,f7d07ba5-8911-4075-a9ad-e1b93efdb6d3,b0861748-937c-4a0e-bedb-7b573c3d62fb
e129d26b-671a-4b0e-9943-39ccfaca52ec,17732c75-269b-4b58-ab32-71c952da0df9,922982f5-4278-444a-9836-a8797cdb696d,2025-09-03T22:11:49.475683,,"So animal paper west alone mother own both. Meeting read watch yourself provide nature.
Federal seat reason knowledge certain office.",2025-09-05T19:50:43.434872,2025-09-06T19:50:43.434872,CANCELLED,Quality reality cultural church nature. Because safe phone phone audience large argue finish.,East Melissa,GPS,-75.009924,176.755524,49493.23,"3 days, 0:00:00",LOW,3fff67a1-02f4-497e-adc9-174104035e62,b67890c1-ebe9-46e1-ae62-8f124981c06c,40.54,hours,False,,2025-09-04T14:29:34.459699,Weather delay,2025-09-03T05:30:35.669934,2026-04-14T22:27:58.654575,3830d64b-14c8-4c52-88ad-5c03ae08642f,00e7eff1-bdf4-4967-9c2e-06573b1414b3
a438be23-d03c-484b-af6d-bdc63f1c0c20,17732c75-269b-4b58-ab32-71c952da0df9,60815a70-5acd-44c4-a751-93e113cd6c10,2025-04-08T09:39:36.240077,,"Make success vote choose. Alone economic anything most.
Prevent large young executive push final. Stay statement close movement. Health blood evidence thought house.",2025-04-10T07:28:01.970245,2025-04-12T07:28:01.970245,IN_PROGRESS,Hold campaign kid citizen beautiful. Deep six poor mouth group.,Jenniferburgh,WELL,-86.2004755,-67.809332,23878.27,"2 days, 0:00:00",MEDIUM,0c481a95-02a4-4df0-ace2-91131d50d01a,59387f64-573a-4d23-bc4c-94103f3802ff,20.58,visits,True,MONTHLY,,,2025-04-07T15:03:35.928891,2026-04-14T22:27:58.654760,9c76dfc0-5be1-491f-a212-6ba4936bf8f4,60a94ef4-3deb-4a7e-ab82-2d3a6530e4d3
5070154e-05f5-40ff-99c5-e83defb30b97,50c30f52-4308-407c-9eb4-b29e37f557ed,687456b3-4e9b-455e-9e96-0649a8fef3d4,2025-02-26T16:31:24.519443,2025-03-03T12:17:23.135545,"Population form instead something record type. Security land cup tell spend process six.
Expert management important give position still. Create claim movement stay recognize scene economic customer.",2025-02-27T05:11:44.629503,2025-03-03T05:11:44.629503,COMPLETED,Old though author senior think. Congress more decade admit value establish.,East Cassandra,ADDRESS,-29.147773,178.336521,21926.38,"1 day, 0:00:00",MEDIUM,220c8898-632d-4c46-a5ae-93aacbcd3080,ac86be1d-d7b3-4c92-8b98-7ec02635ae30,96.94,hours,False,,,,2025-02-25T08:20:32.282428,2026-04-14T22:27:58.654973,7e437639-aa7f-4a66-98de-1dfda90ee89a,b3f3a2d4-b149-4b1b-af51-2b6ec1cd836c
9104eae6-a7ba-4860-a9f1-ab93fba0e700,90914c41-8379-4db0-8e87-d7a9abf1cd74,cd2ffd86-4229-4cf5-8196-bbc447762911,2024-05-11T00:27:00.596234,2024-05-19T10:20:56.895495,Account wish interesting practice. Expect assume herself store while into. Yes either challenge peace wide perform. Poor vote community together value argue me.,2024-05-12T22:48:42.927899,2024-05-17T22:48:42.927899,CLOSED,Us can rest threat. Full represent visit seat fund decision herself. Another set that movement.,South Michaelton,GPS,-66.0922135,-0.416521,26178.75,"2 days, 0:00:00",LOW,833848ff-889c-4e1b-a898-e557b637cc6e,4834abaa-4e84-40a0-99ac-22d1de101e14,42.22,hours,True,DAILY,,,2024-05-10T21:28:33.680361,2026-04-14T22:27:58.655187,0bc048cc-129b-49f7-a7d6-567b8d39cb3d,c0f2da53-a9e2-4fe4-9c21-0ff1fe868d46
806d8643-7806-46e5-9c59-14570a7a9e89,17732c75-269b-4b58-ab32-71c952da0df9,271b3705-a1b9-40e4-9dc3-267b73539f55,2025-12-07T05:40:18.894443,,"Need its reality around gas your common notice. Degree eye number pay half individual there.
Community discuss must reveal price program alone. Land itself point agree low.",2025-12-08T08:22:16.431107,2025-12-13T08:22:16.431107,HALTED,Trade although rate today send figure technology Mrs. Require personal show reflect.,Castrofurt,GPS,-50.3440965,104.003128,26717.02,"2 days, 0:00:00",HIGH,db487e36-0dec-42eb-b1c6-8a1ea375a2c5,4c95d91b-4137-4b45-b42a-a196743fc247,37.96,gallons,True,DAILY,,,2025-12-05T10:03:04.085191,2026-04-14T22:27:58.655458,24331894-5e08-4675-9daa-ac32ae57144d,fbed279e-cc18-49fe-8c97-a83fbbded86f
06c98d65-99d7-4074-b951-849885cb8761,45d86630-0ae0-48cf-91da-da4e2553be12,dedd0eb6-b2fc-496d-994f-79ecc414767e,2025-05-15T13:13:46.424483,2025-05-19T19:21:34.470355,"Opportunity human go economy those machine yet. Inside phone memory better. Floor bar than not student sea read director.
Task explain join page game remain view.",2025-05-16T13:29:39.306026,2025-05-19T13:29:39.306026,CLOSED,Ago job relationship PM reason. Service modern before again particularly. Make however scientist.,Stevetown,GPS,57.976914,-124.702879,47256.55,"3 days, 0:00:00",LOW,4ce2e342-fd3f-4bbe-aad7-bfc3c0e43195,4c95d91b-4137-4b45-b42a-a196743fc247,91.1,loads,True,DAILY,,,2025-05-12T15:28:28.992863,2026-04-14T22:27:58.655661,107f7953-bb61-489c-95b3-140a62297e21,a718b2a4-80d0-4665-9a01-10cf8a0a5cf9
f75dbb33-b3e3-4d85-bbc0-3195720417de,be8a628e-281b-4291-9256-99fe58793399,dedd0eb6-b2fc-496d-994f-79ecc414767e,2024-10-31T20:31:18.906624,,"Window require worker mean shoulder. Source reason red claim its very.
Single not degree since brother walk upon. Or avoid person. Difference few itself question.
Quite including west.",2024-10-31T22:19:23.557588,2024-11-05T22:19:23.557588,REJECTED,Foreign because tend behavior south meet. Concern nature until imagine.,Stevenbury,GPS,57.3684205,90.424002,48290.96,"3 days, 0:00:00",HIGH,4ce2e342-fd3f-4bbe-aad7-bfc3c0e43195,ac86be1d-d7b3-4c92-8b98-7ec02635ae30,97.14,gallons,True,DAILY,,,2024-10-28T21:56:07.202969,2026-04-14T22:27:58.655844,1cc8b50c-98b8-410f-8bab-2ac92a4b37f8,56e1a251-fdd4-4668-b978-ec1ed85ffb34
f536e824-68e1-4810-9a87-f96d3c9e32b1,50c30f52-4308-407c-9eb4-b29e37f557ed,356ce91e-3d69-4c12-b975-4b312ca62840,2024-05-30T12:26:28.253248,2024-06-05T18:05:37.936731,"Individual other together low special tax thought.
Sometimes tough her loss listen education. Threat notice age. You peace offer.
Figure unit stuff growth head. Short past to born man Mrs.",2024-05-31T05:33:50.939101,2024-06-05T05:33:50.939101,CLOSED,Share training would forward strong. Answer country yard later should government trip.,East Frank,GPS,-9.926911,123.556938,25792.54,"1 day, 0:00:00",MEDIUM,14a13488-5719-43f4-aad4-f06901c597f5,ac86be1d-d7b3-4c92-8b98-7ec02635ae30,75.27,days,True,WEEKLY,,,2024-05-28T05:02:22.664642,2026-04-14T22:27:58.656082,0b9551dd-9fec-481a-a3b1-9bf73fa8d8e1,2c302e5a-ee9e-47eb-83a8-fc5483be07a2
e884cddf-3770-4fde-bd7a-dc064645ef2d,00321811-ce92-494f-a69e-9f15b650ca5f,dcf8d00a-1526-417c-8284-f84cf5b1252f,2024-05-21T20:19:10.799490,,Heavy from significant let fast. Approach down standard professional cold mother space. Item suggest idea bad yard contain. Piece trial standard wall approach security you energy.,2024-05-22T18:08:44.150287,2024-05-23T18:08:44.150287,HALTED,Minute common some born tree yet billion international.,Kellytown,GPS,45.9707485,51.267931,38982.94,"2 days, 0:00:00",HIGH,153c28ed-f5be-4a23-8422-0fbe6104a7b9,59387f64-573a-4d23-bc4c-94103f3802ff,15.17,hours,False,,,,2024-05-21T15:23:21.522200,2026-04-14T22:27:58.656285,3948b296-e546-4030-bccd-62e2151206dd,9c872a46-9a54-42e4-9954-1ab3550d8b65
