work_order_id,assigned_vendor,client_id,assigned_at,completed_at,description,estimated_start_date,estimated_end_date,current_status,comments,location,location_type,latitude,longitude,estimated_cost,estimated_duration,priority,well_id,service_type,estimated_quantity,units,is_recurring,recurrence_type,cancelled_at,cancellation_reason,created_at,updated_at,created_by,updated_by
726891c6-55b7-498a-87c8-fc4442f88d1d,23a09d52-0fe3-421e-bb91-3202f9a30091,6caa3fb5-c49a-48dd-8c14-1cc1865c5282,2025-08-17T09:33:51.467854,2025-08-22T07:08:14.802867,Money thousand eat responsibility care better figure. Move effort sister back well management. Nature address think area society rich. American already pass method cold father.,2025-08-18T04:23:09.091698,2025-08-21T04:23:09.091698,completed,Sister same investment on. Act try tough enjoy. I deal exist end.,Jenkinsstad,ADDRESS,-17.6939745,-64.068791,34648.48,"2 days, 0:00:00",MEDIUM,caf5c300-ee0a-43ab-9527-4bf2aebde206,4163a5d4-955d-4a25-abd7-854c4e83b2ac,57.46,gallons,True,WEEKLY,,,2025-08-15T01:41:49.845762,2026-04-11T23:28:35.723691,d1706c0c-2e1a-4448-9d78-5b06e9b782e7,482bae26-f116-4a8d-bc9e-458bc735f958
c94e75c1-095e-4d46-aaf8-cabc449ff907,06d009b4-72da-4d9d-b3b7-57e8599d7117,04c01860-11e0-43ee-ace0-ffb53146f1b0,2024-07-10T10:26:16.579319,,"Improve dream look artist project tax wait bank.
Week meet candidate also. Do across accept thought discussion.",2024-07-11T17:07:52.324685,2024-07-12T17:07:52.324685,rejected,Rich bed over last unit level. If investment hard daughter learn civil.,Escobarmouth,GPS,-37.7806795,31.265497,2084.39,"3 days, 0:00:00",HIGH,746ff6e9-815d-4d37-ace7-b49f52121662,bbbbe58c-e42d-45df-9ddb-4fe9798ad349,41.45,days,False,,,,2024-07-10T03:16:50.324752,2026-04-11T23:28:35.723886,ff180759-0dfc-4cd9-9c57-50ed025740ac,e4724943-13e3-4eba-ad17-5b21b1853206
1cd7346c-751b-4b81-b53c-7ee36ec54fae,133f90fe-7e31-4d27-8cda-4d82237347ba,85a258d7-b0ef-4d6b-90dc-5661b7c3d48c,2025-05-14T09:57:42.603022,,"High might protect time seat doctor. Rock Republican rich them hard recently political throughout.
Partner morning nation. Peace her lawyer very.",2025-05-15T19:41:46.136590,2025-05-18T19:41:46.136590,halted,Within bill yet success. Training drop establish action.,Staffordfurt,WELL,31.3947725,128.171675,38480.85,"3 days, 0:00:00",LOW,cd0cbf2b-d8b7-4042-89e5-d608743d6c06,6bc12c93-a9f7-4d75-b811-9bebbf7039cb,64.56,visits,False,,,,2025-05-11T12:13:55.346711,2026-04-11T23:28:35.724067,d1b5f06a-4c16-4aff-ad9b-6ee2921958a1,a253d8a7-65ec-437a-9891-a33e38b7717a
c35bf724-23d8-4f8a-82d0-255cf05d7646,23a09d52-0fe3-421e-bb91-3202f9a30091,285f3784-ef10-4b42-ae2b-9ae729cb8219,2025-10-30T04:59:13.986497,2025-10-31T19:50:52.440916,"Dream audience describe I watch degree. Option voice hair listen over low.
Big join thought information both sign. Civil role sport blue art offer page affect. Be wind sometimes drive imagine.",2025-10-30T09:41:27.026353,2025-10-31T09:41:27.026353,completed,Population yard sell early land determine arm. Rock image able accept.,North Timothyton,GPS,78.0821935,10.51409,26518.9,"2 days, 0:00:00",HIGH,614a2a2e-591b-4e4a-929f-a1b660400fff,4163a5d4-955d-4a25-abd7-854c4e83b2ac,69.05,hours,False,,,,2025-10-29T03:34:23.385315,2026-04-11T23:28:35.724255,ccf3d564-e170-4773-9cc0-077e6a36a495,d98aa1ad-ae1f-47fa-aea3-c566d8d7894e
160acc54-e375-405c-89bf-8746f567888b,06d009b4-72da-4d9d-b3b7-57e8599d7117,04c01860-11e0-43ee-ace0-ffb53146f1b0,2025-02-11T23:32:10.217369,,"For southern sign ever budget.
Government compare another teacher general. Firm computer natural develop. Form whom right return seven home. Star either simply ahead later pattern best.",2025-02-12T13:42:14.514464,2025-02-15T13:42:14.514464,assigned,Radio along local none we. Subject expect west real pattern happy positive.,Jessicaberg,GPS,80.056982,-71.149907,36405.25,"3 days, 0:00:00",LOW,746ff6e9-815d-4d37-ace7-b49f52121662,aae0e4d8-2cec-412c-b24f-bd332e960900,2.49,days,False,,,,2025-02-09T05:04:27.108352,2026-04-11T23:28:35.724468,b5e6b9d5-245a-4a28-953a-5e23c63ec862,e13151df-73d6-4695-886c-12c182e9d5d5
11249fc1-06d9-48de-af90-78dbba22fe1c,23a09d52-0fe3-421e-bb91-3202f9a30091,285f3784-ef10-4b42-ae2b-9ae729cb8219,2025-12-01T20:28:07.564908,,Little yeah skill gun. Choose never item culture body. Administration sister capital lot. Reach return visit impact low.,2025-12-01T22:22:43.215289,2025-12-04T22:22:43.215289,rejected,Order success method black service design. Join though represent camera. Set interview cultural.,Kellystad,ADDRESS,79.8069245,-94.342713,40736.58,"1 day, 0:00:00",HIGH,614a2a2e-591b-4e4a-929f-a1b660400fff,4163a5d4-955d-4a25-abd7-854c4e83b2ac,89.29,days,True,ONE_TIME,,,2025-11-29T20:48:06.617841,2026-04-11T23:28:35.724714,c7c4e736-35ed-41bf-b69c-55c938913b4e,0ebad35f-113b-4ac1-8343-67a835bca3a8
5dec10cc-dab7-432b-9689-80ae2fe0103d,133f90fe-7e31-4d27-8cda-4d82237347ba,13740cf2-33c5-492f-aedf-c2319bcbafa2,2025-04-26T12:37:27.800516,,"Board page difficult officer difficult. Control behavior drop whose might information. Medical get doctor Mrs piece across. Worker southern talk high any.
Image day performance ability.",2025-04-26T14:46:28.781747,2025-04-28T14:46:28.781747,halted,Call culture contain prepare several bed. Plant staff contain look heavy rich.,New David,ADDRESS,-79.296365,-92.655512,31570.11,"3 days, 0:00:00",HIGH,42e8757c-99d8-490a-9059-3d47390910ba,d1e18f8f-1284-4e35-8fff-1745bbfa3935,10.44,visits,False,,,,2025-04-26T07:37:58.068932,2026-04-11T23:28:35.724919,23739563-3f88-4175-a3a9-d459d2b6900f,dd67ac73-2599-407f-beeb-65fa791e1cad
d6053080-f2f1-46ee-8c58-521c88761915,0d4458dd-5ad6-4786-9888-2bff9f05336e,d96e5168-c48b-4372-9992-3d6291244bfb,2026-02-02T19:19:41.036566,,Change far prove ball. Capital near reveal might military ready wide. Program minute color contain.,2026-02-03T10:25:18.959035,2026-02-04T10:25:18.959035,halted,Save issue as true cut rest history. Study score personal may.,Port Brian,GPS,89.379717,-146.110351,15893.61,"3 days, 0:00:00",LOW,31468659-48ad-4cc6-97bb-b2e7a4d427b5,d1e18f8f-1284-4e35-8fff-1745bbfa3935,76.04,gallons,True,ONE_TIME,,,2026-02-02T09:48:24.106578,2026-04-11T23:28:35.725119,5633c64b-6006-47a6-90a5-bb3d3ed8752d,f21f04af-84a5-49cc-a700-13154c0e5d1c
e08a30a4-4eef-4b2b-b0cb-f91e805db713,c2271158-1a66-4531-9772-0e175585c41f,a21dbcb0-9f45-4f8b-a280-0920b3905c61,,,"Second force newspaper artist trouble rich. Go stage door address. Especially former way trade charge.
Ago yeah reduce analysis may.",2025-04-28T08:03:16.805043,2025-04-30T08:03:16.805043,unassigned,Yourself fire affect.,East Markville,WELL,-41.7021725,172.819515,46508.94,"3 days, 0:00:00",MEDIUM,ca44af96-b4dd-45c8-8083-5c340606e283,d1e18f8f-1284-4e35-8fff-1745bbfa3935,44.41,visits,True,ONE_TIME,,,2025-04-27T07:17:33.371659,2026-04-11T23:28:35.725328,e06b1ac0-671c-42cc-8a90-a356380e2340,c069c4ce-13e8-4704-8d73-47aab0bcf6e1
234d359d-6177-474a-8fbd-fbf554e800b2,c2271158-1a66-4531-9772-0e175585c41f,95d96392-189d-4782-8790-5c23325e8a0c,2025-02-08T18:22:49.084577,,Rest new without go perhaps soldier pick huge. Successful hotel image show cultural interest create. Finish chance successful national political cover hope.,2025-02-08T18:43:05.769776,2025-02-13T18:43:05.769776,in progress,Condition south oil audience cultural. Them ability number animal which blue. Child always choose.,Port Melindabury,WELL,-47.2109895,112.253056,10059.55,"1 day, 0:00:00",LOW,d33f52a8-74ca-4fb9-9fd0-9831f1d31216,4163a5d4-955d-4a25-abd7-854c4e83b2ac,96.7,loads,False,,,,2025-02-06T18:41:36.612291,2026-04-11T23:28:35.725526,7232e764-c0bc-4ae4-afd1-f2ca5e98790e,57d91844-2028-4f2d-b388-05b7bc049f76
94399fbf-a9df-4d2f-9a84-e62568b737ff,133f90fe-7e31-4d27-8cda-4d82237347ba,6caa3fb5-c49a-48dd-8c14-1cc1865c5282,2026-02-08T16:08:34.705921,,Such increase professor paper whom quickly color. Six traditional soldier arrive appear. Campaign generation reality indicate.,2026-02-10T07:32:02.776497,2026-02-12T07:32:02.776497,in progress,"Approach rate chance laugh dark.
Movement event shoulder remain. Member account to those grow.",Diazfort,WELL,-45.8191425,-68.950254,14524.09,"1 day, 0:00:00",MEDIUM,0b142393-3ab0-47c8-a628-534dcd0be4dd,d1e18f8f-1284-4e35-8fff-1745bbfa3935,19.3,hours,False,,,,2026-02-06T02:42:44.690175,2026-04-11T23:28:35.725708,548d52dd-0449-4448-a6f9-bd7bc0ea5a41,ba5c0aaa-fbcd-41fe-bb3a-c42dc8ba9dea
66b1934e-dd54-4378-b5a3-aa0ea148b7fa,e6da2d90-c782-409c-8616-856c4871d2ca,f8fc3e50-abea-49d4-baba-b152aaaf1932,,,"Partner pretty charge no. Ever detail team major from.
Network story southern moment anything. Smile can voice discover.",2024-06-20T02:38:22.230745,2024-06-23T02:38:22.230745,unassigned,Scientist together enough audience. Letter should church drop. Yes response my.,Kristenchester,GPS,-4.833112,-107.471195,7561.14,"2 days, 0:00:00",LOW,3cedfd0b-b0d9-47ca-9c5c-5503ad889641,4e7b5962-dbd8-452f-81b7-4aee649a667c,39.39,gallons,True,DAILY,,,2024-06-16T18:24:23.874460,2026-04-11T23:28:35.725896,cd0ddf93-2150-48f1-a044-8f9c75964ffc,21d7facf-3262-432b-b88c-3fe9232a8410
07b1a1f0-bf68-4a7c-839d-355cfe60d9ca,133f90fe-7e31-4d27-8cda-4d82237347ba,2d4a9276-b730-4ead-b37c-3d5a209278a8,2024-11-21T03:04:21.211469,2024-11-25T02:24:07.917660,"Evidence around amount themselves camera. Nor his trial add.
Experience up successful happen. Law research offer stage audience. Five reason accept clear after deal office.",2024-11-22T05:55:55.711903,2024-11-24T05:55:55.711903,closed,Design product but human democratic. Discover decade side create. Manager office fall policy.,Jessicaton,GPS,-59.093944,-32.01547,13081.48,"2 days, 0:00:00",LOW,c666fc01-b9fa-4581-b129-cb0a7b7fe3f4,d1e18f8f-1284-4e35-8fff-1745bbfa3935,75.45,visits,True,DAILY,,,2024-11-18T15:25:57.902869,2026-04-11T23:28:35.726146,547d8b8d-901a-43b8-9614-0795b63576c5,c3d8d545-3cae-4aee-9117-dd4c0db5610e
58737ced-cf8a-45f1-9a0e-e9b43c6da26a,68b3203f-7c06-4786-8e92-f50ded6dd24f,a21dbcb0-9f45-4f8b-a280-0920b3905c61,2026-01-28T19:00:51.349127,,"Nothing environmental understand. Work cause term stay. Full left inside goal.
Glass politics whom high skin. Physical wear why his perform.",2026-01-29T04:35:42.652142,2026-01-31T04:35:42.652142,assigned,Between anyone they sea pattern that some. Medical story hospital your. Even dream piece.,Scottton,GPS,19.44707,82.13774,23327.24,"1 day, 0:00:00",MEDIUM,8dd3dbec-b62d-4b0e-8c91-5b5ab3f72214,aae0e4d8-2cec-412c-b24f-bd332e960900,73.95,loads,True,WEEKLY,,,2026-01-27T00:33:23.378616,2026-04-11T23:28:35.726328,37a70439-cf1d-40f5-9184-d27714a9a2e8,8a77b48a-94d4-4558-8228-929cf9e1a9d4
23c75234-03bf-422a-a41c-0c6c92f55b4e,133f90fe-7e31-4d27-8cda-4d82237347ba,a21dbcb0-9f45-4f8b-a280-0920b3905c61,,,Whom near against federal. Whom news base already.,2025-11-07T07:29:23.853468,2025-11-09T07:29:23.853468,unassigned,Name significant city seem answer nation today. Television while personal however million.,Cynthiastad,WELL,-5.220182,-67.277791,44911.93,"2 days, 0:00:00",HIGH,875dcbd1-cdb7-47cd-98b2-6ef8f58842d1,6bc12c93-a9f7-4d75-b811-9bebbf7039cb,89.44,days,False,,,,2025-11-07T06:45:05.756019,2026-04-11T23:28:35.726527,2c280e48-8b45-4fac-8e99-3affe818a96e,8b5300ad-5dd3-4f90-b209-36b1a0ea39ce
87d3ebbc-2055-4d09-bdf1-5edb18edd87d,c2271158-1a66-4531-9772-0e175585c41f,a21dbcb0-9f45-4f8b-a280-0920b3905c61,2025-04-01T19:44:05.487165,2025-04-09T00:16:41.442172,"Figure a recently us and. Popular leave garden answer available.
Since two establish. Anything traditional week. Pick manage course direction war remain example.",2025-04-02T21:00:04.211437,2025-04-07T21:00:04.211437,completed,Have much goal population this. Development social consider employee.,Josephborough,ADDRESS,23.790989,31.112419,36110.07,"2 days, 0:00:00",HIGH,ca44af96-b4dd-45c8-8083-5c340606e283,6bc12c93-a9f7-4d75-b811-9bebbf7039cb,74.26,hours,True,WEEKLY,,,2025-03-31T07:27:51.616456,2026-04-11T23:28:35.726758,79444515-417a-46af-a841-245b8c38748c,7db31ff1-c166-484e-991d-e82efa684324
bc5950e8-8bbc-4127-a834-e1c3a09885b4,133f90fe-7e31-4d27-8cda-4d82237347ba,9d45dc15-5fed-4875-b916-efb8a51119f6,2024-12-27T18:38:05.411023,2025-01-02T04:06:48.813251,Commercial turn page it threat. Watch interesting fine involve. Various land movement decision leader nice account. Meeting investment although.,2024-12-29T17:19:01.077731,2024-12-31T17:19:01.077731,completed,Or include experience. Us blood field.,South Jenniferberg,WELL,-43.1015285,134.87093,9682.42,"1 day, 0:00:00",MEDIUM,9e18bc08-ad64-4652-843c-fe1f3b121fe5,d1e18f8f-1284-4e35-8fff-1745bbfa3935,97.19,gallons,False,,,,2024-12-25T05:37:32.655321,2026-04-11T23:28:35.727033,7c9c0dce-74d0-40e2-80a7-4508899ce586,4c929466-b09c-444e-9d64-384745c329b4
964b443e-e0a9-49ce-bea0-4ac3aca93fa4,23a09d52-0fe3-421e-bb91-3202f9a30091,296fa3db-c335-4523-8a1c-df606cb83295,2025-10-14T00:05:58.688851,2025-10-18T23:13:26.885308,Weight trouble do else nearly why picture. Watch hand indeed end brother network. Wear money new friend.,2025-10-14T16:12:31.015714,2025-10-18T16:12:31.015714,completed,Something pass high newspaper ball. Account huge guess hear time agent since forget.,North Carol,ADDRESS,72.96907,-148.622601,34646.79,"2 days, 0:00:00",HIGH,f4366471-8102-464c-bebd-9f4ca3c3b19d,4163a5d4-955d-4a25-abd7-854c4e83b2ac,59.24,loads,True,DAILY,,,2025-10-11T08:39:46.668528,2026-04-11T23:28:35.727229,98c99f8c-ee8e-47de-a517-16cf8fc7c697,f21f04af-84a5-49cc-a700-13154c0e5d1c
8182f38c-864d-48aa-8848-46aa75f78123,06d009b4-72da-4d9d-b3b7-57e8599d7117,a21dbcb0-9f45-4f8b-a280-0920b3905c61,2024-08-03T00:01:23.113152,,"Mother establish off race worry. System only try better.
Especially experience center party sound they adult. Time military data development tell. Interest enter beat simply time big newspaper.",2024-08-03T15:15:01.017570,2024-08-07T15:15:01.017570,cancelled,Fall beautiful capital middle level if. Small Congress use employee rich change whole.,North Shawnbury,GPS,29.916076,-99.595875,9097.43,"1 day, 0:00:00",LOW,875dcbd1-cdb7-47cd-98b2-6ef8f58842d1,d1e18f8f-1284-4e35-8fff-1745bbfa3935,20.96,hours,False,,2024-08-03T21:07:34.036258,Duplicate order,2024-07-31T01:52:59.552589,2026-04-11T23:28:35.727492,acff1c6e-c72d-4e70-b97a-648115a00ed6,6bfab0cd-6102-4db6-8fbf-4c50e1eec8c7
effc9cc0-efd7-4d14-bb56-8c2e470b4aeb,656b008b-6556-4e21-a60c-4ad6a3412f4f,85ad02b7-c91a-4731-b9f6-c74111351c65,,,"Green enter view political. Police modern issue than someone.
Mention clear fact major Congress upon. Who west seven investment board television.",2024-05-24T09:48:09.391023,2024-05-29T09:48:09.391023,unassigned,Drug and begin pretty despite month cause.,South Adriana,ADDRESS,73.3493155,-118.632907,11494.82,"2 days, 0:00:00",LOW,1049e5e8-7298-45fb-86b3-168a09b4a551,bbbbe58c-e42d-45df-9ddb-4fe9798ad349,19.95,gallons,False,,,,2024-05-20T06:09:21.253965,2026-04-11T23:28:35.727683,aa20b7e3-a0a2-45b7-970b-b0f8cb6a56ee,bae1c84a-1ced-4496-8587-c6bd99c1eb27
244f523a-3218-4ae8-8631-174fc71a16c2,0d4458dd-5ad6-4786-9888-2bff9f05336e,85a258d7-b0ef-4d6b-90dc-5661b7c3d48c,2024-06-15T15:57:08.353192,,"Network leg strong daughter then suffer interesting. Audience these painting practice various imagine consumer.
Participant movie federal spring cup manager.",2024-06-15T21:11:01.959533,2024-06-18T21:11:01.959533,assigned,Tough close plan our low. Yet former military himself big today.,Robertburgh,ADDRESS,3.273612,-164.159982,46770.42,"3 days, 0:00:00",MEDIUM,cd0cbf2b-d8b7-4042-89e5-d608743d6c06,d1e18f8f-1284-4e35-8fff-1745bbfa3935,71.4,days,True,ONE_TIME,,,2024-06-13T23:05:01.846797,2026-04-11T23:28:35.727965,547d8b8d-901a-43b8-9614-0795b63576c5,6efc9c66-b3e9-458a-8af5-7500de2ff5d5
3f95c35e-94f0-4bae-a4a0-7b3b5d073275,279f7fdc-14a0-4446-b6ce-4810b1281dbb,f8fc3e50-abea-49d4-baba-b152aaaf1932,2025-12-26T20:52:47.659717,2026-01-01T21:15:01.259531,"Look else carry yard another production international. Level doctor story along wide hope.
Reduce fall artist card school son.",2025-12-27T14:26:48.316373,2026-01-01T14:26:48.316373,closed,Force question enjoy than personal.,Port Tanner,ADDRESS,61.780508,-45.928894,35881.6,"3 days, 0:00:00",LOW,88ebe1e3-93d0-4ed4-9c7e-f6fd9eed4e83,32a1f4ff-8cad-447c-8433-21af7ee7c7a6,88.78,loads,True,MONTHLY,,,2025-12-25T09:02:01.419434,2026-04-11T23:28:35.728139,592b263d-a1a8-481b-a624-174f8bcfc89f,fb3fecf2-838f-4d45-88da-d36994da51e5
2cbf2f5c-3f88-407b-b10b-3b6f24bb14c7,0d4458dd-5ad6-4786-9888-2bff9f05336e,85a258d7-b0ef-4d6b-90dc-5661b7c3d48c,2024-12-10T13:45:56.412484,,"Senior near low line material seven contain. Measure outside boy also hundred.
Fund paper once cost upon decision. Team would western change court team help.",2024-12-11T12:27:59.689487,2024-12-12T12:27:59.689487,halted,Born husband tough ability. Bring foreign government color anyone physical feel.,Port Joel,WELL,11.1611445,31.222527,8810.19,"1 day, 0:00:00",HIGH,cd0cbf2b-d8b7-4042-89e5-d608743d6c06,bbbbe58c-e42d-45df-9ddb-4fe9798ad349,6.36,hours,True,ONE_TIME,,,2024-12-09T12:32:52.121915,2026-04-11T23:28:35.728316,e4933510-c1e9-4c29-a506-d6fcf5a435af,37e9b115-622f-4923-90ce-565f6f455492
7a8f5bdc-f680-4b7d-8821-424cfc0d74a8,656b008b-6556-4e21-a60c-4ad6a3412f4f,9d45dc15-5fed-4875-b916-efb8a51119f6,2025-02-12T23:23:08.390214,,"Information yes white care traditional. Share already theory activity.
Article work side energy security near crime. Soldier free little. Per structure open student institution measure painting.",2025-02-13T15:39:27.313277,2025-02-18T15:39:27.313277,halted,Investment section stuff position try different actually. Return brother more whose more.,Jeffreyberg,GPS,51.759171,-31.971501,13165.47,"1 day, 0:00:00",HIGH,9e18bc08-ad64-4652-843c-fe1f3b121fe5,bbbbe58c-e42d-45df-9ddb-4fe9798ad349,98.45,hours,False,,,,2025-02-12T20:28:16.810063,2026-04-11T23:28:35.728534,1be97f96-efa6-4839-ae4c-bf6e66d23ff1,47a7ea46-f1da-4302-a04b-fe818f89f19e
27d20c56-c3ea-4560-b87d-2228b69c83d0,133f90fe-7e31-4d27-8cda-4d82237347ba,2d4a9276-b730-4ead-b37c-3d5a209278a8,2025-12-09T04:00:05.107324,,"Half personal ball its. Run subject say point purpose.
Local material rise agree. Travel green source many until mention.",2025-12-09T16:08:18.104059,2025-12-13T16:08:18.104059,in progress,Particularly sea might. Role side program southern real pretty moment.,Jordanport,GPS,-61.1713875,48.275286,36714.25,"1 day, 0:00:00",LOW,c666fc01-b9fa-4581-b129-cb0a7b7fe3f4,d1e18f8f-1284-4e35-8fff-1745bbfa3935,39.05,visits,False,,,,2025-12-06T23:01:54.890896,2026-04-11T23:28:35.728755,61f65975-48a0-4ded-834e-885fceb0eab6,92b201cc-029b-45d1-92cb-26c3ffa118d4
086b4a72-24d9-4d03-8b7d-b2fa94ef64c2,279f7fdc-14a0-4446-b6ce-4810b1281dbb,296fa3db-c335-4523-8a1c-df606cb83295,2026-03-11T13:17:06.267022,2026-03-14T11:43:58.184080,"Suffer crime fine stage air parent. History thousand ago radio.
Begin might state within relationship among. Affect board senior.",2026-03-11T18:40:26.368049,2026-03-12T18:40:26.368049,completed,Others civil door huge. Fact professional can rest. Big just during short analysis create.,Port Lucasport,WELL,36.685214,-50.964153,11893.5,"2 days, 0:00:00",MEDIUM,523814a5-a798-4b23-8c88-2ce35513486f,4163a5d4-955d-4a25-abd7-854c4e83b2ac,9.51,loads,False,,,,2026-03-11T10:37:44.407333,2026-04-11T23:28:35.728950,d737fbf5-f7ea-41c6-a0ee-887cb8a711c3,ff7ce568-548b-4a2a-97e4-d387f615e673
9e89773c-7b5c-42d4-abfb-70e6e486e83f,133f90fe-7e31-4d27-8cda-4d82237347ba,9d45dc15-5fed-4875-b916-efb8a51119f6,2025-01-15T03:47:52.326396,,"I fund prove dream system. Because method grow figure doctor relationship.
Church physical interest recently. Young big both.",2025-01-15T08:02:16.654372,2025-01-16T08:02:16.654372,assigned,Goal outside worry central enjoy. Everyone court policy. Source allow point experience per.,Justinburgh,ADDRESS,-49.0428945,-34.055203,21382.92,"1 day, 0:00:00",LOW,9e18bc08-ad64-4652-843c-fe1f3b121fe5,d1e18f8f-1284-4e35-8fff-1745bbfa3935,17.42,days,False,,,,2025-01-14T01:26:52.744504,2026-04-11T23:28:35.729128,23e8fde1-77b7-4fd9-93c3-d7b54fdd32e6,aa150b73-4959-42ce-94ce-285c25db8e6a
71948134-57e6-41b6-b760-05c51942fe6f,06d009b4-72da-4d9d-b3b7-57e8599d7117,ede7db27-f41b-4233-90aa-2747d99c010d,2025-11-08T19:02:55.979233,2025-11-13T23:17:41.889000,Necessary international decade color quality responsibility its. Only their ahead couple especially.,2025-11-09T14:57:36.963720,2025-11-13T14:57:36.963720,completed,Shoulder allow anything beyond wear attention. Husband first daughter candidate social.,North Deborah,GPS,28.9325465,37.083335,660.36,"3 days, 0:00:00",MEDIUM,f8f14ff0-ba1c-4975-b650-6abfe63465d8,aae0e4d8-2cec-412c-b24f-bd332e960900,60.66,loads,False,,,,2025-11-06T14:30:27.105234,2026-04-11T23:28:35.729311,526dbf33-600c-4a98-a39d-777e90238e68,7b456b1b-58d8-4be9-807b-47f20a677e5f
9e1ebb38-7289-43be-83bd-ece21318bb3f,34a45051-a13a-4bfa-92d4-c3f90c3c95dc,ede7db27-f41b-4233-90aa-2747d99c010d,2025-04-28T15:46:20.767784,,Director national until pretty test range author. Fast four real word thing reason hand. No develop charge sure.,2025-04-29T11:09:01.868530,2025-04-30T11:09:01.868530,cancelled,College explain success either then deal. Practice debate laugh low.,Gabrielberg,WELL,-81.9942835,-3.834616,13228.53,"2 days, 0:00:00",MEDIUM,89602d9d-ad22-473d-b46f-9485cb35cbf5,f3ec3133-59db-4438-a2c7-e7ef726d6be4,8.83,visits,True,MONTHLY,2025-04-30T13:13:33.403213,Client cancelled request,2025-04-27T19:36:08.338391,2026-04-11T23:28:35.729486,e4898e7b-7f1d-48aa-9429-e020c1f86ab8,f787262c-86ed-4f08-bc1c-48065fffdcb2
e961c822-9931-4c3d-b884-a596306dc672,133f90fe-7e31-4d27-8cda-4d82237347ba,13740cf2-33c5-492f-aedf-c2319bcbafa2,2025-06-03T21:26:11.056831,2025-06-08T00:16:31.978810,"Prove successful fine class live. About military in do picture. Media away minute.
To brother occur learn. Language investment worry might sing notice.",2025-06-05T02:12:03.279723,2025-06-06T02:12:03.279723,completed,Congress travel usually. Wind ok prevent argue store woman fund. Anyone drug general factor.,Port Jenniferchester,WELL,4.362799,64.415396,4081.34,"1 day, 0:00:00",LOW,42e8757c-99d8-490a-9059-3d47390910ba,6bc12c93-a9f7-4d75-b811-9bebbf7039cb,55.72,days,True,DAILY,,,2025-06-02T10:50:57.966414,2026-04-11T23:28:35.729714,2681527d-1c07-4242-8912-ab4ce63e0fb0,81981685-c762-414d-ade4-5536fdf86524
27e45d0f-d4dc-4398-bed0-897f88cdd594,e6da2d90-c782-409c-8616-856c4871d2ca,dc7f0910-53d4-4ec1-8f74-7abe480627b6,2024-07-16T05:22:35.583838,,"Relationship move daughter forward level shoulder structure. Create high body.
Own institution manage manager miss relate seem agreement. Push truth hear page. Time during view record medical growth.",2024-07-17T02:49:43.871380,2024-07-20T02:49:43.871380,rejected,Nearly entire likely another suddenly behavior sort.,Nicholeland,WELL,-25.8448635,-93.894543,21246.46,"3 days, 0:00:00",LOW,2245e3c3-5efa-4a56-966e-46a618131d6b,4e7b5962-dbd8-452f-81b7-4aee649a667c,80.83,days,False,,,,2024-07-15T22:21:00.520272,2026-04-11T23:28:35.729892,e0752dc6-e969-4a32-9ac5-e9036c22e24f,ed0dbb57-7362-4831-b249-9c8ab118ad9d
5a139b1a-346b-457d-89ec-36be0d0655fb,68b3203f-7c06-4786-8e92-f50ded6dd24f,04c01860-11e0-43ee-ace0-ffb53146f1b0,2025-07-09T19:29:29.221438,2025-07-15T14:55:33.725464,Radio expect produce along weight score local. Check involve risk main.,2025-07-09T23:39:58.240542,2025-07-13T23:39:58.240542,completed,Different bed main actually. Whose executive card lawyer break.,New Melissa,ADDRESS,8.5210085,-177.8794,23273.51,"1 day, 0:00:00",MEDIUM,dcff1cf3-2e53-4bf0-8d44-1ed0621a3977,aae0e4d8-2cec-412c-b24f-bd332e960900,51.83,visits,True,DAILY,,,2025-07-09T10:56:02.412242,2026-04-11T23:28:35.730072,6a595464-9da6-44ae-a3e6-0060d02f4161,f88b1b30-49de-4c48-ba67-64ea29e7c8b4
2ce6129a-6f17-4b99-9d1f-8b1d76470f88,34a45051-a13a-4bfa-92d4-c3f90c3c95dc,d96e5168-c48b-4372-9992-3d6291244bfb,2024-06-26T03:38:08.354269,,Goal rate than sense recent. Interesting herself space right indeed kitchen always. Woman life threat sea back beautiful later.,2024-06-27T08:56:39.731163,2024-06-29T08:56:39.731163,in progress,Item various game authority. This shoulder all.,Barberside,WELL,6.6851105,-136.595481,40509.71,"3 days, 0:00:00",HIGH,62ef3456-1597-40c3-8c18-13cf242d64c4,aae0e4d8-2cec-412c-b24f-bd332e960900,74.45,gallons,True,WEEKLY,,,2024-06-24T20:15:27.839235,2026-04-11T23:28:35.730294,a70c9206-3d5f-4d4f-9cc4-d31747424418,500f21a9-83b1-4b4a-8135-9986c217af12
2f16b356-93ad-4314-9b51-52c2538bb0ac,23a09d52-0fe3-421e-bb91-3202f9a30091,285f3784-ef10-4b42-ae2b-9ae729cb8219,2024-07-12T23:07:50.349988,,"Get first indeed other treatment east. Sort strategy those security their southern system.
Court best no. Small data people maybe either these money. Throughout attention foreign.",2024-07-14T09:21:42.781185,2024-07-17T09:21:42.781185,rejected,"Scene arrive standard painting.
Safe indicate idea everybody. None you myself table live.",Yangmouth,ADDRESS,-45.7802255,-63.345406,29243.3,"2 days, 0:00:00",MEDIUM,614a2a2e-591b-4e4a-929f-a1b660400fff,4163a5d4-955d-4a25-abd7-854c4e83b2ac,13.19,gallons,False,,,,2024-07-11T18:08:15.252773,2026-04-11T23:28:35.730515,09d46833-357d-43fb-8da8-144b1bc15498,34a6b6aa-083b-4768-8f9d-8378b06fe176
fb7375e3-2517-4b7e-9534-8eaf971e0ae1,656b008b-6556-4e21-a60c-4ad6a3412f4f,ede7db27-f41b-4233-90aa-2747d99c010d,2026-03-26T06:41:03.814716,,"I even address collection land race employee. Effort young professional hold.
Language environment last resource. Water pattern eight individual dream ever here.",2026-03-27T01:29:47.892389,2026-03-31T01:29:47.892389,halted,Authority education plant pretty. Sound certain increase line at along.,Davisview,WELL,-22.940797,141.974291,39039.56,"2 days, 0:00:00",LOW,0ec9f115-6f77-4123-9e09-f280e8b1c690,aae0e4d8-2cec-412c-b24f-bd332e960900,52.6,hours,True,WEEKLY,,,2026-03-24T23:25:35.536027,2026-04-11T23:28:35.730754,dde19d4d-13a5-49da-983a-859cf3b219d4,55662abb-80ad-408d-9ce5-cd1b39edd4aa
