work_order_id,assigned_vendor,assigned_at,completed_at,description,estimated_start_date,estimated_end_date,current_status,comments,location,estimated_cost,estimated_duration,priority,well_id,created_at,updated_at,created_by,updated_by
9fee2e90-027d-4e83-9ada-8cbdca2297c3,b0f3789f-11b3-4e6d-8205-dcb3381ef2ba,2025-03-29T14:00:52,,And another month operation chance card if. Off seem above explain represent issue teacher point. Ask world talk this activity officer.,2025-04-10T18:03:21,2025-04-14T18:03:21,assigned,In whole not affect agreement. Wide and imagine without.,Port Leahmouth,22664.31,"24 days, 0:00:00",emergency,b71ac294-8468-4261-b7ba-555387b0a3e0,2025-03-25T12:27:33,2026-04-07T18:12:43.727079,21490f6e-ac63-408b-be12-3f4db221283d,1e98dd5d-3e89-4351-8f22-b2239d1a4669
88f6d130-453f-4f00-8a5c-016189705ef1,0fd09b32-d37a-4f44-ab04-a4366606e6c9,2024-10-11T17:18:57,,"Recently important reality large hold cut. Close evening pull close everything entire.
Receive dog check have eat. Example film customer trial money process.",2024-10-22T13:08:47,2024-10-30T13:08:47,assigned,Keep exist hot or own science. Care just seem finish management.,Jenniferport,44634.32,"3 days, 0:00:00",emergency,0d09eac5-3ddc-41fc-bb29-996accb4edce,2024-10-10T02:50:29,2026-04-07T18:12:43.727233,36cb19f1-2d4e-4159-822d-390f5da2ab54,0c04bacd-c0db-48af-9d2e-1544cf7ee0e0
c9099139-50fe-4b2f-bb4b-905440079253,1b193ccd-19a1-4d90-802b-c54dafe33648,2025-08-23T06:59:04,,"Reveal store continue job rise never. Material spring general PM.
Along thought week fill nation age cover.
Show member edge a expect age skill face. Remember there personal.",2025-08-30T23:47:09,2025-09-12T23:47:09,in progress,Operation anything upon short. Old along west order.,Erinberg,44180.38,"3 days, 0:00:00",routine,84504bc3-0b9d-40ca-824e-4b9168bd1c76,2025-08-19T15:56:10,2026-04-07T18:12:43.727414,1f3bcd3e-0035-4ae9-8563-11e1056f0622,55319355-f2fb-4115-b782-0fffdfd076bc
81e40e4a-4932-41ba-b7b2-7f457666959e,393b03aa-8e0e-4af1-a284-946ca7e0b61c,2025-06-24T06:38:49,2025-07-21T09:43:17,This a night director blue. Pull state water allow black pressure all happy. Sometimes meet wonder type baby tree writer. Myself into song however treatment.,2025-06-25T06:57:07,2025-07-10T06:57:07,completed,In face true use wait. Course large stage protect relationship newspaper ground.,New Kimberlyborough,10671.46,"28 days, 0:00:00",urgent,96af6f3f-c904-4575-8c78-0644312a5cc7,2025-06-16T22:17:09,2026-04-07T18:12:43.727578,eaad2da7-89ed-4e38-9e4d-0bd0ef1b962b,dd41cc4b-6e59-4046-8ad9-16044e78bc48
b4c300f5-eb00-45a5-b8f4-842082aa52b2,0fd09b32-d37a-4f44-ab04-a4366606e6c9,2024-12-01T20:40:46,,"Part high give safe. Here from nature.
Chance debate fund explain a which.
Everything commercial score lead member. Defense choose the. Man exactly arm size stay.",2024-12-11T04:52:47,2024-12-30T04:52:47,in progress,She history rock including. Never ball near food stay.,West Kevinside,22743.8,"25 days, 0:00:00",routine,af04bae8-99c0-4bb7-89ef-d29b27e1d65f,2024-11-20T09:17:15,2026-04-07T18:12:43.727732,cc4263df-0bad-4314-b541-0fb487b016dd,e99811e0-56e3-4158-b728-8c53f0a58461
8bc53425-e7a1-4f41-b5a5-09fd4727b7d2,2c8d1ddb-8c56-4e93-bd93-d4aaf06847fc,2024-11-12T03:31:21,,Majority number best college beyond small. Increase member include seem travel method.,2024-11-16T15:41:58,2024-12-03T15:41:58,unassigned,Business practice away ball. Glass hot him when.,Williammouth,42193.79,"27 days, 0:00:00",emergency,025d1edd-0a4d-4016-81aa-c601d74a249e,2024-11-03T13:32:28,2026-04-07T18:12:43.727882,81ffdc18-2ba4-4836-8b4c-6668aea02616,2d1fcb85-5e5d-4920-9809-c8127baaf86e
1bf8c820-0af5-4da1-b1dc-b18d8237d45f,0fd09b32-d37a-4f44-ab04-a4366606e6c9,2025-10-19T05:14:03,,First a arrive us where nor. Shoulder seven image return.,2025-10-20T22:01:21,2025-10-28T22:01:21,in progress,Enjoy begin view should data yeah. Could pay training but difficult into help.,Port Lesliehaven,32779.03,"5 days, 0:00:00",routine,f59c5d87-aaa3-4d3b-a282-09470df28c0e,2025-10-16T07:22:26,2026-04-07T18:12:43.728020,7e1c3e20-8f75-4450-898d-a936bc1130f1,dbf0a7f8-d342-43a6-93fe-b1de81d47253
aa0dd0aa-2c4b-471e-8382-bf417dcc6968,0fd09b32-d37a-4f44-ab04-a4366606e6c9,2025-12-04T19:08:42,,"Five stop wear chance crime where tend.
Find hour record me deep success. Poor cost experience beautiful about including usually.",2025-12-13T11:39:01,2026-01-07T11:39:01,unassigned,Expect many section. Star per factor society weight.,Mcguireton,8867.22,"29 days, 0:00:00",routine,574ef814-9815-424b-be6f-7af4027e2b03,2025-11-24T01:19:36,2026-04-07T18:12:43.728200,69931427-40f3-4a81-9b83-e2570093ebd8,4d970664-c6b7-4ad2-a718-a0b46efd3e0e
dc679280-ab1c-4f48-b613-8f436cb74b8b,a0da5163-88a0-42a9-b2ef-6fd8f4f914c4,2025-02-12T23:43:56,2025-03-08T05:56:10,Back kind allow job important. Much back poor when. Property different walk administration new what do.,2025-02-16T04:52:18,2025-02-22T04:52:18,completed,Near effect concern believe moment. Add bring a from time science meet.,Port Jason,4586.02,"14 days, 0:00:00",emergency,ee0af0c8-bb94-4a92-a50a-33702a2938e7,2025-01-30T22:32:56,2026-04-07T18:12:43.728382,99224a80-9399-4225-9c62-a83390c65401,b22ac04c-404f-4ec1-8b5f-a6688323140c
19bc113c-6f0a-4d7c-96e2-bfbe20651563,1b193ccd-19a1-4d90-802b-c54dafe33648,2025-08-08T17:40:43,,East real trade leader real risk. Future already budget good far design loss walk. Stop particularly fire food trouble soldier.,2025-08-15T04:40:53,2025-08-20T04:40:53,assigned,Its dinner among amount really top positive. Safe both smile hope now far general personal.,South Shari,44633.87,"16 days, 0:00:00",emergency,c05ac704-a0ac-4e03-b0a8-e06aa01c4b9e,2025-08-07T05:53:52,2026-04-07T18:12:43.728536,666ece15-0ecf-4d6e-97c4-4eb578025027,8eeb19c1-6f6f-44c1-a4ad-42644420c364
6765bf85-f4be-416c-8912-63c2ca1b13b4,1b193ccd-19a1-4d90-802b-c54dafe33648,2024-08-04T15:44:08,2024-09-01T14:59:04,"Between interesting coach. Onto attack always provide. Add include need center perhaps bar.
Public instead certainly project fear which point.",2024-08-06T11:01:17,2024-08-17T11:01:17,completed,Find when light rich. Policy put lead significant pick for tend realize.,West Morganmouth,1245.83,"29 days, 0:00:00",routine,1aa66908-0ce1-4904-b4ff-008d9b2889a9,2024-07-27T21:07:27,2026-04-07T18:12:43.728707,a9a561eb-fb75-4e34-8741-0eaf1f7aa309,9028507d-309b-4305-ba82-3c28dbb1b02d
77a7af96-0b87-4ff7-a5bb-a73ae3fcc63a,1b193ccd-19a1-4d90-802b-c54dafe33648,2024-08-25T03:51:31,,Before good during artist people. Become trial see try tonight war. Prevent seek account help. Hear member marriage but bring.,2024-08-30T22:42:07,2024-09-15T22:42:07,unassigned,"Start detail country age card.
Behind down painting mind result art.",West Lisaborough,41723.65,"6 days, 0:00:00",urgent,0d09eac5-3ddc-41fc-bb29-996accb4edce,2024-08-15T00:43:58,2026-04-07T18:12:43.728873,655affe0-35de-4d18-a8df-ace5ed10bbcc,e3ac3e42-aba1-4079-b089-2639705b1de2
7a539721-46a5-4055-8949-14893bc8cf92,1b193ccd-19a1-4d90-802b-c54dafe33648,2025-01-04T20:56:46,,"Finally rock room or simply man for. First meet push improve opportunity. A area event authority.
Decide cover mother word. Mean probably ground unit those exactly.",2025-01-09T07:02:11,2025-01-27T07:02:11,unassigned,Difference nice central.,North Ryan,22213.11,"17 days, 0:00:00",routine,70db585e-7da4-42d7-8a52-378d70101594,2024-12-29T09:46:33,2026-04-07T18:12:43.729042,9c00d626-0b44-41f1-9ea0-b754c38c3933,c7627f70-af3e-4384-b015-ee2b731673a8
1652895f-5f9a-42e8-8a7c-d7d25453250d,2c8d1ddb-8c56-4e93-bd93-d4aaf06847fc,2024-06-06T02:47:28,,"Require area news truth. Rise just their rule.
You chance individual save miss bring. Sign call act if size. Name short let center land test boy. Practice week compare leave analysis war.",2024-06-19T16:14:43,2024-06-25T16:14:43,assigned,Free accept first pick popular. Station finally address deep nation.,Derekville,27789.99,"10 days, 0:00:00",urgent,a0f36930-7b0e-49ee-b38f-22cf1faf6ba3,2024-05-31T04:50:32,2026-04-07T18:12:43.729208,ad412a36-8fde-421d-8d9b-817b98c2ae19,fbdf8859-9fc1-4054-8f11-1ce00c9bfd1e
1bd73b25-f7e9-415b-9ee0-db344d808993,0fd09b32-d37a-4f44-ab04-a4366606e6c9,2025-08-05T04:50:22,2025-08-26T10:28:17,Far attack price vote. Job young deep break them.,2025-08-07T19:38:52,2025-08-23T19:38:52,completed,Probably Mrs each air office her just. Baby face assume.,Smithstad,36381.4,"1 day, 0:00:00",routine,8ccbeeea-7836-45ae-bfa9-a2f4b7a10bd4,2025-08-03T09:43:47,2026-04-07T18:12:43.729376,605da277-62bb-4f96-a230-075fad3b7d24,e0800186-6b26-4a2d-aea8-f29b073d8e80
0ae68504-8bb1-41e8-a5c6-7d047c2efa55,1183ff2b-4d45-4bb5-b674-7441c73903cc,2024-04-30T03:33:15,,"Human wait picture system fly beyond somebody.
Act although hit serious west in about rise. Service affect direction question who spring say energy.",2024-05-10T07:49:59,2024-06-01T07:49:59,assigned,Cold special election for food radio. Policy prepare example skin month.,Andrewborough,30018.7,"28 days, 0:00:00",urgent,ae2b4f3a-8d15-43a4-a5a5-0dc6cab6ca7a,2024-04-25T06:29:49,2026-04-07T18:12:43.729522,f84c70fd-ff6c-41d0-b682-c3230ed37a1a,8c8308fd-b8d5-438b-965f-bb4041bb3916
1e75456c-d7d1-4461-abb8-d8c66636ecd5,0fd09b32-d37a-4f44-ab04-a4366606e6c9,2025-07-24T17:35:23,,Outside gas third American ago you their. What good interest force threat perhaps teacher. Place here business role situation especially network.,2025-07-28T07:07:37,2025-08-16T07:07:37,unassigned,Boy sport especially order measure expect. Job there sound how.,Westbury,22803.6,"4 days, 0:00:00",emergency,70db585e-7da4-42d7-8a52-378d70101594,2025-07-20T02:26:04,2026-04-07T18:12:43.729688,aacd1596-4c77-4fc0-a981-facf60a089f9,65a64165-7d81-437b-ba31-6f02d1f958d5
fe0334e3-cbd8-41e2-adcd-682b3a5b02d6,a0da5163-88a0-42a9-b2ef-6fd8f4f914c4,2025-11-23T16:30:40,2026-01-11T23:52:33,Effort road look painting. Generation garden only instead hold need change. Offer statement region development. Nice old general.,2025-12-05T02:45:55,2025-12-31T02:45:55,completed,Often none behind total break. Continue adult land future coach region return.,Port Matthewstad,22379.77,"4 days, 0:00:00",emergency,5ddf2b8a-519b-4e58-bf8e-1335657e4ea1,2025-11-18T19:58:34,2026-04-07T18:12:43.729874,44959175-92e7-4aab-973e-452cfc77e6d0,4afff30d-45e0-4c74-8ff1-32b53e21aa00
6f5ffa3e-64ff-4b4d-8e41-c8263c251c3b,1885aabf-2070-43a3-8f8d-71e67ae9409f,2025-05-21T20:43:11,,"Medical event wear discover must attack develop. Determine reduce order food southern.
News learn form allow strong take property. Himself staff present provide. Agency budget defense chair.",2025-05-24T15:51:52,2025-05-25T15:51:52,unassigned,Home message program. Leg small down. Marriage newspaper always particularly grow all sea.,Powelltown,33468.45,"13 days, 0:00:00",routine,4d5f9e80-4c35-4f56-9189-53a3b857d5d0,2025-05-09T13:53:03,2026-04-07T18:12:43.730069,0803f797-edf1-44c8-b82b-cac38df644d6,fc5c2cda-6907-4a9e-830d-a78b0d4927c1
64cdaa7f-83ec-4366-b4ad-c3e3fdcf76a8,0fd09b32-d37a-4f44-ab04-a4366606e6c9,2025-03-15T23:25:23,2025-03-28T06:22:13,List pattern fund success. Almost direction start prove. Consumer push onto realize center name product buy.,2025-03-17T21:41:32,2025-03-18T21:41:32,completed,Girl about blue treat. Open study common sport use reality nature environment.,South Wendyfurt,17358.79,"3 days, 0:00:00",routine,84504bc3-0b9d-40ca-824e-4b9168bd1c76,2025-03-12T02:25:59,2026-04-07T18:12:43.730235,45411961-c2f8-4474-9516-065687888875,c0d2c63a-691c-49e5-a494-48f2bae012c1
88104c17-cd94-4575-8726-9e0b944f5d02,1885aabf-2070-43a3-8f8d-71e67ae9409f,2025-08-04T22:21:11,2025-08-19T06:37:52,Your accept attention camera instead week exist. North store job perhaps hundred interest raise. Necessary condition choose teach chair. Ball board language suggest different player.,2025-08-07T23:17:45,2025-08-10T23:17:45,completed,Fast number exactly door. Positive couple we inside wait. Rather discuss treat place check side.,South Kevintown,45911.64,"3 days, 0:00:00",urgent,ac637e16-b72b-4999-8acf-4a67fd158a42,2025-07-29T04:20:30,2026-04-07T18:12:43.730454,de446b73-dacd-4ef8-8368-7884e95a6fed,00b15749-7191-4d1e-be74-54fce941cd42
4ac458e2-af0e-4d17-88ec-0e041616e2cd,a0da5163-88a0-42a9-b2ef-6fd8f4f914c4,2025-10-23T03:47:05,,They Mrs provide example. Chance summer result decade himself agent production.,2025-10-31T00:27:14,2025-11-29T00:27:14,in progress,Middle few behind response certainly. Political thought dog reality important determine.,Parsonsland,10651.85,"13 days, 0:00:00",routine,b9abee31-271d-48c6-91ea-09e3bb02d93b,2025-10-17T09:56:56,2026-04-07T18:12:43.730616,398c72b9-68d8-4e40-93e5-4c03d5d822a4,4a446368-4069-4717-9b33-1ca5fc9974b8
a04f5e08-e549-47c5-be99-8073621a387d,69671a86-729f-4257-a953-c3099d1a5bf1,2025-02-06T05:04:12,,"Character doctor ahead expert. North every age yourself economy choice too.
Fly this food usually against education. Action religious respond value stage in teach.",2025-02-15T08:46:42,2025-03-10T08:46:42,assigned,Woman play age glass question fire budget. Long number kid this. His various specific next face.,Traceybury,26564.22,"1 day, 0:00:00",urgent,4f12bcd4-8e6f-4c35-9db1-8f9c6eb8783f,2025-02-03T00:20:52,2026-04-07T18:12:43.730797,72d2284f-494a-44e6-882d-6e477323b306,f997a01e-549c-448d-b663-479dc698c17b
6819b7be-d31a-4625-a257-b48c9bf5ea1c,a0da5163-88a0-42a9-b2ef-6fd8f4f914c4,2025-02-04T20:46:04,2025-04-01T20:17:35,"Some under make particularly same certainly. Car possible race win method.
Air general likely city. Agency realize call part.",2025-02-15T13:04:06,2025-03-14T13:04:06,completed,Design protect particularly reduce help.,South Jessicaview,10544.34,"19 days, 0:00:00",urgent,7bda854b-e7dd-4452-96bd-6274f049f7e1,2025-02-02T23:14:09,2026-04-07T18:12:43.730974,81ffdc18-2ba4-4836-8b4c-6668aea02616,cf6fd669-0edc-4b39-b3ee-3192af405750
e82865f7-b697-407a-bf80-139b844a3329,1885aabf-2070-43a3-8f8d-71e67ae9409f,2026-01-19T12:13:08,,Campaign yard one claim half present spend. Worker run expert need four action firm try. Positive gun base respond.,2026-01-31T11:04:43,2026-02-18T11:04:43,unassigned,Recently growth environment owner interesting. Grow degree anyone by begin concern participant.,East Christopher,20202.35,"18 days, 0:00:00",routine,ac637e16-b72b-4999-8acf-4a67fd158a42,2026-01-10T21:03:24,2026-04-07T18:12:43.731130,36f5d090-e225-4d42-a095-d8e5b9121e36,1992e443-cc77-42f5-acd6-7386088e3fe5
99328cc2-bc12-473a-9ff8-21123b941348,1b193ccd-19a1-4d90-802b-c54dafe33648,2024-05-20T20:23:44,,"Seem impact war yeah war great. Conference pass pull shoulder major.
Story recent change network man soldier seven. Long toward recent before. Again picture street address read.",2024-05-26T04:40:34,2024-06-13T04:40:34,unassigned,Offer marriage city pretty. Race force teach response leader society establish meet.,New Meagan,34162.29,"27 days, 0:00:00",emergency,38f94a6c-908f-4bbe-bd80-559fc50b6e37,2024-05-14T23:54:55,2026-04-07T18:12:43.731294,c285773a-9de9-4e4f-9bb5-5f0a5f860112,dc7d1d83-8151-4b1f-965d-8759887e9fe5
8b103930-fab8-47eb-85e9-05509a63b134,a0da5163-88a0-42a9-b2ef-6fd8f4f914c4,2024-12-15T11:57:30,,"Decision create section plant high officer share.
Across movie site prove bill seven arrive. Seek energy many red wait serious. Employee stay matter thus pretty decide national.",2024-12-19T06:38:58,2025-01-10T06:38:58,in progress,Believe true everyone. Pay test present force community explain argue.,Jenningsmouth,11199.7,"5 days, 0:00:00",emergency,b9abee31-271d-48c6-91ea-09e3bb02d93b,2024-12-07T06:36:25,2026-04-07T18:12:43.731540,b1e53802-3acc-4cb2-b315-9326c7176abc,b7040776-15d6-4c5e-926a-0a2eecfc7136
f3172e4e-5853-459f-b773-726f06ad122e,2c8d1ddb-8c56-4e93-bd93-d4aaf06847fc,2024-05-19T06:08:20,,"Event machine several staff. Southern memory front.
Explain spring statement nor sign assume deal. Doctor room explain.",2024-05-20T06:18:01,2024-06-04T06:18:01,assigned,Federal present husband may. Future during expect. Politics despite poor nice for group.,Amychester,6018.51,"10 days, 0:00:00",urgent,4f12bcd4-8e6f-4c35-9db1-8f9c6eb8783f,2024-05-05T16:33:38,2026-04-07T18:12:43.731747,c208aa28-cb96-499a-8d1c-c4388fe89710,dedf1e9c-ba3a-425b-a7de-e573f963627f
1f198854-f1de-44e0-b914-e9d60292ff8e,1885aabf-2070-43a3-8f8d-71e67ae9409f,2025-07-07T05:51:15,2025-07-21T12:58:47,Family range surface also account until. Administration employee book. People others sit call great. Road senior town result improve mind statement.,2025-07-07T12:55:51,2025-07-15T12:55:51,completed,Someone keep door nor kind picture. Perform establish always probably clear.,New Kelseyview,31756.54,"3 days, 0:00:00",urgent,69b70b28-f8e5-4a33-8b15-45fc9ee2cbbf,2025-06-30T03:21:10,2026-04-07T18:12:43.731935,513cd11c-7fbc-4900-ad3d-611913766329,5cc8bc27-7a9e-4043-ad16-0b1c174f944e
8c203a9f-1d45-492b-88c7-cfca6cade54e,1b193ccd-19a1-4d90-802b-c54dafe33648,2025-02-12T02:37:35,,Example artist describe star information mean. Blood age time me certain new.,2025-02-21T10:58:14,2025-03-10T10:58:14,in progress,Former someone modern else girl. Similar suggest process never research best.,East Daniel,15659.44,"24 days, 0:00:00",urgent,c05ac704-a0ac-4e03-b0a8-e06aa01c4b9e,2025-02-08T20:29:12,2026-04-07T18:12:43.732109,5086bece-5659-440a-87c3-c3cb18eade23,97e142c3-7641-4a9a-90e4-41275775684e
880b1484-6986-4bab-b60a-4ac409ab89d4,1b193ccd-19a1-4d90-802b-c54dafe33648,2024-10-29T09:00:25,,"Site step mind others training part charge. Three while contain nor safe.
Thus sense hear project key capital. Way sit compare coach.
Clearly recently play peace success thing.",2024-11-08T12:24:00,2024-12-02T12:24:00,in progress,Help hold TV throw. Plan shake social indicate people trial every small.,New Gary,42801.64,"13 days, 0:00:00",emergency,1aa66908-0ce1-4904-b4ff-008d9b2889a9,2024-10-23T17:43:36,2026-04-07T18:12:43.732280,2c68fcdb-cb2d-482f-8160-07879f26283a,16aeb20e-82f4-4e4b-b27d-2ec4cee865a5
7f8ccdaf-2b5b-4a3c-be90-c6bd78ea2945,1885aabf-2070-43a3-8f8d-71e67ae9409f,2024-11-01T18:20:13,,"Believe including official early care.
Idea name onto worker media. Wait about take bag.
Ten nearly message must tax visit entire. Store huge green ask guess finish especially. Decade deep my wait.",2024-11-05T17:07:52,2024-12-04T17:07:52,unassigned,Place economy positive age claim peace. Card discover view job material fear small myself.,North Danamouth,15199.16,"30 days, 0:00:00",urgent,c827aaf3-39b3-4991-b410-f2b4c5c5d05a,2024-10-22T13:05:30,2026-04-07T18:12:43.732469,d32f2398-9654-4b1f-99f2-01ff54c3352d,20a25136-cb1f-4d95-b756-1f77b44a7894
bc8096c2-6ea3-43e9-b8d0-ba0bf6365729,0fd09b32-d37a-4f44-ab04-a4366606e6c9,2025-03-14T17:03:00,,How film note wall few risk senior. Study across participant direction. Positive personal although today small eye summer.,2025-03-21T04:53:16,2025-04-08T04:53:16,unassigned,Raise buy investment study west manage. Single add question set product me the.,West Alexisbury,25063.09,"25 days, 0:00:00",emergency,8ccbeeea-7836-45ae-bfa9-a2f4b7a10bd4,2025-03-13T04:29:26,2026-04-07T18:12:43.732628,a23b033b-a9f3-49f4-ba1d-ac6f132a9f2d,17711716-0a0f-4079-871c-9095920fa031
f59d7121-b209-4789-a183-bf3a8f669e16,b0f3789f-11b3-4e6d-8205-dcb3381ef2ba,2024-06-13T15:03:03,,"Race design office instead rest dark little left. Sometimes agree quite drive turn as so. Land day process.
Ever only majority she rise.",2024-06-16T10:20:44,2024-07-05T10:20:44,assigned,Another fall authority certain before. Game drug food.,New Jaredport,26941.02,"16 days, 0:00:00",emergency,4f12bcd4-8e6f-4c35-9db1-8f9c6eb8783f,2024-05-31T21:35:26,2026-04-07T18:12:43.732790,d24c79e3-ae94-491d-a715-f9048cc75dc4,82efd2aa-fb32-4367-a640-554d79bf86e9
6aec3f49-1564-4b33-adfa-0719ea553221,0fd09b32-d37a-4f44-ab04-a4366606e6c9,2024-05-25T16:44:30,,"Sea case often deal discussion. Peace it season glass big.
Natural feel seat in I professor enough. High major involve individual per.",2024-06-07T14:18:28,2024-06-26T14:18:28,assigned,Market why about describe. Before that act little machine whom body.,Ericaland,39721.58,"30 days, 0:00:00",urgent,af04bae8-99c0-4bb7-89ef-d29b27e1d65f,2024-05-20T18:10:17,2026-04-07T18:12:43.732959,42b01bd4-abae-4c16-840c-a26f8481708c,6b8f05b2-4a98-4049-b691-b3cd1572650d
7521e26e-0fbe-4ed6-8876-687cafe0030d,2c8d1ddb-8c56-4e93-bd93-d4aaf06847fc,2024-10-31T07:41:46,,"Better beat year firm military. Great law front final. Fact day fly the newspaper.
Indicate year above task computer. Concern challenge them week front.",2024-11-13T18:24:28,2024-12-02T18:24:28,in progress,Allow run if make. Section do list college. Husband television role five thousand increase.,New David,27724.51,"2 days, 0:00:00",routine,025d1edd-0a4d-4016-81aa-c601d74a249e,2024-10-29T02:09:51,2026-04-07T18:12:43.733109,3c663ec1-9e97-425e-b6f2-ae5ea82dba68,4a0e794b-bfe2-4480-a54f-e1953677bf75
1f453173-b121-4af9-9896-a7f361a997f2,1183ff2b-4d45-4bb5-b674-7441c73903cc,2025-03-01T19:42:32,,"Why Republican week already give. Industry them middle top just leader.
Understand sell enough sister common relate. Care word adult which sure begin. Final them trade add especially.",2025-03-12T07:45:43,2025-04-05T07:45:43,unassigned,College your plan exactly source hope. Out view democratic face seek.,Bradyhaven,39671.44,"15 days, 0:00:00",routine,7a8600e7-c776-452a-b6fe-c4f79beca828,2025-02-28T02:49:47,2026-04-07T18:12:43.733289,dd84eb35-dbd6-4c9c-a707-90aa121f21ca,3b0fb0f8-09f9-4f68-b4ad-d39eb96105a4
077513d5-1ac2-4ca6-b39e-1c9da0d6a6ee,0fd09b32-d37a-4f44-ab04-a4366606e6c9,2024-09-23T23:55:20,2024-11-08T18:28:17,"Religious billion show wall wish. Do create either physical reason take. Level news care food.
Look run report soldier least discussion deal. Hundred success rule yet organization.",2024-09-26T02:32:01,2024-10-15T02:32:01,completed,Senior fly civil another language. Short walk market lose movie remember travel.,Lake Anthonyhaven,19574.84,"15 days, 0:00:00",routine,8ccbeeea-7836-45ae-bfa9-a2f4b7a10bd4,2024-09-23T23:33:31,2026-04-07T18:12:43.733491,994404d7-3b47-44e4-8564-32f5228cdd7f,88267ee3-d604-4a25-bb6e-0bf42ed1b7da
27e50278-1492-4d5a-87c3-803b631d07d2,0fd09b32-d37a-4f44-ab04-a4366606e6c9,2025-06-28T06:07:35,,Cut fall direction already. Could measure such game day. Grow yes trial spend. Effort eight beyond individual party suddenly sometimes.,2025-07-01T02:20:17,2025-07-04T02:20:17,in progress,Option center campaign risk reason. Control education break create ability add there.,East Patricia,28788.34,"19 days, 0:00:00",emergency,574ef814-9815-424b-be6f-7af4027e2b03,2025-06-19T05:00:37,2026-04-07T18:12:43.733665,5e073f72-c475-4043-8258-2a7988b74530,a1689ad8-3c76-4fcf-bb3f-c956a46d7d48
fa993215-3282-4919-accd-a30b9c00a4ce,0fd09b32-d37a-4f44-ab04-a4366606e6c9,2024-08-14T04:15:01,,Memory film range coach look material. South answer sport activity. Thank could police rate should report appear. Become south that general.,2024-08-23T11:05:20,2024-09-01T11:05:20,unassigned,Each nature executive energy. Help about society between experience. One unit interest pass after.,South Natalieland,4842.11,"19 days, 0:00:00",urgent,17941284-a857-4947-9263-fe63bfd59d7c,2024-08-14T02:07:05,2026-04-07T18:12:43.733818,5086bece-5659-440a-87c3-c3cb18eade23,49f9f7f4-f4a8-4c9c-8fa0-5c89bc2e671a
eefa53fb-b787-41b7-b2bc-b4796148804b,1183ff2b-4d45-4bb5-b674-7441c73903cc,2025-04-17T03:30:11,,"Community involve population fine both center very. Expert program see indeed. Safe rise hotel back.
Account current none check late. Interesting miss edge must successful best growth offer.",2025-04-19T03:32:02,2025-04-27T03:32:02,unassigned,Mention whom itself girl already. Reason could economic room film serve.,North Nicolebury,30210.26,"6 days, 0:00:00",emergency,56d9b4f7-e1a5-45e4-a7bb-07d3c6db780b,2025-04-15T22:52:09,2026-04-07T18:12:43.733975,73f2c6ae-8ba5-4c40-9c8f-26148f7fa8d6,a5b3da5a-4a50-4b1c-817d-c23447bf24e1
5ba8b885-75f5-483f-b8ce-99be458ebee6,0fd09b32-d37a-4f44-ab04-a4366606e6c9,2024-05-21T03:28:32,,Audience his far provide. Data writer material production. Least effect side produce.,2024-05-29T13:14:34,2024-06-17T13:14:34,in progress,Likely understand apply free themselves item. Score onto Mrs.,Reyeshaven,9444.99,"24 days, 0:00:00",emergency,af04bae8-99c0-4bb7-89ef-d29b27e1d65f,2024-05-16T14:40:03,2026-04-07T18:12:43.734142,56005ae8-2eda-4700-9ddd-81d24a58f522,b4507be1-191f-4021-a337-bcdc89200b56
83650ba5-1093-44d1-91cd-a065bc5c96ea,01788852-2904-489e-8f04-bb0c9a204f53,2026-03-02T01:21:43,,"House beautiful realize art add speech yeah. Lose customer building popular police up.
Save free authority yes million provide. Page team check real thought child successful.",2026-03-03T02:51:19,2026-03-10T02:51:19,assigned,"Necessary election reach business.
Wall travel west.",West Nathan,2182.17,"2 days, 0:00:00",urgent,77ccf46f-0b0a-4827-9500-b896c2b7f37d,2026-02-19T14:28:51,2026-04-07T18:12:43.734319,4f179786-6b03-4dfe-9bb4-477c43556ef3,d4b8d34f-62a6-4489-b8b5-f36e46dc6fa9
f83b5273-17da-405d-b0d6-5b877cb96736,1b193ccd-19a1-4d90-802b-c54dafe33648,2024-05-12T15:21:09,,Individual stand situation sign perform surface sit. Some national current box.,2024-05-15T18:29:54,2024-06-09T18:29:54,in progress,Sense whether training. Must responsibility operation late process.,Port Holly,3898.7,"10 days, 0:00:00",urgent,84504bc3-0b9d-40ca-824e-4b9168bd1c76,2024-05-01T00:53:49,2026-04-07T18:12:43.734461,96f59913-e694-49bb-be6e-a84aa229184e,7f23192b-0f36-48f6-bb24-6ebe25a3c3c2
d7618ad8-b3c1-45bd-9642-be29d19eac04,1183ff2b-4d45-4bb5-b674-7441c73903cc,2024-05-23T13:44:19,,"Task serve guess style. Water despite develop feeling rock newspaper happy.
Partner fine rest clear authority. Plant way break. Hold page point so.",2024-06-04T04:03:30,2024-06-10T04:03:30,unassigned,Administration question administration standard. Once run grow pattern condition.,Port Jason,33560.58,"22 days, 0:00:00",routine,1cd78c4d-8624-4fc7-bdc3-e16401f32f5a,2024-05-16T05:10:57,2026-04-07T18:12:43.734620,af46b8d9-4c7e-49dd-bd46-9ffc042fbce8,5164ab1e-ffd2-4369-bb14-c219b00bd15c
