work_order_id,assigned_vendor,assigned_at,completed_at,description,due_date,current_status,comments,location,estimated_cost,estimated_duration,priority,well_id,created_at,updated_at,created_by,updated_by
56b82c5f-8ce1-4823-9f99-d12c53c46297,ca57e770-5f28-45a8-b6bf-a9f053606a40,2026-04-02T21:55:14.364855,,"Team likely spring Congress maintain recognize. Appear professor central who foreign her those.
Structure house amount such get table information. Term focus thought free to him boy.",2026-04-14T00:01:21,assigned,Drop fast continue hard. Ground wind cause southern you. Want stock event everybody.,New Josephbury,335.34,3,routine,,2026-04-02T21:55:14.365513,2026-04-02T21:55:14.365514,21a867d7-673c-49b4-b1f9-e4b964041f5a,6935f4aa-cc55-4f90-ba66-727fd2ef3e2e
032352c5-d287-4b6e-b877-62952649d803,cc51c8b6-9c5c-45dd-815b-be0d662991ba,2026-04-02T21:55:14.365533,,Surface past score project month. Civil fine music especially her loss successful.,2026-05-01T20:07:15,assigned,Worry go white easy. Able long summer century price. Every but force size drop.,Barbaraton,5109.98,35,routine,,2026-04-02T21:55:14.365895,2026-04-02T21:55:14.365896,b98ea0ae-d364-4738-a41c-61a25ac26b86,3801bb63-5b92-402b-a97b-2414ac6ad041
acc8c4f7-9c65-499c-bb42-3613c2eab1ed,f974cc76-672c-44a0-8712-56dd13702f58,2026-04-02T21:55:14.365908,,"Probably that some network respond. Group show down white on weight care. Next good hold.
Thus vote could benefit doctor suggest. Door body staff write teach.",2026-04-13T19:51:30,completed,According piece far north sport. Crime peace speech reality foot table.,Spencerton,9180.74,13,emergency,,2026-04-02T21:55:14.366487,2026-04-02T21:55:14.366488,cb5b0b2e-9443-4be0-8db7-b330fd13d76e,61bbe172-1c03-4133-86cb-9f0d37e9dcf0
bec3356d-104e-4394-be15-94cb5002be60,b50d7daa-3fcc-4703-9712-83a2920cfb61,2026-04-02T21:55:14.366501,,About at which toward interesting. Sometimes learn discussion sing certain management religious fill. Chair miss soon also remember huge enough join.,2026-05-01T12:31:27,in progress,Program worry owner guy suddenly. Sport both often road generation wide detail agree.,South Alexanderville,9968.68,69,emergency,,2026-04-02T21:55:14.366806,2026-04-02T21:55:14.366807,ff0bc088-d6ad-43d8-b2b3-18ec6d047c63,eb77bf4b-3b82-4a00-a303-cf71672bbdf5
33f6d8d4-25d6-4c3c-9a31-49323f0f515b,b50d7daa-3fcc-4703-9712-83a2920cfb61,2026-04-02T21:55:14.366818,,"Assume goal former. North modern talk administration. Finally away with environmental middle nor.
Teacher individual thought star value response role. Particular person dog court member its green.",2026-04-05T21:28:52,unassigned,Collection new institution later but strong attack. Lead contain factor within management.,North Kurtport,2872.29,61,routine,,2026-04-02T21:55:14.367177,2026-04-02T21:55:14.367178,f10dfc9b-2f79-472e-81d3-48a15b8d1120,28737159-a704-42d7-9e4d-f721423f3999
2f0444c0-a438-4854-8e9a-4000f255bce2,8845a69f-9d5e-43a2-b043-47d8ac3f8384,2026-04-02T21:55:14.367188,,"Cultural again table. Seek both family bill.
Voice whom quite big culture nature but term. Nor take popular head fill young.",2026-04-07T22:20:09,in progress,Attention town thing. Partner evening sound national group support drive.,Robertside,6155.43,60,urgent,,2026-04-02T21:55:14.367517,2026-04-02T21:55:14.367518,41ec3d29-11b1-4571-8e71-99a7af3030a8,73dd9fa1-872c-470d-94e4-11efede4080a
7b8b2a04-bd18-4894-9286-6cfbbee514e3,f974cc76-672c-44a0-8712-56dd13702f58,2026-04-02T21:55:14.367530,,"Some day research mention.
Price son late model good know information. Because rock reality PM who measure. Bring draw without only first church.
Now fire off alone listen. And attack concern.",2026-04-30T08:34:28,completed,"Second guess happy.
Parent fund still use section every sure. Last real as week game.",Leeview,4623.1,52,emergency,,2026-04-02T21:55:14.367958,2026-04-02T21:55:14.367959,ccf21aad-acab-4908-9ea1-7fe21f836ba3,a86ebe2d-280d-40ed-96a2-0183ca39524e
fa2a2b82-3871-4922-945a-296519433c55,cc51c8b6-9c5c-45dd-815b-be0d662991ba,2026-04-02T21:55:14.367969,,"Even industry difference treatment. Top which special. Help include why per himself sure institution.
Others stuff spring bring perhaps over. Today among day outside truth. Lay up deal.",2026-04-22T19:47:53,assigned,Paper school front reflect return save. Performance crime big ball them win environmental go.,North Ashley,4984.42,41,urgent,,2026-04-02T21:55:14.368291,2026-04-02T21:55:14.368292,b776b519-2d0a-4cd8-b0ac-a53c84774a43,4f4e8ab6-57ff-4923-81c8-47765e178141
3264a9fd-991d-40f4-a53c-a8e44e7e7235,f974cc76-672c-44a0-8712-56dd13702f58,2026-04-02T21:55:14.368302,,Factor type build still population speak. Determine situation there send heavy sing book. Follow management whatever painting leg deal green. Father certainly year agent first peace factor.,2026-04-19T03:26:26,completed,Project debate table mind. Must perhaps through her.,South Sabrinatown,392.11,22,emergency,,2026-04-02T21:55:14.368591,2026-04-02T21:55:14.368591,3413f00a-5779-48ed-a8ad-48d55c3b21bd,b17e979b-0e0d-4c60-9aec-faf4c3df97b6
4c0e2b49-d030-47dd-83b4-ebac248be255,7fd3dcbf-3b69-45f3-8592-c615ef3dc89d,2026-04-02T21:55:14.368601,,Candidate if onto. Seek clear born approach front offer. Including product pretty against property place interest.,2026-04-15T13:49:50,assigned,Letter job produce someone. Each establish place discuss girl heavy summer.,Johnton,5819.14,68,routine,,2026-04-02T21:55:14.368885,2026-04-02T21:55:14.368885,7f3602f9-6cb7-450e-8145-a64af0915cf8,426e524e-a7ea-47cf-a620-b22d6bdc2d75
240ced33-f9c5-4993-a282-bb72258f7f64,f974cc76-672c-44a0-8712-56dd13702f58,2026-04-02T21:55:14.368895,,"Party level represent be rule. Hard pressure beyond today. Certain authority explain American community ever.
Day everyone you.",2026-04-13T12:57:08,unassigned,Stage tell me positive very. Have different social suffer which.,Mckayberg,4605.71,59,urgent,,2026-04-02T21:55:14.369450,2026-04-02T21:55:14.369451,808b27fd-fa2d-43b5-ad78-7e4ccad24c56,75d2b5ee-9d0a-4536-8ea9-0e71c9f23813
59a2d96d-a4a9-43bf-bcbb-2ca6a05d47c5,cc51c8b6-9c5c-45dd-815b-be0d662991ba,2026-04-02T21:55:14.369463,,Hand career be join. Remain garden turn reveal increase mind film. Art foot need arm book whole Mr.,2026-04-30T09:11:58,in progress,Performance ahead break marriage later central. Dinner during rate accept.,East Janetshire,6512.57,28,routine,,2026-04-02T21:55:14.369885,2026-04-02T21:55:14.369885,b98ea0ae-d364-4738-a41c-61a25ac26b86,c04a5867-cd2a-4fbf-91c7-a3d94e2e1057
6faa4375-f451-4498-9574-a168872b36f2,4931f2f7-aa70-4199-9d5d-788589c089a0,2026-04-02T21:55:14.369896,,"Eight guy decade event. List week democratic total step order probably.
Recent officer of modern kind option across. Thus military coach. Base old happy once least program today.",2026-04-30T18:59:43,in progress,Everything large matter hair poor. Enter feeling water chance. Would seat suddenly.,Melaniestad,694.99,70,emergency,,2026-04-02T21:55:14.370217,2026-04-02T21:55:14.370218,620ec94a-fe27-43ac-9da7-173375205614,5240a6ce-267b-418a-8435-64a77c5d30d8
c1073f5c-79b1-420c-b467-9c391ea7ebad,4931f2f7-aa70-4199-9d5d-788589c089a0,2026-04-02T21:55:14.370228,,"Travel sound including take focus our. Onto end study after. Before task establish white recently machine. Teacher involve reflect travel.
Start PM short high issue. Dinner build fast.",2026-04-06T08:16:09,unassigned,Impact record around beyond example organization eat nation. Involve under former.,New Holly,1410.44,70,urgent,,2026-04-02T21:55:14.370579,2026-04-02T21:55:14.370580,bc9853ae-ce30-4334-90e5-266fc5c41e1e,e0d5ed3d-4e41-456f-a2e1-e57ca967eb6b
222badbe-0e9e-4f0e-b9b0-42c832d3b285,f974cc76-672c-44a0-8712-56dd13702f58,2026-04-02T21:55:14.370589,,"Almost say nature. Keep we position thousand cost.
Along he study first law relationship scene. Indicate number heavy site face wear traditional. Career thought happy water mind condition.",2026-04-04T00:24:18,unassigned,Week night significant onto. Station card road agency quite people that.,Mcculloughfurt,6591.93,3,emergency,,2026-04-02T21:55:14.370959,2026-04-02T21:55:14.370960,f7749da0-3989-434f-a86b-741fc10140de,6935f4aa-cc55-4f90-ba66-727fd2ef3e2e
9e0734b8-2d37-4bd9-bc14-60096aecac0f,4931f2f7-aa70-4199-9d5d-788589c089a0,2026-04-02T21:55:14.370970,,"Write second form deal receive open no yes. Town than trade structure power summer finish.
Director wear same partner catch which assume event. Approach clearly recognize particularly.",2026-04-03T01:42:36,in progress,Full chair many bit form party. Get nothing will this deep hair.,Walkermouth,4021.16,61,routine,,2026-04-02T21:55:14.371281,2026-04-02T21:55:14.371282,7180b5bf-0483-413d-961b-ecb7109e1ca9,c3a63f46-960f-4c95-89e8-ee0741499a13
0b735f2c-5623-424a-94af-cb6abab7e91b,cc51c8b6-9c5c-45dd-815b-be0d662991ba,2026-04-02T21:55:14.371292,,Try likely structure information according actually rock hundred. Ground raise station hair research can their beat. Provide among artist.,2026-04-15T07:37:32,unassigned,Stand situation young. Stuff operation whole purpose study night. Free nature rock forget project.,Brewerfort,8003.44,55,emergency,,2026-04-02T21:55:14.371632,2026-04-02T21:55:14.371633,73959fee-7717-4d1b-a79c-d90db6c435ba,e355caf8-37cf-424e-b405-a83248c0ff4a
1b1fadec-e860-4376-8d06-efe3bd981f1c,f974cc76-672c-44a0-8712-56dd13702f58,2026-04-02T21:55:14.371644,,Exist budget environmental benefit. Plan activity camera growth fight class evidence. Outside we issue affect lose organization.,2026-04-17T19:50:16,assigned,New standard model our together their sure both.,Russochester,3464.68,35,routine,,2026-04-02T21:55:14.372054,2026-04-02T21:55:14.372055,1c1f129e-cfd3-4cee-8934-f9f65c506daa,2268603f-8123-44fe-a7bf-9c85d8e7ef40
86365e09-1239-45d4-9015-2dd8dd635b20,cc51c8b6-9c5c-45dd-815b-be0d662991ba,2026-04-02T21:55:14.372065,,"War whether although wonder possible. Movement conference child yard. State condition either paper company better recently music.
Cost take floor bad fish term. Better national ball quite.",2026-04-28T13:54:26,assigned,Nothing son easy life paper office. Show ever on east sit.,Williammouth,5426.66,51,urgent,,2026-04-02T21:55:14.372379,2026-04-02T21:55:14.372380,1d344e67-4c91-4004-8fc4-b11803f47588,865aec9d-e3d8-456e-89d3-043686b55a7d
ab5d73f3-2dbc-48d5-8c31-91a390722756,7fd3dcbf-3b69-45f3-8592-c615ef3dc89d,2026-04-02T21:55:14.372391,,Per direction and watch manage score experience chance. Begin foreign product good.,2026-04-09T10:40:40,completed,"Institution value marriage visit require. Large possible letter.
Often security indicate.",East Gregoryberg,357.78,66,emergency,,2026-04-02T21:55:14.372757,2026-04-02T21:55:14.372757,cb5b0b2e-9443-4be0-8db7-b330fd13d76e,4f976b5b-5b77-43c7-bd3d-5903b0410031
4bea9cb2-169a-4415-a524-85e46f6ef1ef,ca57e770-5f28-45a8-b6bf-a9f053606a40,2026-04-02T21:55:14.372768,,"These official enter various. Option task religious past staff. People some draw Mr teach serve national.
Study fire than just while type. Maybe scene contain reality itself clear.",2026-04-08T03:50:23,completed,True young sea future. Need east side subject television outside.,Jennifermouth,6580.39,16,emergency,,2026-04-02T21:55:14.373127,2026-04-02T21:55:14.373128,c509499f-035a-4d4c-91ed-c4b2a67c602c,2a76e66f-84aa-4c0f-89d9-63d6ce73cfed
df411c95-452d-48b4-9670-98507c645704,ca57e770-5f28-45a8-b6bf-a9f053606a40,2026-04-02T21:55:14.373137,,"Represent end participant born together street. She able sit wrong including. Whatever war owner investment teach top challenge could.
Say television world.",2026-04-27T11:42:39,completed,Better best son determine. Wonder government even blue rule blood. Chair argue think now need well.,Stevensonmouth,6832.01,21,routine,,2026-04-02T21:55:14.373606,2026-04-02T21:55:14.373607,3c0d2ec6-4476-4a93-8580-19f1e57bd115,6a08b730-f548-4310-b344-1c71664b3022
a763fb33-7972-4384-9a93-76e0a94c0a77,b50d7daa-3fcc-4703-9712-83a2920cfb61,2026-04-02T21:55:14.373618,,"Leader tree somebody.
Fast end thousand coach deep seem remain. Anything tree family professional.",2026-04-12T18:30:54,in progress,Time require language fast side surface fear.,Johnsonport,6467.27,24,urgent,,2026-04-02T21:55:14.373921,2026-04-02T21:55:14.373921,83954e9e-6134-437b-8694-d4974a5b852b,56e5fc5c-8f07-45a1-9267-e385b6a03a39
aa9687d3-6a8f-439c-a5b6-ccbfda29a627,b50d7daa-3fcc-4703-9712-83a2920cfb61,2026-04-02T21:55:14.373931,,House every black enjoy everybody finally claim here. Message market media fish who country generation. This thought small traditional build challenge who.,2026-04-24T03:09:48,assigned,Serve act class bed. Gun radio standard television toward. Someone son seven.,Port Kenneth,7691.66,72,emergency,,2026-04-02T21:55:14.374233,2026-04-02T21:55:14.374234,fde2c4c7-54fe-43b4-858c-35c0ebaf9ced,1aa4b986-55e7-4a5e-bd7b-323525dc5181
7ae71af5-131e-4393-84eb-ce0aa0a6511f,b50d7daa-3fcc-4703-9712-83a2920cfb61,2026-04-02T21:55:14.374244,,"Stage education door before. Risk lead early.
Baby avoid meeting within business second. Worker expert name business anything alone nice. Structure employee talk while act.
Fine less region him.",2026-04-21T11:02:04,in progress,Take gun mission add job performance finish. Toward can environment interest.,West Nathan,4889.84,46,urgent,,2026-04-02T21:55:14.374561,2026-04-02T21:55:14.374562,1044ae0f-14cd-4ad3-a7ca-78a021157aed,cb5b0b2e-9443-4be0-8db7-b330fd13d76e
9306ceb5-f156-4e53-81ac-1eb394991ae1,ca57e770-5f28-45a8-b6bf-a9f053606a40,2026-04-02T21:55:14.374572,,"It fish everything threat pick foreign season. Dinner own resource Democrat role social civil.
Turn both once. Write name explain member purpose benefit tonight. Final should range.",2026-04-27T20:53:43,completed,Name bag part break high red. Wrong feel since among particular.,Gabrielfort,635.05,51,emergency,,2026-04-02T21:55:14.374973,2026-04-02T21:55:14.374973,7d0be596-ba80-4686-a609-02113ac9b8eb,97098a12-111c-4e36-ac39-23b4ebf87daf
97bad724-7aca-4c5a-9302-571fc24aebcb,011c2b7f-f847-4e96-bd50-b107209bc5c1,2026-04-02T21:55:14.374984,,Assume director book simple. Anything dark side eat someone however special.,2026-04-28T15:45:54,in progress,Accept positive above room. Relate fact admit eight make.,New Daniel,3925.15,65,routine,,2026-04-02T21:55:14.375266,2026-04-02T21:55:14.375266,40180817-bfde-408a-bc33-a4e6db9d37c8,81ea994e-b2f7-4488-b4fc-040eda9557b5
61ccbe20-7ab4-402a-854a-0075de9e6d34,f974cc76-672c-44a0-8712-56dd13702f58,2026-04-02T21:55:14.375277,,Peace bag product although Mrs. Door require head bar.,2026-05-01T07:58:44,unassigned,Method old easy security tell. Voice same heart.,Larsenside,1598.42,12,emergency,,2026-04-02T21:55:14.375604,2026-04-02T21:55:14.375605,80f550c1-bd60-4caf-8405-725683d486d4,eb3167d4-b8a0-4908-80d9-fe214da28c98
ba0fd49d-3250-40bc-a11e-a0c848d81f11,4931f2f7-aa70-4199-9d5d-788589c089a0,2026-04-02T21:55:14.375616,,"Lot position force general pass item. Hear will particular such federal. Already give eat.
Air entire star example believe. Everything purpose ground read tax.",2026-04-22T17:59:06,unassigned,Those nature future. Time sit once arrive board government go.,New Cheryl,8622.53,47,emergency,,2026-04-02T21:55:14.375925,2026-04-02T21:55:14.375926,be1030f4-8c25-4ba0-b2f0-760024fa1dc9,d46b2d0f-2b3a-41d1-baa3-592ed5a59101
37196b69-960b-400c-90b3-b8d2a0f9b3ff,91400177-58db-4f1c-ae89-d1cd8d922248,2026-04-02T21:55:14.375936,,"Remain various later safe every. Real capital generation ok call.
Traditional necessary middle seven care condition size though. Same blood crime practice Republican father best south.",2026-04-10T12:16:28,completed,"Cause attack career our. Better source budget.
Give chair two. Goal how education not.",Moralesland,2257.78,40,routine,,2026-04-02T21:55:14.376275,2026-04-02T21:55:14.376276,c76dfbe7-b9a7-41ef-8fc3-b04241978c48,c9785b82-97cf-44a6-bf93-9274a94c8409
e3579844-ef31-49a0-831c-e606d7af654c,f974cc76-672c-44a0-8712-56dd13702f58,2026-04-02T21:55:14.376286,,Best heavy more effort smile say economy. Style relate sister involve technology election.,2026-04-25T16:19:38,in progress,Radio raise usually religious. Care head bill total itself population.,South Michael,3543.0,12,emergency,,2026-04-02T21:55:14.376546,2026-04-02T21:55:14.376547,f0bac11d-8e9d-4660-b9ed-270ffb2b4c79,89cd40d5-e6f6-4b09-8309-3fd5f630ef94
127467bc-5ca0-46b2-8b83-747200f16956,cc51c8b6-9c5c-45dd-815b-be0d662991ba,2026-04-02T21:55:14.376557,,Responsibility explain factor nice probably. Official significant run world.,2026-04-11T13:44:43,assigned,Firm local recognize much director. Do later fire body do. Grow finally without without.,West Jonathan,8822.18,10,urgent,,2026-04-02T21:55:14.376849,2026-04-02T21:55:14.376850,8b2d2ca5-b565-46b1-93b5-40932ed94402,a42d1bf4-6de2-44ea-8637-374a499c96b9
9bc32b62-df06-47fd-86d8-5f78c63e0b46,ca57e770-5f28-45a8-b6bf-a9f053606a40,2026-04-02T21:55:14.376860,,Study note must seek speak message see work. Coach race call leader. Notice player myself write.,2026-04-16T14:32:37,completed,Admit leader lot such sound various. Energy provide result minute within debate let.,Christensenstad,2730.24,32,urgent,,2026-04-02T21:55:14.377169,2026-04-02T21:55:14.377169,ea1a6856-145e-41ce-a631-fa66ba8e665c,b3c3cbad-2718-41d7-a011-92a44a0bb846
087aed4f-64e0-441c-b2b1-80961b22f8d2,011c2b7f-f847-4e96-bd50-b107209bc5c1,2026-04-02T21:55:14.377179,,"Past cultural either especially sing friend million. Card when way wind goal federal month prevent.
Million both true mind parent herself between over. Road tough who.",2026-04-25T11:40:32,completed,Evidence tonight cause other mind her. Back somebody office.,New Robertoside,3261.95,43,urgent,,2026-04-02T21:55:14.377518,2026-04-02T21:55:14.377519,8bfd8da2-aed0-471b-b109-ae88d8f73bdb,c5f567e7-548b-4f37-8eec-e9dd6fde1b6e
0c5320d5-2941-4be2-bb6b-403165511d85,cc51c8b6-9c5c-45dd-815b-be0d662991ba,2026-04-02T21:55:14.377530,,Sit edge kind represent walk. Miss phone carry coach international article change. Charge me half season community set police.,2026-04-10T09:51:45,assigned,Government political station near cover simply information.,Trevorburgh,6869.46,51,emergency,,2026-04-02T21:55:14.377816,2026-04-02T21:55:14.377817,b11cc6c2-5239-4579-81c3-82efac03d085,32de1161-774f-4974-8c25-498bc8e6f144
b393f641-193f-4325-b18b-38acc234ae2f,4931f2f7-aa70-4199-9d5d-788589c089a0,2026-04-02T21:55:14.377827,,"Police able perhaps buy baby social voice walk. Organization positive return establish somebody word. Nation miss respond officer.
Work usually yes moment. Church adult worry mind matter push.",2026-04-21T19:43:33,in progress,Doctor option computer per. Take upon television whose both treatment. Position price century this.,South Andrewland,3382.44,11,emergency,,2026-04-02T21:55:14.378239,2026-04-02T21:55:14.378240,dc25b1e8-88d7-408f-bf32-6fa97d064c25,5cc08f05-db88-4223-ae26-acafa909fef5
b110c7cd-39c6-4c4e-98e4-d8b18e3f0c02,cc51c8b6-9c5c-45dd-815b-be0d662991ba,2026-04-02T21:55:14.378249,,"Cover office six recognize. Fund good hot surface source north peace.
Let third officer card main week somebody air. Compare toward again act life policy race.",2026-04-03T13:50:11,completed,Generation doctor sell quite. Art meet about better yard fall. Ok picture role wide difference.,Josephview,4772.51,10,routine,,2026-04-02T21:55:14.378581,2026-04-02T21:55:14.378582,4c7b5b41-437f-4b32-a77a-4fddebeb2aab,6935f4aa-cc55-4f90-ba66-727fd2ef3e2e
15e313b0-9938-4c89-9e94-bbe4dd7da325,b50d7daa-3fcc-4703-9712-83a2920cfb61,2026-04-02T21:55:14.378591,,"Natural ask east window drop pick. Message threat here arrive. Girl feeling human husband word exist.
Religious take soldier east professional true. Itself leader rule fish establish less bit.",2026-04-28T22:09:15,completed,Early case year wall. Modern name investment assume lay. Father lot station he.,Hawkinsland,1200.54,38,routine,,2026-04-02T21:55:14.378963,2026-04-02T21:55:14.378964,d466b8b7-453b-48aa-851c-56db16f2cdbf,05a26b80-8022-438d-9173-88b17f75069c
259c3cf2-661f-4ea4-91cb-940276a2b1a4,8845a69f-9d5e-43a2-b043-47d8ac3f8384,2026-04-02T21:55:14.378974,,"Feeling finally charge treatment happy worker. Add last leave another.
Near wife law me media law fast. Play say play every.",2026-04-14T03:27:27,unassigned,Physical might Congress fund and much. Modern science baby too.,Port Reginaldland,3790.44,1,routine,,2026-04-02T21:55:14.379283,2026-04-02T21:55:14.379284,5e3477d0-6a3b-474a-9402-aa44608bc8a2,a71ea3db-6cd3-45ef-b80c-a3d058d9acb3
df6dc616-d641-44cf-a449-686d829a45ba,f974cc76-672c-44a0-8712-56dd13702f58,2026-04-02T21:55:14.379294,,"Test agent safe issue simply partner. Can sometimes bring second. Full include arm poor truth.
Answer second always former and. News reach situation say. Medical table season his.",2026-04-21T12:49:14,assigned,Form hold risk among. Personal defense dinner once sing yet.,New Jeffrey,6545.49,23,routine,,2026-04-02T21:55:14.379626,2026-04-02T21:55:14.379627,f6d22e3d-7d44-48cc-99c6-c02600092108,31d329eb-feb8-4b45-ab88-9624c17e88fb
b9a7082c-3df5-4ba4-b567-da2ba3fd180f,b50d7daa-3fcc-4703-9712-83a2920cfb61,2026-04-02T21:55:14.379639,,"Key everyone score especially collection. Purpose yes range action. Ask feel ahead nothing your.
Pull south yard positive. Design health black.",2026-04-07T02:39:58,completed,Course country exist value any concern. Yeah option evidence worker necessary role.,Hardyview,6280.37,50,routine,,2026-04-02T21:55:14.379993,2026-04-02T21:55:14.379994,765ebb4c-62b1-4e18-90b9-e65bcd0169cd,0e3ef86f-d645-4a01-94b8-eea451d54232
fe050a46-a59c-4d66-a6e2-85057a9b07bd,b50d7daa-3fcc-4703-9712-83a2920cfb61,2026-04-02T21:55:14.380005,,Century sport late people already after. Never program quickly security. Read white discuss notice. Fish policy pretty clearly red half foreign.,2026-04-27T02:55:51,completed,Citizen ever age tax maybe site. Drive reason trade expect guess window.,South Joshuaburgh,9860.85,57,emergency,,2026-04-02T21:55:14.380575,2026-04-02T21:55:14.380578,d7ed82df-bbc6-40f4-a685-fcf69bcd174c,c76dfbe7-b9a7-41ef-8fc3-b04241978c48
6e51ff1e-3669-4743-964c-5bac5da19a68,011c2b7f-f847-4e96-bd50-b107209bc5c1,2026-04-02T21:55:14.380602,,"Place wear white half go reflect down. Reduce day with card then.
Natural southern exist yourself lawyer wonder action.",2026-05-01T10:14:38,unassigned,Interview occur list account site. Each start have hit these something true.,Rileychester,1703.65,63,emergency,,2026-04-02T21:55:14.380960,2026-04-02T21:55:14.380961,a0273f47-68a5-46e3-861f-83e5753d137a,f880816a-3d6e-45bc-8751-23f53d2a31f8
85178290-d6be-4889-976b-0991081f3d8c,4931f2f7-aa70-4199-9d5d-788589c089a0,2026-04-02T21:55:14.380974,,"Quality man human important than. Bit example hot democratic whose.
Yourself sell indeed question kid eight machine speech. Stuff anything stuff close. Coach determine wide only many market.",2026-04-14T08:52:11,in progress,Really girl across. Whether approach true effect include who instead. Can beautiful catch small.,Port Lindsey,1318.88,32,emergency,,2026-04-02T21:55:14.381325,2026-04-02T21:55:14.381326,d46b2d0f-2b3a-41d1-baa3-592ed5a59101,7fd1ddc9-1f8c-43f4-9738-8de823274fe1
3c7d007a-d349-44d9-9794-219a1d8fb4b7,011c2b7f-f847-4e96-bd50-b107209bc5c1,2026-04-02T21:55:14.381337,,"Structure dream much truth among. Economy case far they.
Southern easy build may miss.
Write right amount push hold society. Sing arm dog true exactly. Light act weight player issue.",2026-04-19T08:59:21,completed,Big society fire six.,East Rachelbury,4685.17,5,emergency,,2026-04-02T21:55:14.381669,2026-04-02T21:55:14.381670,c5f567e7-548b-4f37-8eec-e9dd6fde1b6e,8e95133e-b068-48ff-af64-bc22e7dcf019
93d21187-2643-4191-82e3-d17e0d8a31fb,4931f2f7-aa70-4199-9d5d-788589c089a0,2026-04-02T21:55:14.381681,,"Scene so cover carry. Wait woman tax above statement.
Adult leader sure risk some. Employee cover quite blue whether. Say behind rate.",2026-04-14T10:07:31,completed,Poor style single participant remember long shake lay.,Dwayneport,3165.34,65,routine,,2026-04-02T21:55:14.381962,2026-04-02T21:55:14.381963,e2ff1147-8849-40fc-a79b-7e0294860ea8,bc43c794-901e-4512-ada4-0a415409d71f
2453e459-6250-475e-9b04-2ca76a9a88c7,011c2b7f-f847-4e96-bd50-b107209bc5c1,2026-04-02T21:55:14.381974,,"Happy sell quality include within break. Look no individual reason science race. Reason lot myself drive appear section.
Four science poor together. High marriage bad detail the.",2026-04-05T20:24:26,in progress,Near standard share strategy author sea beat.,Dianeview,9785.69,55,emergency,,2026-04-02T21:55:14.382312,2026-04-02T21:55:14.382313,2ca0326c-01e0-47cd-b9c5-316421986974,2a115275-d9a9-4cac-a66f-34e8334906ed
cd07e939-d8bd-4915-9027-70e56d37e3af,011c2b7f-f847-4e96-bd50-b107209bc5c1,2026-04-02T21:55:14.382324,,"Action road lawyer education. Happen against fly ahead. I dream probably if.
Agent manage back develop walk throw.
Pretty put personal through good.",2026-04-26T17:43:28,unassigned,System above subject deep product. Training at organization ball. Plan rather go similar yet.,Paulfort,8945.16,36,emergency,,2026-04-02T21:55:14.382746,2026-04-02T21:55:14.382747,73dd9fa1-872c-470d-94e4-11efede4080a,ab086ab4-ad5e-41aa-aff0-3ee1a5804970
9b4e6f83-b273-42f9-bfcd-3e9b7c53bcf4,d2dd205d-dd9d-4dde-aabd-8d58b9374e1a,2026-04-02T21:55:14.382756,,"Upon term painting season close. Similar able wife six help idea meet.
Head until issue pass. Newspaper her effect travel likely wide reveal.",2026-04-18T23:19:29,completed,"Lay least note end director.
Effort this rich turn yet.
Despite amount task I.",Karenside,2902.8,22,urgent,,2026-04-02T21:55:14.383118,2026-04-02T21:55:14.383119,b3d86fc2-30bf-4f15-8632-81355ba425ed,3a58180b-bde3-4005-bccc-f2bba852e531
