work_order_id,assigned_vendor,client_id,assigned_at,completed_at,description,estimated_start_date,estimated_end_date,current_status,comments,location,location_type,latitude,longitude,estimated_cost,estimated_duration,priority,well_id,service_type,estimated_quantity,units,is_recurring,recurrence_type,cancelled_at,cancellation_reason,created_at,updated_at,created_by,updated_by
678b638a-cf47-4551-a541-a8cd3e0a49de,9deb59e9-2b41-4fa0-b272-fa2b3dc749de,088edccc-2f3d-4fae-874a-0a4ed06779c6,2026-04-03T10:34:50.741057,,"Mr only such always when sense away. Race wear identify deal hear. Page almost let feeling indeed eat rock.
Economic relationship fine environment deep nice. Pull recently no easy network.",2026-04-05T03:32:05.532918,2026-04-07T03:32:05.532918,IN_PROGRESS,"Home camera fight.
Over conference risk vote measure back.",East Chrisborough,GPS,-13.3443565,-94.938795,33219.15,"2 days, 0:00:00",HIGH,6b2f79d6-d6d0-4041-8e07-26bcf5b0c7e2,1fa126ef-30c4-4cf2-9294-a6d23c75936f,31.43,gallons,False,,,,2026-04-03T04:06:11.126035,2026-04-12T23:49:46.263319,4d3d2d79-423f-45bf-822f-309f905608d1,32b039af-278a-451c-bc76-1c0f0afba2e1
8237a3b9-5a1e-4b78-b439-b217ff045756,87557121-007b-4e66-9a6e-733b6e2bc363,29689696-7a26-4c08-8f61-b3d86c203be7,2025-12-06T15:15:13.082030,,"Fast cell system center well. Push new east glass send school bring wrong.
Pick prove address why. Minute ahead project individual opportunity service. Open quality hope reduce state allow herself.",2025-12-07T19:26:47.047919,2025-12-12T19:26:47.047919,CANCELLED,Senior paper maybe opportunity group. Fall accept business authority.,North Kristieville,ADDRESS,-50.098208,-20.371088,3863.3,"1 day, 0:00:00",HIGH,738272c3-3fbd-4e24-b07f-4d42b2b27da6,3e1fd343-c96f-4490-a7f7-233a93117cfd,39.93,loads,True,WEEKLY,2025-12-08T04:58:49.061135,Client cancelled request,2025-12-05T15:17:28.790226,2026-04-12T23:49:46.263537,25d743d6-8bb8-4926-beb2-f332daf1d4ca,30e6f645-4c0e-49b2-8735-ab0d7e631637
9798bd6d-ec69-483d-a9de-7c1a0812788f,600ad80b-c837-4db6-b132-5c5f8b995ef6,d3d1c29a-f1f9-46d1-bd15-d62e528334f9,2025-04-11T12:01:42.301303,2025-04-16T01:40:00.448287,"Democratic free choice old plant indicate send. Compare painting agree subject.
Such cold for stop federal process week. Which goal reflect him health third. Account upon door safe.",2025-04-13T03:47:15.484104,2025-04-15T03:47:15.484104,COMPLETED,"Artist ahead national role. Memory hair idea that.
Tv anything sea. Share big phone upon two.",East Robertchester,GPS,27.867848,28.758477,46048.53,"3 days, 0:00:00",MEDIUM,16174496-c369-4e17-bd66-bc60c40584cb,73148b49-8f75-4090-8b7e-23d5ea575b39,63.55,visits,False,,,,2025-04-08T20:44:58.238464,2026-04-12T23:49:46.263742,85aefd78-1d87-4ea4-9fbd-3469872d787f,0d5587e0-61bf-474a-9919-3a5baeea521b
6f8f43c1-ff0d-45f7-a93c-12e72f216fe2,62aab707-f2c5-4283-86fb-7bdb83f4ac9b,a0be935d-e8a0-460e-9e83-b7480a847df3,2025-01-30T14:21:36.489441,2025-02-06T14:24:10.659159,"Particularly hold sister want dinner Mr.
Answer institution interest so song pattern bad. Claim central likely will television back continue. Above want suddenly child our.",2025-01-30T15:33:06.388063,2025-02-04T15:33:06.388063,CLOSED,Long man record three day. Accept case change candidate.,Donville,ADDRESS,-38.846191,170.020687,43257.09,"2 days, 0:00:00",LOW,5bac6ecc-7104-4ea1-ad26-42664373e19e,73148b49-8f75-4090-8b7e-23d5ea575b39,81.63,visits,False,,,,2025-01-29T08:06:19.862859,2026-04-12T23:49:46.263924,516bb09c-c38a-4256-9a28-5a7166886f95,6bd15aaf-3088-4a2b-b597-11d6140f6157
649e27df-6e21-41b5-a7d6-d09d3b97d2cd,87557121-007b-4e66-9a6e-733b6e2bc363,d4347d99-2c69-4d0e-a2c0-37c94f738087,2025-06-26T07:14:18.796497,,Third must author eye read beautiful. Finish edge care strategy month common perform. Should anyone difficult but page democratic federal.,2025-06-26T14:55:12.018227,2025-06-29T14:55:12.018227,ASSIGNED,Because key perhaps see suffer already cup.,North Chrisside,GPS,11.13874,163.81587,49724.97,"2 days, 0:00:00",HIGH,b8c78a4b-7965-4d4c-9546-ad7c50461653,c357ce45-c285-4528-a39f-f2b46f1d7cd8,45.48,visits,False,,,,2025-06-24T00:09:00.270844,2026-04-12T23:49:46.264083,580abc52-344c-45f9-87f1-eb7beeeb3ee1,b125aec9-6874-4782-8c04-45573ed5cb97
da7106d2-13e4-4a25-89cf-7f00fe81eaa7,87557121-007b-4e66-9a6e-733b6e2bc363,458c914b-8ff0-421f-b274-6701c9d3dc4f,,,"Environment need church administration company when protect. Newspaper enjoy per. Same first believe you why tend star.
Leave a family test bed tree. Act world tend budget.",2024-06-11T19:19:03.466755,2024-06-13T19:19:03.466755,UNASSIGNED,Hard address you perhaps space. Without hot car want third perhaps then could.,West Robert,GPS,-63.3602075,-157.184709,16804.98,"1 day, 0:00:00",MEDIUM,40b5eabe-a90c-4a58-b6b3-f99ee728e400,3e1fd343-c96f-4490-a7f7-233a93117cfd,93.21,hours,True,MONTHLY,,,2024-06-09T15:14:35.514953,2026-04-12T23:49:46.264250,19f2cf24-dd90-4bb0-8aff-b67c005de6b5,a76fc7e7-36a9-497d-8346-b7b3fdec1c03
dd113ce3-4b90-4b6a-a92e-e53c219df822,f1c4b27c-6e22-48a1-a23c-8d646460dcc9,6b9c89b1-facd-4e99-aba4-6b40cc2111ef,2025-07-27T18:22:16.214026,,According clearly cell plan contain put four focus. Measure husband full direction rule rate expert.,2025-07-29T01:02:03.825433,2025-07-30T01:02:03.825433,ASSIGNED,Professor place official hear.,Owensside,WELL,3.968088,-76.777808,49158.12,"2 days, 0:00:00",MEDIUM,d187ebb0-673d-47a3-a284-3725273488db,4e7fc312-7d39-40c4-8680-e6cb72b0aa8b,69.15,visits,True,WEEKLY,,,2025-07-26T00:19:18.423608,2026-04-12T23:49:46.264414,66f7c067-b72f-4add-bb14-f4320c8a5bc4,2211061a-8816-4c4f-9697-fe307463d044
02cfd02f-e2d8-4b4e-b082-06e915a67899,4c23bea9-bb9e-4064-83d9-a54f94a01185,6c88825d-881b-4bee-a20a-e54860f10258,2026-01-01T10:31:32.493907,,Ability field deep natural ask environment. Hundred hair authority green responsibility.,2026-01-01T20:04:14.418188,2026-01-05T20:04:14.418188,HALTED,Herself heavy conference quality media data notice. Task and today eight defense.,Kevinview,ADDRESS,-35.229156,-96.104518,49043.63,"3 days, 0:00:00",HIGH,0dc6f9f8-764c-485f-93f6-124b771a81b7,1fa126ef-30c4-4cf2-9294-a6d23c75936f,46.36,hours,True,MONTHLY,,,2025-12-31T19:33:55.321170,2026-04-12T23:49:46.264600,d0140331-cbcc-4632-93f4-4aba9cb62c82,cd8fb0c9-de31-484b-831c-e7e1fb1b9601
fbd6d020-f257-451a-843f-e49445c7faea,0709cc65-6c9f-4f4d-8ae3-f0bbc2a2a1a8,e51e2d86-c1f3-4d90-90f1-7117fb277a1d,2025-06-04T11:54:47.717243,,"Plant miss during design. Again voice stock poor huge room task.
Center effect rich suffer power. Instead strategy say particularly.
As support design prove ball.",2025-06-04T19:49:41.031910,2025-06-06T19:49:41.031910,REJECTED,Impact simple decide court state sister job now. Research myself then cold break.,West Timothy,WELL,-84.4139665,116.574235,8793.84,"3 days, 0:00:00",HIGH,f604a61f-acf2-4152-9792-47a6dc2ac94e,73148b49-8f75-4090-8b7e-23d5ea575b39,13.69,hours,True,WEEKLY,,,2025-06-02T14:01:38.877210,2026-04-12T23:49:46.264784,d5a2eaae-a6fb-4371-ba26-982372a09509,0ac85ecb-0e78-4d3e-806a-01ed4aaf145f
135d5207-9e5c-44f5-993c-d69d9037666d,1d7e9e8f-40be-49dc-9672-3aa65ee2f0d0,17466069-387c-486d-be2b-cfeb30f62c1a,2024-07-17T00:45:18.443354,,Sense fill early remain. Policy social available little could free happy.,2024-07-18T09:52:28.042340,2024-07-20T09:52:28.042340,CANCELLED,Day education knowledge occur material.,Millerberg,GPS,-62.3414045,140.724173,42035.16,"2 days, 0:00:00",LOW,d9d2e2ba-c5d2-4dbe-bf4b-09bc8de4d65d,4e7fc312-7d39-40c4-8680-e6cb72b0aa8b,33.77,visits,True,DAILY,2024-07-18T02:29:09.284070,Client cancelled request,2024-07-15T13:37:59.094347,2026-04-12T23:49:46.264968,caf3b6f3-4a4c-4d8a-9744-98ec977801ee,6793e809-89e7-48a8-b8f1-67675c7ed032
28ccea26-e373-41f6-8cc1-d5bdc2d0cc09,3dd270ee-41ef-47ed-98c8-22b2af21b4aa,ac5b1c50-7bd0-4ab9-ae40-7f1e992ad093,2025-04-01T15:36:01.380800,,"Role respond let cell. Table including arm bank all student throughout.
Media should she organization. Teacher range plan involve size election. Republican especially late nothing real.",2025-04-01T23:03:59.627653,2025-04-06T23:03:59.627653,ASSIGNED,Military but interesting watch hotel cell reality. Hundred watch stay call.,Maryfurt,GPS,-86.976941,-159.186888,28926.8,"2 days, 0:00:00",LOW,20d17604-106d-416e-b623-92bcea21b9ec,4e7fc312-7d39-40c4-8680-e6cb72b0aa8b,20.2,hours,True,MONTHLY,,,2025-03-30T07:01:05.471563,2026-04-12T23:49:46.265148,0102bd96-503d-4b1f-9970-cd4260d8e4cd,1c2f0935-25da-4e6c-9b65-1162b04cb2c1
8c646e45-4b60-4e76-956b-03c7284b6abd,9deb59e9-2b41-4fa0-b272-fa2b3dc749de,6bb8f685-7691-4a60-88bb-50753e20ce29,2024-11-09T07:18:41.491299,,Indeed lawyer page beat suffer you dog every. Break foreign traditional. Skill third interesting. Yeah the his budget.,2024-11-11T02:55:24.193315,2024-11-15T02:55:24.193315,CANCELLED,Kid chair read strong. Line fight focus explain large various.,Jenniferland,GPS,-26.804608,-12.915892,19743.86,"3 days, 0:00:00",HIGH,f0a7005a-7fa6-4d63-b289-e191fd63aec1,1fa126ef-30c4-4cf2-9294-a6d23c75936f,82.09,hours,False,,2024-11-10T13:10:05.436231,Safety concern,2024-11-08T09:10:31.330544,2026-04-12T23:49:46.265355,7943280a-3585-4f31-ae3b-aec30c103a8c,66f7c067-b72f-4add-bb14-f4320c8a5bc4
cbc3d415-f213-4dbc-8054-a723e2885b84,ad31d7e7-9a34-4eb1-8030-317d6d9d1a4d,d3d1c29a-f1f9-46d1-bd15-d62e528334f9,2025-12-06T14:52:37.857243,,"Billion those national.
Perhaps apply someone above easy listen.
Until court keep garden clear. Body speak probably sport. A throughout model after.",2025-12-08T14:39:59.494844,2025-12-11T14:39:59.494844,HALTED,Conference pattern else indicate born grow. Whatever development while sort window respond out.,Lake Lauraberg,WELL,-88.3096015,-134.676396,7453.1,"2 days, 0:00:00",LOW,a3c01c7f-ca81-4827-9505-c5ce4bd909ec,ba2aec32-4f9f-4149-8dcb-c98d113c1dd1,95.24,hours,True,DAILY,,,2025-12-06T06:37:29.818110,2026-04-12T23:49:46.265546,4eda784a-3a2f-4180-bf72-d0ef86ae20aa,1949c193-0141-47db-bb79-fb10c87d43a5
86ebd3c7-5179-44c4-ad57-a97cc0175272,600ad80b-c837-4db6-b132-5c5f8b995ef6,ac5b1c50-7bd0-4ab9-ae40-7f1e992ad093,2025-02-15T19:28:13.572593,2025-02-20T16:54:13.172957,"Determine while economy kid if person. Religious market different them social. Ever game direction off.
Part color quickly human model.",2025-02-16T23:17:13.565032,2025-02-18T23:17:13.565032,COMPLETED,Data machine bed. Space feeling painting bring mention nothing.,Salaston,GPS,-31.932044,-140.632055,1135.67,"3 days, 0:00:00",MEDIUM,dac3e8aa-5570-49ca-aa41-8c964b8f5bf1,ba2aec32-4f9f-4149-8dcb-c98d113c1dd1,18.81,hours,True,WEEKLY,,,2025-02-13T00:38:41.936117,2026-04-12T23:49:46.265748,d8485552-ccb8-4ffd-b793-99cbd6a658d4,aec374ef-0e4b-445b-8539-67918ed841ef
b1d88ef2-32dd-4a30-b8ec-125a6c6c0e1d,f1c4b27c-6e22-48a1-a23c-8d646460dcc9,dcc1e17c-3547-4d18-8cc2-b9e8053b19d4,2026-01-28T23:11:28.599091,,"Commercial concern condition. After history popular station production. Easy media fast opportunity hard.
Leg move dark air tax. Say as resource feeling. Big much gun wrong society trouble.",2026-01-29T10:02:55.848418,2026-01-30T10:02:55.848418,HALTED,Ago wait least.,East Kerri,GPS,-47.80644,-23.097164,2973.51,"3 days, 0:00:00",LOW,4dfe3479-c870-45e9-a84a-6bc72280dcaa,4e7fc312-7d39-40c4-8680-e6cb72b0aa8b,6.7,gallons,False,,,,2026-01-28T16:19:02.967562,2026-04-12T23:49:46.265954,4430b652-9dfd-4d3f-8f25-791b277b8aa2,84d4e92e-98ad-4630-a4f2-fbbcf0b03cf1
f661fbb7-40d0-4bc0-84a5-2eb0053674fc,9deb59e9-2b41-4fa0-b272-fa2b3dc749de,ac5b1c50-7bd0-4ab9-ae40-7f1e992ad093,2024-05-08T02:09:45.985157,2024-05-12T20:28:21.791893,"Loss fear strong determine husband. Prevent between suddenly around.
Yourself husband wear participant moment peace meeting. Claim full move behind may.",2024-05-10T00:15:17.044516,2024-05-12T00:15:17.044516,COMPLETED,Election reason how beautiful surface issue fly. Camera art human most yes board.,South Jamesbury,WELL,-43.399827,-47.884709,12486.6,"1 day, 0:00:00",LOW,a127374c-ede5-421e-8ccf-3697b632f691,1fa126ef-30c4-4cf2-9294-a6d23c75936f,26.31,visits,True,DAILY,,,2024-05-06T03:33:00.764355,2026-04-12T23:49:46.266153,58479e41-6935-41cf-96f8-63a03cf35975,c77c5878-ae03-4373-b7a6-2ac936189261
d930a248-22af-4624-b3ad-819d0ab346ea,ad31d7e7-9a34-4eb1-8030-317d6d9d1a4d,17466069-387c-486d-be2b-cfeb30f62c1a,2026-03-07T05:46:50.116502,,"Behind soon spend air. Capital actually marriage begin. Miss himself resource move computer participant mention.
Political officer sit now.",2026-03-07T05:59:04.754571,2026-03-11T05:59:04.754571,IN_PROGRESS,Research choose lead look seat husband. Modern traditional couple yeah everybody discuss.,Arellanomouth,WELL,-16.900607,-171.119103,27105.95,"1 day, 0:00:00",LOW,04847602-db19-4c1a-8aa5-9b8645d42d3d,ba2aec32-4f9f-4149-8dcb-c98d113c1dd1,77.07,hours,True,MONTHLY,,,2026-03-05T23:53:47.482046,2026-04-12T23:49:46.266338,ab862857-291f-4376-a721-da8aa95b4beb,5b1146ec-4a52-423b-b82b-2f213223535e
aa4e3b2e-5c3d-4886-b436-b317b2e3c6a7,0709cc65-6c9f-4f4d-8ae3-f0bbc2a2a1a8,e51e2d86-c1f3-4d90-90f1-7117fb277a1d,2024-04-24T22:00:35.177741,,"Single religious would of.
Her section new general suggest interview. Discussion at painting year instead. Wall onto factor game now officer time reach. Reduce staff case chance.",2024-04-25T18:38:04.846108,2024-04-26T18:38:04.846108,ASSIGNED,Deal common though despite down several similar. Week mission finish down.,Port Jessechester,GPS,17.475542,-40.228638,31167.33,"3 days, 0:00:00",LOW,f604a61f-acf2-4152-9792-47a6dc2ac94e,1fa126ef-30c4-4cf2-9294-a6d23c75936f,17.0,hours,True,DAILY,,,2024-04-22T01:37:36.989062,2026-04-12T23:49:46.266507,4c5da63c-a850-4b32-a095-2a2a7bd058e4,b516238c-8891-4055-aa48-486432307e67
45e0d573-f1ea-407d-b86c-ba7e6a40b8ae,ad31d7e7-9a34-4eb1-8030-317d6d9d1a4d,4ec8e0e9-3415-4edc-8390-bb350c4d0b20,,,"Early business happen.
Fall expert find attention myself recently field kid. Visit girl knowledge without party. Teach may many national live almost four.",2024-06-10T15:44:27.207514,2024-06-13T15:44:27.207514,UNASSIGNED,Believe every at trouble billion.,Robertmouth,WELL,22.9490355,23.269728,35080.23,"3 days, 0:00:00",HIGH,e9a9542b-1a69-4849-8bd7-5f03059a47ee,ba2aec32-4f9f-4149-8dcb-c98d113c1dd1,38.74,hours,True,ONE_TIME,,,2024-06-09T14:23:17.908323,2026-04-12T23:49:46.266795,8b8807f4-c988-4fd1-8838-a2d500359eb1,79708746-819e-40b2-a84f-5e536d563e8e
c8e661dc-94c5-411c-b73a-22f27e77048c,4c23bea9-bb9e-4064-83d9-a54f94a01185,d4347d99-2c69-4d0e-a2c0-37c94f738087,2025-09-05T07:32:16.256801,2025-09-11T10:38:24.020424,"Learn garden six. Today mother character wind. Ok decision item live small game.
List brother scene own citizen different. World measure street way. Teacher else strong cover.",2025-09-05T13:09:34.456314,2025-09-10T13:09:34.456314,COMPLETED,Follow serve education large.,New Lori,GPS,62.141966,34.337692,39038.7,"2 days, 0:00:00",MEDIUM,13dcc75b-5843-4681-87ce-e3ac603d363c,1fa126ef-30c4-4cf2-9294-a6d23c75936f,18.64,loads,False,,,,2025-09-04T09:33:32.388670,2026-04-12T23:49:46.266991,b6171d82-9389-47e8-b2bd-9744959f6664,5bdab328-e7ab-49c2-a894-7da5814cf220
f4c7f67a-5014-4203-938c-96afa631f3f1,4c23bea9-bb9e-4064-83d9-a54f94a01185,6b9c89b1-facd-4e99-aba4-6b40cc2111ef,2025-01-01T10:50:10.614433,,"Truth value what item take once. Should must my. Find child course part thing chair act.
Seek century visit. Different more scene condition benefit not character. Cup without study him.",2025-01-02T00:05:01.258083,2025-01-03T00:05:01.258083,IN_PROGRESS,Want pass themselves west strong nation talk. Small family trip of friend partner wide page.,North Erica,ADDRESS,50.8640245,-24.62004,2229.97,"2 days, 0:00:00",HIGH,bb81f67d-15c4-4be4-9882-a1df3311f799,1fa126ef-30c4-4cf2-9294-a6d23c75936f,52.49,gallons,True,DAILY,,,2024-12-31T18:20:57.257587,2026-04-12T23:49:46.267171,62b96124-d555-45ec-814b-c6bfda49a0ec,e8bec9f1-de12-4a45-9310-a83a96db639c
f67dad7e-613a-4411-a566-09c9769f144a,600ad80b-c837-4db6-b132-5c5f8b995ef6,60bb88d6-bc9d-4ef9-aa1a-8c2aeb77deed,2024-11-10T19:27:49.110018,2024-11-16T11:42:37.253243,"Heavy perform sure quickly sister month. Rule forget bar although eye pattern.
One report avoid meet. Word administration major wrong. Or wish relationship wear since able trouble civil.",2024-11-12T08:07:38.648296,2024-11-16T08:07:38.648296,COMPLETED,Production pressure yeah case difficult hair. Near in writer play poor offer expect.,North Bridget,ADDRESS,76.511873,-18.956063,10306.85,"1 day, 0:00:00",LOW,4f1b3fa1-5528-421f-93e4-caf6c5422b2a,ba2aec32-4f9f-4149-8dcb-c98d113c1dd1,68.28,loads,True,MONTHLY,,,2024-11-10T18:25:13.782951,2026-04-12T23:49:46.267350,6c603b94-5338-4010-abd3-074269529b82,94bb48ed-a3f6-4eb2-a227-81fc8a5a2f60
a8e021f2-49a0-4df9-9b82-a560995033bb,87557121-007b-4e66-9a6e-733b6e2bc363,dcc1e17c-3547-4d18-8cc2-b9e8053b19d4,2024-10-29T18:48:26.986157,,Politics public threat history reveal why present skin. Artist later painting concern.,2024-10-29T19:00:49.000536,2024-11-01T19:00:49.000536,ASSIGNED,Help provide move half officer us home. Parent trade tax woman course international for himself.,West Albert,WELL,4.22883,179.441956,40362.87,"3 days, 0:00:00",MEDIUM,27055957-25b4-46d4-b604-9328f729f93e,73148b49-8f75-4090-8b7e-23d5ea575b39,29.03,visits,True,WEEKLY,,,2024-10-28T01:57:44.269465,2026-04-12T23:49:46.267528,92122dc5-386d-498d-aed5-18637e1155ef,300d2544-38fb-4eeb-8503-d8384a2cd82b
f49c905b-44f4-49dd-ac98-174c8e68a211,f1c4b27c-6e22-48a1-a23c-8d646460dcc9,ac5b1c50-7bd0-4ab9-ae40-7f1e992ad093,2026-02-27T18:25:24.831909,,"Create police challenge whatever despite. Water enjoy investment girl within knowledge candidate write.
Amount various brother their ago. Especially blue describe treat year.",2026-02-28T11:35:24.096427,2026-03-02T11:35:24.096427,CANCELLED,Feel whatever its chance subject plan. Station issue might keep explain stage high.,Lake Tanya,ADDRESS,60.967754,178.51016,34814.46,"1 day, 0:00:00",HIGH,658b2dbd-d06a-43f4-9e1b-d7a9ca2fc850,7b6dfde4-99be-4a0d-8299-9105d88c6974,81.63,gallons,False,,2026-03-01T00:34:01.374969,Weather delay,2026-02-25T08:27:40.464175,2026-04-12T23:49:46.267723,04cfc6ba-1b48-498a-8aae-80a3f313bd06,74eb83af-274e-48ab-b9ed-20d5de3791fc
35a679db-8000-4eba-821b-2208442537ad,87557121-007b-4e66-9a6e-733b6e2bc363,458c914b-8ff0-421f-b274-6701c9d3dc4f,,,"Religious main my expect into single strategy them. Top difficult certainly hard within fight science whole. Whether plan always street point.
Fund book within brother hair.",2024-05-26T22:48:11.825423,2024-05-28T22:48:11.825423,UNASSIGNED,Generation sport environment court summer south believe. Theory many specific see final.,Kimberlytown,ADDRESS,-4.669766,-80.584243,32083.97,"2 days, 0:00:00",HIGH,40b5eabe-a90c-4a58-b6b3-f99ee728e400,3e1fd343-c96f-4490-a7f7-233a93117cfd,98.81,visits,True,DAILY,,,2024-05-26T14:26:11.768887,2026-04-12T23:49:46.267906,072c42e4-96f0-4811-92b0-07f432016279,a1c74930-5051-4403-ae7d-3e52fac4dc63
540eaf2b-ac73-45a4-8513-7317e03ee154,3dd270ee-41ef-47ed-98c8-22b2af21b4aa,60bb88d6-bc9d-4ef9-aa1a-8c2aeb77deed,2024-07-26T11:13:56.781766,,"Just evidence director trade theory another. Former detail environmental mission.
Finally range suddenly world line campaign change. Address beat less ball generation order.",2024-07-27T11:27:18.191618,2024-07-31T11:27:18.191618,REJECTED,Gun tend western past. Itself allow without occur whatever argue. Door dark nation let.,East Kylebury,WELL,72.7503985,113.291422,20843.0,"2 days, 0:00:00",MEDIUM,fa7d170b-641d-4d49-8537-bfc423984553,ba2aec32-4f9f-4149-8dcb-c98d113c1dd1,10.04,loads,False,,,,2024-07-24T21:44:20.999921,2026-04-12T23:49:46.268198,246f9d9c-77e3-496b-bf37-b9d0ab2fa429,29b49502-048b-4212-aa3c-8b0930ef4952
50576ec6-ff1f-4bc8-9079-dcfb117e1e6a,87557121-007b-4e66-9a6e-733b6e2bc363,458c914b-8ff0-421f-b274-6701c9d3dc4f,2026-01-06T17:55:06.878285,,"Just miss citizen this manager. Water reality seek. Need by carry reason.
Both picture machine father. Always form forget relationship may.",2026-01-07T09:27:21.108921,2026-01-12T09:27:21.108921,HALTED,"Stop feel study then executive.
I scientist information there.",South Deanna,GPS,51.387413,-57.123539,47209.31,"1 day, 0:00:00",MEDIUM,40b5eabe-a90c-4a58-b6b3-f99ee728e400,3e1fd343-c96f-4490-a7f7-233a93117cfd,93.48,days,True,MONTHLY,,,2026-01-05T05:09:52.499434,2026-04-12T23:49:46.268393,6e352adf-b4bb-44d1-8fff-e64f7bdc80c1,2dba0ad3-4c22-40bd-9f4a-9391c8f7277d
18f1830a-95ce-4299-894b-06288399394d,1d7e9e8f-40be-49dc-9672-3aa65ee2f0d0,4ec8e0e9-3415-4edc-8390-bb350c4d0b20,2026-03-17T07:08:21.341664,,Audience Republican cup activity. Message which next behavior course defense. Customer organization form wear their describe. Could away green culture.,2026-03-17T21:05:16.984415,2026-03-21T21:05:16.984415,HALTED,Mr fly modern. Charge method eat prepare risk more really.,Ginaborough,WELL,-18.367383,-26.451067,13289.38,"3 days, 0:00:00",HIGH,e9a9542b-1a69-4849-8bd7-5f03059a47ee,4e7fc312-7d39-40c4-8680-e6cb72b0aa8b,92.99,days,False,,,,2026-03-17T00:10:37.222116,2026-04-12T23:49:46.268605,83d2b2fe-5779-46d5-9280-3c396bfd421a,1dd61c9a-7d89-4a52-9717-a6ef4baa7ea1
5942b5d2-5da4-4b44-aa6b-a6a1d942fb61,0709cc65-6c9f-4f4d-8ae3-f0bbc2a2a1a8,d3d1c29a-f1f9-46d1-bd15-d62e528334f9,,,"Get force low memory dream performance improve chair. Last water memory.
Can hard several week product. Develop get various fill threat paper.",2026-01-17T03:48:28.632944,2026-01-21T03:48:28.632944,UNASSIGNED,Glass wrong meet local minute. Without office better case somebody financial.,West Aprilshire,GPS,-65.489904,77.30794,6687.96,"2 days, 0:00:00",MEDIUM,6df7fdd8-2036-48de-a432-5b558eb15684,1fa126ef-30c4-4cf2-9294-a6d23c75936f,31.11,loads,False,,,,2026-01-16T08:22:41.828921,2026-04-12T23:49:46.268781,74a2dc7e-3ad5-4d65-952b-285a3b4edcf7,8b1ae075-9c3f-4e4f-b4af-9bcfe9299109
478fc820-0e13-4156-aae3-0ffe554ae7e4,62aab707-f2c5-4283-86fb-7bdb83f4ac9b,d4347d99-2c69-4d0e-a2c0-37c94f738087,2025-11-29T08:43:27.506033,2025-12-03T06:02:28.565673,"Force view dog across explain nothing. Possible computer get may visit indeed.
Same trouble Democrat gas law south similar. Mother team all from run. Young give early behavior once change.",2025-11-29T12:13:21.687339,2025-12-01T12:13:21.687339,COMPLETED,"Have case thank business record.
Leader order matter product hard girl. Level participant agent.",South Suzannechester,WELL,40.8930835,-2.19731,16792.04,"3 days, 0:00:00",HIGH,d1e8d137-cb36-4c77-a505-018795e38454,73148b49-8f75-4090-8b7e-23d5ea575b39,74.69,gallons,True,ONE_TIME,,,2025-11-26T09:46:11.264698,2026-04-12T23:49:46.268974,bf394b62-d7d9-4dc1-80dd-03ac3911c836,d6ed6e6b-9d54-4b11-8b98-e87d3d1c021a
69b83267-94b0-4804-91c3-e6d116809a80,ad31d7e7-9a34-4eb1-8030-317d6d9d1a4d,ac5b1c50-7bd0-4ab9-ae40-7f1e992ad093,2025-08-16T01:25:40.777216,,"Second tell development response man. Voice fish into his.
Gun painting dark. Hope data decade get or today race. Organization star change military much he cut his.",2025-08-17T22:44:32.508590,2025-08-22T22:44:32.508590,HALTED,Design believe decide form matter them carry. Man say personal join.,Wigginstown,ADDRESS,13.4669105,-70.97355,18430.64,"1 day, 0:00:00",HIGH,fe5d382f-6ee8-4373-b91c-8b0f1ba72f6a,ba2aec32-4f9f-4149-8dcb-c98d113c1dd1,58.08,hours,True,MONTHLY,,,2025-08-13T14:12:36.195241,2026-04-12T23:49:46.269222,43b7888b-f586-4362-a9ec-28685701726b,6e800f59-38d0-407d-bef9-5639d7c201a8
7234dded-b4db-4c18-92a5-8f65ca0f1bdf,ad31d7e7-9a34-4eb1-8030-317d6d9d1a4d,d3d1c29a-f1f9-46d1-bd15-d62e528334f9,2026-03-20T00:12:27.889796,,"Republican the range beautiful. Wonder rule minute pass thank total star. Third pay policy place program five consider degree.
Floor clear finish bag surface. Successful finish vote foreign dream.",2026-03-20T11:38:06.730525,2026-03-21T11:38:06.730525,CANCELLED,Mrs wonder candidate. Structure certainly rock drop brother tax say.,Richardfort,ADDRESS,-73.454754,-124.527373,31644.76,"2 days, 0:00:00",MEDIUM,14f71232-c064-4b7b-94b5-f2dc7966d2ff,ba2aec32-4f9f-4149-8dcb-c98d113c1dd1,46.37,days,True,WEEKLY,2026-03-20T01:35:19.942060,Resource unavailable,2026-03-17T19:02:15.822675,2026-04-12T23:49:46.269437,b13f10d7-04db-424f-a480-2ed9907b8598,14730354-f798-432f-bd65-18d0578aa8b8
2a0f34e9-f2e6-4959-b732-6ae0f3b7d19d,0709cc65-6c9f-4f4d-8ae3-f0bbc2a2a1a8,e51e2d86-c1f3-4d90-90f1-7117fb277a1d,2024-04-19T01:13:07.525463,,"Term drive truth. Nation concern Mrs guy. Everything out fill method.
Marriage city person individual trouble always. Center perform hold cultural.",2024-04-20T12:55:25.230337,2024-04-23T12:55:25.230337,IN_PROGRESS,Feel you bar language. Need follow degree writer provide. Because student guy look.,Newmanchester,WELL,-35.837633,-99.012156,17974.89,"2 days, 0:00:00",LOW,b6513343-bf17-4c49-aefc-8503164485d0,73148b49-8f75-4090-8b7e-23d5ea575b39,13.15,loads,True,WEEKLY,,,2024-04-16T07:10:55.638695,2026-04-12T23:49:46.269629,f45bca48-19e2-4f31-bcc0-57a8fccfe183,b81ab8bb-3e19-4411-acda-e1ca48089d7a
a9ae6ae4-afc1-445b-a68d-9493e2de87d4,1d7e9e8f-40be-49dc-9672-3aa65ee2f0d0,d3d1c29a-f1f9-46d1-bd15-d62e528334f9,2025-11-25T17:36:17.520078,,"Reduce do stage technology.
Life could bit series. Age difficult true attack from health cold. One feeling hard pull yard tree level.",2025-11-25T21:36:24.419577,2025-11-29T21:36:24.419577,CANCELLED,Election couple pressure evidence only. Include seek Mrs. Wind week heavy.,East Brandonside,WELL,36.8700185,42.11706,10442.42,"1 day, 0:00:00",LOW,e402e1e8-2c73-4a2e-b313-4cd4be5549ed,4e7fc312-7d39-40c4-8680-e6cb72b0aa8b,33.07,loads,True,MONTHLY,2025-11-26T21:02:39.322832,Weather delay,2025-11-24T12:53:33.149874,2026-04-12T23:49:46.269832,8e138dba-694f-48e1-b151-3c197a2d1f3c,e7074c21-f43c-407e-8c3a-5d2d13bf3167
