work_order_id,assigned_vendor,assigned_at,completed_at,description,estimated_start_date,estimated_end_date,current_status,comments,location,estimated_cost,estimated_duration,priority,well_id,created_at,updated_at,created_by,updated_by
dac1776b-6983-4c93-8969-774aee3285fe,2c8d1ddb-8c56-4e93-bd93-d4aaf06847fc,2024-08-12T12:09:16,2024-10-07T05:26:52,"Happy likely eight course. Impact though hand long police.
Image open argue thus adult. Us degree man.
Should girl happen garden peace. Government collection collection discuss character reality.",2024-08-23T12:40:43,2024-09-17T12:40:43,completed,Marriage find maintain.,Michaelport,4756.15,"18 days, 0:00:00",emergency,4f12bcd4-8e6f-4c35-9db1-8f9c6eb8783f,2024-08-09T12:55:25,2026-04-07T18:12:43.625225,4909788b-c41c-4f7f-84fe-394c520d9952,d9d082f4-9a9f-4873-83ff-156e853a8b70
8d85ce38-2e7b-442f-a577-83fda0cc85bf,0fd09b32-d37a-4f44-ab04-a4366606e6c9,2025-10-07T18:44:54,,"Necessary policy thank great. Director top public year TV. Want assume professional view bill class size end.
Data discussion entire window me. Write skin than play truth.",2025-10-18T10:51:57,2025-11-08T10:51:57,unassigned,Land brother PM various. Piece fill above catch know war. Fill subject be.,Lorimouth,19240.42,"1 day, 0:00:00",urgent,af04bae8-99c0-4bb7-89ef-d29b27e1d65f,2025-09-27T10:17:00,2026-04-07T18:12:43.625413,e1a092d2-4d3a-40bb-a93a-7aef17789878,73d2a48f-25a4-4dd0-836a-e42bc12dc7fc
a36f31d1-11e7-4c27-9381-f1a849bd99a7,a0da5163-88a0-42a9-b2ef-6fd8f4f914c4,2025-05-04T10:25:01,,Once media significant situation call too start. Traditional training strategy across all scientist. Decade late late admit factor risk.,2025-05-17T16:36:29,2025-06-09T16:36:29,in progress,Single common today true case. These cell song color. Throw response event final structure.,Thomasfurt,8631.64,"25 days, 0:00:00",routine,688e356a-ed62-42a7-9119-398fde5d343a,2025-04-30T17:19:23,2026-04-07T18:12:43.625600,386b9856-5633-468b-9d87-8be131d464fb,199ce86c-5db5-4f2b-ab12-9f227307dde8
d0d45f50-ba70-4512-a98b-7d2575f41e41,b0f3789f-11b3-4e6d-8205-dcb3381ef2ba,2024-06-13T20:09:49,,Successful among last I left without phone. Something war line garden may. Relationship federal radio treat.,2024-06-24T21:02:46,2024-07-20T21:02:46,unassigned,One finally outside law. Option interview while direction.,Stevensville,29879.44,"26 days, 0:00:00",routine,ae2b4f3a-8d15-43a4-a5a5-0dc6cab6ca7a,2024-06-02T21:55:40,2026-04-07T18:12:43.625789,a8054e6f-35d0-4e74-9f94-d058087b73a6,dc8c4e25-1686-4ec5-801d-97af24c02908
3b626c56-07cc-45da-8ad3-bd5a8b7e1e75,a0da5163-88a0-42a9-b2ef-6fd8f4f914c4,2024-06-14T17:38:17,2024-07-29T01:39:18,"Compare who majority major hair man exactly gas. Budget song too respond.
Effort popular discuss none local they sing. During resource stand week thank end other. Somebody early result together.",2024-06-23T17:30:38,2024-07-06T17:30:38,completed,Herself network feeling gun.,Lake Robertfort,37644.71,"14 days, 0:00:00",routine,67b8928d-0e26-4400-b275-a44b4be5f63f,2024-06-02T14:03:45,2026-04-07T18:12:43.626020,646b378f-8d0c-4050-af10-5e97c2961bf7,01afb8db-02d7-40ed-a04a-04dc8906751e
cf76b88c-2f4b-4d2f-b38a-d508dfe4e552,2c8d1ddb-8c56-4e93-bd93-d4aaf06847fc,2025-09-30T06:15:43,,"Skill might center. Role us free identify authority like natural. Drive tonight within.
Either manage pick side. Pass plant security senior interesting get job.",2025-10-01T03:29:12,2025-10-09T03:29:12,unassigned,Professor southern leader today. Even exist build lay avoid administration issue.,Lake Anthonyville,35316.09,"21 days, 0:00:00",urgent,025d1edd-0a4d-4016-81aa-c601d74a249e,2025-09-20T06:44:49,2026-04-07T18:12:43.626199,8d216a74-0c12-4e80-b1fe-82dce00bfb95,7d98da59-e7c9-4963-bf25-981e1854e155
a4e74590-8038-4495-8691-3e5785bd9a16,1b193ccd-19a1-4d90-802b-c54dafe33648,2026-03-17T23:09:44,,Store few list high in. First enough short debate.,2026-03-24T07:15:10,2026-04-22T07:15:10,in progress,Hospital toward house finish end. Walk ball officer yeah single often.,Kevinshire,39034.02,"12 days, 0:00:00",emergency,f5ead963-5850-4e73-b1c5-266cd7f0c515,2026-03-08T16:45:58,2026-04-07T18:12:43.626351,a56c9214-dc3f-4781-922d-f0d14209f37f,906625e6-4e26-4754-aa48-664efa67c115
df84e4e4-02b1-49c8-b083-496e2d4ec820,2c8d1ddb-8c56-4e93-bd93-d4aaf06847fc,2025-09-18T15:03:41,,Determine consumer positive dream land maybe dog. Before baby religious back college worker international.,2025-09-24T03:08:07,2025-09-25T03:08:07,unassigned,Wind type method speak. Be realize sell recent yes but other.,Port Andrew,27578.01,"30 days, 0:00:00",emergency,ef533c39-ab50-400a-8801-9eada7824e3f,2025-09-06T08:30:27,2026-04-07T18:12:43.626529,b22ac04c-404f-4ec1-8b5f-a6688323140c,6b8f05b2-4a98-4049-b691-b3cd1572650d
fe0cb960-0991-49b1-af35-b71f3b9e44ac,0fd09b32-d37a-4f44-ab04-a4366606e6c9,2024-05-05T09:24:41,,"Responsibility star either per. Conference he degree born it.
Address yourself clearly need evening. Thing throughout make week night she. Total herself first take.",2024-05-12T08:12:52,2024-06-01T08:12:52,in progress,Usually morning population happen. Money rise us north once who.,New Paulside,28035.03,"9 days, 0:00:00",urgent,574ef814-9815-424b-be6f-7af4027e2b03,2024-05-02T11:56:19,2026-04-07T18:12:43.626740,666ece15-0ecf-4d6e-97c4-4eb578025027,bd24abb8-51f4-4b0b-8715-1c5ba13df580
1d75658f-bbb7-49c0-8a5d-d2d15ba976a5,01788852-2904-489e-8f04-bb0c9a204f53,2024-06-17T11:56:38,,Nation operation finish hour. Stop long us second ability economic.,2024-06-28T06:56:26,2024-07-07T06:56:26,assigned,Sit establish already matter sure long. Them bill century cover nor any beyond.,Lake Sandra,5452.72,"22 days, 0:00:00",urgent,b9abee31-271d-48c6-91ea-09e3bb02d93b,2024-06-07T02:14:26,2026-04-07T18:12:43.626902,ac55a1f0-497d-4e9c-9f2c-071361c030a7,10e16772-7dbc-44b4-828c-d842aa17d6ae
e4594108-6ddb-44db-9fb3-9de07a77d805,393b03aa-8e0e-4af1-a284-946ca7e0b61c,2024-12-31T15:21:03,,Discuss staff consider later develop. Political number yet realize edge issue.,2025-01-07T11:43:17,2025-02-04T11:43:17,in progress,Guess we lay federal. Road quite ahead economy care hard. Yeah wrong inside turn.,Finleystad,14088.62,"6 days, 0:00:00",routine,941e3251-200d-4be4-b559-e5e95ff99e27,2024-12-31T04:37:43,2026-04-07T18:12:43.627187,522d1ba6-9a18-4471-918c-af005e3f3a55,00b15749-7191-4d1e-be74-54fce941cd42
6bb0516c-e856-4a85-879e-a7268a679fff,69671a86-729f-4257-a953-c3099d1a5bf1,2025-10-01T14:34:50,,"Century standard skill activity. Democrat local similar student until perhaps per. Woman each line common newspaper against.
Later may nice want. Such call art total onto.
Radio address set back.",2025-10-06T13:52:57,2025-10-17T13:52:57,assigned,Continue ability experience success. Too why either pressure dog skin.,South Jennifer,38982.82,"9 days, 0:00:00",routine,f539b85d-0912-49e5-ae16-baabd6eeb761,2025-09-20T02:05:11,2026-04-07T18:12:43.627365,31bd215a-c8f8-42a1-9bff-7623aee9dc59,9b5183ad-80f7-4bb7-a779-0107c04dc43d
4681eef3-bf00-4424-a1fe-319ba01c37a8,a0da5163-88a0-42a9-b2ef-6fd8f4f914c4,2025-02-05T10:26:38,,Office industry concern. Physical mouth against be. Yes condition that entire threat the.,2025-02-08T09:56:55,2025-02-24T09:56:55,assigned,Democrat debate financial billion whether great. Require health use sport lot among.,North Jessica,18196.17,"20 days, 0:00:00",routine,a0f36930-7b0e-49ee-b38f-22cf1faf6ba3,2025-01-28T22:02:51,2026-04-07T18:12:43.627639,4e46312f-68d9-4e50-9e28-d4a0ef6d0546,d52c1ddf-3877-4d5c-a925-5d77424f0f7c
d672217a-476e-4305-adee-76c673ff1638,1183ff2b-4d45-4bb5-b674-7441c73903cc,2025-05-23T22:56:06,,"Hear few put industry during after.
First three enjoy above. Thank under class me. Attorney better couple sometimes lay step throw.
Success over nice.",2025-05-24T06:07:20,2025-05-30T06:07:20,unassigned,Pick against give board city once. Describe left follow ball.,Johnnyland,19301.53,"22 days, 0:00:00",emergency,e76cf210-451d-4144-b4f4-a70e6ce65606,2025-05-15T04:36:10,2026-04-07T18:12:43.627996,af96cdfb-5216-4104-83d1-dcec8c1417e9,12898a40-61a3-44e0-a89a-7e5b83c61cf2
e69f4c19-6156-457d-b875-f764e1de2721,1183ff2b-4d45-4bb5-b674-7441c73903cc,2025-12-07T10:12:33,,"Newspaper capital red population. Foot administration full each choose billion best.
Edge weight area responsibility writer ago building. Season drop these stop. Industry finish in pick.",2025-12-13T13:25:28,2025-12-19T13:25:28,in progress,Treatment hour team sit. Bed agent people let benefit. Her guess tax often.,Susanburgh,38936.77,"12 days, 0:00:00",urgent,f59c5d87-aaa3-4d3b-a282-09470df28c0e,2025-11-27T20:06:31,2026-04-07T18:12:43.628194,e1a092d2-4d3a-40bb-a93a-7aef17789878,c9ab186b-c8a9-4cb5-b7bd-06a0edc5b3ae
364092fa-cd3b-46c9-9aab-061535672ae3,1b193ccd-19a1-4d90-802b-c54dafe33648,2025-12-29T19:15:58,2026-01-27T08:12:59,"Better society police herself huge stage might. Can final TV thus something drive hour want. Energy popular behavior drug.
While election mouth new upon now part. Minute consider happy.",2026-01-09T21:13:29,2026-01-23T21:13:29,completed,Yourself result onto oil. Know fund cut keep. White set tree pay beautiful.,Harrismouth,14944.26,"23 days, 0:00:00",emergency,50d7f1a7-5b9e-4438-8e3a-493027cce00a,2025-12-26T13:06:54,2026-04-07T18:12:43.628457,72b16a2a-90b3-4650-bc1b-6a5e408ce601,0dfdafe2-81c3-46f2-992b-b3ce702d64c0
c42adc88-3474-4814-8eda-e7ed7689aa2b,393b03aa-8e0e-4af1-a284-946ca7e0b61c,2025-06-21T14:50:00,,Include walk various property look. Myself investment play including main near. According spring defense ability charge report college trip.,2025-06-21T22:39:10,2025-06-26T22:39:10,in progress,Story detail same learn same. Culture if may special traditional avoid. Idea church degree road.,West Rebecca,23082.8,"28 days, 0:00:00",emergency,df33e250-55d6-44e1-ae11-cb3c7b903821,2025-06-16T13:08:43,2026-04-07T18:12:43.628632,62851153-6309-4b5d-9e07-0cc8b82a623e,245a02d5-183d-4e17-9d2b-8281bf319d8d
1084d2ec-32fb-4112-b126-040aee53bf92,0fd09b32-d37a-4f44-ab04-a4366606e6c9,2024-12-03T23:50:00,,"Others market two successful. Cover really race. Sort for green long.
Factor ready ball commercial. But finally water subject money. Defense already threat though outside.",2024-12-04T04:55:22,2024-12-16T04:55:22,assigned,Reflect hotel mean send. None morning the only.,Whitneyview,41322.94,"11 days, 0:00:00",routine,1cd78c4d-8624-4fc7-bdc3-e16401f32f5a,2024-11-26T22:00:11,2026-04-07T18:12:43.628852,59570b75-7b83-4437-82a3-671a3d1d8f4e,08ec5e9f-5e9b-446d-93bb-a503a330d366
c9be834e-fd7e-45d9-a04f-50beb278ac83,1885aabf-2070-43a3-8f8d-71e67ae9409f,2024-04-29T19:12:33,,"Court trial throw possible us long. Answer involve art the build.
Tonight follow big certainly reduce find must section. Yeah also lay fight summer moment only.",2024-04-29T20:42:33,2024-05-05T20:42:33,in progress,Put laugh new range. Enough commercial upon ready strong hand.,West Alisha,15490.87,"20 days, 0:00:00",urgent,c827aaf3-39b3-4991-b410-f2b4c5c5d05a,2024-04-22T11:56:30,2026-04-07T18:12:43.629019,7b077bb6-baa9-4d9f-a1ee-fb135d0cc5d1,1e077a0a-433a-415b-a533-c2900c8b14a6
dcc4a19d-06e9-4ad7-93a5-52417f05a10f,1183ff2b-4d45-4bb5-b674-7441c73903cc,2024-07-08T13:14:04,,"Name attention lead leader suggest. Us that beautiful decade. Right project few rich.
Public sound wife particularly. Traditional truth compare month share. Will agency option important.",2024-07-14T15:18:06,2024-07-23T15:18:06,unassigned,Congress know decade media water civil success. Rate I leave indicate.,Lindamouth,5359.84,"8 days, 0:00:00",urgent,af04bae8-99c0-4bb7-89ef-d29b27e1d65f,2024-06-29T03:39:59,2026-04-07T18:12:43.629227,7a8e27d8-1571-4f1a-bed3-b294ee1bebd5,bca2ee5d-950c-4795-8d7a-3f20ab263ada
1f788128-7426-4127-be8b-42c385108e50,69671a86-729f-4257-a953-c3099d1a5bf1,2024-11-18T18:47:56,,"Deep forget cover together especially policy.
Blue doctor doctor necessary book each chair camera. Pay protect stock often wide trade campaign. Employee learn parent account.",2024-11-28T19:51:28,2024-12-14T19:51:28,in progress,Line everyone yard law personal. Act growth attention official move fill.,East Kristinside,7918.71,"5 days, 0:00:00",emergency,3743d4e9-3ce7-4f63-969c-b0dad68e3fab,2024-11-06T19:01:37,2026-04-07T18:12:43.629403,771248a6-11d7-4a81-810d-dc2921699dea,202c0882-6cd0-48d2-bf0f-a935ea342dbe
2196cce0-82de-46cb-8a3c-2cf27510a9c3,01788852-2904-489e-8f04-bb0c9a204f53,2025-08-19T11:07:20,,Institution final care class represent collection. Arm yet tax bit front my fish government.,2025-08-27T08:14:52,2025-09-20T08:14:52,assigned,Member red treat feel impact bar service. Especially if chance toward development old hold.,Port John,34775.27,"1 day, 0:00:00",routine,17941284-a857-4947-9263-fe63bfd59d7c,2025-08-06T13:12:23,2026-04-07T18:12:43.629590,039c9d4e-353c-42bc-ad34-7070fc467005,5a9c423b-2049-44e1-8712-4f204a03537d
6aea2eb4-b123-426f-b45c-92b7bc4e9e5f,1183ff2b-4d45-4bb5-b674-7441c73903cc,2026-03-13T14:43:27,2026-04-29T10:23:04,"Go board who carry process air. Soldier nothing reach I.
Message town stage up decision. Lay everybody across idea human same exactly. Student defense assume analysis other.",2026-03-21T19:26:32,2026-03-31T19:26:32,completed,Building art television important hope national about certainly. Its through less would.,North Amandaburgh,28420.61,"9 days, 0:00:00",urgent,e76cf210-451d-4144-b4f4-a70e6ce65606,2026-03-06T01:07:19,2026-04-07T18:12:43.629798,16bba2fa-0683-475f-b751-f1be74a19e02,fa72f656-89a9-4fee-a686-6c9957cead05
e6e41189-0a72-441a-a2fe-01c02ef04c45,1183ff2b-4d45-4bb5-b674-7441c73903cc,2025-07-26T14:11:52,,"Mr according indeed. Six check hundred into board. There ago important staff yes plan blood second.
Race later theory give. Star ever board purpose involve.",2025-08-05T14:51:05,2025-08-21T14:51:05,unassigned,Writer night more continue court ready. Share boy water size.,Lake Bradville,11634.0,"6 days, 0:00:00",urgent,ae2b4f3a-8d15-43a4-a5a5-0dc6cab6ca7a,2025-07-18T01:13:23,2026-04-07T18:12:43.630180,0deaf7a5-487c-4176-aaeb-ff76fd70500e,9028507d-309b-4305-ba82-3c28dbb1b02d
169145ed-c84e-41b3-a2da-feffacd8428a,a0da5163-88a0-42a9-b2ef-6fd8f4f914c4,2025-05-01T12:47:32,2025-06-06T20:09:43,"Impact single occur simply group leave ahead. Police consider writer space.
Stock happen pressure. No here interview act partner him. Event wind west toward this. Most we sister reduce.",2025-05-03T18:54:56,2025-05-17T18:54:56,completed,Exist serious nor light eight. Summer small girl health car hand. Newspaper for show certain.,Port Jack,29152.7,"14 days, 0:00:00",urgent,77ccf46f-0b0a-4827-9500-b896c2b7f37d,2025-04-28T15:18:10,2026-04-07T18:12:43.630397,3698e590-684b-48ae-8430-274a69925773,00b15749-7191-4d1e-be74-54fce941cd42
e7083597-e5e8-433b-a1c1-e61ecd568e80,2c8d1ddb-8c56-4e93-bd93-d4aaf06847fc,2024-06-13T11:09:43,,"Environmental first drop. Figure leave build officer. Sort magazine much power.
Gas others like hotel them plan candidate recent. Watch usually book professional TV. Most center music since.",2024-06-23T20:01:42,2024-07-07T20:01:42,in progress,My act dream professor size land. Live toward approach these.,Rebeccashire,647.96,"16 days, 0:00:00",emergency,ef533c39-ab50-400a-8801-9eada7824e3f,2024-06-12T20:21:45,2026-04-07T18:12:43.630601,c15a5d6f-134b-4cff-9746-313acdeac0e0,60d22630-c025-4724-9074-a500c458df56
986bbaf7-b783-4a1d-874f-17204ac37179,2c8d1ddb-8c56-4e93-bd93-d4aaf06847fc,2025-12-08T18:38:16,,"Eat finish top cover left base piece. Series pay happy necessary.
Another despite hold meeting guess author follow. Hundred this research goal than. Collection spend black.",2025-12-10T19:10:35,2025-12-14T19:10:35,assigned,Close face notice health clear. Executive sit world parent.,North Sheila,37656.17,"23 days, 0:00:00",routine,025d1edd-0a4d-4016-81aa-c601d74a249e,2025-12-03T20:57:38,2026-04-07T18:12:43.630788,f49677a9-8045-46ce-96cd-5666b4e53683,043806d1-12d4-414b-bee3-d5a50d095f68
bb5068a1-8d14-4677-bf72-774aeb054b65,a0da5163-88a0-42a9-b2ef-6fd8f4f914c4,2024-08-20T07:36:52,2024-10-03T15:43:02,Once tell despite occur ok area appear mention. Before church current key weight light prove. Democratic college reduce son despite story.,2024-08-27T06:11:16,2024-09-09T06:11:16,completed,Call notice her. Structure popular yes computer usually business.,Garyburgh,2783.86,"3 days, 0:00:00",emergency,ee0af0c8-bb94-4a92-a50a-33702a2938e7,2024-08-13T18:32:15,2026-04-07T18:12:43.630958,0e93390e-714e-4221-b548-cffa1e863801,1982b92d-39ae-47ba-a25e-77f3c5951727
0ca9f25c-a30d-4db8-9267-5b348dd8c7cf,69671a86-729f-4257-a953-c3099d1a5bf1,2026-01-02T12:59:57,2026-01-28T21:43:10,"Identify lawyer source serious.
Position music heavy wear grow second. Control bed federal health chance him affect.
Energy fish source some. Because walk ten. Nice wear political ok discuss machine.",2026-01-10T08:08:58,2026-01-26T08:08:58,completed,Blood off to behind save. Skill officer ability likely hotel. Especially bad fly together.,New Derek,25160.98,"26 days, 0:00:00",emergency,ef533c39-ab50-400a-8801-9eada7824e3f,2025-12-23T23:55:28,2026-04-07T18:12:43.631176,650ee003-3a56-4bbc-8673-6a03b4166511,b2140731-4154-41a4-9f7c-690c8fe2af6c
0958c0aa-b447-49ae-8ad2-45994d2d085b,a0da5163-88a0-42a9-b2ef-6fd8f4f914c4,2025-03-08T10:43:21,2025-03-31T06:49:37,"Simple commercial media. Area science system watch.
Company thus impact similar return few sense. Beat mother decide account into body watch. Movement skill among own.",2025-03-14T05:23:13,2025-03-18T05:23:13,completed,View room mention require yard process agency.,Silvahaven,27732.28,"21 days, 0:00:00",routine,1aa66908-0ce1-4904-b4ff-008d9b2889a9,2025-03-06T03:22:10,2026-04-07T18:12:43.631574,52fa8914-f23c-42e4-9356-2d93e7cdc43b,0c524e59-7b31-47b6-b16f-fc3b47e55bc7
caab8ec7-a424-433c-8f62-3ad261ad036a,a0da5163-88a0-42a9-b2ef-6fd8f4f914c4,2025-11-29T15:39:16,,Before reduce only remember direction to employee. Start economic necessary able enough have realize senior.,2025-11-30T14:52:11,2025-12-03T14:52:11,assigned,Write win player suddenly deal night area difficult. Outside lose southern dog lead research.,Littleborough,3583.89,"28 days, 0:00:00",routine,5ddf2b8a-519b-4e58-bf8e-1335657e4ea1,2025-11-28T19:33:43,2026-04-07T18:12:43.631803,3b547773-004e-4318-b54a-d92dddd2d6a0,3eaf4559-173e-4944-96a2-9334c51b6c86
e893ec57-fc5f-466b-bdb0-9dd6ba9239ee,a0da5163-88a0-42a9-b2ef-6fd8f4f914c4,2025-08-02T15:50:49,2025-09-29T10:28:05,Discover walk order measure worry. Weight bill your top rate plan especially hit. Part sign heart ready section which specific choose.,2025-08-14T06:17:29,2025-08-31T06:17:29,completed,Remember improve step state. Itself unit case assume. Particularly matter cup item.,Loweburgh,35798.45,"3 days, 0:00:00",urgent,4d5f9e80-4c35-4f56-9189-53a3b857d5d0,2025-07-26T02:29:00,2026-04-07T18:12:43.632023,4f179786-6b03-4dfe-9bb4-477c43556ef3,35e0a582-6654-4fb6-a234-dcb9d97ac8be
23036bf4-17f9-49fd-b2bb-9beb3f610d88,01788852-2904-489e-8f04-bb0c9a204f53,2024-07-29T13:49:48,,"Keep nice live financial. Recent today beautiful dream write. Fill phone actually know huge morning.
Matter PM any less. How onto what if especially late.",2024-08-12T09:47:43,2024-08-14T09:47:43,assigned,Receive speech person policy among. Cause my go little.,Lewisville,49814.83,"8 days, 0:00:00",emergency,ff7bd950-a908-4140-a347-d5f256e7c93c,2024-07-23T10:08:31,2026-04-07T18:12:43.632303,f624044a-ba44-4aa0-b2a4-ac4c27be0cb6,d591c83c-d262-4d86-ba93-d87c1b1b2272
2a4da9f7-34a3-4690-ba85-b43bb91834e5,1885aabf-2070-43a3-8f8d-71e67ae9409f,2025-08-25T12:30:29,,"Successful tough between floor artist. Treat reflect box small hand he claim.
Approach point back. Seat bank prove really. Others successful set line describe trouble.",2025-09-06T22:06:49,2025-09-25T22:06:49,assigned,Team if place loss. Wind establish third lay class draw newspaper.,Lopezport,16493.94,"15 days, 0:00:00",urgent,69b70b28-f8e5-4a33-8b15-45fc9ee2cbbf,2025-08-13T11:55:30,2026-04-07T18:12:43.632722,0d5dd456-b3fa-4284-9aae-6ecf7fb31333,52fa8914-f23c-42e4-9356-2d93e7cdc43b
dd3a0f53-7565-4a25-b5fa-0ba8026305d8,2c8d1ddb-8c56-4e93-bd93-d4aaf06847fc,2025-11-09T12:43:04,,"President no trouble wrong.
Attention friend job lead. Development seat type ability will. Sport hand every all.
Few him quite and represent with inside recently.
Build fish these throw end kid type.",2025-11-20T22:55:07,2025-12-11T22:55:07,unassigned,College true less whether campaign. Knowledge reason what book either five.,South Reneeberg,35549.33,"29 days, 0:00:00",routine,a0f36930-7b0e-49ee-b38f-22cf1faf6ba3,2025-11-03T15:04:30,2026-04-07T18:12:43.633274,579097c0-dfae-40bc-9b95-6641cf4dd3fb,2b571899-d050-4d36-b2db-55b51d4b98d9
8b146bcc-ef68-4162-8aae-f0ce54babe18,1183ff2b-4d45-4bb5-b674-7441c73903cc,2025-05-26T20:34:31,,Former student change of return hundred. Maybe suggest town voice identify environmental small first.,2025-05-28T20:04:47,2025-06-21T20:04:47,assigned,Miss represent mouth strategy effect. Region standard class father moment security.,Calebborough,26568.21,"17 days, 0:00:00",emergency,af04bae8-99c0-4bb7-89ef-d29b27e1d65f,2025-05-21T10:13:44,2026-04-07T18:12:43.634319,05282c34-36aa-4bdf-b177-65453a1dd485,2f24e894-d3fe-44f1-8739-609d734321e5
1efde3b8-c972-448e-9046-d7ffa80f390d,b0f3789f-11b3-4e6d-8205-dcb3381ef2ba,2025-03-29T15:27:13,,"Staff I administration building blue. Room girl born chance each office price. Anything me during within rate.
Off show coach create thing ahead lay mind. Full pull professional process usually gas.",2025-04-04T06:50:53,2025-04-08T06:50:53,assigned,Least finish if every next carry leg. Mind cause president student. Window realize look market.,Matthewview,28420.03,"8 days, 0:00:00",emergency,c827aaf3-39b3-4991-b410-f2b4c5c5d05a,2025-03-24T20:12:33,2026-04-07T18:12:43.634817,cfd11053-eec5-4a4e-ae26-c65072e47834,216e5fd0-9aae-4336-905f-f346934b7616
61fd145b-d6f2-44a2-9ed7-ee3c470b3893,a0da5163-88a0-42a9-b2ef-6fd8f4f914c4,2024-09-24T22:24:10,2024-10-25T03:54:53,"People TV radio. Economic understand century smile could military doctor.
Total future thus arm international. Girl medical truth sure live.",2024-10-08T11:59:10,2024-10-14T11:59:10,completed,Air throw or once alone less. Exactly south each around.,Archershire,38492.72,"14 days, 0:00:00",routine,5ddf2b8a-519b-4e58-bf8e-1335657e4ea1,2024-09-24T00:11:14,2026-04-07T18:12:43.635308,5543fa98-8776-4af7-8fc6-acf1d7438adf,a9d401f8-e31a-477d-8280-164fad0cc525
28c71a72-56df-4c1c-bd76-eb3c1746304f,01788852-2904-489e-8f04-bb0c9a204f53,2024-04-30T18:14:18,,"Movement figure trial majority next brother. Result pretty painting full deep.
Paper treatment result whatever. Rule though bar better there themselves. Subject spend very.",2024-05-09T21:38:44,2024-05-23T21:38:44,unassigned,Officer ever method recognize support. Rule nothing together animal team cause fall.,Kathrynfort,27044.03,"19 days, 0:00:00",routine,b71ac294-8468-4261-b7ba-555387b0a3e0,2024-04-24T19:24:00,2026-04-07T18:12:43.635710,e7a6f821-ac03-4214-9178-d08dc2a8e6c2,792dbd42-5fe5-4708-9812-60ca94053cfb
2ed8a257-8f36-4801-ba65-dd5d0db6ff11,1183ff2b-4d45-4bb5-b674-7441c73903cc,2024-10-18T03:34:00,2024-12-04T17:29:03,"Agreement Democrat else challenge quickly. Mission amount radio home quite he clear.
Leg responsibility case happy test fire move for.",2024-10-30T10:37:38,2024-11-09T10:37:38,completed,Number interest third rule everything financial party. Cold second man middle.,Timothyton,48023.87,"1 day, 0:00:00",emergency,b71ac294-8468-4261-b7ba-555387b0a3e0,2024-10-14T10:50:48,2026-04-07T18:12:43.636105,8fc9d364-8ae9-436e-8a20-d218452ea53f,266abc0f-3ef0-4438-a566-782809da5e79
666f6d50-df7c-418c-83a8-6431fbb238b2,1183ff2b-4d45-4bb5-b674-7441c73903cc,2024-07-11T02:22:10,,Either analysis hope local nearly. Create various least stay student. Between front store compare knowledge. Others probably recent send approach month standard Mrs.,2024-07-24T07:20:56,2024-08-05T07:20:56,assigned,Any ahead writer. Mean crime read enough none rest get. Talk time mouth.,Brownville,46889.19,"3 days, 0:00:00",emergency,56d9b4f7-e1a5-45e4-a7bb-07d3c6db780b,2024-07-08T01:48:13,2026-04-07T18:12:43.636506,5aa44521-b780-4b4a-9dc7-d013658e7c02,f6267f7a-2c99-4844-83b4-1b6452c692cd
002b24c1-ce16-43cd-97fd-161064868a68,1183ff2b-4d45-4bb5-b674-7441c73903cc,2024-07-24T03:43:04,,"Difference foot run none. Whose top rock reveal meet and when day.
Occur fire thus president. Start special kind open mind. Small close save keep.",2024-07-26T08:00:48,2024-08-07T08:00:48,assigned,A similar rock manage. Close central line even this. Point right day especially.,New Laura,25087.97,"17 days, 0:00:00",urgent,1cd78c4d-8624-4fc7-bdc3-e16401f32f5a,2024-07-23T10:58:11,2026-04-07T18:12:43.636912,27f6df84-dbfd-4625-9f8f-3d87866eff73,d591c83c-d262-4d86-ba93-d87c1b1b2272
3d42be61-eb3e-4699-b370-3a387176bd2b,1183ff2b-4d45-4bb5-b674-7441c73903cc,2024-10-25T01:50:30,2024-11-18T23:04:58,"Wait development impact ask where. Two drug professional option PM.
Visit hundred there building author player. President second his.
Away one forget else unit. From community place case.",2024-11-03T07:48:26,2024-11-05T07:48:26,completed,Change turn southern long hundred glass. Agreement him animal big adult.,Lake Michael,15204.91,"16 days, 0:00:00",urgent,1cd78c4d-8624-4fc7-bdc3-e16401f32f5a,2024-10-21T19:31:27,2026-04-07T18:12:43.637426,4b71c217-a64f-4fcf-bbbd-b0de9f495564,e661cfde-7789-4bec-b800-f8037b392a87
5aa3b504-15c3-4c74-976f-4742647a873e,0fd09b32-d37a-4f44-ab04-a4366606e6c9,2025-12-19T15:42:23,,"Allow artist too relate perhaps fill. Me student common notice.
World personal part worker staff nation. Same too new billion smile number culture. Service catch recognize will also.",2025-12-28T06:36:10,2026-01-10T06:36:10,unassigned,Rest west may. Memory still expect. Bar student officer future spring participant.,South Haleystad,30547.57,"6 days, 0:00:00",routine,17941284-a857-4947-9263-fe63bfd59d7c,2025-12-17T18:44:05,2026-04-07T18:12:43.638045,62bb6565-480a-4f5a-8f81-55c1a81efab5,e8395e70-b13c-4021-86bc-eb28ba45794f
