work_order_id,assigned_vendor,client_id,assigned_at,completed_at,description,estimated_start_date,estimated_end_date,current_status,comments,location,location_type,latitude,longitude,estimated_cost,estimated_duration,priority,well_id,service_type,estimated_quantity,units,is_recurring,recurrence_type,cancelled_at,cancellation_reason,created_at,updated_at,created_by,updated_by
b761a21d-0990-437c-91ca-6445289cda19,62aab707-f2c5-4283-86fb-7bdb83f4ac9b,a0be935d-e8a0-460e-9e83-b7480a847df3,2024-07-12T15:30:04.601416,,"Phone author style figure large marriage physical. Tax total natural my responsibility.
Though woman one ground out. Kid international collection goal option. Long perform crime bank.",2024-07-13T16:30:53.234737,2024-07-18T16:30:53.234737,IN_PROGRESS,Indeed past forget after part cultural power. Dog goal keep.,West Amy,WELL,-49.8006005,-147.698052,19184.54,"2 days, 0:00:00",MEDIUM,5bac6ecc-7104-4ea1-ad26-42664373e19e,73148b49-8f75-4090-8b7e-23d5ea575b39,37.1,days,True,WEEKLY,,,2024-07-10T16:00:59.750391,2026-04-12T23:49:46.216483,c8059375-0cdd-4efc-9ddb-082fd8e98adb,f9de5e11-629a-4fd6-83d4-04936f024686
9ad0696f-944c-4a91-9f06-c703321912aa,f1c4b27c-6e22-48a1-a23c-8d646460dcc9,6b9c89b1-facd-4e99-aba4-6b40cc2111ef,2024-04-15T16:26:43.981803,2024-04-18T09:37:56.300637,Including staff meeting remember. Adult government table alone. Best outside major friend organization brother skill also.,2024-04-16T05:24:24.810801,2024-04-18T05:24:24.810801,CLOSED,Wrong sit you. Relate center already represent.,Duffystad,ADDRESS,-27.045288,-21.187245,48475.91,"3 days, 0:00:00",LOW,d187ebb0-673d-47a3-a284-3725273488db,7b6dfde4-99be-4a0d-8299-9105d88c6974,4.13,days,True,MONTHLY,,,2024-04-13T20:51:54.972881,2026-04-12T23:49:46.216681,fe50be3d-b3d9-4659-8640-91314adb2d4d,17f72a6e-2738-4cd4-baff-b7fa223df4d2
57b6a0d1-8d5e-498c-9f35-88e6beed2344,ad31d7e7-9a34-4eb1-8030-317d6d9d1a4d,17466069-387c-486d-be2b-cfeb30f62c1a,2024-05-14T17:57:46.507727,,Black laugh standard get fill. Themselves seven experience attention our realize else. Oil trip message who resource.,2024-05-15T02:38:50.581518,2024-05-20T02:38:50.581518,CANCELLED,According why house field picture between unit operation. Forget take Mrs model exactly help note.,Lake Joy,GPS,7.4194775,165.780096,47193.79,"1 day, 0:00:00",LOW,04847602-db19-4c1a-8aa5-9b8645d42d3d,19e95c4f-f46c-4431-bab6-f5797bcd52f8,41.92,hours,False,,2024-05-16T12:38:57.467277,Resource unavailable,2024-05-12T21:22:13.181261,2026-04-12T23:49:46.216840,d7269d78-b6d7-4be7-99e6-44e56ca60b41,26fcf216-08df-42be-b692-12446f85d92d
62f3a9c0-3178-41cc-8363-70db75fd4013,3dd270ee-41ef-47ed-98c8-22b2af21b4aa,d4347d99-2c69-4d0e-a2c0-37c94f738087,2024-06-29T01:45:11.180838,2024-07-01T16:48:13.791812,"Society cold only. Dream reality change poor across few just.
Final different past example ready newspaper hope. Brother picture treat policy. Through night always long.",2024-06-29T15:10:54.765697,2024-06-30T15:10:54.765697,CLOSED,Research maintain new eye approach. Reason less song for foreign condition.,Port Desiree,GPS,9.014587,27.216397,2230.58,"1 day, 0:00:00",LOW,b8c78a4b-7965-4d4c-9546-ad7c50461653,4e7fc312-7d39-40c4-8680-e6cb72b0aa8b,98.39,gallons,True,DAILY,,,2024-06-26T02:37:43.217390,2026-04-12T23:49:46.217035,5c18f2a5-6b98-484f-aaef-3cb6f2670810,aee505a6-4482-4977-9cc6-ec5ecd4330e2
c7b06fd2-9f33-49ab-ab7c-c6eb70396ac7,87557121-007b-4e66-9a6e-733b6e2bc363,dcc1e17c-3547-4d18-8cc2-b9e8053b19d4,,,Listen back hotel surface imagine ability whatever. Produce break beyond clearly field seek specific. At save occur attack.,2024-07-17T11:16:30.626590,2024-07-20T11:16:30.626590,UNASSIGNED,Receive easy staff get. Movement manage there something day structure already.,Brendaview,GPS,-78.5523205,79.086907,27074.96,"1 day, 0:00:00",MEDIUM,4dfe3479-c870-45e9-a84a-6bc72280dcaa,73148b49-8f75-4090-8b7e-23d5ea575b39,51.7,gallons,False,,,,2024-07-16T02:15:58.064919,2026-04-12T23:49:46.217205,fd153884-1bbc-4787-a3ed-5f4a965ad0c6,ad73770f-1919-497e-8117-2d5f52fa34f7
b7cb5112-ff92-4baa-82f9-9f071935b6a6,ad31d7e7-9a34-4eb1-8030-317d6d9d1a4d,d3d1c29a-f1f9-46d1-bd15-d62e528334f9,2024-07-01T22:23:29.275326,2024-07-06T22:22:21.493573,"Our stage part administration account spring. Continue future song everyone hot wrong. Small full itself could learn.
Family ability yeah may message begin. Field movement community group teacher.",2024-07-02T14:07:46.308718,2024-07-06T14:07:46.308718,COMPLETED,Want become should. Visit since push night soon. Town water ask green doctor.,East Timothy,ADDRESS,66.3336665,59.70004,7000.51,"3 days, 0:00:00",LOW,14f71232-c064-4b7b-94b5-f2dc7966d2ff,ba2aec32-4f9f-4149-8dcb-c98d113c1dd1,80.97,visits,False,,,,2024-06-29T19:53:17.585513,2026-04-12T23:49:46.217436,79d9e57f-9e71-4fd7-9745-28e244569a8b,87f0da8d-3aeb-4e66-8629-ce801f08f49f
0d1fe0f8-78bf-481b-8c91-867379bbf4a5,9deb59e9-2b41-4fa0-b272-fa2b3dc749de,29689696-7a26-4c08-8f61-b3d86c203be7,2024-11-19T02:30:07.886551,2024-11-25T06:07:06.538142,Sell option car scientist. Phone make debate account who. Collection agency but everything.,2024-11-19T13:30:11.851171,2024-11-24T13:30:11.851171,COMPLETED,Visit leave plan record remain history sell care.,Brownfurt,WELL,24.184029,-102.940024,48772.51,"3 days, 0:00:00",HIGH,def1f21a-dcf1-4f27-9d19-42340a3ec6a2,1fa126ef-30c4-4cf2-9294-a6d23c75936f,80.38,loads,False,,,,2024-11-17T01:41:08.049499,2026-04-12T23:49:46.217636,90ffe593-9bb4-4c49-a8b8-70c3283f5189,8afa6e77-1d78-4478-95c7-f90b1b4a0684
9b67a296-ca50-4917-91c9-f1df0e38df56,1d7e9e8f-40be-49dc-9672-3aa65ee2f0d0,6bb8f685-7691-4a60-88bb-50753e20ce29,2025-07-04T08:00:02.772121,2025-07-08T17:51:56.086174,"Consumer number traditional rock. Process always gas treat.
Lose work meet morning building do. Front push cup leg light cut.",2025-07-05T11:27:53.102238,2025-07-07T11:27:53.102238,COMPLETED,Cover have throw stuff. No big management.,Hillbury,ADDRESS,53.8199475,-97.653886,48612.36,"3 days, 0:00:00",HIGH,a0de8f0e-86b9-4bf3-af25-6fe76a535177,4e7fc312-7d39-40c4-8680-e6cb72b0aa8b,48.24,hours,False,,,,2025-07-03T18:27:41.431543,2026-04-12T23:49:46.217862,a1c74930-5051-4403-ae7d-3e52fac4dc63,6a9b68da-2a33-4c57-a7e8-c8433e08bba3
9323af67-6494-4010-9853-ed7ec9fa6741,3dd270ee-41ef-47ed-98c8-22b2af21b4aa,a0be935d-e8a0-460e-9e83-b7480a847df3,2025-05-24T13:55:02.036116,,Much field some fish view wear understand. Natural main over trouble situation measure. Too always hundred. Wrong condition evidence end wife dinner participant cover.,2025-05-25T05:54:32.380562,2025-05-29T05:54:32.380562,HALTED,Only thought eye nothing either appear. Ahead language state walk them.,Lake Amberfort,WELL,-48.5294615,-25.986227,35308.26,"3 days, 0:00:00",HIGH,550bc3cd-5606-474c-a707-af5fb0d083ab,ba2aec32-4f9f-4149-8dcb-c98d113c1dd1,88.95,visits,True,MONTHLY,,,2025-05-23T01:52:49.945683,2026-04-12T23:49:46.218110,c90bd017-c622-4bf7-b444-cfbb6a4c7895,837392fa-a37c-4e46-b705-fbb83b874b5f
d5befbea-6578-4ebc-ac27-b48b59bf2145,0709cc65-6c9f-4f4d-8ae3-f0bbc2a2a1a8,e51e2d86-c1f3-4d90-90f1-7117fb277a1d,,,"Interview thing production these kid. Poor rule kid matter town. Drop reveal order thank itself control despite.
Person owner city of. Mind meeting share ever image person lead.",2024-05-04T20:47:10.951907,2024-05-05T20:47:10.951907,UNASSIGNED,You performance Congress nothing well either car. Seven tough back together debate risk risk.,Bensonton,GPS,3.4831555,36.977005,15826.77,"2 days, 0:00:00",LOW,b6513343-bf17-4c49-aefc-8503164485d0,3e1fd343-c96f-4490-a7f7-233a93117cfd,65.59,loads,True,ONE_TIME,,,2024-05-03T18:33:12.900594,2026-04-12T23:49:46.218325,fd153884-1bbc-4787-a3ed-5f4a965ad0c6,31f766fc-c67f-4a9a-9ca0-0e635735ee21
d212c883-40b1-432c-a390-eb3e9de2a15f,f1c4b27c-6e22-48a1-a23c-8d646460dcc9,e51e2d86-c1f3-4d90-90f1-7117fb277a1d,2025-11-23T19:45:23.947982,2025-11-28T10:50:28.937582,"Congress hear chance finish hospital argue. Page impact natural today eat reflect money. Of responsibility improve.
Firm husband list fly pretty kind view.",2025-11-24T09:59:02.416610,2025-11-28T09:59:02.416610,CLOSED,Remain class across police toward edge. Language thank live response.,Lake Jordan,ADDRESS,47.7166735,45.82232,42063.57,"3 days, 0:00:00",MEDIUM,55cc771e-8dbf-4458-99f1-b737796f672a,4e7fc312-7d39-40c4-8680-e6cb72b0aa8b,81.78,loads,False,,,,2025-11-22T07:38:16.066850,2026-04-12T23:49:46.218570,d0140331-cbcc-4632-93f4-4aba9cb62c82,5ae23122-7507-41d5-a777-ba3b83e4c0e0
6da1573c-1216-42f2-b19d-6a1128b828b3,9deb59e9-2b41-4fa0-b272-fa2b3dc749de,29689696-7a26-4c08-8f61-b3d86c203be7,2024-08-29T20:29:25.952603,,Still world us manage fire could. Law thank until remember training ask produce walk. Rest best ball save sometimes traditional.,2024-08-31T20:09:40.399220,2024-09-05T20:09:40.399220,REJECTED,Always term performance vote work none everybody modern. Each race popular tax.,Johnsonfurt,GPS,-40.244886,-10.729178,40631.17,"1 day, 0:00:00",HIGH,def1f21a-dcf1-4f27-9d19-42340a3ec6a2,1fa126ef-30c4-4cf2-9294-a6d23c75936f,38.55,hours,True,ONE_TIME,,,2024-08-27T06:43:00.742165,2026-04-12T23:49:46.218752,3d09cfd6-08ce-4de2-beb9-bb09153548c5,f6950027-7570-4efd-8a17-9509c414a9a7
dc6c5278-f194-4ae9-9ec8-17c5d7f82649,ad31d7e7-9a34-4eb1-8030-317d6d9d1a4d,ac5b1c50-7bd0-4ab9-ae40-7f1e992ad093,2025-09-16T09:08:33.426256,,Service apply prove security. Fight own idea interesting traditional number. Current population bit debate as remember quality.,2025-09-16T10:39:13.117610,2025-09-17T10:39:13.117610,HALTED,Price relate both summer collection threat. Upon direction minute material. Send yes anyone off.,Port Monicaton,GPS,25.675987,-103.096392,48778.79,"1 day, 0:00:00",MEDIUM,fe5d382f-6ee8-4373-b91c-8b0f1ba72f6a,ba2aec32-4f9f-4149-8dcb-c98d113c1dd1,55.43,gallons,True,ONE_TIME,,,2025-09-13T10:21:46.520219,2026-04-12T23:49:46.218914,421188e2-515a-469e-9e22-62c450306cf0,4992bbc1-8ec0-4e5f-8147-288a65d91e6c
c324a885-0a3e-479a-8138-201c3045f997,0709cc65-6c9f-4f4d-8ae3-f0bbc2a2a1a8,e51e2d86-c1f3-4d90-90f1-7117fb277a1d,2026-03-27T15:21:07.339991,2026-04-01T05:18:38.560102,"Both into significant wide determine else. Woman top door than. Send only investment would run international.
Among old cold structure agent. Court east foreign arrive PM lot.",2026-03-29T04:38:52.527555,2026-04-01T04:38:52.527555,CLOSED,Tax share worry feeling year later. Final step along mouth create.,Port Jacob,WELL,78.436702,-29.967732,48542.92,"2 days, 0:00:00",HIGH,b6513343-bf17-4c49-aefc-8503164485d0,1fa126ef-30c4-4cf2-9294-a6d23c75936f,7.79,gallons,False,,,,2026-03-26T00:25:15.624943,2026-04-12T23:49:46.219085,92122dc5-386d-498d-aed5-18637e1155ef,2ac3bb56-456e-4067-bd36-8a66489f98ea
2e174578-89d2-44cd-818d-7f06ce7b7746,0709cc65-6c9f-4f4d-8ae3-f0bbc2a2a1a8,088edccc-2f3d-4fae-874a-0a4ed06779c6,,,Game stay build knowledge. Produce TV possible expert feeling. New election both catch box participant others treatment. Certain imagine style no believe nature.,2025-03-14T20:42:29.701393,2025-03-16T20:42:29.701393,UNASSIGNED,Pick positive ten travel better agreement choice top. Accept I maybe every sound lose business up.,Port Michellefurt,WELL,-50.466985,-28.400393,20241.17,"2 days, 0:00:00",HIGH,6b2f79d6-d6d0-4041-8e07-26bcf5b0c7e2,1fa126ef-30c4-4cf2-9294-a6d23c75936f,75.98,days,False,,,,2025-03-14T10:32:09.662740,2026-04-12T23:49:46.219268,919f1991-722b-4be8-aab7-286444296fef,577dd594-934f-4284-89e6-2e764aa770c4
04d0c24b-1da3-4123-9fa3-42bd4b6b9309,3dd270ee-41ef-47ed-98c8-22b2af21b4aa,dcc1e17c-3547-4d18-8cc2-b9e8053b19d4,2024-04-29T06:44:30.157222,,"Challenge skill purpose. Family past together name. Star cell operation statement area part guess.
Answer democratic ask full.",2024-04-30T22:57:58.099583,2024-05-02T22:57:58.099583,HALTED,Yes research actually event. Sign PM man art production. Throw listen trip site.,East Ericview,GPS,60.9450525,63.811077,47786.56,"1 day, 0:00:00",HIGH,3a12e2fa-0e57-466b-90ce-44b3075c8ff5,4e7fc312-7d39-40c4-8680-e6cb72b0aa8b,53.52,days,False,,,,2024-04-27T06:24:49.943914,2026-04-12T23:49:46.219432,99a67531-9dc3-468b-8e80-fb6592b4c364,f25e77ca-b070-4718-879d-e414eccdb066
19794ce8-e13a-43ef-a48f-8c95967de714,3dd270ee-41ef-47ed-98c8-22b2af21b4aa,dcc1e17c-3547-4d18-8cc2-b9e8053b19d4,2025-07-13T13:39:15.933201,2025-07-16T07:31:57.927890,"Attorney then involve official base today everything.
Spring interest why west region evidence. Room behavior probably stay interview accept. Effect half statement.",2025-07-14T06:18:20.653317,2025-07-16T06:18:20.653317,CLOSED,Seven right cost left member herself. Use history Mrs newspaper start. Other nor son rate memory.,North Jenniferbury,ADDRESS,-7.2855715,107.791161,2775.97,"2 days, 0:00:00",MEDIUM,3a12e2fa-0e57-466b-90ce-44b3075c8ff5,ba2aec32-4f9f-4149-8dcb-c98d113c1dd1,76.19,hours,True,DAILY,,,2025-07-11T11:56:26.031508,2026-04-12T23:49:46.219688,acf9adc8-9e94-4987-8d7a-af2dee592baf,7626f519-9c39-4de1-8cef-f14dd3586ba9
0000f4eb-eaaa-45b2-bbed-c512b11ae30f,1d7e9e8f-40be-49dc-9672-3aa65ee2f0d0,164e1754-19fd-4529-9986-6c2789f0d803,2025-10-16T11:03:41.114439,,"On make leader interview. Note later term response employee. Street certain surface among of try art.
Blood boy role culture think long forget industry.",2025-10-16T20:10:15.536283,2025-10-20T20:10:15.536283,CANCELLED,Trouble much grow effect. Produce fear region same new quality its. Hair check own door.,Katiechester,WELL,-65.821057,-103.009198,6889.75,"2 days, 0:00:00",LOW,c6ae3bcc-bdb1-4c59-b605-b5d09eafad8c,4e7fc312-7d39-40c4-8680-e6cb72b0aa8b,33.94,loads,True,MONTHLY,2025-10-17T12:16:12.955924,Duplicate order,2025-10-14T03:29:36.053884,2026-04-12T23:49:46.219859,8fe3c23f-8d58-4079-9177-7bb4ebcabd94,22e5dc67-5e1a-46e8-a789-b12a2b86559d
6b2e70ac-9e2b-4205-b001-247b62194e55,0709cc65-6c9f-4f4d-8ae3-f0bbc2a2a1a8,3a1b6912-f450-4445-8dc1-82e07aa292b9,2024-08-28T18:47:05.525063,,Turn happen he future. Writer yet kind hair fund. Successful appear reduce card help exist.,2024-08-29T15:11:44.944782,2024-09-03T15:11:44.944782,IN_PROGRESS,Every cell avoid factor the mouth. Leg case wife middle. Safe require car maybe particular.,East Jessicachester,ADDRESS,-54.132986,-99.626508,32698.9,"1 day, 0:00:00",HIGH,e69055ba-a4be-46cd-9e35-7ccc6c58611e,3e1fd343-c96f-4490-a7f7-233a93117cfd,76.54,hours,True,MONTHLY,,,2024-08-26T04:13:26.278306,2026-04-12T23:49:46.220070,a69be6b0-bb74-4ad6-ad42-7f424df3f9f8,d0140331-cbcc-4632-93f4-4aba9cb62c82
7a683730-5eb0-42aa-baea-b3006e5a3974,3dd270ee-41ef-47ed-98c8-22b2af21b4aa,ee5e0e22-f580-4640-b1c2-bfac29b4b9ef,2024-05-24T12:42:57.487784,,"I agreement top already tree. Over exactly student weight generation southern.
Room police start material task. Senior social east. Natural whether beat out live want natural change.",2024-05-25T23:00:45.442796,2024-05-29T23:00:45.442796,HALTED,Congress husband truth just. Produce beautiful ten cost moment heavy suffer.,Allisonstad,WELL,73.9680465,-57.855142,23748.39,"3 days, 0:00:00",HIGH,d3fd0317-8cda-4159-9b3f-0975342ee28b,ba2aec32-4f9f-4149-8dcb-c98d113c1dd1,83.96,hours,False,,,,2024-05-23T06:01:15.032460,2026-04-12T23:49:46.220231,32b039af-278a-451c-bc76-1c0f0afba2e1,050caf5e-6c36-40f8-ae68-c8086b2f5d4e
b190fb82-839e-4e36-9539-4228b41e3cfa,3dd270ee-41ef-47ed-98c8-22b2af21b4aa,60bb88d6-bc9d-4ef9-aa1a-8c2aeb77deed,2024-12-17T11:32:49.183042,,"Mother few late hospital fear. Quality agreement cell throughout American forget.
Weight exist reality statement. Star throw history method assume nor where.",2024-12-19T10:51:14.244100,2024-12-21T10:51:14.244100,HALTED,Nearly risk all. Middle body new religious.,West Lindsey,WELL,77.3867215,83.805383,22308.04,"3 days, 0:00:00",LOW,fa7d170b-641d-4d49-8537-bfc423984553,4e7fc312-7d39-40c4-8680-e6cb72b0aa8b,66.66,gallons,False,,,,2024-12-16T06:11:21.484415,2026-04-12T23:49:46.220411,5d66c75c-1d41-499c-adad-cdfc0464666a,75496747-3623-4425-86c8-56abc6066371
662f1537-4120-4d39-bc09-dd82c1499d50,600ad80b-c837-4db6-b132-5c5f8b995ef6,d2da7803-13a5-4798-9361-17fc24fad9ff,2026-04-07T20:03:01.206181,2026-04-13T19:23:03.898553,"Military key check simply yes. Citizen industry leader environment local. All cost new imagine hundred. Whom sure use on.
Since fast sometimes attorney federal bill. Ready sometimes will realize.",2026-04-08T20:47:49.454269,2026-04-11T20:47:49.454269,COMPLETED,Garden all particularly expert religious. Side think line clearly various herself.,Gonzalezland,ADDRESS,-67.532017,-26.423561,45311.56,"1 day, 0:00:00",HIGH,43ba865c-66cd-4386-afe3-40990265f0a5,19e95c4f-f46c-4431-bab6-f5797bcd52f8,12.83,loads,True,ONE_TIME,,,2026-04-06T23:25:33.193279,2026-04-12T23:49:46.220621,a5b368a3-d1d6-420b-ad10-4337e5518caf,74eb83af-274e-48ab-b9ed-20d5de3791fc
3ad6738c-123f-4aab-9187-5a9ef233c5d3,62aab707-f2c5-4283-86fb-7bdb83f4ac9b,088edccc-2f3d-4fae-874a-0a4ed06779c6,2025-09-21T18:49:37.728207,,Then treatment Democrat tonight ask. Oil health keep quite present receive door. Force carry change watch crime outside.,2025-09-22T23:36:33.497630,2025-09-24T23:36:33.497630,HALTED,Design sell piece official policy. Fine voice father example report relationship capital.,Kimberlyhaven,ADDRESS,-58.936071,9.536974,43051.29,"1 day, 0:00:00",LOW,6b2f79d6-d6d0-4041-8e07-26bcf5b0c7e2,73148b49-8f75-4090-8b7e-23d5ea575b39,82.8,gallons,False,,,,2025-09-21T18:06:29.462821,2026-04-12T23:49:46.220781,018c8284-1a3a-4701-82f6-de42271ab237,47fa2f82-708a-4f07-bd7a-750873a2f395
cb6e1e6a-2ebb-4e9c-a356-d0c6d2beea2a,ad31d7e7-9a34-4eb1-8030-317d6d9d1a4d,4ec8e0e9-3415-4edc-8390-bb350c4d0b20,2025-06-29T21:38:28.561963,,Senior available else however. Everybody leave shake end letter dog war. Story medical money positive. Development fill traditional network financial consumer drug.,2025-07-01T08:09:53.378013,2025-07-02T08:09:53.378013,CANCELLED,Father turn different seat cold page poor. Store property television dog truth should message.,Jeffreyfurt,WELL,18.95559,-9.604945,42284.13,"2 days, 0:00:00",HIGH,e9a9542b-1a69-4849-8bd7-5f03059a47ee,ba2aec32-4f9f-4149-8dcb-c98d113c1dd1,8.99,hours,False,,2025-07-01T01:25:12.272867,Safety concern,2025-06-27T09:53:31.437027,2026-04-12T23:49:46.220967,781176f2-085d-4925-b874-3cb4d92ee6a1,c74443c7-1149-4e51-915b-c874d8a667cd
bf005085-1803-455d-84c2-2da48f5963ba,ad31d7e7-9a34-4eb1-8030-317d6d9d1a4d,d3d1c29a-f1f9-46d1-bd15-d62e528334f9,2024-06-28T11:15:54.094455,,Large attention month explain hundred. Glass radio when think. Beat tax from nor service he reveal.,2024-06-29T19:10:07.748864,2024-07-04T19:10:07.748864,HALTED,Pattern her among against rate some forget open. Police cold seven simply whose.,East Scott,GPS,38.56111,144.234198,34526.3,"1 day, 0:00:00",HIGH,6df7fdd8-2036-48de-a432-5b558eb15684,19e95c4f-f46c-4431-bab6-f5797bcd52f8,62.6,visits,False,,,,2024-06-25T17:27:21.522558,2026-04-12T23:49:46.221120,38f939b2-043e-40d2-907b-05fed8f10e35,133f5995-6997-4552-8c8f-e5cf2a801d1d
09c0a826-007a-4068-ad09-20e990467cb3,3dd270ee-41ef-47ed-98c8-22b2af21b4aa,dcc1e17c-3547-4d18-8cc2-b9e8053b19d4,,,"Quite social company reveal rest wife call public. Magazine another hair method.
Watch person doctor per. Arrive himself avoid question age. Serve pressure despite guy consider.",2025-02-05T20:11:31.969088,2025-02-06T20:11:31.969088,UNASSIGNED,Manager throughout address movement ability. Organization staff decade role.,North Jane,WELL,23.5888425,134.061577,22837.67,"3 days, 0:00:00",LOW,3a12e2fa-0e57-466b-90ce-44b3075c8ff5,ba2aec32-4f9f-4149-8dcb-c98d113c1dd1,35.29,loads,True,WEEKLY,,,2025-02-04T12:15:47.083358,2026-04-12T23:49:46.221325,c0e1171b-3196-4d54-aa7e-8ee5ff2fc097,327d4ac7-1bc7-4c5e-adc3-2bb45a755353
9f6c4663-a8b4-4902-b856-433bc87ac9af,f1c4b27c-6e22-48a1-a23c-8d646460dcc9,dcc1e17c-3547-4d18-8cc2-b9e8053b19d4,,,"Ok social wonder will theory. Those realize name. Nature strategy admit really. Community officer TV imagine top evidence.
Type team exist ground owner practice. Read full whose you question degree.",2024-05-02T00:11:28.558993,2024-05-05T00:11:28.558993,UNASSIGNED,Sit care support while will. Produce three fish go. Join government will.,West Kylefurt,ADDRESS,-4.392165,-42.328743,40797.98,"2 days, 0:00:00",MEDIUM,130461ce-ec04-4bb2-a015-48c03f0aa75d,7b6dfde4-99be-4a0d-8299-9105d88c6974,91.6,hours,True,MONTHLY,,,2024-05-01T16:58:24.688470,2026-04-12T23:49:46.221492,4f8f21ae-40b0-4e39-96f6-90e0216ce988,01d150e5-30d1-4687-aed7-eca059daf7ff
1aecc3af-4803-476e-bd9f-9369a8195bae,600ad80b-c837-4db6-b132-5c5f8b995ef6,ac5b1c50-7bd0-4ab9-ae40-7f1e992ad093,2024-11-05T18:55:07.776064,,"Almost hospital coach list arm east moment win. Become at two hair inside. Everybody right little learn any.
Subject adult professor. Employee movie grow. Maybe consumer behavior much.",2024-11-06T20:23:05.042371,2024-11-11T20:23:05.042371,HALTED,Degree heavy positive measure cost. Media buy yet go simply mouth.,Bradleymouth,GPS,-81.3915145,-76.655969,48760.14,"2 days, 0:00:00",LOW,dac3e8aa-5570-49ca-aa41-8c964b8f5bf1,73148b49-8f75-4090-8b7e-23d5ea575b39,39.52,hours,True,MONTHLY,,,2024-11-03T23:40:10.594202,2026-04-12T23:49:46.221738,f2fc2583-1768-4b70-b360-0f1b859fa2e8,bf0f3feb-3db7-45a6-b55e-b0d3af53a388
0798f5ec-d1a0-4657-8281-20af0a33ef6e,0709cc65-6c9f-4f4d-8ae3-f0bbc2a2a1a8,e51e2d86-c1f3-4d90-90f1-7117fb277a1d,2024-04-17T14:27:11.117913,,Safe cold draw part. After majority country. Stop size play use garden national.,2024-04-18T20:31:35.476841,2024-04-21T20:31:35.476841,REJECTED,Peace smile history new right.,East Patriciachester,GPS,-79.102687,73.40986,46182.9,"1 day, 0:00:00",LOW,b6513343-bf17-4c49-aefc-8503164485d0,4e7fc312-7d39-40c4-8680-e6cb72b0aa8b,19.33,gallons,True,DAILY,,,2024-04-15T06:08:40.842485,2026-04-12T23:49:46.221902,6793e809-89e7-48a8-b8f1-67675c7ed032,c353d058-6829-4e1d-8e3f-b96963a78deb
39b590c8-c2bd-4ffd-971c-295fdf6c026b,1d7e9e8f-40be-49dc-9672-3aa65ee2f0d0,60bb88d6-bc9d-4ef9-aa1a-8c2aeb77deed,2026-01-17T14:38:54.270341,2026-01-24T17:54:12.711365,"Never beat where them bag agent teach.
Buy no shake. Week industry from already. None assume here this team day us beyond. Debate president create good.",2026-01-19T12:21:56.074006,2026-01-23T12:21:56.074006,COMPLETED,Find old be. Get produce perform attention likely hard. Discuss interview way wall.,West Karlfurt,ADDRESS,-28.4089615,0.878196,10690.81,"1 day, 0:00:00",LOW,4f1b3fa1-5528-421f-93e4-caf6c5422b2a,4e7fc312-7d39-40c4-8680-e6cb72b0aa8b,21.89,days,True,ONE_TIME,,,2026-01-15T21:59:42.293704,2026-04-12T23:49:46.222112,35216ab6-d387-4626-9c57-654ce13130fa,c432ce71-01df-42ef-b00b-fb3e2e488e1c
22fd22f2-ea51-42e9-bc5a-0043f53b027b,f1c4b27c-6e22-48a1-a23c-8d646460dcc9,17466069-387c-486d-be2b-cfeb30f62c1a,2025-09-08T12:54:11.563141,,"Fine prevent involve. Let hear wrong organization successful resource whose.
Itself particular moment back successful. Difficult administration moment picture open present society.",2025-09-08T17:00:30.132165,2025-09-09T17:00:30.132165,ASSIGNED,Entire expect just may. Decide behavior however material could.,Lake Robert,ADDRESS,37.1366415,-86.767833,2315.98,"2 days, 0:00:00",HIGH,04847602-db19-4c1a-8aa5-9b8645d42d3d,19e95c4f-f46c-4431-bab6-f5797bcd52f8,82.86,gallons,False,,,,2025-09-07T17:11:52.474006,2026-04-12T23:49:46.222282,8c0c5399-7c43-47e3-bafa-179cf14deb63,6ee6f9c6-9f98-4c6e-8b22-62a187226328
79e6e18c-a07b-46b3-9e95-369937b3e25b,3dd270ee-41ef-47ed-98c8-22b2af21b4aa,164e1754-19fd-4529-9986-6c2789f0d803,2024-08-10T03:23:07.360582,2024-08-13T04:08:56.892375,"Support summer support those leave. More new none author great the.
That kind recently including sea. Billion part ten. Particularly Mr rich.",2024-08-11T21:01:48.034976,2024-08-12T21:01:48.034976,COMPLETED,Clear large policy animal. Identify item number Democrat. Determine performance article hope else.,South Ryanfort,WELL,-41.9824445,109.166423,12759.65,"3 days, 0:00:00",MEDIUM,c6ae3bcc-bdb1-4c59-b605-b5d09eafad8c,ba2aec32-4f9f-4149-8dcb-c98d113c1dd1,70.45,loads,True,MONTHLY,,,2024-08-08T02:32:26.827897,2026-04-12T23:49:46.222452,78c65af7-9555-4f01-86cc-fe47c52534a7,77d5a1dd-0a70-475b-85cb-422b6ba5cc21
617c4aac-3008-4187-b648-4b57485c6531,f1c4b27c-6e22-48a1-a23c-8d646460dcc9,ac5b1c50-7bd0-4ab9-ae40-7f1e992ad093,2026-02-08T04:05:35.067579,2026-02-14T16:39:57.567834,"Another operation third until inside. Third scene suddenly hear southern. Hand lose draw which go happy.
Whose group cold attorney. Section operation population argue number. Pick them of.",2026-02-09T22:03:45.569279,2026-02-13T22:03:45.569279,CLOSED,Institution north gas never despite like play. Size finish interest.,East Brittany,ADDRESS,24.390826,-55.361894,19319.06,"3 days, 0:00:00",LOW,658b2dbd-d06a-43f4-9e1b-d7a9ca2fc850,4e7fc312-7d39-40c4-8680-e6cb72b0aa8b,94.76,gallons,False,,,,2026-02-06T04:34:45.356328,2026-04-12T23:49:46.222649,6857ab2e-d8c8-4b03-8a8b-deae920467b3,75496747-3623-4425-86c8-56abc6066371
50d9aa2c-92a8-4563-81c6-cbe6503d64cc,1d7e9e8f-40be-49dc-9672-3aa65ee2f0d0,d3d1c29a-f1f9-46d1-bd15-d62e528334f9,2025-06-14T02:46:08.370264,,"Young system mean method affect car huge. Laugh phone thousand enter military.
Yeah number exist card some forget. Foot small generation out. Society store minute value.",2025-06-15T13:14:14.130420,2025-06-18T13:14:14.130420,ASSIGNED,Risk civil special off top now. Teach sea interesting.,Port Gregoryside,ADDRESS,-86.3817025,-1.225064,15883.87,"1 day, 0:00:00",LOW,e402e1e8-2c73-4a2e-b313-4cd4be5549ed,4e7fc312-7d39-40c4-8680-e6cb72b0aa8b,31.77,days,True,MONTHLY,,,2025-06-12T21:41:26.780059,2026-04-12T23:49:46.222830,6132a7c7-ce36-45a6-9447-eb51dcb20ba4,1c0bd123-9f3d-4065-8c9c-36706c0773f9
