work_order_id,assigned_vendor,assigned_at,completed_at,description,due_date,current_status,comments,location,estimated_cost,estimated_duration,priority,well_id,created_at,updated_at,created_by,updated_by
6b6555fb-94f3-49f2-b25c-c1e4ab4c6f3c,1c9ccf14-5176-4c6c-8254-4abf7d027bfa,2026-03-13T11:16:30,,Capital reduce people voice music unit. Watch history help. Perhaps form school goal candidate push become. Thus dog police.,2026-02-22T15:54:41,assigned,Old suddenly service no conference series set. Close close moment fight world.,East Robertoborough,3902.61,46,emergency,469ea200-c22e-4398-94e3-fd4996ca479a,2025-11-10T00:48:27,2026-04-05T08:43:54.120953,8ea99b21-97c1-4738-b966-ce0fe8eaff7a,6d463fc1-fd62-456f-9afb-4f3b07916665
c7b2c361-a0ba-486f-82b5-b956bfcec810,2420f3e7-c826-47ed-9895-1c516c602cfa,2025-06-24T18:44:12,,"Near always party class magazine seek. Eat admit off fire back new address.
Avoid study sound improve.
Property decade grow consumer. Understand be smile order. Dream several owner find.",2025-10-22T17:30:41,completed,"Yard break art score. Three someone fine.
Finish officer test get. Inside six want.",East Vanessamouth,3409.46,27,routine,df5314c4-830b-4e0a-add0-5d7b29866c88,2025-04-07T01:55:23,2026-04-05T08:43:54.121301,e92897dd-1ddb-4453-b34c-36491ff674af,cdc5b99f-43f5-4283-937a-b36ab43b8c3d
93b3b833-fa6f-4323-adf7-4d55df4d907c,ca790bf9-a3d5-441e-9e35-13b30dd2f3a3,2026-02-15T08:35:24,,"While include should decide interesting reach. Clearly nation bring feeling party participant.
Person well travel during nearly middle gun. Sit create at anything dark. Network choose quite save low.",2026-03-25T16:17:56,unassigned,Challenge moment open large tax. Real ago natural process realize.,North Stevenview,2840.85,43,emergency,9b874a7c-4abb-499d-ad5d-6a35f1530d91,2026-02-12T21:46:57,2026-04-05T08:43:54.121552,51499077-2c88-4164-b3d3-187655937724,26d2b0d5-358d-4a94-ba60-74d53733548e
fb667d78-4c06-4232-adde-6c8b8fdae567,0ded7f06-ed67-4a95-a21d-2c431e38c883,2026-04-04T09:20:00,,"Money treatment step start again rule apply. Threat list have responsibility.
Particularly still keep involve movie prevent. Law nation various decide draw ball.",2025-11-23T17:39:40,completed,Recently ground hair another. Night tonight recent card light gun movement.,Katrinachester,6975.33,46,urgent,0e694953-3067-40a7-881c-3d5676a57180,2025-10-02T17:26:02,2026-04-05T08:43:54.121800,98863fc2-4caf-4316-aa43-f0f09561aba1,7c5a08a2-dde2-4b2f-8789-9635eeac67cd
d13f45ad-0e4d-49f4-a812-eaa112299ea4,8d975f8a-3c15-42d6-a033-74e9628c5264,2026-03-22T18:09:01,,"Hope standard whom TV mind. Do represent determine. Everything American TV.
Season try wish foreign.",2026-03-13T05:47:36,completed,"Huge American report bring way.
Vote specific wrong how drug. Bed or how than.",Lake Ashley,8670.47,46,emergency,e86fef08-42cf-49ee-b84d-4480cf6dd429,2025-12-18T12:50:49,2026-04-05T08:43:54.122093,010ce91f-a917-4191-8410-71f6cebd3eb6,756bb689-4ce8-414d-aad4-ae06dbacb18d
249de619-043d-48b6-a640-8a804ffb0717,1c9ccf14-5176-4c6c-8254-4abf7d027bfa,2025-11-14T15:01:01,,Make thank six television. Boy organization easy blood why report any. Picture show brother ball tell leader which find.,2026-01-03T00:21:02,unassigned,Blood event produce improve. Attack teach top member into. Decade yard know front item modern.,South Ricardobury,7626.12,30,emergency,469ea200-c22e-4398-94e3-fd4996ca479a,2025-09-16T23:13:11,2026-04-05T08:43:54.122366,e84d8604-d472-4d59-925b-54e8ca0e459c,c157e665-ce6a-4ade-a0e5-0e037feabf1d
5684e413-2449-4edf-92fd-5f24821493e4,0ded7f06-ed67-4a95-a21d-2c431e38c883,2026-01-22T05:41:50,,Bring onto race example. Sound reason attorney election worry. Audience recently growth institution walk.,2025-10-26T02:51:40,unassigned,Life without huge company wrong skin. Success field material share play particularly treat.,East Brianshire,6995.97,67,routine,31864a77-6c37-4e89-b0c6-17161a0eb3e3,2025-10-16T15:32:30,2026-04-05T08:43:54.122688,3be104de-95b7-4017-b03e-c3224e5d8448,769d446e-1b46-4589-95ea-7520baaa04da
dc2a52a9-bbf1-45b0-af08-d78b2e266910,cee53164-4353-443b-87fe-d45aa142b0eb,2026-02-01T16:40:25,,"Collection record various stock. Most last thus.
Least couple policy wide under nature style. Administration vote teacher.",2026-02-17T20:39:14,unassigned,Guy success himself eight. Maybe after character look situation.,Sandratown,8010.31,9,urgent,db10f7b3-0b9c-433e-8ee7-109f1e0a5e43,2025-09-25T08:42:30,2026-04-05T08:43:54.122968,b1bdc9f0-d845-40a8-b067-2616d944c37f,b42de05e-948c-4c69-ba78-4aea866142bd
589301b6-caaf-405a-972a-353baac57fdb,cd464691-0ec1-4610-90bd-ddf7f41e4b75,2026-02-22T12:47:37,,"Investment way day way. What power all sister student study trial.
Woman citizen paper design care. Game student similar it parent plan.",2025-08-19T02:13:31,assigned,Indeed or project recently western action. No list base owner school tough into.,Cheyenneville,8194.89,2,routine,ed2da5e7-d501-4d62-952e-1d3134a962fd,2025-05-24T16:02:39,2026-04-05T08:43:54.123319,971f8d3d-9c5f-43c3-b7c3-799bbdef7f4a,0478f207-42b7-48c4-bd57-a8f5f8e83149
acb6cc42-2c82-4ad8-9ba6-3bcf3b3ce25f,ca790bf9-a3d5-441e-9e35-13b30dd2f3a3,2026-02-10T19:11:09,,"Game city be need pick.
Oil prepare media nothing first. Rather play two for. Like option particular behavior anything.",2025-12-16T09:47:15,assigned,How economy room writer late himself. Arrive various wonder industry message know.,Deborahburgh,5014.81,14,routine,1dc1a3aa-63e9-4e28-96e0-6940997b262d,2025-09-01T09:03:28,2026-04-05T08:43:54.123710,532d3501-2341-4d3a-a8b4-db0c5791eeea,8b5cbeaf-56cc-4de1-9bfa-d21b8748282b
8bf087d3-1738-478f-b238-4cecc47407c4,084e231e-e1f9-43f1-9eea-8501ecc87efe,2026-02-22T10:31:45,,"Positive she measure tell. Later capital bar real summer.
Ever go ahead. Music begin brother care matter need ago.
Sport spend property claim. Class building front edge serve bring experience term.",2026-03-04T17:48:08,completed,Cell tend us woman social. Stop team key instead station decision record adult.,Lake Dennis,7019.24,38,routine,ef4bb67f-078e-4329-bab2-0f18a1934f6f,2026-02-21T17:32:32,2026-04-05T08:43:54.123995,5aef8d6a-0ad6-4425-9a65-47b066e23a99,1dfcf478-2ca3-4544-ae82-c1ef18bdc1c6
e11f7e81-ae8a-4a67-8524-9f16d2725b99,cd464691-0ec1-4610-90bd-ddf7f41e4b75,2026-01-24T17:54:01,,"Feeling economic still him west magazine force. Become strong four indeed shake wide.
What check fund edge most generation. Dream them foot. Table thing view ready safe.",2026-01-12T13:29:19,assigned,Involve cell interview along. Low heart wind leave let. Boy election yes raise worker.,Loriview,9307.2,61,routine,e8844ffb-9054-4bbb-a468-5f0edbb4c036,2026-01-03T17:10:20,2026-04-05T08:43:54.124297,e00d3b27-9fd5-4f41-8fe3-4e52c399a56c,bad6bc76-f7af-4708-ba62-906d73779380
1aed311b-b5e1-4263-99ac-f794b16c42c1,a64c8bad-2eed-4f71-9a2c-ab6446555b42,2026-02-02T05:07:03,,Recently serious body identify talk simply station. Protect sure long group too.,2025-09-01T21:03:49,completed,Officer individual truth program resource size. Dream per wife first six.,Brendafurt,4976.06,24,routine,a229b0b2-b50d-4763-99d3-cc948a68b30a,2025-08-04T15:48:14,2026-04-05T08:43:54.124567,b391b724-d724-4d47-943c-4a09e42a449a,ac8ee3a1-45d6-4726-bac9-16745c31b820
42c8a8fa-af5a-4f6f-b8a2-2baf873a5728,0ded7f06-ed67-4a95-a21d-2c431e38c883,2026-01-30T04:35:05,,Own each allow collection crime door deal. Research and address professional very enter generation. Civil probably develop generation maintain position benefit.,2026-01-01T13:50:45,unassigned,"Peace hope art. Training far major everybody Mr get size.
Start catch win listen certainly method.",Hectorstad,8118.44,18,urgent,67ca0fea-a09e-43fc-a497-e7e87cae0d61,2025-12-15T09:07:31,2026-04-05T08:43:54.124852,010ce91f-a917-4191-8410-71f6cebd3eb6,e80fcc66-1a97-4e76-bc02-4848c6343bae
e0ad4e44-9bfe-48de-ae77-8d751218a646,a64c8bad-2eed-4f71-9a2c-ab6446555b42,2026-01-06T04:08:00,,"Participant describe nice century. Herself agency every his goal full. Season stop brother computer.
Son use business radio actually line. Loss design every pick billion allow.",2026-03-12T07:41:12,assigned,Score could writer hand trip. Garden personal nation.,South Dylan,7188.66,50,urgent,96dde906-ba9e-4302-994c-4109b53d4619,2025-11-09T01:07:13,2026-04-05T08:43:54.125115,4942e9b4-2407-4c3a-8ac5-5a5fe4a7b9c4,f1a686a1-88f9-426c-8e40-04af6045823b
3a2ebb13-98c1-485a-81dc-ea27ff9eb78b,0cfc4b3e-0118-42f1-8bd8-617ccf8310cd,2025-10-29T19:51:35,,Speak write could situation various idea point. Rock meet go agreement yeah cultural. Quality suggest baby parent may tonight morning argue.,2025-11-23T17:30:30,completed,Enough listen thus book style through. Former break ahead. Race arrive class scene between idea.,Whiteheadstad,3462.84,43,emergency,e0d1ef75-4a31-4c0c-8a21-9b5cb93a95d2,2025-10-13T23:26:01,2026-04-05T08:43:54.125403,7c75fa25-f491-4d45-875b-397fd221354d,d15b45d9-41cf-4778-89f4-9373e04de01f
a3effedf-feea-476b-9b1a-4345ddfaebab,a64c8bad-2eed-4f71-9a2c-ab6446555b42,2026-03-07T19:16:59,,"Anyone father food movie example general.
Half prove much price thousand. Find article indeed too head.
Bit city call share up. Yourself suggest fund here.",2025-07-24T20:09:47,completed,Say sign course American according. Sense hot describe. Floor certain often.,Lake Sharon,8258.06,6,emergency,e0d1ef75-4a31-4c0c-8a21-9b5cb93a95d2,2025-07-06T06:15:27,2026-04-05T08:43:54.125688,fe37b6ec-7b89-4f98-9c31-73532481e01b,ef65804d-d29d-45cd-ad27-3a0640b30759
c0362733-b22e-4cea-9d5a-5b6325c2d55e,0cfc4b3e-0118-42f1-8bd8-617ccf8310cd,2026-03-19T07:57:34,,"Participant stage whose. Young to ball. Contain itself red any.
Owner join son either option important future. Back face when industry. Station upon politics.",2026-02-14T07:22:08,unassigned,Spring least agreement building.,New Williambury,5101.59,62,routine,6fe1d5c2-365c-49ee-a9fd-f5d91829a585,2026-01-09T22:24:06,2026-04-05T08:43:54.125999,fce4b1f9-9817-46dc-b8e1-7b9c2a2aad73,c9a5499f-ceda-4fa5-981b-6cf65893ddfe
c3b559a5-9686-4451-a110-eded5562e0a0,1c9ccf14-5176-4c6c-8254-4abf7d027bfa,2026-02-09T16:47:12,,Clearly ok writer whom but. Believe meeting country meeting enough. Especially there common share back.,2026-03-02T16:04:51,in progress,"Read kid rule sound industry. Campaign use big understand feel enter.
North section career debate.",South Matthew,3413.49,13,routine,d3f1f0f2-7349-4bdd-96c5-7a54a9a93397,2025-09-10T04:22:39,2026-04-05T08:43:54.126273,59a74b3f-4efc-4989-9e7c-394b3c8ec633,ad8512f2-b7a1-4487-9478-8a1f0466ead2
361677c7-5f34-4a59-8f75-3a95360b80de,ca790bf9-a3d5-441e-9e35-13b30dd2f3a3,2026-03-12T00:12:31,,"Significant radio risk walk past with. Action important arm watch try when while. Easy born thus important alone allow.
Check tree politics magazine focus even. Trial wish away word learn.",2026-04-08T15:36:11,assigned,Political deal find real those director memory cup. Attention group interest parent loss.,West Isaac,8539.48,31,routine,9b874a7c-4abb-499d-ad5d-6a35f1530d91,2026-01-05T11:19:15,2026-04-05T08:43:54.126567,b691d28c-1bb3-4853-a8c3-be0d57d6c576,be07cef7-1a7d-4a21-8091-94171808be72
c3e751c3-1276-41c6-ae4a-12aaa73b8830,cee53164-4353-443b-87fe-d45aa142b0eb,2026-01-20T09:35:44,,"Police beyond by yeah very wife. Character middle full wait.
East mind say pick man computer half. Box way inside provide.",2026-02-07T04:28:39,assigned,Save southern box push debate as. Assume specific major summer bed according usually.,Lake Tylerside,5276.37,66,routine,8d6527a3-961e-489c-86c1-47e7ddc60d4d,2025-10-11T19:37:12,2026-04-05T08:43:54.126839,076a0dab-0267-43d4-9ca4-5f969efdb964,d5e21509-49d2-4f78-8522-12167ffa53fa
c2d014b7-ec90-41d6-a06f-1bd52dde005f,0ded7f06-ed67-4a95-a21d-2c431e38c883,2025-10-19T17:26:19,,"Employee seem laugh. Himself on same.
Wide item theory. Believe may drug blood body. Star reason camera nor.
Music technology western nor. Nothing range drive. Member may change class.",2026-01-28T15:58:54,completed,Third production Mrs writer interview instead election. Fast act up fund will choose challenge.,New Erik,5819.92,18,urgent,0e694953-3067-40a7-881c-3d5676a57180,2025-07-26T00:37:42,2026-04-05T08:43:54.127116,317c3c81-7cf9-46e8-acaf-36375a5c7fbe,1dfcf478-2ca3-4544-ae82-c1ef18bdc1c6
c76189fe-5f79-474f-ae74-9d0a1b77a104,0cfc4b3e-0118-42f1-8bd8-617ccf8310cd,2026-03-04T20:25:15,,"Half yeah how. Under goal story simple teach.
Spend traditional remember rise business area. Free study indicate box. Enough pattern everybody person people.",2026-03-07T13:29:40,in progress,Hard real probably enough itself glass their. Per pressure next military.,Lake Anthonyberg,2048.07,5,emergency,231fe4ef-9dfa-4029-a4b7-07ba7d1b832f,2026-02-21T00:03:10,2026-04-05T08:43:54.127374,b391b724-d724-4d47-943c-4a09e42a449a,06f188cd-709a-4ee7-8725-320aee6cea61
da68a251-124f-43a5-9fb7-34875076bac5,cee53164-4353-443b-87fe-d45aa142b0eb,2026-02-24T10:02:28,,Third affect send personal speech. Oil goal evening over like. Class study bit none idea away eat. Financial main high hard.,2026-02-25T05:46:03,assigned,"Stay training may else. Pretty more certain write doctor.
Avoid structure cold according cup town.",New Raymondfurt,6755.79,26,routine,f5c66a6c-dab7-4bd9-b05f-5bf8530c5350,2026-02-16T21:48:53,2026-04-05T08:43:54.127641,a978ee85-0289-45b6-93e0-5e4fc2b77036,a108eaf4-5832-4225-a22d-379c5f2dae0b
3136ac79-fe54-47df-bab5-53a708d0b6e4,ca790bf9-a3d5-441e-9e35-13b30dd2f3a3,2026-03-06T13:27:10,,Without language process responsibility. Consider decade impact activity send task until. Center young message father billion black.,2026-03-23T02:46:05,unassigned,Whether former paper remember mention. Be enter sit manage baby include long.,East Timothy,8404.23,34,emergency,9b874a7c-4abb-499d-ad5d-6a35f1530d91,2025-04-15T19:53:57,2026-04-05T08:43:54.127935,3947f6fd-3e4e-4ee7-b7a2-99f3a1ebb06a,50305b9e-1326-4b8f-8dc0-b88bc34cccf3
b9648b70-ab57-4ae6-b24d-6a204dc6669d,8d975f8a-3c15-42d6-a033-74e9628c5264,2025-11-22T15:19:33,,"Either thought particular rest. Writer movie include both south simple.
Owner some know available front management. Central sense four heavy analysis same. Go too cause least.",2026-01-13T09:25:22,in progress,Stay sometimes be after.,West Jessicafort,1981.82,30,emergency,29f7720e-b3e1-4b2b-bae3-d90c474d8fd6,2025-09-02T21:20:18,2026-04-05T08:43:54.128193,66eda81f-e9e9-4b35-aac5-d502068bbaec,c22d0770-7c64-42c4-b1ab-364b98db3083
b326fdee-1f06-4ac2-a6b7-006225fce782,8d975f8a-3c15-42d6-a033-74e9628c5264,2025-09-12T16:13:44,,Personal its participant single. American staff upon possible. Physical sit either baby.,2026-04-04T05:52:11,unassigned,Image accept most deal four everyone. Family property project front one.,Samanthastad,1196.78,19,urgent,63f4b8f1-3a9d-457e-8a34-e3e719900a1c,2025-08-12T13:08:33,2026-04-05T08:43:54.128445,7afa08c0-45fc-45c4-812a-727e3688d672,04fa6ca4-472b-452a-8add-0b5e86bf949f
2354769a-e518-49b9-b673-8be173ccccee,cd464691-0ec1-4610-90bd-ddf7f41e4b75,2025-11-07T09:57:55,,"Teacher up sit short recognize two. Son real result long center. Window pattern safe against.
Fill court whole increase born trial. Purpose stuff same language that standard.",2025-12-13T08:47:29,assigned,Film ball and similar.,Contrerasburgh,7893.99,62,emergency,1dc1a3aa-63e9-4e28-96e0-6940997b262d,2025-11-01T00:05:55,2026-04-05T08:43:54.128739,06f8f4ff-7501-47aa-8a49-9963ae5c6e59,67bdbe41-ea2e-49b7-87b2-8bdc6819e55e
0b5f4848-27c7-4d3e-8900-faedf53d0563,1c9ccf14-5176-4c6c-8254-4abf7d027bfa,2026-04-04T13:24:49,,"Hundred pass window tough throughout. Performance concern any he.
Specific three group with establish. Beat brother design.",2026-03-09T00:16:59,unassigned,Goal full Mr according court seat. Event purpose cause happy relate within.,Port Fernandoville,8320.46,64,routine,22a17616-9d6c-4127-babc-9b9ee93a4565,2025-12-26T05:21:55,2026-04-05T08:43:54.129041,35bfdb64-e041-46c1-a8b0-f80a96b83311,a02c698c-abef-443a-88ae-e43b2ca09721
c3059036-7806-4a54-b471-dcea3cf8ffa3,8d975f8a-3c15-42d6-a033-74e9628c5264,2026-03-09T06:23:24,,A result must raise science. Alone science ready most effort pull. Child thank speech drug.,2025-08-11T07:02:51,assigned,"Early catch series technology whom.
Line rate building her attorney.",North Feliciaport,8723.34,16,urgent,63f4b8f1-3a9d-457e-8a34-e3e719900a1c,2025-06-18T23:52:22,2026-04-05T08:43:54.129343,bc2883ce-0411-4d48-9140-dca0cd02cdee,d37d0250-e6df-4e8d-a1b2-68e696550535
eced3dd6-1a69-4823-bf53-34bebc166298,0cfc4b3e-0118-42f1-8bd8-617ccf8310cd,2026-03-16T08:16:50,,"Drug time maybe left paper share. Strong try soldier best. Concern six staff wear.
Ever laugh public. Minute class during purpose especially open four.",2026-04-10T12:33:13,completed,Develop reveal matter fish fall. Affect forget song within next. End tell vote write.,Lake Ronaldmouth,1827.98,58,routine,6fe1d5c2-365c-49ee-a9fd-f5d91829a585,2026-03-12T21:07:49,2026-04-05T08:43:54.129609,5b3c95ac-6faf-4d32-8e49-852877d562d2,d7a00477-4cc5-4775-92fc-d095324161ba
8db87337-6c98-4344-a2f4-d5e6c67c2261,1c9ccf14-5176-4c6c-8254-4abf7d027bfa,2025-12-17T23:47:58,,"Never much win open morning vote. Person try than.
Develop visit pick me first. How control PM friend approach you. Grow run family.",2025-08-17T17:48:56,assigned,Whole this what. Dinner various material clear account would on. City nation mention beautiful.,West Holly,7155.69,44,emergency,6e2cc6ee-6bac-4671-90d2-86b1c56c0fe5,2025-08-15T00:34:04,2026-04-05T08:43:54.129911,4105fb81-d7c6-439a-8740-e214356e8f80,d28377e8-4d73-4d9e-9c4c-76da6b2524d0
d5872925-bca3-428d-856a-7d65530a7820,a64c8bad-2eed-4f71-9a2c-ab6446555b42,2026-03-29T10:43:55,,"Attorney teach behind fast. Guess condition build ok range party. Production theory voice.
Read letter stay talk always strong certainly. Four face space. Across would defense deep continue hear.",2026-03-27T05:29:36,in progress,Skill room sister loss wide generation. Pretty impact this free.,New Angela,8229.19,62,routine,7aee536d-0793-4ef7-83b1-999a1ba41050,2026-02-11T20:58:53,2026-04-05T08:43:54.130211,bf8482fc-63f0-408e-bb04-9b53131e5ab1,6318ca51-ba4b-429a-a3b4-1abe0a9bcbc9
9f06ed0d-83d8-4811-a1c6-601c5bb53b4b,084e231e-e1f9-43f1-9eea-8501ecc87efe,2025-07-16T05:18:40,,"Walk home bring child large. Purpose weight want must such anyone already area. Experience century continue find phone buy.
Add season capital build. Door kind firm down decade himself.",2025-07-30T00:56:12,completed,Culture gun black what direction available. Across reflect system network party.,East Alison,9729.11,21,urgent,7e627c1f-58b6-4180-9109-d4c222f350a6,2025-04-27T16:24:50,2026-04-05T08:43:54.130473,169785db-6b3f-413b-8b88-5f1e5710377c,51499077-2c88-4164-b3d3-187655937724
279585e4-0f02-468c-8a0f-45c6ad910f79,0cfc4b3e-0118-42f1-8bd8-617ccf8310cd,2025-12-06T23:53:25,,"North very Republican. Sort where argue family.
Program course poor stock growth hard. Them safe once real my. Head common race by.",2026-01-26T17:45:51,completed,Back draw role yourself daughter house. Agree education debate participant cold.,North William,6782.47,63,emergency,96dde906-ba9e-4302-994c-4109b53d4619,2025-10-20T18:36:54,2026-04-05T08:43:54.130720,0a22464a-f662-445d-84de-d669b5dd8e0b,b352e01e-4ba2-459c-81f5-7e4c029dad98
d24d44ac-15dd-4175-a6bd-a2093cdb66d0,cd464691-0ec1-4610-90bd-ddf7f41e4b75,2025-05-02T03:48:25,,"Spring new east daughter fund. Two bad law every activity idea despite. Data work truth forward industry.
List military later house network. Early recent they garden.",2026-01-17T02:13:14,unassigned,Serious lay property claim western. East arm deep some.,East Marcusborough,3391.64,66,routine,15569630-86c8-4f19-b0fb-53aef6998b8d,2025-04-09T04:47:43,2026-04-05T08:43:54.131015,a8f613df-2035-478c-9580-65084f80fd4b,55c8155d-b405-4945-b055-bb2000f6b481
6fbf70c1-9855-443a-8fcc-e8ce7b3349a9,1c9ccf14-5176-4c6c-8254-4abf7d027bfa,2025-08-27T19:41:59,,Prove they place if value somebody. Activity challenge system stock moment herself. Clearly effort line huge half behavior someone.,2025-11-09T07:49:10,in progress,Hard market service write admit. Speech PM respond arm.,Carterchester,8682.67,48,routine,3f9ad0b7-2433-443c-a2e6-c5544f0aff0e,2025-05-01T09:24:20,2026-04-05T08:43:54.131401,fce9fe57-0f05-4ebe-b107-45343ef3c971,a97d67a9-7be0-4230-9b9f-8b7a77134931
d9de1e80-5a05-4ca2-bea8-b840c052b12a,1c9ccf14-5176-4c6c-8254-4abf7d027bfa,2026-03-01T06:30:11,,"Talk argue be customer number blood quality. Job trial trip black last process sing. Miss poor pretty buy effort language. Majority together according candidate ask.
Choice type age buy offer decade.",2026-04-05T01:00:55,assigned,Smile yourself doctor word. Buy wait Mrs face again plan.,Port Adrian,2227.03,9,emergency,80040808-cc84-4679-baa9-bf31134fb1e1,2025-11-11T13:03:47,2026-04-05T08:43:54.131746,a978ee85-0289-45b6-93e0-5e4fc2b77036,75453ce6-d87a-44e1-a00b-48d6dd51ca74
514b72b1-2432-4392-a29d-0237658f74b3,8d975f8a-3c15-42d6-a033-74e9628c5264,2025-08-10T14:36:49,,"Report remain difference professor bar can. Real either act son tonight dark which.
Continue usually still morning. Money explain apply opportunity. Mrs popular get million Mr real.",2025-07-29T02:34:57,in progress,Condition forget why our official. Television image anyone place quality.,New Robertland,7472.73,70,emergency,3daa2bfc-970f-4893-8794-551b1c247215,2025-06-23T09:44:17,2026-04-05T08:43:54.132058,7af384d7-b31a-4998-a815-b28219090e41,264f9d22-f498-4cb8-9c88-97d33776d483
e5aff2a6-f150-447f-8ab5-a354bcc45b25,cd464691-0ec1-4610-90bd-ddf7f41e4b75,2026-03-30T22:27:41,,Image interest color field. High company challenge tell later when fall. Parent right common treatment million my government. Discussion shoulder position although whether.,2026-03-24T04:11:43,unassigned,Surface but imagine usually.,Barnetttown,8359.92,43,urgent,1dc1a3aa-63e9-4e28-96e0-6940997b262d,2026-02-21T02:28:31,2026-04-05T08:43:54.132323,59ca972a-24b5-4975-8e21-ce48f38cf055,084f57fc-b0b7-408e-800b-975fd64b5537
df831536-1f3a-4b4c-bf3a-4c1804634dfc,a64c8bad-2eed-4f71-9a2c-ab6446555b42,2026-03-01T19:30:52,,Young dinner administration cut great vote job. Increase program yourself sound mouth human.,2026-02-19T09:27:30,completed,Smile process series keep against kitchen. Ever response that remember.,Alexanderstad,9405.75,8,routine,c7ea2efc-77d3-42db-b76b-0b4785ee288e,2026-02-14T03:59:31,2026-04-05T08:43:54.132582,9cf0f200-ff1a-4f2d-8d89-924c8a9ebf70,0fdf2442-7257-490d-bd9c-3251d77b3ce8
f2161dfe-910c-4395-8ded-aab2bcbbc611,a64c8bad-2eed-4f71-9a2c-ab6446555b42,2026-03-06T07:30:22,,"Knowledge design along chair majority. Situation ready media final only.
Painting majority ok push. Young trial series identify senior last.",2026-04-01T02:42:44,completed,Something space raise attorney court.,Nguyenton,2271.0,20,urgent,25be841a-77c7-4ba2-a472-92a8a60beeaa,2026-02-19T04:41:14,2026-04-05T08:43:54.132900,3aa583ff-3481-495d-86ce-8353e00ffb74,5b458ef6-f537-4f3b-85ae-8a356b599206
8f9aae30-64e4-4a8d-9e88-582b9b7b72da,8d975f8a-3c15-42d6-a033-74e9628c5264,2026-02-20T20:54:00,,"Everyone network claim ready.
Yet board save gas. Could sing agency under. Structure film choice study drive employee.
Suggest population fill attention. Than director college onto.",2026-02-11T17:27:49,completed,Result check office. Great understand soon business that its.,South Willietown,2008.3,70,emergency,e8844ffb-9054-4bbb-a468-5f0edbb4c036,2025-12-24T22:37:39,2026-04-05T08:43:54.133212,b1122cc4-fb3f-42e2-949f-4eeb63a9502c,0af97688-dd62-4193-83b4-bed7c5adcfb6
c76f44ad-5088-4097-8deb-fb075e48052a,a64c8bad-2eed-4f71-9a2c-ab6446555b42,2025-05-11T19:36:51,,"Defense still note.
Certainly behavior use discussion eat. Sea boy consumer by prepare skill institution.
Accept summer scientist fact eat. Knowledge million think upon material.
Sport simply draw.",2025-10-27T09:32:23,in progress,Response main kid senior indicate purpose. In run wait machine parent.,North Zacharyborough,2044.63,41,emergency,2451583c-74f2-4dc7-a31c-1d16ec257f7e,2025-04-26T13:18:27,2026-04-05T08:43:54.133602,3094fe68-ac71-4579-848a-05316421b8b0,65c6c7b7-0b6b-41cd-9d0f-ba0fd9de9429
9f0937fc-a362-43c6-8519-acc18d42419e,084e231e-e1f9-43f1-9eea-8501ecc87efe,2025-09-28T17:35:06,,"Season claim detail hard machine carry court. Job read order.
Kind left subject save property local not. Prove cup treatment window event among.",2026-02-01T05:55:23,in progress,Dark leave now you everyone less product. Service sport then direction generation.,Alyssaborough,2684.65,38,urgent,3b573514-9a6b-4950-8eb8-8779bad3cf3b,2025-07-19T01:35:13,2026-04-05T08:43:54.133929,111d15ca-d815-43fe-8c1a-9d0820490b62,a108eaf4-5832-4225-a22d-379c5f2dae0b
5380df30-b753-48e1-873f-5381d8f631d6,2420f3e7-c826-47ed-9895-1c516c602cfa,2026-03-23T12:50:33,,"Improve activity price simple condition. Forget although without door. Activity me strong arm focus.
History data represent traditional civil.",2026-03-28T01:40:10,completed,Director city yeah let small factor. Including country nothing cut. Beat whole image.,South Alexander,1003.67,6,routine,9781227f-2478-4bac-8545-dd175c9c55b5,2026-03-12T05:53:11,2026-04-05T08:43:54.134203,2a8379be-d125-439e-9605-fcdaee49cd37,24a6a0e4-f97e-4197-a838-c7df01c4a878
2da82120-e572-4c1f-874c-ef063613fa2c,ca790bf9-a3d5-441e-9e35-13b30dd2f3a3,2025-11-05T10:28:54,,"Consider fact artist draw maybe agreement. Feel standard certainly break condition explain happen.
Explain scientist care dream may plant.",2026-03-27T10:08:54,assigned,Around attorney leg here out. May material really consider race travel throw.,Lake Christineview,1136.66,34,urgent,7aee536d-0793-4ef7-83b1-999a1ba41050,2025-09-09T00:30:18,2026-04-05T08:43:54.134448,63001a22-4664-4594-b38c-a44a18dd4e73,0e1f20da-253f-4251-8b81-3685b9753e7b
