work_order_id,assigned_vendor,client_id,assigned_at,completed_at,description,work_order_name,estimated_start_date,estimated_end_date,current_status,comments,location,location_type,latitude,longitude,estimated_cost,estimated_duration,priority,well_id,service_type,estimated_quantity,units,is_recurring,recurrence_type,cancelled_at,cancellation_reason,created_at,updated_at,created_by,updated_by
517554a4-5bb7-452b-a54a-708343611f8b,54f29160-579c-4454-afea-3f90f630d4bd,5eaf6aac-6102-4fca-9675-c7559ae63360,2026-03-25T22:57:20.024172,,"Risk three because trouble moment center. Size life majority nice near off.
Son him bit lead art PM. Dinner task born door.
Anyone week someone tell.",WO-96058,2026-03-27T11:17:06.200606,2026-03-31T11:17:06.200606,IN_PROGRESS,Central cut around huge nothing common me. Customer total upon game education common.,West Christopherstad,ADDRESS,49.6656785,-28.469568,2576.8,"3 days, 0:00:00",LOW,6bc5135d-4a38-4cf7-baac-5977df3f81b0,086a9247-2173-4fe0-8bc7-37f146dce3b7,7.02,loads,False,,,,2026-03-25T20:50:05.180043,2026-04-15T19:08:41.295143,240ca425-cd24-45a1-8eaf-0bf4b20d6a06,b8c3c257-71ff-4e15-867a-56ab70e38bc2
9b1c1b92-7977-4e09-a389-94c01b7c1aad,54f29160-579c-4454-afea-3f90f630d4bd,22388918-384a-4cdd-b3c6-3f32ffe72d8c,2025-04-13T13:07:06.601169,,Suddenly reduce thousand should arm prepare pressure. Clear southern medical business authority black method. Also you glass kind country blue.,WO-28780,2025-04-13T19:21:26.430198,2025-04-14T19:21:26.430198,REJECTED,Animal prevent spring their year tax special provide. Early indeed others food affect.,New Marissabury,WELL,-7.8279355,33.682499,6102.54,"1 day, 0:00:00",LOW,d928f53c-1897-4872-8391-73c1d75cc721,086a9247-2173-4fe0-8bc7-37f146dce3b7,21.2,days,False,,,,2025-04-11T23:28:40.121338,2026-04-15T19:08:41.295487,d32416e5-78b6-4211-8e96-bf48ae50b0e1,0241c36b-c477-4d84-b96e-5ffbb7103e29
067a0fa1-8e25-4445-a081-777e07f5c1b0,d8cec599-00d6-4641-bcf6-6aae6d798d2b,34dcbc1a-d3ab-4c1e-ae41-74bce2f7ad66,2025-08-05T18:09:38.319754,,"Floor not hour knowledge situation indicate door. South coach along lose short pull one. Thank necessary real sense.
Down small beautiful appear relationship ten personal. Thank price technology.",WO-53349,2025-08-05T18:37:27.041265,2025-08-07T18:37:27.041265,HALTED,Name close method fall. Central include close present medical.,Karenton,WELL,-86.2938775,-177.478235,30544.85,"2 days, 0:00:00",MEDIUM,353f25dd-07d2-4d3c-9ad5-1b5e5ec00c0b,ce8f766e-041c-4139-8e39-0beb4382b441,97.53,loads,False,,,,2025-08-05T12:28:27.127387,2026-04-15T19:08:41.295846,c63acd3a-f23f-4642-a97e-062895b2f701,68cc8e1a-be4c-460d-b490-992ccbf95b19
438d275b-0ad8-4773-9a4b-38bafee2dcb1,83853f5e-c1cc-4f0c-8566-d798f4b3342e,d2644f40-d137-4f6c-9d59-d9c3afa21cd6,2025-01-15T05:00:33.272007,,Particular well character step work at blue. Rather sea chair mission that another.,WO-56121,2025-01-16T03:25:01.358842,2025-01-18T03:25:01.358842,HALTED,Few about pick my knowledge hundred those election. Blood discover home best really return.,South Ronaldburgh,ADDRESS,-22.7098895,-175.026898,30647.39,"2 days, 0:00:00",HIGH,c25feff2-39f0-475d-a753-e45c3b333990,509beb3f-897a-4f8d-9d3a-fd081e1f4600,71.86,days,True,ONE_TIME,,,2025-01-13T09:59:37.618804,2026-04-15T19:08:41.296170,42e5cdff-8ebd-4dbe-b814-ebabbf02fb49,19eaf1cf-e4f8-4575-a632-ef37adf68e51
c0bae06b-78c3-4a92-b737-afff3e6feafa,d8cec599-00d6-4641-bcf6-6aae6d798d2b,640b3bb3-f2f0-4602-8955-7a8ffabd44a7,,,"Near myself opportunity smile game off. Almost standard carry our. Interest this lose among.
Writer myself network car. According cover fast similar another summer.
Large expert activity team night.",WO-34707,2024-07-18T01:20:47.079859,2024-07-20T01:20:47.079859,UNASSIGNED,Item word performance old once. Interview skin capital arrive study free her.,Taylorfort,GPS,38.8127455,-163.468332,47951.95,"1 day, 0:00:00",HIGH,e4eee4ab-21ca-4764-ae56-974b0433a2d9,ce8f766e-041c-4139-8e39-0beb4382b441,50.85,days,True,ONE_TIME,,,2024-07-16T01:00:38.233372,2026-04-15T19:08:41.296517,573327ba-d37d-49e6-a5f0-51d3dc5e9122,f703d663-4ccf-4927-a223-c9936489fb40
03e5c35d-e05f-476f-bf7d-050d5bc2e1b7,cd79ed9d-99fc-4878-bbcb-3b3df59226f9,747ad838-966c-42f7-b322-a9a9b71b627d,,,Share community remain drug bit course would soon. Then particularly soldier case artist picture resource. Culture black though federal help.,WO-61724,2024-07-23T05:43:37.265461,2024-07-28T05:43:37.265461,UNASSIGNED,Each edge late PM style difficult.,Lake Alexis,GPS,-35.154654,-67.926929,16188.5,"1 day, 0:00:00",HIGH,fd5d5a0c-29e4-4fce-a2b8-521a4b321a7a,4e78a7e9-49e1-48b7-9800-4a1c34bc9afe,30.01,gallons,False,,,,2024-07-20T18:18:34.723928,2026-04-15T19:08:41.296843,00f9edc3-767c-45be-878d-b4d8897ffe14,d504e755-f41d-4cc3-a57b-8660652f1e16
6b6a7372-d0f9-4315-8e4d-9f91e8d0e715,d8d8da12-0220-4369-b5b0-535c355a22c7,7f893179-b166-4b75-9111-d61e648bf526,2024-10-14T19:12:25.169042,,"Cold anything loss page surface baby. Cause firm politics role color.
End since forward something bank score. Improve color election difficult music.",WO-17132,2024-10-15T13:29:08.603664,2024-10-17T13:29:08.603664,ASSIGNED,Rock now really network perhaps. As success cut physical.,East Shannon,GPS,-4.7163135,-175.973538,18413.12,"2 days, 0:00:00",HIGH,76f1198d-42ff-47c2-ac9b-367b92527b29,4e78a7e9-49e1-48b7-9800-4a1c34bc9afe,51.06,loads,False,,,,2024-10-11T21:39:28.030751,2026-04-15T19:08:41.297251,cb8717a0-7720-4a66-9b00-edca61b617da,bd8e9837-1d09-43ca-a582-54ddfa3c71b5
8d7791e8-fa27-4f05-8838-8754a61fd5a0,83853f5e-c1cc-4f0c-8566-d798f4b3342e,747ad838-966c-42f7-b322-a9a9b71b627d,2026-01-05T17:39:24.620166,2026-01-08T19:50:49.344500,Almost recently similar provide suddenly total person. Me song sign threat fight what author. Model will fear as exactly both.,WO-18432,2026-01-06T13:53:43.585288,2026-01-11T13:53:43.585288,COMPLETED,"Likely this maybe. Support soldier could society task.
Area protect let face.",Scottfort,WELL,84.153925,-164.993419,33868.2,"3 days, 0:00:00",LOW,6ee4767b-5962-4350-a930-007daf980b05,086a9247-2173-4fe0-8bc7-37f146dce3b7,60.95,loads,True,MONTHLY,,,2026-01-04T19:50:23.328057,2026-04-15T19:08:41.297604,1534fd82-bdca-448d-9495-21f54578a02d,f6ec1031-1388-47c5-84ae-bb5e986ac8dc
8c698c97-d8d4-4253-8efb-67c813226d55,d8d8da12-0220-4369-b5b0-535c355a22c7,5eaf6aac-6102-4fca-9675-c7559ae63360,2026-01-01T11:29:04.017481,,"That sport matter structure forward. None middle your itself ground chair might.
Allow exist necessary into read. Agency stuff apply process appear. Deep girl position like material page.",WO-86908,2026-01-02T17:04:25.698740,2026-01-07T17:04:25.698740,IN_PROGRESS,Let she send would with. Fine future peace cause health candidate.,Mitchellburgh,GPS,88.871232,-156.412817,43882.08,"1 day, 0:00:00",LOW,67c26f37-6a64-4887-8571-512e9e7e6bc8,ce8f766e-041c-4139-8e39-0beb4382b441,12.96,loads,True,DAILY,,,2025-12-30T09:04:47.939207,2026-04-15T19:08:41.298076,88a0dbd3-1706-48b9-a043-abd345f13feb,ea745baa-776d-425f-80a9-685b0bcd2f14
848768ae-8a21-4199-a6bc-9acc3775a53b,d8cec599-00d6-4641-bcf6-6aae6d798d2b,640b3bb3-f2f0-4602-8955-7a8ffabd44a7,,,Service lot door often product various company. Science ready result look science leg small modern.,WO-97991,2026-04-12T02:38:28.712689,2026-04-16T02:38:28.712689,UNASSIGNED,Media nature letter. Fund room off last. Culture wish team authority life.,Elliottborough,WELL,51.3989975,104.715382,7052.7,"3 days, 0:00:00",MEDIUM,e4eee4ab-21ca-4764-ae56-974b0433a2d9,ce8f766e-041c-4139-8e39-0beb4382b441,90.52,loads,True,ONE_TIME,,,2026-04-11T23:05:25.474135,2026-04-15T19:08:41.298448,a20903ec-784f-4bcc-866b-7286b78d7218,d3737094-eae6-44a2-8226-d5dfdaa87863
80f93de3-d8ff-44b1-9486-21a21fc233c7,a80bb39a-c58e-45c1-b533-bac9d8013fa0,0b969507-30c4-4933-b465-af089dff16bd,2026-03-29T15:17:25.843644,2026-04-02T07:16:22.023422,"Claim hospital national bed in goal go. Be machine quite degree form.
Beat parent a student year policy science. Order will represent reason.",WO-59872,2026-03-30T14:38:43.129627,2026-04-02T14:38:43.129627,COMPLETED,Score eye west apply resource important tell. House major call order.,Allenmouth,ADDRESS,-63.0093905,-171.484349,4150.75,"2 days, 0:00:00",MEDIUM,06c21883-e7e4-40df-ad7c-3adfdef4680f,ec85f926-f00a-4d57-8835-f1f452018492,91.16,visits,True,ONE_TIME,,,2026-03-28T21:11:53.873659,2026-04-15T19:08:41.298824,08753525-bf40-4284-860f-a046a60c35ac,0cafd494-4adc-4479-9e38-ed9a4a7d2dfc
c42f0818-3356-4479-8dc5-f9a5e83a8f41,83853f5e-c1cc-4f0c-8566-d798f4b3342e,2697e244-3ffd-4132-b5d7-a30cb0b44073,2025-07-25T19:58:37.103652,,"Course state school wear site player. Mother cell marriage. Hear director why and seat this lawyer.
Message blood production factor. Stand step enter discover note region likely.",WO-37012,2025-07-26T20:31:27.541306,2025-07-31T20:31:27.541306,IN_PROGRESS,Yourself under study study answer different drop. Determine ball operation last parent.,Moralesmouth,ADDRESS,47.244072,111.196842,44832.16,"3 days, 0:00:00",HIGH,0f4e84f3-df65-416b-a684-b98dacfe5d32,086a9247-2173-4fe0-8bc7-37f146dce3b7,37.62,visits,True,DAILY,,,2025-07-23T18:28:33.129797,2026-04-15T19:08:41.299163,64fcc88a-7cb3-4030-8b1d-dcfc1da47e70,b4c4fb49-f58d-4b34-b6b7-f36e70225cae
e7a7ecd7-451f-44c4-b7b0-8d2195e38daa,d8d8da12-0220-4369-b5b0-535c355a22c7,0b6bcfd3-35f2-4765-a6e6-645e93130da5,2025-09-14T01:54:14.603362,,"Low center data maintain improve nor. Customer course response score single. Strong green find study character.
Others election stock practice increase behind none total. Agree science single they.",WO-32525,2025-09-14T03:41:02.426241,2025-09-15T03:41:02.426241,HALTED,Knowledge indicate trip. Hotel ability card free add win.,Dawsonton,WELL,-47.2042195,-56.276846,24918.03,"1 day, 0:00:00",HIGH,b45e3f6a-2091-47b1-8e00-2392698cb981,509beb3f-897a-4f8d-9d3a-fd081e1f4600,52.25,days,False,,,,2025-09-13T19:31:14.597711,2026-04-15T19:08:41.299606,bf3f5689-35e4-40f2-ba04-83a18f336753,315b0bad-cf74-4102-8deb-12f38e47e551
c586dd06-42d6-4ce3-a532-b80d9a942b84,83853f5e-c1cc-4f0c-8566-d798f4b3342e,2697e244-3ffd-4132-b5d7-a30cb0b44073,2025-11-21T03:01:14.307052,,"Ability area affect professor value dark. Report test believe fund. Industry city us song task scientist first.
Oil industry another case.",WO-96764,2025-11-22T03:57:11.026946,2025-11-24T03:57:11.026946,IN_PROGRESS,Out scene feel man manage. Character student step law shoulder character budget provide.,Lake Patrick,WELL,16.322123,-123.471061,26197.18,"3 days, 0:00:00",HIGH,0f4e84f3-df65-416b-a684-b98dacfe5d32,d24895a1-476d-492f-9608-a5fa43530a07,32.12,loads,True,MONTHLY,,,2025-11-20T01:31:37.022089,2026-04-15T19:08:41.300033,24fd27bb-aa46-4c61-a471-531233ce0a33,452c4bb8-8070-448e-a483-9059890046ff
cf727409-c93a-4943-b073-51aab880037e,d8d8da12-0220-4369-b5b0-535c355a22c7,5eaf6aac-6102-4fca-9675-c7559ae63360,2024-07-29T01:32:34.133515,2024-07-29T20:12:37.063156,Check statement bed read mission choice seven perhaps. Return from mention enough father. But camera face evidence mother.,WO-24528,2024-07-29T07:04:07.075816,2024-07-31T07:04:07.075816,COMPLETED,Step detail executive soon remain degree before. Pay effect almost the. Manager challenge tough to.,East Jeffton,GPS,-69.6082055,53.882945,49445.88,"1 day, 0:00:00",LOW,67c26f37-6a64-4887-8571-512e9e7e6bc8,ec85f926-f00a-4d57-8835-f1f452018492,66.98,gallons,False,,,,2024-07-26T23:10:35.109359,2026-04-15T19:08:41.300426,86f4db3c-65b4-4cb7-bab7-0f14f2654413,3da1da75-bd34-4656-9750-98e728663a4c
e682c6b5-8d29-4f7b-acd9-3a8c45e0b561,a729f017-ee54-49b2-b16f-e5d33223b156,6ec74371-7536-4716-83fd-c1f11645adc2,2026-04-15T12:28:47.437898,2026-04-15T18:04:00.296035,"Whole senior worry strategy.
Color join town onto western. Performance message until minute heart real in. By instead agreement operation.",WO-57958,2026-04-15T17:45:11.408478,2026-04-20T17:45:11.408478,COMPLETED,"You number girl strategy.
Thus have project apply firm reduce threat quickly. Child since head.",West Jose,ADDRESS,84.084654,37.450643,24674.11,"1 day, 0:00:00",MEDIUM,3f7291a3-8f45-4917-a0c4-b0eeee8d60c2,ce8f766e-041c-4139-8e39-0beb4382b441,21.11,days,True,ONE_TIME,,,2026-04-15T09:31:50.906739,2026-04-15T19:08:41.300903,c75b1af1-5dd5-4603-b437-fe5910ef151b,ed0c8ac5-3b96-4c76-84eb-4d3fd740962e
fb50dc09-7392-4e09-87aa-6f03740e8169,d8d8da12-0220-4369-b5b0-535c355a22c7,0b6bcfd3-35f2-4765-a6e6-645e93130da5,2024-07-15T14:38:48.180563,,"The practice evening left morning painting. Sit near north analysis enter medical.
Case set at blood stock fear top. Window bit no.",WO-98908,2024-07-16T05:14:19.204422,2024-07-17T05:14:19.204422,ASSIGNED,Take class market letter allow head. Trip type try. Training away put writer.,Matthewchester,GPS,-53.484527,-65.155613,24916.15,"1 day, 0:00:00",LOW,b45e3f6a-2091-47b1-8e00-2392698cb981,ce8f766e-041c-4139-8e39-0beb4382b441,99.31,hours,False,,,,2024-07-12T15:42:32.759304,2026-04-15T19:08:41.301295,11500758-7483-4a3f-aac8-d7927f6c91e1,d21d37bc-2781-4983-960b-d28ad121ffdc
c93643a0-6070-4d74-ac5b-07a969306e27,83853f5e-c1cc-4f0c-8566-d798f4b3342e,88c511c2-8c1e-442c-9ed1-d5017c094726,2024-08-15T23:59:36.296053,,"Billion mind his. Response return avoid away address.
With show matter cause subject western occur grow. Race its see common because central.",WO-51737,2024-08-17T03:21:42.200135,2024-08-20T03:21:42.200135,REJECTED,Exist push you chair nation. Four game education herself.,West Vickiehaven,GPS,-89.6818555,89.365894,44667.49,"1 day, 0:00:00",MEDIUM,e9759881-cc27-4303-8adf-2a3677236513,ec85f926-f00a-4d57-8835-f1f452018492,10.94,days,True,WEEKLY,,,2024-08-15T18:59:23.917311,2026-04-15T19:08:41.301805,ff9ee2a6-3b26-45c1-993f-5058de01dfcf,77b45985-6e1a-4660-84e5-90c0b52d3177
d20a97b0-041c-4697-b7a7-3a8cdfdfa29b,a729f017-ee54-49b2-b16f-e5d33223b156,6ec74371-7536-4716-83fd-c1f11645adc2,,,Make pick physical low myself. Energy my course property. Challenge born yes teach officer up different grow. Image bank data statement when.,WO-28982,2025-10-08T09:23:49.017403,2025-10-10T09:23:49.017403,UNASSIGNED,Economy experience enter particularly meet staff lot. By best cause of attack letter season.,East Suzanne,WELL,76.0368375,-172.185009,43669.68,"1 day, 0:00:00",HIGH,3f7291a3-8f45-4917-a0c4-b0eeee8d60c2,4e78a7e9-49e1-48b7-9800-4a1c34bc9afe,20.37,visits,False,,,,2025-10-05T10:43:09.842848,2026-04-15T19:08:41.302216,0815a212-193b-48b0-a0d6-203e786981fd,3bf2310c-f066-4b03-9367-cb1586f5fe71
835150d1-ed10-4180-9b13-efa24fceed52,d8cec599-00d6-4641-bcf6-6aae6d798d2b,cb02ddbf-6d9b-4525-a9bb-805fbc0b6fc7,2025-05-27T01:51:50.520948,2025-05-29T07:31:34.923266,"Hand yes series environmental step report usually.
Manage exactly back manager sound. Piece ready require future how student ball film.",WO-67413,2025-05-27T20:08:57.741919,2025-05-28T20:08:57.741919,COMPLETED,"Shoulder a energy education every.
Modern thank society draw able. Type but process.",Port John,ADDRESS,6.335748,146.208955,21998.78,"2 days, 0:00:00",HIGH,7375b85c-b70c-48d9-9bd8-72d36f414841,ce8f766e-041c-4139-8e39-0beb4382b441,61.51,gallons,True,ONE_TIME,,,2025-05-26T03:55:54.088360,2026-04-15T19:08:41.302625,9f6931b1-76f6-427c-a3db-12e80197b036,bd2dc11d-070c-465d-ab02-46f55245d2da
a0875a61-facb-4353-9e84-bdf22b61477c,2a176a68-3d26-483d-b147-5cbd65c2dc42,0b969507-30c4-4933-b465-af089dff16bd,2024-12-06T01:07:19.972538,2024-12-08T14:21:23.485394,Lawyer account manage next contain produce. Which film herself citizen.,WO-88588,2024-12-06T22:54:16.307161,2024-12-09T22:54:16.307161,COMPLETED,Budget news hour lawyer so though born. Specific program travel relate financial economic.,North Jenniferton,GPS,-37.676562,103.325994,42114.25,"2 days, 0:00:00",HIGH,06c21883-e7e4-40df-ad7c-3adfdef4680f,ec85f926-f00a-4d57-8835-f1f452018492,49.02,visits,True,WEEKLY,,,2024-12-05T16:33:10.919164,2026-04-15T19:08:41.303015,f14f9acd-9c90-4152-9c03-9c017ca77479,53e11af8-515b-4bc3-9f88-e327c5699ee8
4ec55927-bb0b-434b-835b-94323b958bf1,cd79ed9d-99fc-4878-bbcb-3b3df59226f9,34dcbc1a-d3ab-4c1e-ae41-74bce2f7ad66,,,"Hold sign her. President son fund never else speak.
Short street fill age I throughout drug. Candidate myself tell above.
Debate live manage phone. Good around guy eight really.",WO-32972,2026-04-07T08:40:06.793366,2026-04-10T08:40:06.793366,UNASSIGNED,Month example soon hot foot appear. Crime commercial half show.,North Coreyview,GPS,84.706177,29.463803,16607.15,"3 days, 0:00:00",MEDIUM,d55c45ae-54d5-4599-8a82-1c5543fdace0,4e78a7e9-49e1-48b7-9800-4a1c34bc9afe,12.47,visits,False,,,,2026-04-05T16:26:22.818610,2026-04-15T19:08:41.303463,60dd7573-c7dd-4fb1-9bec-1d29a37743dd,cd34cb7e-b6f0-4f60-aa98-3669ddf93d6e
b2d2d10b-d570-4123-8886-5de1d048182d,a729f017-ee54-49b2-b16f-e5d33223b156,2697e244-3ffd-4132-b5d7-a30cb0b44073,2024-05-15T11:06:06.038633,,West born size collection. Toward good star from. Common economic see condition issue draw.,WO-27818,2024-05-17T09:55:11.906308,2024-05-21T09:55:11.906308,IN_PROGRESS,Foot fine movie they. Year wife matter conference need west.,Danielland,GPS,84.889329,9.104809,34517.49,"1 day, 0:00:00",MEDIUM,7e17d15e-235e-40dc-b066-f0e289eaf84d,0abebf50-39f5-4876-bdd5-2c87b12d3eb4,27.52,gallons,False,,,,2024-05-15T00:53:21.596995,2026-04-15T19:08:41.303876,4939bb5a-5a98-49d7-b57c-dd8d78c03017,8859712e-b729-4705-aef4-a4be7020a2bf
07e5750d-1a84-4e51-9e24-86ca4374bb78,83853f5e-c1cc-4f0c-8566-d798f4b3342e,d2644f40-d137-4f6c-9d59-d9c3afa21cd6,2024-11-04T16:38:18.966316,,Help movement agree reduce couple finish draw nor. Rate power ten rest include.,WO-91472,2024-11-06T05:02:08.299937,2024-11-10T05:02:08.299937,REJECTED,Nice amount bad.,Johnfurt,GPS,1.132941,-147.727058,21547.36,"2 days, 0:00:00",LOW,a49325fe-fdc1-4c26-83b2-d7e01e6d05f8,d24895a1-476d-492f-9608-a5fa43530a07,27.56,gallons,False,,,,2024-11-01T22:59:26.718288,2026-04-15T19:08:41.304207,ac923b7e-3ee6-4190-bdb0-655e77929f83,f4ec02ca-2335-4f50-a160-c737e173c65a
0ebf8c84-e8d4-4427-8399-20f60c965585,cd79ed9d-99fc-4878-bbcb-3b3df59226f9,88c511c2-8c1e-442c-9ed1-d5017c094726,2024-07-23T00:54:04.468394,,"Rise friend size value even. Together official city bar and.
Loss artist laugh offer total. Also world production mind hair learn nature. Suddenly successful feel program mind argue.",WO-05321,2024-07-23T04:49:08.781036,2024-07-28T04:49:08.781036,IN_PROGRESS,Organization action without allow community by keep. Customer sort reality foot million lot.,Lake David,WELL,16.726199,17.636761,6896.16,"3 days, 0:00:00",LOW,5ce11006-bd6f-4dc6-b623-df4f52e60dad,4e78a7e9-49e1-48b7-9800-4a1c34bc9afe,95.08,hours,True,WEEKLY,,,2024-07-21T18:22:16.281837,2026-04-15T19:08:41.304572,aef2dc01-5750-4f79-bf22-c2a4ea02612e,2b27fddc-7769-4c3a-8c45-eed067eb9423
f81f4d14-25d9-418b-a0c9-0c9b17d55188,a80bb39a-c58e-45c1-b533-bac9d8013fa0,88c511c2-8c1e-442c-9ed1-d5017c094726,2025-03-17T14:02:00.472818,,"Decade fast support manager lay middle charge. Oil own that finally her computer. Local success pull both.
East sea next news. Certainly thought shoulder here seat teacher return.",WO-00174,2025-03-18T04:13:44.696231,2025-03-19T04:13:44.696231,ASSIGNED,Mrs most car true perform. A meeting certainly baby walk. Agreement goal reason arrive nearly.,Cochranstad,ADDRESS,80.078877,-3.815071,27005.9,"1 day, 0:00:00",HIGH,e9759881-cc27-4303-8adf-2a3677236513,ec85f926-f00a-4d57-8835-f1f452018492,40.16,gallons,True,WEEKLY,,,2025-03-14T16:03:40.282511,2026-04-15T19:08:41.305024,893e5978-1355-4522-9dc9-6684eb2bf5ae,bf3f5689-35e4-40f2-ba04-83a18f336753
5926736f-d4fc-439f-abc1-c8424bc28da3,cd79ed9d-99fc-4878-bbcb-3b3df59226f9,d2644f40-d137-4f6c-9d59-d9c3afa21cd6,2025-06-23T11:07:18.022976,2025-06-26T01:01:15.464499,Follow single sing study raise stage. Research fire oil far enter its fear.,WO-88024,2025-06-24T20:32:37.201460,2025-06-25T20:32:37.201460,COMPLETED,Entire ever scientist team call environmental use. Soldier mention they.,Kimberlymouth,WELL,29.1930905,-74.485301,25324.22,"2 days, 0:00:00",LOW,a1ddb999-1546-42e3-b1e7-12ff5323b355,4e78a7e9-49e1-48b7-9800-4a1c34bc9afe,16.54,loads,True,ONE_TIME,,,2025-06-21T09:15:25.280114,2026-04-15T19:08:41.305338,f4dbe7ed-6ad2-4ce4-bad4-91940f132cd8,893e5978-1355-4522-9dc9-6684eb2bf5ae
65e9ce7f-5dae-4ce4-b90b-ec8a89eee8f2,2a176a68-3d26-483d-b147-5cbd65c2dc42,664eb1f4-0f02-4b63-aab2-9855a3767b74,2024-04-28T09:33:46.940982,,Public technology music hit. Fill represent nature support light class conference politics. Indeed car true matter class evidence paper.,WO-99695,2024-04-29T03:29:51.399447,2024-05-03T03:29:51.399447,ASSIGNED,Accept week lot production leader minute begin. Firm remain report challenge least recognize gun.,Lake Christopherberg,ADDRESS,47.3398355,-130.557842,6994.06,"3 days, 0:00:00",MEDIUM,916c93d3-0801-4ccc-989a-0d7d8dbf4e01,ec85f926-f00a-4d57-8835-f1f452018492,86.34,hours,False,,,,2024-04-27T16:48:47.927083,2026-04-15T19:08:41.305654,15f2d26c-6d66-45fe-b2d4-86c254c5ae67,705b08cc-e1a0-48a7-b998-ecde17797dec
43bbb430-eeb8-4f2b-abf8-4aebbe14da96,cd79ed9d-99fc-4878-bbcb-3b3df59226f9,747ad838-966c-42f7-b322-a9a9b71b627d,2026-04-15T03:52:35.003884,,"Summer pull political American politics. Indeed future case.
Family all talk worker none. Throw late sit computer.",WO-87048,2026-04-15T15:54:43.866887,2026-04-20T15:54:43.866887,IN_PROGRESS,Cold kind else study person season. Image bring son sign. Condition under involve.,Lake Tony,WELL,39.997821,-24.329488,10117.06,"3 days, 0:00:00",MEDIUM,fd5d5a0c-29e4-4fce-a2b8-521a4b321a7a,4e78a7e9-49e1-48b7-9800-4a1c34bc9afe,78.69,visits,True,MONTHLY,,,2026-04-15T01:59:15.862708,2026-04-15T19:08:41.306109,74ac824f-60a3-4127-ba87-0cf81cde0605,6187c455-18d0-4912-bc94-2d828da3248c
9fc44ecf-a593-42bf-a6f5-fb3bfef7795e,54f29160-579c-4454-afea-3f90f630d4bd,22388918-384a-4cdd-b3c6-3f32ffe72d8c,2025-01-28T08:13:14.270675,,"Certainly though movement help source. Where art already cultural without word. Environmental what author city a.
Bed list spend fill herself become different cup.",WO-70253,2025-01-29T02:13:42.611720,2025-02-01T02:13:42.611720,ASSIGNED,Quickly start right wind marriage. Or summer admit owner Congress whole want. No hour hair.,North Nicolemouth,ADDRESS,-52.7990255,-60.878649,19140.75,"2 days, 0:00:00",LOW,d928f53c-1897-4872-8391-73c1d75cc721,ec85f926-f00a-4d57-8835-f1f452018492,23.0,visits,False,,,,2025-01-26T20:55:37.353345,2026-04-15T19:08:41.306471,acbd888f-102f-4d02-97dd-b8621ea256dc,99521a1a-0bfa-4792-ae4a-bfe6aa27a30b
41c92817-7c2f-4853-8900-e7a12c47f507,c46d5c72-fd67-4f18-8924-a3d1249f4dfb,7f893179-b166-4b75-9111-d61e648bf526,2025-09-03T22:16:40.040349,2025-09-07T13:04:03.277940,"Consumer goal party bar there. Require move natural tree rate.
Boy environment health serve voice. Really relationship around will term long month.",WO-83038,2025-09-04T21:51:18.900069,2025-09-08T21:51:18.900069,COMPLETED,Same foot hear central. Capital western month arm. If economic true all occur add.,Brianborough,WELL,49.0184085,158.475383,36514.09,"2 days, 0:00:00",HIGH,eb7d0474-4334-4d0e-ae11-328e452d955d,cad184f7-eb41-4fb5-8d99-23e0d00e60e3,71.74,visits,False,,,,2025-09-03T14:28:48.769328,2026-04-15T19:08:41.306804,92151678-eb10-48fe-acd3-694bbc97e55a,84272e1d-92a3-44ce-9ff8-4a7257592c1b
a0d432b5-9b2d-4a03-940d-e8506c30d265,54f29160-579c-4454-afea-3f90f630d4bd,22388918-384a-4cdd-b3c6-3f32ffe72d8c,2024-09-25T02:28:10.347196,2024-09-28T22:31:53.242522,"Expert perhaps guess moment kid leave mission. Late improve exist discuss reflect finish major heart.
Age law difference like college exist film.",WO-38278,2024-09-25T23:18:48.699438,2024-09-30T23:18:48.699438,CLOSED,Indeed hold major light fear. Each however with national somebody minute statement.,South Ronaldtown,WELL,-68.32969,81.453273,16955.56,"3 days, 0:00:00",LOW,d928f53c-1897-4872-8391-73c1d75cc721,086a9247-2173-4fe0-8bc7-37f146dce3b7,10.44,gallons,False,,,,2024-09-24T05:53:51.642137,2026-04-15T19:08:41.307196,94514a2b-9e7a-49e9-a207-f4f29017485d,c594e2db-f58a-473d-ab17-1c20f1addce9
55dab5cf-35bb-48a4-b4f9-2896225bf6bf,83853f5e-c1cc-4f0c-8566-d798f4b3342e,747ad838-966c-42f7-b322-a9a9b71b627d,2026-03-26T13:40:13.312218,,"Report agency continue nice.
Tv claim article international student. Region beautiful interview shake look suffer. Share car improve others be.",WO-22217,2026-03-28T09:46:18.342952,2026-04-01T09:46:18.342952,IN_PROGRESS,Whether answer way leave need environment. Poor option ask simply environment news mission.,North Jillianshire,ADDRESS,6.0900205,-110.630543,38486.72,"2 days, 0:00:00",MEDIUM,1a5d40c8-1040-4259-8e0a-5aa64cfe10a1,ec85f926-f00a-4d57-8835-f1f452018492,31.83,loads,True,ONE_TIME,,,2026-03-24T19:25:56.396472,2026-04-15T19:08:41.307501,c5ce7a4c-eb4a-4978-b709-faa059c20555,f4484d67-349f-4088-b391-d430c9111260
88a268d9-99cb-4afa-a903-484c426912f3,cd79ed9d-99fc-4878-bbcb-3b3df59226f9,88c511c2-8c1e-442c-9ed1-d5017c094726,2025-01-27T14:53:18.943984,,"Stage ten side people room total.
Seat great institution public think surface employee. Provide machine turn they none free finish.",WO-22253,2025-01-27T23:53:29.368533,2025-01-29T23:53:29.368533,HALTED,Under boy prove buy knowledge east. Tough appear start your rock. Window member network.,North Johnside,ADDRESS,-77.2533715,111.141914,27506.64,"2 days, 0:00:00",HIGH,5ce11006-bd6f-4dc6-b623-df4f52e60dad,4e78a7e9-49e1-48b7-9800-4a1c34bc9afe,24.34,visits,False,,,,2025-01-26T10:18:52.277134,2026-04-15T19:08:41.307821,b4c4fb49-f58d-4b34-b6b7-f36e70225cae,9f6931b1-76f6-427c-a3db-12e80197b036
