id,assigned_vendor,client_id,assigned_at,completed_at,description,work_order_name,estimated_start_date,estimated_end_date,current_status,comments,location,location_type,latitude,longitude,estimated_cost,estimated_duration,priority,well_id,service_type,estimated_quantity,units,is_recurring,recurrence_type,cancelled_at,cancellation_reason,created_at,updated_at,created_by,updated_by
202ae3c0-eee6-47cf-815b-af6ebe9fea62,8d2e71e3-0422-4b11-bab4-6af9543a3839,f525d920-9583-480f-bd27-5dff2c94820f,2024-05-05T11:57:20,2024-05-10T15:53:36,Various he enjoy few decade. Movement other administration voice production pick foreign magazine. Out down product little style. Right world huge section.,WO-01561,2024-05-07T06:43:55,2024-05-11T06:43:55,COMPLETED,Suffer least no skin. Phone bank way talk ability pull new cause. Most field will strategy person.,Jonesberg,ADDRESS,-56.0576275,-141.441024,36903.74,"2 days, 0:00:00",LOW,64db6a55-8918-4153-82b2-49b26e782579,af516e74-dbad-4474-9b38-fee85f1c5f93,23.69,gallons,True,DAILY,,,2024-05-04T07:19:25,2026-04-15T18:10:30.692197,dc4d1fa0-0b0a-4941-9daa-f79bf04fd85e,89d36c8a-de7d-428e-99b8-31aa33da2097
7d32d313-212c-4d14-90f9-0ed18a84f46d,d37db5f8-d37f-49c0-b8b2-76d6a45ab850,c344b60a-1d8a-499d-bcd8-1de36d615c15,,,"Again degree bank road. State business his point physical response.
Couple energy break physical.",WO-99952,2026-04-14T19:40:54,2026-04-18T19:40:54,UNASSIGNED,Continue past seven election raise everything. Soon section investment region my.,Haleburgh,ADDRESS,39.246767,104.88875,42476.52,"2 days, 0:00:00",HIGH,8bda866a-1929-4fcc-89c8-d06690e62fcc,af516e74-dbad-4474-9b38-fee85f1c5f93,32.23,days,True,ONE_TIME,,,2026-04-11T12:01:35,2026-04-15T18:10:30.692611,b38112c6-711d-4377-9d14-0a7da5357115,cc8a8d01-075f-4430-9cc8-90bfd8d17cde
d43b4589-413f-4035-9466-10a2b9e3e128,174a76cb-9bbd-48fa-82c3-f88bcdf4c7aa,678c61ab-e0a4-40b1-af00-261f9020c2ca,2025-04-25T01:49:20,,"Two officer read administration.
West life break condition right however. Describe couple meet.
Someone compare floor price operation week life. Return wife someone crime store.",WO-56761,2025-04-26T22:13:22,2025-04-27T22:13:22,IN_PROGRESS,Half new room civil. Air add amount huge economic.,East Danabury,ADDRESS,24.557292,9.591615,24176.84,"3 days, 0:00:00",LOW,c3da1d19-9580-4a71-bccb-a3c18e8f9096,cb49e5de-7799-42e2-98e8-44fad7981926,50.75,visits,False,,,,2025-04-22T06:10:10,2026-04-15T18:10:30.693040,8ad4c495-b793-4a0a-b4b4-0d213b5bfce9,a93f53e4-41c6-4fa7-9e9d-642dcf08a7e6
e53dcb4b-f9f6-4673-af40-14524d1567c0,174a76cb-9bbd-48fa-82c3-f88bcdf4c7aa,fb7640ea-e12f-44b2-a4e1-18957b81adb3,2025-12-01T07:35:26,2025-12-05T12:05:22,"Contain line according pay. Nearly case like. Join respond majority recently.
How at person room government before remember adult. Those allow boy field Mrs eight.",WO-30342,2025-12-02T04:45:07,2025-12-05T04:45:07,CLOSED,Yet former daughter boy itself. Center what air paper that remember determine.,Smithside,ADDRESS,-12.8531815,-24.226978,33868.1,"2 days, 0:00:00",HIGH,7b14f2f2-2f53-433e-bdac-8b20cd4db741,11140ee8-eb7c-4db8-bf89-1b9b4dec4035,10.97,loads,True,ONE_TIME,,,2025-11-28T12:37:24,2026-04-15T18:10:30.693509,92c2f574-c6e6-4776-b269-93501f7f9ab7,920b13b3-ff95-4083-91c3-e70876ca5cfb
873b1dc4-e58b-4021-9854-bc26f6dc8565,58f9dbaf-1659-4d39-9ffe-a44624472704,731e4fd5-b8ef-4d21-add8-632f22763d09,2025-12-21T04:02:10,2025-12-28T21:02:03,"Forget pretty majority federal.
Store color about can benefit grow. Stand pressure who impact of relate. Room significant business student. Head recently recent card soldier need.",WO-40476,2025-12-22T04:09:35,2025-12-27T04:09:35,CLOSED,Second put other another blood break. Simply stage floor rate strong leg.,Margaretberg,GPS,-42.194095,147.036097,9603.73,"2 days, 0:00:00",LOW,054abf16-2d48-4ac2-96ae-1658db6e0fb2,9cec2b70-8268-49b0-9790-027f56d65b08,42.49,loads,False,,,,2025-12-18T22:33:37,2026-04-15T18:10:30.693914,f4686e5b-f3b3-4cd2-830b-3a4221287bd5,bd0840ad-b66c-4cc6-a948-1bf9d1721d5b
8a93e638-83a8-45fd-9f06-5429f6f71cbb,8d2e71e3-0422-4b11-bab4-6af9543a3839,678c61ab-e0a4-40b1-af00-261f9020c2ca,,,Produce hair these and say. Nor kitchen knowledge outside work because. Size writer something difference remember.,WO-21336,2026-03-29T16:17:59,2026-04-03T16:17:59,UNASSIGNED,Leg too process thank finally book. Later ok stock.,Stephanieshire,ADDRESS,-75.4534345,68.067237,36180.37,"1 day, 0:00:00",HIGH,492f99aa-15c9-4d77-9b8f-61e9ca734db1,cb49e5de-7799-42e2-98e8-44fad7981926,43.79,visits,True,ONE_TIME,,,2026-03-27T10:42:34,2026-04-15T18:10:30.694387,c867e221-72f0-4964-a808-9e0b3948d48c,a355d021-f24a-4ac1-91ac-c79883b3d690
be2bb814-6c74-495e-8589-b10efd5df7aa,8d2e71e3-0422-4b11-bab4-6af9543a3839,882b9fc4-ab62-40eb-8d69-87c3efb8debd,2026-01-08T02:32:49,,Media fire medical development public form. Author local finally statement yard quality major. Arm kitchen prove south style.,WO-03369,2026-01-09T20:13:14,2026-01-13T20:13:14,IN_PROGRESS,Behavior play local run size successful foot join. Billion child thank trade must door.,New Jennifer,GPS,-73.4331235,-38.881899,39373.98,"2 days, 0:00:00",MEDIUM,8227da16-8558-4d8d-871b-ac9431613168,cb49e5de-7799-42e2-98e8-44fad7981926,56.65,days,True,WEEKLY,,,2026-01-06T06:25:18,2026-04-15T18:10:30.694877,2fc8ee22-cb11-4b0f-b3c6-e88cff4184ca,306a4962-ddc8-4a1b-89f8-9df35ec5744e
cc0c1b85-445e-4890-a218-e3a3dde93795,faa66382-4806-43a8-8a5d-ac3393c400fd,f525d920-9583-480f-bd27-5dff2c94820f,2026-04-05T19:40:10,2026-04-09T01:27:45,"Hundred help produce standard center. Threat none contain rate change nor.
Put hundred leader painting it voice. Agency return what question common argue once. Education particularly lead out thus.",WO-05307,2026-04-05T21:47:52,2026-04-09T21:47:52,COMPLETED,Community individual tend today. This memory present know.,East Heather,ADDRESS,49.1980405,-166.152969,37357.36,"2 days, 0:00:00",MEDIUM,290acd4f-771e-45ff-9afe-7645ceadc83b,11140ee8-eb7c-4db8-bf89-1b9b4dec4035,36.67,days,True,MONTHLY,,,2026-04-05T17:05:40,2026-04-15T18:10:30.695247,fe17acb4-b1ce-4064-bb7c-a74f47d0d4af,305656c1-e84e-4f1e-9070-ca8636ccfc7c
c9a2f4a6-09ba-4313-9510-2d8bdfeea2ad,58f9dbaf-1659-4d39-9ffe-a44624472704,731e4fd5-b8ef-4d21-add8-632f22763d09,2024-06-18T17:32:47,,Network top else region hand often case. Make actually nothing stand state. Though week key reason either staff.,WO-88972,2024-06-19T05:44:12,2024-06-24T05:44:12,REJECTED,News guess work public. Bar human adult officer beat.,West Terriland,WELL,-80.6080475,126.365336,18077.9,"3 days, 0:00:00",HIGH,054abf16-2d48-4ac2-96ae-1658db6e0fb2,11140ee8-eb7c-4db8-bf89-1b9b4dec4035,49.26,visits,True,WEEKLY,,,2024-06-15T18:07:23,2026-04-15T18:10:30.695762,c67c476b-7981-4a89-a6e2-7f3f83528e17,c9bcdf5a-0fef-493f-8127-c2d3a2a56d9d
14b69ae3-5688-4a52-85be-e6d6c0df061e,8d2e71e3-0422-4b11-bab4-6af9543a3839,3b7581cb-ea6e-4a86-a15f-e6d5897da24c,2024-04-15T19:46:38,,"Many say agreement computer.
Chance professor north. Rather us director radio. Allow activity push per.",WO-94204,2024-04-17T05:55:38,2024-04-19T05:55:38,IN_PROGRESS,Exist glass responsibility kid always soldier. Behavior together could learn sit partner.,Tylerland,ADDRESS,32.8911165,-18.305954,21379.92,"3 days, 0:00:00",HIGH,4baeb96d-8da3-4b5f-82cc-cc08c13b5aac,cb49e5de-7799-42e2-98e8-44fad7981926,41.07,hours,False,,,,2024-04-15T16:02:46,2026-04-15T18:10:30.696146,f17f327d-003f-4c68-a351-da3d5a872ca2,8967424e-b041-4377-8585-a50cb8832972
50aa14be-0400-48d5-a25d-a13c5f179f34,8d2e71e3-0422-4b11-bab4-6af9543a3839,84e86518-3a3e-4445-8f1c-4328934ff3f3,2025-07-26T07:18:45,,"Fear rich might bad evening partner middle. What someone me color same. Know enter agree pay newspaper decide.
Share fish wind say body top. Reality arm red head.",WO-30734,2025-07-26T10:41:35,2025-07-29T10:41:35,HALTED,There always choose. Enter get whose manager usually across. Fast step state military this machine.,Evelynburgh,ADDRESS,-68.363012,-39.205342,13926.78,"2 days, 0:00:00",MEDIUM,d15d4e10-fb48-4ffd-871d-a6be1c1a8c60,0e86a864-3c22-4865-be33-9cbe67fc6cba,75.04,days,False,,,,2025-07-24T07:26:58,2026-04-15T18:10:30.696542,8967424e-b041-4377-8585-a50cb8832972,24a2e3b9-cc00-4d58-8cae-13bf3ad0f743
657993d1-7100-4638-b0a0-ca67ede08421,174a76cb-9bbd-48fa-82c3-f88bcdf4c7aa,04139841-be62-450b-bd98-1aa2a541894b,2025-03-15T08:03:14,,"From answer even song perform today interest. People me power lawyer year modern.
Fall forget election later far attorney. Above truth unit carry very. Indeed three about foreign own.",WO-84479,2025-03-16T17:24:18,2025-03-18T17:24:18,IN_PROGRESS,Responsibility protect imagine TV attorney growth. Sound carry car TV test artist walk.,Johnton,ADDRESS,-32.7749765,56.219242,47051.65,"3 days, 0:00:00",HIGH,64ee6292-ed9b-4a4c-908c-2264b84270db,16c270b4-3b14-467e-9cc3-879f37e9a5db,8.93,gallons,False,,,,2025-03-15T02:20:10,2026-04-15T18:10:30.696920,6193902f-b348-4ea5-8777-f71a04d9b2bc,1e5cc72b-9747-442e-bb29-be6eaf519b33
a49aa844-f689-4096-a453-850ce90aff32,9863f9e7-9e3e-4991-ae05-2fcfca5ff7d0,f525d920-9583-480f-bd27-5dff2c94820f,,,Mr player class fear. Industry technology son black personal decide. Man suggest newspaper.,WO-25212,2025-09-22T18:43:39,2025-09-26T18:43:39,UNASSIGNED,Sport music term least. Decide city admit test.,Samuelland,ADDRESS,-88.052996,38.345345,13491.39,"1 day, 0:00:00",LOW,290acd4f-771e-45ff-9afe-7645ceadc83b,1ecd42cc-80e4-426b-8a62-3e3dc4dc248a,65.83,visits,True,ONE_TIME,,,2025-09-21T17:03:28,2026-04-15T18:10:30.697313,305656c1-e84e-4f1e-9070-ca8636ccfc7c,79fb4bc6-daed-4bba-9c6a-1275647c4fd5
b78a6659-158c-49b4-bc1b-f4648cb2b570,ab06f125-03cd-4efa-b705-80a382abe9d7,ee1cb8f2-9136-4c01-915d-7a7f8d44671a,2024-09-05T15:48:15,,"Entire plan spend senior without. Lose garden interesting cover practice teach.
Popular short argue former fund ground once. Article call left seat protect. Color general under large.",WO-55468,2024-09-07T06:54:11,2024-09-09T06:54:11,IN_PROGRESS,Material direction cost condition summer who. Exist own good let.,Jamieland,ADDRESS,-55.4326215,-154.660512,2240.17,"2 days, 0:00:00",MEDIUM,cc9f124c-945f-43c4-938c-1a6e82e91ff8,9cec2b70-8268-49b0-9790-027f56d65b08,86.56,visits,True,ONE_TIME,,,2024-09-03T15:19:10,2026-04-15T18:10:30.697767,1ed2b20a-cb43-4236-a5b9-3e0e8065e6df,acd069ef-6123-4ffa-906d-b111d4788912
2c32040b-9943-4136-8a0f-649b929ed075,4efb429c-f661-47c7-8be1-26bcd85624cc,ed8cf4c2-c280-4462-92ab-89c394e00cfc,2026-03-30T07:21:19,,"Really drop war. Before service century difference green near apply. Simple away must admit bring stand deal.
For learn can pretty make. Short audience five herself part process happy.",WO-07882,2026-03-31T01:11:28,2026-04-05T01:11:28,CANCELLED,Practice benefit attack pick continue federal. Man report floor art daughter smile.,Port Garyport,ADDRESS,-13.2997,-174.842324,31736.85,"3 days, 0:00:00",HIGH,0b0bdd90-c3cd-48dd-95dc-246105ded0fe,1ecd42cc-80e4-426b-8a62-3e3dc4dc248a,44.06,days,False,,2026-04-01T01:17:33,Weather delay,2026-03-27T16:46:19,2026-04-15T18:10:30.698177,e94a3ceb-7cba-4697-a469-9ce809296682,9b26f587-fb24-4a00-955f-1a1137426d26
e77a94b7-88b6-4fe2-9839-b937ed647617,ab06f125-03cd-4efa-b705-80a382abe9d7,c344b60a-1d8a-499d-bcd8-1de36d615c15,2025-11-10T16:27:01,,"Your job face structure skill. Economy compare respond state top gun store. Government occur on article. Executive stage part.
Carry treat door child. Image beat tonight beautiful whom.",WO-76861,2025-11-11T05:02:18,2025-11-15T05:02:18,ASSIGNED,Dream standard break bring ago close beat. Maybe yes always face teacher.,North Emily,GPS,-38.4085105,-7.700171,20904.09,"1 day, 0:00:00",MEDIUM,8bda866a-1929-4fcc-89c8-d06690e62fcc,16c270b4-3b14-467e-9cc3-879f37e9a5db,2.05,days,False,,,,2025-11-08T13:18:56,2026-04-15T18:10:30.698574,1ed2b20a-cb43-4236-a5b9-3e0e8065e6df,a5a73ec0-e6f6-40ff-856f-9e8e57e8f52f
8e337548-2967-4b20-8883-1d572a5c6a10,faa66382-4806-43a8-8a5d-ac3393c400fd,691a7e30-5a38-47ce-b009-80b80a73e695,,,"Kind charge set thing. Human approach feel understand they wrong treat be.
Top begin boy media several fact fly. Born reveal site.
Evening sometimes or involve when.",WO-31603,2025-02-17T14:11:56,2025-02-21T14:11:56,UNASSIGNED,Road behavior win public with area side. With wife west service of here. Art human left add order.,Rodriguezmouth,GPS,50.368912,-175.220495,952.06,"2 days, 0:00:00",MEDIUM,30e5a01b-128e-45d4-8a36-93c45b4523fd,9cec2b70-8268-49b0-9790-027f56d65b08,60.1,hours,False,,,,2025-02-14T04:24:43,2026-04-15T18:10:30.699022,9bee316c-611c-40de-8478-f309597df492,8526be68-654f-43ff-8054-2a60bb800fd5
13276247-b75c-4920-863a-25922fe6f4ba,174a76cb-9bbd-48fa-82c3-f88bcdf4c7aa,fb7640ea-e12f-44b2-a4e1-18957b81adb3,2025-12-13T06:00:56,,Ever any inside economic. Fear such sometimes image threat. Fall think my moment cover themselves commercial.,WO-03482,2025-12-15T00:14:58,2025-12-19T00:14:58,IN_PROGRESS,Many night deal report crime there. Certainly drive admit election dog.,South Masonburgh,GPS,64.37385,57.439199,4420.88,"3 days, 0:00:00",LOW,4c5ea3ae-95c6-4aa1-bd4b-a9b6414e29b6,11140ee8-eb7c-4db8-bf89-1b9b4dec4035,52.14,days,True,WEEKLY,,,2025-12-13T04:05:29,2026-04-15T18:10:30.699501,a80a73af-85b1-49cc-8a98-4b00d28bcd8c,2c1bc234-7f2a-41db-acdd-953ace881371
e3f99df1-0cd4-4d2e-86be-f6df8ec4ec04,d37db5f8-d37f-49c0-b8b2-76d6a45ab850,ed8cf4c2-c280-4462-92ab-89c394e00cfc,2025-04-24T22:15:14,,"Group few mention book simply. Son have condition both find.
Through authority much brother film true. There away might coach security.
Game remember especially will travel compare.",WO-30119,2025-04-25T00:58:16,2025-04-29T00:58:16,HALTED,Foot quickly late woman one else sit painting. Image try guess myself.,Jacobfort,WELL,34.392476,-161.786037,7262.89,"1 day, 0:00:00",HIGH,b6f7a498-7647-4673-8d48-e9417fcf3625,af516e74-dbad-4474-9b38-fee85f1c5f93,46.08,visits,True,DAILY,,,2025-04-23T17:09:12,2026-04-15T18:10:30.699921,f6483901-e02a-45c0-b300-1f0fbba0fdb2,3c151245-5f81-4dd1-8a0b-25a278350056
a21d9491-818b-4179-9d3c-2fc7e205bf4f,4efb429c-f661-47c7-8be1-26bcd85624cc,882b9fc4-ab62-40eb-8d69-87c3efb8debd,2024-04-29T11:41:57,,"Up former produce friend report figure Congress. Effort party hit office family structure.
Suddenly candidate garden matter whose born. Possible land even leave. Recent five contain fine brother.",WO-76130,2024-04-30T18:16:50,2024-05-01T18:16:50,IN_PROGRESS,Feeling example recognize table community relationship PM. Finish go change you spend.,Lake Jessica,ADDRESS,-72.6189925,101.688587,48630.46,"2 days, 0:00:00",MEDIUM,4a809846-2f41-46d2-aa73-bf4f8fcd89a7,1ecd42cc-80e4-426b-8a62-3e3dc4dc248a,13.38,visits,True,DAILY,,,2024-04-27T09:22:49,2026-04-15T18:10:30.700321,33b016a2-3b2a-4dd9-9c3c-4eed80a66a87,1172fe1a-72ef-4dde-bb56-74cdba00f9b2
20825574-4b78-4fa4-8884-dd599a36bf55,faa66382-4806-43a8-8a5d-ac3393c400fd,3b7581cb-ea6e-4a86-a15f-e6d5897da24c,2026-04-15T17:53:07,,Everyone usually very maintain officer break indicate away. Election high power whose yourself task. Art office guy field rule.,WO-87700,2026-04-15T17:54:23,2026-04-19T17:54:23,ASSIGNED,Yeah stock position guess as film serious. Card board response stop country year line.,Williamberg,GPS,26.8215095,83.983666,49899.19,"2 days, 0:00:00",HIGH,5684198a-4b2a-4e80-9ffd-dd2cf24f24fd,11140ee8-eb7c-4db8-bf89-1b9b4dec4035,79.35,loads,False,,,,2026-04-15T15:45:08,2026-04-15T18:10:30.700638,29d52da1-c34c-40a7-bfaf-700fa54a93f6,954fa0d8-97af-4dd0-aaa4-4ecbdef76d00
19735236-4cae-4e6c-8f63-5daafe4775f3,4efb429c-f661-47c7-8be1-26bcd85624cc,75a0afd8-df78-48b9-ae6b-7116f2e24eba,2025-10-29T09:52:45,,"Past girl system sometimes. Speech house kid interview house. Bed our civil bill young.
Live glass teacher southern create free car. Article join conference particularly.",WO-90740,2025-10-31T01:15:39,2025-11-01T01:15:39,CANCELLED,Response station safe research apply. Realize fine pressure economy to daughter knowledge.,West Stevenmouth,GPS,-62.880598,138.064771,44837.1,"2 days, 0:00:00",MEDIUM,da2d2770-54fc-4f45-8515-549a3178bc70,1ecd42cc-80e4-426b-8a62-3e3dc4dc248a,83.0,hours,True,DAILY,2025-10-30T17:56:16,Safety concern,2025-10-28T11:42:31,2026-04-15T18:10:30.701036,7fa2669f-d5bf-4c35-8868-dc5ad1797edb,454a2fa8-ac03-4e75-abf1-5e4fc9b85139
58b7c6aa-675c-4634-96bd-81895211f3ca,174a76cb-9bbd-48fa-82c3-f88bcdf4c7aa,493992a7-7782-4721-b60e-c640d5d32c7e,2025-05-29T12:39:41,2025-06-04T06:36:04,Local inside probably music. History hard relationship film road reality benefit majority. Social less protect itself air deal certainly.,WO-33150,2025-05-31T11:23:23,2025-06-02T11:23:23,CLOSED,Behind member serious station. White something single race road campaign.,Lucasbury,ADDRESS,-10.096339,85.328204,23311.31,"1 day, 0:00:00",HIGH,31e420c7-9b20-404f-8d61-1638dfa5c155,11140ee8-eb7c-4db8-bf89-1b9b4dec4035,66.93,gallons,True,DAILY,,,2025-05-27T02:20:18,2026-04-15T18:10:30.701876,5da395e1-3486-4970-a3ac-2f4601a0aae6,c56be500-b5d8-41fa-b299-9af4bfacba21
3f031eaf-0dec-4452-9e41-1e6f95824ffc,d37db5f8-d37f-49c0-b8b2-76d6a45ab850,ed8cf4c2-c280-4462-92ab-89c394e00cfc,2026-04-07T10:57:24,,"Officer mother east nice group past three. Discuss friend financial.
Collection billion good service drop quality. Day quality increase others either. True eye cut none fly season.",WO-63256,2026-04-07T17:46:26,2026-04-12T17:46:26,IN_PROGRESS,Debate teach child finally under language.,West Michaelfort,ADDRESS,-23.716627,-34.024716,24320.86,"2 days, 0:00:00",LOW,b6f7a498-7647-4673-8d48-e9417fcf3625,af516e74-dbad-4474-9b38-fee85f1c5f93,36.68,hours,True,WEEKLY,,,2026-04-06T00:39:26,2026-04-15T18:10:30.702353,23ae6dda-4cdc-44f5-9824-c00d9c84e150,1c5bf441-cba3-4f46-8b9a-e06ad17e45b4
46d6178c-242b-42d6-a33c-9a471679ec56,ab06f125-03cd-4efa-b705-80a382abe9d7,c47f7a97-07de-45fc-b329-df9d514c1dd8,2025-03-07T15:08:34,,"Trial society read why much. Think season skill war for may occur.
Join truth because course my thus. Kind order two music door knowledge early. Great paper idea five Democrat.",WO-64692,2025-03-09T08:59:14,2025-03-10T08:59:14,REJECTED,"Fear themselves group more organization. You cost bill green.
Mean as miss and form.",South Christopherburgh,WELL,-58.917227,1.478054,29442.49,"2 days, 0:00:00",LOW,4f1798a5-ccfc-4a39-afe5-4e0f34bcc4b1,1ecd42cc-80e4-426b-8a62-3e3dc4dc248a,1.88,hours,False,,,,2025-03-06T07:26:36,2026-04-15T18:10:30.702770,2de3fff2-1d7c-4572-8183-86e714bf95e6,7fba2b75-a5ea-4bb9-a4ed-4f44791dcd21
98b649ed-f4c0-47ec-a756-41506dd6de00,cddd5f7c-18e5-439d-b906-a347d43c668d,b43e3365-5df9-4195-a65d-d09d87c032b0,2024-05-22T15:48:55,,Recognize without necessary impact me unit. Point total and skin. But miss develop describe capital.,WO-57181,2024-05-23T09:07:37,2024-05-25T09:07:37,ASSIGNED,Make treatment big. Base while detail spend avoid crime. Good which among the teacher space among.,Paulmouth,WELL,-21.5793945,110.394175,5024.38,"3 days, 0:00:00",MEDIUM,254ea4de-f7cc-422e-86bb-4db3d83aaee0,9cec2b70-8268-49b0-9790-027f56d65b08,93.15,hours,False,,,,2024-05-19T16:05:20,2026-04-15T18:10:30.703328,60260623-b284-4bdb-aeab-3539de227aa7,31c5c209-d2b2-42c5-afa7-83755df5b9eb
705eb2a6-abc6-4305-a215-f57d0c66eed0,ab06f125-03cd-4efa-b705-80a382abe9d7,fb7640ea-e12f-44b2-a4e1-18957b81adb3,2024-04-21T19:40:32,,"Real to word toward. Result power true yes.
Wall investment make behavior body never. Story as bank. Project capital property population. Themselves pass participant develop arrive.",WO-96196,2024-04-23T00:45:39,2024-04-27T00:45:39,IN_PROGRESS,Whom grow gas. Assume senior successful society. Million if ever.,Anthonyfurt,WELL,-86.898264,137.088072,49092.95,"3 days, 0:00:00",MEDIUM,06b16a44-2c0b-4ec7-83a5-ee6c79d05263,16c270b4-3b14-467e-9cc3-879f37e9a5db,80.75,visits,False,,,,2024-04-20T15:22:28,2026-04-15T18:10:30.703747,36c0a4cc-f2c5-4a36-a9dd-3d6595e24690,be398cae-ca14-492a-8c3e-15f86de8590a
3c86ee29-26a7-411e-8c07-9f6307671c8f,faa66382-4806-43a8-8a5d-ac3393c400fd,66d9ecee-f243-482d-98d8-69b8b0179d6b,2025-09-27T23:49:03,,Including capital war. Future it newspaper range point. Number American election part ever figure.,WO-68590,2025-09-29T00:01:24,2025-09-30T00:01:24,HALTED,Can southern whatever be serve hit. Human account couple others camera space hundred.,West Edward,GPS,14.7645395,-161.828805,28171.73,"3 days, 0:00:00",HIGH,c939336d-7723-43ae-9052-08348184324c,9cec2b70-8268-49b0-9790-027f56d65b08,49.52,days,False,,,,2025-09-25T12:43:19,2026-04-15T18:10:30.704127,dfaaaefc-199c-464e-8928-1b97075f726b,48b43c14-9dc3-4ac1-ae15-3c91de311a75
06406245-11a8-4b70-a6da-87097435628f,ab06f125-03cd-4efa-b705-80a382abe9d7,c344b60a-1d8a-499d-bcd8-1de36d615c15,2024-04-17T09:24:42,,Final hospital artist conference gun support fund change. Growth rule direction current because rest middle he. Admit partner stop discover professional drug.,WO-14087,2024-04-18T08:47:17,2024-04-19T08:47:17,IN_PROGRESS,Term indicate short feel mission mouth. See yeah station chance financial.,New Suzanne,ADDRESS,-47.362294,-176.17998,15135.8,"2 days, 0:00:00",HIGH,8bda866a-1929-4fcc-89c8-d06690e62fcc,af516e74-dbad-4474-9b38-fee85f1c5f93,37.34,hours,True,MONTHLY,,,2024-04-15T19:28:26,2026-04-15T18:10:30.704585,1300191e-48fb-4dd4-bf98-cf116587a4bb,ad4cd319-5146-4b76-8922-d92523555779
4e7f6c48-0013-488d-bba7-2c6659b4d3d3,d37db5f8-d37f-49c0-b8b2-76d6a45ab850,84e86518-3a3e-4445-8f1c-4328934ff3f3,2024-11-06T02:45:02,,"Here her analysis campaign national manager. Religious still land reveal can personal. Debate range start respond hope growth.
He seek carry campaign. Lose far together.",WO-45744,2024-11-07T07:38:17,2024-11-12T07:38:17,REJECTED,Attorney somebody sure benefit business. Dinner stand thought size usually clearly.,North Michael,WELL,68.5818515,-97.619097,36189.68,"3 days, 0:00:00",HIGH,26674d61-d034-4f7e-8a6f-7303b6c6ec24,af516e74-dbad-4474-9b38-fee85f1c5f93,82.09,gallons,False,,,,2024-11-04T18:36:37,2026-04-15T18:10:30.704970,a587d530-98fc-470c-bc73-476c54fefc64,6ccfafe4-5a4d-4253-b408-a93036cb468e
39c56e11-4606-4fd0-a374-0fe8cf09f9df,174a76cb-9bbd-48fa-82c3-f88bcdf4c7aa,678c61ab-e0a4-40b1-af00-261f9020c2ca,2025-05-09T19:31:10,,"Join truth middle make eye test weight. Democrat civil control that focus.
Upon keep face. Rate wonder rule there there. Despite how leg least rich many according.
Idea in your several I.",WO-82193,2025-05-10T14:05:50,2025-05-11T14:05:50,REJECTED,Tend Mr lose so several card. Remain democratic deal sure trade. Popular your issue coach set too.,Howardtown,WELL,14.367337,-53.814419,41842.07,"1 day, 0:00:00",LOW,c3da1d19-9580-4a71-bccb-a3c18e8f9096,cb49e5de-7799-42e2-98e8-44fad7981926,87.48,gallons,True,ONE_TIME,,,2025-05-07T23:19:08,2026-04-15T18:10:30.705384,390eb692-63ab-43a8-a156-6755e0b357bb,87798497-b3e6-45c6-af9a-b0758d559e16
b0b5e43e-558a-4ddb-bdcc-472ae69e95b4,cddd5f7c-18e5-439d-b906-a347d43c668d,fb7640ea-e12f-44b2-a4e1-18957b81adb3,2025-04-15T05:28:22,,"Next rise different heavy personal.
Bar improve full glass. Scene star southern report of election. Performance matter senior TV.",WO-41749,2025-04-15T11:54:21,2025-04-19T11:54:21,CANCELLED,Get similar yet age natural name fear it. Talk court part actually specific support boy.,Kyletown,ADDRESS,-7.37082,-28.033934,2929.74,"1 day, 0:00:00",HIGH,4c5ea3ae-95c6-4aa1-bd4b-a9b6414e29b6,9cec2b70-8268-49b0-9790-027f56d65b08,72.07,hours,False,,2025-04-16T15:58:36,Safety concern,2025-04-13T12:53:22,2026-04-15T18:10:30.705811,7f6d4c1f-af22-4c1a-9f8f-d5ac34898d36,9dc1c08c-269c-4a83-956f-a2e20608b85a
3ba739d8-5a10-4651-b358-79ea93969a21,9863f9e7-9e3e-4991-ae05-2fcfca5ff7d0,c47f7a97-07de-45fc-b329-df9d514c1dd8,2024-09-07T00:34:54,,Material choose avoid year page. Able risk week best. Since traditional economic least paper find.,WO-24597,2024-09-07T15:03:30,2024-09-11T15:03:30,ASSIGNED,Gun radio peace church theory level. Break friend question benefit.,Gonzalezstad,ADDRESS,44.4739415,23.206837,28121.98,"2 days, 0:00:00",MEDIUM,4f1798a5-ccfc-4a39-afe5-4e0f34bcc4b1,1ecd42cc-80e4-426b-8a62-3e3dc4dc248a,79.63,hours,True,WEEKLY,,,2024-09-04T18:00:48,2026-04-15T18:10:30.706236,7b3f2523-5bd6-41e2-b34d-408a0803003b,34fecc21-92d7-4b88-b4f0-4d0d21495160
44fd8657-e0fd-474d-832d-6cb696ad0b16,8d2e71e3-0422-4b11-bab4-6af9543a3839,161a2cf7-5893-41ae-b4c4-d338e37dc1c5,2025-04-24T19:49:22,,We trouble year improve even. Anything him character how manage interest soon.,WO-53772,2025-04-26T14:52:11,2025-04-28T14:52:11,ASSIGNED,Guess discover mouth place it dark. Under level positive entire work.,South Lindaville,ADDRESS,70.0746365,-3.961144,36396.01,"3 days, 0:00:00",MEDIUM,f0a84ddc-1697-4069-bd4e-89f946cadd32,1ecd42cc-80e4-426b-8a62-3e3dc4dc248a,19.76,days,True,ONE_TIME,,,2025-04-22T05:03:16,2026-04-15T18:10:30.706689,4a761b69-7632-45b2-80ea-1ba1397a7a96,ed54a112-aa22-4d08-947f-a65a405c25f6
f3454885-bbda-4979-971d-bfc978bd4e8d,646727fe-d9d3-47f4-abd3-a0bbe4e4c1bc,f525d920-9583-480f-bd27-5dff2c94820f,2024-07-14T18:39:01,,Thing little plant dark cultural door strong interview. Edge threat language pretty especially.,WO-12923,2024-07-15T16:25:29,2024-07-16T16:25:29,CANCELLED,Television now camera man. Hair popular minute father public. Training eat in may across.,East Jonathanstad,GPS,34.1353295,-65.610672,35276.25,"2 days, 0:00:00",LOW,64db6a55-8918-4153-82b2-49b26e782579,723a7696-0101-49f1-9967-329b83246c8a,17.51,gallons,False,,2024-07-16T08:21:05,Safety concern,2024-07-13T14:07:29,2026-04-15T18:10:30.707140,b11e5cb9-6681-4ba1-804f-69b2f160a9d2,e4328302-a52e-4c5a-b212-d6f86b62a55a
418f2de7-e422-4cce-a4b6-08e8aa0d6270,d37db5f8-d37f-49c0-b8b2-76d6a45ab850,84e86518-3a3e-4445-8f1c-4328934ff3f3,2025-03-20T07:26:21,2025-03-25T07:28:26,Test there per. Continue around act brother later than media.,WO-52699,2025-03-21T07:21:51,2025-03-24T07:21:51,CLOSED,Sea city street power.,Port Michaelton,GPS,-41.681468,68.523562,42320.27,"2 days, 0:00:00",HIGH,26674d61-d034-4f7e-8a6f-7303b6c6ec24,af516e74-dbad-4474-9b38-fee85f1c5f93,43.63,loads,False,,,,2025-03-17T11:44:27,2026-04-15T18:10:30.707517,d24becdc-8819-4f28-86b6-109a12f74bda,3b9c648f-65c3-4e27-9c63-820b875b71d1
