work_order_id,assigned_vendor,assigned_at,completed_at,description,due_date,current_status,comments,location,estimated_cost,estimated_duration,priority,well_id,created_at,updated_at,created_by,updated_by
4611f406-d484-4374-9fbf-554a5705fbf7,9469901e-742d-4522-9bba-d1217399375e,2025-05-12T08:44:47,,"Tax its movie image report source we find.
Ago even meet country. Account bed leader.
Modern plant able morning someone. Feel keep read director performance after letter. Song read section sell.",2025-09-28T09:31:17,in progress,Quality raise material dog bit. Him energy education choose.,Michaelburgh,5563.57,45,routine,9774c0b5-6317-4794-bf97-42efa48f1dce,2025-05-02T13:04:46,2026-04-07T10:18:07.782823,9290575e-4763-4fdc-9af6-f0802ddf524d,747bcda2-5e97-4d31-bcbd-c20245b8dc7a
9d49c691-68ab-46f2-b32c-9c35e43dfcda,38939c64-27d8-477b-adbf-3eb952a9ff97,2026-01-10T07:00:28,,Phone water stuff catch. Himself level teach. Eight process her institution executive mean.,2025-05-29T20:44:09,assigned,Reveal parent commercial woman place new wonder. Out heart increase chance author.,West Robert,2666.61,70,routine,0bfb698e-0d8e-4ba6-9f17-7ac0a4ca2180,2025-04-11T22:32:24,2026-04-07T10:18:07.782999,712b72b3-aca1-4acd-84c0-2036a8b53c4b,c3c3b5a5-638b-467e-91a2-3c127f5a6413
18ef6872-498c-45de-ae21-3b789021f409,38939c64-27d8-477b-adbf-3eb952a9ff97,2026-03-31T05:50:34,,Gun stuff check under civil prevent option late. Card resource society garden rather west. Put much buy successful speech none memory.,2026-03-30T03:50:20,in progress,"Station figure sometimes Congress.
Over personal send generation. Out find long pressure.",Martinezton,2547.1,23,emergency,600ff490-cf6d-4fb9-97a2-f24a0457b52d,2025-10-10T23:02:39,2026-04-07T10:18:07.783290,ae4df723-47a3-4efb-aca1-96cbd008a6bd,036cf1a0-e79a-4b93-beb8-b88b76911887
64332e97-6537-4217-bff8-8314a7daf500,159610a4-4b4f-4948-abd0-c010992f70a8,2026-01-06T05:57:04,,"Range at travel scene away hold. Treat result theory popular meeting he successful. Follow kid near without matter entire general especially.
Under something suffer fly.",2026-02-16T16:29:02,in progress,One too word consider. Necessary difference paper such memory prove us. Practice upon voice piece.,Port Jimmy,182.68,67,routine,186200fb-53e0-4a56-baf0-cafe6b69edb3,2025-09-24T14:15:52,2026-04-07T10:18:07.783463,789f2a28-fb91-4b9b-99ae-2d8d17e3795a,c02473af-35e8-4f3a-b1dc-24f1fa429752
f0e85ff3-be65-46be-842e-bb4721ea45ee,4195973a-1e8f-47c7-af89-4b7e5e46de81,2026-03-27T05:32:13,,"Than reality present save paper spring him. New information human baby space full reduce.
Area option serve staff. Certain north must concern assume.",2025-07-01T22:10:24,completed,Congress think it point though player friend area.,West Donnaberg,7101.98,30,routine,b7bdc965-f9b1-45f8-b871-cfeb9e7c797b,2025-06-14T06:29:28,2026-04-07T10:18:07.783593,ebcacddf-e96d-4b74-bfe0-f2aa5d143806,a27031cb-8d05-467b-9daf-adb2ff295939
c13bd037-123e-49e6-b512-b51ec1769dfd,ca08ace8-52c5-4d85-8659-6c4ca8d07a0c,2026-03-05T22:21:59,,"Red in police relate door bar. Father culture by board. They another likely.
Tend at go only. Or value course agent study. Rise effect baby.",2025-12-07T03:35:36,assigned,Along citizen itself week effort tell organization last. Party newspaper while show wonder.,Williamsstad,8101.77,64,emergency,1fab7158-54bc-4774-afef-3c6f0c7b6c1e,2025-10-12T05:51:32,2026-04-07T10:18:07.783826,d64b0822-8d51-4d49-89a4-783b32d361f1,1a1a12df-33a5-411b-af33-e247308e13e6
3fb9dd21-4290-4a5c-a0ed-a082d794d508,d5f6ba26-1832-4314-a2fd-f9b60850c485,2026-03-04T05:00:12,,Win bar eat next mouth production. Able few never stage generation thus everyone. Population beat week camera candidate while.,2026-01-17T10:35:47,in progress,Executive give child music cost true test plant. Five hour although budget.,New Tasha,4188.03,6,emergency,1d29b680-7148-45d8-8082-e64384b3fcc2,2025-12-26T21:27:22,2026-04-07T10:18:07.783979,dbe685ff-199f-4be3-88a4-69f81bec126a,2f108704-64da-46e4-9836-b924edb97123
0ed653be-8b3f-47d4-b3aa-354259e466d6,ec609920-5b8b-4710-99cf-185d2b003772,2026-02-23T20:12:57,,Rise top both special site such it. Better player choose gas bed create. Off environment hour sea source.,2026-03-24T08:25:33,assigned,Player want Mr itself government free cell poor. Lawyer check it technology about way.,Maryville,817.2,53,emergency,b7bdc965-f9b1-45f8-b871-cfeb9e7c797b,2025-12-13T11:55:22,2026-04-07T10:18:07.784120,5a34f956-2462-4873-8f8b-baacf798396e,b28016a9-b8f3-4adc-b95e-78c4fea3323b
742f9e19-1b3a-4732-972d-5e193ae23344,00ce0e5d-dabe-447d-8247-cec72142417d,2026-03-02T14:24:47,,"Character hard member modern. Camera garden result official religious.
Food speak ready set accept throw quickly. Every current change either enough feel current.",2026-03-27T01:13:12,unassigned,Major admit any prove. Rather police color to week level.,Clarkebury,2725.38,27,emergency,d47bdfe5-723b-4d3c-a04f-5d09ab41a81b,2026-02-06T18:31:03,2026-04-07T10:18:07.784284,3634d377-b75a-4790-9e4f-a6abccb9ee91,57a414d9-67ab-484a-9732-2547ff11bf39
c63bba2c-a91b-47f8-9ec1-7ab5eeda0f9c,f9923c46-a9a0-4f7d-95b8-8b0238e212f8,2026-04-01T17:49:33,,"Want senior court leader cup as.
Poor notice this expect term wife debate. Property crime million. Party too understand.",2026-04-08T02:09:32,completed,Its him politics public.,New Stevenhaven,4182.94,53,urgent,2fc55cb8-ba54-4615-84aa-f727953c1a26,2026-03-08T23:09:29,2026-04-07T10:18:07.784430,0529cdfd-65e3-4259-b822-65f01df12a58,0dc81666-cb3d-4c8e-81e8-ecadb95d0de6
38a00819-acdd-4085-b433-2b3df17c8a52,9469901e-742d-4522-9bba-d1217399375e,2026-02-14T22:52:53,,Street long process develop else without concern. Week western toward indicate office. City successful though Mr serve site.,2026-02-22T15:30:55,assigned,Place push force compare direction side now. Purpose argue send hair woman contain.,Williamfurt,236.05,72,routine,69cefa9a-d560-4a17-a13d-a5652e00e8a1,2026-02-11T17:06:31,2026-04-07T10:18:07.784578,e237d37b-dbe6-4ac8-8fa5-358cddfe59a7,b9c94cfc-dec0-48ab-8b6e-68691e59b38b
77e12ede-593a-4ad5-bc8e-cd0dfdf5c74e,3e45d3ec-4483-4235-88c0-8042057d7cff,2026-03-30T01:52:48,,Respond reason behind west although turn. Peace enough two. Prepare clearly other color. Everybody with watch evening.,2025-10-17T13:04:52,unassigned,Many evening off. To heavy analysis young can natural tough try.,North Jessicashire,2480.47,60,routine,fe66602b-ecb2-4bfa-884b-3b40b05f0302,2025-10-03T00:13:46,2026-04-07T10:18:07.784722,48d7f07b-f503-49da-a9a0-7b21aa127cd9,4c5903f5-be4e-417e-8f40-80e93be3fbe7
1aeacedd-6639-400d-a945-a806646234b3,38939c64-27d8-477b-adbf-3eb952a9ff97,2026-03-23T23:41:08,,"Someone spend rest hold price. Blood computer else group.
Daughter your former great good bill agent. Bring another treatment firm available.",2025-10-22T16:11:34,in progress,Your by scene music. Star some lead.,North Kimberly,732.39,71,urgent,8c2e0996-ae50-4c15-bc25-3b3b3a95896c,2025-05-30T13:53:07,2026-04-07T10:18:07.784885,76687cae-1f55-42c2-a94e-12441a4e9320,894513df-6c4b-4458-9020-58a1fa3b9c3d
f6aebdd3-bff6-4f2f-a8f6-9b0dc1b4738a,ca08ace8-52c5-4d85-8659-6c4ca8d07a0c,2026-03-23T00:23:10,,Table suffer family new clearly response. Doctor PM whose scientist without miss.,2026-02-28T07:05:25,completed,Voice detail work capital pull mother science.,West Jocelynside,535.43,56,routine,6edce5fb-6eb5-4d55-bfd0-c35755c6e9cc,2026-01-16T08:40:24,2026-04-07T10:18:07.785040,48f2faef-aab1-43d3-8593-e5209eaedfb8,59b7b211-c90a-416d-a957-f98d937f77b2
be289c05-9a93-49f6-a043-05441253004d,d5f6ba26-1832-4314-a2fd-f9b60850c485,2026-01-12T15:48:18,,"Know population mean country. Attorney travel throughout seek most goal.
Door she office watch. Institution teach traditional fire argue through spend different.",2025-12-15T15:34:32,unassigned,Firm field military read should east. Magazine compare fight everything number front.,South Henry,2334.84,61,emergency,05cf787c-49ff-4d04-b65a-b5fe04cba979,2025-11-27T19:26:13,2026-04-07T10:18:07.785207,c30b25d8-9e11-426d-99dc-5d69f4d50ba7,73b4bd4b-4a69-4a24-9f6b-15be44c6a68c
280db20e-2298-4204-a303-c43975068dbc,ca08ace8-52c5-4d85-8659-6c4ca8d07a0c,2026-03-21T01:35:05,,"Big section traditional music apply toward. Heavy get here voice. Act nation another business.
Off born reveal professional according. Blood quality imagine social. Design west effect buy trade man.",2026-01-24T11:06:34,in progress,Present since but arrive front he. Lawyer add radio.,Grantberg,165.43,23,emergency,9774c0b5-6317-4794-bf97-42efa48f1dce,2026-01-11T17:06:59,2026-04-07T10:18:07.785376,0d750d49-0177-4e02-84aa-b6c3f2410b4b,04f4f235-3a2f-4d35-92dc-ba500edb2430
648b85a4-9672-4baa-aca7-70ff625eebf8,38939c64-27d8-477b-adbf-3eb952a9ff97,2026-04-05T06:25:01,,"Never drop trip standard cut think cut approach. Financial great sell imagine leave between.
Memory agent far person evidence offer rule. Total campaign energy. Same thought member story election.",2026-04-13T19:06:12,completed,School way citizen particular indicate system. Consumer case today only.,Timothyfurt,5422.38,70,routine,8e2c1c85-0fc3-40ad-b842-0237c0f9b2be,2026-03-28T18:22:15,2026-04-07T10:18:07.785538,93e9766c-f5c9-4b3c-9439-6ceb44e10eb2,246ef666-ed40-4085-b665-d4d2b92d18c0
87c91d2b-180c-4883-a20b-587731c4bef6,f9923c46-a9a0-4f7d-95b8-8b0238e212f8,2025-12-30T08:17:28,,"Whatever couple upon budget learn state. Police tend guy as people say. Card example two night.
Blue difficult often mind quality. Under whatever ago money property could majority.",2026-04-11T21:15:38,unassigned,Fish business himself public. Stage room economy industry everything guess anyone.,Rodriguezton,1123.86,70,routine,37a9df9a-0c80-4672-a86c-4467822d2688,2025-07-10T05:03:38,2026-04-07T10:18:07.785712,91b03854-6156-4efb-b02d-145c745acbc7,e829aba1-48b0-4b9b-93a4-bbd03b5e5030
a48383d5-fb69-4642-8de2-c1ba4ed189e6,38939c64-27d8-477b-adbf-3eb952a9ff97,2025-08-29T11:52:15,,"Interview take may away. Interesting break class prevent develop task three.
Shake eat hot too. Camera lot add bed now agreement. Available situation decision offer worry two bit because.",2026-01-19T11:12:19,assigned,Discover so effort couple. Value several follow happen say if boy. Place poor person word bag.,Patrickville,4632.8,16,urgent,0bfb698e-0d8e-4ba6-9f17-7ac0a4ca2180,2025-08-19T18:54:40,2026-04-07T10:18:07.785944,29ffe999-4042-41bd-8ffc-d2ec9097eb46,ff884f11-f841-4d9a-98b8-799f2c476f89
7f7fc7fc-b077-4b4d-a10c-68949741d833,38939c64-27d8-477b-adbf-3eb952a9ff97,2026-01-17T01:32:35,,Agency among president onto none set off. Fact final family debate save plan. Factor somebody despite card international occur.,2025-12-21T08:15:00,assigned,Especially case tonight economic between thing anything ground. Total others thank husband.,Garyland,7235.73,10,routine,8c2e0996-ae50-4c15-bc25-3b3b3a95896c,2025-12-14T04:57:48,2026-04-07T10:18:07.786096,defc8965-3a44-4586-80e4-aeb8cbd34e7e,ee5c2b1e-385c-45b5-b17c-d5193eeff685
5aead00e-351f-4776-89b1-bdf8f5928824,3e45d3ec-4483-4235-88c0-8042057d7cff,2025-04-23T20:38:59,,Machine both idea least difference evidence. Population continue town always because. Represent case center today reduce modern. Coach list court ready deep beyond provide.,2025-11-18T23:25:42,in progress,Yard series use until toward least. Cell late young leave.,North Barbara,2553.56,44,emergency,93215096-0b30-4bd1-8932-efa7bf5e7fd3,2025-04-19T03:07:34,2026-04-07T10:18:07.786255,19ddf84b-2d12-4835-9b73-05cc1b0e0848,bdd47adb-e081-4a21-9455-5b069df1fa15
8bfcdad1-6bf8-4923-93cb-e13fcb5af2b5,f9923c46-a9a0-4f7d-95b8-8b0238e212f8,2025-12-10T17:46:55,,Stock front catch per. Plant name least program far. Bit range left feel room. Might big follow likely community.,2025-08-11T21:33:42,completed,Operation price wife law itself. Institution move garden.,Lake Danielle,3478.48,49,routine,6c483a54-0e49-4e56-b143-f6e53094418e,2025-07-03T03:17:49,2026-04-07T10:18:07.786406,fa9bb202-c85c-4c02-bebc-f252a88c56d4,36dc4eeb-97c0-4a0c-9b0b-8a818bef353a
d33470d8-e535-4e29-923b-0edd16b34f39,38939c64-27d8-477b-adbf-3eb952a9ff97,2025-09-07T20:48:42,,Property strong hospital federal foreign eight. Bit bad performance have road investment. Expert power senior thought mention rock list. Yet skin box family recognize.,2026-02-11T13:23:13,in progress,Ten allow wish idea detail. Whose wear suggest benefit follow nearly subject.,Williamland,8799.64,45,emergency,69cefa9a-d560-4a17-a13d-a5652e00e8a1,2025-08-14T08:00:52,2026-04-07T10:18:07.786550,c3d8ffa6-a2d2-4a8e-bb2b-a0ab6e248a15,a7c468f7-4f7b-4056-8541-530e08457a9d
c8edde5d-ddc0-4b6a-82f5-bef20dd326bc,f9923c46-a9a0-4f7d-95b8-8b0238e212f8,2026-01-02T01:40:45,,"Any could project order serve. Save maintain candidate wide. Among nothing drug short against quality out.
Security if establish. Bag far answer policy white. Explain sure difficult college clear.",2026-02-09T01:10:48,unassigned,Too soldier talk treat president remember what. Purpose determine resource pressure card put.,Wademouth,5970.39,20,urgent,6edce5fb-6eb5-4d55-bfd0-c35755c6e9cc,2025-06-03T09:38:55,2026-04-07T10:18:07.786711,a2d25950-be7c-4921-b092-d00963bf35df,9e1f4037-c0d8-46d8-9419-e39677995ded
f2940139-ab08-46be-bfdd-3fd97fa11382,f9923c46-a9a0-4f7d-95b8-8b0238e212f8,2026-03-05T20:09:20,,"Writer identify recently clearly though. Hand first woman believe against third president.
Child pass some very act that exactly.",2026-01-28T19:58:14,assigned,Bar every public fast data now such north. Picture care hot memory action yes.,West Susanville,556.64,34,emergency,c2b6b348-b8de-47ff-a980-4cc2907db28f,2025-11-06T18:00:37,2026-04-07T10:18:07.786902,1673aae2-7e48-4918-99f9-1c06c4a11259,cf5d3f51-8eec-4911-8be8-82253ee7e1ac
a53b0bc0-c371-4488-8c03-493f8f4b356f,4195973a-1e8f-47c7-af89-4b7e5e46de81,2026-01-27T05:12:48,,"Ago blood PM doctor.
Speech building central network dog whole own. Play main like speech.
Read inside success idea church various. Act I fight individual night check develop.",2026-01-28T12:58:30,in progress,Forget medical your you. Every three leader only fly series its force.,Prattborough,931.74,43,urgent,30d0a7b2-e936-429a-802f-51418eade57a,2025-05-01T21:34:12,2026-04-07T10:18:07.787095,9ddb4400-fa44-41a6-9169-29e972c0e2f8,a841dddd-8bbd-4bd7-93e6-87648b191545
73488fee-d0b6-413e-a57a-5f0473bc4cad,d5f6ba26-1832-4314-a2fd-f9b60850c485,2026-02-14T02:47:19,,"Outside quite speech product nature. Meeting use itself ago sound identify each.
Five since process painting hundred. Trip word old step eight.",2025-12-22T23:30:43,in progress,Ahead worker last account choice political. Boy public away guess mission.,Patrickstad,8439.28,23,urgent,0a4e2374-ae9a-45cf-8169-b74dcb073545,2025-10-15T06:18:51,2026-04-07T10:18:07.787236,d9f242d8-ee68-4b0f-9038-7fa7f01dfa1c,abaf4d6f-9ab9-4b14-b664-fdb879656ab6
b80dd3ff-8904-439a-bfa8-02fc31e9e5cd,159610a4-4b4f-4948-abd0-c010992f70a8,2026-03-20T07:40:30,,"Financial everything scientist so. Interesting chance practice. Anything perform book turn ever level record herself.
Imagine easy fly find. Appear candidate that.",2025-09-04T19:47:26,in progress,Open federal off when quite city data. I personal for TV. Star Republican race speech more.,South Stephanieburgh,3985.31,54,urgent,7e65792d-9921-4c85-8102-cccf8186193b,2025-07-18T09:12:18,2026-04-07T10:18:07.787389,3c8568bb-a24e-42db-b82c-6faebd2c0353,d31e2ff4-2a74-4d7d-9ccf-27230f0eed36
09cc3ed3-56a3-4011-8246-7a708b96aee5,d5f6ba26-1832-4314-a2fd-f9b60850c485,2026-02-18T08:18:01,,Activity thought cultural popular itself music tough. Popular major test. Ask short seem cut government find way owner.,2026-03-04T00:46:30,in progress,"Never professional provide live sport.
Pm behind knowledge understand player.",North Kaylashire,1109.42,41,emergency,1d29b680-7148-45d8-8082-e64384b3fcc2,2026-01-28T07:40:49,2026-04-07T10:18:07.788330,80f5d509-ef21-4d09-840c-b66a5661d72c,21d5f234-af2a-426c-b0f6-50bd8c5450ad
4ad78429-a7a4-4d09-ba50-adfd27a2dd86,3e45d3ec-4483-4235-88c0-8042057d7cff,2025-09-06T08:38:58,,More your significant. Career magazine Mrs Mrs employee. Read bit item sell.,2025-11-07T23:33:33,unassigned,Might wrong become value. Employee this charge present American degree eat. East cost suffer.,West Julian,6412.77,30,urgent,93215096-0b30-4bd1-8932-efa7bf5e7fd3,2025-06-26T21:13:28,2026-04-07T10:18:07.788584,03873e95-c62b-4a30-b572-d47988686294,901965dc-6df7-4cf2-a06a-12dd96c93874
60c28200-4192-4a2a-bcf1-31ab3a931d83,9469901e-742d-4522-9bba-d1217399375e,2026-03-23T08:47:48,,"Himself indicate kitchen book. Type always enter book material. Similar media upon dog especially fire official feel.
If need choice me. Evening some wide. Early occur of material.",2026-04-12T04:25:29,in progress,Cost put opportunity.,Scottborough,4334.72,26,urgent,186200fb-53e0-4a56-baf0-cafe6b69edb3,2026-03-21T06:16:04,2026-04-07T10:18:07.788741,d30d9b15-3d8a-4ff6-9a5d-3661859c5551,42fa0411-b182-433a-b0dd-8a8a7b80f669
00af1112-86a0-478b-aa71-5359ad810fbe,4195973a-1e8f-47c7-af89-4b7e5e46de81,2025-12-08T18:39:09,,"View example friend live speech better another far. Interesting back after seven bill good mind.
Out much spring if kid like similar where. Least hotel hotel film bring color light.",2026-02-10T05:38:44,completed,"Stage down cover stuff little much effect.
Life half himself. Claim majority shoulder start.",Lake Jamesfort,3371.13,35,urgent,9e14feee-755f-49ec-be19-c06f1a246c94,2025-10-05T14:12:59,2026-04-07T10:18:07.788949,a81295ce-27a4-4ea5-b668-3093a8ce48ff,c06bdfe9-53b3-47d6-bfb7-1fcaa90e5cef
5e422f78-b27d-4199-89c5-a692051aa246,ec609920-5b8b-4710-99cf-185d2b003772,2026-01-30T03:19:08,,"More professor single cup buy goal. Than resource card huge almost ball.
Part listen page father bank foot. Hot represent chance leg everyone real.",2025-11-09T16:59:12,assigned,Service thought start price true change. Candidate medical around feeling.,North Robert,5629.04,30,routine,d05489c3-cf4a-49c6-840c-5f7bc11506f2,2025-08-23T23:34:07,2026-04-07T10:18:07.789113,70c3dd8b-39bd-44bb-8e44-f86d91efde64,6bd6f84f-a9bb-48ab-ab30-990edf125119
9fec2b9b-f4c8-4d02-8870-40df7a7b4dd2,d5f6ba26-1832-4314-a2fd-f9b60850c485,2026-03-22T12:59:42,,"War event reflect unit some product. Husband statement night they.
Same toward media reach challenge sea control. Ground important think.",2026-03-07T13:45:06,unassigned,Group professor different shoulder over total meeting. Form southern middle.,Kimberlyhaven,586.74,57,urgent,0a4e2374-ae9a-45cf-8169-b74dcb073545,2026-02-25T23:18:41,2026-04-07T10:18:07.789271,42bbf83d-9f0f-4711-8dab-548f87d922f0,046e9eda-007e-4b91-a90e-18b9a69f779d
fe7f809c-6985-49ec-8ae5-4e0a88090cb8,3e45d3ec-4483-4235-88c0-8042057d7cff,2026-03-26T04:30:03,,"Pick doctor into beyond sister eight. Him physical forward ever produce answer kid. Few feeling understand.
Central lot stand response. Free property interview issue peace Congress land.",2026-01-26T10:03:33,in progress,They southern finish mother simple decide daughter. Cover face court.,Anthonyberg,5066.16,16,routine,fe66602b-ecb2-4bfa-884b-3b40b05f0302,2026-01-26T00:11:19,2026-04-07T10:18:07.789415,48f2faef-aab1-43d3-8593-e5209eaedfb8,00ef8fd1-44dc-4b94-b2f1-5d51e621cef6
7addae32-4efe-4d42-893e-03fd2bc16356,ca08ace8-52c5-4d85-8659-6c4ca8d07a0c,2025-12-02T10:37:10,,Nice agent reality sport. Same door green public create place enough. Popular reflect history reason dinner.,2025-10-21T11:08:24,completed,Candidate return claim cost sometimes democratic. Thousand everybody decide big.,Millerberg,5486.98,66,emergency,185a873d-df59-40d1-ad4c-4609f608b033,2025-05-13T00:25:37,2026-04-07T10:18:07.789578,ff117b04-806a-4462-8005-6c7ba08aef42,54aac3d2-4219-46ad-a292-34ce694b1025
5eb7e7dc-e7d3-4092-a01e-8c2f8a541b9b,3e45d3ec-4483-4235-88c0-8042057d7cff,2025-08-24T06:08:27,,From chance cover ok never ready leg. Bar head campaign food whatever.,2026-02-20T22:32:51,unassigned,Because sense western white. Dark the finally although. While certainly policy read like court.,Russellton,1822.56,69,routine,93215096-0b30-4bd1-8932-efa7bf5e7fd3,2025-05-20T11:22:07,2026-04-07T10:18:07.789749,65c3a69b-e891-4480-b0f8-80ee09167ee8,fa42226d-a5bc-43f0-9830-c00b4d0ffb89
db860d59-8078-42fe-98d0-3cb44b03a509,ca08ace8-52c5-4d85-8659-6c4ca8d07a0c,2026-02-17T08:36:48,,"Street hot happen among difficult deep fish. Raise stand five.
My though today head hard music. History take catch.",2025-09-22T22:01:59,completed,Scientist approach seven include. Owner institution hard. Spring so rock before sister they.,Elliottport,5105.33,20,urgent,11b3fac4-0a2b-48f6-88bd-d93fcb533461,2025-08-08T22:55:13,2026-04-07T10:18:07.789943,ac9a4b3f-e0b5-4185-960f-1936dd22a51e,48e03e1e-9486-4972-a729-d6ab04cc9917
d66afb72-ce3d-4cef-b205-cbcf0f783597,ec609920-5b8b-4710-99cf-185d2b003772,2026-03-31T19:20:58,,Along area assume. Control majority whatever allow really. Attorney air bed.,2026-02-24T10:39:47,unassigned,Person that seven among before. Return news black rule lose try officer.,West Kimberlyburgh,7053.63,72,emergency,65243d2f-5486-4599-87f2-5f271bc649aa,2025-12-10T19:10:05,2026-04-07T10:18:07.790140,db15cbe5-86dd-4216-9328-93f7f774e677,54c54f92-2da5-42da-b783-b9686633d7b9
0e613602-5226-4a4d-bcf4-defed9fb63d8,ec609920-5b8b-4710-99cf-185d2b003772,2026-03-04T04:38:52,,"Through coach believe raise. Audience others push drug drive realize. Knowledge water onto offer value with.
List paper recognize trade. Black lead pretty early walk others hard federal.",2025-12-16T11:26:38,unassigned,Card threat this provide because.,New Samantha,6872.16,18,emergency,d47bdfe5-723b-4d3c-a04f-5d09ab41a81b,2025-10-29T18:16:38,2026-04-07T10:18:07.790274,ef64173b-da11-41f8-8fbc-65522277dd0e,78d15b48-a2a8-4d1f-94eb-de4f58401c3e
7ae494bf-d6d8-4845-aa2f-e04fb4483c72,159610a4-4b4f-4948-abd0-c010992f70a8,2026-03-26T16:20:51,,White season result environmental. Herself along life less. Watch official analysis teacher.,2026-03-19T09:09:16,unassigned,"Key former less new such. Never oil tough feeling size.
Finish sister real admit together value.",Amyborough,9182.47,12,emergency,ea41f7e6-a8ac-40f5-85af-85bed4e02578,2026-01-07T13:40:29,2026-04-07T10:18:07.790439,de453f46-b774-43ec-8336-10ddd727f365,25fb49ff-4ec5-4694-9c58-22e0dfa9ea57
6a9dc4ff-923e-4db4-a3f8-b1c35db75366,159610a4-4b4f-4948-abd0-c010992f70a8,2025-10-12T00:29:39,,Kind seven answer hold. Forget attorney decade ability exist be dark.,2026-01-29T22:44:36,unassigned,Company level clear quickly. Music reflect lose material kid door. Can suddenly cell fund.,New Cody,3327.91,66,urgent,186200fb-53e0-4a56-baf0-cafe6b69edb3,2025-08-20T06:15:32,2026-04-07T10:18:07.790577,2db1af4f-e440-4750-b710-14b82c1ae543,1e5a35b7-6094-45d1-827d-347ec1df04c6
99e4cf5f-7ac7-484a-9287-e132c2f271df,f9923c46-a9a0-4f7d-95b8-8b0238e212f8,2026-02-03T15:24:29,,"About yet although deep resource reveal dinner.
Could current discuss thing face economic thousand. Event similar everybody road. Win spring raise because area sport money.",2025-10-21T14:07:39,completed,Film nor performance. Nor necessary population station their floor.,South Andrew,1804.41,36,routine,37a9df9a-0c80-4672-a86c-4467822d2688,2025-06-15T22:26:57,2026-04-07T10:18:07.790721,89c291bd-0dd5-4296-8d4c-de469dbb25e5,d64b0822-8d51-4d49-89a4-783b32d361f1
ce17a798-d851-4328-8043-8804d3c1a37a,ca08ace8-52c5-4d85-8659-6c4ca8d07a0c,2026-01-09T14:23:03,,"Price others opportunity often.
Finish sort part. Several natural back news energy everyone local. Play raise such media.
Forget if agency between four inside. Five assume pay particular room region.",2026-03-15T04:40:03,in progress,Child old huge though project look give general.,Millerview,7027.65,34,urgent,9774c0b5-6317-4794-bf97-42efa48f1dce,2025-11-06T16:55:27,2026-04-07T10:18:07.790899,8a5ced8a-f0f4-43b3-abf1-7c63086d0ac0,f3c9eb0f-3224-41c4-8c5f-6f4c2bc37cfa
c71a24f6-b3b5-4052-82ef-ec4a9563981a,4195973a-1e8f-47c7-af89-4b7e5e46de81,2026-03-14T14:38:56,,Security per feeling result team main world. About like break room rest center increase.,2025-11-06T16:57:50,assigned,Wonder ago rise once sense product. Tough company present concern participant.,East Charlesfurt,5709.34,47,routine,9e14feee-755f-49ec-be19-c06f1a246c94,2025-04-25T06:17:46,2026-04-07T10:18:07.791054,ceadbb51-5462-4648-b038-ba29a7f6f0fd,64b008e6-c97c-436f-9ddb-f178e20e8c42
2926d67f-95ce-44f5-b777-2a0c524a5b83,38939c64-27d8-477b-adbf-3eb952a9ff97,2025-11-07T16:48:46,,"Sell water truth dog. Issue degree dog factor shake. Wear history near.
Including the even style but. Surface least point enough. Argue research discuss wide.",2025-10-08T14:11:09,assigned,During control return he put culture. Notice old run around seek by American beat.,Port Robert,9794.99,34,emergency,8c2e0996-ae50-4c15-bc25-3b3b3a95896c,2025-06-11T10:08:13,2026-04-07T10:18:07.791197,0ab2f407-e6df-433f-8266-89c397ac77b2,c47d8138-7437-4625-8a68-92ad3bfb2bd6
9f388899-ce0b-4e1f-ad0e-14d467e43050,159610a4-4b4f-4948-abd0-c010992f70a8,2025-10-21T12:25:12,,"Friend leg probably create marriage behind. Choice bit plant director month. Purpose up support hair.
Them policy apply know. Board to tax eat difference different.",2025-12-16T22:14:16,unassigned,Parent who choice see someone about process. Space future despite or.,Fieldsborough,831.47,68,routine,7e65792d-9921-4c85-8102-cccf8186193b,2025-06-21T20:40:26,2026-04-07T10:18:07.791357,48d7f07b-f503-49da-a9a0-7b21aa127cd9,00488eee-5013-4af0-8216-8507bdf20384
b8809c1a-a113-4bfd-8279-bf0d8f1c9680,38939c64-27d8-477b-adbf-3eb952a9ff97,2026-03-26T03:56:49,,"Scene among only capital middle. Suddenly college media bill station budget seat.
Attack sea game able now service need. Modern write family summer hope final look. Character feeling build.",2025-12-28T04:22:15,in progress,Company Congress green yeah whose and light. Able less Congress modern poor.,East Donaldmouth,6573.45,19,emergency,8e2c1c85-0fc3-40ad-b842-0237c0f9b2be,2025-06-10T02:13:51,2026-04-07T10:18:07.791512,d62107a7-f0a4-4512-bc23-e6d3026d8af3,a44aa19e-f12e-43f1-ad76-51037411be67
