id,assigned_vendor,client_id,assigned_at,completed_at,description,work_order_name,estimated_start_date,estimated_end_date,current_status,comments,location,location_type,latitude,longitude,estimated_cost,estimated_duration,priority,well_id,service_type,estimated_quantity,units,is_recurring,recurrence_type,cancelled_at,cancellation_reason,created_at,updated_at,created_by,updated_by
fdedcd7f-6d43-4502-8347-97ce9bdacf9c,4678cf0f-ec53-469f-8fdc-1952c6c95524,87a43abf-a0aa-4b19-bcdd-ea7b1e66a945,2026-02-21T11:52:13.559707,2026-02-27T00:16:37.090071,"Yard worker indeed three about foreign own consider. Four yard write ok economy time middle.
Check everything within expert.",WO-70659,2026-02-21T12:04:31.097292,2026-02-25T12:04:31.097292,COMPLETED,Air firm discussion her capital candidate player. Drop apply student whether computer.,Ryanton,ADDRESS,16.056923,43.443752,36903.74,"2 days, 0:00:00",LOW,c65466d1-6281-4ce4-a3fc-5c1e113cff5c,1ae8c37c-38a8-4360-94a0-0adfc4c9305b,23.69,gallons,True,DAILY,,,2026-02-20T18:54:26.634637,2026-04-16T05:41:22.886010,a29e9853-03e1-418d-a2c1-fc28bb10c450,2fd74f97-4009-4119-9ab3-5c014480e0aa
eb44d78d-9d14-4159-9e01-02b4cdb17b77,976efc1b-14ab-4f55-b545-737e09b5c32a,7313119f-25ea-4281-a2ed-2f9da6eafe78,,,"Performance member message heavy government for. Bag us close take quite.
Cause visit trip model music item. Treat firm weight.",WO-29887,2026-03-23T01:10:38.332325,2026-03-27T01:10:38.332325,UNASSIGNED,Decide city admit test. Mission woman camera kind their lose.,Port Jeffrey,ADDRESS,81.1884775,159.997845,42476.52,"2 days, 0:00:00",HIGH,dca06baf-7c59-4271-909a-004de9f99547,1ae8c37c-38a8-4360-94a0-0adfc4c9305b,32.23,days,True,ONE_TIME,,,2026-03-19T13:32:34.489461,2026-04-16T05:41:22.886465,3d1ab0e9-cae9-4d27-abc0-25a3cca07bfb,aa0521d2-0d27-45fd-bc09-48b7a26584d3
c7c78496-dbeb-4fa0-bc4c-9ad5a3a66214,b4531ca4-b042-4cf2-9ef5-7c1e35fd541f,db8ac4f6-6623-4a62-a8fc-db0ac50bad37,2024-12-17T01:23:31.298287,,"Drug three community west can sound stuff. Popular short argue former fund ground once. Article call left seat protect.
Nearly staff special type. Fine clear effort.",WO-15964,2024-12-18T13:42:56.658828,2024-12-19T13:42:56.658828,IN_PROGRESS,Own good let ready ahead process institution. Dream past vote old.,North Ambertown,ADDRESS,-58.601648,16.4815,24176.84,"3 days, 0:00:00",LOW,6cc018a5-b3ee-435e-b83c-a1d590df5697,2d9f1a62-d4a7-4c88-8ff3-3d3942708b81,50.75,visits,False,,,,2024-12-14T10:44:45.991984,2026-04-16T05:41:22.886937,9db004a5-3fe6-4974-9b74-ece81e04c1d6,6f54f9a9-be2d-4831-8aa1-947ef1b6ac65
0d8f731b-1f7e-417e-a96d-fcf15ff49261,b4531ca4-b042-4cf2-9ef5-7c1e35fd541f,028545bf-3cab-4c72-9cdb-f40b5b7308fe,2025-11-09T23:28:31.208280,2025-11-14T13:53:56.297772,Learn can pretty make memory leave. Unit hand issue per leg trouble. Government manager nothing particularly he.,WO-25207,2025-11-10T12:55:30.168263,2025-11-13T12:55:30.168263,CLOSED,Leg agent room natural feel. Country rock raise drop. Size scene expect yard. Say common customer.,West Sarafort,ADDRESS,73.150274,-44.23573,33868.1,"2 days, 0:00:00",HIGH,4122088a-61b2-46a7-985e-2b410d7e692f,f63e6700-3590-44d4-93ee-620634a189eb,10.97,loads,True,ONE_TIME,,,2025-11-09T08:35:33.175993,2026-04-16T05:41:22.887398,e7bd646b-d56a-40e0-994c-02978577a277,0cbf8c31-14d1-47ed-8137-66cc50b002f0
cabc46cb-90d9-4f4c-9fa6-3a9b0fcde77e,88bdb298-8da5-47e4-a4ec-178d9ae25cdb,d2b63471-5290-4bf5-9d7c-86e2435b53fc,2024-06-19T02:10:52.703393,2024-06-26T17:33:08.877542,Image beat tonight beautiful whom. Daughter few white within. Song report list dark over.,WO-02989,2024-06-20T09:38:26.465789,2024-06-25T09:38:26.465789,CLOSED,Nation month audience here include special citizen.,Burnsport,GPS,-71.4230035,79.981418,9603.73,"2 days, 0:00:00",LOW,12990c1a-2a9e-44ae-83db-e296deda81a5,521017d3-3b25-4d49-90c9-b7eca5ccd641,42.49,loads,False,,,,2024-06-16T16:32:49.322862,2026-04-16T05:41:22.887857,2473e5fc-5e09-4c31-a15c-9b42a7efbdaf,31e5f321-b3cf-4aa6-9848-874f92039b54
c23ebdcc-542b-4598-8771-b7935e44c6e2,4678cf0f-ec53-469f-8fdc-1952c6c95524,db8ac4f6-6623-4a62-a8fc-db0ac50bad37,,,"Top begin boy media several fact fly. Born reveal site.
Evening sometimes or involve when.
Thus listen hospital around resource. Get reflect group teacher learn difficult stay.",WO-70399,2026-03-24T01:56:06.272078,2026-03-29T01:56:06.272078,UNASSIGNED,Art human left add order. I others study however rather. Technology carry she design leave.,Dianaside,ADDRESS,22.9727245,-73.752856,36180.37,"1 day, 0:00:00",HIGH,3c2b257c-08f8-4262-a55c-a0a781cf33b8,2d9f1a62-d4a7-4c88-8ff3-3d3942708b81,43.79,visits,True,ONE_TIME,,,2026-03-19T18:56:39.350893,2026-04-16T05:41:22.888234,d3bfe099-75f5-445e-8a58-2a55a962390d,18806b14-5ad4-4d26-a89c-78de9fd96cad
11894503-fafd-4830-bf9d-169e960c0f30,4678cf0f-ec53-469f-8fdc-1952c6c95524,5b5c3c37-70f2-465f-8c5b-3d4e90f804e4,2024-10-08T00:41:33.724616,,"Front movement make experience receive really.
Performance prepare during friend rule. Manage central surface foot my realize rather. Watch sea green your both per boy.",WO-47584,2024-10-08T11:02:10.116995,2024-10-12T11:02:10.116995,IN_PROGRESS,Billion see especially son have condition both.,South Kaitlyn,GPS,-84.058108,-1.303833,39373.98,"2 days, 0:00:00",MEDIUM,9eacb904-3044-43da-a3fa-f4facf315c0f,2d9f1a62-d4a7-4c88-8ff3-3d3942708b81,56.65,days,True,WEEKLY,,,2024-10-07T09:07:34.794217,2026-04-16T05:41:22.888647,358471cc-9246-47d7-b4cd-915edd2a68d7,691a46cd-f1be-4871-bfcb-43a08e38e041
c6e4cd2f-724c-4bdd-9687-79d16f963f6b,0662f3bb-2c28-4b44-acfe-56565d827f1f,87a43abf-a0aa-4b19-bcdd-ea7b1e66a945,2026-03-29T14:46:39.666316,2026-04-04T23:35:34.577997,"Score may east media. Understand wall wife yard matter.
Southern cup theory quality place. Exactly full note push small agreement.
Surface behavior western. Charge simple what why.",WO-16508,2026-03-30T03:43:08.192163,2026-04-03T03:43:08.192163,COMPLETED,Country sound so task. Drive staff pick.,Pattersonmouth,ADDRESS,-11.164888,-105.810791,37357.36,"2 days, 0:00:00",MEDIUM,10d257dd-d748-428f-83b0-64cbdc34c18a,f63e6700-3590-44d4-93ee-620634a189eb,36.67,days,True,MONTHLY,,,2026-03-27T11:42:35.744565,2026-04-16T05:41:22.889170,30c21118-ed1a-4a8c-9f53-4d764b9f5454,0e84e8f5-92e6-41ae-917c-bc778315c143
a529839a-98b4-4d1c-bca3-8c3bdbed5e04,88bdb298-8da5-47e4-a4ec-178d9ae25cdb,d2b63471-5290-4bf5-9d7c-86e2435b53fc,2025-11-23T23:31:46.837479,,Suddenly candidate garden matter whose born. Possible land even leave. Recent five contain fine brother.,WO-76130,2025-11-25T11:36:17.832695,2025-11-30T11:36:17.832695,REJECTED,Feeling example recognize table community relationship PM. Finish go change you spend.,Lake Jessica,WELL,-72.6189925,101.688587,18077.9,"3 days, 0:00:00",HIGH,12990c1a-2a9e-44ae-83db-e296deda81a5,f63e6700-3590-44d4-93ee-620634a189eb,49.26,visits,True,WEEKLY,,,2025-11-21T00:53:59.844598,2026-04-16T05:41:22.889592,e82e4b01-d85c-461e-a98f-3e4f930f08d9,af61771a-f2d1-41ab-9eec-6ef835bae33a
902e0654-626e-4ed8-987b-6e52e2249633,4678cf0f-ec53-469f-8fdc-1952c6c95524,873ed2c3-5db9-4e66-8fd5-eda1ae4e0cbc,2025-12-14T21:37:05.710424,,Everyone usually very maintain officer break indicate away. Election high power whose yourself task. Art office guy field rule.,WO-87700,2025-12-16T19:41:16.002455,2025-12-18T19:41:16.002455,IN_PROGRESS,Yeah stock position guess as film serious. Card board response stop country year line.,Williamberg,ADDRESS,26.8215095,83.983666,21379.92,"3 days, 0:00:00",HIGH,fb8a7942-1ea7-4df0-ade9-61334331fa72,2d9f1a62-d4a7-4c88-8ff3-3d3942708b81,41.07,hours,False,,,,2025-12-12T00:29:19.651875,2026-04-16T05:41:22.890061,2b84be0d-a021-4adb-aba2-bd2d19b4ae0f,6d92849a-c1fc-4f16-b3c8-b3f5101c9769
a8833314-f8b3-4fe2-a3c6-3cf4963d4d45,4678cf0f-ec53-469f-8fdc-1952c6c95524,00433d9c-81cf-4058-bf6a-fed7ddb39ed2,2025-09-04T18:42:07.825892,,Important arrive little expert tell speech house kid. Likely growth everybody significant member maybe.,WO-52573,2025-09-06T12:13:59.065366,2025-09-09T12:13:59.065366,HALTED,Partner resource almost. Send star simply always high friend item.,Burkeborough,ADDRESS,-37.8906275,-106.983941,13926.78,"2 days, 0:00:00",MEDIUM,a8ea5934-3296-44fe-983e-b2702ef80311,b197cee2-a173-4026-9d78-0664ecf14e76,75.04,days,False,,,,2025-09-03T03:45:46.339395,2026-04-16T05:41:22.890490,6d92849a-c1fc-4f16-b3c8-b3f5101c9769,4f5c1b39-0cbb-4838-84d4-831aeb0e763a
670738e4-8549-4f0c-bdba-fc633da34241,b4531ca4-b042-4cf2-9ef5-7c1e35fd541f,1de1a4ae-f248-4934-bbf9-6d89826f25dd,2025-03-26T23:44:46.083048,,Mouth great hundred significant. Discuss cause skill talk despite purpose control.,WO-83845,2025-03-28T23:24:20.746226,2025-03-30T23:24:20.746226,IN_PROGRESS,Central on right become room. Month continue chair like collection. Foot not hundred traditional.,North Brian,ADDRESS,-65.5616915,-171.571029,47051.65,"3 days, 0:00:00",HIGH,59da93cc-6776-48e0-814b-cc27d537560b,1d15cc9c-bbe5-46c9-81bb-d76c6d53997b,8.93,gallons,False,,,,2025-03-26T07:08:48.420574,2026-04-16T05:41:22.891071,ce9477e3-de00-4613-9118-81fe30f48161,14dd0066-a0a3-4964-900c-f6e1d49b081e
692b0a02-7a6b-42ea-8858-cb126c8e7ace,cff59dfd-47ec-43be-8791-91f399189fb6,87a43abf-a0aa-4b19-bcdd-ea7b1e66a945,,,"Herself heavy raise win go. Prevent leave rest step color role. Truth later nor out assume.
Someone oil almost. Few mind how. Security debate teach.",WO-76090,2025-07-26T14:59:46.175109,2025-07-30T14:59:46.175109,UNASSIGNED,May occur process home. Truth because course my thus science. Bed more send maybe with event.,Phillipburgh,ADDRESS,-18.8061635,-60.658242,13491.39,"1 day, 0:00:00",LOW,10d257dd-d748-428f-83b0-64cbdc34c18a,50332e38-e437-4b90-b168-2b3d2557eede,65.83,visits,True,ONE_TIME,,,2025-07-22T22:38:24.030025,2026-04-16T05:41:22.891510,0e84e8f5-92e6-41ae-917c-bc778315c143,891e2ccf-275d-4d44-91b4-cd9e832a22a7
1258fef2-7045-46b2-9e57-03f351eef3e8,3717f5e0-8ae1-4f1b-a417-590176d14f60,d4965895-64f5-46e0-a4af-546400816e98,2024-11-12T22:41:56.113492,,"Organization computer born star rather home. Mean as miss and form. Information fact interview toward onto.
Local employee everybody involve trial. Price thing international control.",WO-00415,2024-11-13T15:53:54.919028,2024-11-15T15:53:54.919028,IN_PROGRESS,Begin hear area section pressure bed far. Side break tree personal right already green.,Lake Frank,ADDRESS,59.9211025,16.301654,2240.17,"2 days, 0:00:00",MEDIUM,37b438f5-0370-41ef-88b9-d3dc30759298,521017d3-3b25-4d49-90c9-b7eca5ccd641,86.56,visits,True,ONE_TIME,,,2024-11-10T07:42:31.545685,2026-04-16T05:41:22.891960,67d39545-d6e3-40da-96e0-c1fa8892e614,a778ea69-223e-419b-b550-6bdcaf591d81
cc6d3495-74b8-47ee-bf9d-8d9e6be2ebf0,b29a8b42-259b-4fa9-9c07-ac0390374664,c5d2e606-6a9f-49bc-b434-8cfe4e54eec0,2026-03-20T12:15:03.629325,,"While detail spend avoid. Evidence good which among the.
Program want step. Their authority up many mission give choice.",WO-65712,2026-03-21T21:56:47.684674,2026-03-26T21:56:47.684674,CANCELLED,Never answer poor my. Project capital property population.,Carolside,ADDRESS,86.6588225,91.063573,31736.85,"3 days, 0:00:00",HIGH,bb84848b-0ead-4180-b882-6cab8742960f,50332e38-e437-4b90-b168-2b3d2557eede,44.06,days,False,,2026-03-21T17:03:31.091898,Weather delay,2026-03-17T18:07:32.547562,2026-04-16T05:41:22.892338,799d9fc3-d7d8-4f85-b583-c6ea4c872243,6bf2c471-b226-48d3-a1ee-ad04b0766cc5
c5cce77c-2912-4d0a-b231-cbf97062fc55,3717f5e0-8ae1-4f1b-a417-590176d14f60,7313119f-25ea-4281-a2ed-2f9da6eafe78,2025-08-22T03:52:34.987565,,"Region plan number identify natural whom grow gas.
Cell any describe instead. Business skill simply walk three shoulder education.",WO-58062,2025-08-23T19:01:05.213295,2025-08-27T19:01:05.213295,ASSIGNED,Move law sell painting there southern crime believe. Many modern picture but writer.,Webbton,GPS,-56.462754,32.511778,20904.09,"1 day, 0:00:00",MEDIUM,dca06baf-7c59-4271-909a-004de9f99547,1d15cc9c-bbe5-46c9-81bb-d76c6d53997b,2.05,days,False,,,,2025-08-19T04:07:57.170698,2026-04-16T05:41:22.892773,67d39545-d6e3-40da-96e0-c1fa8892e614,b189d5f9-b3db-4da3-8cfd-5de39ac52f16
1f673fdb-f338-4d5a-b3ee-7f828271bfdc,0662f3bb-2c28-4b44-acfe-56565d827f1f,cf5fd7cb-7cc4-4129-a6df-f8e0dfcd7fb7,,,Start far citizen to state market car. Response challenge challenge conference. Future game sea story a.,WO-05993,2024-12-31T01:21:05.367937,2025-01-04T01:21:05.367937,UNASSIGNED,Drug camera responsibility but. Be chair there even election season rise society.,Vargasside,GPS,-49.431236,-16.9325,952.06,"2 days, 0:00:00",MEDIUM,2bfd5b63-ba0a-4fc0-9232-41b6477ae8fa,521017d3-3b25-4d49-90c9-b7eca5ccd641,60.1,hours,False,,,,2024-12-30T06:27:48.135331,2026-04-16T05:41:22.893139,a51321e0-7876-4191-b47d-49cc15b115b6,1ea03a0f-22c8-432d-a269-8a747872cf09
15c8d9aa-fb90-45f7-8376-7f8c2a6e1da9,b4531ca4-b042-4cf2-9ef5-7c1e35fd541f,028545bf-3cab-4c72-9cdb-f40b5b7308fe,2024-05-17T18:31:44.878914,,Challenge behavior man wait tend top military. Board administration amount race him technology class. Gas leg sign senior itself describe.,WO-17882,2024-05-19T15:04:17.262429,2024-05-23T15:04:17.262429,IN_PROGRESS,Former world edge. Discover save cost while city would. However itself trip remember mother music.,South David,GPS,86.2727045,171.564424,4420.88,"3 days, 0:00:00",LOW,f7ab65fd-2789-4536-bdfb-584d848f0760,f63e6700-3590-44d4-93ee-620634a189eb,52.14,days,True,WEEKLY,,,2024-05-17T07:49:51.450631,2026-04-16T05:41:22.893510,e314ff66-3d32-4c36-bc6d-7254cfe054e7,411fa026-25ba-4593-83e3-caa826d8872a
6fbee612-80a1-4ed1-bc8c-b07896a1bd6c,976efc1b-14ab-4f55-b545-737e09b5c32a,c5d2e606-6a9f-49bc-b434-8cfe4e54eec0,2024-05-12T09:21:32.111302,,"So enjoy about standard address. Bank two green opportunity test high.
Remain find use degree organization partner. Benefit business surface dinner stand thought size.",WO-86188,2024-05-13T19:31:43.541379,2024-05-17T19:31:43.541379,HALTED,Study live idea way. Break of check parent. Lead within detail camera total.,East Richardchester,WELL,4.825426,35.938451,7262.89,"1 day, 0:00:00",HIGH,11c7b27c-fdc3-4c54-951c-c2eed5e7ba8a,1ae8c37c-38a8-4360-94a0-0adfc4c9305b,46.08,visits,True,DAILY,,,2024-05-09T20:46:42.234671,2026-04-16T05:41:22.893989,f7f033a6-a80b-4a0f-a3f1-9ca21970a003,05d7c52d-ae56-44a0-8a73-08bbad2207da
67f68839-cb47-42c7-93f3-9d2649cc894e,b29a8b42-259b-4fa9-9c07-ac0390374664,5b5c3c37-70f2-465f-8c5b-3d4e90f804e4,2024-04-26T12:46:36.888059,,"Talk near choice tend. Skin population camera ok.
Indeed when close new energy key interview. Out culture action federal single.",WO-42106,2024-04-27T10:20:31.717306,2024-04-28T10:20:31.717306,IN_PROGRESS,Newspaper because serious affect next rise different. Education wear believe ready risk often.,West Kristina,ADDRESS,24.124081,-141.397583,48630.46,"2 days, 0:00:00",MEDIUM,a0420a4d-8ae5-4be2-afa9-c1d7eaa6f479,50332e38-e437-4b90-b168-2b3d2557eede,13.38,visits,True,DAILY,,,2024-04-24T12:22:40.687147,2026-04-16T05:41:22.894387,6e51b311-6dbe-4a80-8cd4-843309d823ed,947898e4-8314-4f64-83b8-5500d2d32f8e
63a909b5-01c4-44a3-84c0-9f886e84e5d4,0662f3bb-2c28-4b44-acfe-56565d827f1f,873ed2c3-5db9-4e66-8fd5-eda1ae4e0cbc,2026-04-16T04:40:43.792960,,"Authority get similar yet age natural name fear. Skill talk court part actually specific.
Guy agree behind bank. Blood final whom film contain current will material. Serve end one actually.",WO-90499,2026-04-16T04:46:07.958481,2026-04-20T04:46:07.958481,ASSIGNED,Wonder loss morning two high party. Herself program hit consider already push brother.,Lake Meganstad,GPS,7.1499825,58.333857,49899.19,"2 days, 0:00:00",HIGH,684fa738-2409-4ee0-bb53-09464e185864,f63e6700-3590-44d4-93ee-620634a189eb,79.35,loads,False,,,,2026-04-16T01:11:12.927130,2026-04-16T05:41:22.894738,22408703-5bac-4b08-882c-93dac7ff3b3e,7cc353d5-62c2-4e25-a90c-f2c60b00bd1e
6c172aab-783e-40c3-b706-1e950abb3fb6,b29a8b42-259b-4fa9-9c07-ac0390374664,e9f6e5b3-7260-4249-961b-316d318d58c3,2025-06-22T13:12:23.943159,,Race final peace street. Put day space role sure above whom.,WO-63276,2025-06-24T07:16:32.470530,2025-06-25T07:16:32.470530,CANCELLED,Positive response can age hair kind. Over accept right quickly.,Lake Samanthatown,GPS,37.4312965,-61.130893,44837.1,"2 days, 0:00:00",MEDIUM,3498fafd-a5b8-4354-ac23-4c678301fa34,50332e38-e437-4b90-b168-2b3d2557eede,83.0,hours,True,DAILY,2025-06-23T11:37:04.201658,Safety concern,2025-06-22T01:54:21.995750,2026-04-16T05:41:22.895193,ab3c29cc-33bd-4c03-9e08-6a65d4a33d7c,4a142153-fb15-4794-8b58-60ccb9c5fbe3
858fdb4e-899c-4710-bf48-17f5b3b737e9,b4531ca4-b042-4cf2-9ef5-7c1e35fd541f,3226e426-ef49-45fa-b72e-550bd5da5fe9,2025-03-02T16:52:45.979314,2025-03-05T09:48:14.467327,Return hit computer. Stuff fire animal scene center. Might thank later ok deal through.,WO-94101,2025-03-04T07:25:11.518404,2025-03-06T07:25:11.518404,CLOSED,Pick job lot mouth.,East Kathleentown,ADDRESS,18.3103985,103.391257,23311.31,"1 day, 0:00:00",HIGH,8ca14d7f-e807-4139-9c72-b4303567fda8,f63e6700-3590-44d4-93ee-620634a189eb,66.93,gallons,True,DAILY,,,2025-03-02T12:53:36.563812,2026-04-16T05:41:22.895571,cd28062f-580e-49cb-b71b-7c1a6fa47001,b2e3bba7-9cd5-49c4-b991-a726889f849f
fe22f2de-47b5-43fc-8591-2eac1dc4eae5,976efc1b-14ab-4f55-b545-737e09b5c32a,c5d2e606-6a9f-49bc-b434-8cfe4e54eec0,2026-04-01T15:30:43.250194,,Pm trial my wall. Outside dream responsibility two. Now camera man effect our.,WO-03485,2026-04-02T14:05:35.943651,2026-04-07T14:05:35.943651,IN_PROGRESS,Item tend process real account. There per look method pass. Brother later than media social.,Ericton,ADDRESS,-56.6608755,14.134155,24320.86,"2 days, 0:00:00",LOW,11c7b27c-fdc3-4c54-951c-c2eed5e7ba8a,1ae8c37c-38a8-4360-94a0-0adfc4c9305b,36.68,hours,True,WEEKLY,,,2026-03-31T08:21:24.122465,2026-04-16T05:41:22.895995,bb76c49d-84ba-46fb-a975-0efb378a99e7,d18faa97-95b0-452d-8d59-7c7a58c8e8cb
65863e52-e2d2-4c3a-9e8a-346caf427c3b,3717f5e0-8ae1-4f1b-a417-590176d14f60,56f6f056-e13b-44a9-9b75-c474164d6faa,2024-08-07T10:36:43.584320,,Way probably I cultural again outside through travel. Sure human enter about each key.,WO-48109,2024-08-08T17:45:45.639256,2024-08-09T17:45:45.639256,REJECTED,Travel get most remember. Trip grow series magazine language.,South Sarah,WELL,-54.699629,135.079631,29442.49,"2 days, 0:00:00",LOW,a374f166-f69f-410f-b6e0-fd15efb1b060,50332e38-e437-4b90-b168-2b3d2557eede,1.88,hours,False,,,,2024-08-04T22:36:25.483423,2026-04-16T05:41:22.896356,b77a8912-ce3d-40b3-ab27-69e6aac69773,083cdee5-1169-48ca-a9ca-571f52a771d0
ef8b5647-e361-43dd-80df-0a780f9e1877,86ea9e9c-f1d8-423c-bb34-2f1df47812aa,92feeac5-761f-4487-a05b-d4d30859f098,2024-12-22T23:13:17.841166,,Half level industry month moment rich. Town option during view buy institution.,WO-55593,2024-12-23T23:26:04.798007,2024-12-25T23:26:04.798007,ASSIGNED,Say speech eat other past. Management represent them.,Port Shannon,WELL,29.92394,-38.530547,5024.38,"3 days, 0:00:00",MEDIUM,cd343f2e-67d5-4aec-b72b-ecd15989ee86,521017d3-3b25-4d49-90c9-b7eca5ccd641,93.15,hours,False,,,,2024-12-20T02:20:24.781009,2026-04-16T05:41:22.896760,486fac9b-dfef-4e71-83c9-412c238db71a,c934fe99-eb05-4956-9150-e2f37d5bfe4a
47c9df53-af6e-4c26-b817-0b2476f47b5b,3717f5e0-8ae1-4f1b-a417-590176d14f60,028545bf-3cab-4c72-9cdb-f40b5b7308fe,2025-06-28T15:38:47.057940,,"Treat worry make quickly. Growth source walk stage way really.
Billion trade PM any fund. From drive face green white thought.",WO-04910,2025-06-29T09:40:31.388958,2025-07-03T09:40:31.388958,IN_PROGRESS,Wait item matter amount travel. Myself player million want yes.,Williamland,WELL,-40.1799365,-22.188847,49092.95,"3 days, 0:00:00",MEDIUM,0fe53134-2df9-48ca-b3f2-5e0e26576e73,1d15cc9c-bbe5-46c9-81bb-d76c6d53997b,80.75,visits,False,,,,2025-06-26T06:40:39.557178,2026-04-16T05:41:22.897226,635db01b-b003-4411-90ae-995f1520d411,6de27a7b-162e-4161-ac20-21cfc6bbbafd
c4cdbe2b-a67f-4dac-a27f-3cd93eedec3d,0662f3bb-2c28-4b44-acfe-56565d827f1f,3ae3720e-3bf7-499f-91ed-7e129d4ccdce,2024-08-26T09:38:06.715750,,Chance staff film summer election. Create range coach manager star image kind. Million raise near kitchen take evening.,WO-39402,2024-08-27T06:30:47.918825,2024-08-28T06:30:47.918825,HALTED,Factor because rate issue.,Brandonland,GPS,78.0158865,-38.743204,28171.73,"3 days, 0:00:00",HIGH,6bc3b38c-4935-4336-b333-d0a648931402,521017d3-3b25-4d49-90c9-b7eca5ccd641,49.52,days,False,,,,2024-08-24T02:29:19.648377,2026-04-16T05:41:22.897845,457db68e-3083-45a8-b2dd-045f3a3953b6,e167fd34-e2ea-4ed3-95b9-ba9b6a97a392
7c8a6611-c900-4dbc-baf7-10d310f12bdc,3717f5e0-8ae1-4f1b-a417-590176d14f60,7313119f-25ea-4281-a2ed-2f9da6eafe78,2026-03-11T04:53:27.732753,,Test little interest report daughter take public. Single can daughter. Ability American word song.,WO-07751,2026-03-12T20:52:21.739304,2026-03-13T20:52:21.739304,IN_PROGRESS,Into action seem. Board near lay fund.,East James,ADDRESS,-66.794316,42.169087,15135.8,"2 days, 0:00:00",HIGH,dca06baf-7c59-4271-909a-004de9f99547,1ae8c37c-38a8-4360-94a0-0adfc4c9305b,37.34,hours,True,MONTHLY,,,2026-03-08T11:11:43.799642,2026-04-16T05:41:22.898239,e35dbe71-13f8-4f3d-8a42-52e7182df36a,1a5d1718-b536-4f90-b3f9-f006a4491cd0
ede3ff46-8d57-4136-947d-d2237166db9f,976efc1b-14ab-4f55-b545-737e09b5c32a,00433d9c-81cf-4058-bf6a-fed7ddb39ed2,2026-02-22T21:19:00.869007,,"Law forward change lead catch. Purpose if through.
Lawyer finish account threat. Tough suddenly true type near among.",WO-95165,2026-02-22T22:22:51.089797,2026-02-27T22:22:51.089797,REJECTED,Report name allow firm anyone determine. Hot half easy wonder data.,Davidview,WELL,-27.3774315,62.041382,36189.68,"3 days, 0:00:00",HIGH,70fd92c8-cb17-49a2-b48d-99d44cfc707d,1ae8c37c-38a8-4360-94a0-0adfc4c9305b,82.09,gallons,False,,,,2026-02-21T20:51:17.047888,2026-04-16T05:41:22.898670,6612b52e-10fa-4a58-917c-0ef8bcef466a,bbda2d61-b61d-4aae-9903-425d9a56addf
98e1d93c-6736-4c3d-9929-703a68f6aa8e,b4531ca4-b042-4cf2-9ef5-7c1e35fd541f,db8ac4f6-6623-4a62-a8fc-db0ac50bad37,2026-01-25T17:25:47.854532,,Action whom especially article standard game record. College together strong difference defense treat standard seat.,WO-10559,2026-01-27T00:28:27.074423,2026-01-28T00:28:27.074423,REJECTED,Paper nature easy practice maintain deep. Explain matter mind require election feel.,Ronaldburgh,WELL,30.840723,-120.590161,41842.07,"1 day, 0:00:00",LOW,6cc018a5-b3ee-435e-b83c-a1d590df5697,2d9f1a62-d4a7-4c88-8ff3-3d3942708b81,87.48,gallons,True,ONE_TIME,,,2026-01-25T15:03:13.774226,2026-04-16T05:41:22.899023,a5861693-4a1b-4e40-84ae-aeea970cda34,b461937b-4f44-426b-aae2-35c629954e07
938890e0-7af0-4ba8-93b6-9e639d05103b,86ea9e9c-f1d8-423c-bb34-2f1df47812aa,028545bf-3cab-4c72-9cdb-f40b5b7308fe,2025-05-29T14:06:40.665234,,Skin standard ask night mention tend. Ago paper vote detail. Onto attention everything. About new president any their yes matter.,WO-96460,2025-05-30T09:49:23.761411,2025-06-03T09:49:23.761411,CANCELLED,Last woman material parent health world up. Pressure fill Mr health page opportunity.,South Lisa,ADDRESS,-59.9524285,129.952044,2929.74,"1 day, 0:00:00",HIGH,f7ab65fd-2789-4536-bdfb-584d848f0760,521017d3-3b25-4d49-90c9-b7eca5ccd641,72.07,hours,False,,2025-05-31T02:35:43.021892,Safety concern,2025-05-27T03:09:34.859210,2026-04-16T05:41:22.899546,5a279833-3eb9-4348-aa4f-21763679e499,18eab616-1d57-4621-a6f8-c5845d4f4066
20974610-7f2c-407c-ad21-516fe4e0f32f,cff59dfd-47ec-43be-8791-91f399189fb6,56f6f056-e13b-44a9-9b75-c474164d6faa,2024-06-18T07:17:57.278283,,Hard question defense baby share. News always political morning middle scene situation.,WO-77865,2024-06-19T11:23:31.332730,2024-06-23T11:23:31.332730,ASSIGNED,Nothing everybody return such health.,North Hannahfort,ADDRESS,4.413689,-163.003959,28121.98,"2 days, 0:00:00",MEDIUM,a374f166-f69f-410f-b6e0-fd15efb1b060,50332e38-e437-4b90-b168-2b3d2557eede,79.63,hours,True,WEEKLY,,,2024-06-17T01:02:34.090001,2026-04-16T05:41:22.899988,cacd35bb-e232-40e5-a090-dcf03a8d8cc7,21109e6c-0bc8-4693-96d3-e358ded16d42
e0c8a1fb-a3b6-4733-980b-ce5c148234e8,4678cf0f-ec53-469f-8fdc-1952c6c95524,d9beb757-4983-4517-9696-69cd5a3543ad,2025-12-06T16:01:28.282953,,"Peace middle run. Herself reduce health poor yeah.
Either current beyond movie three social with southern. Firm admit of evening similar often trouble.",WO-01818,2025-12-08T14:31:17.628811,2025-12-10T14:31:17.628811,ASSIGNED,Tree close plan. Full attack method town front education stop.,Jessicaside,ADDRESS,-44.249094,123.772099,36396.01,"3 days, 0:00:00",MEDIUM,17178c88-10b6-474e-a752-4f5ff8d96156,50332e38-e437-4b90-b168-2b3d2557eede,19.76,days,True,ONE_TIME,,,2025-12-06T05:53:33.173736,2026-04-16T05:41:22.900545,089e0092-2c81-4f91-96c9-436636dfb5ad,fd4b4436-1e44-4b9a-8670-ea61c03b5a1f
0a57efe5-22a0-4edf-b801-5fc9db6d92f7,0c7b6485-a187-4495-9459-142ad8d38f4d,87a43abf-a0aa-4b19-bcdd-ea7b1e66a945,2024-05-28T09:28:31.915679,,"Beat once break rate. Civil old parent mean face.
Seem describe message. Really however officer couple building take.",WO-65948,2024-05-29T20:53:09.786549,2024-05-30T20:53:09.786549,CANCELLED,Chair cost son by product lead property. Weight tree fine event police buy training finish.,West Isaac,GPS,-22.7017155,-173.358988,35276.25,"2 days, 0:00:00",LOW,c65466d1-6281-4ce4-a3fc-5c1e113cff5c,2cc137b9-70a3-4c73-8a9f-7918ef898f2e,17.51,gallons,False,,2024-05-29T00:04:05.265804,Safety concern,2024-05-27T09:46:25.784030,2026-04-16T05:41:22.900935,54fe94d5-0f71-4813-9ad8-8efe34769669,da13b8c3-aa49-489f-b30f-9de6a505e046
