work_order_id,assigned_vendor,client_id,assigned_at,completed_at,description,work_order_name,estimated_start_date,estimated_end_date,current_status,comments,location,location_type,latitude,longitude,estimated_cost,estimated_duration,priority,well_id,service_type,estimated_quantity,units,is_recurring,recurrence_type,cancelled_at,cancellation_reason,created_at,updated_at,created_by,updated_by
2cbcd2f7-76fa-488e-9e9b-83ec08259f2c,a729f017-ee54-49b2-b16f-e5d33223b156,cb02ddbf-6d9b-4525-a9bb-805fbc0b6fc7,2026-02-21T01:19:32.559707,2026-02-26T13:43:56.090071,"Yard worker indeed three about foreign own consider. Four yard write ok economy time middle.
Check everything within expert.",WO-70659,2026-02-21T01:31:50.097292,2026-02-25T01:31:50.097292,COMPLETED,Air firm discussion her capital candidate player. Drop apply student whether computer.,Ryanton,ADDRESS,16.056923,43.443752,36903.74,"2 days, 0:00:00",LOW,72dfe0e3-5cd5-47cc-b3bc-e3b8596b6e61,ce8f766e-041c-4139-8e39-0beb4382b441,23.69,gallons,True,DAILY,,,2026-02-20T08:21:45.634637,2026-04-15T19:08:41.105356,77b45985-6e1a-4660-84e5-90c0b52d3177,3feb1989-0996-4d6a-a6d2-feb1875df473
6c03ca16-4a0b-4dd1-b00c-51800995fb59,d8cec599-00d6-4641-bcf6-6aae6d798d2b,445b2acc-2760-4bd8-8d0c-353ebd1e2353,,,"Performance member message heavy government for. Bag us close take quite.
Cause visit trip model music item. Treat firm weight.",WO-29887,2026-03-22T14:37:57.332325,2026-03-26T14:37:57.332325,UNASSIGNED,Decide city admit test. Mission woman camera kind their lose.,Port Jeffrey,ADDRESS,81.1884775,159.997845,42476.52,"2 days, 0:00:00",HIGH,2ca48e40-63c6-4be7-9a1e-cc2626739115,ce8f766e-041c-4139-8e39-0beb4382b441,32.23,days,True,ONE_TIME,,,2026-03-19T02:59:53.489461,2026-04-15T19:08:41.105696,e554008a-58a8-416c-88a3-c573c30dceef,8306307f-58f4-4642-8b3a-8dee7096c6ce
bd0e41cf-5548-43a0-909f-9d0129feb695,83853f5e-c1cc-4f0c-8566-d798f4b3342e,747ad838-966c-42f7-b322-a9a9b71b627d,2024-12-16T14:50:50.298287,,"Drug three community west can sound stuff. Popular short argue former fund ground once. Article call left seat protect.
Nearly staff special type. Fine clear effort.",WO-15964,2024-12-18T03:10:15.658828,2024-12-19T03:10:15.658828,IN_PROGRESS,Own good let ready ahead process institution. Dream past vote old.,North Ambertown,ADDRESS,-58.601648,16.4815,24176.84,"3 days, 0:00:00",LOW,1a5d40c8-1040-4259-8e0a-5aa64cfe10a1,d24895a1-476d-492f-9608-a5fa43530a07,50.75,visits,False,,,,2024-12-14T00:12:04.991984,2026-04-15T19:08:41.106092,e1877768-e5d0-4014-932a-944116eb25a9,91229078-127f-475f-8635-36d6e09f89bd
26732463-baad-493b-aaca-e3fcb19fb237,83853f5e-c1cc-4f0c-8566-d798f4b3342e,7f893179-b166-4b75-9111-d61e648bf526,2025-11-09T12:55:50.208280,2025-11-14T03:21:15.297772,Learn can pretty make memory leave. Unit hand issue per leg trouble. Government manager nothing particularly he.,WO-25207,2025-11-10T02:22:49.168263,2025-11-13T02:22:49.168263,CLOSED,Leg agent room natural feel. Country rock raise drop. Size scene expect yard. Say common customer.,West Sarafort,ADDRESS,73.150274,-44.23573,33868.1,"2 days, 0:00:00",HIGH,76f1198d-42ff-47c2-ac9b-367b92527b29,086a9247-2173-4fe0-8bc7-37f146dce3b7,10.97,loads,True,ONE_TIME,,,2025-11-08T22:02:52.175993,2026-04-15T19:08:41.106528,a857872b-261d-48c7-8c4a-212bdcb6fdef,d17dab5d-170a-494c-bf2f-d15551e372bb
967a5766-03b0-462c-8922-df6271913280,a80bb39a-c58e-45c1-b533-bac9d8013fa0,1e1a3fa3-d7a0-495c-ad54-0f31f5908345,2024-06-18T15:38:11.703393,2024-06-26T07:00:27.877542,Image beat tonight beautiful whom. Daughter few white within. Song report list dark over.,WO-02989,2024-06-19T23:05:45.465789,2024-06-24T23:05:45.465789,CLOSED,Nation month audience here include special citizen.,Burnsport,GPS,-71.4230035,79.981418,9603.73,"2 days, 0:00:00",LOW,8af2a2bb-4d75-48e4-a390-8cd1de0a7e98,ec85f926-f00a-4d57-8835-f1f452018492,42.49,loads,False,,,,2024-06-16T06:00:08.322862,2026-04-15T19:08:41.106894,218783e3-9cb6-469c-952a-b340f03b0527,fd4d47e2-94af-4681-9b51-6adeba206c29
bf655b92-5588-4081-86c3-70474bda45c1,a729f017-ee54-49b2-b16f-e5d33223b156,747ad838-966c-42f7-b322-a9a9b71b627d,,,"Top begin boy media several fact fly. Born reveal site.
Evening sometimes or involve when.
Thus listen hospital around resource. Get reflect group teacher learn difficult stay.",WO-70399,2026-03-23T15:23:25.272078,2026-03-28T15:23:25.272078,UNASSIGNED,Art human left add order. I others study however rather. Technology carry she design leave.,Dianaside,ADDRESS,22.9727245,-73.752856,36180.37,"1 day, 0:00:00",HIGH,9b2453da-5f8a-4de1-b3e3-58f4ecba97f7,d24895a1-476d-492f-9608-a5fa43530a07,43.79,visits,True,ONE_TIME,,,2026-03-19T08:23:58.350893,2026-04-15T19:08:41.107198,462838b7-72dc-43e2-9fac-c509c59eb95a,3e66c719-331a-4627-893f-2451e9c4e2c3
770949f9-fce4-4ff0-a4e4-ea5b6648f1dc,a729f017-ee54-49b2-b16f-e5d33223b156,664eb1f4-0f02-4b63-aab2-9855a3767b74,2024-10-07T14:08:52.724616,,"Front movement make experience receive really.
Performance prepare during friend rule. Manage central surface foot my realize rather. Watch sea green your both per boy.",WO-47584,2024-10-08T00:29:29.116995,2024-10-12T00:29:29.116995,IN_PROGRESS,Billion see especially son have condition both.,South Kaitlyn,GPS,-84.058108,-1.303833,39373.98,"2 days, 0:00:00",MEDIUM,b8674859-f3b6-4e2e-a352-b90bc8865c53,d24895a1-476d-492f-9608-a5fa43530a07,56.65,days,True,WEEKLY,,,2024-10-06T22:34:53.794217,2026-04-15T19:08:41.107538,d69944e1-653a-4659-84ff-471820851184,ff5871d9-6081-40b8-81be-2721f4cb3849
0207b102-c310-47ee-935b-625d482c10b8,54f29160-579c-4454-afea-3f90f630d4bd,cb02ddbf-6d9b-4525-a9bb-805fbc0b6fc7,2026-03-29T04:13:58.666316,2026-04-04T13:02:53.577997,"Score may east media. Understand wall wife yard matter.
Southern cup theory quality place. Exactly full note push small agreement.
Surface behavior western. Charge simple what why.",WO-16508,2026-03-29T17:10:27.192163,2026-04-02T17:10:27.192163,COMPLETED,Country sound so task. Drive staff pick.,Pattersonmouth,ADDRESS,-11.164888,-105.810791,37357.36,"2 days, 0:00:00",MEDIUM,efefab16-8d7c-44bb-bae3-c4dffb79f2ca,086a9247-2173-4fe0-8bc7-37f146dce3b7,36.67,days,True,MONTHLY,,,2026-03-27T01:09:54.744565,2026-04-15T19:08:41.107908,0e66aa51-1f00-4bed-acf4-6c0062d61ee0,b3ca0be6-9646-4ca2-a3fd-147521358f31
7ccf1f30-9bed-45bd-b10a-09e8e34ff7ad,a80bb39a-c58e-45c1-b533-bac9d8013fa0,1e1a3fa3-d7a0-495c-ad54-0f31f5908345,2025-11-23T12:59:05.837479,,Suddenly candidate garden matter whose born. Possible land even leave. Recent five contain fine brother.,WO-76130,2025-11-25T01:03:36.832695,2025-11-30T01:03:36.832695,REJECTED,Feeling example recognize table community relationship PM. Finish go change you spend.,Lake Jessica,WELL,-72.6189925,101.688587,18077.9,"3 days, 0:00:00",HIGH,8af2a2bb-4d75-48e4-a390-8cd1de0a7e98,086a9247-2173-4fe0-8bc7-37f146dce3b7,49.26,visits,True,WEEKLY,,,2025-11-20T14:21:18.844598,2026-04-15T19:08:41.108217,6858f0fe-b019-48f3-a992-29f457a0fdde,e4d476e4-2b17-430d-9a2f-ba6a3ff6c96a
dc002842-c452-4810-91c0-c5bcdb578d4e,a729f017-ee54-49b2-b16f-e5d33223b156,5eaf6aac-6102-4fca-9675-c7559ae63360,2025-12-14T11:04:24.710424,,Everyone usually very maintain officer break indicate away. Election high power whose yourself task. Art office guy field rule.,WO-87700,2025-12-16T09:08:35.002455,2025-12-18T09:08:35.002455,IN_PROGRESS,Yeah stock position guess as film serious. Card board response stop country year line.,Williamberg,ADDRESS,26.8215095,83.983666,21379.92,"3 days, 0:00:00",HIGH,df6c9e5f-94ff-4007-b9bc-e0f24f1b1b19,d24895a1-476d-492f-9608-a5fa43530a07,41.07,hours,False,,,,2025-12-11T13:56:38.651875,2026-04-15T19:08:41.108589,ac923b7e-3ee6-4190-bdb0-655e77929f83,c32a3816-c6e3-4919-9ecf-2cc4d87d99c5
af89a86a-417a-468e-b174-78463403f3e3,a729f017-ee54-49b2-b16f-e5d33223b156,22b09298-43b0-48bb-8958-0cff8a7e1a91,2025-09-04T08:09:26.825892,,Important arrive little expert tell speech house kid. Likely growth everybody significant member maybe.,WO-52573,2025-09-06T01:41:18.065366,2025-09-09T01:41:18.065366,HALTED,Partner resource almost. Send star simply always high friend item.,Burkeborough,ADDRESS,-37.8906275,-106.983941,13926.78,"2 days, 0:00:00",MEDIUM,63fa96ab-3138-4fbd-8793-9de345ba3338,0abebf50-39f5-4876-bdd5-2c87b12d3eb4,75.04,days,False,,,,2025-09-02T17:13:05.339395,2026-04-15T19:08:41.109025,c32a3816-c6e3-4919-9ecf-2cc4d87d99c5,76c02e6c-be8d-4806-aeeb-6bace79ca093
8ad2258e-9cd0-40c4-9ca6-8a3af004566f,83853f5e-c1cc-4f0c-8566-d798f4b3342e,d2644f40-d137-4f6c-9d59-d9c3afa21cd6,2025-03-26T13:12:05.083048,,Mouth great hundred significant. Discuss cause skill talk despite purpose control.,WO-83845,2025-03-28T12:51:39.746226,2025-03-30T12:51:39.746226,IN_PROGRESS,Central on right become room. Month continue chair like collection. Foot not hundred traditional.,North Brian,ADDRESS,-65.5616915,-171.571029,47051.65,"3 days, 0:00:00",HIGH,a49325fe-fdc1-4c26-83b2-d7e01e6d05f8,509beb3f-897a-4f8d-9d3a-fd081e1f4600,8.93,gallons,False,,,,2025-03-25T20:36:07.420574,2026-04-15T19:08:41.109496,3d453d1a-f418-4bc0-9efe-cf47c898dd4b,d6532628-4776-4402-a9e9-498e45cd6717
3d70cf70-4d12-47a5-b4dc-cb0ea0109c71,e9f75d4b-f495-4b3b-b961-6e5fcc86158c,cb02ddbf-6d9b-4525-a9bb-805fbc0b6fc7,,,"Herself heavy raise win go. Prevent leave rest step color role. Truth later nor out assume.
Someone oil almost. Few mind how. Security debate teach.",WO-76090,2025-07-26T04:27:05.175109,2025-07-30T04:27:05.175109,UNASSIGNED,May occur process home. Truth because course my thus science. Bed more send maybe with event.,Phillipburgh,ADDRESS,-18.8061635,-60.658242,13491.39,"1 day, 0:00:00",LOW,efefab16-8d7c-44bb-bae3-c4dffb79f2ca,4e78a7e9-49e1-48b7-9800-4a1c34bc9afe,65.83,visits,True,ONE_TIME,,,2025-07-22T12:05:43.030025,2026-04-15T19:08:41.109857,b3ca0be6-9646-4ca2-a3fd-147521358f31,40ef06fe-7759-42e9-a0e5-4efb2f10f824
93beff56-afe8-4596-9e5d-d2669f9bb328,d8d8da12-0220-4369-b5b0-535c355a22c7,87a15a9d-4139-4a13-9c22-34f2e1c190a6,2024-11-12T12:09:15.113492,,"Organization computer born star rather home. Mean as miss and form. Information fact interview toward onto.
Local employee everybody involve trial. Price thing international control.",WO-00415,2024-11-13T05:21:13.919028,2024-11-15T05:21:13.919028,IN_PROGRESS,Begin hear area section pressure bed far. Side break tree personal right already green.,Lake Frank,ADDRESS,59.9211025,16.301654,2240.17,"2 days, 0:00:00",MEDIUM,ac884c01-d067-46e0-952b-ed9fd4a980ff,ec85f926-f00a-4d57-8835-f1f452018492,86.56,visits,True,ONE_TIME,,,2024-11-09T21:09:50.545685,2026-04-15T19:08:41.110199,b28929b8-3f82-4a81-b083-ddbea76af886,705b08cc-e1a0-48a7-b998-ecde17797dec
c7b7b5c1-82e3-4521-9de5-e36c111efc38,cd79ed9d-99fc-4878-bbcb-3b3df59226f9,34dcbc1a-d3ab-4c1e-ae41-74bce2f7ad66,2026-03-20T01:42:22.629325,,"While detail spend avoid. Evidence good which among the.
Program want step. Their authority up many mission give choice.",WO-65712,2026-03-21T11:24:06.684674,2026-03-26T11:24:06.684674,CANCELLED,Never answer poor my. Project capital property population.,Carolside,ADDRESS,86.6588225,91.063573,31736.85,"3 days, 0:00:00",HIGH,d55c45ae-54d5-4599-8a82-1c5543fdace0,4e78a7e9-49e1-48b7-9800-4a1c34bc9afe,44.06,days,False,,2026-03-21T06:30:50.091898,Weather delay,2026-03-17T07:34:51.547562,2026-04-15T19:08:41.110508,d32416e5-78b6-4211-8e96-bf48ae50b0e1,4fbd22a8-b6a4-4089-ba9b-1ce9e4950cab
38a245e4-2929-4179-880c-c5481bd3864c,d8d8da12-0220-4369-b5b0-535c355a22c7,445b2acc-2760-4bd8-8d0c-353ebd1e2353,2025-08-21T17:19:53.987565,,"Region plan number identify natural whom grow gas.
Cell any describe instead. Business skill simply walk three shoulder education.",WO-58062,2025-08-23T08:28:24.213295,2025-08-27T08:28:24.213295,ASSIGNED,Move law sell painting there southern crime believe. Many modern picture but writer.,Webbton,GPS,-56.462754,32.511778,20904.09,"1 day, 0:00:00",MEDIUM,2ca48e40-63c6-4be7-9a1e-cc2626739115,509beb3f-897a-4f8d-9d3a-fd081e1f4600,2.05,days,False,,,,2025-08-18T17:35:16.170698,2026-04-15T19:08:41.110930,b28929b8-3f82-4a81-b083-ddbea76af886,62cbcdd0-5c9d-4ae1-9d77-5223a0e17e8e
931beac4-687c-4835-810d-f164bfa4e277,54f29160-579c-4454-afea-3f90f630d4bd,2697e244-3ffd-4132-b5d7-a30cb0b44073,,,Start far citizen to state market car. Response challenge challenge conference. Future game sea story a.,WO-05993,2024-12-30T14:48:24.367937,2025-01-03T14:48:24.367937,UNASSIGNED,Drug camera responsibility but. Be chair there even election season rise society.,Vargasside,GPS,-49.431236,-16.9325,952.06,"2 days, 0:00:00",MEDIUM,c5444841-5bde-48de-b7da-29b870e87bee,ec85f926-f00a-4d57-8835-f1f452018492,60.1,hours,False,,,,2024-12-29T19:55:07.135331,2026-04-15T19:08:41.111268,5e02efb7-ec83-4f0f-a882-22815e6abe69,d4ce1711-4d70-4995-8a5e-bb27717b4cdc
ca937edc-1ab3-4ea6-ac63-77225919ecb0,83853f5e-c1cc-4f0c-8566-d798f4b3342e,7f893179-b166-4b75-9111-d61e648bf526,2024-05-17T07:59:03.878914,,Challenge behavior man wait tend top military. Board administration amount race him technology class. Gas leg sign senior itself describe.,WO-17882,2024-05-19T04:31:36.262429,2024-05-23T04:31:36.262429,IN_PROGRESS,Former world edge. Discover save cost while city would. However itself trip remember mother music.,South David,GPS,86.2727045,171.564424,4420.88,"3 days, 0:00:00",LOW,81ae6d72-ac14-417e-94b1-2ddb4b72a568,086a9247-2173-4fe0-8bc7-37f146dce3b7,52.14,days,True,WEEKLY,,,2024-05-16T21:17:10.450631,2026-04-15T19:08:41.111592,d504e755-f41d-4cc3-a57b-8660652f1e16,4ed9e68f-f97e-4d92-a9a3-545b19eb13a7
8906d7ae-07bf-4793-8884-fcf6cf0938bf,d8cec599-00d6-4641-bcf6-6aae6d798d2b,34dcbc1a-d3ab-4c1e-ae41-74bce2f7ad66,2024-05-11T22:48:51.111302,,"So enjoy about standard address. Bank two green opportunity test high.
Remain find use degree organization partner. Benefit business surface dinner stand thought size.",WO-86188,2024-05-13T08:59:02.541379,2024-05-17T08:59:02.541379,HALTED,Study live idea way. Break of check parent. Lead within detail camera total.,East Richardchester,WELL,4.825426,35.938451,7262.89,"1 day, 0:00:00",HIGH,353f25dd-07d2-4d3c-9ad5-1b5e5ec00c0b,ce8f766e-041c-4139-8e39-0beb4382b441,46.08,visits,True,DAILY,,,2024-05-09T10:14:01.234671,2026-04-15T19:08:41.111934,3e0295e1-8cab-45cd-b306-c688ebfe6f94,17639e07-940d-44a0-959c-723105c25fd9
cb73bfee-ba80-4bfd-be1c-569caca4616a,cd79ed9d-99fc-4878-bbcb-3b3df59226f9,664eb1f4-0f02-4b63-aab2-9855a3767b74,2024-04-26T02:13:55.888059,,"Talk near choice tend. Skin population camera ok.
Indeed when close new energy key interview. Out culture action federal single.",WO-42106,2024-04-26T23:47:50.717306,2024-04-27T23:47:50.717306,IN_PROGRESS,Newspaper because serious affect next rise different. Education wear believe ready risk often.,West Kristina,ADDRESS,24.124081,-141.397583,48630.46,"2 days, 0:00:00",MEDIUM,3c772683-c6b6-4846-8fc7-640d269c8415,4e78a7e9-49e1-48b7-9800-4a1c34bc9afe,13.38,visits,True,DAILY,,,2024-04-24T01:49:59.687147,2026-04-15T19:08:41.112263,43e5cc17-1cb5-47b8-a4dc-f56f005856b0,0291c29c-5afe-47d2-8441-77548820e1ae
ef7c5ecd-e23b-4af3-8f44-458714a6d2e7,54f29160-579c-4454-afea-3f90f630d4bd,5eaf6aac-6102-4fca-9675-c7559ae63360,2026-04-15T15:44:39.252523,,"Authority get similar yet age natural name fear. Skill talk court part actually specific.
Guy agree behind bank. Blood final whom film contain current will material. Serve end one actually.",WO-90499,2026-04-15T16:02:52.196405,2026-04-19T16:02:52.196405,ASSIGNED,Wonder loss morning two high party. Herself program hit consider already push brother.,Lake Meganstad,GPS,7.1499825,58.333857,49899.19,"2 days, 0:00:00",HIGH,6bc5135d-4a38-4cf7-baac-5977df3f81b0,086a9247-2173-4fe0-8bc7-37f146dce3b7,79.35,loads,False,,,,2026-04-15T03:59:38.205777,2026-04-15T19:08:41.112554,7f3e7714-51a7-49ee-b080-28ddc079d6d9,5f33d142-f8ce-4da7-9b4d-1ec5e924933b
2bda0c88-6665-43ac-947e-5c879b6a4926,cd79ed9d-99fc-4878-bbcb-3b3df59226f9,223d6948-beb6-4177-bbc6-db80ddbbe012,2025-06-22T02:39:42.943159,,Race final peace street. Put day space role sure above whom.,WO-63276,2025-06-23T20:43:51.470530,2025-06-24T20:43:51.470530,CANCELLED,Positive response can age hair kind. Over accept right quickly.,Lake Samanthatown,GPS,37.4312965,-61.130893,44837.1,"2 days, 0:00:00",MEDIUM,424655c4-ff4f-4e4c-a29f-f6cdfe010e53,4e78a7e9-49e1-48b7-9800-4a1c34bc9afe,83.0,hours,True,DAILY,2025-06-23T01:04:23.201658,Safety concern,2025-06-21T15:21:40.995750,2026-04-15T19:08:41.113085,80588a28-7a84-4d68-ad29-231c8f7194e6,59350ac4-0036-49db-bd84-1051827ef490
67934996-d9e3-4132-9b75-8b76dd05a2cc,83853f5e-c1cc-4f0c-8566-d798f4b3342e,640b3bb3-f2f0-4602-8955-7a8ffabd44a7,2025-03-02T06:20:04.979314,2025-03-04T23:15:33.467327,Return hit computer. Stuff fire animal scene center. Might thank later ok deal through.,WO-94101,2025-03-03T20:52:30.518404,2025-03-05T20:52:30.518404,CLOSED,Pick job lot mouth.,East Kathleentown,ADDRESS,18.3103985,103.391257,23311.31,"1 day, 0:00:00",HIGH,e4eee4ab-21ca-4764-ae56-974b0433a2d9,086a9247-2173-4fe0-8bc7-37f146dce3b7,66.93,gallons,True,DAILY,,,2025-03-02T02:20:55.563812,2026-04-15T19:08:41.113414,31adfc07-6a85-4092-82c9-f85079ccadc3,3697f39d-9a15-433d-97fa-69c853aa1473
65fb3847-7df7-4a07-9cf4-680f8815fff5,d8cec599-00d6-4641-bcf6-6aae6d798d2b,34dcbc1a-d3ab-4c1e-ae41-74bce2f7ad66,2026-04-01T04:58:02.250194,,Pm trial my wall. Outside dream responsibility two. Now camera man effect our.,WO-03485,2026-04-02T03:32:54.943651,2026-04-07T03:32:54.943651,IN_PROGRESS,Item tend process real account. There per look method pass. Brother later than media social.,Ericton,ADDRESS,-56.6608755,14.134155,24320.86,"2 days, 0:00:00",LOW,353f25dd-07d2-4d3c-9ad5-1b5e5ec00c0b,ce8f766e-041c-4139-8e39-0beb4382b441,36.68,hours,True,WEEKLY,,,2026-03-30T21:48:43.122465,2026-04-15T19:08:41.113736,c330f9ec-f9f9-427a-b72f-2cd16ccb8a3d,af35cfac-1136-41f5-ba5c-6480b28aea05
0fa240b5-bee8-484e-8f8b-767f53e02d47,d8d8da12-0220-4369-b5b0-535c355a22c7,88c511c2-8c1e-442c-9ed1-d5017c094726,2024-08-07T00:04:02.584320,,Way probably I cultural again outside through travel. Sure human enter about each key.,WO-48109,2024-08-08T07:13:04.639256,2024-08-09T07:13:04.639256,REJECTED,Travel get most remember. Trip grow series magazine language.,South Sarah,WELL,-54.699629,135.079631,29442.49,"2 days, 0:00:00",LOW,9cb07870-85f9-47ce-8750-c33cce2f82a1,4e78a7e9-49e1-48b7-9800-4a1c34bc9afe,1.88,hours,False,,,,2024-08-04T12:03:44.483423,2026-04-15T19:08:41.114027,f4484d67-349f-4088-b391-d430c9111260,331e7a92-4b4d-4a65-972e-0f0a8b5a360b
28014eda-ed9e-4b8d-8834-6c48e1781cae,2a176a68-3d26-483d-b147-5cbd65c2dc42,0b969507-30c4-4933-b465-af089dff16bd,2024-12-22T12:40:36.841166,,Half level industry month moment rich. Town option during view buy institution.,WO-55593,2024-12-23T12:53:23.798007,2024-12-25T12:53:23.798007,ASSIGNED,Say speech eat other past. Management represent them.,Port Shannon,WELL,29.92394,-38.530547,5024.38,"3 days, 0:00:00",MEDIUM,06c21883-e7e4-40df-ad7c-3adfdef4680f,ec85f926-f00a-4d57-8835-f1f452018492,93.15,hours,False,,,,2024-12-19T15:47:43.781009,2026-04-15T19:08:41.114403,f703d663-4ccf-4927-a223-c9936489fb40,573327ba-d37d-49e6-a5f0-51d3dc5e9122
0277c7d5-59d6-4a2d-bce5-685e2606f151,d8d8da12-0220-4369-b5b0-535c355a22c7,7f893179-b166-4b75-9111-d61e648bf526,2025-06-28T05:06:06.057940,,"Treat worry make quickly. Growth source walk stage way really.
Billion trade PM any fund. From drive face green white thought.",WO-04910,2025-06-28T23:07:50.388958,2025-07-02T23:07:50.388958,IN_PROGRESS,Wait item matter amount travel. Myself player million want yes.,Williamland,WELL,-40.1799365,-22.188847,49092.95,"3 days, 0:00:00",MEDIUM,eec2d04f-b201-4d96-a8ea-7ebde78e5d1b,509beb3f-897a-4f8d-9d3a-fd081e1f4600,80.75,visits,False,,,,2025-06-25T20:07:58.557178,2026-04-15T19:08:41.114778,c400cfc4-c7f5-4ddc-9c1d-dd3198d6e0b8,cd34cb7e-b6f0-4f60-aa98-3669ddf93d6e
4ce8aa75-f39d-4789-ac51-6ae37dcc753b,54f29160-579c-4454-afea-3f90f630d4bd,22388918-384a-4cdd-b3c6-3f32ffe72d8c,2024-08-25T23:05:25.715750,,Chance staff film summer election. Create range coach manager star image kind. Million raise near kitchen take evening.,WO-39402,2024-08-26T19:58:06.918825,2024-08-27T19:58:06.918825,HALTED,Factor because rate issue.,Brandonland,GPS,78.0158865,-38.743204,28171.73,"3 days, 0:00:00",HIGH,d928f53c-1897-4872-8391-73c1d75cc721,ec85f926-f00a-4d57-8835-f1f452018492,49.52,days,False,,,,2024-08-23T15:56:38.648377,2026-04-15T19:08:41.115213,3ea59ab6-8a49-408b-84ae-74046a37e358,7fcb323c-8e16-49bd-b607-03f3380a7c85
40217a47-d266-4749-89dd-d5bd009dcd97,d8d8da12-0220-4369-b5b0-535c355a22c7,445b2acc-2760-4bd8-8d0c-353ebd1e2353,2026-03-10T18:20:46.732753,,Test little interest report daughter take public. Single can daughter. Ability American word song.,WO-07751,2026-03-12T10:19:40.739304,2026-03-13T10:19:40.739304,IN_PROGRESS,Into action seem. Board near lay fund.,East James,ADDRESS,-66.794316,42.169087,15135.8,"2 days, 0:00:00",HIGH,2ca48e40-63c6-4be7-9a1e-cc2626739115,ce8f766e-041c-4139-8e39-0beb4382b441,37.34,hours,True,MONTHLY,,,2026-03-08T00:39:02.799642,2026-04-15T19:08:41.115536,6890a60c-d782-4028-8bac-d5a86252faaa,29ebd38c-ca55-459e-9a5d-2ca00c520cdc
35452d56-9e1a-4783-b715-448834c997bf,d8cec599-00d6-4641-bcf6-6aae6d798d2b,22b09298-43b0-48bb-8958-0cff8a7e1a91,2026-02-22T10:46:19.869007,,"Law forward change lead catch. Purpose if through.
Lawyer finish account threat. Tough suddenly true type near among.",WO-95165,2026-02-22T11:50:10.089797,2026-02-27T11:50:10.089797,REJECTED,Report name allow firm anyone determine. Hot half easy wonder data.,Davidview,WELL,-27.3774315,62.041382,36189.68,"3 days, 0:00:00",HIGH,235632f0-1c0e-4954-9584-bd3027642d49,ce8f766e-041c-4139-8e39-0beb4382b441,82.09,gallons,False,,,,2026-02-21T10:18:36.047888,2026-04-15T19:08:41.115875,d1dea692-d873-4aed-ac79-f138054e5a19,9983c77e-0c71-4182-8179-8b1e2534e28d
f271de73-a026-4cce-9e2c-5f3a8a9339f9,83853f5e-c1cc-4f0c-8566-d798f4b3342e,747ad838-966c-42f7-b322-a9a9b71b627d,2026-01-25T06:53:06.854532,,Action whom especially article standard game record. College together strong difference defense treat standard seat.,WO-10559,2026-01-26T13:55:46.074423,2026-01-27T13:55:46.074423,REJECTED,Paper nature easy practice maintain deep. Explain matter mind require election feel.,Ronaldburgh,WELL,30.840723,-120.590161,41842.07,"1 day, 0:00:00",LOW,1a5d40c8-1040-4259-8e0a-5aa64cfe10a1,d24895a1-476d-492f-9608-a5fa43530a07,87.48,gallons,True,ONE_TIME,,,2026-01-25T04:30:32.774226,2026-04-15T19:08:41.116155,6ae91a92-45b6-4a09-a527-ec9ee24be9bb,393e8e58-573a-488d-bb3f-bf0eb2f546f9
f4b8cb7b-d51c-4c2b-a4fd-80f224139c32,2a176a68-3d26-483d-b147-5cbd65c2dc42,7f893179-b166-4b75-9111-d61e648bf526,2025-05-29T03:33:59.665234,,Skin standard ask night mention tend. Ago paper vote detail. Onto attention everything. About new president any their yes matter.,WO-96460,2025-05-29T23:16:42.761411,2025-06-02T23:16:42.761411,CANCELLED,Last woman material parent health world up. Pressure fill Mr health page opportunity.,South Lisa,ADDRESS,-59.9524285,129.952044,2929.74,"1 day, 0:00:00",HIGH,81ae6d72-ac14-417e-94b1-2ddb4b72a568,ec85f926-f00a-4d57-8835-f1f452018492,72.07,hours,False,,2025-05-30T16:03:02.021892,Safety concern,2025-05-26T16:36:53.859210,2026-04-15T19:08:41.116578,4c601f76-ade5-4f52-bc22-42d5e413a115,bd2dc11d-070c-465d-ab02-46f55245d2da
8e3a4948-5d03-4723-b48d-acbfe3f3bca5,e9f75d4b-f495-4b3b-b961-6e5fcc86158c,88c511c2-8c1e-442c-9ed1-d5017c094726,2024-06-17T20:45:16.278283,,Hard question defense baby share. News always political morning middle scene situation.,WO-77865,2024-06-19T00:50:50.332730,2024-06-23T00:50:50.332730,ASSIGNED,Nothing everybody return such health.,North Hannahfort,ADDRESS,4.413689,-163.003959,28121.98,"2 days, 0:00:00",MEDIUM,9cb07870-85f9-47ce-8750-c33cce2f82a1,4e78a7e9-49e1-48b7-9800-4a1c34bc9afe,79.63,hours,True,WEEKLY,,,2024-06-16T14:29:53.090001,2026-04-15T19:08:41.116956,bde81b41-8fc1-4f7f-91d0-59691e8ccc3e,918fdc4c-a875-404d-8058-05fdb5c3ef54
8897ed51-6bee-4f3d-9885-52326cda2db3,a729f017-ee54-49b2-b16f-e5d33223b156,32016199-ef60-445d-bf14-13c5616b4f19,2025-12-06T05:28:47.282953,,"Peace middle run. Herself reduce health poor yeah.
Either current beyond movie three social with southern. Firm admit of evening similar often trouble.",WO-01818,2025-12-08T03:58:36.628811,2025-12-10T03:58:36.628811,ASSIGNED,Tree close plan. Full attack method town front education stop.,Jessicaside,ADDRESS,-44.249094,123.772099,36396.01,"3 days, 0:00:00",MEDIUM,244f677a-34cb-4e34-8526-046ac5fe640d,4e78a7e9-49e1-48b7-9800-4a1c34bc9afe,19.76,days,True,ONE_TIME,,,2025-12-05T19:20:52.173736,2026-04-15T19:08:41.117438,3ffb3751-7d9b-4ef2-896b-48089ac49a1c,92317b4d-5eab-4c03-a3c3-3afa188b999a
103d4ad8-e050-448f-bbef-e82d1133c81c,c46d5c72-fd67-4f18-8924-a3d1249f4dfb,cb02ddbf-6d9b-4525-a9bb-805fbc0b6fc7,2024-05-27T22:55:50.915679,,"Beat once break rate. Civil old parent mean face.
Seem describe message. Really however officer couple building take.",WO-65948,2024-05-29T10:20:28.786549,2024-05-30T10:20:28.786549,CANCELLED,Chair cost son by product lead property. Weight tree fine event police buy training finish.,West Isaac,GPS,-22.7017155,-173.358988,35276.25,"2 days, 0:00:00",LOW,72dfe0e3-5cd5-47cc-b3bc-e3b8596b6e61,cad184f7-eb41-4fb5-8d99-23e0d00e60e3,17.51,gallons,False,,2024-05-28T13:31:24.265804,Safety concern,2024-05-26T23:13:44.784030,2026-04-15T19:08:41.117767,edcf6f74-ed68-4d49-8364-badfd553ac06,05a8512c-2d6a-4452-8ee4-73b690d9b594
