work_order_id,assigned_vendor,assigned_at,completed_at,description,due_date,current_status,comments,location,estimated_cost,estimated_duration,priority,well_id,created_at,updated_at,created_by,updated_by
4436ff95-9907-44f9-926b-d19342c88ab7,3e45d3ec-4483-4235-88c0-8042057d7cff,2026-03-18T04:40:03,,"Begin oil identify standard sound. Inside cut wish better.
Rock charge card east.
Rather in matter another remember.
Near only just out system strong. Mother including stuff.",2026-03-26T14:53:29,unassigned,Understand reach especially put consumer. Throw enter several let on.,Lake Maria,7444.23,39,urgent,fe66602b-ecb2-4bfa-884b-3b40b05f0302,2026-02-16T07:12:24,2026-04-07T10:18:07.941036,f1628162-5fbc-411d-b15b-6ac1c5a462cd,ffcccd11-84be-45c8-ad63-542e6bd35611
447b8c5d-41b7-4199-90e2-88d70a1ef778,9469901e-742d-4522-9bba-d1217399375e,2025-12-30T00:09:35,,Share theory surface. Phone policy laugh table democratic your prove. Stand represent will box statement nearly indeed late.,2025-11-29T03:27:28,in progress,See dark still imagine. After over decade plant. Kitchen between card relationship style anything.,Port Cameronburgh,1673.57,57,urgent,f438b685-e230-42cd-bf14-5469acb5c568,2025-04-22T05:45:29,2026-04-07T10:18:07.941208,c79c15fe-349b-4aee-bacc-669ca159f987,806fd4b9-f9d5-4ccb-8ef3-ad1142b177a3
314196df-f134-4f5f-8faa-5c18497d5d70,9469901e-742d-4522-9bba-d1217399375e,2026-03-06T10:15:47,,"Management gas away believe. Central service but.
Goal he husband. Activity hotel especially help spring always.",2026-01-22T02:14:49,assigned,Job six travel group conference also. Use hotel beyond individual. World sound effect money.,Jacksontown,1973.91,33,urgent,cc6b5a32-4f32-4a4b-8cb9-14c4cd447a59,2025-11-28T13:46:44,2026-04-07T10:18:07.941389,d46659bc-3408-48b3-8004-57e70616888b,803b44db-f551-49bf-8b3b-bb540514cf18
75528986-9afc-4e47-b2bb-0f196d377edd,3e45d3ec-4483-4235-88c0-8042057d7cff,2025-12-09T13:18:24,,"Safe evidence call land. Standard check general present human save fly prepare. Spend politics value total bad reach network.
Own all industry thank sign. Power direction prove someone cover since.",2026-03-13T00:01:32,in progress,Sister everybody serve hold would. Girl none almost yes tough tax suggest. Determine light speech.,South Richard,4100.95,18,urgent,30d0a7b2-e936-429a-802f-51418eade57a,2025-11-14T14:47:10,2026-04-07T10:18:07.941576,818e86c0-653b-4564-a049-944030cba6fd,68635665-bd8a-4b00-9366-285397594be9
1be84844-915a-4709-aae1-ab78cadfdda2,00ce0e5d-dabe-447d-8247-cec72142417d,2026-01-01T06:47:47,,Believe relationship account maintain important box trip. We give be future bad people. In model past these describe base scientist them. Stop arrive traditional rock shake star try.,2026-03-08T10:50:48,in progress,Think attack we network direction save give. Program time production speak.,West Elizabethland,651.68,48,routine,9774c0b5-6317-4794-bf97-42efa48f1dce,2025-10-26T17:38:44,2026-04-07T10:18:07.941751,fbad8b15-3c09-4a81-a591-cb804f8d455c,5c568942-a736-4e5a-b15a-ad94a196140f
48ee005d-cff4-4c5f-bb02-15a54aa51b93,159610a4-4b4f-4948-abd0-c010992f70a8,2026-03-21T18:00:10,,"Certainly fine speech customer kitchen investment tax. Likely provide wish Congress these station.
Occur enjoy edge write knowledge price mouth. Simple boy size media.",2026-03-30T17:45:09,assigned,Require number another. Crime whom speak hour. Simple half miss.,Timothyside,1441.6,55,emergency,186200fb-53e0-4a56-baf0-cafe6b69edb3,2026-03-11T15:24:29,2026-04-07T10:18:07.941974,24ebe2a2-f391-4f40-baca-c27e4d0d9bd6,939db2fc-4042-434b-8160-d1746a44a644
e9e5be2a-e36d-4f7b-929a-f2007a5739f6,38939c64-27d8-477b-adbf-3eb952a9ff97,2026-04-04T13:55:15,,End hope away Democrat senior rather against. Tough quite grow. Information now industry manager those develop.,2026-04-13T22:43:14,in progress,Defense writer forget answer act card computer. Language per good fire increase.,Michaelburgh,6206.01,2,emergency,1978fe38-03b4-42a6-a4a9-0884c7f3af98,2026-03-22T00:17:01,2026-04-07T10:18:07.942131,4eace900-2b0b-4842-be98-2d3ae12d4710,d64b0822-8d51-4d49-89a4-783b32d361f1
80672066-67a7-45e8-be29-603058976caf,ec609920-5b8b-4710-99cf-185d2b003772,2026-03-28T12:20:46,,"Painting writer system turn decision truth moment. Consider Congress technology very fast.
Phone serve own staff entire light. Sing system want institution. Today good over also.",2026-03-29T23:59:47,unassigned,"Experience learn successful late prove art. Enjoy among pay.
Somebody PM do key authority use.",New Adamview,2899.25,13,emergency,51ca7b96-72d2-4eb0-8c58-e0e0074f6858,2026-03-27T02:26:27,2026-04-07T10:18:07.942312,b7eee933-3969-41bf-9bd8-e3e94dd1a334,c415ed5f-7b4c-47d6-8957-556efa387c02
36c850b1-3dbc-449c-96f2-3efa44a13245,3e45d3ec-4483-4235-88c0-8042057d7cff,2025-10-12T05:29:27,,"Director quickly walk lead manager like civil. Maybe purpose beautiful buy culture memory fear.
Organization record still trip can put push administration. Sit do court church.",2026-02-20T17:48:19,unassigned,Activity reality through society. Task heart myself life. Affect probably debate live.,South Kevinview,9344.04,54,routine,79a1931c-3d03-43f3-b9a5-69caf18b43ff,2025-09-18T00:01:31,2026-04-07T10:18:07.942491,3a1584ae-be2f-47d1-9c5e-5a1b6c42ff10,fdbb8366-6116-4381-b194-06d2d7bf6ab9
4af4558e-ba2f-4705-88f7-f36919629001,38939c64-27d8-477b-adbf-3eb952a9ff97,2026-02-27T12:39:48,,"Himself maybe any capital case. History set garden ago according left. Under our loss whatever ground.
Talk feel left material these return learn. Yes relate drop floor. Approach war now personal.",2026-02-27T23:10:59,in progress,Share real would. Fall produce PM current owner.,Mossbury,9613.25,34,urgent,600ff490-cf6d-4fb9-97a2-f24a0457b52d,2026-01-31T20:13:24,2026-04-07T10:18:07.942727,2ebd06aa-6ad0-4562-9f3c-640b0228e83e,bbe6eee1-8115-4b2c-a22b-319af82de623
d3a89886-4eaa-4d85-9aa0-423289065598,ec609920-5b8b-4710-99cf-185d2b003772,2026-02-20T19:22:20,,"Mention amount today minute. According art single response.
Capital door if mention job evidence rich. Visit police traditional situation fill. Down local center according.",2025-08-27T14:01:39,unassigned,Cost already agent note others. Company clearly class. Increase yard over prepare training but ago.,South Peter,5868.47,10,emergency,d05489c3-cf4a-49c6-840c-5f7bc11506f2,2025-08-03T09:21:52,2026-04-07T10:18:07.942963,81de09e2-d96d-4e2b-b13c-cc39d3b209d0,767e061d-8628-40d6-8f81-62769b9c6d7d
8dbe04fb-9298-4332-803f-e40bde9cdfd1,3e45d3ec-4483-4235-88c0-8042057d7cff,2026-03-27T14:35:07,,"Big goal manage coach full. Human court imagine bank suffer.
Loss case consider wish bad magazine nor information. We evening line natural sister environment. Think call know your ahead.",2026-04-06T12:53:16,in progress,Baby stay oil foreign his. Free will draw head opportunity bit he.,West Taraberg,8649.97,26,urgent,08d7a575-b2cd-4102-92e6-261b6319675f,2026-02-20T14:28:02,2026-04-07T10:18:07.943162,b767f771-af46-43a4-8335-172eccf0a99c,eda3134d-ca7a-435d-ad2a-7acd6b50e775
60d89735-3b35-4e49-97a4-68a7f6163d94,9469901e-742d-4522-9bba-d1217399375e,2025-11-23T15:27:25,,"Size politics politics look. Security action reflect yet. Situation only and letter stop.
Spend firm wish character live. Group bring Republican former year deep born eight.",2025-12-23T03:52:21,completed,Democratic if activity million live care. Executive laugh else. Learn would throughout country.,Desireeview,5993.41,40,routine,f438b685-e230-42cd-bf14-5469acb5c568,2025-08-24T15:00:17,2026-04-07T10:18:07.943348,ab53765c-6321-431b-a7d3-575636cb48e9,0330731e-1ce0-42bd-8acc-20b230f04f5b
94adfe96-6556-4473-8429-b38ae281336f,ec609920-5b8b-4710-99cf-185d2b003772,2026-03-02T22:59:56,,"Section including positive student war many by. Point body item security.
Expect head list from manage. Area project sure up.",2026-04-13T12:20:37,completed,Person sense remain condition feeling. Add why include live hold join.,Lake John,4538.02,46,emergency,d47bdfe5-723b-4d3c-a04f-5d09ab41a81b,2026-02-12T20:50:53,2026-04-07T10:18:07.943542,7f9492dc-6b90-4a24-a3b0-a557db533ed7,0342453d-db63-45da-b3c2-2a4432fb5f7f
bf5a266b-eb42-46e3-a3fb-d95e4953c583,9469901e-742d-4522-9bba-d1217399375e,2026-02-08T01:59:15,,"Law why little. War four really could language school.
Anything my everybody particular author a instead. Successful become tend perform.",2025-09-03T11:53:40,in progress,New well could. Charge as start practice.,South Hollymouth,5004.99,34,routine,9774c0b5-6317-4794-bf97-42efa48f1dce,2025-04-14T05:20:15,2026-04-07T10:18:07.943743,9ac15679-84c5-477c-bd6a-6f855288860c,45988649-30d2-49ed-ba47-bc808c75726f
1dbce237-2ebc-4a3d-afc7-71e977f05fdc,ca08ace8-52c5-4d85-8659-6c4ca8d07a0c,2026-04-04T14:21:16,,Local care thing method understand speech option. Relate color dark oil catch. Television mouth reveal. Chance commercial out lot arm.,2026-03-02T19:23:26,in progress,Relationship small best imagine. Us stay level language share.,South Philliphaven,111.9,12,emergency,185a873d-df59-40d1-ad4c-4609f608b033,2026-02-22T14:22:09,2026-04-07T10:18:07.943928,49e548cc-2265-42fc-ab85-5157dec072bc,26371d4e-d093-41ec-a6d2-dd746aab3583
c142b17d-80d1-4806-b237-adbcbf7b2c80,38939c64-27d8-477b-adbf-3eb952a9ff97,2026-02-28T02:26:41,,"Sport long what sort subject gun. Leg perhaps often improve mouth responsibility thank crime.
Door daughter manager fact hundred gas this. Staff administration summer vote turn.",2026-02-01T22:27:46,unassigned,Number defense recognize north cost home evening. Process fly onto follow big.,East Bryan,4340.97,39,urgent,69cefa9a-d560-4a17-a13d-a5652e00e8a1,2025-12-17T10:18:39,2026-04-07T10:18:07.944098,11a12b28-92a6-4e80-b702-9440843e8e0d,c1e43b67-179a-4520-a7e7-cca28834e0b4
539086df-0d74-44ef-899c-4dc11db6d2c1,ca08ace8-52c5-4d85-8659-6c4ca8d07a0c,2026-03-15T08:14:13,,"Better public claim information present how event. Bed tonight home style.
Simple us first physical raise try kind. Language back center clear.",2026-01-24T17:52:03,completed,Question class very ball anyone kid. Child none policy trouble vote various rate.,South Zacharyport,4783.5,50,emergency,11b3fac4-0a2b-48f6-88bd-d93fcb533461,2026-01-20T15:28:27,2026-04-07T10:18:07.944304,35d2385c-cd01-4965-8cdb-30c71b7644cc,9d0aebfa-7f33-4a3a-8d76-7e8eb1b26742
4c7548aa-dcee-41c4-b74e-3c814137648b,159610a4-4b4f-4948-abd0-c010992f70a8,2026-03-18T15:08:17,,Professional shake he spend three. Able argue factor believe reveal fire.,2026-01-19T06:12:22,unassigned,Large good social every challenge. Cell woman dinner push focus.,Longstad,3419.86,27,urgent,9877b53f-f558-4a80-9047-f136e062e325,2026-01-11T04:37:35,2026-04-07T10:18:07.944531,0b06fab8-304d-40b1-a3df-ceef7ce256d0,49e548cc-2265-42fc-ab85-5157dec072bc
5681f6d9-edbf-465b-8087-c16e0732e868,4195973a-1e8f-47c7-af89-4b7e5e46de81,2025-12-29T13:40:53,,"General option someone fall. Mouth wind recognize point customer. Meeting share start fact tax fly entire.
Another rest speech star. Resource fast along decide truth.",2025-11-19T05:41:18,completed,Sort issue stand no place cold defense. Forward above should son this clear.,North Mckenzie,2776.42,64,emergency,d0bf40fa-83f2-4c23-898b-3cb9013ee7fc,2025-09-28T14:46:59,2026-04-07T10:18:07.944697,430ba17a-1099-4883-812e-40954622bd12,ce68c4db-77ff-4e3f-8633-1925033e15b0
2d97c3d5-3b7a-4e61-9194-f77517366871,9469901e-742d-4522-9bba-d1217399375e,2025-11-25T20:41:53,,Deal style night medical cover thank write then. Surface my at perform note unit than. Whose attention staff play there produce allow.,2026-01-20T20:44:52,assigned,Middle accept woman store.,Samuelstad,9297.34,33,emergency,186200fb-53e0-4a56-baf0-cafe6b69edb3,2025-09-16T05:58:56,2026-04-07T10:18:07.944846,dbd832b0-fb6e-4bfb-9828-0251e07c22eb,586c26d9-697e-4e95-b9e3-146889af2f92
64370eed-c7c2-4df4-808a-8daa7ba732b5,3e45d3ec-4483-4235-88c0-8042057d7cff,2025-10-20T22:04:54,,"Draw morning everyone item ask area service. Administration within state. Someone across to.
Article into candidate fight. Quite better lawyer game. Material offer field have present hot mind local.",2026-01-09T03:38:23,assigned,Attention term successful hospital. More clearly local wrong.,Sandramouth,8963.96,12,urgent,93215096-0b30-4bd1-8932-efa7bf5e7fd3,2025-10-15T11:03:21,2026-04-07T10:18:07.945064,d104610e-9c37-4968-b578-54e33cc377e1,59b7b211-c90a-416d-a957-f98d937f77b2
99d5a57e-940c-4f2b-8f05-7d18be552759,159610a4-4b4f-4948-abd0-c010992f70a8,2025-12-06T12:13:34,,"Attack individual medical late much. Subject also read carry people must federal. Both special scientist.
Pay ahead although future dream. How degree public step big middle.",2026-04-10T10:32:47,in progress,New form mention car and behavior eight that. Military determine manager month.,North Ashleytown,1467.45,70,emergency,9877b53f-f558-4a80-9047-f136e062e325,2025-11-21T22:42:29,2026-04-07T10:18:07.945247,c03a78b1-7ae7-43a1-9c6b-0cc2f0b9738a,78d15b48-a2a8-4d1f-94eb-de4f58401c3e
1ce11f19-64c1-4a24-b396-c13af2386c6c,9469901e-742d-4522-9bba-d1217399375e,2026-03-19T19:47:10,,"Outside full to reveal deep then speak. Become respond teacher city few fact never.
Road particularly grow tax authority require. Room bill no for. Cut least identify company enough.",2026-03-04T07:57:13,assigned,Finally like system either dinner forget close. Sell trade least boy voice free.,Cartermouth,8308.34,34,urgent,cc6b5a32-4f32-4a4b-8cb9-14c4cd447a59,2026-01-10T20:20:17,2026-04-07T10:18:07.945426,9a85ad4e-aecc-41bb-810c-57b3e65f510d,c27d8b92-b6b5-4ed4-bcb1-03faef8e62ac
a6ba1bbe-89c3-4ab0-95eb-b48b12d3fc2e,3e45d3ec-4483-4235-88c0-8042057d7cff,2026-04-05T22:18:15,,"Only consumer newspaper blood. Alone dinner night. Ten own worker develop.
Conference model defense news need similar position. Seem board phone.",2026-02-25T17:38:35,in progress,Together senior four food.,Thomasborough,5614.08,5,routine,93215096-0b30-4bd1-8932-efa7bf5e7fd3,2026-02-11T14:15:27,2026-04-07T10:18:07.945643,86f40099-f466-4c54-8590-8e4914310208,2e765a83-feba-4076-a8d7-937e7d664bfd
4b633a48-7bbe-458c-b3be-973b90e69e59,9469901e-742d-4522-9bba-d1217399375e,2026-03-26T11:42:53,,Also reason another left much detail base. Book most another evidence sell. Tv medical wall difference win. Student go still single north.,2026-04-04T12:05:42,unassigned,Company rise color mind space keep military. Chair ago discuss.,Smithfort,348.49,37,urgent,186200fb-53e0-4a56-baf0-cafe6b69edb3,2026-02-24T08:44:30,2026-04-07T10:18:07.945828,68635665-bd8a-4b00-9366-285397594be9,d64fbd39-bc5e-42e8-a63f-5a8a968425d6
a694f87d-1b53-4499-8527-364fa5b48b86,159610a4-4b4f-4948-abd0-c010992f70a8,2026-01-20T20:05:52,,Bring term trade head forward field. Police cell there before amount yet speech bag. Pattern material the team through system. Accept value magazine light nor agency.,2026-03-29T15:22:10,unassigned,Research investment collection field piece. Fast market music decision.,Petersonton,7461.52,35,urgent,53ed9b92-d8a2-4f53-99e9-d402d60b4249,2025-12-01T17:47:32,2026-04-07T10:18:07.946494,44617e29-1078-4d54-95c0-b200e3268f0a,6d691680-2fab-4dc5-bb22-25986f9e2d5e
cce5f031-1cf2-4f60-ab02-d96f71dcad77,f9923c46-a9a0-4f7d-95b8-8b0238e212f8,2026-03-25T17:24:26,,"Carry rise hot understand. Executive owner sort decision note return try.
However future drive nice. Wait son fire discover kitchen walk.",2026-03-11T18:50:03,assigned,Quickly call huge size. Thank good direction. Growth enjoy say seek spend.,New Vincentland,4286.75,49,routine,2cddc46a-a152-402d-9bba-a81dbc516e31,2026-01-19T08:02:37,2026-04-07T10:18:07.946673,7cae2cb8-5844-4179-9292-9bab19fd3708,4ff7bb8f-712a-4e5b-a2bb-03429112baaa
e9052d3a-4c0d-41f8-8809-776ff15d779f,ec609920-5b8b-4710-99cf-185d2b003772,2026-03-07T14:18:34,,"Part relationship place about next teacher reflect. Nice meeting pattern account information.
Agent put level full old animal be. College place wrong.",2026-02-03T13:57:54,in progress,Instead sea service indicate sense lay. Stock these discussion join study.,Port Markfort,2860.19,70,routine,53ed9b92-d8a2-4f53-99e9-d402d60b4249,2025-11-11T08:38:22,2026-04-07T10:18:07.946873,a2d83c69-6457-472c-951f-24f5fee13ffe,1415c974-2e76-4143-ac72-78339489dc8e
8f75780e-9b55-458c-b4c3-7c01e6906271,f9923c46-a9a0-4f7d-95b8-8b0238e212f8,2025-10-07T05:20:27,,Around whether phone food hospital. Who sort through lead. Adult commercial available suggest spend eight happy.,2026-01-06T13:15:29,unassigned,Either it spring science large four difference. Four human road about now.,New John,8455.86,8,urgent,37a9df9a-0c80-4672-a86c-4467822d2688,2025-07-25T10:27:25,2026-04-07T10:18:07.947033,8052aba3-7012-4aed-b222-f76eee382b15,ed33097d-267d-4f0f-a288-fb5a351a310c
32781474-0f63-400a-88ca-cc19ef019d5d,3e45d3ec-4483-4235-88c0-8042057d7cff,2025-12-10T08:50:35,,"Statement rest floor during would. Join to economy sister.
Many great weight officer perhaps probably attention. Each hospital south morning ahead consider.",2025-12-17T04:50:14,assigned,Offer most experience home. Practice food result job much realize.,South Andrew,3884.61,10,routine,93215096-0b30-4bd1-8932-efa7bf5e7fd3,2025-11-09T20:45:28,2026-04-07T10:18:07.947246,7651cb43-3929-459d-84d7-b6031fb976d7,73b4bd4b-4a69-4a24-9f6b-15be44c6a68c
d4537f76-7c1b-450a-ae81-3dbe6eb2e6fd,ca08ace8-52c5-4d85-8659-6c4ca8d07a0c,2025-07-22T23:37:05,,"A explain Congress put service nothing explain rest. Area good bring boy bag.
Responsibility indicate enjoy. Into very evidence however question event past.",2026-01-01T06:20:09,assigned,Develop hard once part where even. Worker wide ago it discuss go wait.,South Linda,578.09,9,urgent,1fab7158-54bc-4774-afef-3c6f0c7b6c1e,2025-04-10T12:43:45,2026-04-07T10:18:07.947395,d206c472-b7e6-40f7-b5f7-b957527dcb15,80c90ad2-a181-4fa0-8a12-c55fbfa92cbb
8f0ea971-a261-4a2d-9536-5e5092739f71,4195973a-1e8f-47c7-af89-4b7e5e46de81,2026-02-16T07:19:17,,"Popular animal cut lot report central. Finish nice how result within can.
Letter method fly car man color build. Store anything city nothing anything recent woman.",2026-02-26T18:50:47,assigned,Fly throw response evening early gun left explain. Lot take easy near.,Michellemouth,1647.8,10,emergency,9e14feee-755f-49ec-be19-c06f1a246c94,2026-01-26T15:33:32,2026-04-07T10:18:07.947550,266baaed-3f40-420c-b514-976e0bc3b8bc,05a1307b-7f45-4e39-843e-a1b00051f1b1
2ccecf05-223e-4d6d-937f-9375214b85a4,159610a4-4b4f-4948-abd0-c010992f70a8,2025-05-26T19:33:09,,Eat throw worker fast yeah. Leg increase threat radio spend next high although.,2025-06-07T03:26:55,unassigned,Drop two step attention TV paper. Right probably answer various talk two. Accept or buy here back.,Port Nicholasville,7835.27,54,emergency,53ed9b92-d8a2-4f53-99e9-d402d60b4249,2025-05-24T20:50:56,2026-04-07T10:18:07.947721,7b45ca3f-3856-4e60-a3e4-dcbc0b83f1fd,ffcccd11-84be-45c8-ad63-542e6bd35611
3fe37850-61d8-4c98-8b41-59960a658e77,9469901e-742d-4522-9bba-d1217399375e,2026-01-19T13:51:53,,Artist church special research open Republican chance. Law voice important use. Pretty message care break body financial make.,2026-01-30T22:58:05,unassigned,Attention music guy happen. Level environment detail including reason wonder just.,Kyliehaven,1505.02,26,urgent,a41c79e5-d234-4a3a-b605-12a2e3fcb0de,2025-11-04T19:47:34,2026-04-07T10:18:07.947921,98064d74-1376-4f59-b9a1-142dc91ee995,d8dcdf2c-ed9f-478a-9aba-6d01da06d643
10a35762-0aaa-4e4b-9b00-856d409c8924,ca08ace8-52c5-4d85-8659-6c4ca8d07a0c,2025-07-26T03:33:26,,Say several sell example. It energy might buy television goal. Job responsibility mind must sport own.,2026-02-24T07:58:14,unassigned,Letter spring sport stage stuff commercial. Enjoy development receive prevent be.,Lake Ashley,8386.84,22,emergency,ed9154bc-fd30-4171-9034-88e50ffb17d8,2025-06-12T17:20:05,2026-04-07T10:18:07.948087,c3d8ffa6-a2d2-4a8e-bb2b-a0ab6e248a15,b247daea-594c-4186-87b0-3a00aa7fc519
7d3b8efd-518d-463c-ad73-eb5b2c087466,f9923c46-a9a0-4f7d-95b8-8b0238e212f8,2026-03-03T13:17:17,,"Page car conference. Simply air large quickly understand fine.
Movie sell let raise church head town sign. Sit foreign position along herself. Born or station suggest call specific.",2025-11-24T17:10:38,assigned,"Behavior imagine enough first effect. Series employee recently body.
Stay third administration.",Lake Samantha,508.01,68,urgent,f438b685-e230-42cd-bf14-5469acb5c568,2025-05-04T18:47:32,2026-04-07T10:18:07.948255,41c8913c-f6c6-4746-80b9-2e6571d1e695,9efc73bd-390f-4543-a269-5ec98415b8bd
2f22fc83-7270-4eec-a5db-b79ea266573a,ca08ace8-52c5-4d85-8659-6c4ca8d07a0c,2026-04-01T00:54:50,,"Score push federal suddenly between help. Rule present nor section. Administration among suffer though reality culture.
Structure mother piece around. Name sell again question.",2026-03-28T13:16:08,in progress,Tv operation star some. Citizen already agree human wear as.,South William,1285.03,42,emergency,11b3fac4-0a2b-48f6-88bd-d93fcb533461,2026-03-18T20:34:32,2026-04-07T10:18:07.948434,76c387ba-02db-405f-b432-1ce01e1682c3,65a150c6-ca89-4ce0-b4da-2a8acc3a3632
4c3e74b2-5556-42fd-bf08-72471cdbc864,f9923c46-a9a0-4f7d-95b8-8b0238e212f8,2025-10-26T07:07:14,,Up model reduce name. Throughout his PM of quite could national. Certainly poor study reflect hot family. Health table continue take eat lead also.,2025-11-04T17:46:08,assigned,Middle cultural story network central reduce employee. Activity everyone market budget need page.,New Nicoleshire,165.67,32,emergency,6edce5fb-6eb5-4d55-bfd0-c35755c6e9cc,2025-09-27T18:32:19,2026-04-07T10:18:07.948623,8a5ced8a-f0f4-43b3-abf1-7c63086d0ac0,0fc3191e-18c0-4c3f-8373-7da14ed78129
7b56b01a-4de5-4141-83b2-463d638abf44,ca08ace8-52c5-4d85-8659-6c4ca8d07a0c,2026-02-05T02:02:47,,"Impact over animal professor fund. Interview out herself.
Someone deal subject seat message nation use drug. Design all ever discussion what. Home pay decide upon bill anyone action.",2025-08-26T10:29:01,unassigned,Material miss set population debate. Everything economic trial cost.,Shariport,8704.35,60,routine,73f34cca-7069-47c7-bbe4-07ffcddfe219,2025-07-24T21:57:21,2026-04-07T10:18:07.948869,ef66b782-6536-4412-8524-9290307dbebd,563955be-6e46-46db-bfec-6ad0d14265f9
1ab57f8a-9cdd-4a3b-b4e3-a0c6d511b873,38939c64-27d8-477b-adbf-3eb952a9ff97,2025-11-28T08:42:26,,"Sit response beyond Congress physical now without. General care side base this.
Growth room authority. Certain order similar model hear speech defense. Friend point miss worker vote.",2026-03-15T11:06:57,completed,Although offer gas per amount bank. All child finish yes reason financial.,Port Erica,9638.99,5,routine,69cefa9a-d560-4a17-a13d-a5652e00e8a1,2025-04-21T10:54:00,2026-04-07T10:18:07.949043,1673aae2-7e48-4918-99f9-1c06c4a11259,bdfbac3e-a58f-4e2e-b7e9-027fc1e9bc85
40465c71-6e30-4ae1-8b3b-2b28c2dbcb6f,159610a4-4b4f-4948-abd0-c010992f70a8,2026-03-21T22:45:47,,"Generation cultural buy movie manage she. Source vote admit car. Wish single any amount.
Image seat reason price seven billion. Answer one pay add fire when.",2025-11-18T15:04:32,completed,Run fight morning sea quite bed. Politics owner focus would. Culture every benefit.,New Nathan,8142.5,1,routine,9877b53f-f558-4a80-9047-f136e062e325,2025-08-16T23:02:34,2026-04-07T10:18:07.949219,87deb185-04fc-4134-970c-a231eeef4cdb,f521a4f2-a592-44b4-8a4b-dbc05a553d93
1a788d8a-a04e-4c62-be15-73f032cf1cd1,ec609920-5b8b-4710-99cf-185d2b003772,2026-04-06T03:14:31,,"Want former hear lay too he avoid. Low so firm center.
Animal crime recently. Performance weight he toward ready. President window deal watch size. Note study set hospital test.",2026-04-01T04:08:44,completed,Top professor science think three. Practice sometimes physical or.,Lake Joshua,9475.75,6,urgent,b7bdc965-f9b1-45f8-b871-cfeb9e7c797b,2026-01-31T18:52:27,2026-04-07T10:18:07.949383,2cbc2654-4fd4-40e3-b27f-978d19cc022d,d8ce7170-e90e-43d1-b514-0e1100ff0d57
466dead7-af00-4b08-81a1-b85a2e0d3e85,159610a4-4b4f-4948-abd0-c010992f70a8,2025-12-16T16:39:55,,"Follow walk would serious new fall maintain. Particular receive specific door.
Investment down partner improve speak class. Nothing tell alone before three. Choose need science now.",2025-11-28T07:27:24,unassigned,Believe similar worker huge ball those set. Necessary think dog share particular wrong.,Patrickmouth,6100.29,41,urgent,17dab9f7-fc8f-4bea-b9a5-8a0b11775be2,2025-07-18T01:43:09,2026-04-07T10:18:07.949546,9d740dd4-86c1-4812-9be3-663b90865977,814f2c89-2c95-438f-8d97-c3b0402f700f
0a831203-09fe-4f07-9715-b7635a54bff0,38939c64-27d8-477b-adbf-3eb952a9ff97,2026-02-10T04:53:01,,"Six enough certainly cut night hand. How risk represent training establish huge.
Purpose know whole mother source type. Against other attention then go. Certain us card say send crime chair.",2025-11-04T01:44:12,completed,Energy in join travel. Travel effect time blood sort possible it. Goal radio exist into modern.,West Lisa,3357.23,48,emergency,8c2e0996-ae50-4c15-bc25-3b3b3a95896c,2025-07-02T13:00:40,2026-04-07T10:18:07.949747,9baa7b7c-c58e-466f-af54-540f7f44e816,606dff29-1d7c-498f-9f98-fdb130edba59
52762034-8210-491e-9edc-966119e50e30,3e45d3ec-4483-4235-88c0-8042057d7cff,2025-12-07T21:55:49,,Work both call feeling culture then tree. Understand little surface heart dog western feeling.,2025-12-09T16:30:46,in progress,Serious morning argue admit type science dream. Have almost movement draw office reveal.,East Rachelburgh,6363.04,66,urgent,08d7a575-b2cd-4102-92e6-261b6319675f,2025-11-20T22:50:44,2026-04-07T10:18:07.949930,43e9f627-0185-4a71-81c8-00d5de0fa8a5,81de09e2-d96d-4e2b-b13c-cc39d3b209d0
35cc33b9-2871-4f24-8ce6-41c4ac232d48,00ce0e5d-dabe-447d-8247-cec72142417d,2026-03-19T15:29:56,,Once paper admit compare job parent national. Full avoid reflect able drop art. Hand market call senior stop world. Officer prove tonight recent staff impact resource.,2026-03-22T21:57:34,assigned,Right fear physical note class great onto open. Growth avoid member audience bed piece he.,New Ericville,3053.47,45,urgent,d0bf40fa-83f2-4c23-898b-3cb9013ee7fc,2026-02-23T01:05:34,2026-04-07T10:18:07.950092,d31e2ff4-2a74-4d7d-9ccf-27230f0eed36,5c66a987-fd92-4f91-98e8-3462041422f9
