work_order_id,assigned_vendor,client_id,assigned_at,completed_at,description,estimated_start_date,estimated_end_date,current_status,comments,location,location_type,latitude,longitude,estimated_cost,estimated_duration,priority,well_id,service_type,estimated_quantity,units,is_recurring,recurrence_type,cancelled_at,cancellation_reason,created_at,updated_at,created_by,updated_by
ca37cf48-1e98-45d5-a6bc-646a5fac20d6,50c30f52-4308-407c-9eb4-b29e37f557ed,356ce91e-3d69-4c12-b975-4b312ca62840,,,"Tonight after across chair someone which. Than political course available short suggest.
Area data Congress none early baby range. Assume find imagine. Perform lot report story.",2024-08-06T09:20:27.951446,2024-08-07T09:20:27.951446,UNASSIGNED,Across behind money full during law according. Stop beyond try seek.,Lake Nicholasborough,GPS,-17.895844,135.691962,28835.55,"1 day, 0:00:00",MEDIUM,67ecc6c7-eaa5-48fb-8d16-0122a790562a,ac86be1d-d7b3-4c92-8b98-7ec02635ae30,34.56,gallons,False,,,,2024-08-04T16:59:48.773705,2026-04-14T22:27:58.551789,b3d7a4c6-7490-4a66-896e-67dad9bcccd7,3d2acc08-af8d-42cd-9c9e-48e2c8b76a04
f0d93563-0d81-4cdf-aca5-243576de4e72,5ced5175-6a4b-4acc-aaad-6eee39aba902,8c3a4539-ec08-4eec-8c87-7fac73e41ebf,2024-07-07T05:04:01.378987,,Million local ask stuff body pass bag social. Director conference change charge born high. Treatment true view medical.,2024-07-09T01:01:47.422296,2024-07-12T01:01:47.422296,HALTED,Too base million who. Trouble street enjoy modern.,North Richard,ADDRESS,-34.6061485,150.50383,26223.5,"1 day, 0:00:00",LOW,29d49267-b770-4abd-869d-5a629f8b3f12,4c95d91b-4137-4b45-b42a-a196743fc247,33.46,days,True,MONTHLY,,,2024-07-04T20:41:54.820427,2026-04-14T22:27:58.551962,54832c74-dcc1-4812-b8ce-6fcc80164558,fb022c57-4cdf-4da0-a36e-7325a32ed560
1034d472-c673-4277-8d43-31bbb6d2cef7,6c08930e-b79b-414d-83b8-3fa71b4f7c3f,60815a70-5acd-44c4-a751-93e113cd6c10,2025-11-19T06:33:18.985996,,Last story skill left film this. Member majority action treatment. Article TV together partner discover recently trial individual.,2025-11-19T17:50:24.284545,2025-11-21T17:50:24.284545,ASSIGNED,Should international fly series move face matter. Shoulder side face into figure.,East Kim,ADDRESS,50.621421,141.408733,41507.66,"1 day, 0:00:00",LOW,9ada0405-95fb-42f6-9d60-30ec500058e2,b67890c1-ebe9-46e1-ae62-8f124981c06c,7.16,gallons,False,,,,2025-11-18T21:10:36.686095,2026-04-14T22:27:58.552156,8f7627d7-a47e-4790-9fcc-ae5090bcf17d,edaf9412-959c-46fb-88ef-284a6e5730a2
fa458c6f-bd3e-4b04-bed5-504eb11965da,50c30f52-4308-407c-9eb4-b29e37f557ed,ec9afc83-9b84-4021-9754-c0005ccd8025,2026-03-18T12:12:37.220139,,Painting plant professor win within. Natural both do player police available particularly too. Loss account trial theory boy bad security.,2026-03-20T03:22:36.261754,2026-03-25T03:22:36.261754,CANCELLED,Thought star painting size case the.,Lake Nicholasfurt,ADDRESS,61.8968945,-24.790324,43664.73,"3 days, 0:00:00",MEDIUM,363d4af0-d16b-4010-8267-8fd3d084a036,3f4dd684-ecaa-4e82-8ad1-5d2ad55c4b71,64.01,visits,False,,2026-03-20T01:11:16.079021,Safety concern,2026-03-16T05:07:03.711706,2026-04-14T22:27:58.552344,411c1b9b-36fd-41ae-a8d3-9a7cbb127c19,9cef00e8-1756-4df4-a305-2a14cdd8213f
07eaff79-477d-41ea-82a9-fa38f41d2d09,69f88d89-cd4d-4b68-9ea5-d47749a320b4,356ce91e-3d69-4c12-b975-4b312ca62840,2024-07-31T14:58:37.399049,,"Strong moment him. Various the special individual difficult. Because east second learn.
Me table technology yeah everybody entire with control. Care determine some prove song.",2024-08-01T21:08:43.350283,2024-08-06T21:08:43.350283,IN_PROGRESS,Set student knowledge focus. He not structure all get.,Barnettborough,WELL,-61.677143,-85.665917,35701.95,"1 day, 0:00:00",HIGH,70f10b6a-77b2-4d81-b3d7-6890872d6399,3f4dd684-ecaa-4e82-8ad1-5d2ad55c4b71,51.81,days,False,,,,2024-07-29T16:39:49.805965,2026-04-14T22:27:58.552581,83773906-9148-49d0-98a9-9f9c13e1debc,4667a079-0f79-4c9c-a248-d7a4c621c168
0d4dbafa-9cc7-46d6-a330-3b846af52563,17732c75-269b-4b58-ab32-71c952da0df9,fe0211e2-1730-4140-a5c5-59d09ab75793,,,Rest majority allow determine believe sport artist. Business down deal newspaper in through. Place buy beautiful investment finally detail many.,2025-11-30T16:47:03.032634,2025-12-02T16:47:03.032634,UNASSIGNED,Current single talk involve short. Popular pattern value. Produce product region next check reason.,East Cory,ADDRESS,-67.5065525,-133.211218,46124.02,"1 day, 0:00:00",HIGH,351bee4a-92ee-46ca-b34c-beffe540ff5a,b67890c1-ebe9-46e1-ae62-8f124981c06c,85.38,hours,False,,,,2025-11-29T21:48:36.366369,2026-04-14T22:27:58.552756,bbf017c2-6c72-4701-9a06-b89627edf02a,5bce669a-eea8-4869-964b-1b0d96c41293
6a6afdbe-83d1-49e3-938c-75036fc10b5f,17732c75-269b-4b58-ab32-71c952da0df9,ee25c6e3-177b-48c8-b18a-46587520acf9,2024-12-05T09:42:59.342448,,"Who color security by military. Respond prevent act early with economic. Range science near term certain.
Standard human current time student same. Son middle just possible fact.",2024-12-06T19:40:37.075363,2024-12-07T19:40:37.075363,IN_PROGRESS,Start security social test may best. Customer company happen teacher weight.,South Jenniferfurt,GPS,24.80535,49.113353,49555.5,"2 days, 0:00:00",MEDIUM,13c5f586-a6ef-46bc-9289-9bae0180a683,4834abaa-4e84-40a0-99ac-22d1de101e14,49.11,gallons,False,,,,2024-12-03T03:13:41.376686,2026-04-14T22:27:58.552927,5803ecfc-d366-4276-88aa-68c83228ef91,107f7953-bb61-489c-95b3-140a62297e21
43488481-1e78-433f-b51c-4e147ff4a9b8,69f88d89-cd4d-4b68-9ea5-d47749a320b4,8c3a4539-ec08-4eec-8c87-7fac73e41ebf,2024-05-18T01:39:48.736829,,"Middle guess challenge. We inside pattern head. Carry shake effort even blue.
Congress evening purpose study. Notice minute method decision on.",2024-05-19T08:25:07.268999,2024-05-22T08:25:07.268999,HALTED,Or southern next task well move themselves. Benefit forward best modern.,East William,WELL,18.368286,54.335725,603.24,"3 days, 0:00:00",MEDIUM,29d49267-b770-4abd-869d-5a629f8b3f12,4c95d91b-4137-4b45-b42a-a196743fc247,7.69,hours,True,MONTHLY,,,2024-05-16T21:49:54.590394,2026-04-14T22:27:58.553101,67d4bb1c-3a45-4f3a-afdd-9a90ac953cd1,76137e59-72be-4327-bfd3-390f4a175cac
182e371f-7524-4ed6-8fa6-36cb75b67b11,17732c75-269b-4b58-ab32-71c952da0df9,ee25c6e3-177b-48c8-b18a-46587520acf9,2024-12-17T20:41:33.234462,2024-12-22T19:34:30.806768,"Base pass sound too notice. Dream case will season.
Situation general pattern weight. Process artist technology there fly send. Personal front himself other lay light.",2024-12-18T20:05:31.754444,2024-12-21T20:05:31.754444,CLOSED,Beautiful fund draw soon structure. Enjoy story agent happy learn.,New Jesse,GPS,10.893198,56.545368,41805.77,"3 days, 0:00:00",LOW,13c5f586-a6ef-46bc-9289-9bae0180a683,eddc4c1a-19a5-4a63-9507-8896001501c0,76.43,days,False,,,,2024-12-15T14:43:52.224947,2026-04-14T22:27:58.553320,3d63b27b-6841-4f6a-b8c4-180d1021d644,697a596c-b7bb-4372-9ed2-a71604d04380
339b160d-3cc9-4d6a-ab00-c56f3722833b,be8a628e-281b-4291-9256-99fe58793399,544d6c6a-b83d-4633-b842-e6fab7e2bc69,2025-12-28T21:11:06.582592,,"Television to raise. Data light business sign born.
Top design true every. Save friend sense consumer save box third cup.
Deep professor join. Example itself growth successful maybe environment.",2025-12-29T09:28:09.459263,2026-01-01T09:28:09.459263,IN_PROGRESS,Use open traditional. Son police number great. Much power talk. Way seven provide while hotel.,East Matthew,WELL,61.08938,-28.477458,19668.14,"2 days, 0:00:00",MEDIUM,20d9b627-c980-4e80-a914-7b619d6ce63a,3f4dd684-ecaa-4e82-8ad1-5d2ad55c4b71,54.56,visits,False,,,,2025-12-27T10:07:18.169241,2026-04-14T22:27:58.553519,9be42b7f-8fce-452e-8b31-e163aeb99c00,0fe14385-26a7-4e03-9609-798835febd64
54e6f75e-a5c3-4207-bca4-e298e672a128,6c08930e-b79b-414d-83b8-3fa71b4f7c3f,dcf8d00a-1526-417c-8284-f84cf5b1252f,,,"Republican piece now television audience.
Establish window plan note sense opportunity approach.",2025-06-27T11:07:27.086309,2025-07-02T11:07:27.086309,UNASSIGNED,Phone range fight statement political test require. Each upon condition world anything mind.,West Bryan,ADDRESS,78.1150875,56.130741,28271.7,"1 day, 0:00:00",HIGH,74e633ef-edc4-4867-8dde-102a0c9da18d,b67890c1-ebe9-46e1-ae62-8f124981c06c,56.38,gallons,False,,,,2025-06-25T01:57:28.387185,2026-04-14T22:27:58.553673,28d5579b-1e0e-4495-997e-95edbe8991e1,4944c3b9-97b4-41ea-95e7-3636c4cdd654
09a7d835-253b-4073-a649-64b1ab6fef1c,6c08930e-b79b-414d-83b8-3fa71b4f7c3f,687456b3-4e9b-455e-9e96-0649a8fef3d4,2024-07-15T03:22:00.711608,2024-07-23T16:18:47.709306,"Suddenly service situation light. Road which politics concern along. Manager many environment short.
Throw total short world rule make. Instead bag century reach production risk ever.",2024-07-16T22:29:58.852607,2024-07-21T22:29:58.852607,CLOSED,Memory recent large benefit this leg. Assume opportunity whose take.,South Vanessaport,WELL,23.7183095,2.797202,48137.65,"2 days, 0:00:00",LOW,887431ee-f9ac-41ab-8c69-ed8edcc4d628,b67890c1-ebe9-46e1-ae62-8f124981c06c,25.28,days,True,DAILY,,,2024-07-13T14:27:41.035712,2026-04-14T22:27:58.553867,24331894-5e08-4675-9daa-ac32ae57144d,21ccf874-7199-49c9-ba88-e22d1a895821
73f8d5d4-1f95-4d4a-a224-4d56f19d2d1b,45d86630-0ae0-48cf-91da-da4e2553be12,687456b3-4e9b-455e-9e96-0649a8fef3d4,,,Probably talk increase population. Over memory recent own cover. Account return center her. May agent rate like head write.,2025-12-13T08:15:42.236743,2025-12-17T08:15:42.236743,UNASSIGNED,Example town have school popular discussion expert.,Nelsonmouth,WELL,85.890352,135.431438,22132.36,"2 days, 0:00:00",LOW,887431ee-f9ac-41ab-8c69-ed8edcc4d628,b67890c1-ebe9-46e1-ae62-8f124981c06c,86.11,loads,False,,,,2025-12-11T19:21:35.766962,2026-04-14T22:27:58.554042,6477f7ff-7f5d-4e5d-a694-5103aca7cb6d,90a60660-ac0b-4bfa-811d-504717814e6d
f20742f8-f43f-44ef-bb96-72b20abfc4e8,be8a628e-281b-4291-9256-99fe58793399,fe0211e2-1730-4140-a5c5-59d09ab75793,2024-10-07T08:13:46.437855,,Each them sit policy sense party data measure. Money standard network decision rest. Miss so change mention where decision.,2024-10-08T02:54:29.608214,2024-10-11T02:54:29.608214,IN_PROGRESS,Organization study pattern go. House child rest impact piece continue because.,Denisemouth,WELL,-18.9264385,50.964117,38531.08,"1 day, 0:00:00",MEDIUM,80b84377-66d7-4ef6-b04b-60b873aae793,b67890c1-ebe9-46e1-ae62-8f124981c06c,95.26,gallons,True,WEEKLY,,,2024-10-05T12:48:48.631464,2026-04-14T22:27:58.554203,63e0a284-2e64-4ff8-8964-6427266ec30d,0ace32b7-a217-4792-80c2-47a9d0c5b4cb
f607ceb5-3234-4cce-8009-4b9b18f58a84,45d86630-0ae0-48cf-91da-da4e2553be12,d33031c3-bb47-4170-a667-97d3e7826c55,,,Describe gun realize exactly protect. Window cell bring remember. Charge worker realize marriage hope.,2025-04-18T03:14:03.495162,2025-04-21T03:14:03.495162,UNASSIGNED,She space produce model alone let need. Such meet Republican great simple. Agree perform open.,South Mary,GPS,76.0601275,123.512315,7551.8,"2 days, 0:00:00",MEDIUM,20559f9c-a3d1-4cb2-bf81-3b4780ed02a1,4c95d91b-4137-4b45-b42a-a196743fc247,38.18,hours,True,WEEKLY,,,2025-04-14T04:45:20.026995,2026-04-14T22:27:58.554367,0a4f43e1-5231-4b7d-a2f9-0cc27dfdb25e,616f9252-6339-43b4-b095-ba8254a868f8
aaebd0a7-0ad9-4deb-bff8-1a5035931be7,45d86630-0ae0-48cf-91da-da4e2553be12,fe0211e2-1730-4140-a5c5-59d09ab75793,2025-01-26T14:16:28.340877,,Player lead change center investment that her push. Various down alone challenge action least. Score task live information their writer.,2025-01-27T13:39:57.241413,2025-01-28T13:39:57.241413,CANCELLED,"Couple soon occur health. Travel I outside decade.
Necessary first on onto among.",South Rebecca,WELL,84.6951225,-145.800003,23508.76,"2 days, 0:00:00",LOW,62c662f7-b719-4960-8734-6af4d36499e8,b67890c1-ebe9-46e1-ae62-8f124981c06c,48.93,visits,False,,2025-01-28T00:54:40.114867,Resource unavailable,2025-01-24T10:44:09.550154,2026-04-14T22:27:58.554583,813fe994-3cbe-42b0-ae9b-d91688965c58,48a46bd5-48cf-449e-b749-21c8384472c3
c7eba098-8024-4a43-b24c-2a53fb631bfe,17732c75-269b-4b58-ab32-71c952da0df9,dcf8d00a-1526-417c-8284-f84cf5b1252f,2025-11-24T16:36:51.780752,,"Possible as still word rather official over.
Attorney finish nation threat. On serious threat however measure which doctor. Need argue certain maybe.
Himself appear very season number change.",2025-11-25T15:52:44.077214,2025-11-27T15:52:44.077214,ASSIGNED,Reach head member. Morning already human check agree. Street hotel according.,Port Triciastad,ADDRESS,-82.190206,7.318103,28628.16,"2 days, 0:00:00",LOW,b3798b84-0dd8-423e-b649-40a131592de7,eddc4c1a-19a5-4a63-9507-8896001501c0,84.78,days,True,WEEKLY,,,2025-11-23T03:15:14.915950,2026-04-14T22:27:58.554785,1cc8b50c-98b8-410f-8bab-2ac92a4b37f8,1e715c05-c83f-449e-92a7-b13757507c0f
c718b4f8-b9d6-41b6-9a5a-6603a7b94db4,00321811-ce92-494f-a69e-9f15b650ca5f,922982f5-4278-444a-9836-a8797cdb696d,2025-07-10T05:34:34.450184,2025-07-18T05:24:27.350198,"Form Mrs off step live record. On unit final entire left. Successful among course thank bar so simply.
Or agree lay. Market training shoulder final economy. Collection beyond spend ok candidate.",2025-07-11T22:29:58.300706,2025-07-16T22:29:58.300706,COMPLETED,History son scene Congress kitchen. Sort indicate idea together.,North Melissaview,GPS,-30.7102625,111.788501,2568.71,"2 days, 0:00:00",HIGH,3fff67a1-02f4-497e-adc9-174104035e62,eddc4c1a-19a5-4a63-9507-8896001501c0,29.64,gallons,False,,,,2025-07-07T17:29:51.656594,2026-04-14T22:27:58.554991,4315b715-00c3-417e-a99b-6801012b9cc8,acd76ced-5452-4ce9-b57d-c23c69a123ac
2393ce5b-5459-4836-b68f-5b6fceb79fed,be8a628e-281b-4291-9256-99fe58793399,dedd0eb6-b2fc-496d-994f-79ecc414767e,2026-04-05T01:32:45.126199,,"Blood player which law whom Republican event. Sometimes they woman the. Girl serious play skin.
Even image thousand price game. Law along test image.",2026-04-07T00:12:16.401071,2026-04-11T00:12:16.401071,HALTED,Do soon bill into. High win member finally.,West Ryan,GPS,-60.6666855,58.518741,2751.49,"3 days, 0:00:00",HIGH,4ce2e342-fd3f-4bbe-aad7-bfc3c0e43195,ac86be1d-d7b3-4c92-8b98-7ec02635ae30,56.75,loads,True,WEEKLY,,,2026-04-02T19:48:35.221403,2026-04-14T22:27:58.555174,a872713a-91a6-4aaa-a7a9-c7129e0edc33,0a4f43e1-5231-4b7d-a2f9-0cc27dfdb25e
37d80bfe-4873-4436-82cc-34963f23e485,45d86630-0ae0-48cf-91da-da4e2553be12,ee25c6e3-177b-48c8-b18a-46587520acf9,2026-01-27T06:37:25.159346,,Father lead store small knowledge. Dinner per south book. Away recognize test newspaper thing get.,2026-01-28T06:56:52.376700,2026-02-01T06:56:52.376700,HALTED,Born hear politics prevent federal general find.,New Jonathanhaven,WELL,49.2052205,-143.179556,44254.61,"2 days, 0:00:00",HIGH,8dee7a67-491c-48d5-bf66-8a440bc991d4,4c95d91b-4137-4b45-b42a-a196743fc247,26.87,visits,False,,,,2026-01-26T18:49:34.280820,2026-04-14T22:27:58.555408,979390a5-cbba-4e8e-a717-fb7a96b154d4,ece5c74c-aaaf-49bb-a7a7-6348eb3cdc4e
ecabdb71-1c50-4ffa-b0e8-a124202f6b20,17732c75-269b-4b58-ab32-71c952da0df9,60815a70-5acd-44c4-a751-93e113cd6c10,2025-01-19T10:14:13.875053,2025-01-26T04:48:56.491991,"Present age organization all up. Rich his economy about against.
Public energy require buy particular answer.",2025-01-20T11:39:04.189946,2025-01-24T11:39:04.189946,COMPLETED,True history and one. Less ground force cell industry.,South Jonathan,ADDRESS,-87.0281115,-11.285255,1285.79,"3 days, 0:00:00",LOW,0c481a95-02a4-4df0-ace2-91131d50d01a,4c95d91b-4137-4b45-b42a-a196743fc247,65.0,hours,False,,,,2025-01-17T19:17:38.727792,2026-04-14T22:27:58.555580,bbc8baf4-af0f-4212-aa0c-b39ee18fe3b0,68c54ae4-1862-419b-a4e7-23f2de02e41f
de017f99-344d-49c3-809c-ca0a55feaad8,69f88d89-cd4d-4b68-9ea5-d47749a320b4,cd2ffd86-4229-4cf5-8196-bbc447762911,2024-06-20T16:27:23.761973,,Before attention past become customer. Information response wind within choose guess. Those community American include music.,2024-06-21T04:05:22.077439,2024-06-26T04:05:22.077439,CANCELLED,Bad camera author. Popular usually whole manage skill.,New Roger,GPS,49.6780625,-72.52011,27163.14,"3 days, 0:00:00",MEDIUM,fc2b6c48-778f-45f2-8707-c81d6eab6330,3f4dd684-ecaa-4e82-8ad1-5d2ad55c4b71,67.55,loads,True,ONE_TIME,2024-06-22T12:27:56.840276,Duplicate order,2024-06-18T17:18:59.918768,2026-04-14T22:27:58.555762,f41b2ff4-f9e3-4e07-a123-e3ef3aafe8ff,411c1b9b-36fd-41ae-a8d3-9a7cbb127c19
bb984f65-4635-4765-be0b-3b856fd06e71,be8a628e-281b-4291-9256-99fe58793399,fe0211e2-1730-4140-a5c5-59d09ab75793,2025-05-28T15:05:34.840583,,"Perhaps court game. Use fund who goal majority.
Information sure wait item mouth off. Speak same charge see like while live.",2025-05-28T22:19:33.409591,2025-05-30T22:19:33.409591,CANCELLED,Police seven beyond condition. Fear cultural company rather couple green environmental.,Mitchellshire,WELL,-27.5288465,-172.192276,18838.79,"1 day, 0:00:00",MEDIUM,c8dbad2c-f030-4477-8ea7-6bf5da81794e,c023f54c-5638-484f-ad7e-cff78fc43d6b,1.93,hours,False,,2025-05-30T08:44:14.232617,Client cancelled request,2025-05-28T05:56:06.480161,2026-04-14T22:27:58.555995,9c44f75a-6849-4f9f-9303-3f20ec36825e,016b4643-0046-4fac-8639-0d0986718114
81a7c4b5-e566-4077-8e5b-110a31544821,17732c75-269b-4b58-ab32-71c952da0df9,fdbcc9da-c12c-4210-9472-0b40b76e6448,2025-07-13T14:47:56.073642,,Within outside health loss night many notice hot. Parent design modern board notice position thought. Nothing no stand radio evening brother doctor process.,2025-07-14T16:26:04.034282,2025-07-19T16:26:04.034282,ASSIGNED,Shoulder cold big generation thank. Item interest poor seven series time blue. Radio answer off.,Hannahshire,ADDRESS,-42.1364365,-26.787511,40516.52,"1 day, 0:00:00",LOW,f2277196-af58-45ae-93cb-9259f5fc3bd2,59387f64-573a-4d23-bc4c-94103f3802ff,98.03,loads,False,,,,2025-07-11T08:05:23.866669,2026-04-14T22:27:58.556229,34c4ca68-0087-471e-8ab0-14e420c2adf5,98ee9aee-b134-4a5b-823a-c0483348e5c7
a9d79f70-ac5b-446e-a142-f69a3e9bfa08,69f88d89-cd4d-4b68-9ea5-d47749a320b4,356ce91e-3d69-4c12-b975-4b312ca62840,2024-12-20T00:20:50.746834,2024-12-25T11:43:24.667337,"Effect Mr base executive. Everybody happen down number reduce run sure month.
Control soldier water it task affect better positive. Close fill woman his. Very this single Mr.",2024-12-21T11:05:39.693534,2024-12-25T11:05:39.693534,COMPLETED,"Shake TV nearly conference happy level manage. Range follow drive.
Current than from.",North Brittany,WELL,75.0593615,-164.240756,28670.56,"2 days, 0:00:00",LOW,70f10b6a-77b2-4d81-b3d7-6890872d6399,4c95d91b-4137-4b45-b42a-a196743fc247,55.63,days,False,,,,2024-12-18T05:10:08.853012,2026-04-14T22:27:58.556431,2050bd74-7adc-43a9-9770-5aea637c35b8,98ee9aee-b134-4a5b-823a-c0483348e5c7
be344973-4940-4e6d-977e-b1a09faba4c8,17732c75-269b-4b58-ab32-71c952da0df9,dedd0eb6-b2fc-496d-994f-79ecc414767e,2026-04-11T12:58:16.446474,,Brother away start political cultural star here. Because husband industry trade cultural base until.,2026-04-12T20:19:18.671923,2026-04-13T20:19:18.671923,IN_PROGRESS,Your determine computer protect many. Family west eye century upon war. Food American final woman.,Harrischester,WELL,-10.115975,-90.27184,46711.39,"1 day, 0:00:00",HIGH,5d3e9c60-f840-405f-b69c-4d517aeb8a84,4834abaa-4e84-40a0-99ac-22d1de101e14,73.16,loads,False,,,,2026-04-09T14:44:42.845545,2026-04-14T22:27:58.556636,4db70885-c2b0-4047-96e8-e19b89f3745e,64a0847c-087d-45c5-a08c-80253d589ddb
0b8340d0-523d-4f4e-9e5e-411e55a53024,17732c75-269b-4b58-ab32-71c952da0df9,fdbcc9da-c12c-4210-9472-0b40b76e6448,2025-03-18T19:10:45.357034,,Range wait dark main meeting. Particularly item process hope picture until hit. Impact create throughout become discussion determine major.,2025-03-18T22:44:16.414960,2025-03-23T22:44:16.414960,HALTED,Executive we window change ahead industry thing. Wife learn finish identify.,New Williamton,GPS,23.698547,125.186504,32227.83,"3 days, 0:00:00",LOW,f2277196-af58-45ae-93cb-9259f5fc3bd2,eddc4c1a-19a5-4a63-9507-8896001501c0,85.53,loads,True,MONTHLY,,,2025-03-18T08:10:43.097113,2026-04-14T22:27:58.556807,8f7627d7-a47e-4790-9fcc-ae5090bcf17d,add55726-03ef-4479-ab97-eaa6f2a39163
41850120-8c37-455c-a260-761b5e64b7a7,5ced5175-6a4b-4acc-aaad-6eee39aba902,544d6c6a-b83d-4633-b842-e6fab7e2bc69,2024-04-25T11:36:39.215108,2024-05-02T10:20:57.521945,"Say stand whether same bad any light. Story practice tough.
Spring guy of form the best reach or. Word along check culture. Drug save change difference must.",2024-04-26T21:22:35.923615,2024-04-30T21:22:35.923615,CLOSED,Or himself their summer. Forget fight rather someone heavy least.,Thomasburgh,GPS,68.422051,95.915646,2824.75,"2 days, 0:00:00",HIGH,105e7faa-4a05-4f7c-b0b7-735825f463dc,ac86be1d-d7b3-4c92-8b98-7ec02635ae30,45.44,hours,True,DAILY,,,2024-04-25T07:39:43.957805,2026-04-14T22:27:58.557004,0beb14d6-8d09-4ba7-b488-ffc669c16517,e5b99192-a23d-43db-85cd-f6376da6fb26
bc2d82c1-3a55-4ed6-b687-034da78da30e,50c30f52-4308-407c-9eb4-b29e37f557ed,ec9afc83-9b84-4021-9754-c0005ccd8025,,,"Even two despite build face base relate.
Red plan opportunity eat. Again front ability lawyer weight.",2024-06-12T01:37:40.038164,2024-06-14T01:37:40.038164,UNASSIGNED,In city increase role over business for. Use somebody decision glass sort doctor.,Adriennemouth,ADDRESS,-57.579338,-127.14834,47909.9,"1 day, 0:00:00",LOW,53f0ea2e-d5b0-41a1-92d8-8c4cf21c7580,59387f64-573a-4d23-bc4c-94103f3802ff,17.28,loads,False,,,,2024-06-11T00:36:34.810786,2026-04-14T22:27:58.557186,7e437639-aa7f-4a66-98de-1dfda90ee89a,384a95c6-ebe0-4cd1-9374-08f4eaed4faa
b4fde907-9cb7-49ca-81f1-20b674b39bc8,17732c75-269b-4b58-ab32-71c952da0df9,271b3705-a1b9-40e4-9dc3-267b73539f55,2025-05-21T19:28:47.876585,2025-05-29T07:06:42.517232,"Expect animal course seat.
Plant option however clear or best. Which Mrs support really from.
Human stage house central. However on leg to.",2025-05-23T15:25:59.972348,2025-05-27T15:25:59.972348,CLOSED,Discussion ability phone air young clearly behind. Region recently stuff common.,West Michael,WELL,-73.5767515,-41.315551,42105.13,"1 day, 0:00:00",LOW,db487e36-0dec-42eb-b1c6-8a1ea375a2c5,4834abaa-4e84-40a0-99ac-22d1de101e14,47.88,loads,False,,,,2025-05-20T05:37:59.567921,2026-04-14T22:27:58.557375,96db0323-91c5-4b06-a531-12ab492afa8d,0b6f3781-f6ed-44e9-9853-92e5b5199749
3face518-c24c-432a-a115-1cdca79c5a68,50c30f52-4308-407c-9eb4-b29e37f557ed,ec9afc83-9b84-4021-9754-c0005ccd8025,2024-06-30T04:48:58.708413,2024-07-02T22:19:22.045626,"Ago simply teacher audience above.
Rate I safe talk financial real. Somebody wind use mission.
Finally model street audience black home hotel. Difficult exactly to argue.",2024-07-01T12:48:49.964643,2024-07-02T12:48:49.964643,CLOSED,Thus agreement keep recognize. Interest statement TV drug just between.,Patrickview,ADDRESS,-62.931595,49.988601,29157.26,"1 day, 0:00:00",LOW,53f0ea2e-d5b0-41a1-92d8-8c4cf21c7580,ac86be1d-d7b3-4c92-8b98-7ec02635ae30,91.75,visits,False,,,,2024-06-29T02:36:22.411675,2026-04-14T22:27:58.557558,4d005ed0-852b-4f69-8c94-0f12ccb09d63,ea4a3231-a27f-4765-8e1f-8f415b065c3d
25b85e01-a9ca-4981-8291-6650b6cbf4f5,45d86630-0ae0-48cf-91da-da4e2553be12,ee25c6e3-177b-48c8-b18a-46587520acf9,,,"Friend significant war wife. Cell visit adult mission. Realize personal should.
Now make operation control way important. Return fund generation inside glass represent.",2024-12-01T22:40:19.664823,2024-12-05T22:40:19.664823,UNASSIGNED,Answer majority spend. General finally save throw note strategy.,Mossshire,WELL,-88.1378515,-34.38228,30731.56,"2 days, 0:00:00",LOW,8dee7a67-491c-48d5-bf66-8a440bc991d4,4c95d91b-4137-4b45-b42a-a196743fc247,11.08,hours,False,,,,2024-11-29T23:54:05.705635,2026-04-14T22:27:58.557751,2c56d214-852f-40c5-9d45-bd1a09c529d0,01d0201b-a79a-46ab-92b8-0cb6b91e99eb
f98d3d2c-dba2-4bc0-a677-35bb200eedff,be8a628e-281b-4291-9256-99fe58793399,fdbcc9da-c12c-4210-9472-0b40b76e6448,2025-01-25T00:29:23.018772,,Travel might cover miss thing most must. Card only we bag red home. Public little at true leader continue. Respond race religious value small read.,2025-01-26T17:42:33.826027,2025-01-31T17:42:33.826027,ASSIGNED,Trouble discussion maybe now drop five father. Pretty exist total who condition as.,Knighttown,GPS,63.785632,153.070164,22943.86,"2 days, 0:00:00",MEDIUM,9522783b-21f0-4853-b836-c07e4211ca85,3f4dd684-ecaa-4e82-8ad1-5d2ad55c4b71,88.11,days,True,ONE_TIME,,,2025-01-23T20:03:17.163029,2026-04-14T22:27:58.557970,1593c3bb-cccc-4866-a016-dd92e8a877a4,813fe994-3cbe-42b0-ae9b-d91688965c58
2837a429-7605-4072-874d-7725712134fa,6c08930e-b79b-414d-83b8-3fa71b4f7c3f,dcf8d00a-1526-417c-8284-f84cf5b1252f,2024-06-11T08:19:10.181709,,However information let others head. Sell democratic style identify. Five really card arm.,2024-06-12T11:44:02.167306,2024-06-17T11:44:02.167306,REJECTED,State no north against. Least brother dinner long hotel. Whom professor continue.,Henryview,WELL,10.902783,28.288569,1108.28,"3 days, 0:00:00",LOW,74e633ef-edc4-4867-8dde-102a0c9da18d,b67890c1-ebe9-46e1-ae62-8f124981c06c,59.7,gallons,True,ONE_TIME,,,2024-06-08T17:39:10.654740,2026-04-14T22:27:58.558155,3ba35b3e-d06f-49b5-ae32-ab3ed65cf3c4,4057c94b-c77d-4771-a737-c0cc40018cd6
4ad702f6-ba09-4637-ad57-605b80d8a3ae,00321811-ce92-494f-a69e-9f15b650ca5f,75c7e517-dddd-43b4-b8d5-e7eb922003e3,2026-01-04T23:04:20.317622,,Executive industry with page win rock thought. Grow than very join general full.,2026-01-06T14:56:54.908897,2026-01-10T14:56:54.908897,CANCELLED,Nearly lose hotel employee. Attack expect total professor kid knowledge imagine culture.,Jessicaburgh,GPS,-87.5404065,-2.558163,7314.8,"1 day, 0:00:00",LOW,46538246-445c-4643-b106-c4bb91b94703,59387f64-573a-4d23-bc4c-94103f3802ff,13.64,days,True,DAILY,2026-01-05T12:22:55.045507,Safety concern,2026-01-03T23:39:32.036514,2026-04-14T22:27:58.558320,4d38bafd-68bd-4d5a-be17-2ccc0e68bb50,af75e498-5a85-4382-8d66-d5659d471720
