id,assigned_vendor,client_id,assigned_at,completed_at,description,work_order_name,estimated_start_date,estimated_end_date,current_status,comments,location,location_type,latitude,longitude,estimated_cost,estimated_duration,priority,well_id,service_type,estimated_quantity,units,is_recurring,recurrence_type,cancelled_at,cancellation_reason,created_at,updated_at,created_by,updated_by
58cc2942-03cf-4054-af16-6a4e37b768b8,3717f5e0-8ae1-4f1b-a417-590176d14f60,028545bf-3cab-4c72-9cdb-f40b5b7308fe,2026-01-30T06:24:20.506413,,Alone laugh report deal small difference drug age. President you interview keep feeling seem second. Evidence simple morning mention alone between its.,WO-94221,2026-01-30T20:25:07.920117,2026-02-01T20:25:07.920117,IN_PROGRESS,Learn weight take travel thing per.,Autumnhaven,ADDRESS,54.5850685,-30.282721,39451.96,"2 days, 0:00:00",LOW,4122088a-61b2-46a7-985e-2b410d7e692f,1d15cc9c-bbe5-46c9-81bb-d76c6d53997b,76.87,days,True,DAILY,,,2026-01-27T22:43:46.988364,2026-04-16T05:41:23.251398,801d4529-4cd4-4eb2-ad59-3ae4c6b83cc0,e64d299a-7e6d-4737-9360-0c73232e545f
e382f036-e2e5-4f83-9866-cbc16574cd7b,0662f3bb-2c28-4b44-acfe-56565d827f1f,00433d9c-81cf-4058-bf6a-fed7ddb39ed2,2025-03-22T10:25:28.231195,,Drug quickly suddenly stand. Station structure direction social fire.,WO-85872,2025-03-23T22:15:21.514507,2025-03-24T22:15:21.514507,IN_PROGRESS,Address then data special.,East Amy,GPS,-26.966701,-57.994221,12475.32,"3 days, 0:00:00",MEDIUM,70fd92c8-cb17-49a2-b48d-99d44cfc707d,f63e6700-3590-44d4-93ee-620634a189eb,57.81,loads,True,DAILY,,,2025-03-21T10:32:14.465216,2026-04-16T05:41:23.252928,bd4c38a8-14f0-4725-9b57-9feed2b1e6cf,f4138753-bd9e-40c0-9a4c-92d88a4427df
f3b8262c-ed4b-4627-ad1b-bc60209312b8,b4531ca4-b042-4cf2-9ef5-7c1e35fd541f,87a43abf-a0aa-4b19-bcdd-ea7b1e66a945,2025-03-20T03:45:19.276259,,"Actually reflect statement road security kid. Quickly expect fly woman manage street issue.
Success finish include leg. Some blue phone plant away nature.",WO-24432,2025-03-21T23:59:39.855775,2025-03-26T23:59:39.855775,IN_PROGRESS,That professor yard ready. Practice weight later general I recent old other.,Barberborough,WELL,-2.8076865,-85.158992,7227.26,"2 days, 0:00:00",MEDIUM,816a183a-24bc-4f72-9bd4-b1fa7a32478b,521017d3-3b25-4d49-90c9-b7eca5ccd641,53.36,visits,True,MONTHLY,,,2025-03-20T02:47:20.025765,2026-04-16T05:41:23.253426,516f773e-9ff4-4160-9217-4989207f2983,d77fc502-6405-48c0-97ee-683a9adb0058
790d5d46-5899-422c-baff-4db81397de36,4678cf0f-ec53-469f-8fdc-1952c6c95524,db8ac4f6-6623-4a62-a8fc-db0ac50bad37,2024-04-26T00:09:51.842887,,"Newspaper wind light account statement. While station send.
When pay newspaper staff somebody. Exactly cause admit generation.",WO-71042,2024-04-26T09:28:04.051117,2024-05-01T09:28:04.051117,REJECTED,Close exactly individual age. Price option star nice. Push watch across few cause.,Johnport,ADDRESS,34.477974,-177.818472,37705.75,"3 days, 0:00:00",MEDIUM,3c2b257c-08f8-4262-a55c-a0a781cf33b8,521017d3-3b25-4d49-90c9-b7eca5ccd641,17.52,visits,False,,,,2024-04-25T21:35:59.159727,2026-04-16T05:41:23.253989,8e9b7adf-87f2-429b-8e0d-f3721a269a40,a7710c49-0cf9-4ad4-a169-8150ffea2738
133bf272-f906-43a6-861b-562c7db2f55e,b29a8b42-259b-4fa9-9c07-ac0390374664,56f6f056-e13b-44a9-9b75-c474164d6faa,2024-11-22T20:20:41.594007,,"Close night source determine ask step message friend. Popular positive road work notice.
System current look worker spring. Way fish lot use morning.",WO-07210,2024-11-23T08:25:38.253130,2024-11-26T08:25:38.253130,REJECTED,Pass sing paper son account herself. This speak five all tonight into.,South Samantha,WELL,41.946849,79.808114,19437.33,"2 days, 0:00:00",MEDIUM,d2b3cab9-1bac-40d1-aa05-0532f66216a6,50332e38-e437-4b90-b168-2b3d2557eede,3.36,visits,False,,,,2024-11-21T22:25:29.219504,2026-04-16T05:41:23.254405,10e641f2-d974-4962-a779-5a17a4b193f3,dfc1f602-4924-4b07-bdf2-d5e1322cb261
1dc38137-4845-4a09-8984-1c2e64fe6c2e,88bdb298-8da5-47e4-a4ec-178d9ae25cdb,3ae3720e-3bf7-499f-91ed-7e129d4ccdce,2025-01-03T16:49:02.123712,,"Degree public then.
Man view box between fast. Everything join light effect. Require administration impact if.
Her store kid size keep. Left message impact. Morning skin city.",WO-38850,2025-01-04T20:17:26.431644,2025-01-08T20:17:26.431644,IN_PROGRESS,That page dog air spring short. Every I create. Low draw final of song eye.,East Todd,ADDRESS,46.3830595,84.499131,20119.86,"1 day, 0:00:00",LOW,6bc3b38c-4935-4336-b333-d0a648931402,1d15cc9c-bbe5-46c9-81bb-d76c6d53997b,90.15,visits,True,WEEKLY,,,2025-01-01T22:50:42.519906,2026-04-16T05:41:23.254882,9b8d4b1d-b617-4c94-b21a-aff72a2976c7,8fba3054-f201-49de-8aeb-20dbc957b634
b3175ebb-7e17-4a29-b799-1a436d7bb778,4678cf0f-ec53-469f-8fdc-1952c6c95524,db8ac4f6-6623-4a62-a8fc-db0ac50bad37,2024-10-17T15:52:30.353321,2024-10-22T14:48:36.940185,"Senior cold end number. Once wear three contain play soldier. Return dark yard fund man positive team.
Above admit radio him group. Hand believe theory one there.",WO-91467,2024-10-17T19:57:29.804404,2024-10-21T19:57:29.804404,COMPLETED,Involve meet wind pick sure exactly. Through position moment peace moment cost business home.,Lake Georgemouth,WELL,-24.1277345,-131.200402,48001.11,"1 day, 0:00:00",LOW,3c2b257c-08f8-4262-a55c-a0a781cf33b8,2d9f1a62-d4a7-4c88-8ff3-3d3942708b81,89.81,hours,False,,,,2024-10-16T09:40:16.856760,2026-04-16T05:41:23.255326,0f28f863-025e-42e8-83fb-fa34d9254832,3ae85031-eaae-4e2f-888a-eb4bff5773c0
aba8c4b3-9de8-4b3b-bc22-2992554fde1e,b29a8b42-259b-4fa9-9c07-ac0390374664,56f6f056-e13b-44a9-9b75-c474164d6faa,2025-12-06T11:28:20.572725,,"Per human choose eye center run. Figure performance head however site. Safe interview quality space stop begin have.
Process hear college bill. Man education sell trial leg box address range.",WO-16044,2025-12-06T16:45:09.161499,2025-12-07T16:45:09.161499,CANCELLED,Economy bed specific need most personal wall. Mission strong agreement.,West Sarah,GPS,71.262911,-56.672127,41144.16,"3 days, 0:00:00",MEDIUM,c019bd51-302f-4396-98bf-e6d39dc5a1fe,50332e38-e437-4b90-b168-2b3d2557eede,5.01,visits,False,,2025-12-07T08:34:26.340794,Safety concern,2025-12-03T18:37:48.346726,2026-04-16T05:41:23.255811,16441259-46cb-464f-8fac-4ce51d7d3d07,411fa026-25ba-4593-83e3-caa826d8872a
5ed06291-f35d-4082-b2be-347248c1f0ad,4678cf0f-ec53-469f-8fdc-1952c6c95524,00433d9c-81cf-4058-bf6a-fed7ddb39ed2,2025-09-16T12:26:22.956427,,Central after seek anyone else care give. Coach event many learn. Keep suddenly data seem particular use full animal.,WO-63815,2025-09-17T02:56:29.817208,2025-09-18T02:56:29.817208,IN_PROGRESS,Sort middle network story. Positive like house matter but.,New Scottville,WELL,-30.1533995,56.516955,3464.4,"3 days, 0:00:00",LOW,a8ea5934-3296-44fe-983e-b2702ef80311,b197cee2-a173-4026-9d78-0664ecf14e76,63.44,loads,True,WEEKLY,,,2025-09-15T19:13:40.979766,2026-04-16T05:41:23.256218,7107316c-37b3-4e5c-a8a2-ff64b35048ef,ddd95822-d7cf-451a-843e-b25340375d31
fc4e338e-b802-4a4b-bc01-7f89544d5248,4678cf0f-ec53-469f-8fdc-1952c6c95524,db8ac4f6-6623-4a62-a8fc-db0ac50bad37,2025-12-24T01:18:38.249928,,Room hard available opportunity travel. Mention indicate attack mouth only not large. Set best spring challenge financial character remain.,WO-94197,2025-12-24T02:01:00.245648,2025-12-27T02:01:00.245648,REJECTED,Dinner capital center. Anything indicate main soldier. Service need but sport.,Mooreton,GPS,-61.746275,-124.972344,44234.89,"2 days, 0:00:00",MEDIUM,3c2b257c-08f8-4262-a55c-a0a781cf33b8,521017d3-3b25-4d49-90c9-b7eca5ccd641,76.6,hours,True,ONE_TIME,,,2025-12-23T17:31:49.013010,2026-04-16T05:41:23.256691,809bb6f0-8fcb-4e50-9428-caf7ee593a81,034a83f7-4ff0-4558-a5dc-3c9c5f74249d
82f95119-2b60-4739-b902-bd90a5b1e022,4678cf0f-ec53-469f-8fdc-1952c6c95524,84ad090c-2539-4105-ba14-dfe5f61fd3c4,2025-06-02T02:57:16.904711,,"Actually suffer movie likely some speech. Maybe science pass else free crime goal. Hold painting scene.
Be manage both through each why carry worry. Quickly during stock chair century.",WO-44489,2025-06-03T11:41:59.010212,2025-06-07T11:41:59.010212,IN_PROGRESS,Fall need during usually. Officer care wish.,Christineville,GPS,-20.120632,125.353182,36706.77,"3 days, 0:00:00",MEDIUM,fa6fe0fa-e5c9-400c-ba0e-3ee78f3d0251,521017d3-3b25-4d49-90c9-b7eca5ccd641,15.25,gallons,False,,,,2025-06-01T16:23:55.814360,2026-04-16T05:41:23.257103,083cdee5-1169-48ca-a9ca-571f52a771d0,f1a29143-e564-4a7b-b4e7-91935ebad3af
b405238d-2525-4e62-afd9-d3f31cfcc403,4678cf0f-ec53-469f-8fdc-1952c6c95524,873ed2c3-5db9-4e66-8fd5-eda1ae4e0cbc,,,"Should but task size fly around save also. Tree artist use picture item involve age choice.
Team hear meet hope exactly administration church. Try today test student.",WO-16728,2025-04-13T18:13:35.896307,2025-04-16T18:13:35.896307,UNASSIGNED,Understand future small politics phone imagine risk between. Heavy between religious soon campaign.,Bakerchester,WELL,-11.7395685,130.032141,21209.61,"1 day, 0:00:00",MEDIUM,fb8a7942-1ea7-4df0-ade9-61334331fa72,2d9f1a62-d4a7-4c88-8ff3-3d3942708b81,80.15,gallons,True,DAILY,,,2025-04-12T16:05:13.118393,2026-04-16T05:41:23.257707,917f0f4f-b62b-44bb-8d02-237c048e4eb7,fd4b4436-1e44-4b9a-8670-ea61c03b5a1f
044f3ffa-a213-4a94-a628-a7bbf39d7526,4678cf0f-ec53-469f-8fdc-1952c6c95524,87a43abf-a0aa-4b19-bcdd-ea7b1e66a945,,,"Garden perform nation customer. All mouth authority beat budget.
Bring treatment ever fill tell catch. Military usually always red this important often.",WO-71313,2026-04-16T03:55:17.825218,2026-04-17T03:55:17.825218,UNASSIGNED,Tonight list Democrat year forward. Scientist seek spend scientist president star.,South Glenn,GPS,-17.2810785,-111.871666,39457.1,"1 day, 0:00:00",MEDIUM,c65466d1-6281-4ce4-a3fc-5c1e113cff5c,1ae8c37c-38a8-4360-94a0-0adfc4c9305b,91.6,gallons,False,,,,2026-04-16T02:12:34.784231,2026-04-16T05:41:23.258156,022c6902-386a-4ef3-80c2-2b8169d540f5,e314ff66-3d32-4c36-bc6d-7254cfe054e7
0496aff1-c55f-4a33-b051-637f20821cf3,b4531ca4-b042-4cf2-9ef5-7c1e35fd541f,db8ac4f6-6623-4a62-a8fc-db0ac50bad37,2025-08-10T02:59:07.846971,,Point card left effect professional low. Dog hear every suggest thus. War past matter front thus turn Democrat eat. Interest need worry girl use affect.,WO-36544,2025-08-10T12:52:22.076144,2025-08-15T12:52:22.076144,REJECTED,Yard occur that though grow performance. While center protect term billion southern.,West Natalie,ADDRESS,66.7873955,94.0459,42604.39,"2 days, 0:00:00",HIGH,6cc018a5-b3ee-435e-b83c-a1d590df5697,521017d3-3b25-4d49-90c9-b7eca5ccd641,56.3,loads,False,,,,2025-08-10T01:09:47.035418,2026-04-16T05:41:23.258545,c879e65f-12d8-428b-b59e-f36336cd2c86,b6023200-8883-4e3a-a38a-ec0094d4baea
366a7154-5280-4827-9dcc-f87ec1405bcb,0662f3bb-2c28-4b44-acfe-56565d827f1f,c5d2e606-6a9f-49bc-b434-8cfe4e54eec0,2024-09-14T22:18:45.020922,,"Industry almost growth student. Even yourself occur activity point west woman important.
Society poor at run social.",WO-52564,2024-09-15T13:49:46.115566,2024-09-20T13:49:46.115566,HALTED,Apply security baby rise. Five computer Mr dog. Student up difficult light manage industry.,Justinside,WELL,-32.094215,-152.892403,21976.73,"2 days, 0:00:00",MEDIUM,0babe4ef-5e0e-41aa-af1e-e037f115335c,f63e6700-3590-44d4-93ee-620634a189eb,94.05,loads,True,ONE_TIME,,,2024-09-13T09:29:38.752708,2026-04-16T05:41:23.258992,053d30b1-2b2d-46a5-b083-3a50eb4c93d7,48da29ea-d6a8-4885-9ee5-19b0bebad8f8
14274567-be8f-41db-bfc0-bb81838cb99c,b29a8b42-259b-4fa9-9c07-ac0390374664,db8ac4f6-6623-4a62-a8fc-db0ac50bad37,2025-01-12T00:05:31.918349,,"Price owner coach common also. At spend nor family sense voice. Make suffer treatment sea.
Music point town machine young. Service receive enter yard fish follow care. Program throw now woman.",WO-79440,2025-01-13T19:27:22.604598,2025-01-16T19:27:22.604598,HALTED,Important anything month. Year whom since.,Madisonberg,WELL,48.5835755,-114.463125,42302.17,"1 day, 0:00:00",LOW,dc1c92f3-8baa-43c8-8f0b-fd87f46bbeb5,50332e38-e437-4b90-b168-2b3d2557eede,46.97,gallons,True,DAILY,,,2025-01-09T20:51:08.153373,2026-04-16T05:41:23.259442,1df8c420-0518-4367-8e65-aec81947092a,cd28062f-580e-49cb-b71b-7c1a6fa47001
96ada831-12b4-4e5f-9346-0b2f1baed27b,86ea9e9c-f1d8-423c-bb34-2f1df47812aa,92feeac5-761f-4487-a05b-d4d30859f098,2024-06-19T02:58:08.332089,,List rather law house. Thus another station view rock country oil. Develop listen born everybody body read. Wish size toward institution pay air able.,WO-16764,2024-06-19T09:35:51.700822,2024-06-24T09:35:51.700822,CANCELLED,Site keep institution. Part man left. Major race figure surface campaign.,Robertmouth,GPS,0.5179505,78.967495,8541.05,"2 days, 0:00:00",HIGH,cd343f2e-67d5-4aec-b72b-ecd15989ee86,521017d3-3b25-4d49-90c9-b7eca5ccd641,7.57,loads,True,DAILY,2024-06-20T08:39:06.473221,Resource unavailable,2024-06-17T12:35:25.500866,2026-04-16T05:41:23.259932,5475edfb-ec6a-4ab2-88c1-26e39811f9ee,bb5c9656-13de-4f04-a9ef-1ecbc126210d
ffc6a170-6fd2-4162-951e-330e66745fa5,b29a8b42-259b-4fa9-9c07-ac0390374664,56f6f056-e13b-44a9-9b75-c474164d6faa,2024-09-12T02:37:25.561499,,"Step population yes make. Side future enter better.
Into room rock sign. Case find technology article out. Strong picture camera pull quickly foot matter.",WO-76982,2024-09-12T19:56:58.078928,2024-09-16T19:56:58.078928,IN_PROGRESS,Ten sport own others. Sort foreign wear perhaps. Image manager once certainly stop record.,Woodsshire,GPS,54.857442,-82.389122,46910.9,"1 day, 0:00:00",MEDIUM,c019bd51-302f-4396-98bf-e6d39dc5a1fe,50332e38-e437-4b90-b168-2b3d2557eede,24.33,visits,True,WEEKLY,,,2024-09-09T05:56:18.561832,2026-04-16T05:41:23.260565,5475edfb-ec6a-4ab2-88c1-26e39811f9ee,2b84be0d-a021-4adb-aba2-bd2d19b4ae0f
4eb97c94-8dc2-40ec-95b7-0599ebdabb89,86ea9e9c-f1d8-423c-bb34-2f1df47812aa,db8ac4f6-6623-4a62-a8fc-db0ac50bad37,2025-09-22T00:56:46.367228,2025-09-25T23:15:54.008873,"Speak language your time site we available. Ahead sing dinner for save. Care whether fine common field whatever.
Let quite public thus. At dream run business national him whose staff.",WO-23231,2025-09-23T21:17:58.061200,2025-09-26T21:17:58.061200,COMPLETED,Check give move political. Especially idea operation between.,North Beverlyborough,WELL,24.6628415,-139.882183,8380.0,"2 days, 0:00:00",HIGH,3c2b257c-08f8-4262-a55c-a0a781cf33b8,521017d3-3b25-4d49-90c9-b7eca5ccd641,38.31,hours,True,WEEKLY,,,2025-09-19T01:29:35.695662,2026-04-16T05:41:23.260971,d8c1faba-4e4a-4a4d-9254-4a5cae2bae4c,9f0ad337-5fe4-4618-a209-d2b700ee6f61
25e9d157-b220-46b4-ad3a-7baffcd3b88f,b4531ca4-b042-4cf2-9ef5-7c1e35fd541f,56f6f056-e13b-44a9-9b75-c474164d6faa,2025-04-28T18:29:32.500338,2025-04-30T08:54:45.344910,"Toward Mr yeah industry.
Democrat financial interesting present test manager. Sea try scientist.
Check prevent recently to family heart. Avoid save system car between.",WO-34213,2025-04-29T19:48:36.776617,2025-04-30T19:48:36.776617,CLOSED,Wear whether smile it quite open expert. Near exactly water tonight particular black.,Johnsonmouth,ADDRESS,-57.34974,113.395841,603.32,"1 day, 0:00:00",LOW,65060607-d4c1-43b9-b74e-d4a08676f8ae,1d15cc9c-bbe5-46c9-81bb-d76c6d53997b,14.21,loads,True,ONE_TIME,,,2025-04-26T07:54:30.553374,2026-04-16T05:41:23.261410,28a0d9a5-28b7-4189-8945-842131a1d6bf,7b107ad1-041a-4757-89ac-e8ab5e06eea0
28f47c96-8b00-4779-8978-3de79064d32e,86ea9e9c-f1d8-423c-bb34-2f1df47812aa,92feeac5-761f-4487-a05b-d4d30859f098,2026-04-16T01:37:43.623230,,"Event our camera weight very see conference point. Not employee high despite.
Live follow class suffer practice. Book suddenly take in. Physical base time music.",WO-79230,2026-04-16T02:21:37.475226,2026-04-19T02:21:37.475226,IN_PROGRESS,Smile job name news call. Ground executive cut stand.,East Michaelberg,WELL,-8.9976575,102.486414,49415.14,"3 days, 0:00:00",LOW,cd343f2e-67d5-4aec-b72b-ecd15989ee86,521017d3-3b25-4d49-90c9-b7eca5ccd641,82.32,gallons,True,ONE_TIME,,,2026-04-16T00:28:02.895598,2026-04-16T05:41:23.261912,f5d88b75-9d54-4b00-9b24-2d58c276c541,0cbf8c31-14d1-47ed-8137-66cc50b002f0
dc14173e-c80f-4742-b72b-a722914cccc1,4678cf0f-ec53-469f-8fdc-1952c6c95524,db8ac4f6-6623-4a62-a8fc-db0ac50bad37,2025-07-29T15:59:09.799005,,Role company lead phone production laugh war source. Policy water use few almost myself art. Cell loss affect doctor day safe home. Per professor with bag young.,WO-94706,2025-07-30T08:30:20.905783,2025-08-04T08:30:20.905783,HALTED,Most concern remain southern. Age process challenge issue trip.,East Gary,ADDRESS,68.1149045,-70.880344,7361.49,"2 days, 0:00:00",HIGH,3c2b257c-08f8-4262-a55c-a0a781cf33b8,50332e38-e437-4b90-b168-2b3d2557eede,85.39,gallons,True,WEEKLY,,,2025-07-27T01:47:00.579860,2026-04-16T05:41:23.262400,e4aae49d-de25-4ee1-924e-3a2b278ed3f3,c3a8a910-3d2c-42ea-95ed-ede5420d466f
0de0f8b7-69fb-4b33-b322-662d80b1556e,88bdb298-8da5-47e4-a4ec-178d9ae25cdb,92feeac5-761f-4487-a05b-d4d30859f098,2026-01-19T07:39:29.166728,,"Husband sport win cover happy production.
Fact yourself team performance. Official week approach now but season identify.",WO-23666,2026-01-19T16:45:56.873229,2026-01-20T16:45:56.873229,HALTED,Child future series money animal serious word his. Whole baby language message.,Millschester,GPS,-36.422646,35.394801,33417.92,"3 days, 0:00:00",MEDIUM,cd343f2e-67d5-4aec-b72b-ecd15989ee86,1d15cc9c-bbe5-46c9-81bb-d76c6d53997b,81.22,loads,False,,,,2026-01-17T20:14:58.721549,2026-04-16T05:41:23.262831,56c2836a-b295-4809-b77e-e8585506b2bb,6612b52e-10fa-4a58-917c-0ef8bcef466a
4fd546e8-9abd-4d42-8d4b-6a5960b4aa7d,976efc1b-14ab-4f55-b545-737e09b5c32a,e9f6e5b3-7260-4249-961b-316d318d58c3,2025-02-17T07:07:54.324793,2025-02-18T04:27:33.019099,"Production power cut light area. Forget small town common perhaps decade happen.
White pass service soldier fire might. Item sing owner.
Approach special while style. Major reduce fly he modern.",WO-88988,2025-02-17T14:19:25.006536,2025-02-20T14:19:25.006536,COMPLETED,Support grow seek personal board. Phone question under program.,Barretthaven,ADDRESS,-67.260619,27.274368,10922.09,"2 days, 0:00:00",LOW,09c318a1-16c8-4aa8-a969-dc3ab7b43b41,1ae8c37c-38a8-4360-94a0-0adfc4c9305b,70.62,hours,False,,,,2025-02-17T04:01:13.490497,2026-04-16T05:41:23.263325,47be9a31-acd2-48e5-b605-5737d516b02f,6bfed627-c348-448b-a52c-eb9f83a69736
a29650fa-0564-4265-99d9-481a0b4aa695,3717f5e0-8ae1-4f1b-a417-590176d14f60,00433d9c-81cf-4058-bf6a-fed7ddb39ed2,2026-04-15T03:03:50.321306,,Style authority street trouble glass pick. Own peace relationship field final. Local election data evening military eye environmental. Discuss once suffer card.,WO-59782,2026-04-15T14:42:51.318049,2026-04-17T14:42:51.318049,ASSIGNED,Sense least finish bill television top interesting. Wonder light site tonight national item answer.,Jerrybury,ADDRESS,-30.2883145,117.794089,38633.15,"3 days, 0:00:00",MEDIUM,f5491ae6-9775-4292-9ae9-ada17effd903,50332e38-e437-4b90-b168-2b3d2557eede,58.35,visits,True,WEEKLY,,,2026-04-14T09:36:17.152105,2026-04-16T05:41:23.263965,6d92849a-c1fc-4f16-b3c8-b3f5101c9769,635db01b-b003-4411-90ae-995f1520d411
231fae44-3fce-4925-8a8d-b9947987906e,3717f5e0-8ae1-4f1b-a417-590176d14f60,873ed2c3-5db9-4e66-8fd5-eda1ae4e0cbc,,,"Thought each return piece education. Practice vote entire beautiful newspaper every quality. Start likely drug community month large focus.
Past she action. Partner national within far.",WO-37068,2024-11-23T20:14:14.611665,2024-11-26T20:14:14.611665,UNASSIGNED,Quality now soon however responsibility per world. Movie raise affect. Close recently push.,South Brandonmouth,WELL,83.629942,165.577577,9978.69,"1 day, 0:00:00",LOW,53c27215-e85c-4fa2-8375-cf8f03b98b0c,50332e38-e437-4b90-b168-2b3d2557eede,4.11,loads,False,,,,2024-11-19T12:08:34.747250,2026-04-16T05:41:23.264564,916e03cb-c78e-4e79-aac1-f20e4cd440f3,fce0c62e-9cf8-4dae-8bad-209fd914fcc7
b84231e1-fd38-408d-9e35-802bf5a9ce9b,0662f3bb-2c28-4b44-acfe-56565d827f1f,db8ac4f6-6623-4a62-a8fc-db0ac50bad37,2024-12-03T03:27:00.676961,,Ten his mind worker know. Whose end worry recognize share detail. Watch director glass take contain lot occur. Election until friend figure it provide realize hair.,WO-21115,2024-12-03T17:29:51.699999,2024-12-07T17:29:51.699999,REJECTED,Prevent first price. Shake that impact wide than chair necessary. Work activity level.,Angelafort,WELL,-86.713106,-103.466358,37391.42,"3 days, 0:00:00",MEDIUM,6cc018a5-b3ee-435e-b83c-a1d590df5697,521017d3-3b25-4d49-90c9-b7eca5ccd641,66.18,days,False,,,,2024-12-01T09:54:26.570621,2026-04-16T05:41:23.265013,d18faa97-95b0-452d-8d59-7c7a58c8e8cb,e35dbe71-13f8-4f3d-8a42-52e7182df36a
16db89be-b99f-41f0-b314-04a9b0d80ecc,cff59dfd-47ec-43be-8791-91f399189fb6,87a43abf-a0aa-4b19-bcdd-ea7b1e66a945,2026-02-08T16:06:48.891346,,"Term parent scientist everyone. Step morning indicate city organization various.
Assume chair whether various want.",WO-49634,2026-02-09T07:07:33.595612,2026-02-10T07:07:33.595612,CANCELLED,I science inside imagine item factor happy. Apply nice fire term behind safe fine.,Christinahaven,GPS,13.3760225,98.680578,44268.85,"1 day, 0:00:00",HIGH,b77b9d82-de70-47d0-9be8-8c3d444ca202,50332e38-e437-4b90-b168-2b3d2557eede,60.79,loads,True,ONE_TIME,2026-02-08T21:32:46.962272,Duplicate order,2026-02-05T18:47:15.003270,2026-04-16T05:41:23.265417,9db004a5-3fe6-4974-9b74-ece81e04c1d6,947898e4-8314-4f64-83b8-5500d2d32f8e
72945698-af0e-4835-a910-b4408b935e63,b29a8b42-259b-4fa9-9c07-ac0390374664,db8ac4f6-6623-4a62-a8fc-db0ac50bad37,,,Response heart kid possible often audience. Sport whatever cultural culture factor who north role. Despite writer contain prepare according last keep.,WO-19303,2026-04-16T05:37:40.922930,2026-04-19T05:37:40.922930,UNASSIGNED,Mind sign car in test employee. Determine discussion ten fire others computer list sense.,Snyderberg,ADDRESS,69.611175,74.102324,40110.33,"2 days, 0:00:00",MEDIUM,dc1c92f3-8baa-43c8-8f0b-fd87f46bbeb5,50332e38-e437-4b90-b168-2b3d2557eede,1.27,visits,False,,,,2026-04-16T01:12:49.993223,2026-04-16T05:41:23.265870,29d052a6-9387-404d-b7d6-39c5ac9c3e3a,7403c193-6860-4ce6-8e2f-a33859577889
602e92ab-d9a2-4d2e-9a5b-75349e85ca24,3717f5e0-8ae1-4f1b-a417-590176d14f60,00433d9c-81cf-4058-bf6a-fed7ddb39ed2,2026-03-19T17:45:02.168034,,Inside really series wrong yet budget. Likely sure out watch check team. Line phone wrong until science modern late write.,WO-35941,2026-03-21T04:16:35.774377,2026-03-26T04:16:35.774377,IN_PROGRESS,Research alone deal pick man floor structure kitchen.,North Debra,GPS,-43.0212385,84.707133,44534.53,"3 days, 0:00:00",HIGH,70fd92c8-cb17-49a2-b48d-99d44cfc707d,50332e38-e437-4b90-b168-2b3d2557eede,92.73,gallons,False,,,,2026-03-19T16:57:00.208209,2026-04-16T05:41:23.266258,6c939cc7-d936-4ebe-81d4-6f841cf87f13,99f3f3bb-cfb4-4118-b98b-4bbfb0650425
8e8ac9ee-ec11-430c-a9fb-ae7cf7e30bd4,b29a8b42-259b-4fa9-9c07-ac0390374664,db8ac4f6-6623-4a62-a8fc-db0ac50bad37,2025-02-03T04:19:42.450121,,"Light return attack five lay give concern. That yet thought which plan training control.
Compare camera should. Center bar eat imagine. My business model. Live no learn.",WO-68728,2025-02-04T15:05:59.833924,2025-02-09T15:05:59.833924,HALTED,Particularly event hotel hear protect ground. Successful watch thought local.,Davidville,GPS,-40.7254095,-14.894932,16963.97,"2 days, 0:00:00",HIGH,dc1c92f3-8baa-43c8-8f0b-fd87f46bbeb5,50332e38-e437-4b90-b168-2b3d2557eede,63.08,hours,True,WEEKLY,,,2025-02-02T08:45:44.890886,2026-04-16T05:41:23.268153,916e03cb-c78e-4e79-aac1-f20e4cd440f3,c5332427-e255-40e5-a3c2-2c176e878c4b
2c762b17-7f76-4527-8e68-6c3066fd1a40,b4531ca4-b042-4cf2-9ef5-7c1e35fd541f,1de1a4ae-f248-4934-bbf9-6d89826f25dd,2025-01-22T19:48:35.301601,2025-01-24T19:12:48.119570,Quite voice population nor. Bank staff article board decade. Gun baby student interesting.,WO-20781,2025-01-23T06:52:00.034188,2025-01-27T06:52:00.034188,COMPLETED,Same doctor stand would lot foot. Participant fly less occur drug brother official.,East Benjamin,GPS,-36.3318625,73.488529,44629.9,"1 day, 0:00:00",LOW,59da93cc-6776-48e0-814b-cc27d537560b,1d15cc9c-bbe5-46c9-81bb-d76c6d53997b,67.17,days,False,,,,2025-01-21T18:32:19.488455,2026-04-16T05:41:23.268662,bb76c49d-84ba-46fb-a975-0efb378a99e7,6bc4ca05-5fc3-47ee-aa0d-ecc6aee13b59
f4e94f3e-10b3-4a83-b3f2-57cf0a2119fc,88bdb298-8da5-47e4-a4ec-178d9ae25cdb,d2b63471-5290-4bf5-9d7c-86e2435b53fc,2026-04-16T04:09:25.846626,2026-04-16T04:36:31.523586,"Behind lot relate environmental mouth measure end pay. Evening painting accept billion collection attack.
Effect kitchen establish. According really truth now. Address strong six here.",WO-03668,2026-04-16T04:09:50.713448,2026-04-20T04:09:50.713448,COMPLETED,Listen enough voice everything.,Steinville,WELL,-68.469418,-86.462529,611.4,"1 day, 0:00:00",LOW,12990c1a-2a9e-44ae-83db-e296deda81a5,1ae8c37c-38a8-4360-94a0-0adfc4c9305b,80.44,loads,False,,,,2026-04-16T03:00:26.286403,2026-04-16T05:41:23.269140,af0a1396-4c73-47ae-81ae-18d7efb7ebb3,1fab81ee-2b72-402f-bb7d-a01c93c49ba6
669af61a-470c-45b4-a181-b359e40dc9ca,b29a8b42-259b-4fa9-9c07-ac0390374664,c5d2e606-6a9f-49bc-b434-8cfe4e54eec0,2024-07-10T10:11:36.411640,,"Least claim argue let turn rock law. Contain call example quickly rich.
Tell show put not religious everything. Style degree career information trade field. Without want else land pull.",WO-89420,2024-07-11T17:35:05.951008,2024-07-16T17:35:05.951008,HALTED,Amount per miss customer certain home. Police thought half rather home. Measure purpose total care.,Port Sheila,ADDRESS,-28.9076675,-43.383572,49448.99,"1 day, 0:00:00",HIGH,bb84848b-0ead-4180-b882-6cab8742960f,50332e38-e437-4b90-b168-2b3d2557eede,66.47,loads,True,MONTHLY,,,2024-07-07T23:46:43.014766,2026-04-16T05:41:23.269615,ba57f3a2-e013-4738-8319-fcb82503de17,bd4c38a8-14f0-4725-9b57-9feed2b1e6cf
