work_order_id,assigned_vendor,assigned_at,completed_at,description,due_date,current_status,comments,location,estimated_cost,estimated_duration,priority,well_id,created_at,updated_at,created_by,updated_by
9c763299-a7da-4e36-b932-305443ef0a54,2420f3e7-c826-47ed-9895-1c516c602cfa,2026-04-01T12:32:17,,"Shoulder bad alone help. Or necessary alone why never teach example.
Military vote thought. Brother thing to for look fact issue.",2025-12-04T20:16:09,in progress,Have vote despite and. Ok foot exist sign. Place degree whole while.,South Shannon,8363.7,34,routine,9781227f-2478-4bac-8545-dd175c9c55b5,2025-09-26T15:17:12,2026-04-05T08:43:54.190546,87ae3b78-bd69-4dc5-90c8-b6639ea61523,50305b9e-1326-4b8f-8dc0-b88bc34cccf3
28d71ba8-81da-439e-bc4e-d49ac1c07eff,a64c8bad-2eed-4f71-9a2c-ab6446555b42,2025-12-03T02:24:19,,Evening service impact baby she whatever any. Like Republican on safe dinner represent his. Someone dinner land movie quickly bank ability.,2026-03-29T09:09:16,assigned,Create mouth onto loss make serious indicate. Before from turn machine.,Brooketon,3306.19,36,urgent,e0d1ef75-4a31-4c0c-8a21-9b5cb93a95d2,2025-09-06T23:41:49,2026-04-05T08:43:54.190815,2f0f1431-011d-47d1-bd28-f09319e7a46a,f2a55572-8ad4-49fe-adbf-a6144b36a98f
446664c4-8efa-4912-96ee-4168e2e03bf4,1c9ccf14-5176-4c6c-8254-4abf7d027bfa,2026-03-26T02:11:04,,Staff cut during recognize. Sure author government growth money art Democrat draw.,2026-03-13T06:55:06,in progress,Enjoy attack without grow drive. Concern station media. Huge structure human thought everybody.,South Brittanyfurt,2676.44,25,emergency,0fd3f492-fdf8-43cf-a536-3746bb53375e,2026-02-20T12:40:05,2026-04-05T08:43:54.191062,47baa1d5-b6e1-4f4a-901d-ebd8fb0094ec,5e8f2c62-ae22-463f-8048-d55f29853a36
04b95e1e-f540-4f31-a2ab-433e2e3504f4,084e231e-e1f9-43f1-9eea-8501ecc87efe,2025-08-04T03:46:23,,Sit fill perhaps author space right forward pick. Where everything anything that outside morning site. Ground single will security none. Instead store next which home enough like.,2025-12-06T07:47:07,assigned,"Family support black one. Position step everything effort modern.
Time into personal rate.",East Sheena,1812.48,49,emergency,d977449a-fa06-4edb-b2b4-806595da6995,2025-04-22T14:51:41,2026-04-05T08:43:54.191356,da5dea8f-522c-407c-8917-def6981adc98,8378ed5c-e9f1-4d1c-817f-4096d95bd1f6
12aefc64-4e75-4c15-ba4b-23497e35f2bc,8d975f8a-3c15-42d6-a033-74e9628c5264,2025-11-10T03:20:42,,"Well establish Mr nearly. Suffer possible not media with director. International impact add Mrs say.
Test stop dog center operation while. Order guy right develop think eye general.",2025-12-28T16:13:27,completed,"Pass firm a.
Movement grow should Mr. Just between statement person color young learn.",Shawborough,6670.85,25,urgent,63f4b8f1-3a9d-457e-8a34-e3e719900a1c,2025-08-28T17:19:24,2026-04-05T08:43:54.191658,65b0f0b3-bf09-4703-85f1-629af7d28d3f,a6b6f555-147d-481e-81da-95beda1d1dda
c62cbff1-9016-46ab-ba95-49f580d896ba,cee53164-4353-443b-87fe-d45aa142b0eb,2026-04-03T09:47:21,,Begin seem box benefit his east. Like them none owner Mrs station. Himself save energy visit offer other.,2026-03-22T20:33:40,unassigned,Compare high whose morning to never. Ask bring always sound prepare offer radio.,Valdeztown,4592.83,4,routine,8d6527a3-961e-489c-86c1-47e7ddc60d4d,2026-02-13T16:47:11,2026-04-05T08:43:54.191947,496d3a59-36e7-4e5e-a7c0-e735e7fc7978,edb3440a-276b-4bd4-bd21-77644dcf6657
20ac7648-7d56-43f5-a778-6a2d6f9e9368,cd464691-0ec1-4610-90bd-ddf7f41e4b75,2025-09-09T10:03:05,,"Sense dog contain foreign media. Could window few group military.
Sort follow explain health. Consumer rest raise public program current certain.",2026-01-15T15:21:16,assigned,Experience knowledge top raise maybe. However anyone why before notice ok.,Hunterland,7230.49,55,urgent,469ea200-c22e-4398-94e3-fd4996ca479a,2025-08-06T00:50:21,2026-04-05T08:43:54.192232,97f46a09-e7be-453d-9e21-3d0fd9c65d19,4f3d75ef-7a26-4dbe-bd96-3feac1e4e4f9
fc06674d-cdd8-452e-a29d-b531dcfabe28,0cfc4b3e-0118-42f1-8bd8-617ccf8310cd,2026-03-15T11:52:46,,"Soldier sport participant behind. Interest ready technology return my current science.
Himself note draw attorney along American article environment. After can now only stop best staff agree.",2026-04-01T18:49:02,in progress,School team consumer budget day eye. Gun outside white happen democratic.,West James,6145.84,61,urgent,7c47200a-9141-4320-9581-1836b1b7346e,2026-03-09T18:17:44,2026-04-05T08:43:54.192479,29c77dc4-b18d-4be0-9007-6c958f69cdeb,345b4be0-de01-4438-96e1-c25d233a8792
97996c58-347f-4224-9933-56007b8885fc,cd464691-0ec1-4610-90bd-ddf7f41e4b75,2025-07-24T09:13:56,,"Morning story down. Number all interesting outside yeah answer.
Out toward book. Discover me thousand among. Central bank tree travel window hard.",2026-02-16T08:41:44,unassigned,What during reality pass analysis between. Through region week television.,Lake Shannonmouth,1049.96,72,emergency,469ea200-c22e-4398-94e3-fd4996ca479a,2025-07-12T04:43:42,2026-04-05T08:43:54.192767,e2f18af0-ffc4-4ff8-88d9-0b632e2a313e,1d14bf31-05dc-43b8-9680-d88e06140573
4aaffd1a-f8f6-432e-89af-d64b5a4fd12d,cee53164-4353-443b-87fe-d45aa142b0eb,2026-03-05T22:06:24,,Once realize board according woman heavy than increase. Way trial from although board store me. Likely notice decision appear during always growth. Dog notice serve now evening vote minute moment.,2025-06-25T20:06:58,assigned,Once home no seven. Art soldier kitchen though visit artist most.,Rogersbury,6043.74,69,urgent,db10f7b3-0b9c-433e-8ee7-109f1e0a5e43,2025-04-25T22:36:35,2026-04-05T08:43:54.193136,1fc01d33-4507-4429-aa7b-5e5ec5bcf646,40a16518-338e-4176-a794-6b03cf59ea06
8c651ad9-5b83-4275-b6be-9b0c306a7856,0ded7f06-ed67-4a95-a21d-2c431e38c883,2026-04-04T06:28:47,,"Seven enjoy yourself may while. Decade half medical offer hour read draw.
Us improve suffer take production gas. Issue southern our type physical customer.",2026-03-26T08:01:42,in progress,Cause card work consumer. Through compare part painting hear lot. Feeling game upon bit.,Jacobsonburgh,938.55,64,urgent,31864a77-6c37-4e89-b0c6-17161a0eb3e3,2026-03-23T22:09:48,2026-04-05T08:43:54.193441,7394070f-2936-4ee7-9287-0783b3b328a5,93e80ac0-e020-4dd9-8774-b924155d038a
54265aeb-8add-4b75-864c-ab9ebbbe79f8,a64c8bad-2eed-4f71-9a2c-ab6446555b42,2025-10-09T08:59:26,,"Dream buy expert especially current.
Officer front specific when agency. Be cold Congress from. People instead yeah soon both finish.",2025-11-07T07:25:54,unassigned,Word more sort heavy break three front. According although which oil picture exactly back.,East Mariamouth,6105.96,72,emergency,0fd3f492-fdf8-43cf-a536-3746bb53375e,2025-04-10T01:48:23,2026-04-05T08:43:54.193752,d14e55ea-89f0-4faa-897c-794e4edf6a33,a38c2e89-9d65-41f7-8b6d-4627c6e0a0c4
b409f6cf-2960-45a4-ad9f-7aa2a84cbb08,0ded7f06-ed67-4a95-a21d-2c431e38c883,2026-03-27T03:10:27,,"Move character name east task left month. Matter speak method sell tree.
Team manager sit fly four region. Economic quality that. Environment few onto other.",2026-04-06T17:00:17,unassigned,Even including owner goal professional list everything. Even south might method me.,Tiffanyview,9418.13,44,emergency,31864a77-6c37-4e89-b0c6-17161a0eb3e3,2026-02-04T11:29:52,2026-04-05T08:43:54.194017,169785db-6b3f-413b-8b88-5f1e5710377c,94a59949-03b9-4eae-b4ab-38c09c66873a
151c4646-16f7-4c58-b7e5-f2044ee0f5a4,0cfc4b3e-0118-42f1-8bd8-617ccf8310cd,2025-11-14T10:36:07,,"Yet thing explain hospital other player throughout. If relate tell offer your start fine.
Everybody work behind appear detail if commercial. She pick unit. Goal usually travel history.",2026-01-30T19:59:24,completed,Across oil green game father add.,Hollandville,3525.42,64,emergency,6fe1d5c2-365c-49ee-a9fd-f5d91829a585,2025-10-17T20:53:53,2026-04-05T08:43:54.194300,ffe0d409-9822-46db-9512-ab90100822d0,3d78879e-86a5-4fa2-93cd-f6ff275aef89
1b04e58e-7172-4aa0-a46d-a40d319638f3,ca790bf9-a3d5-441e-9e35-13b30dd2f3a3,2025-10-14T13:03:28,,"Officer board traditional wind. Listen subject detail fund week effort themselves.
Certainly development method girl option.
Talk eat can week especially. Hit should boy continue pull carry.",2025-09-18T05:09:11,in progress,Explain start chair use. Amount street already beat since should.,New Cathy,890.93,27,urgent,b0f74e66-2159-4a2b-80d2-f2bd2ec7883f,2025-07-29T14:23:31,2026-04-05T08:43:54.194586,63dafea2-6781-4671-975c-a3ebb0edbb14,45e62ec0-0158-477b-b8da-9b497d289b83
70db7b52-ae82-46f9-b5bb-167469165ba8,cd464691-0ec1-4610-90bd-ddf7f41e4b75,2026-03-19T21:04:26,,"Compare sometimes safe notice.
Idea exactly mouth television health field activity. Affect detail finally human.
Summer always other fall only magazine tend rock. Likely near style.",2026-02-25T19:51:53,in progress,Artist fire reason character write size. Stand thing American consider more. Few low baby sign.,Christopherhaven,5240.42,68,emergency,e86fef08-42cf-49ee-b84d-4480cf6dd429,2026-01-21T17:38:03,2026-04-05T08:43:54.194986,83ed4d71-7c3d-4fb5-925d-88f7efc1cae7,5fc2697c-4d85-48cd-8662-d83c81f160fb
cdd37c71-0a19-4967-bb41-c4a5e6f75f1b,0cfc4b3e-0118-42f1-8bd8-617ccf8310cd,2025-07-31T10:52:03,,"That can money improve. Dream might threat wife world newspaper mention. Strong people gun could safe.
Street court get six few. Onto debate consumer finish move today.",2025-09-27T09:04:20,completed,Coach say try child raise. Exist whom same court heavy next high.,Juliachester,6304.09,35,emergency,f5c66a6c-dab7-4bd9-b05f-5bf8530c5350,2025-07-24T23:49:09,2026-04-05T08:43:54.195240,48aeab08-c18b-4e99-bd4a-522e908cd904,c1bd113d-a494-445c-a8a6-45e37541a779
e488ef0a-bedc-4aaf-93df-8050bd92ba6f,084e231e-e1f9-43f1-9eea-8501ecc87efe,2026-02-05T01:16:00,,"Fast career everyone consumer body suddenly discuss many. Probably thank important same do. Happen toward it form someone hair.
Real someone Mrs really.",2026-03-08T10:25:03,assigned,Conference physical place. Check remember few decision. Tough low can which car.,Port Michelehaven,7112.83,13,emergency,86d8cfae-3b98-45f5-bf69-5c2c422130b4,2025-12-07T21:57:41,2026-04-05T08:43:54.195658,786932a9-7ba4-447e-87df-6d2fdd163671,92abd489-c65f-4bb4-99ca-f5a7cda091d5
6c3832f7-16d9-44ae-baa5-e486692bf37d,084e231e-e1f9-43f1-9eea-8501ecc87efe,2026-03-02T22:13:45,,"Accept production hear everyone forget. Image huge western. Stock push various beat cup despite how.
Yourself either huge use voice cup gun.
Already career mean certain beyond.",2026-02-19T15:33:43,assigned,Become form remember environmental machine. Force civil century unit. Return light agent worry.,Wayneburgh,6920.56,2,emergency,3b573514-9a6b-4950-8eb8-8779bad3cf3b,2025-07-03T11:51:36,2026-04-05T08:43:54.195910,c804425a-4cc3-4694-b687-55053cc9b341,35284735-f28f-4d1e-82f9-c29da368c7e3
959d64f2-e9cf-4b12-b528-dcae1816cf9a,1c9ccf14-5176-4c6c-8254-4abf7d027bfa,2025-10-29T16:02:41,,Value reason people civil customer. Pretty office exist quality try current evening. Themselves case follow politics human little.,2026-02-20T10:00:49,unassigned,Stuff sometimes environmental attention but. Difference opportunity focus former item line degree.,Patriciachester,6857.69,53,routine,22a17616-9d6c-4127-babc-9b9ee93a4565,2025-08-27T09:57:19,2026-04-05T08:43:54.196191,d0508adb-1a89-4d23-a9cd-8345fc6299da,18b59b2b-2ad7-4c09-9d45-18d83f50fafe
1be603bc-3e1d-4d5e-a528-0517ef0eeb3b,0ded7f06-ed67-4a95-a21d-2c431e38c883,2025-12-22T10:49:45,,Unit scientist visit. Guess hospital mouth commercial. Prepare indeed add cell professor brother.,2026-03-20T23:11:57,assigned,Kind drive story know. Me choice wife baby today exist.,South Scottshire,7539.68,40,routine,86d8cfae-3b98-45f5-bf69-5c2c422130b4,2025-12-20T22:58:08,2026-04-05T08:43:54.196478,b540cf79-7fb4-464b-b877-29f1a8206b99,7d9d6220-2d74-452f-ba50-3a375819b28b
10bf8058-96a1-4ee0-a310-1e0f03b5d862,cee53164-4353-443b-87fe-d45aa142b0eb,2026-03-27T10:22:45,,People else different most government each probably require. Question turn step accept course indeed bag. Man next either for.,2026-02-19T22:39:41,assigned,Speak reveal argue must. Dark trip six win southern most against.,Port Mollymouth,2517.84,14,emergency,db10f7b3-0b9c-433e-8ee7-109f1e0a5e43,2025-10-22T13:20:52,2026-04-05T08:43:54.196746,27a561fb-b6ba-4836-a283-34043a1d3454,e3bbaa30-cd21-4056-b68d-ee7185b530ad
a08fb315-fc4c-44d9-bb23-64a967c07d45,0cfc4b3e-0118-42f1-8bd8-617ccf8310cd,2025-10-18T16:21:18,,Read stock become positive stay everything develop. Book light fill data move Mrs. Matter father offer himself beat hit there.,2026-02-17T03:27:11,completed,Letter staff way. Local either leg window prove degree PM poor. Exactly interest always everything.,North Bradleyside,8855.42,60,urgent,7c47200a-9141-4320-9581-1836b1b7346e,2025-09-03T07:30:18,2026-04-05T08:43:54.197015,414bd871-e858-4a19-8eb0-5084edc5d945,76361bd3-72e8-4ed6-874c-f0dcabf263af
aa63d482-aaa1-4ec6-a50a-4a9019fe0495,0cfc4b3e-0118-42f1-8bd8-617ccf8310cd,2026-02-01T19:11:35,,"End fight piece indeed begin at.
Respond research manager first allow around factor return. Commercial anyone yes law there. At culture land form.",2025-12-10T21:10:12,in progress,Wind election item voice mouth. Team film campaign.,Hillmouth,8797.61,17,emergency,7c47200a-9141-4320-9581-1836b1b7346e,2025-09-12T06:32:22,2026-04-05T08:43:54.197314,6f24f569-b3b8-4921-8d10-6383ecd3267d,d9f717d9-66cd-43d4-8a62-f4b898972ab1
a703d4d6-e111-4a56-9a54-a183640e6179,8d975f8a-3c15-42d6-a033-74e9628c5264,2026-03-12T20:46:56,,Analysis gun approach image maintain serious. Allow fight detail service. Maybe something outside mean weight garden.,2026-01-24T11:35:19,assigned,Soldier eye bill. Two defense before question. Protect build peace follow.,Martinezton,138.52,5,routine,2451583c-74f2-4dc7-a31c-1d16ec257f7e,2025-08-21T23:12:32,2026-04-05T08:43:54.197625,30b40afa-8ced-429b-9e95-c3213a597f3b,209b6d70-19b5-450b-a0b9-0c6e659c0e84
54ca4449-ea05-4d86-a620-4fbce1659f9b,084e231e-e1f9-43f1-9eea-8501ecc87efe,2026-03-23T05:17:17,,Marriage when end learn star soldier. Fund like occur this peace off front. Town phone ball possible forward three.,2026-03-25T18:09:36,in progress,Adult usually eight finally list. Situation eat when friend people foreign Mr.,West Bethanyport,8047.3,72,routine,5a8e64fa-c78c-430f-808f-b3712dc2253f,2025-12-27T13:25:42,2026-04-05T08:43:54.197873,264f9d22-f498-4cb8-9c88-97d33776d483,82969ae5-e012-4a44-9761-c1ce9c908287
aa485f21-2b45-457b-8a27-40df266d78b8,cee53164-4353-443b-87fe-d45aa142b0eb,2026-04-02T05:12:24,,Follow work treat authority more when fine. Term feel who performance. Couple newspaper cover inside finish. Manage itself recently past whether adult notice.,2026-03-13T02:10:25,completed,Fish what fine issue someone modern. Move nothing live spring this standard near.,West Jordan,5829.27,22,emergency,b0f74e66-2159-4a2b-80d2-f2bd2ec7883f,2026-03-08T11:29:45,2026-04-05T08:43:54.198162,77dd8107-9513-4d51-95c8-9193b6ee5370,70e8dd6e-a42e-4e38-a775-ae2457575f0b
95079ea1-a8fd-4169-bfa8-4cbe45c24963,0ded7f06-ed67-4a95-a21d-2c431e38c883,2025-08-04T08:55:53,,"Better add experience laugh young. Bill full story again customer must. National up eye social.
Reflect nice establish bring wrong future organization. Their board several fill improve night laugh.",2026-03-23T21:12:43,in progress,Dinner here analysis subject bad exactly expert argue.,Lake Nicholasshire,6343.33,49,emergency,0e694953-3067-40a7-881c-3d5676a57180,2025-06-18T11:41:28,2026-04-05T08:43:54.198454,92abd489-c65f-4bb4-99ca-f5a7cda091d5,932ca938-796c-4369-947c-e78258b2e6bf
cfd662b8-f02f-42bd-9e0f-9f5c030a543d,1c9ccf14-5176-4c6c-8254-4abf7d027bfa,2025-12-24T09:32:25,,Sort per game. Important concern six hospital political consumer number.,2026-04-10T08:04:41,in progress,Senior training our goal toward. Son material let business one.,Lake Melissaberg,6497.42,37,emergency,80040808-cc84-4679-baa9-bf31134fb1e1,2025-11-19T21:42:13,2026-04-05T08:43:54.198739,7b46ad12-e8c2-4d08-8a13-e827122bcd27,718c49ff-071a-4a36-9470-c3c73bbb940d
b1f79c16-d5c5-4673-8190-c6dd4f1dcc58,0cfc4b3e-0118-42f1-8bd8-617ccf8310cd,2025-11-29T18:35:41,,Seat source leg magazine property anyone. Lot effect imagine once.,2025-12-29T02:30:05,unassigned,Cause drop technology both edge tree.,Bakerfort,7691.09,34,emergency,7c47200a-9141-4320-9581-1836b1b7346e,2025-11-11T07:04:02,2026-04-05T08:43:54.199001,333333f8-f7cf-474a-a9f1-23823a6956a9,ac19b38d-553a-437b-aa96-41a552879d5b
e2aeb872-ac3b-4e94-8284-a8902582e96c,0cfc4b3e-0118-42f1-8bd8-617ccf8310cd,2026-03-16T04:20:03,,What those born white fish social play. Few beautiful project discussion. Government sign such keep meeting reduce. Hard throw relationship edge once yeah.,2026-03-27T22:59:58,unassigned,"Within travel throw miss. Soldier get top generation.
Home age wife class can great.",Morrishaven,7404.4,49,urgent,231fe4ef-9dfa-4029-a4b7-07ba7d1b832f,2026-02-21T19:11:40,2026-04-05T08:43:54.199281,1dfcf478-2ca3-4544-ae82-c1ef18bdc1c6,0e693fe1-4e16-4845-a016-88c3769b3835
121e41b7-f3b4-42f4-b861-325d1b8d29ce,0cfc4b3e-0118-42f1-8bd8-617ccf8310cd,2025-09-15T11:23:56,,"Body current part book dark explain beautiful. Son hard when line. Own office deep one.
Onto approach carry land. Pick news series tonight. Boy fall collection its appear career stuff month.",2026-02-08T23:56:44,in progress,Stay small this company central. Air decide north door.,Lindaberg,3277.92,39,urgent,29f7720e-b3e1-4b2b-bae3-d90c474d8fd6,2025-09-14T20:29:07,2026-04-05T08:43:54.199551,bfc085ad-eff6-4866-ad78-3525464167d3,f907f4af-a2af-47ab-992d-7ec9735cf265
f219cc04-8f1c-4dbe-bf52-81caa03e0f75,a64c8bad-2eed-4f71-9a2c-ab6446555b42,2026-02-08T08:09:06,,"White lose produce. Tv or character recent same commercial final dog. Family ability month enjoy model question.
End today finally treat. Debate behavior listen news.",2026-01-24T12:55:43,assigned,Field daughter course recently audience message. Boy whose eat one.,North Melaniemouth,2480.48,20,emergency,a229b0b2-b50d-4763-99d3-cc948a68b30a,2025-12-14T02:16:12,2026-04-05T08:43:54.199805,6a16fde1-e3ef-4552-871b-800bc2b769dc,ecb0d275-004b-4484-a063-627f0bf307c1
0fc8233f-cb0d-48c3-997f-ea2dc19410aa,cee53164-4353-443b-87fe-d45aa142b0eb,2026-02-25T09:28:15,,"Contain activity woman standard under after wish. However yet join weight perhaps toward born. Week make hotel goal picture various.
This nature bad suffer. Every unit six later degree marriage word.",2026-03-17T18:32:15,assigned,Song picture care very put experience eat. Suddenly floor add company up local.,Lake Pamela,9548.82,25,emergency,8d6527a3-961e-489c-86c1-47e7ddc60d4d,2025-12-12T12:58:15,2026-04-05T08:43:54.200125,db581e51-2b80-4139-bdeb-2d33aff59ad9,9a79509b-4519-48e4-a9ca-d9b345352a08
878aba8f-dcbe-4fa6-9a06-ecc1f2ffa2eb,cd464691-0ec1-4610-90bd-ddf7f41e4b75,2026-01-29T09:51:14,,"Across eight over. Him voice personal culture.
Key machine win eat. Participant ago theory during report her. Their ten trade subject.",2025-11-07T21:32:52,in progress,Four idea parent. Role up medical could senior reach.,Port Savannahstad,4227.73,59,urgent,e86fef08-42cf-49ee-b84d-4480cf6dd429,2025-09-29T20:29:06,2026-04-05T08:43:54.200416,642aadeb-2174-4d6e-a645-e309d8b4ef71,f2b35040-072b-403f-980c-e7956c2f1cf8
675a2c80-6e6f-4798-ad75-4d0e82396257,2420f3e7-c826-47ed-9895-1c516c602cfa,2025-09-12T23:56:42,,Food exist show general sort difficult sister. Recognize current good democratic example military. Red exist consider half.,2025-10-11T15:37:13,completed,Name democratic rather strategy. Necessary suffer defense pick lose. Finally decide another.,New Aaronview,512.43,21,routine,aa1ac17f-2d5e-4c5d-a221-1e46d0f7d84b,2025-06-11T14:20:42,2026-04-05T08:43:54.200658,82969ae5-e012-4a44-9761-c1ce9c908287,63001a22-4664-4594-b38c-a44a18dd4e73
11e90371-a9f3-4d0f-8765-26ca728565b8,1c9ccf14-5176-4c6c-8254-4abf7d027bfa,2026-03-12T17:14:52,,"Effort ok onto market. Individual offer interest everybody word data affect. Artist some thus lay really hope.
Hospital forward candidate necessary.",2026-03-31T01:29:16,assigned,Role walk simply military main business blue. Role receive until scientist run alone until.,South Leslie,9028.01,38,emergency,22a17616-9d6c-4127-babc-9b9ee93a4565,2026-03-05T22:03:24,2026-04-05T08:43:54.200915,59a74b3f-4efc-4989-9e7c-394b3c8ec633,615fbe88-4e78-42b9-a0e3-ec092a2b22ab
6fa7500e-4990-4eed-81bf-9550c25742d6,1c9ccf14-5176-4c6c-8254-4abf7d027bfa,2026-02-12T11:04:56,,"Election me growth movie.
His father who lawyer focus PM. Yourself ready already possible tough worry.
Responsibility thing out structure middle. Probably successful indeed meeting and grow free.",2025-11-05T05:34:16,in progress,Produce stuff industry. Ball avoid near close mean window happy.,Fergusonville,4950.08,54,urgent,22a17616-9d6c-4127-babc-9b9ee93a4565,2025-08-21T08:04:32,2026-04-05T08:43:54.201213,45e62ec0-0158-477b-b8da-9b497d289b83,ad8512f2-b7a1-4487-9478-8a1f0466ead2
d353329e-17b2-4a80-85b1-a60a8fb7851c,a64c8bad-2eed-4f71-9a2c-ab6446555b42,2026-02-06T20:11:50,,"Field also show well back. Learn improve down company conference. When plant staff.
No develop lay identify.
Firm simply everything respond prevent peace her. Prove send simply.",2025-12-24T01:39:17,unassigned,Account body public nice garden. Method husband amount suddenly be answer catch really.,East Timothy,9636.38,65,routine,25be841a-77c7-4ba2-a472-92a8a60beeaa,2025-10-22T14:48:52,2026-04-05T08:43:54.201564,a2a5ba71-5a3d-4b53-8869-7020987f96e4,37288ad5-d2a4-4436-a093-c423d202eea3
01220cd3-9749-4538-80ea-d9e39bde387b,0cfc4b3e-0118-42f1-8bd8-617ccf8310cd,2025-08-13T00:31:30,,Message peace trade listen effect American. Least feel what eat full.,2025-08-23T13:23:41,unassigned,"Federal Mrs from fine blood.
Computer note food. Degree describe research grow owner city agency.",South Ann,5824.29,15,routine,231fe4ef-9dfa-4029-a4b7-07ba7d1b832f,2025-06-25T16:37:47,2026-04-05T08:43:54.201820,d47974d1-5429-4e87-bef3-b091e2a53b43,ee7c9f82-e01a-4e47-b026-dcde3675b390
8ad0cdfd-67cd-4427-b66f-12cd88ad8542,8d975f8a-3c15-42d6-a033-74e9628c5264,2025-12-12T06:26:14,,Real service area instead across choose. Nice thank time can seven.,2026-03-23T02:46:24,unassigned,Win outside evening.,Benjaminberg,467.24,30,urgent,e8844ffb-9054-4bbb-a468-5f0edbb4c036,2025-12-09T22:44:16,2026-04-05T08:43:54.202065,54ba4c6a-a4fa-4960-b2ba-264a795323a5,a97d67a9-7be0-4230-9b9f-8b7a77134931
fe565a83-d270-405e-af8e-74a57b516da4,1c9ccf14-5176-4c6c-8254-4abf7d027bfa,2025-09-06T18:05:22,,"Fast she itself between full eat. Huge dinner daughter simply set step.
Each hotel lose special. Nature throw painting report director land organization page. Wide include American occur enter.",2026-01-23T09:31:29,unassigned,Form event listen notice state president family. Pull leader marriage serious now.,Port Gary,6322.12,38,emergency,f5c66a6c-dab7-4bd9-b05f-5bf8530c5350,2025-08-03T02:48:43,2026-04-05T08:43:54.202366,3cb91134-9784-47d8-98b5-344cc9ad398b,845430e6-e588-49fc-9a00-9ddc75106e63
b06ef851-3c81-46e4-bc02-dc93d21f32c3,0ded7f06-ed67-4a95-a21d-2c431e38c883,2026-03-03T07:25:47,,"Plan us attack only likely.
Listen performance magazine want. Sea support environment song a account despite.",2026-03-14T22:13:25,assigned,Reflect pretty current. Be specific sense very business young. Control into beyond commercial.,Port Erichaven,3616.5,21,urgent,4fbf5b76-1e33-47e3-9ab2-81c5589251fc,2026-03-02T16:15:08,2026-04-05T08:43:54.202641,f9daf376-f829-4674-8caa-224f3c97cb1a,f1a36fc4-04c5-427c-a5f4-434fece999ea
eadc0c50-14b6-414f-8950-e43c9c5c3d99,0cfc4b3e-0118-42f1-8bd8-617ccf8310cd,2025-09-14T08:40:05,,"Soldier executive significant old memory else stay. Company until institution oil radio build. Garden media this current best establish.
Computer soldier itself lay pull. Leader six show face.",2026-02-26T15:29:45,in progress,Crime meeting man house. Film six despite ago reason. High true consider evening.,Lake Yvonnemouth,3676.48,31,routine,7c47200a-9141-4320-9581-1836b1b7346e,2025-07-02T19:37:50,2026-04-05T08:43:54.202927,a48368c0-70b6-4fa9-bda2-2da4a60f1e58,5aef8d6a-0ad6-4425-9a65-47b066e23a99
de2aca87-6f9d-4f8d-9a1c-1e892ac0940d,0cfc4b3e-0118-42f1-8bd8-617ccf8310cd,2026-03-28T08:38:14,,Myself season impact. Management respond we yourself arrive ok. Town financial seat note family. Pattern beat investment still read quickly south.,2026-04-02T18:36:13,assigned,Vote five around use. Including ask politics feeling tree.,North William,2087.44,19,urgent,7c47200a-9141-4320-9581-1836b1b7346e,2026-03-20T19:16:45,2026-04-05T08:43:54.203183,befe9116-16b7-499f-9819-0b995e0bba86,6318ca51-ba4b-429a-a3b4-1abe0a9bcbc9
d7498112-53ff-4514-92b9-21f0a0da4d75,cd464691-0ec1-4610-90bd-ddf7f41e4b75,2026-01-15T18:19:14,,"Over heart green type respond ok. Six daughter past fight.
Particular investment section my song my. Control arrive foreign think book simple hospital ever.",2025-11-24T14:37:47,in progress,Sound citizen all yourself. Food woman easy area.,Kruegerborough,9981.89,39,emergency,ed2da5e7-d501-4d62-952e-1d3134a962fd,2025-07-30T08:05:00,2026-04-05T08:43:54.203513,7bdd5409-8615-4532-82f3-81999ef821be,ee6be0f4-3111-472a-a4ac-d15627717f33
4ab74d24-6b13-43e7-b527-fb5a8b3be858,0cfc4b3e-0118-42f1-8bd8-617ccf8310cd,2026-03-13T20:51:12,,"Various position within possible law. Worry third must ok.
Tell actually unit cause medical me decade happen. Can according point compare church.",2026-03-26T10:13:28,in progress,Notice ability learn parent relationship. Store want listen fill born stock recognize economic.,New Thomas,3442.27,8,emergency,6e2cc6ee-6bac-4671-90d2-86b1c56c0fe5,2026-01-24T16:24:17,2026-04-05T08:43:54.203771,ba877233-6e38-454c-8214-b2992ede3e16,ae1cc33d-e5e1-4f21-84fc-6bbd08205b31
