id,assigned_vendor,client_id,assigned_at,completed_at,description,work_order_name,estimated_start_date,estimated_end_date,current_status,comments,location,location_type,latitude,longitude,estimated_cost,estimated_duration,priority,well_id,service_type,estimated_quantity,units,is_recurring,recurrence_type,cancelled_at,cancellation_reason,created_at,updated_at,created_by,updated_by
1cf913f0-09d2-4de6-9766-c51ecfed3865,8d2e71e3-0422-4b11-bab4-6af9543a3839,691a7e30-5a38-47ce-b009-80b80a73e695,2026-02-25T08:52:08,,"Old pretty way quality act.
Seat speak also federal center behind table. Include prevent beyond provide none lose. Trip guy economy public key must. Perform try son face lawyer program.",WO-19430,2026-02-27T03:22:42,2026-03-03T03:22:42,IN_PROGRESS,Cover fast similar another summer another large.,South Tammy,GPS,62.885401,5.82494,34517.49,"1 day, 0:00:00",MEDIUM,83c78c61-784a-48a3-b5d2-5b02a171f8a2,0e86a864-3c22-4865-be33-9cbe67fc6cba,27.52,gallons,False,,,,2026-02-23T13:37:33,2026-04-15T18:10:30.918555,eed20be3-a6d5-4f40-a2af-0ad51bb11032,3d2f9751-fe2f-4802-83a2-3eced8e53d5d
5237a606-bc9c-426e-9ecd-c088712feea4,174a76cb-9bbd-48fa-82c3-f88bcdf4c7aa,04139841-be62-450b-bd98-1aa2a541894b,2025-03-08T19:30:39,,"Various close technology what effect amount. Tax example consumer former. Old once north money information talk front produce.
Low member discuss account door front.",WO-02874,2025-03-10T09:01:17,2025-03-14T09:01:17,REJECTED,My pick make score expect think. Usually dinner produce they head.,Russellport,GPS,52.928522,25.554688,21547.36,"2 days, 0:00:00",LOW,64ee6292-ed9b-4a4c-908c-2264b84270db,cb49e5de-7799-42e2-98e8-44fad7981926,27.56,gallons,False,,,,2025-03-07T06:38:52,2026-04-15T18:10:30.919014,f17f327d-003f-4c68-a351-da3d5a872ca2,09c462d1-8ac8-410e-a360-89e7e7248ab7
1df9fb01-ba42-4150-ba72-325adde855b6,4efb429c-f661-47c7-8be1-26bcd85624cc,c47f7a97-07de-45fc-b329-df9d514c1dd8,2025-05-04T16:21:33,,"Could head lose different add daughter. Time ask activity tax hit.
Piece almost game. Baby everyone live. Politics role color doctor end since. Marriage ahead risk tax sister improve.",WO-49825,2025-05-06T15:28:13,2025-05-11T15:28:13,IN_PROGRESS,Image yes black baby consumer. Tree somebody those blue.,Lake Karen,WELL,-38.93281,-28.168791,6896.16,"3 days, 0:00:00",LOW,55abbe3d-3bd9-4289-b279-ab674df24bc8,1ecd42cc-80e4-426b-8a62-3e3dc4dc248a,95.08,hours,True,WEEKLY,,,2025-05-04T10:46:57,2026-04-15T18:10:30.919575,26b77aa2-60a0-4fe5-9ac1-97638c0caa8f,da0d89c3-8d11-46c7-b686-6aed0d477f7d
fa775c96-cfa6-45a5-8416-a694c157f927,58f9dbaf-1659-4d39-9ffe-a44624472704,c47f7a97-07de-45fc-b329-df9d514c1dd8,2026-01-10T07:21:05,,"Offer hotel day service. Ok woman tough.
Position charge director small according song history. Tree bank indicate old fish. Us beautiful join subject necessary opportunity.",WO-82736,2026-01-11T14:27:45,2026-01-12T14:27:45,ASSIGNED,Full likely hear onto good either. Or up never.,Schroederside,ADDRESS,45.110492,11.549464,27005.9,"1 day, 0:00:00",HIGH,0e3fb706-69e2-498c-b02f-99e12010398b,9cec2b70-8268-49b0-9790-027f56d65b08,40.16,gallons,True,WEEKLY,,,2026-01-07T14:29:03,2026-04-15T18:10:30.920044,7fce6227-dab2-4582-be37-62e677f9ab58,df380b64-a1d3-47a6-9fc3-c48b4cb4ed42
e58da9e0-2a2e-407e-ba70-86d63d0268e4,4efb429c-f661-47c7-8be1-26bcd85624cc,04139841-be62-450b-bd98-1aa2a541894b,2026-03-08T17:22:10,2026-03-11T12:22:39,"Year group sure walk option thought. Both money tough adult consider.
Poor ever north member sing. Democratic million mean. Employee spring oil worry.
Out assume fish. Choose bank next few realize.",WO-01074,2026-03-09T15:31:49,2026-03-10T15:31:49,COMPLETED,Mean summer history yourself week shoulder. Especially body camera discuss discuss adult college.,Kimberlychester,WELL,-48.088493,-154.197152,25324.22,"2 days, 0:00:00",LOW,adae98ef-7f24-4190-81fa-484cdd62c623,1ecd42cc-80e4-426b-8a62-3e3dc4dc248a,16.54,loads,True,ONE_TIME,,,2026-03-07T01:41:29,2026-04-15T18:10:30.920436,72e32496-904c-4fcb-a9a2-31d42d201bd5,7fce6227-dab2-4582-be37-62e677f9ab58
98f84083-8a45-4633-8700-518ba2214f78,cddd5f7c-18e5-439d-b906-a347d43c668d,882b9fc4-ab62-40eb-8d69-87c3efb8debd,2025-03-14T18:21:42,,"Majority form our herself. Choice north animal appear bag material. Ok speech watch hour investment matter.
Important picture three plant just scene. Catch something two learn possible him suffer.",WO-02731,2025-03-16T00:03:34,2025-03-20T00:03:34,ASSIGNED,Own up art experience. Person themselves leader official either lawyer.,Reevesmouth,ADDRESS,-67.744505,-164.074452,6994.06,"3 days, 0:00:00",MEDIUM,7db02384-cd8f-4f4a-ad93-eb28ac94acc3,9cec2b70-8268-49b0-9790-027f56d65b08,86.34,hours,False,,,,2025-03-12T01:19:19,2026-04-15T18:10:30.920728,793edc3f-30d6-43cf-bbce-c79977fe1502,acd069ef-6123-4ffa-906d-b111d4788912
c1b3048b-b6ff-4d6d-bd78-acdc170e5ff9,4efb429c-f661-47c7-8be1-26bcd85624cc,678c61ab-e0a4-40b1-af00-261f9020c2ca,2026-04-15T13:09:17,,"Large easy necessary science camera. Operation thus whether myself Republican. Ok green compare sense item watch a.
Plant financial benefit. Support kind pattern order TV say scene learn.",WO-71053,2026-04-15T16:44:44,2026-04-20T16:44:44,IN_PROGRESS,Seem eat fill hit. Realize memory best man. Argue quickly church deal.,Kathyland,WELL,-29.8717075,-134.335672,10117.06,"3 days, 0:00:00",MEDIUM,edc1cbc0-6981-4e5b-accb-e54d573652b3,1ecd42cc-80e4-426b-8a62-3e3dc4dc248a,78.69,visits,True,MONTHLY,,,2026-04-15T09:32:43,2026-04-15T18:10:30.921015,e3d8a13b-cccc-40f7-88bd-d615dc4f8ecb,fdd5b344-7a8a-49d1-9cce-659b067753d3
a6e5c26f-a536-474c-9a30-2d939b98f02d,faa66382-4806-43a8-8a5d-ac3393c400fd,66d9ecee-f243-482d-98d8-69b8b0179d6b,2024-08-21T17:11:35,,Bag strong campaign the movie. Parent a student year policy science. Order will represent reason.,WO-59872,2024-08-23T15:17:59,2024-08-26T15:17:59,ASSIGNED,Score eye west apply resource important tell. House major call order.,Allenmouth,ADDRESS,-63.0093905,-171.484349,19140.75,"2 days, 0:00:00",LOW,c939336d-7723-43ae-9052-08348184324c,9cec2b70-8268-49b0-9790-027f56d65b08,23.0,visits,False,,,,2024-08-20T05:53:12,2026-04-15T18:10:30.921258,00de9876-5af2-4d28-891d-966bb1115aa8,b92b94b7-5b9b-4092-b0de-2b2973b972f0
464ab30e-02f0-4ae8-978d-a90d0a9b3f6b,646727fe-d9d3-47f4-abd3-a0bbe4e4c1bc,fb7640ea-e12f-44b2-a4e1-18957b81adb3,2025-09-14T22:38:24,2025-09-20T15:08:51,"Course state school wear site player. Mother cell marriage. Hear director why and seat this lawyer.
Message blood production factor. Stand step enter discover note region likely.",WO-37012,2025-09-16T11:52:45,2025-09-20T11:52:45,COMPLETED,Yourself under study study answer different drop. Determine ball operation last parent.,Moralesmouth,WELL,47.244072,111.196842,36514.09,"2 days, 0:00:00",HIGH,e3a8d94b-62ff-40a2-90f3-b891c4aac1ee,723a7696-0101-49f1-9967-329b83246c8a,71.74,visits,False,,,,2025-09-13T00:26:35,2026-04-15T18:10:30.921548,779f5efb-5068-4174-8ea1-4a9033ef4deb,67fdcf9d-359b-48d1-b178-0266022d26f2
f2a211f4-dd14-4573-a27e-7876489da34b,faa66382-4806-43a8-8a5d-ac3393c400fd,66d9ecee-f243-482d-98d8-69b8b0179d6b,2025-11-10T13:33:46,2025-11-13T12:53:24,"Inside bill plan really mother never.
Customer course response score single. Strong green find study character.
Others election stock practice increase behind none total. Agree science single they.",WO-32525,2025-11-10T20:01:07,2025-11-15T20:01:07,CLOSED,Knowledge indicate trip. Hotel ability card free add win.,Dawsonton,WELL,-47.2042195,-56.276846,16955.56,"3 days, 0:00:00",LOW,c939336d-7723-43ae-9052-08348184324c,11140ee8-eb7c-4db8-bf89-1b9b4dec4035,10.44,gallons,False,,,,2025-11-09T19:25:08,2026-04-15T18:10:30.922669,1bc723e4-7120-489e-a30f-41b05c363e76,4bc55327-7b86-42d1-811c-c7ecf3ad62f1
bf91f262-b1f8-467b-8827-0ddede404e9c,174a76cb-9bbd-48fa-82c3-f88bcdf4c7aa,678c61ab-e0a4-40b1-af00-261f9020c2ca,2026-04-04T16:44:21,,"Ability area affect professor value dark. Report test believe fund. Industry city us song task scientist first.
Oil industry another case.",WO-96764,2026-04-06T06:33:45,2026-04-10T06:33:45,IN_PROGRESS,Out scene feel man manage. Character student step law shoulder character budget provide.,Lake Patrick,ADDRESS,16.322123,-123.471061,38486.72,"2 days, 0:00:00",MEDIUM,c3da1d19-9580-4a71-bccb-a3c18e8f9096,9cec2b70-8268-49b0-9790-027f56d65b08,31.83,loads,True,ONE_TIME,,,2026-04-02T22:42:25,2026-04-15T18:10:30.923428,a2235ad8-7e9c-4ae3-b5e8-c7e8fb66f793,2de3fff2-1d7c-4572-8183-86e714bf95e6
0830ee44-2e0f-4eda-bf37-aaeba962f936,4efb429c-f661-47c7-8be1-26bcd85624cc,c47f7a97-07de-45fc-b329-df9d514c1dd8,2024-08-09T13:49:32,,"Democratic left town out. Statement bed read mission choice seven perhaps.
Section less lawyer serve but camera. Administration east else require month.",WO-63321,2024-08-09T19:55:25,2024-08-11T19:55:25,HALTED,Pay effect almost the. Manager challenge tough to.,East Jeffton,ADDRESS,-69.6082055,53.882945,27506.64,"2 days, 0:00:00",HIGH,55abbe3d-3bd9-4289-b279-ab674df24bc8,1ecd42cc-80e4-426b-8a62-3e3dc4dc248a,24.34,visits,False,,,,2024-08-07T06:15:16,2026-04-15T18:10:30.924058,a20fee26-7da5-44eb-825a-5a82f809b78d,e61573c1-ae72-498e-b2c0-5432fb1cfd5b
60ef6490-1bdb-4c24-96c1-d36fdd63dc7f,faa66382-4806-43a8-8a5d-ac3393c400fd,84e86518-3a3e-4445-8f1c-4328934ff3f3,2025-05-09T21:39:41,,"Whole senior worry strategy.
Color join town onto western. Performance message until minute heart real in. By instead agreement operation.",WO-57958,2025-05-10T19:59:57,2025-05-11T19:59:57,CANCELLED,"You number girl strategy.
Thus have project apply firm reduce threat quickly. Child since head.",West Jose,WELL,84.084654,37.450643,26236.98,"1 day, 0:00:00",LOW,26674d61-d034-4f7e-8a6f-7303b6c6ec24,11140ee8-eb7c-4db8-bf89-1b9b4dec4035,20.54,hours,True,DAILY,2025-05-10T14:04:30,Duplicate order,2025-05-06T22:52:09,2026-04-15T18:10:30.924762,24c7f89a-3d7d-4a14-89bd-a4f76baaa1a6,78ca308d-9cfb-4425-b356-0a549011cc4c
0aadf2ae-12aa-4b49-9b95-e0c65f6de9cb,174a76cb-9bbd-48fa-82c3-f88bcdf4c7aa,691a7e30-5a38-47ce-b009-80b80a73e695,2024-07-24T14:44:30,2024-07-26T02:02:03,Evening left morning painting group six discover. Analysis enter medical sort science born. Trade state subject national.,WO-88247,2024-07-25T12:52:41,2024-07-27T12:52:41,CLOSED,Look quite list ground. Trip type try.,Kellymouth,ADDRESS,-22.4819825,-23.811891,20270.58,"2 days, 0:00:00",LOW,a87d58bc-fc0f-48b2-872b-8ef7e5bb3b9d,16c270b4-3b14-467e-9cc3-879f37e9a5db,44.11,loads,False,,,,2024-07-22T08:51:30,2026-04-15T18:10:30.925438,3dfc9932-a736-408b-ab4d-8f910a4b70ab,d70fa11b-a911-48fb-ae9b-6fdd1f4a2d01
5b7f0260-3f73-406c-9765-bea5858653c2,d37db5f8-d37f-49c0-b8b2-76d6a45ab850,ed8cf4c2-c280-4462-92ab-89c394e00cfc,2024-12-25T17:07:25,,"Push now edge guess edge use increase degree. Lay better reality put.
Stock positive either response.",WO-48394,2024-12-25T21:07:21,2024-12-30T21:07:21,REJECTED,Guy manager democratic new hour radio yard. Training executive write give show begin.,Haynesberg,ADDRESS,51.567278,73.609376,14864.74,"3 days, 0:00:00",LOW,b6f7a498-7647-4673-8d48-e9417fcf3625,af516e74-dbad-4474-9b38-fee85f1c5f93,80.48,loads,True,DAILY,,,2024-12-25T11:32:17,2026-04-15T18:10:30.925973,4f9a6aa2-e203-44fa-9b9e-6a0dfdfd5e30,92ec116d-fc24-4327-951d-e9108236763c
e7677ed4-8e98-479c-a068-d4c4dc2dad40,58f9dbaf-1659-4d39-9ffe-a44624472704,731e4fd5-b8ef-4d21-add8-632f22763d09,2024-11-16T09:15:36,,Trial evidence lose early have PM. As yard medical ability maybe effect rate.,WO-95376,2024-11-18T08:17:48,2024-11-20T08:17:48,REJECTED,Street watch close sense state writer claim become. Sit people group poor whom.,New Kristaview,WELL,12.2598365,83.79153,986.15,"2 days, 0:00:00",LOW,054abf16-2d48-4ac2-96ae-1658db6e0fb2,16c270b4-3b14-467e-9cc3-879f37e9a5db,15.88,hours,False,,,,2024-11-13T16:12:31,2026-04-15T18:10:30.926544,395f06ad-c205-47dd-bf8f-54f36cc2718e,ea9d778c-cd1c-4f95-a237-36d86e9d4474
dfd00acf-09d1-49ae-9079-c94cff3e1f52,58f9dbaf-1659-4d39-9ffe-a44624472704,b43e3365-5df9-4195-a65d-d09d87c032b0,2025-01-07T15:41:55,2025-01-11T08:32:01,"Idea author care purpose education.
Ball hundred daughter thought piece. Require future how student ball film.",WO-67413,2025-01-09T03:10:51,2025-01-12T03:10:51,CLOSED,"Shoulder a energy education every.
Modern thank society draw able. Type but process.",Port John,WELL,6.335748,146.208955,29925.5,"1 day, 0:00:00",MEDIUM,254ea4de-f7cc-422e-86bb-4db3d83aaee0,af516e74-dbad-4474-9b38-fee85f1c5f93,64.0,gallons,True,MONTHLY,,,2025-01-07T14:07:33,2026-04-15T18:10:30.927274,673a3bb1-5e70-4851-8d2a-60deb1abd5b0,72423661-b0d5-4e6a-b216-0ccf363c7b4f
f06aa286-1667-4b41-99d7-20082a060082,d37db5f8-d37f-49c0-b8b2-76d6a45ab850,72036ee9-cdd1-4b01-beee-c44773ada2dc,2025-01-01T12:06:35,,"Forget effort Republican lawyer. Cold question owner. Certain both lay candidate military product now onto.
Newspaper cup between soon. Explain interview budget give under individual top.",WO-08146,2025-01-01T20:46:35,2025-01-06T20:46:35,CANCELLED,Senior much natural address PM option. Deal position watch political truth close.,Reidfurt,GPS,18.580517,169.691903,46748.24,"3 days, 0:00:00",HIGH,49fd3478-3169-450a-86a8-4fd09fbb2fbe,af516e74-dbad-4474-9b38-fee85f1c5f93,64.52,gallons,False,,2025-01-01T15:50:33,Resource unavailable,2024-12-31T12:44:21,2026-04-15T18:10:30.927881,37c3001a-85c5-40c7-b5b1-67fdf72587a5,31a74116-b53b-425e-b72d-778006c01b81
bbdc7fed-6176-4908-a8fe-a5b007fba947,cddd5f7c-18e5-439d-b906-a347d43c668d,161a2cf7-5893-41ae-b4c4-d338e37dc1c5,2025-01-03T10:53:59,,"Best us relationship car moment point. Fill age I throughout. Whose represent candidate myself tell.
War debate live manage.",WO-13093,2025-01-04T11:46:32,2025-01-09T11:46:32,HALTED,Television prepare put them. Tree turn clearly for next control.,South Daniel,WELL,64.8340475,-29.720149,16842.93,"3 days, 0:00:00",HIGH,4e27aceb-da8a-41bf-90c2-00a6e9220982,9cec2b70-8268-49b0-9790-027f56d65b08,28.45,days,True,MONTHLY,,,2025-01-01T11:20:24,2026-04-15T18:10:30.928382,6f49a0fd-61af-4762-b3f6-76f6b57e2e73,deb36f2e-0a15-481f-b1ff-5cb72033014e
e53567df-13f2-49b0-864c-f23a719d9eb9,cddd5f7c-18e5-439d-b906-a347d43c668d,fb7640ea-e12f-44b2-a4e1-18957b81adb3,2026-04-15T03:53:49,,"Born lose tend many boy because better.
Amount center wish price catch still. Collection cause hot produce leave skin success common.",WO-85111,2026-04-15T17:31:00,2026-04-17T17:31:00,ASSIGNED,Why science heavy. Side break fact everybody. Affect that knowledge mission.,Zhangland,WELL,65.6863015,-108.492394,8658.51,"1 day, 0:00:00",MEDIUM,e3a8d94b-62ff-40a2-90f3-b891c4aac1ee,9cec2b70-8268-49b0-9790-027f56d65b08,8.7,hours,True,DAILY,,,2026-04-15T00:44:09,2026-04-15T18:10:30.928975,6f5619a4-afa3-47bd-b351-c73061467537,a5a73ec0-e6f6-40ff-856f-9e8e57e8f52f
93c6578e-ae8e-400b-a801-6cc0d391e5c7,faa66382-4806-43a8-8a5d-ac3393c400fd,61e56726-2b7d-4134-a6cc-529289b2b54c,2024-04-23T16:23:46,,"Suddenly system box ask prepare expert treatment. Take help movement agree reduce.
Finish draw nor store. Rate power ten rest include.",WO-91472,2024-04-24T05:37:16,2024-04-26T05:37:16,ASSIGNED,Nice amount bad.,Johnfurt,ADDRESS,1.132941,-147.727058,19176.82,"2 days, 0:00:00",HIGH,790333e2-22aa-4356-801c-1bf8e1fccc97,9cec2b70-8268-49b0-9790-027f56d65b08,47.97,loads,False,,,,2024-04-23T10:52:36,2026-04-15T18:10:30.929454,62b74d17-cabf-47bb-8114-8a5c897591bb,5ed44a0c-16bf-427a-9da4-f1e8e1e35d00
11928852-a287-4e52-9834-29a789210e3a,faa66382-4806-43a8-8a5d-ac3393c400fd,ed8cf4c2-c280-4462-92ab-89c394e00cfc,2024-08-03T18:47:57,2024-08-08T00:08:17,"Drug every fire lose today room. Far effort peace.
Attack process skin loss. Morning world raise training. Also world production mind hair learn nature.",WO-15963,2024-08-05T01:40:33,2024-08-07T01:40:33,COMPLETED,Some a require. Weight report be style total. Walk now wear fish maybe door travel forget.,Owensport,ADDRESS,87.7713425,-14.388202,35711.71,"2 days, 0:00:00",HIGH,f633e0a6-c872-4259-91e6-e6e873076c1d,11140ee8-eb7c-4db8-bf89-1b9b4dec4035,44.72,loads,False,,,,2024-08-01T11:40:01,2026-04-15T18:10:30.929993,02e1f943-dc10-4527-9f7e-56b6561838d7,db278903-8658-4fa4-b365-5ad0a8792977
8a33828d-6728-47da-8af2-18bbf2cadc8a,faa66382-4806-43a8-8a5d-ac3393c400fd,a922b7d7-c9d0-429d-82e0-ab8fd3161e02,2026-03-28T12:36:09,2026-03-30T02:38:33,"Relationship difference real eye how local. Matter prevent school religious.
Happy ball bag back machine state. Worry letter film herself oil own that.",WO-81837,2026-03-29T03:45:03,2026-04-02T03:45:03,COMPLETED,Art pretty doctor field soldier view. Laugh pass consider identify.,Hodgetown,ADDRESS,-48.6595255,93.286784,36560.33,"1 day, 0:00:00",HIGH,8c8df8d2-74ef-4891-a381-40cf7f38512b,9cec2b70-8268-49b0-9790-027f56d65b08,56.42,gallons,False,,,,2026-03-27T07:15:57,2026-04-15T18:10:30.930408,8755942c-2b6c-4170-916c-b7ad46fa63ed,2fc76754-952b-4390-9b40-9532f63e53d2
a63fe76e-bbb8-4cfd-839c-599a6f1331f7,d37db5f8-d37f-49c0-b8b2-76d6a45ab850,f525d920-9583-480f-bd27-5dff2c94820f,2026-03-24T13:53:59,,"Easy determine week of back. Message whom city buy. Glass yet fly.
Audience raise across fill indicate now specific. Great step foreign east however probably from though.",WO-10998,2026-03-24T19:29:14,2026-03-26T19:29:14,ASSIGNED,Compare young receive increase page region. Remain movie community than choice lot degree.,Brittanyview,WELL,75.7248075,161.710864,16758.35,"2 days, 0:00:00",MEDIUM,1d368a2a-1655-46a6-a06f-99658461cf29,af516e74-dbad-4474-9b38-fee85f1c5f93,50.78,hours,False,,,,2026-03-23T20:07:52,2026-04-15T18:10:30.930778,1fe87dcf-eb84-4a43-b4fe-1bc75d164bab,2c1bc234-7f2a-41db-acdd-953ace881371
7d0949bf-8cd1-496a-85b4-1d8040da3c7a,4efb429c-f661-47c7-8be1-26bcd85624cc,c47f7a97-07de-45fc-b329-df9d514c1dd8,2024-10-19T23:19:20,,"Capital sister last cultural join nearly guy. Attention onto American arm doctor fill.
Listen painting keep heavy garden she indeed. Note under maybe various. Paper before case feel wall when dinner.",WO-79356,2024-10-21T09:12:51,2024-10-24T09:12:51,HALTED,Group behavior former finally energy rule. Leg arm stop make medical day.,Tylerview,ADDRESS,-23.563186,-22.362092,43227.67,"2 days, 0:00:00",HIGH,55abbe3d-3bd9-4289-b279-ab674df24bc8,1ecd42cc-80e4-426b-8a62-3e3dc4dc248a,63.59,visits,True,ONE_TIME,,,2024-10-19T02:59:48,2026-04-15T18:10:30.931210,522ac2c4-4e3c-4ef2-863d-db8655a38006,33b016a2-3b2a-4dd9-9c3c-4eed80a66a87
50107aa6-7f5c-4233-b07b-8e54b8fb46bd,8d2e71e3-0422-4b11-bab4-6af9543a3839,882b9fc4-ab62-40eb-8d69-87c3efb8debd,2024-11-10T05:00:33,,Air throw late sit computer lead teacher. Candidate pretty whether listen pretty easy assume. Congress night short station for often move.,WO-97168,2024-11-10T23:25:47,2024-11-12T23:25:47,IN_PROGRESS,Bed list spend fill herself become different cup.,Brownmouth,WELL,-35.690778,112.654188,41786.19,"1 day, 0:00:00",LOW,8227da16-8558-4d8d-871b-ac9431613168,1ecd42cc-80e4-426b-8a62-3e3dc4dc248a,44.89,hours,True,MONTHLY,,,2024-11-10T02:43:11,2026-04-15T18:10:30.931708,e274a57e-8fab-497c-8b9a-05fb70f40d3c,23ae6dda-4cdc-44f5-9824-c00d9c84e150
f6f96ab5-e723-402f-ae97-49fb126c20db,4efb429c-f661-47c7-8be1-26bcd85624cc,ed8cf4c2-c280-4462-92ab-89c394e00cfc,,,"Start right wind marriage later between. Our value product.
No hour hair. Term hair line example.
Have worker small college course. Indicate four rise traditional between.",WO-93920,2025-12-21T22:18:12,2025-12-24T22:18:12,UNASSIGNED,Arm home manager reflect now. Occur add natural type figure. Husband star tree ability interesting.,South Sherryborough,ADDRESS,49.0184085,158.475383,44937.96,"1 day, 0:00:00",HIGH,0b0bdd90-c3cd-48dd-95dc-246105ded0fe,1ecd42cc-80e4-426b-8a62-3e3dc4dc248a,72.49,loads,False,,,,2025-12-17T16:21:19,2026-04-15T18:10:30.932205,9c1091df-98b7-4987-8590-49413b12678a,799a53cd-379e-4e44-b95e-7969ba63ea69
b8f3006a-901e-422f-8437-337b336befbb,174a76cb-9bbd-48fa-82c3-f88bcdf4c7aa,691a7e30-5a38-47ce-b009-80b80a73e695,,,"At majority type study dinner traditional. Leave mission will organization piece field. Discuss reflect finish major heart.
Age law difference like college exist film.",WO-38278,2024-10-13T19:41:49,2024-10-14T19:41:49,UNASSIGNED,Indeed hold major light fear. Each however with national somebody minute statement.,South Ronaldtown,WELL,-68.32969,81.453273,4656.45,"2 days, 0:00:00",LOW,83c78c61-784a-48a3-b5d2-5b02a171f8a2,11140ee8-eb7c-4db8-bf89-1b9b4dec4035,28.28,gallons,True,WEEKLY,,,2024-10-12T02:05:08,2026-04-15T18:10:30.932594,0b7d3fc7-4114-4a20-91c8-ade2b01b27dd,625e6615-4c17-4bd7-b55a-7e73ecb145e8
22bfada5-b342-4d3f-8c95-0a71c2a0dd46,174a76cb-9bbd-48fa-82c3-f88bcdf4c7aa,04139841-be62-450b-bd98-1aa2a541894b,2024-11-10T09:00:39,,"Record boy despite radio very machine thing too. Claim article international student who.
Film the ready phone. Which share car improve. Soon rather second business up safe system you.",WO-07578,2024-11-12T03:43:43,2024-11-13T03:43:43,REJECTED,Lot nor they even city.,Lake Josephfurt,GPS,-53.0188655,-107.263714,28624.58,"3 days, 0:00:00",LOW,64ee6292-ed9b-4a4c-908c-2264b84270db,9cec2b70-8268-49b0-9790-027f56d65b08,57.05,visits,False,,,,2024-11-08T17:07:42,2026-04-15T18:10:30.932989,02365b71-540e-456f-a38d-bdefda13ba43,fdd5b344-7a8a-49d1-9cce-659b067753d3
9ae71e70-816a-4eb9-94c0-2c1f4e99c748,174a76cb-9bbd-48fa-82c3-f88bcdf4c7aa,c47f7a97-07de-45fc-b329-df9d514c1dd8,2026-03-25T04:14:08,,Billion thus group important. Girl cut hotel key laugh despite. Total either seat great institution public.,WO-67611,2026-03-25T23:10:41,2026-03-26T23:10:41,IN_PROGRESS,Window member network. Owner can million push soldier prove.,Port Amanda,WELL,55.570957,-141.480586,32078.31,"2 days, 0:00:00",LOW,0e3fb706-69e2-498c-b02f-99e12010398b,9cec2b70-8268-49b0-9790-027f56d65b08,87.84,gallons,True,DAILY,,,2026-03-24T21:55:46,2026-04-15T18:10:30.933385,a02b1fb1-89a8-4dc2-83a5-0bcac0ad258e,84feee3b-b405-4cc7-8b4c-2723e1f2894a
c56d2982-2633-477b-bfde-520b075724c5,58f9dbaf-1659-4d39-9ffe-a44624472704,ed8cf4c2-c280-4462-92ab-89c394e00cfc,2025-08-28T15:23:58,,What with radio politics change exactly staff. Tonight effort vote professional.,WO-93487,2025-08-28T21:10:25,2025-08-31T21:10:25,IN_PROGRESS,Financial ten return win debate. Receive worker table letter detail well catch budget.,North Scottshire,WELL,-73.799593,-99.782156,35442.74,"1 day, 0:00:00",MEDIUM,b6f7a498-7647-4673-8d48-e9417fcf3625,af516e74-dbad-4474-9b38-fee85f1c5f93,14.9,loads,False,,,,2025-08-26T22:56:10,2026-04-15T18:10:30.933759,dcad7a49-9775-494a-bf28-08f3784d58eb,b38112c6-711d-4377-9d14-0a7da5357115
7ad23917-343f-4c1a-a8b3-e12b843f2b3e,174a76cb-9bbd-48fa-82c3-f88bcdf4c7aa,fb7640ea-e12f-44b2-a4e1-18957b81adb3,2026-04-01T11:15:16,,Suffer physical accept record them low continue. Enjoy traditional else guess. Successful town power score play cell.,WO-67606,2026-04-02T14:08:05,2026-04-06T14:08:05,ASSIGNED,Especially enough none. Test education teacher price. Suddenly itself inside sing star son.,Richardsonmouth,GPS,45.3469815,-154.426902,18080.08,"2 days, 0:00:00",MEDIUM,4c5ea3ae-95c6-4aa1-bd4b-a9b6414e29b6,16c270b4-3b14-467e-9cc3-879f37e9a5db,77.46,days,True,MONTHLY,,,2026-03-30T23:58:39,2026-04-15T18:10:30.934210,3fdfbd51-0748-4437-a5e2-374bd0ef2a46,875b9b1b-425c-40a9-a2be-3a112a85e34a
0a84cd30-4c31-42e6-a14b-6de644e60d8d,cddd5f7c-18e5-439d-b906-a347d43c668d,882b9fc4-ab62-40eb-8d69-87c3efb8debd,2025-04-09T19:30:01,,Music with daughter raise begin open. Gun from officer year modern pattern describe. Measure reach personal impact by religious west.,WO-60511,2025-04-10T23:42:14,2025-04-12T23:42:14,CANCELLED,Government deep no dog write.,Vincentfort,ADDRESS,-36.520272,-176.082591,17672.62,"3 days, 0:00:00",MEDIUM,7db02384-cd8f-4f4a-ad93-eb28ac94acc3,9cec2b70-8268-49b0-9790-027f56d65b08,21.54,days,True,MONTHLY,2025-04-11T03:52:20,Safety concern,2025-04-08T10:32:49,2026-04-15T18:10:30.934604,1e5cc72b-9747-442e-bb29-be6eaf519b33,73d43e39-a8fb-4300-8bf7-eb0228a0c9d9
a6842b5c-393c-4320-8f5d-583456794b99,ab06f125-03cd-4efa-b705-80a382abe9d7,882b9fc4-ab62-40eb-8d69-87c3efb8debd,2024-07-22T23:37:14,2024-07-25T08:21:30,"Who next church evidence. Charge yourself left give.
Five front plan with. Exist several wonder pay key behavior. Will try plant participant song call wonder mission.",WO-40827,2024-07-23T12:45:01,2024-07-26T12:45:01,COMPLETED,Black more interest find doctor police. Agency anyone opportunity hundred peace.,Crawfordtown,WELL,-76.747862,148.917111,13411.87,"1 day, 0:00:00",HIGH,8227da16-8558-4d8d-871b-ac9431613168,cb49e5de-7799-42e2-98e8-44fad7981926,66.17,gallons,False,,,,2024-07-21T03:45:15,2026-04-15T18:10:30.935023,b313c6d5-33e2-416f-b318-90631e227d62,73d43e39-a8fb-4300-8bf7-eb0228a0c9d9
01aa26f2-3e4f-40db-bc30-e1fb3b969cc3,174a76cb-9bbd-48fa-82c3-f88bcdf4c7aa,f525d920-9583-480f-bd27-5dff2c94820f,,,"Avoid pattern would avoid no green. Mind industry yes.
Hospital back we offer gas. Stage ready risk campaign. Parent couple important respond.",WO-35352,2024-07-07T07:31:53,2024-07-10T07:31:53,UNASSIGNED,Reflect energy money also international include short. Until shoulder not.,Lake Samanthaview,ADDRESS,54.4100985,-103.786004,43531.79,"1 day, 0:00:00",LOW,2d88c350-49b5-45ac-8519-760a73b80453,cb49e5de-7799-42e2-98e8-44fad7981926,42.72,loads,True,WEEKLY,,,2024-07-04T20:24:19,2026-04-15T18:10:30.935507,16ce440a-c02d-4ff2-95c8-f90cc383f732,c24a5cd8-0c33-4d76-b3bb-c41e3d06a54d
9a525df5-2bba-49c3-99b8-5be5f3d4e2e3,9863f9e7-9e3e-4991-ae05-2fcfca5ff7d0,f525d920-9583-480f-bd27-5dff2c94820f,2026-03-08T14:02:43,2026-03-10T12:38:18,Where these learn born deep score left trade. Generation unit charge soon mind another side. Factor unit value who money million.,WO-77207,2026-03-10T00:31:55,2026-03-15T00:31:55,CLOSED,Explain yet remain. Already gun think describe.,Dianatown,WELL,72.738856,-125.486144,40556.46,"2 days, 0:00:00",HIGH,290acd4f-771e-45ff-9afe-7645ceadc83b,1ecd42cc-80e4-426b-8a62-3e3dc4dc248a,58.02,visits,True,MONTHLY,,,2026-03-05T18:07:01,2026-04-15T18:10:30.936261,96a16cb4-0133-455e-b509-60a062f47510,5c30e31f-6590-4724-b8d0-8a894510f49d
