work_order_id,assigned_vendor,assigned_at,completed_at,description,estimated_start_date,estimated_end_date,current_status,comments,location,estimated_cost,estimated_duration,priority,well_id,created_at,updated_at,created_by,updated_by
15b018a4-813f-46a5-bb21-551371160b68,1b193ccd-19a1-4d90-802b-c54dafe33648,2025-01-10T06:46:28,,Adult brother American. Myself position assume reason plant role turn unit. Debate yard political themselves imagine wait.,2025-01-23T22:10:56,2025-02-16T22:10:56,assigned,Huge next customer notice truth. Their cold training paper sport. Down detail very job gun drive.,South Bonnieton,33160.7,"29 days, 0:00:00",emergency,51ea7f3e-d7ac-4081-8a67-f7a56f324ea3,2025-01-06T07:10:05,2026-04-07T18:12:43.766947,f4990c60-0e72-4ffc-90bb-7da9163658c4,cb2e029a-7664-45b4-9ece-d3ab2899d0bc
85520bb7-14bb-4ce3-af2d-ddce6848a9b3,1b193ccd-19a1-4d90-802b-c54dafe33648,2024-05-26T07:38:30,2024-07-03T15:20:31,"Ago coach art turn exactly. Writer choose finish person standard city.
Building region school strong. Whom research through year front although.",2024-06-03T03:19:45,2024-06-24T03:19:45,completed,"Edge expert about thank. Picture theory second peace trade certainly.
Per job past time.",Vegaland,42833.24,"12 days, 0:00:00",emergency,ee0af0c8-bb94-4a92-a50a-33702a2938e7,2024-05-12T19:49:21,2026-04-07T18:12:43.767118,386b9856-5633-468b-9d87-8be131d464fb,bc4af0f7-8e96-468c-93da-97a8feee52f5
3e0123f7-8ad2-41b8-8225-0c39d1843ea2,2c8d1ddb-8c56-4e93-bd93-d4aaf06847fc,2025-11-07T06:20:22,,"Building house save. Forward often subject environment per above. Send determine identify certainly series ten.
Food machine Mr air kitchen wall experience. Rock vote bar sign.",2025-11-12T18:20:14,2025-11-16T18:20:14,unassigned,Along stage out care specific suggest American natural. Stock list concern green best.,South Colin,2082.49,"3 days, 0:00:00",routine,ef533c39-ab50-400a-8801-9eada7824e3f,2025-10-24T10:01:33,2026-04-07T18:12:43.767287,1e8567ec-5ad5-476f-be16-65004d279de5,ba947dc9-5848-4203-adbb-cb693460acdc
c79225ff-32ec-4e9e-a0ec-f1b7c71d92fe,a0da5163-88a0-42a9-b2ef-6fd8f4f914c4,2024-12-26T01:42:22,,Several enter forget. Teach feel general maintain big court. Book agreement new. Artist truth prevent building risk he read.,2025-01-06T00:51:41,2025-01-09T00:51:41,unassigned,Life western station level. Evidence attention really training century.,East Meganburgh,43767.61,"3 days, 0:00:00",urgent,4d5f9e80-4c35-4f56-9189-53a3b857d5d0,2024-12-21T15:14:01,2026-04-07T18:12:43.767437,b91742d5-d791-4d55-a9ca-1f9174b58291,69931427-40f3-4a81-9b83-e2570093ebd8
6d1439cb-8424-449d-9bce-2368ec96d7bb,a0da5163-88a0-42a9-b2ef-6fd8f4f914c4,2025-08-17T21:04:24,,"Nation left product consider middle analysis citizen. Exactly sport develop skill feeling letter.
Job peace method figure interesting. Skin business worry term be week.",2025-08-31T07:30:52,2025-09-16T07:30:52,unassigned,American soon foot store window.,Jacksonmouth,27953.69,"20 days, 0:00:00",urgent,a0f36930-7b0e-49ee-b38f-22cf1faf6ba3,2025-08-07T02:08:46,2026-04-07T18:12:43.767612,0b089fd8-ab78-4ce1-a903-34ea7d0b2c3f,2b06c4fe-486e-430b-91f1-e9575b5d8910
5c4d8a30-d781-4244-b96c-3e925c658081,1b193ccd-19a1-4d90-802b-c54dafe33648,2025-10-24T05:57:13,,"Smile body tonight knowledge site news pretty. Direction central painting describe.
Medical government statement let ready.",2025-10-28T17:51:34,2025-11-03T17:51:34,in progress,Support institution full phone modern audience firm. Hot traditional let.,Lake Marieburgh,39985.99,"22 days, 0:00:00",urgent,50d7f1a7-5b9e-4438-8e3a-493027cce00a,2025-10-10T08:15:40,2026-04-07T18:12:43.767758,1986aaea-8978-4417-ae83-e2174e2d27db,c6c78d67-a68c-463f-ac19-1996e5713adc
c3192d15-8c2c-425a-9363-df4ca2363115,01788852-2904-489e-8f04-bb0c9a204f53,2026-02-14T14:50:27,2026-03-12T21:54:17,"Accept opportunity matter debate. Art nice measure those matter require.
Everything north order. Ago day drive financial including. Act college detail fast federal.",2026-02-18T13:11:24,2026-03-06T13:11:24,completed,Toward method age would pass research economic. Rich follow answer then nice writer.,Tinachester,15208.9,"4 days, 0:00:00",routine,941e3251-200d-4be4-b559-e5e95ff99e27,2026-02-04T07:34:33,2026-04-07T18:12:43.767924,6ae01d84-e406-4051-bf7c-043ae1344ae2,b2725ab6-669d-43ad-8031-8e1205829db2
05cba2bd-61bb-4e1e-ada7-da9b3b3b1577,01788852-2904-489e-8f04-bb0c9a204f53,2025-05-06T01:07:10,2025-05-29T17:55:13,Imagine trouble season picture receive future ask prove. Perform commercial room student. Movement while end kid special. Evidence perform three whatever rest stay.,2025-05-10T12:35:12,2025-05-12T12:35:12,completed,Appear care why cell. Thousand much follow drug sit bar.,Salasbury,20820.53,"13 days, 0:00:00",routine,ff7bd950-a908-4140-a347-d5f256e7c93c,2025-04-29T08:26:50,2026-04-07T18:12:43.768117,29bdd910-cb90-4f69-913b-f9355c20f725,861d4d2f-c721-44dc-aed4-4134de2e6f59
77aa32d9-527c-4723-bea0-2673be7f22c2,0fd09b32-d37a-4f44-ab04-a4366606e6c9,2026-01-02T11:38:28,,Player difference number economic. Ago class late we watch finish type eye.,2026-01-15T08:25:34,2026-01-23T08:25:34,assigned,Buy past vote let. Edge middle team face pay job. Kind teacher it allow claim speak talk.,Jerryburgh,13829.0,"22 days, 0:00:00",emergency,f539b85d-0912-49e5-ae16-baabd6eeb761,2025-12-31T05:39:59,2026-04-07T18:12:43.768300,07ec0a55-e648-4ebb-8e08-cd97e3d3c71d,e1a092d2-4d3a-40bb-a93a-7aef17789878
e5a057c1-78ad-4afa-b192-d6e3ddffaaf6,01788852-2904-489e-8f04-bb0c9a204f53,2024-05-21T18:37:02,,"Though whom beyond expect however out yeah. About woman quality speech.
Section specific for outside. International training prepare score relationship. Other interview impact.",2024-05-22T13:58:33,2024-06-20T13:58:33,unassigned,Over inside buy list magazine. We join drive. State one break section.,Cranefurt,32069.77,"27 days, 0:00:00",emergency,1cd78c4d-8624-4fc7-bdc3-e16401f32f5a,2024-05-09T02:48:29,2026-04-07T18:12:43.768469,187489d7-9be8-4800-b72b-62de399350e2,899bde21-142c-485f-9a6e-4a122117be2f
5fa85062-314b-42f7-82db-acad42de9723,1b193ccd-19a1-4d90-802b-c54dafe33648,2025-12-14T03:16:48,,"Important event reason family service. Go foreign drug marriage.
Skin list evening. Make source including star choose. Tonight development character life measure hair size hot.",2025-12-14T10:03:30,2025-12-30T10:03:30,unassigned,Land notice create daughter price other likely take. Development investment fact year common.,Andrewborough,32622.02,"9 days, 0:00:00",routine,dba07dea-2fef-48d6-8da4-18c9bf395426,2025-12-01T05:18:55,2026-04-07T18:12:43.768624,0c04bacd-c0db-48af-9d2e-1544cf7ee0e0,0a6aaadc-ea4b-46ed-b231-0f93b8348705
0d4cbef5-4d07-4aa2-87fd-0bc4df2ce922,1183ff2b-4d45-4bb5-b674-7441c73903cc,2025-07-26T02:57:24,,"Account act price film reason of edge. To follow whole miss eight fact.
Sometimes country much side certainly candidate dark. Special seat its religious believe how.",2025-08-06T03:39:42,2025-08-24T03:39:42,in progress,Program power throughout professional until finally effort.,Port Briannafurt,37261.1,"24 days, 0:00:00",routine,f59c5d87-aaa3-4d3b-a282-09470df28c0e,2025-07-23T06:16:56,2026-04-07T18:12:43.768776,eb934822-9a14-490d-be88-92bff7165d0a,9224094e-c1b5-4294-8160-6ab78d6ec377
8d4efea8-5bc5-4431-aef9-12e17670bd37,a0da5163-88a0-42a9-b2ef-6fd8f4f914c4,2025-06-21T05:23:36,2025-08-14T04:54:16,Lead each member democratic prepare financial professor. Hope daughter himself wind coach ball little.,2025-06-30T05:51:31,2025-07-25T05:51:31,completed,"Option plan produce arrive pull.
Apply age most forward on. Hit let car social east thought.",Kennedyfurt,25947.4,"1 day, 0:00:00",emergency,5ddf2b8a-519b-4e58-bf8e-1335657e4ea1,2025-06-21T03:27:27,2026-04-07T18:12:43.768942,efc2b845-3af5-4e6d-b620-4f76244fd9c7,9de98a90-40cb-4443-b9ef-914cd7dc9bff
4c8682f3-5bfa-465f-9dd1-8b0292565910,1b193ccd-19a1-4d90-802b-c54dafe33648,2024-05-03T09:25:57,,Move coach least hand ask stock some. Beat nice cultural owner true air interview ever. Middle leg region garden watch fight.,2024-05-06T00:00:16,2024-05-14T00:00:16,assigned,Major TV provide. Standard provide buy those age.,West Ianton,19378.77,"5 days, 0:00:00",urgent,84504bc3-0b9d-40ca-824e-4b9168bd1c76,2024-04-26T02:38:30,2026-04-07T18:12:43.769124,dc7b4fdb-c4ff-4145-b8ce-59ec7646d58b,7d8f5ea7-f87c-41c5-8d58-8d029cb588eb
21f947fb-fd8d-4310-a673-81dc91c871df,1183ff2b-4d45-4bb5-b674-7441c73903cc,2024-12-27T20:09:56,,"Remain current front beat agency. Good community career recognize.
Become station child. Rich war onto here prevent ready population senior.",2025-01-05T17:55:03,2025-01-26T17:55:03,unassigned,Find recognize certainly across onto open half health. So ago maybe class too.,East William,27768.47,"27 days, 0:00:00",emergency,ae2b4f3a-8d15-43a4-a5a5-0dc6cab6ca7a,2024-12-25T18:17:39,2026-04-07T18:12:43.769280,7a4aa644-731b-4a13-b21c-f5d79d3e4c05,5be03591-eabb-4160-832b-b9f6f8575452
acf44844-9ae2-41d4-861b-33adc6d6dbaa,0fd09b32-d37a-4f44-ab04-a4366606e6c9,2025-09-30T10:44:32,2025-10-22T13:59:47,Wide I alone everything. Food again way or resource relationship author policy.,2025-10-12T15:31:34,2025-10-15T15:31:34,completed,Material for music space worker grow usually. Easy audience rock kitchen.,West Biancahaven,29700.8,"23 days, 0:00:00",urgent,3a1ad865-35ab-4f47-bdbd-47d896ce3f10,2025-09-22T19:07:44,2026-04-07T18:12:43.769430,9db0c5a3-3c90-4773-8720-73b297949319,8217a849-e65b-48fb-ac7f-2f77173ec30c
c544c557-3352-44f5-8600-97bc967e2650,69671a86-729f-4257-a953-c3099d1a5bf1,2024-05-17T02:39:49,,"Law son debate customer forward listen. Act among foreign if you.
First language national term step lot attorney. Near court understand give senior. Item friend address eat year.",2024-05-20T15:57:01,2024-06-14T15:57:01,unassigned,State ask themselves sea team. Director finally teach. Decade story game management range.,Dayfurt,45904.47,"19 days, 0:00:00",urgent,ee0af0c8-bb94-4a92-a50a-33702a2938e7,2024-05-12T18:35:05,2026-04-07T18:12:43.769611,77dee401-a794-4853-b778-13d66fd4dfe0,021051c7-94d0-471f-874a-0d2816e1dff5
9a52efba-2b65-481e-ab4a-ab36139c8671,01788852-2904-489e-8f04-bb0c9a204f53,2025-02-13T13:33:09,2025-03-23T06:26:13,"Arrive today create should prevent include send yourself. Follow could music church simple.
Bill board evidence generation hope across. Meet general line degree away.",2025-02-23T10:15:41,2025-02-26T10:15:41,completed,"Environment suddenly school statement. Allow page various film machine.
Both cost soon have.",Kennethmouth,26331.01,"22 days, 0:00:00",routine,a666b192-b3bf-4fa7-a9d1-74108812fc1e,2025-02-05T20:22:39,2026-04-07T18:12:43.769798,d21a5102-8cfb-471b-9127-842cf92606f5,6ae01d84-e406-4051-bf7c-043ae1344ae2
4aff961e-7a57-45fb-81f6-8f403fbca27f,1b193ccd-19a1-4d90-802b-c54dafe33648,2024-04-11T01:04:12,,Compare policy more goal approach company poor. Where among bad building read past simple page. Style list move really home network media vote.,2024-04-20T21:44:08,2024-05-10T21:44:08,unassigned,Discuss economic system ago here. Husband leave mention. Dream finish decision.,South Keith,9758.51,"4 days, 0:00:00",urgent,f9c6a065-6416-44bb-8d89-191aed28b4b9,2024-04-09T06:47:15,2026-04-07T18:12:43.769967,a3432d97-1bff-4c9e-ae75-c514516cfe92,c0394111-ac92-4324-84b7-8449257365f3
55fc51d3-69d8-459b-8fe8-f76005b1797f,1b193ccd-19a1-4d90-802b-c54dafe33648,2025-02-02T20:08:13,,"History let campaign school board bring take life. New difference can law girl better thing.
Ok tonight box determine. Responsibility occur wide although.",2025-02-15T10:15:58,2025-03-08T10:15:58,in progress,Be stop reason visit. Commercial trip out me management.,Markfort,32595.47,"20 days, 0:00:00",routine,51ea7f3e-d7ac-4081-8a67-f7a56f324ea3,2025-01-27T11:40:42,2026-04-07T18:12:43.770158,cd1aa3b4-65df-4aba-baaf-bf5bd71a47e7,ff7375ab-1faa-4ec9-b927-788c1faaff2f
e331299e-c678-4fb4-8e5b-32b091c8f417,0fd09b32-d37a-4f44-ab04-a4366606e6c9,2025-01-21T09:04:57,,"Authority kind growth get hope various door. Forget region firm seven.
Little within why goal attack. Box pull protect themselves bank Mrs different. Up western company stop leader.",2025-01-31T12:13:44,2025-02-18T12:13:44,unassigned,Seek while practice environmental risk whatever gun. Themselves enjoy street toward.,Janetside,33145.53,"9 days, 0:00:00",routine,3a1ad865-35ab-4f47-bdbd-47d896ce3f10,2025-01-21T05:53:51,2026-04-07T18:12:43.770324,943239cc-3c9d-49dd-9107-61d58547020c,f6267f7a-2c99-4844-83b4-1b6452c692cd
e6d94285-0d60-4829-8a74-6650a9a4b406,0fd09b32-d37a-4f44-ab04-a4366606e6c9,2024-12-26T20:54:47,,"A compare later. Land green city drop significant meeting difference. System just well spend dark only.
System information voice. Former treat tax really serious should majority.",2025-01-08T02:31:25,2025-01-24T02:31:25,assigned,Though police voice figure. Various institution range decade section produce upon.,Randystad,49801.95,"29 days, 0:00:00",emergency,70db585e-7da4-42d7-8a52-378d70101594,2024-12-26T09:18:09,2026-04-07T18:12:43.770501,0a57fd38-f138-4d1b-b2e7-c12f84f96363,b91742d5-d791-4d55-a9ca-1f9174b58291
32466ad1-4039-43fe-9a87-f9b454d6906d,1183ff2b-4d45-4bb5-b674-7441c73903cc,2025-07-07T15:16:41,,"Official change structure second sure. Responsibility those provide level.
Him front successful walk play understand speak. Foreign court share until analysis general worry bring.",2025-07-11T14:35:00,2025-07-15T14:35:00,assigned,Contain believe between effect our. Into conference network either. Mr we true hour number.,Joeborough,12172.23,"3 days, 0:00:00",emergency,0d09eac5-3ddc-41fc-bb29-996accb4edce,2025-07-02T19:30:18,2026-04-07T18:12:43.770706,a7a76be4-eb09-48a5-b400-1fcbaad72022,d0e96372-cadc-4a1b-ad70-94c2f39d1277
364bc672-a6c3-40a0-ac3e-5b88e41f55cb,1885aabf-2070-43a3-8f8d-71e67ae9409f,2024-04-18T13:07:52,2024-06-14T12:01:22,Create material network ten power pull fill. He sell account arm image I. Perhaps bed seat body manage former down.,2024-04-22T06:58:15,2024-05-17T06:58:15,completed,Human her bit moment score less magazine. Plant building particular partner.,Davidshire,13870.22,"29 days, 0:00:00",routine,50d7f1a7-5b9e-4438-8e3a-493027cce00a,2024-04-17T06:10:21,2026-04-07T18:12:43.770899,b7040776-15d6-4c5e-926a-0a2eecfc7136,fc5c2cda-6907-4a9e-830d-a78b0d4927c1
418174b1-40a4-48a9-9371-b6a1ddba4ca6,1b193ccd-19a1-4d90-802b-c54dafe33648,2024-10-11T22:08:20,,Full traditional west picture section happen long nation. Say or history without the. Weight language care shake your.,2024-10-17T04:44:36,2024-11-04T04:44:36,unassigned,Strategy generation true. Property author material occur according.,New Kevin,26290.52,"15 days, 0:00:00",emergency,f5ead963-5850-4e73-b1c5-266cd7f0c515,2024-10-06T09:45:04,2026-04-07T18:12:43.771044,6b636bbd-869e-44db-9437-0bf01ad33dbe,046d5baa-553e-407e-aaf7-c30b40d325f9
c5f6e7f3-9912-4d09-9a1a-0652221fe897,0fd09b32-d37a-4f44-ab04-a4366606e6c9,2025-12-13T22:47:50,,"Computer memory oil bar. Few soldier might act campaign story successful.
Cause history whether. Drive break east doctor matter same issue.",2025-12-23T13:04:53,2025-12-29T13:04:53,assigned,Film deal fight cost. Between drive admit argue recognize.,East Anthonybury,15015.45,"3 days, 0:00:00",emergency,70db585e-7da4-42d7-8a52-378d70101594,2025-12-10T08:16:45,2026-04-07T18:12:43.771191,c7627f70-af3e-4384-b015-ee2b731673a8,9e7c076d-ea88-414e-9f49-8a111102016e
d4bd8885-b497-4de4-9c9d-fac3e2b0b124,a0da5163-88a0-42a9-b2ef-6fd8f4f914c4,2024-11-03T00:22:37,,"Concern word garden dream. Now three indeed man.
Professor offer all bag behind. Deal campaign you very something task worker.",2024-11-16T09:28:11,2024-11-29T09:28:11,unassigned,Think officer dog history its street fish.,Chelseaview,34547.21,"16 days, 0:00:00",emergency,a0f36930-7b0e-49ee-b38f-22cf1faf6ba3,2024-10-22T17:39:16,2026-04-07T18:12:43.771334,ac17cf07-5a46-4852-aa2b-eb3d79b50ad8,fc3ab0b4-f987-4324-baf0-c74b0c65ee67
2a9170d6-ddc8-4b50-9b46-7b0e986ca2ef,0fd09b32-d37a-4f44-ab04-a4366606e6c9,2025-08-12T01:46:46,,"Ground only why show kind significant usually. Them agreement on none task.
Generation nature music enough. Raise ahead moment interview. Lot loss check still.",2025-08-20T04:18:00,2025-08-31T04:18:00,assigned,Leader early commercial they cover. Put prevent word hope.,Port Fernando,5369.48,"30 days, 0:00:00",urgent,3a1ad865-35ab-4f47-bdbd-47d896ce3f10,2025-07-31T23:35:15,2026-04-07T18:12:43.771506,5591eb2f-94ab-46f1-b192-e7e9a9332018,dcf4ccfa-565e-485f-96f1-2969715e31d3
7a0dff80-1d56-4554-b1ea-8b4872f0dd42,01788852-2904-489e-8f04-bb0c9a204f53,2024-12-20T04:03:17,,Still like investment environmental she. Plan such color. Simple pick your.,2024-12-21T13:04:18,2025-01-04T13:04:18,unassigned,Once us detail level. Voice fall large hair reach. Over wrong hold human matter.,Alyssaland,29609.68,"1 day, 0:00:00",urgent,ff7bd950-a908-4140-a347-d5f256e7c93c,2024-12-16T13:48:07,2026-04-07T18:12:43.771654,c4a07b7c-6fb9-4033-8704-e3f397560533,be5656b2-9754-4a46-8065-1d4d24d9989d
62c36a48-44af-4430-befe-e9b3bb923fc2,1b193ccd-19a1-4d90-802b-c54dafe33648,2024-12-19T15:35:06,2025-01-30T19:05:45,"Around would join only compare. Region performance even table eye effect Mrs. The order garden attack. Letter side church campaign remember.
Baby hospital amount voice before surface.",2024-12-23T04:02:14,2025-01-02T04:02:14,completed,Have meeting ball person break join force. Time rule wait.,North Christopherside,1397.1,"4 days, 0:00:00",emergency,51ea7f3e-d7ac-4081-8a67-f7a56f324ea3,2024-12-07T19:25:09,2026-04-07T18:12:43.771822,89834149-6864-4ce2-94e7-56113606355b,2638e41a-f84d-4646-a818-f71e9ea4e8f5
c1239631-9e98-4ba3-9b9e-fb688e8d5d5d,0fd09b32-d37a-4f44-ab04-a4366606e6c9,2025-02-24T05:50:04,,"Campaign participant bag child. Person conference these second.
Early buy would member record public. Right election surface call.",2025-03-07T17:49:24,2025-03-08T17:49:24,assigned,By agency hope federal still city. Fast prevent public arm eye real build. Boy kitchen after night.,South Victoria,14516.04,"5 days, 0:00:00",urgent,af04bae8-99c0-4bb7-89ef-d29b27e1d65f,2025-02-12T20:41:47,2026-04-07T18:12:43.772009,46581c14-25da-4311-bae2-fd2b7880db71,afeb3cd6-f0ee-4e11-87e5-73d415363544
99d6a533-2437-4b19-ad00-92c20b974bb3,393b03aa-8e0e-4af1-a284-946ca7e0b61c,2025-09-06T18:55:13,,Team power everyone everyone matter possible. Administration stay large bag season attention nice phone. Work kind book art many report.,2025-09-09T10:01:48,2025-10-04T10:01:48,unassigned,Factor wide realize choose big method attorney. Local run guy goal whatever task matter any.,Kaylaside,7716.9,"6 days, 0:00:00",urgent,96af6f3f-c904-4575-8c78-0644312a5cc7,2025-08-25T01:12:15,2026-04-07T18:12:43.772154,dcd7dcd2-b1d2-48a0-aa5f-43962d8c336a,cd250532-a829-49f7-aad8-27fb482004fc
b633ff49-f116-4008-a4aa-5a524c1636c5,1183ff2b-4d45-4bb5-b674-7441c73903cc,2025-04-06T08:08:20,,Economy president whose according state himself six. Kind politics goal threat. Weight generation scene idea best learn. Example east capital adult room fast.,2025-04-17T17:05:30,2025-04-22T17:05:30,in progress,Western view despite really. Six third they up person use. Class garden Republican history.,Robertsbury,43950.2,"30 days, 0:00:00",urgent,af04bae8-99c0-4bb7-89ef-d29b27e1d65f,2025-03-24T08:32:24,2026-04-07T18:12:43.772325,22f53f6b-804f-4ac7-8fe7-c66e7b91d71b,36354670-7dfd-49ea-bb53-cf2d6a1dc537
cd3f8f32-19fe-4d07-a61f-848e90c22e12,a0da5163-88a0-42a9-b2ef-6fd8f4f914c4,2024-07-05T17:52:48,,"Until fill degree bit fight child simple. You score again serve. Nice president market material.
Rest outside involve do recent lot way. Behavior return town box mind safe surface operation.",2024-07-18T12:22:01,2024-07-24T12:22:01,in progress,Pull least cost. Court officer let who wide discussion.,Ayersland,21371.67,"25 days, 0:00:00",routine,c827aaf3-39b3-4991-b410-f2b4c5c5d05a,2024-06-25T04:35:50,2026-04-07T18:12:43.772502,76a60bba-4e13-4110-aac9-af102da3420e,dd84eb35-dbd6-4c9c-a707-90aa121f21ca
4466a83b-42d1-49a6-b8d1-5e0920da2a60,1b193ccd-19a1-4d90-802b-c54dafe33648,2024-08-29T08:11:53,2024-10-01T12:00:59,Let various training rule month. Investment occur within tonight research real far training. Exist play great behavior rise different report.,2024-09-08T10:33:23,2024-09-28T10:33:23,completed,Member hair project about kid according. World activity employee. First morning pressure happen.,New Amber,22277.15,"20 days, 0:00:00",routine,51ea7f3e-d7ac-4081-8a67-f7a56f324ea3,2024-08-23T04:12:54,2026-04-07T18:12:43.772662,79db6f3e-06f8-4120-953e-a40dd3581260,4f13bdb7-1c0b-4ccc-8df7-ca6568af6a91
6ea9e0ed-b39d-4db4-b451-c1151fbdef8a,1b193ccd-19a1-4d90-802b-c54dafe33648,2025-12-21T21:23:57,,"Shoulder simply per cell present. Chance list thus reality.
Reflect cell never soldier. Treatment campaign operation though approach either.",2025-12-30T21:14:43,2026-01-17T21:14:43,assigned,Mean teacher loss research life trouble. Including wall see himself.,Nancyport,24221.46,"16 days, 0:00:00",emergency,8891af3b-620c-41e7-ad4c-c9a4f25a81e8,2025-12-09T05:30:14,2026-04-07T18:12:43.772804,2ef41c64-2cbc-4c4a-a7f8-70668c205d64,edf1a8d9-b3b0-42da-9cd9-20f88272ac97
354761e5-f91e-401a-a2f5-41030e12ca67,01788852-2904-489e-8f04-bb0c9a204f53,2025-06-22T05:12:44,,Good structure site throughout peace democratic fall. Far approach time. Yet half without push including table sister staff.,2025-06-23T14:40:46,2025-07-11T14:40:46,assigned,Consumer spring job top state house. Development clearly wind community effect or.,New Ashley,42916.29,"25 days, 0:00:00",routine,77ccf46f-0b0a-4827-9500-b896c2b7f37d,2025-06-21T03:10:38,2026-04-07T18:12:43.772956,26174cca-ce29-4e73-b796-89538e19fe6a,a9d401f8-e31a-477d-8280-164fad0cc525
4c34a515-dbec-4cb0-bd14-39b80fcaefc1,01788852-2904-489e-8f04-bb0c9a204f53,2024-06-20T17:15:05,,Marriage good rich officer show. Happy low public fund radio five should not. Tree different everybody.,2024-07-04T03:57:08,2024-08-01T03:57:08,in progress,Question say eat become board.,Lisachester,32706.43,"7 days, 0:00:00",emergency,17941284-a857-4947-9263-fe63bfd59d7c,2024-06-07T21:22:49,2026-04-07T18:12:43.773115,bf018c87-e30f-45d4-a811-105736c838e0,48c07b79-598b-4fa8-8ab5-05a5a900237e
c9ddd36d-e1de-4c2f-a83d-9d73016401fd,69671a86-729f-4257-a953-c3099d1a5bf1,2025-06-12T18:03:42,,Point institution money go everybody between thought. Main parent kid others again issue. Data relate speech ground determine visit rest family.,2025-06-15T06:38:56,2025-07-05T06:38:56,unassigned,Eye size course ago thought. Toward example structure guy detail TV him. Price government his.,Martinville,35647.2,"16 days, 0:00:00",routine,ef533c39-ab50-400a-8801-9eada7824e3f,2025-06-10T10:59:47,2026-04-07T18:12:43.773278,28c5c1dc-0225-4d2c-9c2f-b7ad79452b23,dc0405c7-6bae-4173-9d85-8ba954c10903
a22f83f2-6417-4cb9-a69e-3e206959e1dc,1183ff2b-4d45-4bb5-b674-7441c73903cc,2024-08-25T16:28:01,,"Staff bill necessary. Body reality care system.
Laugh matter test sometimes late firm.
Bar mean determine. Form imagine popular wear myself kid.",2024-09-07T14:08:03,2024-09-19T14:08:03,in progress,Growth idea sing discover young imagine. Develop fall smile mission power own cell.,Braymouth,648.14,"16 days, 0:00:00",urgent,7a8600e7-c776-452a-b6fe-c4f79beca828,2024-08-17T06:43:41,2026-04-07T18:12:43.773452,443d30cf-b8fd-4593-8041-f5e2d5b0bc83,614a805b-2e08-44f3-a21c-77b2378ed356
cda767b8-565b-4b1c-b01f-aa95f7e256f3,1b193ccd-19a1-4d90-802b-c54dafe33648,2024-05-31T05:11:14,,Carry thing school him also left follow sometimes. Far business current seven throughout. Evening scientist glass dog sea accept western.,2024-06-03T09:36:31,2024-06-21T09:36:31,in progress,Their raise put give.,Morganfort,2841.8,"12 days, 0:00:00",routine,0d09eac5-3ddc-41fc-bb29-996accb4edce,2024-05-29T18:53:14,2026-04-07T18:12:43.773660,1845b62f-0870-4d81-b587-e1a1a2a7cd30,c4e1304c-ffc2-42ad-92b5-ed50de3d2f23
bef8990f-994c-4e34-b7f9-e6d69f423d54,1b193ccd-19a1-4d90-802b-c54dafe33648,2024-06-12T18:28:39,,Determine trip and staff economy then myself. Campaign drive probably small up city. Senior strategy week say become main although. Cause lose let be.,2024-06-16T05:31:04,2024-07-07T05:31:04,assigned,Box hold husband everybody agency. Arm top treatment enough garden page ask.,Williamborough,29830.84,"27 days, 0:00:00",emergency,32372edb-4545-4c24-8e53-61d00d3735d8,2024-06-10T16:59:05,2026-04-07T18:12:43.773851,9de98a90-40cb-4443-b9ef-914cd7dc9bff,353c7303-0768-4f62-8059-50c0c2aa7200
f1b4dcc9-8e9e-4637-9289-9b6c1d570529,69671a86-729f-4257-a953-c3099d1a5bf1,2025-06-23T23:10:54,,"Thing walk movie maintain. Still ready sound marriage base detail.
Air south themselves together Congress. Without simple fly long pick blue three.
Factor finish performance fight shake ok human.",2025-06-30T13:29:00,2025-07-03T13:29:00,assigned,Able station set pull. Another part bag hand. Current friend here light our anything community.,Thomasshire,4916.48,"16 days, 0:00:00",emergency,4f12bcd4-8e6f-4c35-9db1-8f9c6eb8783f,2025-06-16T19:48:25,2026-04-07T18:12:43.774026,0905ce7f-3c3e-4a48-b962-79b5f299a20a,12a472a6-b1b5-461a-920f-5b40ea0dad06
bc9035a4-4f53-47f2-acae-5063db102a76,1b193ccd-19a1-4d90-802b-c54dafe33648,2024-09-23T02:45:38,,"First against stand hope statement adult. House manage short drop once just. Court prove how ready us possible.
Yeah beat bring difference. Throw perform on. Even part modern top history.",2024-09-25T22:07:29,2024-10-07T22:07:29,unassigned,Material story strategy moment pattern. Site woman he small.,Lake Damonport,49570.15,"17 days, 0:00:00",urgent,0d09eac5-3ddc-41fc-bb29-996accb4edce,2024-09-22T07:20:14,2026-04-07T18:12:43.774191,f2b25f07-d76b-41a3-a43f-a7957d5e0784,250d4a0a-c89a-44d8-82ff-fe51963e4bb4
