work_order_id,assigned_vendor,client_id,assigned_at,completed_at,description,estimated_start_date,estimated_end_date,current_status,comments,location,location_type,latitude,longitude,estimated_cost,estimated_duration,priority,well_id,service_type,estimated_quantity,units,is_recurring,recurrence_type,cancelled_at,cancellation_reason,created_at,updated_at,created_by,updated_by
9a5dd58e-ef34-494f-89b5-2ac85697b539,0d4458dd-5ad6-4786-9888-2bff9f05336e,296fa3db-c335-4523-8a1c-df606cb83295,,,Despite enough shake success piece. Resource business happen move Mr. Similar must benefit put there others drug.,2025-11-11T02:09:33.023306,2025-11-12T02:09:33.023306,unassigned,Type some kitchen light. Forward movement house appear whole note scene.,New Seanview,GPS,-12.1563075,160.974371,25242.74,"1 day, 0:00:00",MEDIUM,0d744722-b9a3-4d41-9b6f-ed05c6fef9e1,6bc12c93-a9f7-4d75-b811-9bebbf7039cb,74.5,visits,False,,,,2025-11-07T21:55:46.248706,2026-04-11T23:28:35.825069,a0b0d39e-71ac-4a4b-961c-9a0c083b70eb,8e60834c-7999-43fd-a1c1-8dd068ac6050
43caec9c-d175-45c1-bf81-b11acc2f9b0c,0d4458dd-5ad6-4786-9888-2bff9f05336e,d96e5168-c48b-4372-9992-3d6291244bfb,2025-05-02T17:30:29.274263,,"Think listen sport range generation half government. Thought somebody least. Interview parent but.
But majority light that able light quickly employee. Man take style would play condition film.",2025-05-03T21:40:57.244745,2025-05-05T21:40:57.244745,halted,International quite college music nearly physical off. Morning change significant phone skill.,Anthonyfurt,ADDRESS,64.591874,70.740882,47349.89,"3 days, 0:00:00",HIGH,31468659-48ad-4cc6-97bb-b2e7a4d427b5,6bc12c93-a9f7-4d75-b811-9bebbf7039cb,39.97,loads,False,,,,2025-04-30T01:04:51.422374,2026-04-11T23:28:35.825362,9342317c-669f-4538-8727-7d672d39657f,b96cc1dc-8a3a-4d0a-87e1-67cb1b963636
5407d3d2-f63c-4a57-929c-0c3bae476acd,06d009b4-72da-4d9d-b3b7-57e8599d7117,a21dbcb0-9f45-4f8b-a280-0920b3905c61,2024-06-07T21:36:59.914542,,"Each they difference most. Whose bag term staff.
More bar want character stage. Next author health military section step while. Describe trip race pressure one other.",2024-06-09T02:35:48.509615,2024-06-10T02:35:48.509615,halted,Sit mind kitchen set degree. Stand second each. System each detail word cost. Trip issue mouth.,Andersonhaven,ADDRESS,-88.7580195,104.119121,32067.6,"3 days, 0:00:00",LOW,8dd3dbec-b62d-4b0e-8c91-5b5ab3f72214,d1e18f8f-1284-4e35-8fff-1745bbfa3935,66.59,gallons,True,DAILY,,,2024-06-05T02:42:08.919514,2026-04-11T23:28:35.825580,ce54ee82-9adc-4cda-b383-02b4e2ad020e,ce54ee82-9adc-4cda-b383-02b4e2ad020e
535bbc79-8c6e-4ca9-9401-a5cf39a9e5d6,e6da2d90-c782-409c-8616-856c4871d2ca,285f3784-ef10-4b42-ae2b-9ae729cb8219,2024-06-09T07:55:48.705281,,"Effort movie air use report. Include public indicate level career amount growth.
Computer western stuff really. Window green claim.
Life treatment concern effect color. Various would drop note.",2024-06-09T09:03:46.903211,2024-06-13T09:03:46.903211,cancelled,Material business religious husband history life activity. Sit or use others room.,Jamesfurt,GPS,-72.710111,-55.297069,43076.98,"2 days, 0:00:00",HIGH,6f0867bd-a6a9-4a53-8d24-24f67e756e7b,4e7b5962-dbd8-452f-81b7-4aee649a667c,16.75,visits,True,ONE_TIME,2024-06-09T17:47:36.617744,Weather delay,2024-06-07T08:14:22.913798,2026-04-11T23:28:35.825785,727d3be2-c1d0-42a5-bfd6-6d25233babde,861497be-d57d-4cc8-89aa-b3c500147da0
3546adb1-97f0-41ac-9779-cfcd47391f6a,656b008b-6556-4e21-a60c-4ad6a3412f4f,9d45dc15-5fed-4875-b916-efb8a51119f6,2024-12-23T04:30:57.674516,2024-12-31T07:55:40.470147,In perhaps reason. May business process product federal provide court. Common conference street.,2024-12-24T23:42:10.764369,2024-12-29T23:42:10.764369,closed,Security one then value. Eat five big represent author.,North David,WELL,-56.879108,-165.495824,20149.04,"1 day, 0:00:00",MEDIUM,9e18bc08-ad64-4652-843c-fe1f3b121fe5,bbbbe58c-e42d-45df-9ddb-4fe9798ad349,83.59,gallons,False,,,,2024-12-20T05:35:13.059909,2026-04-11T23:28:35.825985,159248a3-f748-484d-a254-9a1cd43eefb1,42205660-a1a2-440e-b7b7-ee63e3b2d04b
2fab2a8c-1f0a-4536-9de4-4d41f90179f8,06d009b4-72da-4d9d-b3b7-57e8599d7117,7ed0d1fe-6706-4ca7-9ad5-9cdffbbfa493,2024-06-30T06:41:45.692915,,Style across all. Assume expert new experience career. All respond decide half stage man.,2024-07-01T04:47:32.443387,2024-07-02T04:47:32.443387,rejected,List measure pretty great successful store case. Recognize room kind ever impact candidate.,Jessicaside,GPS,70.60877,-167.169132,42443.64,"1 day, 0:00:00",HIGH,41527c18-628d-4940-ac66-8e9c65189cf1,aae0e4d8-2cec-412c-b24f-bd332e960900,58.21,visits,False,,,,2024-06-28T15:26:14.004200,2026-04-11T23:28:35.826172,68ee053b-0389-49a5-8575-71bca01e2749,22e98fb3-27c9-4bf8-b1cf-58d31aacbab3
fb46b597-71b0-4b50-985f-426b7ceb19f0,133f90fe-7e31-4d27-8cda-4d82237347ba,6caa3fb5-c49a-48dd-8c14-1cc1865c5282,2025-01-07T06:59:28.590706,,Better under board they current receive couple. Record through suddenly yeah professor whose. Side there machine energy region.,2025-01-07T09:01:12.557839,2025-01-10T09:01:12.557839,in progress,Size human themselves treat. Control light trouble seven admit start.,Brownmouth,WELL,60.544142,120.891183,19662.8,"1 day, 0:00:00",LOW,0b142393-3ab0-47c8-a628-534dcd0be4dd,6bc12c93-a9f7-4d75-b811-9bebbf7039cb,11.34,gallons,True,DAILY,,,2025-01-05T09:57:52.446961,2026-04-11T23:28:35.826453,2479892f-f3f3-4f46-84cf-a0b828f9e6ca,91e0858a-1671-48ee-b511-f66bb50e07c2
69309701-e0cf-471f-8404-bc50db81e54a,23a09d52-0fe3-421e-bb91-3202f9a30091,6caa3fb5-c49a-48dd-8c14-1cc1865c5282,2025-11-25T21:13:59.561517,,"Wife unit back next. Federal us interview.
Unit campaign popular. Night know sure. Produce scene suddenly ask different.",2025-11-27T16:10:22.560262,2025-11-28T16:10:22.560262,in progress,Look line clear station. Card radio structure most hot team. Prove together education sense baby.,Olsonstad,GPS,-3.1051695,-66.50757,34393.95,"3 days, 0:00:00",MEDIUM,caf5c300-ee0a-43ab-9527-4bf2aebde206,4163a5d4-955d-4a25-abd7-854c4e83b2ac,44.92,loads,True,ONE_TIME,,,2025-11-24T01:25:14.172537,2026-04-11T23:28:35.826913,f17c1457-6125-46a3-b14f-2f08d7450425,c38a2f17-4761-4518-b741-8910bf13bb1f
835fe8cc-3155-4eb8-97c0-8cfb9f85db24,68b3203f-7c06-4786-8e92-f50ded6dd24f,04c01860-11e0-43ee-ace0-ffb53146f1b0,2025-06-08T08:11:44.784511,,"Sure message send stop religious. Offer expect study discover serve concern financial sound.
Shake fall visit street pattern.",2025-06-09T13:21:07.661064,2025-06-11T13:21:07.661064,cancelled,Fill it leg happy. Economic today seek.,Joanmouth,ADDRESS,-11.7459335,65.714295,40786.7,"3 days, 0:00:00",HIGH,dcff1cf3-2e53-4bf0-8d44-1ed0621a3977,aae0e4d8-2cec-412c-b24f-bd332e960900,9.7,visits,False,,2025-06-08T10:23:56.515781,Duplicate order,2025-06-05T19:15:22.801412,2026-04-11T23:28:35.827105,f2cdea7b-dea7-4766-b4c4-dea6db74dac0,d98aa1ad-ae1f-47fa-aea3-c566d8d7894e
3bff2887-2f62-416f-a9e6-936287606388,23a09d52-0fe3-421e-bb91-3202f9a30091,95d96392-189d-4782-8790-5c23325e8a0c,,,"Age keep forward. True strong other put. Nothing open whose fire way level.
Piece investment everything police develop.
Candidate pressure on none.",2025-03-30T16:54:48.226068,2025-04-01T16:54:48.226068,unassigned,Wait something worry free economic. Strong stage stay none. Whether soldier recent.,New Jimmy,GPS,15.7907485,78.772779,17803.95,"2 days, 0:00:00",LOW,a84ad228-a876-4ea9-8a49-cbb2863d0a2d,4163a5d4-955d-4a25-abd7-854c4e83b2ac,60.34,gallons,False,,,,2025-03-27T17:35:48.334599,2026-04-11T23:28:35.827326,43fd303b-f85a-4fdf-a078-2991136e0f37,79b8ca7d-66de-4336-8ea6-94ecee6dde51
25d45ce4-b43f-4f1f-bc77-1f0397a72751,06d009b4-72da-4d9d-b3b7-57e8599d7117,a21dbcb0-9f45-4f8b-a280-0920b3905c61,,,"Fall ground nothing maybe hold wait yet. Expert particular never especially key five remain least.
Foreign move security single very ever lot. Could hair respond idea line.",2024-10-02T15:48:07.213412,2024-10-03T15:48:07.213412,unassigned,Hope clear however research strong including. Artist wife partner who prove film bring.,South Markfort,GPS,23.465837,-121.436755,3832.59,"2 days, 0:00:00",LOW,8dd3dbec-b62d-4b0e-8c91-5b5ab3f72214,4e7b5962-dbd8-452f-81b7-4aee649a667c,65.04,hours,True,ONE_TIME,,,2024-09-28T14:15:36.381341,2026-04-11T23:28:35.827499,823cd6a4-9685-485a-8b73-7854a87640b1,f6f933e4-85d1-49cf-9b80-9fd58fca19ff
3cde220d-5d80-49e5-8789-5728d1a3b8f6,656b008b-6556-4e21-a60c-4ad6a3412f4f,34a30a97-c3af-454e-afb6-60950528910e,2024-07-03T16:11:37.820217,,"Executive check board specific. Join situation suggest body down. Yes time address option human when practice.
Indeed marriage model offer kitchen Congress. Short people although. Bring fish air.",2024-07-04T10:02:13.037982,2024-07-08T10:02:13.037982,cancelled,Speech special yourself. Art attack but I floor garden.,Stewartport,GPS,71.441595,49.193094,44662.58,"1 day, 0:00:00",LOW,d834d972-e17a-42a3-ad23-c2835e3da14f,aae0e4d8-2cec-412c-b24f-bd332e960900,3.56,hours,True,WEEKLY,2024-07-04T20:09:23.047420,Weather delay,2024-07-03T01:03:22.509215,2026-04-11T23:28:35.827724,7ff0e2bf-75b0-4cb4-adac-d11d025d9793,db8fed6d-3dcb-4743-b859-9f276c4b642c
4190e633-9512-4b56-96c4-51b243cd7cc8,656b008b-6556-4e21-a60c-4ad6a3412f4f,04c01860-11e0-43ee-ace0-ffb53146f1b0,2025-07-06T05:01:16.819855,,"Small reason age win interest foot.
Physical thousand face issue people record company. Wide station security wife air Mrs later.",2025-07-06T23:29:30.554382,2025-07-07T23:29:30.554382,rejected,Him of together mouth. Experience top risk field choice education kind. Benefit full close east.,New Patricia,GPS,44.920819,179.873427,32421.3,"3 days, 0:00:00",MEDIUM,dcff1cf3-2e53-4bf0-8d44-1ed0621a3977,aae0e4d8-2cec-412c-b24f-bd332e960900,39.16,hours,False,,,,2025-07-05T15:09:37.502381,2026-04-11T23:28:35.827907,5771b7e3-e41a-4800-8dd4-41f262c1abfd,966f8fc0-cb8e-40b1-bc86-62e5f07c358f
9464962e-c163-4505-bf4a-560cc5be9829,133f90fe-7e31-4d27-8cda-4d82237347ba,6caa3fb5-c49a-48dd-8c14-1cc1865c5282,2024-10-23T15:21:07.070965,,Southern south still fight remember. Serve situation nothing this economy attorney kid. According could wife before attorney little act.,2024-10-23T15:23:53.954062,2024-10-24T15:23:53.954062,in progress,Special source fly of so crime. Exist eat clearly memory.,Martinezside,GPS,-4.8896145,-42.485384,28693.63,"1 day, 0:00:00",MEDIUM,0b142393-3ab0-47c8-a628-534dcd0be4dd,6bc12c93-a9f7-4d75-b811-9bebbf7039cb,67.58,loads,True,ONE_TIME,,,2024-10-22T02:43:10.527525,2026-04-11T23:28:35.828103,6549988c-f315-4338-a853-b9eeaed55688,6b6b3d30-d29a-4601-8cb0-9c9cd9a60752
9c0bd1f8-5481-42ce-a5ad-849882808b60,279f7fdc-14a0-4446-b6ce-4810b1281dbb,296fa3db-c335-4523-8a1c-df606cb83295,2024-08-09T03:58:40.676911,,"Pick consumer adult relationship. Low when yes Congress able.
Activity memory see economic fly Mrs politics focus. Pattern board station job your. Inside thousand church question despite.",2024-08-10T18:16:29.580657,2024-08-12T18:16:29.580657,cancelled,Research southern material side unit none. Total marriage every recognize into public.,Lake Anna,ADDRESS,61.2269445,-80.560586,36590.75,"1 day, 0:00:00",MEDIUM,523814a5-a798-4b23-8c88-2ce35513486f,4163a5d4-955d-4a25-abd7-854c4e83b2ac,56.68,visits,True,WEEKLY,2024-08-09T14:39:51.336292,Safety concern,2024-08-08T02:21:30.754908,2026-04-11T23:28:35.828297,ccf3d564-e170-4773-9cc0-077e6a36a495,2f5bb8ae-574c-4c16-b187-b7b6269d4bce
ca64e758-2527-4ff9-8cf0-e0ad21f68473,656b008b-6556-4e21-a60c-4ad6a3412f4f,f8fc3e50-abea-49d4-baba-b152aaaf1932,2025-03-22T00:58:42.261579,,Forget knowledge total big spring source. Network him animal activity consider education plan.,2025-03-22T03:07:35.497463,2025-03-24T03:07:35.497463,halted,Hear state fund car pick hospital again fill. Much begin picture. Maybe plant major gun.,Blackbury,WELL,21.689556,5.081355,15654.51,"2 days, 0:00:00",LOW,3cedfd0b-b0d9-47ca-9c5c-5503ad889641,4e7b5962-dbd8-452f-81b7-4aee649a667c,78.57,days,True,MONTHLY,,,2025-03-19T22:34:26.346152,2026-04-11T23:28:35.828517,a1a41dea-2d47-42ff-8777-a45c8f027d56,979e0561-bbaf-4a16-acdb-e341675f5550
336b4b50-0d79-430e-8cd5-3627ace92dd9,133f90fe-7e31-4d27-8cda-4d82237347ba,95d96392-189d-4782-8790-5c23325e8a0c,2025-10-01T00:51:16.626720,,Strategy program choose fine exist bag. Likely action quite else. Every network staff.,2025-10-02T14:05:16.073442,2025-10-04T14:05:16.073442,halted,Conference forward day. Charge sit ok bill speech cover want. Might front source dark factor.,Hectorchester,ADDRESS,-67.852635,141.454742,39600.98,"3 days, 0:00:00",LOW,0478f87b-41fc-4508-8b7f-7b68f93367ec,d1e18f8f-1284-4e35-8fff-1745bbfa3935,26.82,hours,False,,,,2025-09-30T20:40:33.354865,2026-04-11T23:28:35.828704,679b99f2-0ce6-4572-9e0d-b42e59c7a04c,861497be-d57d-4cc8-89aa-b3c500147da0
da7cff9d-d283-4853-8d63-998f7d2401c4,656b008b-6556-4e21-a60c-4ad6a3412f4f,9d45dc15-5fed-4875-b916-efb8a51119f6,2025-12-26T02:33:42.019759,,Mr politics ability appear sing make and feeling. Democratic you debate.,2025-12-27T13:42:56.422040,2025-12-29T13:42:56.422040,rejected,Start someone life food student face.,Whitetown,WELL,-0.7622035,-128.642667,9147.73,"2 days, 0:00:00",MEDIUM,9e18bc08-ad64-4652-843c-fe1f3b121fe5,6bc12c93-a9f7-4d75-b811-9bebbf7039cb,8.15,visits,False,,,,2025-12-23T22:47:20.818030,2026-04-11T23:28:35.828877,62b953c0-d0d2-4396-bdc4-95b25723334a,d0dd82cc-dea2-4e78-8ab9-3cac4a8b8fa3
30badba9-04c1-41e1-88b5-dc4fa870de9e,e6da2d90-c782-409c-8616-856c4871d2ca,ede7db27-f41b-4233-90aa-2747d99c010d,2024-11-26T21:30:24.189063,,"Crime pick certain recognize join fill.
She let on cultural head. Would movement age. Suggest list central movement color.
All station step. Herself smile maybe night source. Lot design professional.",2024-11-27T02:08:14.972271,2024-12-02T02:08:14.972271,rejected,Evening expect debate certain security source wrong. Yet rich husband letter difficult identify.,New Kimberlyhaven,GPS,86.570463,-44.112299,43450.54,"2 days, 0:00:00",LOW,89602d9d-ad22-473d-b46f-9485cb35cbf5,4e7b5962-dbd8-452f-81b7-4aee649a667c,6.36,visits,False,,,,2024-11-24T17:47:26.450212,2026-04-11T23:28:35.829091,76b50142-a1fb-4077-abfc-74c87ad621a2,79444515-417a-46af-a841-245b8c38748c
da04a9a5-010b-4e6b-9b69-3231892e9841,656b008b-6556-4e21-a60c-4ad6a3412f4f,45f09fb8-ad23-4286-a44e-b860446031aa,2025-08-10T04:18:17.211783,,Minute so lay group. Particular recent happen six bed simple prove. Score they also lose.,2025-08-11T02:00:32.386908,2025-08-14T02:00:32.386908,rejected,Necessary suddenly cell American affect. Everything system behavior.,Andersonborough,WELL,-19.486119,-3.603433,36455.31,"3 days, 0:00:00",LOW,4a7d0e68-5575-4605-874f-c8ef41f4b1b3,6bc12c93-a9f7-4d75-b811-9bebbf7039cb,80.93,hours,False,,,,2025-08-08T15:15:50.106233,2026-04-11T23:28:35.829321,ff180759-0dfc-4cd9-9c57-50ed025740ac,b911c649-df87-44f2-92d5-7420bf48c0c1
3d7cc196-a1ef-4354-b790-186896c45b12,e6da2d90-c782-409c-8616-856c4871d2ca,2d4a9276-b730-4ead-b37c-3d5a209278a8,2025-07-10T14:11:18.865165,,"Describe laugh billion than watch. Story goal check agency as certain expect evidence. Agree attention feel.
Figure smile nice behavior. Wind interesting lot phone should tend.",2025-07-11T16:33:26.808463,2025-07-12T16:33:26.808463,rejected,Magazine lay book receive support goal.,Lopezmouth,WELL,-88.942027,-144.415331,22752.17,"1 day, 0:00:00",HIGH,c666fc01-b9fa-4581-b129-cb0a7b7fe3f4,4e7b5962-dbd8-452f-81b7-4aee649a667c,12.46,hours,False,,,,2025-07-10T00:04:00.786700,2026-04-11T23:28:35.829520,cac4ca54-7520-472e-8418-70d6873b7e99,2cd075ef-ef59-4f1d-ab65-48fa4441009f
e71f003a-8565-47d6-8e83-054a09a8201d,e6da2d90-c782-409c-8616-856c4871d2ca,f8fc3e50-abea-49d4-baba-b152aaaf1932,2024-11-12T21:48:36.788049,,Between raise quickly think community find add difference. Partner painting off environment.,2024-11-12T22:09:20.899349,2024-11-17T22:09:20.899349,in progress,Outside ask action region the. Movement type party exactly receive nation.,West Danielville,WELL,-51.1179305,-132.42488,6204.88,"3 days, 0:00:00",LOW,3cedfd0b-b0d9-47ca-9c5c-5503ad889641,4e7b5962-dbd8-452f-81b7-4aee649a667c,43.39,visits,False,,,,2024-11-10T23:04:42.693815,2026-04-11T23:28:35.829698,1faea77a-0687-4332-bd94-f00b9f7d2274,e0752dc6-e969-4a32-9ac5-e9036c22e24f
4e87d3b0-8675-4c09-9c92-00264431e50f,23a09d52-0fe3-421e-bb91-3202f9a30091,85ad02b7-c91a-4731-b9f6-c74111351c65,2025-09-26T11:36:35.733321,,"Grow total charge.
While soldier group since free reason. That few all yard subject already.",2025-09-28T00:27:21.455667,2025-09-29T00:27:21.455667,assigned,Meet low soldier into tend by. Memory they along chance use. Name among floor.,Sharitown,ADDRESS,-81.9039885,175.90882,4723.86,"2 days, 0:00:00",HIGH,fb276719-0c90-4411-b8a5-bb57adee9acc,4163a5d4-955d-4a25-abd7-854c4e83b2ac,62.98,gallons,False,,,,2025-09-24T18:06:00.191857,2026-04-11T23:28:35.829900,24992f46-ff11-43ed-af23-7c2b64d6116a,928e1a69-e7d6-4e8c-b4f1-6178dcaa4626
74c12c62-fa93-44f4-a2bb-3a543d855156,c2271158-1a66-4531-9772-0e175585c41f,285f3784-ef10-4b42-ae2b-9ae729cb8219,,,"Similar serious seven season may according knowledge. Place choice hear radio quite low among. Into write mission state life.
Future anyone certainly state this. Rest even side.",2025-05-28T09:16:48.262457,2025-05-31T09:16:48.262457,unassigned,Relate imagine her sort once send. Film pressure grow several.,West Matthew,GPS,-41.3283615,-119.961368,11294.41,"1 day, 0:00:00",HIGH,614a2a2e-591b-4e4a-929f-a1b660400fff,4e7b5962-dbd8-452f-81b7-4aee649a667c,92.96,days,True,MONTHLY,,,2025-05-26T09:06:05.042073,2026-04-11T23:28:35.830070,5cce432c-f14e-4171-aba0-43eb56b7c333,6536ffd1-d75a-4b46-bf1a-d6135d02a237
f9175214-b061-423f-87b1-f24f8ecba5da,279f7fdc-14a0-4446-b6ce-4810b1281dbb,dc7f0910-53d4-4ec1-8f74-7abe480627b6,2025-06-08T00:00:00.766786,,Sit pattern film exactly. Management shoulder us international six idea. Early a maintain space statement change reflect.,2025-06-09T02:00:56.572512,2025-06-10T02:00:56.572512,assigned,Together care middle her consumer. Star husband pass environmental.,Hughesview,GPS,32.6813425,-155.487232,2656.86,"2 days, 0:00:00",MEDIUM,a0bb034a-f039-44e5-ae1b-93e0c0702602,32a1f4ff-8cad-447c-8433-21af7ee7c7a6,72.09,visits,True,MONTHLY,,,2025-06-06T12:03:16.395219,2026-04-11T23:28:35.830275,b55e3681-1f0a-4b93-babc-be6f4f0a5689,f3def351-401b-400f-adff-ecba5741d196
10a4b7c6-1bbe-4569-902a-03f5ec5cb344,06d009b4-72da-4d9d-b3b7-57e8599d7117,285f3784-ef10-4b42-ae2b-9ae729cb8219,2024-05-17T22:40:16.779510,,Protect thank shake believe similar. Race side old so finally civil yard marriage.,2024-05-19T07:55:15.256206,2024-05-24T07:55:15.256206,assigned,Next far each kitchen. Voice everything within investment process open.,West Michaelville,ADDRESS,-17.795727,-164.145773,38772.16,"3 days, 0:00:00",MEDIUM,3e533dfd-dcc0-4cf0-89ba-370ea2e55a1a,6bc12c93-a9f7-4d75-b811-9bebbf7039cb,23.19,visits,True,DAILY,,,2024-05-14T23:13:33.618391,2026-04-11T23:28:35.830499,22a5cfd9-4ca3-479a-8067-0de84cb6419c,41c9ce85-86a1-4979-a53a-f7637cef5c10
6c4e51e5-8d36-42b3-b90a-c21290874303,06d009b4-72da-4d9d-b3b7-57e8599d7117,85ad02b7-c91a-4731-b9f6-c74111351c65,2026-01-29T02:53:04.364604,,"Federal crime could later product change state. Pay look subject deal agency heart. Test board according art energy.
Six first night. Investment wish picture eight month.",2026-01-29T03:53:13.858596,2026-02-01T03:53:13.858596,in progress,Itself item professional sort really event. Environment ready lead know.,Port Katelynfurt,GPS,39.7125035,167.122266,29474.16,"2 days, 0:00:00",LOW,da714c53-1ef1-4b70-8a04-78470c4cb3af,aae0e4d8-2cec-412c-b24f-bd332e960900,42.5,hours,False,,,,2026-01-28T01:36:14.897613,2026-04-11T23:28:35.830743,75ba45c5-20a1-4b82-8665-7f237a23043b,805991ac-d980-4df3-b72d-b0568152461c
17bc42e0-17b4-4fdc-b868-7a29564edeca,133f90fe-7e31-4d27-8cda-4d82237347ba,a21dbcb0-9f45-4f8b-a280-0920b3905c61,2025-09-14T16:15:04.271622,,"Vote ok sound. White page from. Natural would economic business avoid certain compare suddenly.
Shake heavy find after drive truth likely. Citizen or piece state. Cold my miss tell relate.",2025-09-16T15:51:00.826797,2025-09-17T15:51:00.826797,in progress,Government entire apply series general.,Guerramouth,ADDRESS,76.019322,91.167456,18438.12,"3 days, 0:00:00",MEDIUM,875dcbd1-cdb7-47cd-98b2-6ef8f58842d1,d1e18f8f-1284-4e35-8fff-1745bbfa3935,80.52,visits,False,,,,2025-09-12T18:37:49.550283,2026-04-11T23:28:35.830970,15f60d98-9f15-464a-ba8c-eeff8c77a561,50912bb9-c741-4adf-9dd2-a65d7f593674
d38ccfbf-4480-4ee9-95c9-ff62176e590c,c2271158-1a66-4531-9772-0e175585c41f,dc7f0910-53d4-4ec1-8f74-7abe480627b6,2025-08-25T22:46:13.534596,2025-08-28T19:01:38.258677,"Kid site build. Argue soldier successful community. Push keep exactly population partner.
Type sport then total use situation wide. At quickly person hour.",2025-08-26T13:19:04.583881,2025-08-27T13:19:04.583881,closed,Cover reality relationship idea purpose enter game.,Stephenfort,WELL,78.19607,174.895108,8343.77,"3 days, 0:00:00",LOW,59208569-ef37-40ef-ac48-c855618a22a6,4163a5d4-955d-4a25-abd7-854c4e83b2ac,94.31,hours,True,WEEKLY,,,2025-08-25T04:11:08.287947,2026-04-11T23:28:35.831151,6e2c1e9e-85ae-4651-b08b-e475aea06a10,e4898e7b-7f1d-48aa-9429-e020c1f86ab8
9999f45c-88d5-4437-b2f1-8aa23efb8cb6,656b008b-6556-4e21-a60c-4ad6a3412f4f,34a30a97-c3af-454e-afb6-60950528910e,,,"Edge morning meeting Republican common answer experience them. Ok approach need chair west plant.
Home make yeah. Conference product various realize environmental.",2026-03-09T12:51:16.542137,2026-03-11T12:51:16.542137,unassigned,Early deep garden identify appear just capital create.,North John,ADDRESS,51.4496275,123.264305,47233.77,"3 days, 0:00:00",HIGH,d834d972-e17a-42a3-ad23-c2835e3da14f,4e7b5962-dbd8-452f-81b7-4aee649a667c,65.42,hours,False,,,,2026-03-06T12:53:27.771238,2026-04-11T23:28:35.831356,8734592b-befb-404e-b108-61cfbc6799c9,66744f4c-df49-4e05-a77e-f7ce7d98cebc
765edf9b-bb83-4c7a-bbaf-a0eb91983e51,23a09d52-0fe3-421e-bb91-3202f9a30091,95d96392-189d-4782-8790-5c23325e8a0c,2025-07-30T08:34:51.866989,,"Hand speech two someone collection it. Them wish talk air help add.
Friend white strategy fast interview without. Figure draw though glass.",2025-07-31T09:14:24.327433,2025-08-04T09:14:24.327433,assigned,Talk near opportunity matter book. Million discover program interesting keep.,Garciachester,WELL,77.072673,-21.282402,41562.08,"1 day, 0:00:00",MEDIUM,a84ad228-a876-4ea9-8a49-cbb2863d0a2d,4163a5d4-955d-4a25-abd7-854c4e83b2ac,99.62,days,False,,,,2025-07-30T08:26:18.719402,2026-04-11T23:28:35.831563,59be7ee0-1327-4acb-b96a-c8abb39a9e9d,22d34b65-c3d5-490e-a898-3a622d5537c3
54fb7dcf-4ed1-4cdd-8a06-598ae657dc56,656b008b-6556-4e21-a60c-4ad6a3412f4f,9d45dc15-5fed-4875-b916-efb8a51119f6,2025-10-06T01:09:55.944328,2025-10-08T20:57:54.723627,"Including participant student behavior. Size nature budget strong expert.
Own bed total thank. Fire effort pattern finally. Language piece fine service improve order research.",2025-10-07T09:19:03.149743,2025-10-08T09:19:03.149743,closed,Possible hundred article perform down. Everybody focus coach part board hear wide.,Port Scott,WELL,24.060306,-82.511866,47919.41,"2 days, 0:00:00",HIGH,9e18bc08-ad64-4652-843c-fe1f3b121fe5,bbbbe58c-e42d-45df-9ddb-4fe9798ad349,23.7,loads,False,,,,2025-10-05T06:55:51.224410,2026-04-11T23:28:35.831766,cac4ca54-7520-472e-8418-70d6873b7e99,eac8a7ef-fe2c-4660-906c-196682b9d23f
7a1b44f2-aeec-499b-a08e-98855ee01713,279f7fdc-14a0-4446-b6ce-4810b1281dbb,dc7f0910-53d4-4ec1-8f74-7abe480627b6,2024-07-21T22:01:42.784813,2024-07-26T23:05:54.231736,"Put than direction see box.
Scene bad crime either include. Leader some eight much.
Everybody each machine rock win. Cost difference perform surface federal particular wall.",2024-07-22T08:54:36.583683,2024-07-25T08:54:36.583683,completed,Even among look really. Real best us decide pass firm.,Lake Nicoleshire,WELL,89.444927,175.576861,9194.41,"3 days, 0:00:00",LOW,a0bb034a-f039-44e5-ae1b-93e0c0702602,4163a5d4-955d-4a25-abd7-854c4e83b2ac,69.43,gallons,False,,,,2024-07-19T04:46:49.636922,2026-04-11T23:28:35.831982,67c09d9c-7bd5-4fe3-9b5d-e9c0ddf97385,0e6cce34-4c7d-4478-94a3-12b1cb9bfeb5
14c7fd19-9520-46bf-835e-0cc843a5ff2f,34a45051-a13a-4bfa-92d4-c3f90c3c95dc,d96e5168-c48b-4372-9992-3d6291244bfb,2025-11-06T22:52:36.265592,,"Thank suddenly knowledge suggest only painting condition. Major Mr spring yet animal.
Size politics through with. Sign crime station growth after age product teach. Lead nice suffer carry leave.",2025-11-08T15:13:03.305137,2025-11-12T15:13:03.305137,assigned,Stage will recognize all impact. Each much network trade. Make join miss.,North Lisaberg,WELL,70.776114,-133.110757,23731.21,"1 day, 0:00:00",HIGH,4b060583-30e8-46f5-a027-6889918c75d7,aae0e4d8-2cec-412c-b24f-bd332e960900,26.62,hours,False,,,,2025-11-04T00:01:13.212069,2026-04-11T23:28:35.832175,1dc3fd6b-6f5e-41f9-846f-1839f6af2cdd,b3c14733-b731-43af-a4bf-0f3bd129f8d7
44913101-0d73-45c7-b965-0121e21b2ac4,133f90fe-7e31-4d27-8cda-4d82237347ba,d96e5168-c48b-4372-9992-3d6291244bfb,2025-11-27T15:55:27.572458,,Run generation author specific economic science. New cup century market. Artist stage rule shoulder.,2025-11-29T13:42:00.487886,2025-12-03T13:42:00.487886,rejected,Rich success international condition. Exactly can want court.,South Jackton,GPS,17.226733,-30.162019,19321.64,"2 days, 0:00:00",HIGH,31468659-48ad-4cc6-97bb-b2e7a4d427b5,d1e18f8f-1284-4e35-8fff-1745bbfa3935,41.93,gallons,True,WEEKLY,,,2025-11-26T13:21:59.608582,2026-04-11T23:28:35.832348,5428d10a-9efc-4ece-847f-7adef8029a02,34a6b6aa-083b-4768-8f9d-8378b06fe176
