id,assigned_vendor,client_id,assigned_at,completed_at,description,work_order_name,estimated_start_date,estimated_end_date,current_status,comments,location,location_type,latitude,longitude,estimated_cost,estimated_duration,priority,well_id,service_type,estimated_quantity,units,is_recurring,recurrence_type,cancelled_at,cancellation_reason,created_at,updated_at,created_by,updated_by
40a0d8c5-6b11-43fc-a598-22bd18f6d0eb,faa66382-4806-43a8-8a5d-ac3393c400fd,66d9ecee-f243-482d-98d8-69b8b0179d6b,2025-05-29T08:01:07,2025-06-03T06:58:34,"Wife ball energy brother happy. Per only either here.
Ask data often especially tough can idea. Production boy she deep over.",WO-99346,2025-05-30T12:47:14,2025-06-01T12:47:14,CLOSED,Door matter mother vote fund guy.,Josephstad,GPS,19.9336395,8.391828,26223.91,"1 day, 0:00:00",LOW,c939336d-7723-43ae-9052-08348184324c,9cec2b70-8268-49b0-9790-027f56d65b08,77.8,days,True,WEEKLY,,,2025-05-28T06:09:40,2026-04-15T18:10:30.804830,b604b6a8-bb11-48fe-abff-9893414b8d16,f6483901-e02a-45c0-b300-1f0fbba0fdb2
162334f2-6434-40e9-af93-0bb65391d425,faa66382-4806-43a8-8a5d-ac3393c400fd,f525d920-9583-480f-bd27-5dff2c94820f,2024-06-21T02:49:54,,Laugh data alone fast his defense name focus. Four about by central available. Wind son positive me nice daughter campaign approach. Then each network minute Republican agency.,WO-83828,2024-06-21T22:23:12,2024-06-22T22:23:12,ASSIGNED,Religious large art us program our. Maintain foreign system oil important half stop.,North Christineview,WELL,-1.2868495,85.097237,16007.33,"3 days, 0:00:00",LOW,290acd4f-771e-45ff-9afe-7645ceadc83b,9cec2b70-8268-49b0-9790-027f56d65b08,78.48,hours,False,,,,2024-06-18T23:10:14,2026-04-15T18:10:30.805208,beb3aba8-56f7-4f44-99b6-b3df8d359f54,4d8be706-2f32-44f4-a9f1-9a185c7976f6
19d1d6a9-7efa-484e-81ac-016ee42e68f3,ab06f125-03cd-4efa-b705-80a382abe9d7,61e56726-2b7d-4134-a6cc-529289b2b54c,2024-09-02T13:34:59,,Clear however why save power. Style these goal a hold under expect. Add whom staff road approach city.,WO-30523,2024-09-03T14:51:04,2024-09-04T14:51:04,CANCELLED,We test she it. Present adult point market end. To and without though.,Williamshire,ADDRESS,-63.076222,6.86986,15098.38,"2 days, 0:00:00",MEDIUM,790333e2-22aa-4356-801c-1bf8e1fccc97,9cec2b70-8268-49b0-9790-027f56d65b08,10.49,visits,True,ONE_TIME,2024-09-03T16:53:17,Client cancelled request,2024-09-02T12:12:49,2026-04-15T18:10:30.805622,76e24607-e9a5-41a8-91a8-33d74f5e58f1,7fce6227-dab2-4582-be37-62e677f9ab58
092decfa-ce9d-43ae-a5ed-177591e73fed,d37db5f8-d37f-49c0-b8b2-76d6a45ab850,678c61ab-e0a4-40b1-af00-261f9020c2ca,2025-12-07T22:47:11,2025-12-12T12:31:34,Color station news language executive. Final should material. Employee quite teacher traditional.,WO-30994,2025-12-08T00:35:13,2025-12-12T00:35:13,CLOSED,Big fast however president relationship behind. Source hard specific wrong catch audience.,Lake David,ADDRESS,-18.0768695,126.881934,32720.61,"3 days, 0:00:00",LOW,de55832f-5b83-4632-9510-d65a82f32a05,af516e74-dbad-4474-9b38-fee85f1c5f93,45.95,loads,True,WEEKLY,,,2025-12-06T03:16:22,2026-04-15T18:10:30.806044,b3acb374-ab72-4423-a8aa-730139a82fb6,2de3fff2-1d7c-4572-8183-86e714bf95e6
798d3370-d3dd-45ce-8e65-1364d22d5bbe,9863f9e7-9e3e-4991-ae05-2fcfca5ff7d0,f525d920-9583-480f-bd27-5dff2c94820f,2025-09-17T15:45:31,,Apply bed can southern. Speech level record behavior finish little job.,WO-24702,2025-09-17T20:40:57,2025-09-22T20:40:57,ASSIGNED,There picture station product huge job personal two. Low recognize occur. Capital senior dog break.,Pedrohaven,WELL,-77.675054,-105.687908,18091.87,"2 days, 0:00:00",HIGH,290acd4f-771e-45ff-9afe-7645ceadc83b,1ecd42cc-80e4-426b-8a62-3e3dc4dc248a,62.46,gallons,True,WEEKLY,,,2025-09-15T07:27:37,2026-04-15T18:10:30.806419,888c3de9-07f5-4dd8-8e2e-e62e767e867a,48b43c14-9dc3-4ac1-ae15-3c91de311a75
4b5c3040-94b1-47eb-b6a8-06fe3ee53745,4efb429c-f661-47c7-8be1-26bcd85624cc,c47f7a97-07de-45fc-b329-df9d514c1dd8,2025-06-22T22:17:11,,"Military information car her wide response every. Board themselves think space leader.
Expert for get time plan. Husband point student issue.",WO-24655,2025-06-23T18:33:58,2025-06-28T18:33:58,CANCELLED,Participant chance weight. Campaign natural human again.,Lake Frank,GPS,-38.5801095,-111.868944,23741.43,"3 days, 0:00:00",MEDIUM,55abbe3d-3bd9-4289-b279-ab674df24bc8,1ecd42cc-80e4-426b-8a62-3e3dc4dc248a,29.82,hours,True,DAILY,2025-06-22T22:25:35,Resource unavailable,2025-06-22T00:12:40,2026-04-15T18:10:30.806800,ba3a6fba-2c0e-4031-8a4d-67f98f369722,62b74d17-cabf-47bb-8114-8a5c897591bb
7f0e9c9a-6a16-4905-8c18-a865c761f8c6,8d2e71e3-0422-4b11-bab4-6af9543a3839,691a7e30-5a38-47ce-b009-80b80a73e695,,,"Senior worry budget on know animal. She hundred chair trouble.
Poor land sell fish war. Ball employee product stay.",WO-03748,2024-09-02T09:08:18,2024-09-06T09:08:18,UNASSIGNED,Modern situation just. Suggest certain anyone toward yet. Hundred above possible.,East Martin,GPS,-30.3045535,89.262181,32207.46,"1 day, 0:00:00",LOW,83c78c61-784a-48a3-b5d2-5b02a171f8a2,1ecd42cc-80e4-426b-8a62-3e3dc4dc248a,34.81,visits,True,DAILY,,,2024-08-30T08:00:47,2026-04-15T18:10:30.807183,395f06ad-c205-47dd-bf8f-54f36cc2718e,888c3de9-07f5-4dd8-8e2e-e62e767e867a
c2a3dbe3-c32b-465c-a700-4d7c2f1a2e97,174a76cb-9bbd-48fa-82c3-f88bcdf4c7aa,f525d920-9583-480f-bd27-5dff2c94820f,2024-09-28T08:33:16,,"Move us security trip fact. Force order face story.
Weight collection voice though. Check put analysis paper. Choice must these something good civil.",WO-56774,2024-09-30T03:30:14,2024-10-03T03:30:14,CANCELLED,Special with worker. Support despite put ability turn nice difference.,Port Sandramouth,WELL,-30.931808,-121.302657,43867.22,"1 day, 0:00:00",MEDIUM,2d88c350-49b5-45ac-8519-760a73b80453,cb49e5de-7799-42e2-98e8-44fad7981926,22.72,hours,False,,2024-09-28T11:16:07,Weather delay,2024-09-26T20:13:55,2026-04-15T18:10:30.807646,3c151245-5f81-4dd1-8a0b-25a278350056,15a94360-2d80-431d-8a20-2ca7f7be1524
0b4fece8-df19-42f8-851f-2f0eea419553,58f9dbaf-1659-4d39-9ffe-a44624472704,b43e3365-5df9-4195-a65d-d09d87c032b0,2024-08-13T09:29:08,2024-08-17T08:50:22,"Nearly method teach training nation.
Material half summer not direction reason politics. Themselves loss although opportunity. Dog soon production such how them behind. Information all week.",WO-10154,2024-08-15T03:04:43,2024-08-19T03:04:43,COMPLETED,Sing compare free least address bill. Section moment career me compare difference capital.,Rubiobury,ADDRESS,55.5295325,-94.8058,40459.93,"2 days, 0:00:00",LOW,254ea4de-f7cc-422e-86bb-4db3d83aaee0,16c270b4-3b14-467e-9cc3-879f37e9a5db,40.63,hours,False,,,,2024-08-10T13:38:30,2026-04-15T18:10:30.808091,f93475ee-de16-4768-a52b-6f9cfb2d5a7c,1bc723e4-7120-489e-a30f-41b05c363e76
b201ef1b-f3e6-4c4d-8f82-d126c492b03d,4efb429c-f661-47c7-8be1-26bcd85624cc,691a7e30-5a38-47ce-b009-80b80a73e695,2025-03-07T07:24:52,,Keep let letter president meeting every ago country. Well truth former trade expert. Party society discussion real.,WO-81100,2025-03-08T15:23:26,2025-03-11T15:23:26,IN_PROGRESS,Sure likely door theory yeah million woman.,Josephstad,GPS,-13.87362,-27.959428,2673.29,"1 day, 0:00:00",LOW,514f396f-cd98-4f64-9e93-f605fc73734b,1ecd42cc-80e4-426b-8a62-3e3dc4dc248a,20.58,gallons,True,WEEKLY,,,2025-03-05T21:46:19,2026-04-15T18:10:30.808442,bd1cbae0-a017-4429-8cad-44c9cf5e6cb1,cd0d0780-7af4-4d92-9972-617417b2f7b9
ce671c52-d68a-41ca-b50b-231af811cff6,58f9dbaf-1659-4d39-9ffe-a44624472704,731e4fd5-b8ef-4d21-add8-632f22763d09,2025-04-27T16:44:37,2025-04-30T21:01:59,Remember student face someone staff rock least. Lay agency understand newspaper. Nothing official end test race heavy despite.,WO-81567,2025-04-28T04:24:59,2025-04-30T04:24:59,COMPLETED,Common tough commercial. Series save part court information someone.,East Kellyfurt,WELL,86.769705,44.899604,42222.63,"1 day, 0:00:00",LOW,054abf16-2d48-4ac2-96ae-1658db6e0fb2,9cec2b70-8268-49b0-9790-027f56d65b08,83.31,gallons,True,DAILY,,,2025-04-24T19:46:15,2026-04-15T18:10:30.808820,f250fc97-1715-4049-98e4-35f25cae9d61,d70fa11b-a911-48fb-ae9b-6fdd1f4a2d01
a6077e8d-be09-49a4-8c1e-4d8d7bbd6711,ab06f125-03cd-4efa-b705-80a382abe9d7,3b7581cb-ea6e-4a86-a15f-e6d5897da24c,2025-03-18T20:18:41,2025-03-23T09:00:05,"Cover best college. Anyone participant then little ball.
Though radio watch election both say. Require save manager pass. News spend attention check.",WO-28799,2025-03-20T06:16:48,2025-03-23T06:16:48,COMPLETED,Speak upon personal easy actually office national. Edge into whom chance peace kid.,Amandaborough,GPS,17.3646375,-142.999662,43980.2,"1 day, 0:00:00",LOW,1deb90dc-c05c-42e8-89cd-c64fb0effa7a,1ecd42cc-80e4-426b-8a62-3e3dc4dc248a,15.3,gallons,True,MONTHLY,,,2025-03-16T01:55:26,2026-04-15T18:10:30.809320,df380b64-a1d3-47a6-9fc3-c48b4cb4ed42,c650d0f2-cd46-42ca-8a5d-233e1a493e1b
48e8e857-72db-4f99-8edb-2ff2c1a7b1a1,4efb429c-f661-47c7-8be1-26bcd85624cc,fb7640ea-e12f-44b2-a4e1-18957b81adb3,2024-11-25T02:52:35,,Agent responsibility organization tree particularly. Four program foot mission night audience.,WO-36938,2024-11-26T04:47:15,2024-12-01T04:47:15,REJECTED,"Much hot almost accept watch suggest.
Provide bit hear course join instead. They almost pull enjoy.",South Jenniferhaven,GPS,80.4410395,-156.836206,38272.58,"3 days, 0:00:00",LOW,4c5ea3ae-95c6-4aa1-bd4b-a9b6414e29b6,1ecd42cc-80e4-426b-8a62-3e3dc4dc248a,85.59,loads,True,ONE_TIME,,,2024-11-23T04:40:47,2026-04-15T18:10:30.809723,79ada15d-9936-4f25-af5e-9309efb338b3,7e1939dd-cc79-4677-bc76-26047a1781dc
ead941f1-0d7a-4357-9a1e-65904955b3d5,174a76cb-9bbd-48fa-82c3-f88bcdf4c7aa,ed8cf4c2-c280-4462-92ab-89c394e00cfc,2025-08-14T02:15:23,,"Off whatever to network. Popular relate create Congress listen.
Share fall leave time type left however. Show some scene need medical course music. Technology exist want discuss coach letter.",WO-54631,2025-08-15T02:17:18,2025-08-17T02:17:18,HALTED,Surface memory use rate maybe very. Community account visit hour itself debate matter large.,Ortizland,ADDRESS,35.2235905,121.037827,10857.26,"1 day, 0:00:00",MEDIUM,f633e0a6-c872-4259-91e6-e6e873076c1d,9cec2b70-8268-49b0-9790-027f56d65b08,79.31,days,False,,,,2025-08-12T20:47:24,2026-04-15T18:10:30.810251,3f925fa2-6865-403e-bce8-6051462fdfd2,8f923bb5-f2a7-4740-9111-caf989f5eb96
9314030e-e011-4f6c-8040-3494c30ff624,d37db5f8-d37f-49c0-b8b2-76d6a45ab850,84e86518-3a3e-4445-8f1c-4328934ff3f3,2024-04-26T23:27:54,2024-04-30T23:50:25,"Really try oil attorney win. Well reason sing generation.
Shake value class artist be card theory bring. Happy lead would woman choose.",WO-01774,2024-04-28T12:42:23,2024-04-30T12:42:23,CLOSED,After determine wrong travel enter bring. Act natural task dark up whether.,South Michael,GPS,-9.9607095,-122.852338,26511.05,"2 days, 0:00:00",HIGH,26674d61-d034-4f7e-8a6f-7303b6c6ec24,af516e74-dbad-4474-9b38-fee85f1c5f93,95.62,visits,False,,,,2024-04-25T10:27:51,2026-04-15T18:10:30.810769,863f1ef8-a8a7-4479-a058-6e1fda74a3ac,756a994a-d55b-4f66-bf57-7caec2784ee7
b6153c9c-8f0d-4287-a8c4-9f67cd5c3546,cddd5f7c-18e5-439d-b906-a347d43c668d,678c61ab-e0a4-40b1-af00-261f9020c2ca,2025-02-05T02:27:55,2025-02-11T06:03:03,Month officer cost week participant law. Well candidate more allow speech. Receive voice sing including thought.,WO-65497,2025-02-06T19:19:31,2025-02-10T19:19:31,COMPLETED,Social perhaps face eight question onto. Employee challenge upon above.,Johnsonport,WELL,-54.722068,-144.196475,11320.39,"2 days, 0:00:00",MEDIUM,492f99aa-15c9-4d77-9b8f-61e9ca734db1,9cec2b70-8268-49b0-9790-027f56d65b08,57.57,loads,False,,,,2025-02-04T06:03:44,2026-04-15T18:10:30.811057,ee2821d9-f03c-4524-801a-558d32273991,60260623-b284-4bdb-aeab-3539de227aa7
c8565e7c-a3e8-4762-a54e-a07e542ecb4a,174a76cb-9bbd-48fa-82c3-f88bcdf4c7aa,c47f7a97-07de-45fc-b329-df9d514c1dd8,2024-08-05T20:15:54,,"Experience must participant.
Ball today money necessary. Federal get walk remain wait military. Consumer pay well poor.
Southern least adult white him. Over century describe test popular.",WO-17520,2024-08-06T03:29:50,2024-08-08T03:29:50,REJECTED,Low always minute recently reach land can. There gun degree citizen successful.,South Joe,ADDRESS,-53.236396,-55.506172,25856.97,"2 days, 0:00:00",MEDIUM,0e3fb706-69e2-498c-b02f-99e12010398b,9cec2b70-8268-49b0-9790-027f56d65b08,45.66,visits,True,MONTHLY,,,2024-08-02T22:38:10,2026-04-15T18:10:30.811361,8d703a54-1a6f-4f13-8590-b52f819b760e,d24becdc-8819-4f28-86b6-109a12f74bda
09f3087d-6aa5-4b3c-95ab-8a3d0f61879d,faa66382-4806-43a8-8a5d-ac3393c400fd,678c61ab-e0a4-40b1-af00-261f9020c2ca,2026-02-09T19:31:10,,"Either lot until we eat argue. Within science tonight be firm close deep manager.
Realize after sense describe.
Shake on apply ok time drop.
Professional stuff recent. Rock type theory identify.",WO-27750,2026-02-10T00:42:43,2026-02-14T00:42:43,IN_PROGRESS,Decision sound candidate imagine kid particular case cost. Bed history party through.,Colebury,WELL,-57.732266,-85.072017,32445.07,"2 days, 0:00:00",LOW,c3da1d19-9580-4a71-bccb-a3c18e8f9096,9cec2b70-8268-49b0-9790-027f56d65b08,30.16,days,False,,,,2026-02-09T19:18:46,2026-04-15T18:10:30.811936,f1f35c57-8a89-4d75-b79f-173640d2bb56,04cff076-ac2b-48f9-ae98-e2f27df76c44
b3046118-fe56-480a-89f4-9d893007e655,ab06f125-03cd-4efa-b705-80a382abe9d7,fb7640ea-e12f-44b2-a4e1-18957b81adb3,2024-10-29T06:58:16,,Military represent defense chair director. Turn full goal design. Customer father low life it artist similar. Floor movie meeting law sound yard.,WO-81442,2024-10-30T04:04:50,2024-10-31T04:04:50,ASSIGNED,Beat never part ask. Safe just call lead. Statement role think.,Josephmouth,WELL,-49.1514775,37.6783,2394.93,"1 day, 0:00:00",MEDIUM,06b16a44-2c0b-4ec7-83a5-ee6c79d05263,9cec2b70-8268-49b0-9790-027f56d65b08,20.47,loads,False,,,,2024-10-29T03:16:40,2026-04-15T18:10:30.812825,00de9876-5af2-4d28-891d-966bb1115aa8,6360e96d-06a2-40a2-9ce1-4dd921466693
cd71f930-1d59-4627-8729-4672a182e0c2,ab06f125-03cd-4efa-b705-80a382abe9d7,882b9fc4-ab62-40eb-8d69-87c3efb8debd,2026-02-26T14:35:57,,Standard father language old ability capital easy market. Allow staff listen east.,WO-10463,2026-02-26T23:43:44,2026-03-03T23:43:44,IN_PROGRESS,Modern hit thousand lawyer. Present not manager.,Leeville,GPS,-26.6591565,12.134163,14451.34,"2 days, 0:00:00",MEDIUM,8227da16-8558-4d8d-871b-ac9431613168,1ecd42cc-80e4-426b-8a62-3e3dc4dc248a,94.64,days,True,WEEKLY,,,2026-02-24T22:25:25,2026-04-15T18:10:30.813731,70eb33ed-9f96-4e77-a15f-ee56af4e4e54,35ed79e2-2ff9-4571-b10a-ebf786fd6fc6
f40118d2-4fd6-4ecd-b663-e2deae8ce261,646727fe-d9d3-47f4-abd3-a0bbe4e4c1bc,72036ee9-cdd1-4b01-beee-c44773ada2dc,2025-09-05T17:12:04,,Realize last take effect those. Power structure his candidate. Establish important ready country fast four very doctor.,WO-44451,2025-09-05T18:45:25,2025-09-09T18:45:25,IN_PROGRESS,Specific least draw decision. Not lead within worry information.,Port Christopher,WELL,78.2014465,178.503108,23984.69,"3 days, 0:00:00",HIGH,49fd3478-3169-450a-86a8-4fd09fbb2fbe,723a7696-0101-49f1-9967-329b83246c8a,78.81,visits,True,DAILY,,,2025-09-03T03:33:30,2026-04-15T18:10:30.815319,5eaa7168-859b-4e51-a737-1a7e188d0257,c650d0f2-cd46-42ca-8a5d-233e1a493e1b
664d7be0-36fc-4860-ad71-dcd6502505a3,174a76cb-9bbd-48fa-82c3-f88bcdf4c7aa,f525d920-9583-480f-bd27-5dff2c94820f,2024-08-20T15:28:20,2024-08-20T23:38:41,"Plant Democrat wife. Whole yourself could question.
Political need health should decision structure soldier. Best professional in myself. Help not policy country the meet.",WO-61666,2024-08-20T18:45:32,2024-08-24T18:45:32,COMPLETED,Spend continue mention alone bank. Employee both member far soldier lead.,Theresatown,ADDRESS,32.9496905,11.376048,10874.45,"2 days, 0:00:00",HIGH,2d88c350-49b5-45ac-8519-760a73b80453,9cec2b70-8268-49b0-9790-027f56d65b08,3.98,gallons,False,,,,2024-08-17T16:11:32,2026-04-15T18:10:30.816417,96b79693-d079-4951-a4ae-9829c1040fdf,c353389d-a432-4ee8-8c3e-88fbcdc340c5
b0cfa0c8-1dbf-4dad-8af3-3b110a540fe8,faa66382-4806-43a8-8a5d-ac3393c400fd,691a7e30-5a38-47ce-b009-80b80a73e695,2025-12-30T23:41:15,,"Message end hand clearly north. Few over instead former free.
Choice well degree apply. Main already nothing language wonder. Prove item cold north nature despite.",WO-49373,2026-01-01T01:03:33,2026-01-04T01:03:33,REJECTED,Party mind different set. Reduce read method language. Though enjoy standard model join.,Jeremyshire,WELL,59.277599,68.196812,21573.11,"2 days, 0:00:00",HIGH,30e5a01b-128e-45d4-8a36-93c45b4523fd,11140ee8-eb7c-4db8-bf89-1b9b4dec4035,54.22,loads,False,,,,2025-12-30T07:15:24,2026-04-15T18:10:30.816783,4bc55327-7b86-42d1-811c-c7ecf3ad62f1,5863fd9f-4c51-4a0a-9a87-74100e2e7b94
934d8bd1-d01e-40fe-b09f-3c63e89428c6,646727fe-d9d3-47f4-abd3-a0bbe4e4c1bc,f525d920-9583-480f-bd27-5dff2c94820f,2026-04-01T15:55:14,,"Officer on talk one. Response recognize move five small.
Eye hospital find center know agreement group. Strong model forget successful.",WO-99726,2026-04-01T17:26:47,2026-04-04T17:26:47,CANCELLED,Present apply author network. Kind apply up similar say grow.,Charlesburgh,ADDRESS,-68.396604,-100.212761,49018.52,"1 day, 0:00:00",MEDIUM,64db6a55-8918-4153-82b2-49b26e782579,16c270b4-3b14-467e-9cc3-879f37e9a5db,7.31,visits,False,,2026-04-02T17:27:38,Safety concern,2026-03-29T18:34:19,2026-04-15T18:10:30.817090,888c3de9-07f5-4dd8-8e2e-e62e767e867a,07c886b2-c6a8-402f-b1fa-668e5e294f93
627b8fa8-54ec-45b9-bb19-b944c731eee9,646727fe-d9d3-47f4-abd3-a0bbe4e4c1bc,f525d920-9583-480f-bd27-5dff2c94820f,2024-10-17T21:12:26,,Go time daughter. Amount hot less difficult cause establish white. High book suffer worry somebody.,WO-56016,2024-10-19T14:40:33,2024-10-20T14:40:33,HALTED,Her again six understand. Worker plan return these soldier experience.,Lake Dwayneview,WELL,21.074007,1.380181,2086.93,"3 days, 0:00:00",HIGH,290acd4f-771e-45ff-9afe-7645ceadc83b,723a7696-0101-49f1-9967-329b83246c8a,49.37,gallons,True,DAILY,,,2024-10-17T00:41:36,2026-04-15T18:10:30.817525,5ccd3d97-2995-41ae-a4d8-34997f52959d,16ce440a-c02d-4ff2-95c8-f90cc383f732
83957269-dd19-4637-bb51-7fdc71e69cd3,8d2e71e3-0422-4b11-bab4-6af9543a3839,3b7581cb-ea6e-4a86-a15f-e6d5897da24c,2024-12-07T05:02:41,,"Hope real see decide crime relationship. Decade people someone specific. Decision around exist sense.
Discuss organization will number. Tough few Mr none.",WO-29299,2024-12-08T08:33:29,2024-12-12T08:33:29,ASSIGNED,Choice agency doctor know season fly listen environment. Product threat any.,New James,WELL,-26.871675,52.846904,26167.32,"1 day, 0:00:00",MEDIUM,4baeb96d-8da3-4b5f-82cc-cc08c13b5aac,af516e74-dbad-4474-9b38-fee85f1c5f93,86.11,visits,False,,,,2024-12-06T05:15:52,2026-04-15T18:10:30.817899,356bfa35-d694-48fb-ba71-be738be3d0e9,5192be53-0289-4208-a0e1-a9a9969053bd
9b7d2445-44dc-49f9-9d82-48063a811a8e,ab06f125-03cd-4efa-b705-80a382abe9d7,3b7581cb-ea6e-4a86-a15f-e6d5897da24c,2025-11-19T20:35:25,,"Federal walk exist pull. Paper those thousand inside. Movie measure population activity record participant.
Sometimes throw official clearly. As per sea often treatment.",WO-10883,2025-11-20T11:03:39,2025-11-24T11:03:39,ASSIGNED,"Economy fund magazine catch our. Begin many former enjoy see.
Democrat candidate prove couple.",Port Kevin,WELL,3.4684685,-155.268542,15832.98,"3 days, 0:00:00",HIGH,1deb90dc-c05c-42e8-89cd-c64fb0effa7a,16c270b4-3b14-467e-9cc3-879f37e9a5db,48.0,days,True,DAILY,,,2025-11-18T11:23:11,2026-04-15T18:10:30.818271,e5854516-008b-4237-91ae-eb3d6f12b259,05455bcb-b563-4f7c-abb5-f8dc4c19c262
f600b120-929e-4bd8-8aff-af704c187979,4efb429c-f661-47c7-8be1-26bcd85624cc,75a0afd8-df78-48b9-ae6b-7116f2e24eba,2024-12-23T05:50:43,2024-12-25T15:51:43,"True several interest night. Time watch life six skin.
Increase ready unit plant just cost whatever by. Feeling shoulder manage. Pick around behavior whole final another ahead.",WO-00496,2024-12-24T10:14:50,2024-12-27T10:14:50,CLOSED,Ever nor health amount feel poor.,Kennethbury,WELL,-28.0644925,-76.911565,22563.71,"2 days, 0:00:00",HIGH,c545a2d5-2d2e-4fae-8313-79be1d1e6aee,1ecd42cc-80e4-426b-8a62-3e3dc4dc248a,80.95,days,True,DAILY,,,2024-12-21T09:39:02,2026-04-15T18:10:30.818660,4f45ae8d-f6c9-4fdd-abc5-9a603c2050db,136c7ec2-8f48-4e68-8de6-259701af3359
73c822be-466d-48f2-a6d9-50fa59d653b0,8d2e71e3-0422-4b11-bab4-6af9543a3839,f525d920-9583-480f-bd27-5dff2c94820f,,,"Raise available democratic security.
Center stay fish.
Former teach age community financial. Score strategy have today.",WO-43330,2024-12-24T10:06:34,2024-12-25T10:06:34,UNASSIGNED,Describe they project. Natural ball brother production world door.,Cherylshire,GPS,85.750251,-44.992583,17665.7,"3 days, 0:00:00",MEDIUM,64db6a55-8918-4153-82b2-49b26e782579,cb49e5de-7799-42e2-98e8-44fad7981926,39.72,gallons,False,,,,2024-12-21T01:43:07,2026-04-15T18:10:30.819338,c2f01000-2e7d-4571-810f-78f7290bae12,c5b36714-02bd-4e43-93f2-5290bce2924b
81c853e6-4fdd-43af-ac7a-ca99b0151591,d37db5f8-d37f-49c0-b8b2-76d6a45ab850,f525d920-9583-480f-bd27-5dff2c94820f,2025-12-07T21:32:49,,"Degree computer writer past daughter. Herself teacher good idea necessary test arrive.
Act most hear name. Sense well purpose office receive.",WO-60108,2025-12-09T05:49:17,2025-12-14T05:49:17,IN_PROGRESS,Take kid drop strategy. Involve compare happy develop seven sure skill.,Melissaland,WELL,53.0873405,-57.61028,35082.92,"1 day, 0:00:00",LOW,1d368a2a-1655-46a6-a06f-99658461cf29,af516e74-dbad-4474-9b38-fee85f1c5f93,88.67,gallons,False,,,,2025-12-07T04:03:21,2026-04-15T18:10:30.819823,8fee8277-8256-45da-adb4-f46e74cf5c2c,e4328302-a52e-4c5a-b212-d6f86b62a55a
af5f1680-a2c9-4c7f-b068-bc18610dbe42,faa66382-4806-43a8-8a5d-ac3393c400fd,882b9fc4-ab62-40eb-8d69-87c3efb8debd,2025-01-07T07:41:23,2025-01-09T12:47:36,"Night well environment wish. Option head population work might end carry.
Ball night purpose remain civil its. Book feeling cause mouth.",WO-57045,2025-01-09T06:13:24,2025-01-13T06:13:24,COMPLETED,Action despite perhaps new gun. None memory central home like fact dream.,Alexanderstad,GPS,10.3163015,126.584574,4288.41,"1 day, 0:00:00",HIGH,7db02384-cd8f-4f4a-ad93-eb28ac94acc3,11140ee8-eb7c-4db8-bf89-1b9b4dec4035,76.89,loads,True,WEEKLY,,,2025-01-07T04:54:03,2026-04-15T18:10:30.820233,a93f53e4-41c6-4fa7-9e9d-642dcf08a7e6,25e77f78-cd95-408f-980b-67242f148887
a94002d5-0101-4bba-b518-9e016fff50d4,4efb429c-f661-47c7-8be1-26bcd85624cc,04139841-be62-450b-bd98-1aa2a541894b,2025-04-15T13:33:19,2025-04-17T09:37:18,"Town education figure save explain voice. Degree unit use plant long from.
Society challenge director. Month mouth best hour. Way president ok force middle.",WO-28468,2025-04-16T21:22:21,2025-04-17T21:22:21,CLOSED,Set place training still know. Decide term current. Share sell loss fine end.,Jennifertown,WELL,-2.549505,-130.118485,19367.2,"3 days, 0:00:00",MEDIUM,adae98ef-7f24-4190-81fa-484cdd62c623,1ecd42cc-80e4-426b-8a62-3e3dc4dc248a,85.72,visits,False,,,,2025-04-13T22:24:35,2026-04-15T18:10:30.820679,f1f35c57-8a89-4d75-b79f-173640d2bb56,1e5cc72b-9747-442e-bb29-be6eaf519b33
b6752db7-eeeb-46da-a81b-b0cf3e2eb04f,58f9dbaf-1659-4d39-9ffe-a44624472704,731e4fd5-b8ef-4d21-add8-632f22763d09,2024-10-29T15:00:51,2024-11-03T08:37:10,"Different player student tough animal of prevent. Yeah move war political total than reveal.
Service image third reveal wide. Discussion go just someone.",WO-07492,2024-10-31T04:36:10,2024-11-04T04:36:10,CLOSED,People investment guess mouth hand. Police blood a serious.,South Marie,GPS,-28.1110965,43.05703,27647.21,"1 day, 0:00:00",HIGH,054abf16-2d48-4ac2-96ae-1658db6e0fb2,af516e74-dbad-4474-9b38-fee85f1c5f93,95.05,gallons,True,ONE_TIME,,,2024-10-28T21:51:18,2026-04-15T18:10:30.821063,3dfc9932-a736-408b-ab4d-8f910a4b70ab,cd0d0780-7af4-4d92-9972-617417b2f7b9
296be0ae-536b-44ec-83ef-325a80abcbca,8d2e71e3-0422-4b11-bab4-6af9543a3839,161a2cf7-5893-41ae-b4c4-d338e37dc1c5,2024-11-27T21:49:08,,"Many Congress factor during material. Part forget deal again. Sign those type hotel.
At computer grow floor young. Local raise owner how make.",WO-56215,2024-11-28T12:28:11,2024-11-30T12:28:11,ASSIGNED,Relate indicate story lawyer. Western Mrs still through.,Matthewbury,GPS,28.7615375,27.935636,8838.44,"3 days, 0:00:00",LOW,f0a84ddc-1697-4069-bd4e-89f946cadd32,af516e74-dbad-4474-9b38-fee85f1c5f93,68.06,gallons,True,MONTHLY,,,2024-11-25T08:09:13,2026-04-15T18:10:30.821456,d07b7eff-0643-412c-a157-c223529ac173,c949fc6c-a059-4a79-a4a7-b19d82c454fa
c5fa9997-b02a-4576-b054-bf2d43b78582,9863f9e7-9e3e-4991-ae05-2fcfca5ff7d0,f525d920-9583-480f-bd27-5dff2c94820f,2025-07-18T23:41:25,2025-07-24T00:02:30,Case human society event offer probably. Send determine although.,WO-73510,2025-07-20T08:55:19,2025-07-24T08:55:19,COMPLETED,Prepare every remember. Discuss matter anything at fish chance name.,Martinezhaven,ADDRESS,-43.2450505,20.61574,19835.61,"2 days, 0:00:00",MEDIUM,1d368a2a-1655-46a6-a06f-99658461cf29,1ecd42cc-80e4-426b-8a62-3e3dc4dc248a,6.19,hours,True,ONE_TIME,,,2025-07-16T14:32:49,2026-04-15T18:10:30.821948,68cee10f-f6df-4b87-a7ae-8edaaf21c9bd,7979fcee-4f82-4c0d-98c2-d233f722281b
a11516ee-46e9-45ba-aebf-26a2a910e321,9863f9e7-9e3e-4991-ae05-2fcfca5ff7d0,3b7581cb-ea6e-4a86-a15f-e6d5897da24c,2025-03-05T04:14:16,2025-03-07T21:33:29,"Always commercial political capital type. Certain town conference. Family hold bar recent for.
No huge year support great marriage. Federal despite speech. Culture number culture why role.",WO-42735,2025-03-05T09:14:05,2025-03-07T09:14:05,COMPLETED,Page view reduce important analysis discussion resource. Agreement bad language.,Diamondfurt,WELL,-40.0871765,160.03893,1883.24,"1 day, 0:00:00",MEDIUM,4baeb96d-8da3-4b5f-82cc-cc08c13b5aac,1ecd42cc-80e4-426b-8a62-3e3dc4dc248a,82.23,hours,True,MONTHLY,,,2025-03-03T00:48:47,2026-04-15T18:10:30.822392,fe17acb4-b1ce-4064-bb7c-a74f47d0d4af,a10c7988-b4b3-43b6-a1b0-40e838b925ce
